,created_at,id_str,reply_count,retweet_count,text,user,name,state,party
0,Sun May 21 19:26:26 +0000 2017,8.66E+17,116,174,"Franni here. Since it's Al's birthday, and since he's working so hard, I wanted us to do something special for him.… https://t.co/glGlcprbj8",alfranken,Al Franken,New York,Democratic
1,Tue May 16 01:44:44 +0000 2017,8.64E+17,718,1248,This is profoundly troubling. Why would President Trump give our highly classified information to the Russians? https://t.co/uFKr4ZOId4,alfranken,Al Franken,New York,Democratic
2,Wed May 10 19:55:37 +0000 2017,8.62E+17,218,1334,It couldn't be clearer: we need an independent investigation into President Trump's ties to Russia. If you agree... https://t.co/OYShZ5yFJK,alfranken,Al Franken,New York,Democratic
3,Wed May 10 19:54:55 +0000 2017,8.62E+17,134,794,More troubling news: AG Sessions was involved in the firing. Same Jeff Sessions who said he'd recuse himself from the Russia investigation.,alfranken,Al Franken,New York,Democratic
4,Wed May 10 19:54:20 +0000 2017,8.62E+17,131,556,Troubling news that you probably know by now: President Trump fired the person tasked with investigating his and his team's ties to Russia.,alfranken,Al Franken,New York,Democratic
5,Mon May 08 15:53:50 +0000 2017,8.62E+17,46,46,"I still don't have words to describe my sadness knowing that Luis is gone, but I'm proud he'll keep changing lives.… https://t.co/bJuOHxeLUK",alfranken,Al Franken,New York,Democratic
6,Mon May 08 15:53:22 +0000 2017,8.62E+17,9,33,"#TuesdaysPromise is a remarkable, moving, &amp; timely book, &amp; it's another example of what so many of us admired about veteran Luis Montalvan.",alfranken,Al Franken,New York,Democratic
7,Sun May 07 02:02:21 +0000 2017,8.61E+17,23,141,Congrats @NAMIMinnesota on 40 years of incredible work and change surrounding mental health. Proud to partner w/ yo… https://t.co/o53oldHbSG,alfranken,Al Franken,New York,Democratic
8,Sat May 06 17:17:25 +0000 2017,8.61E+17,38,95,Kicked off Saturday by meeting Minnesotans of all ages at the St. Paul #CincodeMayo parade. Can't think of a better… https://t.co/Za84UyrysQ,alfranken,Al Franken,New York,Democratic
9,Sat May 06 01:13:42 +0000 2017,8.61E+17,16,61,"Great catching up with @melissahortman, Minnesota's House of Representatives Minority Leader, in St. Paul tonight. https://t.co/1aPtOcXcOS",alfranken,Al Franken,New York,Democratic
10,Fri May 05 20:56:10 +0000 2017,8.61E+17,41,171,Share your stories &amp; make your voice heard. Hold GOP in Congress accountable bc we need to stop this terrible bill. https://t.co/KzCfADR67c,alfranken,Al Franken,New York,Democratic
11,Fri May 05 20:53:18 +0000 2017,8.61E+17,40,256,"We need to fight back for the millions of disabled, elderly &amp; low-income Americans who would bear the brunt of devastating cuts to Medicaid.",alfranken,Al Franken,New York,Democratic
12,Fri May 05 20:52:57 +0000 2017,8.61E+17,23,113,We need to fight back for older Americans who could be charged up to 5x more than young people by insurance companies.,alfranken,Al Franken,New York,Democratic
13,Fri May 05 20:52:19 +0000 2017,8.61E+17,62,91,"We need to fight back for working families who would face ↑ deductibles &amp; out of pocket costs, &amp; could see annual, lifetime caps reinstated.",alfranken,Al Franken,New York,Democratic
14,Fri May 05 20:51:52 +0000 2017,8.61E+17,20,62,We need to fight back for the millions of people in Minnesota and our nation w/ a preexisting condition who would lose critical protections.,alfranken,Al Franken,New York,Democratic
15,Fri May 05 20:51:22 +0000 2017,8.61E+17,22,117,"The bill passed the House yesterday, and now it's time for the majority of us who oppose this plan to fight back and make our voices heard.",alfranken,Al Franken,New York,Democratic
16,Fri May 05 20:50:58 +0000 2017,8.61E+17,151,1474,"The GOP took health bill that had the approval of 17 percent of the American people, went back to the drawing board, and made it even worse.",alfranken,Al Franken,New York,Democratic
17,Thu May 04 19:03:38 +0000 2017,8.60E+17,170,3131,#TBT https://t.co/24oAyeBh59,alfranken,Al Franken,New York,Democratic
18,Thu May 04 17:19:24 +0000 2017,8.60E+17,61,492,Help me defeat #Trumpcare and stand up for millions of Americans. Sign up and pledge to hold House GOP accountable. https://t.co/l6vKtGwJqv,alfranken,Al Franken,New York,Democratic
19,Thu May 04 02:09:58 +0000 2017,8.60E+17,44,144,"When we empower women in MN and across our nation, we take steps to move our country forward. Proud to stand with… https://t.co/ZLlmYaaozM",alfranken,Al Franken,New York,Democratic
20,Tue May 02 16:58:35 +0000 2017,8.59E+17,57,119,"Just finished Sheldon's book Captured, detailed look at how corporations influence our democracy. Highly recommend. https://t.co/CeecgMTvMJ",alfranken,Al Franken,New York,Democratic
21,Fri Apr 28 23:59:29 +0000 2017,8.58E+17,97,612,"I firmly believe that it's not just part of my job, but also my responsibility as an adult, to help all children fl… https://t.co/sJVT4ISS2r",alfranken,Al Franken,New York,Democratic
22,Tue Apr 25 16:56:47 +0000 2017,8.57E+17,27,134,".@BernieSanders @SherrodBrown We know that Big Pharma's impact is real, and we want to fix it. If you're with us, I… https://t.co/cLmh0TukKy",alfranken,Al Franken,New York,Democratic
23,Tue Apr 25 16:55:52 +0000 2017,8.57E+17,20,170,.@BernieSanders @SherrodBrown This shouldn't be partisan. Our efforts to bring ↓ drug costs are common sense and ea… https://t.co/5DYcHi4MVL,alfranken,Al Franken,New York,Democratic
24,Tue Apr 25 16:55:31 +0000 2017,8.57E+17,21,76,"I'm working w/ @BernieSanders &amp; @SherrodBrown &amp; others to address the problem, including by allowing Medicare to negotiate with drug makers.",alfranken,Al Franken,New York,Democratic
25,Tue Apr 25 16:55:03 +0000 2017,8.57E+17,93,686,It's wrong to force sick people to choose between their medicine or their mortgage. But Big Pharma is putting Americans in that position.,alfranken,Al Franken,New York,Democratic
26,Tue Apr 25 16:24:47 +0000 2017,8.57E+17,6,42,Did you know Bloomington is a finalist in national contest to win hockey rink improvements? Here's how you can help: https://t.co/Rh1K8j1CT8,alfranken,Al Franken,New York,Democratic
27,Sat Apr 22 20:43:16 +0000 2017,8.56E+17,64,642,Thank you to all of the Americans who are making your voices heard in Minnesota and across the nation on behalf of our planet on #EarthDay.,alfranken,Al Franken,New York,Democratic
28,Thu Apr 20 16:29:18 +0000 2017,8.55E+17,70,573,I stood up for @ppmn last night and #IStandWithPP every day because I know Planned Parenthood provides real people… https://t.co/ZMfDHkqiLi,alfranken,Al Franken,New York,Democratic
29,Fri Apr 14 19:21:23 +0000 2017,8.53E+17,174,1274,"I've said it before, but it bears repeating: Women deserve to be able to make their own decisions abt their health. https://t.co/T7wmFwwLi9",alfranken,Al Franken,New York,Democratic
30,Thu Apr 06 21:25:10 +0000 2017,8.50E+17,60,300,"If you have a problem w/ your private information being sold to the highest bidder w/o your consent, add your name: https://t.co/FJa7b3gmdj",alfranken,Al Franken,New York,Democratic
31,Thu Apr 06 21:24:26 +0000 2017,8.50E+17,51,292,"But it does raise this question: if you’re helping big companies at the expense of the people who voted for you, then who do you work for?",alfranken,Al Franken,New York,Democratic
32,Thu Apr 06 21:23:18 +0000 2017,8.50E+17,23,216,It's more than a terrible idea. It's a blatant giveaway to big corporations and another move in the GOP's plan to undermine #netneutrality.,alfranken,Al Franken,New York,Democratic
33,Thu Apr 06 21:22:49 +0000 2017,8.50E+17,161,832,President Trump and GOP in Congress made it legal for big companies to sell your personal info to third parties. Sound like a terrible idea?,alfranken,Al Franken,New York,Democratic
34,Tue Apr 04 16:49:27 +0000 2017,8.49E+17,18,33,I know I can count on @MayorHodges to protect the gains we've made together &amp; continue to move Minneapolis forward. https://t.co/KfbQlq9VrE,alfranken,Al Franken,New York,Democratic
35,Tue Apr 04 16:47:16 +0000 2017,8.49E+17,46,77,"Minneapolis needs a tested leader, and I need a local partner who will look out for our families, friends, neighbors, and communities.",alfranken,Al Franken,New York,Democratic
36,Mon Apr 03 19:43:55 +0000 2017,8.49E+17,25,73,Are you a DFLer living in Mpls? Make your voice heard tomorrow by participating in your ward's caucus at 7 PM. https://t.co/XkAHkIH8Yf,alfranken,Al Franken,New York,Democratic
37,Mon Apr 03 00:12:46 +0000 2017,8.49E+17,27,57,"As a resident of the 7th ward, I wish I could be in Mpls on Tuesday to caucus for my Council Member @cmlisagoodman. https://t.co/TMzHT4rj2P",alfranken,Al Franken,New York,Democratic
38,Sat Apr 01 17:24:11 +0000 2017,8.48E+17,31,75,"This is not an #AprilFools prank. @_cingraham once deemed MN worst place to live, but he's had a change of heart. https://t.co/cyHhYc3xIq",alfranken,Al Franken,New York,Democratic
39,Fri Mar 31 20:39:41 +0000 2017,8.48E+17,135,483,I'm going to keep pressuring the GOP to stop putting Big Telecom before people's rights. https://t.co/ylSMIZamYf,alfranken,Al Franken,New York,Democratic
40,Wed Mar 29 18:20:56 +0000 2017,8.47E+17,162,1111,"Today, and every day, you can count on me to do whatever I can to defend Planned Parenthood. #PinkOut #IStandWithPP… https://t.co/mP05RDegnO",alfranken,Al Franken,New York,Democratic
41,Mon Mar 27 21:45:57 +0000 2017,8.46E+17,36,313,Minnesotan Ilhan Omar recently joined the @TODAYshow. I hope you'll watch this: https://t.co/sa7cUQBqo5 #WomensHistoryMonth #MuslimWomensDay,alfranken,Al Franken,New York,Democratic
42,Sat Mar 18 15:00:00 +0000 2017,8.43E+17,317,610,Trump's budget cuts vital programs and leaves Minnesota families to choke down the consequences. Reject it: https://t.co/CpN2glZh5Z,alfranken,Al Franken,New York,Democratic
43,Tue Mar 14 23:18:48 +0000 2017,8.42E+17,76,220,"Minnesotans—it's township election day. Your voice matters, so make sure it's heard at the local level by voting.",alfranken,Al Franken,New York,Democratic
44,Thu Mar 09 16:28:44 +0000 2017,8.40E+17,1440,8196,How deep do Russia's ties to Trump World run? I want answers. Add your name if you want independent investigation: https://t.co/MSK71un8jA,alfranken,Al Franken,New York,Democratic
45,Mon Mar 06 22:55:37 +0000 2017,8.39E+17,378,984,President Trump is trying to distract the American people from the facts by putting forth outrageous claims. WATCH ➝ https://t.co/Hy5pU58Jd1,alfranken,Al Franken,New York,Democratic
46,Sun Mar 05 00:12:34 +0000 2017,8.38E+17,46,59,Congrats to Marge Hoffa as well for being elected Vice Chair of @MinnesotaDFL. You and Ken are both integral to our party.,alfranken,Al Franken,New York,Democratic
47,Sat Mar 04 22:32:34 +0000 2017,8.38E+17,30,67,Glad to hear that Minnesotans have elected strong leader @kenmartin73 as our @MinnesotaDFL Chair once again. https://t.co/6FS2vn3QIE #MNDFL,alfranken,Al Franken,New York,Democratic
48,Thu Mar 02 23:35:07 +0000 2017,8.37E+17,642,1353,Americans deserve an attorney general who will be honest with them. https://t.co/HawYI70sEA,alfranken,Al Franken,New York,Democratic
49,Sat Feb 25 22:05:14 +0000 2017,8.36E+17,340,1306,.@TomPerez &amp; @EllisonCampaign will no doubt do great job at the helm of the Democratic Party. Now let's go to work. https://t.co/sKWtevJc7K,alfranken,Al Franken,New York,Democratic
50,Fri Feb 24 18:15:55 +0000 2017,8.35E+17,94,240,He's been a progressive champion for Minnesotans for over a decade. @EllisonCampaign would be the same for all Amer… https://t.co/qZJbEjsv5a,alfranken,Al Franken,New York,Democratic
51,Wed Feb 22 00:51:03 +0000 2017,8.34E+17,507,4041,It doesn't end with Flynn. Call for an investigation into the Trump Admin's connection with Russia. https://t.co/fyKwhA9eZ9,alfranken,Al Franken,New York,Democratic
52,Sat Feb 18 22:21:36 +0000 2017,8.33E+17,55,83,It's a sunny day in Minneapolis. Read more about where I stopped and met Anna (pictured here) on @UMNews campus.… https://t.co/8xkACJnSwM,alfranken,Al Franken,New York,Democratic
53,Thu Feb 16 19:23:26 +0000 2017,8.32E+17,37,97,VOTE TODAY → Red Wing is in @smbizrevolution nationwide contest. Join me in supporting this great Minnesota town: https://t.co/lQtDgGyITg,alfranken,Al Franken,New York,Democratic
54,Tue Feb 14 23:01:05 +0000 2017,8.32E+17,231,201,"Team Franken, ten years ago today we launched my first campaign for the Senate. It's been a big ten years for us. https://t.co/erMdZlszrl",alfranken,Al Franken,New York,Democratic
55,Sat Feb 11 20:56:20 +0000 2017,8.31E+17,329,736,"Last night, I told @RealTimers @billmaher my message to all Americans making their voices heard: Keep it up. Watch: https://t.co/TWODNAXh5z",alfranken,Al Franken,New York,Democratic
56,Fri Feb 10 22:21:52 +0000 2017,8.30E+17,159,483,That's why I'll be doing everything I can to make sure we don't unravel #DoddFrank financial safeguards meant to protect all Americans.,alfranken,Al Franken,New York,Democratic
57,Fri Feb 10 22:21:04 +0000 2017,8.30E+17,104,405,We cannot allow millions of Americans to again lose jobs and watch businesses shutter their doors because of greed.,alfranken,Al Franken,New York,Democratic
58,Fri Feb 10 22:20:10 +0000 2017,8.30E+17,66,303,Republicans in Congress are reportedly talking about gutting the Consumer Financial Protection Bureau.,alfranken,Al Franken,New York,Democratic
59,Fri Feb 10 22:19:24 +0000 2017,8.30E+17,94,315,"President Trump wants to unravel Dodd-Frank, the landmark legislative package that reformed Wall Street after the 2008 financial collapse.",alfranken,Al Franken,New York,Democratic
60,Fri Feb 10 22:18:56 +0000 2017,8.30E+17,41,268,"But Goldman Sachs has become a farm team for his Cabinet, doing exactly the opposite of what he promised Americans.",alfranken,Al Franken,New York,Democratic
61,Fri Feb 10 22:18:32 +0000 2017,8.30E+17,151,652,".@realDonaldTrump promised that he'd fight for working people, not for Wall Street giants like Goldman Sachs.",alfranken,Al Franken,New York,Democratic
62,Tue Jan 31 17:48:51 +0000 2017,8.26E+17,521,899,"If there were an easy fix to what's going on, I'd let you know. There isn't. But we can get through this. Together. https://t.co/B0CAeywAjQ",alfranken,Al Franken,New York,Democratic
63,Mon Jan 23 18:58:18 +0000 2017,8.24E+17,138,470,"That's wrong, and that's why I joined a coalition of people this weekend who are committed to defending @PPFA.… https://t.co/YLf2A3LdFC",alfranken,Al Franken,New York,Democratic
64,Mon Jan 23 18:57:17 +0000 2017,8.24E+17,188,894,"But with continued attacks on women's repro rights and efforts to defund @PPFA, the GOP is showing that they don't respect women's freedom.",alfranken,Al Franken,New York,Democratic
65,Mon Jan 23 18:56:33 +0000 2017,8.24E+17,172,1423,"I support @PPFA bc I believe in this simple principle: women deserve to make their own decisions about their health, not gov't officials.",alfranken,Al Franken,New York,Democratic
66,Sat Jan 21 18:59:36 +0000 2017,8.23E+17,223,939,I am grateful for the hundreds of thousands of people who are making their voices heard across the country today. https://t.co/jdd73D3C3e,alfranken,Al Franken,New York,Democratic
67,Wed Jan 18 23:15:28 +0000 2017,8.22E+17,141,624,"If you guessed D, you're correct. Climate change is a global issue, and it isn't going to go away if we ignore it. https://t.co/AZwEBSNCrI",alfranken,Al Franken,New York,Democratic
68,Wed Jan 18 23:14:16 +0000 2017,8.22E+17,178,277,"POP QUIZ → Climate change is: A) A myth B) ""Weather"" C) Not Based on Science D) None of the Above",alfranken,Al Franken,New York,Democratic
69,Sun Jan 15 20:52:00 +0000 2017,8.21E+17,231,1729,"Last week, GOP began first steps to gutting #ACA. Today, Americans are joining together for #OurFirstStand to tell them to #SaveHealthcare.",alfranken,Al Franken,New York,Democratic
70,Sat Jan 14 23:01:20 +0000 2017,8.20E+17,242,1679,I know that on Monday I plan to honor MLK Jr.'s legacy. Maybe @realDonaldTrump can do the same instead of attacking civil rights heroes.,alfranken,Al Franken,New York,Democratic
71,Sat Jan 14 23:00:36 +0000 2017,8.20E+17,80,737,Civil rights hero John Lewis: getting results for over 50 years. https://t.co/G3CZdvgqxz https://t.co/cN0g7621EE,alfranken,Al Franken,New York,Democratic
72,Wed Jan 11 02:36:31 +0000 2017,8.19E+17,188,2334,"For eight years of hope, decency, and dedication to the cause of making people's lives better: thanks @POTUS. #ObamaFarewell",alfranken,Al Franken,New York,Democratic
73,Fri Jan 06 22:19:32 +0000 2017,8.17E+17,235,889,We should all agree that a foreign power should never interfere in our democracy. Every American should read this: https://t.co/vPUGHYmNyj,alfranken,Al Franken,New York,Democratic
74,Tue Jan 03 18:09:36 +0000 2017,8.16E+17,226,1122,I'm disappointed that it took widespread public outrage for @HouseGOP to figure out it was the wrong move to gut in… https://t.co/WSEIRu0VQG,alfranken,Al Franken,New York,Democratic
75,Tue Jan 03 16:15:14 +0000 2017,8.16E+17,81,303,Today marks the start of the 115th Congress. House GOP gutting ethics office is not the way to start a new session: https://t.co/uzR1yLIMVL,alfranken,Al Franken,New York,Democratic
76,Sun Dec 25 23:04:16 +0000 2016,8.13E+17,71,106,"So far, my holiday time w/ family today—including my grandkids—has been filled w/ smiles &amp; some relaxation. I hope… https://t.co/N9q3xlV12M",alfranken,Al Franken,New York,Democratic
77,Sat Dec 24 17:16:10 +0000 2016,8.13E+17,65,205,"Whether you're lighting a Menorah, gathering around the Christmas tree, or posing for a holiday photo, have a happy… https://t.co/zw7Mmy6LuQ",alfranken,Al Franken,New York,Democratic
78,Fri Dec 23 00:41:19 +0000 2016,8.12E+17,138,630,"As Americans look to @realDonaldTrump to move our country forward, I urge him to rethink his position on nukes for the safety of our nation.",alfranken,Al Franken,New York,Democratic
79,Fri Dec 23 00:40:33 +0000 2016,8.12E+17,330,2580,This is a direct departure from decades of bipartisan efforts to reduce the role of nuclear weapons in our national… https://t.co/OBp7hgfATS,alfranken,Al Franken,New York,Democratic
80,Mon Dec 19 00:05:04 +0000 2016,8.11E+17,10,34,I spent some time w/ @MarkLeibovich this year to offer a glimpse into what my life's like and what I'm fighting for. https://t.co/OfqqZoNvxz,alfranken,Al Franken,New York,Democratic
81,Mon Dec 12 21:11:04 +0000 2016,8.08E+17,27,70,VOTE TODAY → @DFAaction is holding a vote on who to endorse for DNC chair. Join me in supporting @EllisonCampaign. https://t.co/bpBiIKZQEs,alfranken,Al Franken,New York,Democratic
82,Sat Dec 10 21:53:30 +0000 2016,8.08E+17,127,839,The future of the US should rest in the hands of Americans; interference by a foreign power should never play a role https://t.co/8HjTGE2brQ,alfranken,Al Franken,New York,Democratic
83,Fri Dec 09 00:22:02 +0000 2016,8.07E+17,25,247,"This is me &amp; John Glenn on a USO tour. I'll miss John, &amp; I'm amazed to think about what one man did for this nation… https://t.co/P8ncqATOF9",alfranken,Al Franken,New York,Democratic
84,Wed Dec 07 22:32:50 +0000 2016,8.07E+17,48,443,Over 55 million Americans depend on #Medicare. Join me in standing up for this vital program before it's too late. https://t.co/IICFO8NzIu,alfranken,Al Franken,New York,Democratic
85,Sun Dec 04 18:26:52 +0000 2016,8.05E+17,5,64,"Congrats to @jessdiggs for showing Norwegians that Minnesotans know how to ski, and for winning the @FISCrossCountry World Cup yesterday.",alfranken,Al Franken,New York,Democratic
86,Sat Dec 03 21:43:27 +0000 2016,8.05E+17,24,123,"Keith @EllisonCampaign works hard on behalf of Minnesotans, no matter their race, faith, or background. https://t.co/aoTDp5avK3",alfranken,Al Franken,New York,Democratic
87,Thu Nov 24 21:21:42 +0000 2016,8.02E+17,17,43,#HappyThanksgiving from my family (and my grandson Joe) to all the families celebrating in MN &amp; across the country.… https://t.co/DdZty8Ds3n,alfranken,Al Franken,New York,Democratic
88,Mon Nov 21 19:48:44 +0000 2016,8.01E+17,312,2501,It's impossible to unify our country if white supremacists have an ally running the White House. https://t.co/DUbM7j3MqB,alfranken,Al Franken,New York,Democratic
89,Wed Nov 16 18:26:07 +0000 2016,7.99E+17,39,414,.@IlhanMN is a Minnesotan who made history last week as the first Somali-American ever elected to state legislature… https://t.co/gUUqsyIGhc,alfranken,Al Franken,New York,Democratic
90,Tue Nov 15 21:34:13 +0000 2016,7.99E+17,246,3320,The following are actual article titles published by Breitbart News with Steve Bannon at the helm.… https://t.co/JTandg67GF,alfranken,Al Franken,New York,Democratic
91,Tue Nov 15 16:56:54 +0000 2016,7.99E+17,87,372,"Many of you may feel worried about the future. I want you to know that I will always fight for you, and so will MN. https://t.co/cdAtmQvdIA",alfranken,Al Franken,New York,Democratic
92,Mon Nov 14 21:47:11 +0000 2016,7.98E+17,47,170,"Keith @EllisonCampaign has integrity, heart, hope and optimism. I'm proud to support him to be the next DNC Chair. https://t.co/GD8idHU1C0",alfranken,Al Franken,New York,Democratic
93,Wed Nov 09 23:35:24 +0000 2016,7.96E+17,138,351,Diverse communities are the fabric of the United States of America. I'll never stop fighting for you. https://t.co/yliQFXxIB4,alfranken,Al Franken,New York,Democratic
94,Wed Nov 09 16:40:02 +0000 2016,7.96E+17,26,135,.@Maggie_Hassan will work hard on behalf of NH in the U.S. Senate. And I'll be working right alongside her to help our nation move forward.,alfranken,Al Franken,New York,Democratic
95,Wed Nov 09 02:43:35 +0000 2016,7.96E+17,14,146,"Congratulations, @TammyforIL. I've worked w/ you when you were Rep. Duckworth, and I can't wait to work with you as U.S. Senator Duckworth.",alfranken,Al Franken,New York,Democratic
96,Tue Nov 08 22:35:27 +0000 2016,7.96E+17,33,109,Do you care about student loan debt? Combating climate change? Funding for Planned Parenthood? Vote. https://t.co/LzXNqKw2Wz,alfranken,Al Franken,New York,Democratic
97,Tue Nov 08 21:36:56 +0000 2016,7.96E+17,17,96,"Have you and your friends voted? If you have, give yourselves a hand. Or even go in for a hug. But if you haven't,… https://t.co/WFn7p8ULwW",alfranken,Al Franken,New York,Democratic
98,Tue Nov 08 20:01:39 +0000 2016,7.96E+17,12,72,"In the past 24 hours, I've been in Faribault, Mpls, Northfield, and Red Wing. The constant? Hard-working… https://t.co/HQ4l4jlKi2",alfranken,Al Franken,New York,Democratic
99,Tue Nov 08 19:07:05 +0000 2016,7.96E+17,26,113,Have you voted AND told others to vote? Have you told friends to vote? Your parents? Your kids that are over 18? Your neighbors? I hope so.,alfranken,Al Franken,New York,Democratic
100,Tue Nov 08 17:33:46 +0000 2016,7.96E+17,23,176,I first met Muna when she was a U.S. Senate page in Washington. It was great to run into this Minnesotan while gett… https://t.co/8dYRxeFhEU,alfranken,Al Franken,New York,Democratic
101,Tue Nov 08 14:24:10 +0000 2016,7.96E+17,1,18,"This morning, I'll be at @UMNews with Keith @EllisonCampaign at Coffman at 10 AM. If you've voted, join us. If not, go vote now!",alfranken,Al Franken,New York,Democratic
102,Tue Nov 08 14:23:26 +0000 2016,7.96E+17,12,66,"Over 650,000 Minnesotans have voted early. That's astounding. I was one of them, and I voted early so I can help #GetOutTheVote in MN today.",alfranken,Al Franken,New York,Democratic
103,Tue Nov 08 13:55:27 +0000 2016,7.96E+17,18,178,It's important that we take back the Senate. It's important that we elect Dems at the local level in Minnesota and throughout our country.,alfranken,Al Franken,New York,Democratic
104,Tue Nov 08 13:55:11 +0000 2016,7.96E+17,16,115,"I want @HillaryCllinton to be able to check ""shatter the highest glass ceiling"" off her to-do list today. But it's more than that.",alfranken,Al Franken,New York,Democratic
105,Tue Nov 08 13:36:00 +0000 2016,7.96E+17,21,173,Words matter. They matter to young Minnesotans like Ari who know that we need to elect someone who will lift us up… https://t.co/99lIkzIl4O,alfranken,Al Franken,New York,Democratic
106,Tue Nov 08 13:14:29 +0000 2016,7.96E+17,16,65,*BEEP BEEP BEEP BEEP BEEP BEEP* This is your #ElectionDay wake-up call. Have you voted yet? https://t.co/G9aSKFeGTr,alfranken,Al Franken,New York,Democratic
107,Tue Nov 08 03:38:02 +0000 2016,7.96E+17,18,34,Plans for tomorrow morning? I've got you covered. Watch me on @MSNBC's @Morning_Joe around 7:30 AM CT &amp; then get out there to elect Hillary.,alfranken,Al Franken,New York,Democratic
108,Tue Nov 08 02:52:07 +0000 2016,7.96E+17,18,164,"MN has a long history of electing strong, progressive leaders. Tomorrow, I can't wait for Minnesotans to make history and elect even more.",alfranken,Al Franken,New York,Democratic
109,Mon Nov 07 23:15:37 +0000 2016,7.96E+17,19,191,Putting the Senate back in Democratic hands could all come down to Florida. So #GetOutTheVote for @PatrickMurphyFL.,alfranken,Al Franken,New York,Democratic
110,Mon Nov 07 23:02:19 +0000 2016,7.96E+17,6,50,I'm on my way to Red Wing. I'll be helping to get out the vote there this evening so we can send @AngieCraigMN to Washington for #MN02.,alfranken,Al Franken,New York,Democratic
111,Mon Nov 07 20:46:31 +0000 2016,7.96E+17,16,106,Paul Wellstone was a professor at @CarletonCollege. These Carleton students are carrying on his legacy of fighting… https://t.co/NO2RDditG6,alfranken,Al Franken,New York,Democratic
112,Mon Nov 07 19:22:52 +0000 2016,7.96E+17,12,58,"Our young Minnesotans at @StOlaf know that their future, and the future of our nation, rests in their hands. They k… https://t.co/NmlCXESoCt",alfranken,Al Franken,New York,Democratic
