,created_at,id_str,reply_count,retweet_count,text,user,name,state,party
1407,Sat Mar 01 23:16:00 +0000 2014,4.40E+17,7,8,Go Nathan! -Al MT @lisamurkowski: w/ your state musher Nathan Schroeder #Iditarod http://t.co/f9cWC41Jo2,alfranken,Al Franken,New York,Democratic
1408,Sat Mar 01 17:31:54 +0000 2014,4.40E+17,8,18,"This is going to be a people-powered campaign. Say you're in to volunteer for Al: http://t.co/GvCSYSnTOF, http://t.co/VXJt5aYzQp",alfranken,Al Franken,New York,Democratic
1409,Fri Feb 28 21:41:44 +0000 2014,4.40E+17,9,21,"""We should be able to have choices where we live.” Join Sheila and share your thoughts on #cable service with Al: http://t.co/c6UTDUvQsO",alfranken,Al Franken,New York,Democratic
1410,Fri Feb 28 18:45:35 +0000 2014,4.39E+17,7,15,No gimmicks here. Our grassroots fundraising deadline is rapidly approaching—pitch in $3 right now: http://t.co/FIFJmeaX0v,alfranken,Al Franken,New York,Democratic
1411,Fri Feb 28 15:29:12 +0000 2014,4.39E+17,7,25,Al hosted a discussion on how MN schools can access funding to improve #mentalhealth care services for students: http://t.co/jQ7zEa0CzJ,alfranken,Al Franken,New York,Democratic
1412,Thu Feb 27 21:35:48 +0000 2014,4.39E+17,4,11,#TeamFranken hit the phones in St Paul to build our grassroots network. Sign up to volunteer: http://t.co/JsKelsdkBQ http://t.co/abjUge3MDM,alfranken,Al Franken,New York,Democratic
1413,Thu Feb 27 18:15:33 +0000 2014,4.39E+17,11,10,Consider this tweet your alarm bell. Chip in $7 to help Al fight back before the February deadline: http://t.co/9gwNKiJG1j,alfranken,Al Franken,New York,Democratic
1414,Thu Feb 27 14:56:42 +0000 2014,4.39E+17,8,15,"Honored to accept @NAESP's Congressional Champion award for my legislative work supporting school principals, key to improving learning. -Al",alfranken,Al Franken,New York,Democratic
1415,Tue Feb 25 15:40:09 +0000 2014,4.38E+17,39,144,"#ComcastTWC is a deal that could result in higher prices, worse service, &amp; less choice: http://t.co/c6UTDUvQsO, http://t.co/FLuiNuQsC4",alfranken,Al Franken,New York,Democratic
1416,Mon Feb 24 22:58:46 +0000 2014,4.38E+17,9,218,"Everyone who knew Harold, loved Harold. He was a brilliant writer, hilarious comedic actor, influential director, &amp; wise, loving friend. -Al",alfranken,Al Franken,New York,Democratic
1417,Sun Feb 23 00:24:16 +0000 2014,4.37E+17,8,21,From the road - Al spoke to @MinnesotaDFL-ers in White Bear Lake today about what's at stake &amp; how to get involved. http://t.co/m1pH7itR4d,alfranken,Al Franken,New York,Democratic
1418,Sat Feb 22 22:56:03 +0000 2014,4.37E+17,7,38,"Today's loss against Finland was a tough one, but we're still proud of what #TeamUSA accomplished. Well done, US Men's Hockey. -Al",alfranken,Al Franken,New York,Democratic
1419,Sat Feb 22 00:03:55 +0000 2014,4.37E+17,45,196,Increasing the #MinimumWage is one of the best ways we can help workers and strengthen our economy. http://t.co/mwP9MgWZaq,alfranken,Al Franken,New York,Democratic
1420,Fri Feb 21 22:05:53 +0000 2014,4.37E+17,8,16,"We can't beat this flu at Al Franken HQ, but we can beat Karl Rove if we hit our February goal. Chip in $3: http://t.co/cQvb6xcBIZ",alfranken,Al Franken,New York,Democratic
1421,Fri Feb 21 20:15:24 +0000 2014,4.37E+17,11,61,Democracy is not for sale. Help Al put #CitizensUnited back in the #DumpsterofBadIdeas: http://t.co/EOxWQmGu3E,alfranken,Al Franken,New York,Democratic
1422,Fri Feb 21 19:10:29 +0000 2014,4.37E+17,10,49,"The US Men's Hockey Team played their hearts out, and that's what matters. You made us proud! -Al",alfranken,Al Franken,New York,Democratic
1423,Thu Feb 20 21:59:26 +0000 2014,4.37E+17,17,78,I applaud @Gap's decision to raise their minimum hourly pay. This is a step in the right direction: http://t.co/Ud2Z4t5BoC -Al,alfranken,Al Franken,New York,Democratic
1424,Thu Feb 20 20:14:49 +0000 2014,4.37E+17,6,43,We saw a valiant effort from the US Women's Hockey team at every stage of the game against Canada. You made MN and our country proud! -Al,alfranken,Al Franken,New York,Democratic
1425,Thu Feb 20 17:33:38 +0000 2014,4.37E+17,3,19,Wishing #MN's own @AmandaKessel8 @LeeSteck2 @meganebozek @_aschlep @GigiMarvin &amp; the rest of #TeamUSA the best of luck vs Canada today! -Al,alfranken,Al Franken,New York,Democratic
1426,Wed Feb 19 23:30:32 +0000 2014,4.36E+17,29,192,RT if you're concerned about skyrocketing cable rates: http://t.co/c6UTDUMTuO #ComcastTWC http://t.co/mtXjK3w3SH,alfranken,Al Franken,New York,Democratic
1427,Wed Feb 19 19:24:56 +0000 2014,4.36E+17,2,9,Big plays from #MN's own @dbackes42 @PKessel81 &amp; Zach Parise against the Czech Republic in men's hockey today. Onward to victory! -Al,alfranken,Al Franken,New York,Democratic
1428,Wed Feb 19 02:25:20 +0000 2014,4.36E+17,7,14,Suit up for the spring with a new tee—now available at the Al Franken Store: http://t.co/hJbFxL07td,alfranken,Al Franken,New York,Democratic
1429,Tue Feb 18 23:33:04 +0000 2014,4.36E+17,13,22,"""I'm worried this could mean a higher number at the bottom of my bill."" Join Amy F. &amp; weigh in on #cable service: http://t.co/c6UTDUvQsO",alfranken,Al Franken,New York,Democratic
1430,Tue Feb 18 20:56:55 +0000 2014,4.36E+17,6,42,Karl Rove &amp; the Kochs underestimate the true power of a grassroots network like ours. Chip in $3 today: http://t.co/3Fmm3mCX8z,alfranken,Al Franken,New York,Democratic
1431,Tue Feb 18 01:00:19 +0000 2014,4.36E+17,38,57,The proposed #ComcastTWC acquisition isn't just some wonky intellectual debate. Al wants to hear from you: http://t.co/c6UTDUMTuO,alfranken,Al Franken,New York,Democratic
1432,Mon Feb 17 22:25:27 +0000 2014,4.36E+17,15,26,"Al is fighting hard for Minnesota families. Say you're in to volunteer: http://t.co/Z1UocANjcY, http://t.co/4QXLvrPReD",alfranken,Al Franken,New York,Democratic
1433,Mon Feb 17 20:43:27 +0000 2014,4.36E+17,2,21,"On behalf of #MN, we were so proud to have u represent us in Sochi @JaredZezel04 @LaZylkE_14 @jlandsteiner @Shoostie2010 &amp; @Apottinger! -Al",alfranken,Al Franken,New York,Democratic
1434,Sun Feb 16 22:49:54 +0000 2014,4.35E+17,113,60,What do you think of the proposed #ComcastTW acquisition? Al wants to hear from you: http://t.co/c6UTDUMTuO,alfranken,Al Franken,New York,Democratic
1435,Sun Feb 16 19:46:07 +0000 2014,4.35E+17,2,3,"...@JustinFaulk27, @RMcDonagh27 &amp; @rsuter20 and the rest of the team! -Al",alfranken,Al Franken,New York,Democratic
1436,Sun Feb 16 19:45:50 +0000 2014,4.35E+17,4,14,"Another big victory against Slovenia for the US Men's Hockey Team. Congrats to @dbackes42, @PKessel81, @OSH74, @DerekStepan21...",alfranken,Al Franken,New York,Democratic
1437,Sat Feb 15 15:35:41 +0000 2014,4.35E+17,9,67,"Warroad's own @Osh74 takes #TeamUSA to a huge victory over Russia in an epic shootout, 3-2. A great way to start the day! -Al",alfranken,Al Franken,New York,Democratic
1438,Fri Feb 14 22:53:32 +0000 2014,4.34E+17,18,50,"""Consumers are – I am very concerned – going to pay higher bills."" Al addresses the #ComcastTW merger @TheLeadCNN: http://t.co/8xC9YOaV4z",alfranken,Al Franken,New York,Democratic
1439,Fri Feb 14 20:57:09 +0000 2014,4.34E+17,8,39,Love is the law. #FF these marriage equality advocates: @MN4allfamilies @freedomtomarry @hrc @MEUSA,alfranken,Al Franken,New York,Democratic
1440,Fri Feb 14 20:38:14 +0000 2014,4.34E+17,12,186,It's the 1st Valentine's Day since marriage equality came to #MN. RT if you agree-it's a great day for all families. http://t.co/WjhC85dr19,alfranken,Al Franken,New York,Democratic
1441,Fri Feb 14 18:23:21 +0000 2014,4.34E+17,7,8,"You know Al needs your help to fight back, just like he always has. Sign up to volunteer, Minnesota —&gt; http://t.co/Z1UocANjcY",alfranken,Al Franken,New York,Democratic
1442,Fri Feb 14 15:48:36 +0000 2014,4.34E+17,22,36,"Happy Valentine's Day, Franni. -Al http://t.co/tk1almMeMM",alfranken,Al Franken,New York,Democratic
1443,Thu Feb 13 23:34:15 +0000 2014,4.34E+17,106,202,"I'm concerned #ComcastTWC merger could mean less choice, higher cost, &amp; worse service for consumers. @TheLeadCNN: http://t.co/IZPWU8VWtl -Al",alfranken,Al Franken,New York,Democratic
1444,Thu Feb 13 20:58:41 +0000 2014,4.34E+17,6,23,Commit to help Al fight back against an anti-middle class agenda - chip in $3 today: http://t.co/cQvb6xcBIZ,alfranken,Al Franken,New York,Democratic
1445,Thu Feb 13 18:13:51 +0000 2014,4.34E+17,20,66,"“I don’t know of any first-term senator who has had such a broad sweep of accomplishments.” http://t.co/XzpwVzTiaj, http://t.co/BBsmxNSIBN",alfranken,Al Franken,New York,Democratic
1446,Thu Feb 13 15:59:39 +0000 2014,4.34E+17,1,3,"...@JustinFaulk27, @RMcDonagh27 &amp; @rsuter20 and the rest of the team! -Al",alfranken,Al Franken,New York,Democratic
1447,Thu Feb 13 15:58:59 +0000 2014,4.34E+17,1,10,"Great to start the day with a men's @USAHockey win in Sochi! Congrats to @dbackes42, @PKessel81, @OSH74, @DerekStepan21....",alfranken,Al Franken,New York,Democratic
1448,Thu Feb 13 01:45:11 +0000 2014,4.34E+17,2,23,#MNmade - Winona's own @FastenalCompany produced @noellepikuspace's skeleton sled for tomorrow's competition: http://t.co/ar2k31H9Vb,alfranken,Al Franken,New York,Democratic
1449,Wed Feb 12 23:09:46 +0000 2014,4.34E+17,3,42,Franni and I wish Vice President Mondale a quick recovery following successful heart surgery today. We hope you're resting comfortably. -Al,alfranken,Al Franken,New York,Democratic
1450,Wed Feb 12 18:43:07 +0000 2014,4.34E+17,10,131,Companies shouldn’t get to decide who can use the fast lane on the info superhighway. Stand up for #NetNeutrality: http://t.co/pWctNJwsnj,alfranken,Al Franken,New York,Democratic
1451,Wed Feb 12 16:08:21 +0000 2014,4.34E+17,6,4,A valiant effort from @meganebozek @AmandaKessel8 @_aschlep @GigiMarvin @LeeSteck2 and the rest of #TeamUSA against Canada! -Al,alfranken,Al Franken,New York,Democratic
1452,Tue Feb 11 21:34:04 +0000 2014,4.33E+17,10,26,"In honor of the Olympics, #TeamFranken went curling. Sadly, we're not nearly as good as the US teams in Sochi... http://t.co/mjutbRuNND",alfranken,Al Franken,New York,Democratic
1453,Mon Feb 10 23:24:23 +0000 2014,4.33E+17,5,51,"We have 5 Minnesotans w/ the US Curling team in Sochi - sweep on @JaredZezel04, @LaZylkE_14, @jlandsteiner, @Shoostie2010 &amp; @Apottinger! -Al",alfranken,Al Franken,New York,Democratic
1454,Mon Feb 10 22:55:15 +0000 2014,4.33E+17,6,10,Al visited a Nerstrand farm for a kitchen-table discussion w/ residents who’ve been hit hard by the #propane crisis. http://t.co/j26blIrMHR,alfranken,Al Franken,New York,Democratic
1455,Sat Feb 08 23:38:17 +0000 2014,4.32E+17,2,24,Congrats to Afton's own @jessdiggs on her first Olympic #xcski finish in #Sochi. You made Minnesota proud! -Al,alfranken,Al Franken,New York,Democratic
1456,Sat Feb 08 22:37:37 +0000 2014,4.32E+17,3,19,Best wishes to @KeriHerman for a successful #slopestyle. Your hometown of Bloomington is pulling for you! -Al,alfranken,Al Franken,New York,Democratic
1457,Fri Feb 07 22:27:00 +0000 2014,4.32E+17,1,8,Looking forward to watching Marine on St. Croix's own @lcnordgren compete with the @USBiathlon team! -Al,alfranken,Al Franken,New York,Democratic
1458,Fri Feb 07 19:28:47 +0000 2014,4.32E+17,0,10,Proud to represent all Minnesotans competing with the @USOlympic team in Sochi. Go #TeamUSA! -Al,alfranken,Al Franken,New York,Democratic
1459,Fri Feb 07 18:24:40 +0000 2014,4.32E+17,2,35,Al’s urging makers of #GoogleGlass facial recognition app to delay its release until #privacy risks are addressed. http://t.co/gsjAlfGqbT,alfranken,Al Franken,New York,Democratic
1460,Fri Feb 07 18:11:21 +0000 2014,4.32E+17,5,5,"From Eden Prairie to Virginia, meet the everyday Minnesotans competing with the @USOlympic team in Sochi: http://t.co/laVKBUB7E6",alfranken,Al Franken,New York,Democratic
1461,Thu Feb 06 16:25:11 +0000 2014,4.31E+17,6,14,"Warroad, MN has sent 7 hockey players to the Olympics since 1956. Excited to see the Christians play in #Sochi - Al http://t.co/BSA5mWPODF",alfranken,Al Franken,New York,Democratic
1462,Wed Feb 05 21:01:18 +0000 2014,4.31E+17,13,79,Please join us today in wishing a very happy 21st birthday to the Family and Medical Leave Act. #FMLA21,alfranken,Al Franken,New York,Democratic
1463,Wed Feb 05 18:31:21 +0000 2014,4.31E+17,5,13,Thanks to everyone in #MN who took part in precinct caucuses last night. Stay involved! Join our campaign at http://t.co/3XNvJMwa41 -Al,alfranken,Al Franken,New York,Democratic
1464,Wed Feb 05 17:34:42 +0000 2014,4.31E+17,29,16,"Farmers in MN needed this bill &amp; with 1 in 5 jobs in MN connected to Ag, so did our economy. Glad we finally got this done -Al #FarmBill",alfranken,Al Franken,New York,Democratic
1465,Tue Feb 04 22:30:59 +0000 2014,4.31E+17,3,18,"RT! Don’t forget, MN caucuses are tonight at 7PM. To find your caucus location, click here: http://t.co/Bv6g4eLp5u",alfranken,Al Franken,New York,Democratic
1466,Tue Feb 04 20:35:13 +0000 2014,4.31E+17,2,15,".@MinnesotaDFL Video: Remembering Joan Mondale, friend and passionate arts advocate: http://t.co/pFe3c7gtA9",alfranken,Al Franken,New York,Democratic
1467,Tue Feb 04 17:11:33 +0000 2014,4.31E+17,6,15,Great pick by Gov. Dayton. Excited to have @tinaflintsmith on the ticket! She's a true champion for middle-class Minnesotans #betterMN -Al,alfranken,Al Franken,New York,Democratic
1468,Tue Feb 04 00:48:10 +0000 2014,4.31E+17,3,63,Joan Mondale was a wonderful woman &amp; I'm so glad I could call her my friend. Franni and I send our deep sympathy to the Mondale family. -Al,alfranken,Al Franken,New York,Democratic
1469,Mon Feb 03 20:08:40 +0000 2014,4.30E+17,2,18,#MN caucuses are tomorrow night (Feb. 4th). Click here to find your caucus: http://t.co/r2bOE0QIVT,alfranken,Al Franken,New York,Democratic
1470,Mon Feb 03 16:39:56 +0000 2014,4.30E+17,7,83,#NetNeutrality is under attack -- sign on to Al's petition to help fight back: http://t.co/xl5dBXloW8,alfranken,Al Franken,New York,Democratic
1471,Sat Feb 01 19:26:27 +0000 2014,4.30E+17,5,20,The Admin answers Al's call for aid as Al continues work to help keep Minnesotans warm during propane shortage http://t.co/wK4hu9XhZP,alfranken,Al Franken,New York,Democratic
1472,Sat Feb 01 01:14:57 +0000 2014,4.29E+17,24,277,74 yrs ago today the 1st #SocSec check was signed. Keeping the program's promise to our seniors remains as essential today as it was then.,alfranken,Al Franken,New York,Democratic
1473,Sat Feb 01 00:47:33 +0000 2014,4.29E+17,3,46,Join us in congratulating @MNWild fwd Zach Parise on being named captain of the men’s @USOlympic hockey team today http://t.co/EmZpBWaCCt,alfranken,Al Franken,New York,Democratic
1474,Wed Jan 29 03:22:07 +0000 2014,4.28E+17,28,74,"Agree w/ Pres, workforce development critical to strong economy. Im working to create jobs/close skills gap http://t.co/BdHBn6Y12R -Al #SOTU",alfranken,Al Franken,New York,Democratic
1475,Wed Jan 29 01:31:23 +0000 2014,4.28E+17,5,17,Very excited to have #MN manufacturer &amp; workforce development leader Erick Ajax as my guest for #SOTU -Al http://t.co/yQVVgd2iWu,alfranken,Al Franken,New York,Democratic
1476,Tue Jan 28 21:00:48 +0000 2014,4.28E+17,12,26,"Al, @AmyKlobuchar, @GovMarkDayton &amp; others urge immediate action on MN’s propane shortage to keep MN families warm http://t.co/wEi9iy9qxq",alfranken,Al Franken,New York,Democratic
1477,Tue Jan 28 17:45:48 +0000 2014,4.28E+17,1,2,@gfherald backs Al's effort to protect drivers' privacy and the location data stored in their cars http://t.co/SYkwPrgnRn #ICYMI,alfranken,Al Franken,New York,Democratic
1478,Sat Jan 25 18:50:39 +0000 2014,4.27E+17,8,26,Apple's @tim_cook calls 4 more #NSA transparency http://t.co/BNznbm56J7 @ABC Apple backs Al's NSA transparency bill http://t.co/H4QpgDUhf6,alfranken,Al Franken,New York,Democratic
1479,Fri Jan 24 03:29:52 +0000 2014,4.27E+17,15,31,Cold didn't stop the Carls @carletoncollege from mtg w/ me to talk college affordability. Thnx for your support -Al http://t.co/3sp2KOAi8m,alfranken,Al Franken,New York,Democratic
1480,Fri Jan 24 01:44:06 +0000 2014,4.27E+17,13,25,Great mtg Oles @stolaf tonight. Thanks for braving the cold &amp; talking about cutting the cost of college with me -Al http://t.co/Z1uQW29Nih,alfranken,Al Franken,New York,Democratic
1481,Wed Jan 22 15:47:42 +0000 2014,4.26E+17,4,17,Great meeting Duluth East's First Robotics team. Programs like these are critical for success in 21st cent econ. -AF http://t.co/WFbh2gTLD5,alfranken,Al Franken,New York,Democratic
1482,Mon Jan 20 14:22:57 +0000 2014,4.25E+17,14,394,"Today we remember Martin Luther King Jr.’s leadership, passion &amp; his fight for equality for all Americans that we continue to this day #MLK",alfranken,Al Franken,New York,Democratic
1483,Sun Jan 19 14:47:52 +0000 2014,4.25E+17,3,7,"Katherine Speer was an incredible mother, Grandy, friend and DFLer. We will all miss her. http://t.co/0nVrdIjK6r",alfranken,Al Franken,New York,Democratic
1484,Tue Jan 14 18:23:15 +0000 2014,4.23E+17,13,32,Al’s teaming up w/ @amyklobuchar to help low income families and seniors keep the heat on this winter http://t.co/UAyVrbiKvK,alfranken,Al Franken,New York,Democratic
1485,Sun Jan 12 03:31:24 +0000 2014,4.22E+17,15,39,Congrats to my new mayor @betsyhodges! I look forward working with you to make MPLS and MN a better place! -Al http://t.co/TDpmJ44vV5,alfranken,Al Franken,New York,Democratic
1486,Mon Jan 06 23:33:39 +0000 2014,4.20E+17,16,34,"As temps keep dropping, here are some cold weather driving tips to make sure everyone gets home safe tonight http://t.co/y391EKlZvN",alfranken,Al Franken,New York,Democratic
1487,Sun Jan 05 17:14:45 +0000 2014,4.20E+17,5,33,Please join me in wishing @R_T_Rybak a speedy recovery. We hope you're feeling better. -Al,alfranken,Al Franken,New York,Democratic
1488,Tue Dec 24 15:06:42 +0000 2013,4.15E+17,30,28,"Franni &amp; I want to wish you &amp; your family a happy, healthy, &amp; warm holiday season. - AF",alfranken,Al Franken,New York,Democratic
1489,Fri Dec 20 18:10:01 +0000 2013,4.14E+17,6,6,ICYMI - with apologies to Clement Clarke Moore: http://t.co/Xd8HtitZ4c,alfranken,Al Franken,New York,Democratic
1490,Fri Dec 20 00:56:12 +0000 2013,4.14E+17,10,15,"Al: “For cell phones! For staplers! For gas and for rent! For the volunteers’ snacks (trust me – money well spent)"" http://t.co/Xd8HtitZ4c",alfranken,Al Franken,New York,Democratic
1491,Thu Dec 19 23:28:11 +0000 2013,4.14E+17,10,27,"You've got your eggnog, and your gingerbread blue prints are mapped out. What's missing? A poem from Al, of course: http://t.co/Xd8HtitZ4c",alfranken,Al Franken,New York,Democratic
1492,Wed Dec 18 18:33:21 +0000 2013,4.13E+17,15,41,Al brought some much needed bipartisan cheer to the Senate by hosting his 3rd annual #SenateSecretSanta http://t.co/KzM95hs3UU,alfranken,Al Franken,New York,Democratic
1493,Thu Dec 12 21:44:14 +0000 2013,4.11E+17,28,109,Special interest $ in elections has gotten out of hand. Join the fight to fix our campaign finance system. Sign &amp; RT: http://t.co/1RMrGK8c1a,alfranken,Al Franken,New York,Democratic
1494,Thu Dec 05 23:28:42 +0000 2013,4.09E+17,5,40,Franni and my thoughts and prayers go out to President Mandela's family and all of the people who were touched by this incredible man -Al,alfranken,Al Franken,New York,Democratic
1495,Thu Dec 05 21:09:37 +0000 2013,4.09E+17,2,6,VIDEO: Watch Al discuss how students can save $ on college costs during a recent visit to Apple Valley High School. http://t.co/8AbIpHp5BK,alfranken,Al Franken,New York,Democratic
1496,Tue Dec 03 20:27:01 +0000 2013,4.08E+17,13,34,More coverage of Al’s work to make #college more affordable by putting textbooks online. Check it out: http://t.co/4PXDAKHAAl,alfranken,Al Franken,New York,Democratic
1497,Sun Dec 01 22:10:47 +0000 2013,4.07E+17,25,44,Skol Vikings! Enjoying the game today with my son Joe. - Al http://t.co/Lz6MPhvqR7,alfranken,Al Franken,New York,Democratic
1498,Thu Nov 28 13:00:19 +0000 2013,4.06E+17,22,21,This #Thanksgiving Franni &amp; I are thankful for all of your support. Have a happy &amp; healthy holiday! - AF,alfranken,Al Franken,New York,Democratic
1499,Thu Nov 28 01:49:27 +0000 2013,4.06E+17,26,79,"This year's Festival of Lights has begun, we wish you and your family a wonderful holiday. Hanukkah Sameach!",alfranken,Al Franken,New York,Democratic
1500,Wed Nov 27 20:32:26 +0000 2013,4.06E+17,13,24,Al welcomed release of new guidelines he's long fought for to help ensure access to mental health services http://t.co/0GHRbiEEmw,alfranken,Al Franken,New York,Democratic
1501,Wed Nov 27 18:35:12 +0000 2013,4.06E+17,24,71,"In light of rising college textbook prices, Al &amp; @DickDurbin are promoting free, online open-source textbooks. http://t.co/zYFIwN8PHF",alfranken,Al Franken,New York,Democratic
1502,Fri Nov 22 22:27:14 +0000 2013,4.04E+17,3,7,@senatorbaldwin don't count your brats b4 they're grilled. @Vikings rumored to add another quarterback to the mix https://t.co/n41hL21Uq2,alfranken,Al Franken,New York,Democratic
1503,Fri Nov 22 21:54:11 +0000 2013,4.04E+17,32,39,"Al &amp; @AmyKlobuchar help reform Senate rules to overcome unprecedented obstruction, get govt working for Minnesotans http://t.co/CKsLvcXjYA",alfranken,Al Franken,New York,Democratic
1504,Fri Nov 15 21:38:46 +0000 2013,4.01E+17,18,20,More coverage of Al’s push for transparency in surveillance programs. Check out @MinnPost’s story: http://t.co/2bPSTGmWBb,alfranken,Al Franken,New York,Democratic
1505,Thu Nov 14 19:12:10 +0000 2013,4.01E+17,25,39,Americans should know if our govt is striking the proper balance between privacy &amp; security in surveillance programs http://t.co/UwvQfqzjkO,alfranken,Al Franken,New York,Democratic
1506,Thu Nov 14 15:50:17 +0000 2013,4.01E+17,21,31,Al is fighting for better access to mental health services for #vets suffering from #PTSD http://t.co/u44XTQruLJ,alfranken,Al Franken,New York,Democratic
1507,Wed Nov 13 20:40:20 +0000 2013,4.01E+17,5,17,ICYMI: Read Al’s piece in @HuffPostPol from last week and join him in calling on the House to #PassENDA http://t.co/am8tnGibXU #lgbt,alfranken,Al Franken,New York,Democratic
1508,Wed Nov 13 18:22:23 +0000 2013,4.01E+17,6,17,Al spoke w/ #vets in Austin &amp; discussed his plans for improving access to VA clinics for rural veterans http://t.co/IX3Q5oYyun,alfranken,Al Franken,New York,Democratic
1509,Tue Nov 12 00:56:09 +0000 2013,4.00E+17,22,30,Al met with seniors in Eden Prairie today to thank veterans and their families for serving our country. http://t.co/zhuAVmxbzn,alfranken,Al Franken,New York,Democratic
1510,Mon Nov 11 18:19:11 +0000 2013,4.00E+17,16,78,"On #VeteransDay, let's honor those who've served by renewing our pledge to provide them w/the support they've earned http://t.co/e44fG36v9W",alfranken,Al Franken,New York,Democratic
1511,Mon Nov 11 03:19:49 +0000 2013,4.00E+17,12,28,Another great House Party in north Minneapolis to close out the weekend! http://t.co/22nduLgCKi,alfranken,Al Franken,New York,Democratic
1512,Mon Nov 11 00:13:26 +0000 2013,4.00E+17,12,16,"In Crystal, MN with the Rutmans. Another great House Party! http://t.co/zPFRkWooTm",alfranken,Al Franken,New York,Democratic
1513,Sat Nov 09 23:31:21 +0000 2013,3.99E+17,4,23,Congrats #Gophers on today's big win over Penn State! #RingtheBell #victory,alfranken,Al Franken,New York,Democratic
1514,Sat Nov 09 22:57:28 +0000 2013,3.99E+17,8,32,Incredible turnout at campaign HQ for another House Party. The time to get involved is now! http://t.co/osqEZWfRBo http://t.co/KEGOElRWtl,alfranken,Al Franken,New York,Democratic
1515,Sat Nov 09 18:36:11 +0000 2013,3.99E+17,2,15,The Year to Go House Party program is off to a great start! Cranberry Walnut bread was amazing! http://t.co/ekNjZDEp9u,alfranken,Al Franken,New York,Democratic
1516,Sat Nov 09 03:44:33 +0000 2013,3.99E+17,10,34,Al received @TakeActionMN 's 2013 Leadership Award tonight in MPLS. http://t.co/nsQLaZbsbV,alfranken,Al Franken,New York,Democratic
1517,Thu Nov 07 21:35:43 +0000 2013,3.99E+17,15,62,We’re a step closer toward #lgbt #equality in the workplace today. It's time the House take up and pass #ENDA. http://t.co/e6JQxkodoV,alfranken,Al Franken,New York,Democratic
1518,Tue Nov 05 19:57:17 +0000 2013,3.98E+17,15,51,"Don’t forget it’s #ElectionDay &amp; there are local elections throughout the state. Make sure you, your friends and your family get out &amp; vote!",alfranken,Al Franken,New York,Democratic
1519,Wed Oct 30 15:29:20 +0000 2013,3.96E+17,22,82,Al is joining 38 Senators urging #FarmBill negotiators to reject drastic #foodstamp cuts passed by the House http://t.co/FCSpEftp6S,alfranken,Al Franken,New York,Democratic
1520,Fri Oct 25 22:09:07 +0000 2013,3.94E+17,50,345,"On the 11th anniversary of the tragedy that took Paul &amp; Sheila Wellstone, let's remember their ability to touch Minnesotans &amp; lift them up",alfranken,Al Franken,New York,Democratic
1521,Thu Oct 24 18:21:49 +0000 2013,3.93E+17,10,7,#MN manufacturing #jobs &amp; overcoming the skills gap were topics of conversation during Al’s visit to Forest Lake HS: http://t.co/AnfWhRndxd,alfranken,Al Franken,New York,Democratic
1522,Wed Oct 23 21:26:31 +0000 2013,3.93E+17,16,23,Al: With #shutdown ended I’m hopeful #Congress will finally pass #FarmBill that benefits #MN farmers &amp; families http://t.co/BBvx3AuILO,alfranken,Al Franken,New York,Democratic
1523,Thu Oct 17 17:45:09 +0000 2013,3.91E+17,43,100,"Al: Time to return to issues we should be focused on: putting people back to work, educating our kids &amp; strengthening our econ. recovery",alfranken,Al Franken,New York,Democratic
1524,Thu Oct 17 01:19:45 +0000 2013,3.91E+17,72,125,Relieved we reopened government; now we must focus on the work we were sent here to do. - Al,alfranken,Al Franken,New York,Democratic
