,created_at,id_str,reply_count,retweet_count,text,user,name,state,party
365,Wed Apr 28 18:21:08 +0000 2010,13020789511,0,2,http://bit.ly/92rNtr,SenBillNelson,Bill Nelson,Florida,Democratic
366,Wed Apr 28 18:20:46 +0000 2010,13020773923,0,6,Got favorable response today to my request for a congressional probe of oil industry’s claims that it’s safe enough to drill near florida.,SenBillNelson,Bill Nelson,Florida,Democratic
367,Tue Apr 27 18:54:43 +0000 2010,12959456666,0,1,"So far partisanship has kept us from considering Wall Street reform.  Hopefully, we can break the divide.  http://bit.ly/cheB76",SenBillNelson,Bill Nelson,Florida,Democratic
368,Fri Apr 23 18:47:44 +0000 2010,12718396210,0,1,"Based on all the tweets yesterday, nobody saw Denver coming! http://bit.ly/d8Ree7",SenBillNelson,Bill Nelson,Florida,Democratic
369,Thu Apr 22 21:38:31 +0000 2010,12662533685,0,4,"Ok, it’s draft time – so where do y’all think Tim Tebow’s going to end up?",SenBillNelson,Bill Nelson,Florida,Democratic
370,Thu Apr 22 15:36:50 +0000 2010,12645591673,0,2,"Happy Earth Day. Did you know Sen. Nelson had a hand in launching the movement?  Gaylord Nelson, that is. http://bit.ly/bFlJoR",SenBillNelson,Bill Nelson,Florida,Democratic
371,Wed Apr 21 19:59:59 +0000 2010,12594942373,0,4,At budget cmte – looks like we’ll get another $1 billion for NASA next year. Could save jobs. Here’s what I had to say http://bit.ly/cdzz9Z,SenBillNelson,Bill Nelson,Florida,Democratic
372,Tue Apr 20 16:20:57 +0000 2010,12524817978,0,1,Saddened by Dorothy Height’s passing - she certainly left her mark in America’s history as a pioneer of civil rights http://bit.ly/bRC45D,SenBillNelson,Bill Nelson,Florida,Democratic
373,Fri Apr 16 20:34:20 +0000 2010,12303147918,0,1,At the Clinton Global Initiative mtg – looking forward to meeting the students who are doing extraordinary work http://bit.ly/dCevgw,SenBillNelson,Bill Nelson,Florida,Democratic
374,Fri Apr 16 18:41:37 +0000 2010,12298355549,0,1,Toured Univision in Miami today – Elizabeth and the rest of the folks there are doing a heck of a job!,SenBillNelson,Bill Nelson,Florida,Democratic
375,Thu Apr 15 22:30:55 +0000 2010,12247857427,0,2,Was great playing Hardball w Chris Matthews about Obama’s plan for space exploration. See it here - http://bit.ly/9WF0kz,SenBillNelson,Bill Nelson,Florida,Democratic
376,Thu Apr 15 19:43:19 +0000 2010,12240565353,0,6,Listen to my reaction to Obama’s plan for space here - http://billnelson.senate.gov/audiofiles/NelsonSpace.wma,SenBillNelson,Bill Nelson,Florida,Democratic
377,Thu Apr 15 18:58:35 +0000 2010,12238689859,0,2,At KSC - Crowd here anxiously awaiting president’s speech on space program http://bit.ly/ajh7RZ,SenBillNelson,Bill Nelson,Florida,Democratic
378,Thu Apr 08 21:49:02 +0000 2010,11845144836,0,6,The White House announcement today of some extra work for NASA in Florida is a step in the right direction – but there are miles to go.,SenBillNelson,Bill Nelson,Florida,Democratic
379,Thu Apr 08 16:56:04 +0000 2010,11832930060,0,3,Judge says Chinese company at fault in drywall mess. It’s time our government stepped up the pressure on the Chinese. http://bit.ly/ctGzrO,SenBillNelson,Bill Nelson,Florida,Democratic
380,Tue Apr 06 18:16:13 +0000 2010,11711298220,0,2,FL to get $24 million for medical IT – read more here http://billnelson.senate.gov/news/details.cfm?id=323635&,SenBillNelson,Bill Nelson,Florida,Democratic
381,Tue Mar 23 14:49:01 +0000 2010,10928535934,0,7,Headed to the White House for historic signing of health care bill,SenBillNelson,Bill Nelson,Florida,Democratic
382,Tue Mar 16 14:32:27 +0000 2010,10572276143,0,9,Headed to Oval Office for meeting with the president about America’s space program. Lots of folks unhappy with newly released plan for NASA.,SenBillNelson,Bill Nelson,Florida,Democratic
383,Wed Mar 10 19:20:41 +0000 2010,10284858681,0,6,Met some really extraordinary women this morning - volunteer WWII pilots. They're getting long overdue honors. http://bit.ly/9vBihk,SenBillNelson,Bill Nelson,Florida,Democratic
384,Tue Mar 09 21:03:44 +0000 2010,10237707523,0,7,Hard to believe: it’s been three years today since former FBI agent Bob Levinson disappeared in Iran. http://www.helpboblevinson.com/,SenBillNelson,Bill Nelson,Florida,Democratic
385,Mon Mar 08 14:47:33 +0000 2010,10173443675,0,3,Glad President Obama has decided to come to Florida next month and elaborate on his plans for our nation’s space program.,SenBillNelson,Bill Nelson,Florida,Democratic
386,Fri Mar 05 16:15:10 +0000 2010,10030670323,0,4,Senate is considering financial reform today – I think executives who got golden parachutes should have been left without their shirts.,SenBillNelson,Bill Nelson,Florida,Democratic
387,Mon Mar 01 15:08:23 +0000 2010,9828360748,0,1,Down in Central Fla today to see where our stimulus bucks are going.  With VP at widening of U.S. 27.,SenBillNelson,Bill Nelson,Florida,Democratic
388,Fri Feb 26 20:28:06 +0000 2010,9695018378,0,6,The latest partisan stunt is getting in the way of helping Americans by temporarily blocking unemployment benefits http://bit.ly/cIxv10,SenBillNelson,Bill Nelson,Florida,Democratic
389,Wed Feb 24 19:43:24 +0000 2010,9589585478,0,5,We got a jobs bill passed today – it would give companies a strong incentive to hire new folks. Now we have to see what the House does.,SenBillNelson,Bill Nelson,Florida,Democratic
390,Wed Feb 24 16:39:33 +0000 2010,9582934823,0,5,NASA to boldly go - where?  http://www.newschief.com/article/20100224/NEWS/2245060/1053,SenBillNelson,Bill Nelson,Florida,Democratic
391,Tue Feb 23 19:10:24 +0000 2010,9538427340,0,2,Florida fishermen raised significant concerns with me today about new govt. fishing bans – I’m asking for a full review.,SenBillNelson,Bill Nelson,Florida,Democratic
392,Mon Feb 22 17:04:28 +0000 2010,9483962630,0,3,"StoryCorps bus now in Pensacola http://bit.ly/dCkaky – 50,000 Americans have so far recorded their stories for NPR and Library of Congress.",SenBillNelson,Bill Nelson,Florida,Democratic
393,Thu Feb 18 20:13:39 +0000 2010,9299081199,0,4,"I’m asking three federal agencies to investigate unusual cancer cases in South FL, here’s more http://bit.ly/clEATU",SenBillNelson,Bill Nelson,Florida,Democratic
394,Fri Feb 12 21:33:45 +0000 2010,9026673329,0,4,"En route back from Haiti. Distribution of food, supplies greatly improved. But urgent help still needed especially before the rainy season.",SenBillNelson,Bill Nelson,Florida,Democratic
395,Mon Feb 01 22:49:28 +0000 2010,8517293370,0,19,"Looking at administration’s budget for nasa – houston, we may have a problem.",SenBillNelson,Bill Nelson,Florida,Democratic
396,Mon Feb 01 15:30:30 +0000 2010,8502396077,0,4,Reason for moving it is so they're not all in one place like sitting ducks. Also huge for the North Florida economy. http://bit.ly/bbdWUz,SenBillNelson,Bill Nelson,Florida,Democratic
397,Mon Feb 01 15:30:17 +0000 2010,8502387546,0,3,"In Jax this morning on Mayport landing a new carrier. Something Ander, Corrine and I have spent close to a decade fighting for.",SenBillNelson,Bill Nelson,Florida,Democratic
398,Wed Jan 27 18:01:47 +0000 2010,8287838668,0,9,"Obama in Tampa tomorrow where he’s announcing $8 B in stimulus money for high-speed rail, including some for a bullet train in Florida.",SenBillNelson,Bill Nelson,Florida,Democratic
399,Thu Jan 21 20:37:58 +0000 2010,8040634656,0,17,"Just got off phone with folks from the administration, they’ll be allowing kids from Haiti with critical injuries quick passage to the U.S.",SenBillNelson,Bill Nelson,Florida,Democratic
400,Tue Jan 19 18:15:35 +0000 2010,7954309353,0,2,Still pressing gov’t for one-year medical visas for the youngest and worst traumatized victims of the quake http://bit.ly/7Tq01D,SenBillNelson,Bill Nelson,Florida,Democratic
401,Wed Jan 13 22:18:37 +0000 2010,7724169574,0,10,For some ways to help Haiti earthquake victims: http://www.billnelson.senate.gov/2010haitiearthquake.cfm,SenBillNelson,Bill Nelson,Florida,Democratic
402,Wed Jan 13 15:07:49 +0000 2010,7710858956,0,2,My heart and prayers go out to the people in Haiti.,SenBillNelson,Bill Nelson,Florida,Democratic
403,Tue Jan 12 17:56:30 +0000 2010,7676889386,0,7,Big grassroots rallies today to help bring high speed rail to Florida http://bit.ly/6MayM8,SenBillNelson,Bill Nelson,Florida,Democratic
404,Tue Jan 12 16:13:37 +0000 2010,7673722113,0,3,Went on quite a ride - 24 years ago today http://www.upi.com/Odd_News/2010/01/12/The-almanac/UPI-51371263285000/,SenBillNelson,Bill Nelson,Florida,Democratic
405,Thu Dec 24 13:37:11 +0000 2009,6999460294,0,6,"Senate just passed health care with my vote. Not a perfect bill, but good. It’ll let a lot more people get medical coverage.",SenBillNelson,Bill Nelson,Florida,Democratic
406,Thu Dec 10 19:09:04 +0000 2009,6540535675,0,4,@mmarkarian thanks to humane society for supporting a ban on harmful species http://bit.ly/7rmSpt,SenBillNelson,Bill Nelson,Florida,Democratic
407,Thu Dec 10 18:37:26 +0000 2009,6539649747,0,7,"Bunch of us (me, LeMieux, Reps. Brown, Mica) had heart-to-heart with US transportation boss last night. Optimistic FL will get bullet train.",SenBillNelson,Bill Nelson,Florida,Democratic
408,Thu Dec 10 14:43:52 +0000 2009,6532973264,0,1,A guy who punched someone outside one of my speeches on health-care reform gets sent to anger classes http://bit.ly/4XiGdx,SenBillNelson,Bill Nelson,Florida,Democratic
409,Wed Dec 02 21:16:21 +0000 2009,6281313942,0,7,I told my wife Grace not to push the refresh button so many times http://bit.ly/7PVDUs,SenBillNelson,Bill Nelson,Florida,Democratic
410,Wed Dec 02 17:45:12 +0000 2009,6275752259,0,1,I think the president offered a sensible plan to empower the Afghan people and allow for our troops to complete their mission and come home.,SenBillNelson,Bill Nelson,Florida,Democratic
411,Wed Nov 18 20:49:17 +0000 2009,5836768965,0,5,Usually where there’s smoke there’s fire – that’s why I’m calling for an investigation into the drug price hikes http://bit.ly/2Qul6W,SenBillNelson,Bill Nelson,Florida,Democratic
412,Wed Nov 18 20:48:58 +0000 2009,5836760762,0,2,"What? Drug makers hiking prices even more, despite promises to shave costs to help pay for health reform?  http://bit.ly/4DfU1b",SenBillNelson,Bill Nelson,Florida,Democratic
413,Tue Nov 17 20:20:54 +0000 2009,5805157638,0,2,"I usually drink my first cup of coffee watching Morning Joe, wonder if he'd host Hillary and Palin talking over a cup? http://bit.ly/1JLLVt",SenBillNelson,Bill Nelson,Florida,Democratic
414,Tue Nov 17 16:43:05 +0000 2009,5800038781,0,1,We’ll be voting on big military projects today. Stuff like getting ready for one day moving a huge Navy carrier to Florida.,SenBillNelson,Bill Nelson,Florida,Democratic
415,Thu Oct 22 17:43:57 +0000 2009,5074840691,0,1,I will continue to fight to get NASA funding for the next generation of human spaceflight. More on what we need to do http://bit.ly/1Q1aG9,SenBillNelson,Bill Nelson,Florida,Democratic
416,Tue Oct 13 18:59:38 +0000 2009,4841789965,0,1,"Just voted for the Finance Committee’s health-care bill, I’ll be on CNN about it just after 3 p.m.",SenBillNelson,Bill Nelson,Florida,Democratic
417,Wed Sep 09 23:46:11 +0000 2009,3874796648,0,1,Health-insurance exchanges will help the nearly one-in-four Floridians who don’t have or cannot get affordable health insurance.,SenBillNelson,Bill Nelson,Florida,Democratic
418,Wed Sep 09 23:45:25 +0000 2009,3874780995,0,1,Just read excerpts from President’s speech for tonight. I’m glad the president is proposing insurance exchanges.,SenBillNelson,Bill Nelson,Florida,Democratic
419,Fri Jul 24 20:04:04 +0000 2009,2824860751,0,1,Meeting with folks in Orl. hurt by decline in tourism worsened by gov’t blacklisting. Talking about ways to end it http://tinyurl.com/nzhzst,SenBillNelson,Bill Nelson,Florida,Democratic