,created_at,id_str,reply_count,retweet_count,text,user,name,state,party
1482,Tue Nov 03 17:21:55 +0000 2015,6.61594E+17,3,23,"Thx to my favorite colleague for helping me celebrate my 12,000th vote in the US Senate. Look at all… https://t.co/Rfp4zmc6Yu",ChuckGrassley,Chuck Grassley,Iowa,Republican
1483,Mon Nov 02 18:16:58 +0000 2015,6.61246E+17,1,12,"Skyped with Sioux City West HS students today. Very good Qs, main topics were immigration and… https://t.co/XBt3X5fBvh",ChuckGrassley,Chuck Grassley,Iowa,Republican
1484,Mon Nov 02 17:50:35 +0000 2015,6.61239E+17,2,4,On Friday I spoke at DuPont grand opening of the largest cellulosic ethanol plant in the world. A… https://t.co/5KfJnSGeMd,ChuckGrassley,Chuck Grassley,Iowa,Republican
1485,Sun Nov 01 01:24:10 +0000 2015,6.60628E+17,1,4,UNI win match over Indiana st 3/0,ChuckGrassley,Chuck Grassley,Iowa,Republican
1486,Sun Nov 01 01:19:42 +0000 2015,6.60627E+17,0,2,UNI 25/19 over Indiana st set2,ChuckGrassley,Chuck Grassley,Iowa,Republican
1487,Sun Nov 01 00:49:19 +0000 2015,6.6062E+17,2,3,First set 25/19 UNI ovr Indiana st,ChuckGrassley,Chuck Grassley,Iowa,Republican
1488,Sat Oct 31 23:44:12 +0000 2015,6.60603E+17,1,2,Tonite is Indiana st v UNI VB  there Indiana st beat UNI 3/2 earlier.,ChuckGrassley,Chuck Grassley,Iowa,Republican
1489,Sat Oct 31 02:00:33 +0000 2015,6.60275E+17,1,7,UNI match winner ovr Illinois st 3/1,ChuckGrassley,Chuck Grassley,Iowa,Republican
1490,Sat Oct 31 01:33:13 +0000 2015,6.60268E+17,2,4,UNI coach Bobbi Peterson telling team how win. It works in 3rd set 25/21 ovr Illinois st https://t.co/XDSTyPfP2H,ChuckGrassley,Chuck Grassley,Iowa,Republican
1491,Sat Oct 31 01:00:49 +0000 2015,6.6026E+17,0,3,Report on first two sets. Illinois st over UNI 26/22  then UNI ovr 25/22,ChuckGrassley,Chuck Grassley,Iowa,Republican
1492,Fri Oct 30 23:46:33 +0000 2015,6.60241E+17,3,5,Tonite Illinois st at UNI VB. I will report.,ChuckGrassley,Chuck Grassley,Iowa,Republican
1493,Fri Oct 30 23:43:19 +0000 2015,6.60241E+17,4,10,These r ppl who spoke 2day at dedication of world largest cellulosic ethanol plant at Nevada Iowa  GovB and I ledoff https://t.co/yIwjF3dG1w,ChuckGrassley,Chuck Grassley,Iowa,Republican
1494,Thu Oct 29 21:04:52 +0000 2015,6.59838E+17,2,7,I hope u can read this to notice my mother Ruth 3rd fr left casting a vote 29 hrs after ratification… https://t.co/uuMr3FpvJ1,ChuckGrassley,Chuck Grassley,Iowa,Republican
1495,Wed Oct 28 14:36:31 +0000 2015,6.59378E+17,14,16,I thought universities were where robust intellectual debate wld b conducted. Then how come Williams College disinvited Suzanne Venker,ChuckGrassley,Chuck Grassley,Iowa,Republican
1496,Wed Oct 28 14:27:09 +0000 2015,6.59376E+17,8,21,I hope u can read this by a person who understands danger to world peace that Russia is and that the… https://t.co/ffyxbueulh,ChuckGrassley,Chuck Grassley,Iowa,Republican
1497,Wed Oct 28 14:20:42 +0000 2015,6.59374E+17,26,21,"Why we in US contrast:rich/poor,black/white,men/womenetc US at its best when all in this together/one family/one ppl/United we stand",ChuckGrassley,Chuck Grassley,Iowa,Republican
1498,Tue Oct 27 19:12:56 +0000 2015,6.59085E+17,4,4,"As u know, Oct. is breast cancer awareness month. I'm a proud supporter of prevention &amp; awareness. My… https://t.co/eVC5mnt1Ay",ChuckGrassley,Chuck Grassley,Iowa,Republican
1499,Fri Oct 23 20:53:28 +0000 2015,6.57661E+17,3,12,A great company in Waterloo VGM lost its leader and Waterloo lost a great civic leader https://t.co/wMM8X485ke,ChuckGrassley,Chuck Grassley,Iowa,Republican
1500,Thu Oct 22 18:16:26 +0000 2015,6.57259E+17,6,17,GR8 news-landmark bipartisan sentencing &amp; prison reform bill that I authored clears Judiciary committee Passes w Strong vote of 15-5,ChuckGrassley,Chuck Grassley,Iowa,Republican
1501,Wed Oct 21 16:40:33 +0000 2015,6.56873E+17,6,7,a good memory from this summer at the IA State Fair. Reason for the pic? It's my wife's birthday.… https://t.co/a8gELb1CLv,ChuckGrassley,Chuck Grassley,Iowa,Republican
1502,Wed Oct 21 16:01:24 +0000 2015,6.56863E+17,2,2,Met w Court Appointed Special Advocates for Children who help foster youth. The caucus I chair had a… https://t.co/wjnBxRU8jm,ChuckGrassley,Chuck Grassley,Iowa,Republican
1503,Mon Oct 19 14:17:42 +0000 2015,6.56112E+17,1,4,UNI marching band at homecoming https://t.co/0r9CqDS7qE,ChuckGrassley,Chuck Grassley,Iowa,Republican
1504,Sun Oct 18 01:42:11 +0000 2015,6.55559E+17,2,2,Pella Christian girls being recruited by UNI VB https://t.co/zX5d17JXBc,ChuckGrassley,Chuck Grassley,Iowa,Republican
1505,Sun Oct 18 01:21:48 +0000 2015,6.55554E+17,2,4,UNI ovr Drake 3/0 for match,ChuckGrassley,Chuck Grassley,Iowa,Republican
1506,Sun Oct 18 00:54:44 +0000 2015,6.55548E+17,1,7,Sets 1&amp;2 UNI ovr Drake 25/13 25/20. Drake is an outstanding U IN DESMOINES,ChuckGrassley,Chuck Grassley,Iowa,Republican
1507,Sat Oct 17 20:08:00 +0000 2015,6.55475E+17,4,3,This is fun to b at UNI homecoming https://t.co/mm5AuifLJQ,ChuckGrassley,Chuck Grassley,Iowa,Republican
1508,Sat Oct 17 20:04:38 +0000 2015,6.55475E+17,0,2,At Dick Morris UNI homecoming tailgate  Dick received honorary Letterman jacket same time I did abt… https://t.co/kVBgbaUlZ8,ChuckGrassley,Chuck Grassley,Iowa,Republican
1509,Sat Oct 17 19:50:39 +0000 2015,6.55471E+17,2,2,Just met up congressman Rod Blum at UNI homecoming tailgate https://t.co/xdFHe2m8ey,ChuckGrassley,Chuck Grassley,Iowa,Republican
1510,Sat Oct 17 19:28:45 +0000 2015,6.55465E+17,0,2,I'm w UNI Panther at homecoming  panthers play western Illinois https://t.co/Jur5mjFk3x,ChuckGrassley,Chuck Grassley,Iowa,Republican
1511,Sat Oct 17 19:24:39 +0000 2015,6.55464E+17,1,6,Barbara Grassley at UNI homecoming   W UNI Panther  Barb Class of 83 https://t.co/X7eRdpEt5o,ChuckGrassley,Chuck Grassley,Iowa,Republican
1512,Sat Oct 17 17:05:41 +0000 2015,6.55429E+17,2,18,No.  Don't assume all plants r dead w this killing frost https://t.co/55bBXvsA1x,ChuckGrassley,Chuck Grassley,Iowa,Republican
1513,Sat Oct 17 16:55:56 +0000 2015,6.55427E+17,4,10,25degrees last night at Grassley farm. Picture are colors of the first killing frost  normal killing… https://t.co/mP0fX1WpHq,ChuckGrassley,Chuck Grassley,Iowa,Republican
1514,Fri Oct 16 15:58:03 +0000 2015,6.5505E+17,4,4,"Q&amp;A Greene County HS 131 ppl TOPICS-Educ,filibuster,SchoolShootings, SameSexMarriage, drugs, MiddleEast, taxes, govt/relig #99countymeetings",ChuckGrassley,Chuck Grassley,Iowa,Republican
1515,Fri Oct 16 15:54:16 +0000 2015,6.55049E+17,7,50,Visit the Jefferson Iowa DairyQueen sometime for fine food https://t.co/eFRmLBWo9d,ChuckGrassley,Chuck Grassley,Iowa,Republican
1516,Fri Oct 16 15:40:18 +0000 2015,6.55046E+17,240,3370,"I'm at the Jefferson Iowa DairyQueen doing ""you know what"" !!!",ChuckGrassley,Chuck Grassley,Iowa,Republican
1517,Fri Oct 16 15:18:54 +0000 2015,6.5504E+17,1,6,In Jefferson  w school mascot of Greene County HS  I finished the full grassley meaning my 99county… https://t.co/CLgnh24b5o,ChuckGrassley,Chuck Grassley,Iowa,Republican
1518,Thu Oct 15 16:47:51 +0000 2015,6.547E+17,15,25,Welcome Obama decision 2day not withdraw all troops fr Afghanistan. He learned fr such mistake in Iraq,ChuckGrassley,Chuck Grassley,Iowa,Republican
1519,Tue Oct 13 22:01:42 +0000 2015,6.54054E+17,8,5,Sen. judiciary comm had hearing on meth today in Des Moines. Terrible drug prob in Iowa. Law enf &amp; Treatment providers highlighted problem.,ChuckGrassley,Chuck Grassley,Iowa,Republican
1520,Tue Oct 13 21:41:26 +0000 2015,6.54049E+17,1,6,Doing a lptv interview abt Iowa caucuses  I followed gov Branstad   Pls watch   Assume I did ok.… https://t.co/AWc4m7o0ox,ChuckGrassley,Chuck Grassley,Iowa,Republican
1521,Mon Oct 12 20:01:07 +0000 2015,6.53662E+17,1,2,"Mapleton Town Meeting 31ppl TOPICS-Obamacare, debt, DeathTax, guns, same sex marriage, taxes, Educ., PP, refugees, energy #99countymeetings",ChuckGrassley,Chuck Grassley,Iowa,Republican
1522,Mon Oct 12 19:23:34 +0000 2015,6.53652E+17,0,4,Maple town meeting in community library. Thx to library for hospitality https://t.co/7EeZT1ofkS,ChuckGrassley,Chuck Grassley,Iowa,Republican
1523,Mon Oct 12 17:57:11 +0000 2015,6.53631E+17,0,3,"Q&amp;A, tour Crawford County Hospital 31 ppl TOPICS-Soc Sec, foreign aid, taxes, bird flu, WOTUS, guns, Immig, drugs, Welfare #99countymeetings",ChuckGrassley,Chuck Grassley,Iowa,Republican
1524,Mon Oct 12 17:48:30 +0000 2015,6.53628E+17,0,4,Thanks to Bill Bruce and Crawford county hospital for hosting tour and Q&amp;A w constituents   Bruce… https://t.co/dywbGpIBuU,ChuckGrassley,Chuck Grassley,Iowa,Republican
1525,Mon Oct 12 15:46:24 +0000 2015,6.53598E+17,0,3,"Ida Grove Town meeting 19ppl TOPICS-SCOTUS, Syrian refugees, RFS, REACH Act, energy, Welfare, China/debt, balanced budget #99countymeetings",ChuckGrassley,Chuck Grassley,Iowa,Republican
1526,Mon Oct 12 14:03:12 +0000 2015,6.53572E+17,2,5,"Storm Lake town meeting 42ppl Bal. Budget, SanctuaryCities, Immig,Iran,taxes, WOTUS, TPP, DoD$, SocSec, PP, Obamacare #99countymeetings",ChuckGrassley,Chuck Grassley,Iowa,Republican
1527,Mon Oct 12 13:47:12 +0000 2015,6.53568E+17,0,2,#99countymeetings Just finished first of five town meetings in StormLake https://t.co/8cVdTNSjh0,ChuckGrassley,Chuck Grassley,Iowa,Republican
1528,Sun Oct 11 02:17:22 +0000 2015,6.53032E+17,1,2,UNI wins match 3/2 ovr Missouri St,ChuckGrassley,Chuck Grassley,Iowa,Republican
1529,Sun Oct 11 01:59:28 +0000 2015,6.53027E+17,1,2,Set4 Missouri st ovr UNI 25/20,ChuckGrassley,Chuck Grassley,Iowa,Republican
1530,Sun Oct 11 01:33:05 +0000 2015,6.5302E+17,2,1,Set3 UNI ovr Missouri st 25/15,ChuckGrassley,Chuck Grassley,Iowa,Republican
1531,Sun Oct 11 01:00:47 +0000 2015,6.53012E+17,0,2,Set 2 UNI ovr Missouri st 25/19,ChuckGrassley,Chuck Grassley,Iowa,Republican
1532,Sun Oct 11 00:33:01 +0000 2015,6.53005E+17,1,1,Set 1 Missouri st ovr UNI 26/24,ChuckGrassley,Chuck Grassley,Iowa,Republican
1533,Sat Oct 10 01:40:14 +0000 2015,6.5266E+17,3,3,Wichita st wins match over UNI 3/0,ChuckGrassley,Chuck Grassley,Iowa,Republican
1534,Sat Oct 10 01:03:46 +0000 2015,6.52651E+17,2,4,Set2 Wichita st 25/23,ChuckGrassley,Chuck Grassley,Iowa,Republican
1535,Fri Oct 09 19:48:44 +0000 2015,6.52571E+17,2,4,"Colfax Mingo HS TOPICS Immigration, college debt, keystone pipeline, guns, Iran, marijuana, refugees, taxes, drone strikes #99countymeetings",ChuckGrassley,Chuck Grassley,Iowa,Republican
1536,Fri Oct 09 19:22:19 +0000 2015,6.52565E+17,4,4,The next time u in Colfax visit the ColfaxHistorical Society and museum https://t.co/6lBzVcg7xY,ChuckGrassley,Chuck Grassley,Iowa,Republican
1537,Fri Oct 09 19:18:16 +0000 2015,6.52564E+17,1,1,I just did. Q&amp;A w 62 students at ColfaxMingo HS https://t.co/6qHYwiFmY4,ChuckGrassley,Chuck Grassley,Iowa,Republican
1538,Fri Oct 09 16:37:10 +0000 2015,6.52523E+17,1,1,"Guthrie Center HS 225ppl TOPICS-guns, urban sprawl, deficit,IAsenators, farms, vets jobs,Immig, mental health, drugs, GMOs #99countymeetings",ChuckGrassley,Chuck Grassley,Iowa,Republican
1539,Fri Oct 09 16:21:33 +0000 2015,6.52519E+17,2,6,I'm w 200+ students at Guthrie Center HS Q&amp;A   Because young ppl don't. Come to my other town… https://t.co/Onduoh6ANn,ChuckGrassley,Chuck Grassley,Iowa,Republican
1540,Fri Oct 09 16:16:46 +0000 2015,6.52518E+17,0,1,Greenfield town meet at The Corner coffee shop  Tom thx for hospitality   Lots of presidential… https://t.co/X5PFcy0QGU,ChuckGrassley,Chuck Grassley,Iowa,Republican
1541,Fri Oct 09 14:46:25 +0000 2015,6.52495E+17,0,4,"Greenfield town meeting, 38 ppl TOPICS-Syria, Dodd-Frank, HouseSpeaker,ExecOrders,SCOTUS, Hiways, Immig,Taxes,Tuition,ECPA #99countymeetings",ChuckGrassley,Chuck Grassley,Iowa,Republican
1542,Wed Oct 07 18:46:48 +0000 2015,6.51831E+17,1,4,"This is my team. 2 of the boys are sons of my chief of staff, Jill. the other is the son of my former… https://t.co/RzRxHwK3tK",ChuckGrassley,Chuck Grassley,Iowa,Republican
1543,Tue Oct 06 20:36:55 +0000 2015,6.51496E+17,1,6,Nice mtg w state rep Marti Anderson. Colleague of @PatGrassley We talked abt fed justice reform &amp; other issues http://t.co/IP54yyoSMA,ChuckGrassley,Chuck Grassley,Iowa,Republican
1544,Sat Oct 03 14:50:34 +0000 2015,6.50322E+17,3,11,Read abt California Fair Pay act in Friday WSJ op Ed  for info on pay differentials Good and not so good. Arguments not often heard,ChuckGrassley,Chuck Grassley,Iowa,Republican
1545,Sat Sep 26 18:34:42 +0000 2015,6.47842E+17,5,17,No  No. I'm. Still in Iowa  Eastern Iowa town. Pop361 https://t.co/Ol8oQcDUmZ,ChuckGrassley,Chuck Grassley,Iowa,Republican
1546,Sat Sep 26 01:52:32 +0000 2015,6.4759E+17,2,7,UNI wins match 3/1 ovr southern Illinois,ChuckGrassley,Chuck Grassley,Iowa,Republican
1547,Sat Sep 26 01:24:38 +0000 2015,6.47583E+17,0,5,3rd set UNI 25/17 ovr southern Illinois,ChuckGrassley,Chuck Grassley,Iowa,Republican
1548,Sat Sep 26 00:52:20 +0000 2015,6.47574E+17,0,3,2nd set SoIllinois 25/16 UNI,ChuckGrassley,Chuck Grassley,Iowa,Republican
1549,Sat Sep 26 00:26:55 +0000 2015,6.47568E+17,1,3,First set UNI 25/23 ovr SoIllinols,ChuckGrassley,Chuck Grassley,Iowa,Republican
1550,Fri Sep 25 23:39:50 +0000 2015,6.47556E+17,2,2,My most favorite mascots. TC&amp;TK for UNI I'm reporting on U of So Illinois VB https://t.co/8hRzbrJNgR,ChuckGrassley,Chuck Grassley,Iowa,Republican
1551,Fri Sep 25 22:09:41 +0000 2015,6.47533E+17,10,11,Appreciate Pope Francis emphasis of family during visit to US. A foundation of our country Wonderful reinforcement of importance of family,ChuckGrassley,Chuck Grassley,Iowa,Republican
1552,Fri Sep 25 14:56:38 +0000 2015,6.47424E+17,1,2,This is Sabin Hall at UNI  it houses dept of poli sci. But when I was student it was the Laboratory… https://t.co/MUg9yaCIK8,ChuckGrassley,Chuck Grassley,Iowa,Republican
1553,Thu Sep 24 15:24:22 +0000 2015,6.47069E+17,3,4,Sat w the junior senator from Iowa  @senjoniernst for the Pope's address to Congress this morn. I… https://t.co/ffhwGP41mL,ChuckGrassley,Chuck Grassley,Iowa,Republican
1554,Thu Sep 24 15:16:13 +0000 2015,6.47067E+17,12,12,Pope's address well rcvd to congress. Great 2 be part of historic event,ChuckGrassley,Chuck Grassley,Iowa,Republican
1555,Thu Sep 24 09:55:46 +0000 2015,6.46986E+17,1,4,Thx to Tara Thomas Gary Bertch Jeff Zaptili Anna Mae Weems for this honor. But it is ur hard work… https://t.co/IL7bbObsXA,ChuckGrassley,Chuck Grassley,Iowa,Republican
1556,Wed Sep 23 14:57:43 +0000 2015,6.467E+17,2,2,While we were waiting for two hrs for pope Mrs Grassley and Mrs Loebsack talked quietly the whole… https://t.co/mjLUVTRgNY,ChuckGrassley,Chuck Grassley,Iowa,Republican
1557,Wed Sep 23 14:11:30 +0000 2015,6.46688E+17,9,23,At rate crowd leaves whitehouse it will take hr to get bk to Hill,ChuckGrassley,Chuck Grassley,Iowa,Republican
1558,Wed Sep 23 13:18:16 +0000 2015,6.46675E+17,25,88,What happened?   This was supposed to start at 9am,ChuckGrassley,Chuck Grassley,Iowa,Republican
1559,Wed Sep 23 12:55:36 +0000 2015,6.46669E+17,5,39,Band plays God Bless America,ChuckGrassley,Chuck Grassley,Iowa,Republican
1560,Wed Sep 23 12:47:52 +0000 2015,6.46667E+17,6,42,Band plays  this is my country land of my birth,ChuckGrassley,Chuck Grassley,Iowa,Republican
1561,Wed Sep 23 12:36:11 +0000 2015,6.46664E+17,0,23,Band plays Washington Post March.,ChuckGrassley,Chuck Grassley,Iowa,Republican
1562,Wed Sep 23 12:32:28 +0000 2015,6.46663E+17,4,47,Sound of drums. Military band coming,ChuckGrassley,Chuck Grassley,Iowa,Republican
1563,Wed Sep 23 12:26:51 +0000 2015,6.46662E+17,4,8,The home of American Presidents  Property of US Taxpayersc https://t.co/8G5Ff4PWT0,ChuckGrassley,Chuck Grassley,Iowa,Republican
1564,Wed Sep 23 12:14:34 +0000 2015,6.46659E+17,14,205,Another whitehouse person just wiped dew off podium,ChuckGrassley,Chuck Grassley,Iowa,Republican
1565,Wed Sep 23 12:13:19 +0000 2015,6.46659E+17,27,443,Somebody fr whitehouse just chkd sound system for pope  visit.  The gentleman  correctly counted 1to 10 and did it loudly,ChuckGrassley,Chuck Grassley,Iowa,Republican
1566,Wed Sep 23 11:57:48 +0000 2015,6.46655E+17,27,166,U might not believe this but Repulicans talking to democrats and house members talking to Senators  while waiting for Francis,ChuckGrassley,Chuck Grassley,Iowa,Republican
1567,Wed Sep 23 11:50:07 +0000 2015,6.46653E+17,6,129,White House furnished towels to wipe dew off chairs,ChuckGrassley,Chuck Grassley,Iowa,Republican
1568,Wed Sep 23 11:29:10 +0000 2015,6.46647E+17,3,5,Red carpet is podium where Obama and pope will speak https://t.co/K2wPak0pRp,ChuckGrassley,Chuck Grassley,Iowa,Republican
1569,Wed Sep 23 11:28:50 +0000 2015,6.46647E+17,4,10,"Congressman Rick Nolan, MN and I joined the Congress together in 1974. He and I are the only two… https://t.co/Y0TXDGiMjj",ChuckGrassley,Chuck Grassley,Iowa,Republican
1570,Wed Sep 23 11:18:10 +0000 2015,6.46645E+17,4,7,"This pix just 1/3 of bleachers filled at 7am to see pope. I think u get the ""idea"" https://t.co/yU1PJe8ywQ",ChuckGrassley,Chuck Grassley,Iowa,Republican
1571,Wed Sep 23 11:08:35 +0000 2015,6.46642E+17,5,11,Seated on whitehouse lawn at 7am. Pope arrived 9am.,ChuckGrassley,Chuck Grassley,Iowa,Republican
1572,Wed Sep 23 10:45:13 +0000 2015,6.46636E+17,5,15,Seeing Pope Francis will be my second w a pope. First was Pope John Paul at White House after he was in Iowa 35 yrs ago,ChuckGrassley,Chuck Grassley,Iowa,Republican
1573,Wed Sep 23 10:41:29 +0000 2015,6.46635E+17,4,9,Several senators and spouses on bus to White House to greet Pope Francis We will cool heels for two hrs on lawn til ceremony,ChuckGrassley,Chuck Grassley,Iowa,Republican
1574,Thu Sep 17 12:08:34 +0000 2015,6.44483E+17,33,123,6.14 miles this morn from Home 2 Dome for my bday. 1 hr 23 mins. Left at 4:15AM http://t.co/TukSOe6sIE,ChuckGrassley,Chuck Grassley,Iowa,Republican
1575,Thu Sep 17 09:54:07 +0000 2015,6.44449E+17,11,27,Time and distance on my 82nd birthday run from home to the dome https://t.co/KNUYA1tLP2,ChuckGrassley,Chuck Grassley,Iowa,Republican
1576,Wed Sep 16 15:10:41 +0000 2015,6.44167E+17,4,9,Congratulations to my grandson @patgrassley for his appointment to Chairman of Iowa House of Representatives Appropriations Committee,ChuckGrassley,Chuck Grassley,Iowa,Republican
1577,Tue Sep 15 15:47:01 +0000 2015,6.43813E+17,1,3,Sorry to miss Eastern Iowa honor flight vets at WWII memrl due to their bus trouble. Thank you for… https://t.co/6DgJNk3lo8,ChuckGrassley,Chuck Grassley,Iowa,Republican
1578,Mon Sep 14 19:58:27 +0000 2015,6.43514E+17,6,2,"Spoke this AM about importance of whistleblowers at UNI American Democracy Project. ~ 45 ppl lots of Good Qs state sen Danielsen spoke, too",ChuckGrassley,Chuck Grassley,Iowa,Republican
1579,Mon Sep 14 19:12:18 +0000 2015,6.43503E+17,0,2,It was an honor to present Gary Fisher a 12 year certificate for 12 years of Loyal Service to the… https://t.co/Nq7W92YQww,ChuckGrassley,Chuck Grassley,Iowa,Republican
1580,Mon Sep 14 17:03:48 +0000 2015,6.4347E+17,0,3,Congratulations to Dunlap International of Central City  they received the President's E-award with… https://t.co/j1QGu17TvI,ChuckGrassley,Chuck Grassley,Iowa,Republican
1581,Mon Sep 14 16:08:02 +0000 2015,6.43456E+17,0,7,Highlighting Iowa innovation today as 27 people attend award ceremony for @iaaccelerator w/… https://t.co/8Ky60vPAab,ChuckGrassley,Chuck Grassley,Iowa,Republican
1582,Sun Sep 13 15:51:57 +0000 2015,6.4309E+17,3,27,Gov Walker visited my cedar falls church 2day just like in 1976 I visited Plainfield Baptist Church… https://t.co/otKxWt6ZTX,ChuckGrassley,Chuck Grassley,Iowa,Republican
1583,Sun Sep 13 11:44:23 +0000 2015,6.43027E+17,4,101,Everyone asks if I want the Cyclones or the Hawks -- they're always shocked when I say the Panthers. http://t.co/Eq9QIqTKlM,ChuckGrassley,Chuck Grassley,Iowa,Republican
1584,Sat Sep 12 02:56:55 +0000 2015,6.42532E+17,24,19,Syrian refugees happen when Obama draws a line in the sand as he did w Assad and the line was crossed and there were no consequences,ChuckGrassley,Chuck Grassley,Iowa,Republican
1585,Fri Sep 11 09:07:06 +0000 2015,6.42263E+17,23,55,On this day we should honor Emergency Personnel who gave lives helping 9/11 tragedy and be ever vigilant never happen again Terrorism real,ChuckGrassley,Chuck Grassley,Iowa,Republican
1586,Fri Sep 11 09:00:37 +0000 2015,6.42261E+17,308,366,"14yrs ago terrorists attacked killing 3000 of us Like 12/7/41""lives in infamy"" so will 9/11 2dayJapanese friendly Jihadists want kill us",ChuckGrassley,Chuck Grassley,Iowa,Republican
1587,Thu Sep 10 21:19:48 +0000 2015,6.42085E+17,15,4,Go to my website and check out my speech on Obama Iran nuke deal. I give reasons why I’m not supporting. You can watch video or read text,ChuckGrassley,Chuck Grassley,Iowa,Republican
1588,Sun Sep 06 22:09:17 +0000 2015,6.40648E+17,4,17,"LaborDay2015""61/'71 I worked WaterlooRegister  My IntlAssocOfMachinists membership #AD56032 CliffordHubbard sign as Fin'lSec FirststampFeb62",ChuckGrassley,Chuck Grassley,Iowa,Republican
1589,Sun Sep 06 01:17:28 +0000 2015,6.40333E+17,4,15,"At Iowa State UNI game  I'm w ""Cy"" https://t.co/WdkVQAUoZ1",ChuckGrassley,Chuck Grassley,Iowa,Republican
1590,Sun Sep 06 01:07:36 +0000 2015,6.4033E+17,6,4,Just posted a photo https://t.co/fWJLSl85vo,ChuckGrassley,Chuck Grassley,Iowa,Republican
1591,Sat Sep 05 01:46:11 +0000 2015,6.39978E+17,0,2,Kentucky win over UNI 3/1.,ChuckGrassley,Chuck Grassley,Iowa,Republican
1592,Sat Sep 05 01:16:20 +0000 2015,6.3997E+17,0,2,Set 3 Kentucky ovr UNI 25/19,ChuckGrassley,Chuck Grassley,Iowa,Republican
1593,Sat Sep 05 00:37:30 +0000 2015,6.39961E+17,1,3,Set 2 UNI over tenth ranked Kentucky 27/25,ChuckGrassley,Chuck Grassley,Iowa,Republican
1594,Sat Sep 05 00:02:52 +0000 2015,6.39952E+17,1,4,Ranked 10 Kentucky win over UNI 25/20 first set,ChuckGrassley,Chuck Grassley,Iowa,Republican
1595,Fri Sep 04 23:36:38 +0000 2015,6.39945E+17,2,7,The brains behind successful UNI volleyball era. Coach Bobbi Peterson and asst coach Kalani Maha https://t.co/waI15dZ9Cs,ChuckGrassley,Chuck Grassley,Iowa,Republican
1596,Fri Sep 04 23:00:37 +0000 2015,6.39936E+17,1,2,USC over Creighton 3/0 in match,ChuckGrassley,Chuck Grassley,Iowa,Republican
1597,Fri Sep 04 22:38:40 +0000 2015,6.39931E+17,4,14,Creighton has 3players fr Iowa USC has no Iowans on their team Kentucky has 2iowans who are stars All UNI players are fr Iowa save 4,ChuckGrassley,Chuck Grassley,Iowa,Republican
1598,Fri Sep 04 22:33:38 +0000 2015,6.39929E+17,0,1,Creighton early recovery didn't last long bc they lose 2nd set to USC 25/16.,ChuckGrassley,Chuck Grassley,Iowa,Republican
1599,Fri Sep 04 22:04:14 +0000 2015,6.39922E+17,0,4,At UNI Creighton loses to USC first set 25/17,ChuckGrassley,Chuck Grassley,Iowa,Republican
1600,Fri Sep 04 21:22:48 +0000 2015,6.39912E+17,1,7,2day Volleyball season starts. This wkend at UNI  Creighton/SoCal Kentucky/UNI and Saturday Kentucky/USC Creighton/UNI Creighton/KU USC/UNI,ChuckGrassley,Chuck Grassley,Iowa,Republican
1601,Fri Aug 28 21:56:19 +0000 2015,6.37383E+17,3,3,#99countymeetings meeting with people at Medical Associates in Dubuque.  48 ppl in attendance.… https://t.co/dKcNT95jKx,ChuckGrassley,Chuck Grassley,Iowa,Republican
1602,Fri Aug 28 01:34:26 +0000 2015,6.37076E+17,9,74,"""Ducked"" into Mallard on my way back from NW Iowa. assume duck not alive. https://t.co/tXHwuLkhZJ",ChuckGrassley,Chuck Grassley,Iowa,Republican
1603,Thu Aug 27 23:56:25 +0000 2015,6.37051E+17,1,6,"Dickinson co town meeting, 80 ppl, topics- Iran, voting laws, crop ins., EPA, prison reform, highway bill, ACA, soc sec #99countymeetings",ChuckGrassley,Chuck Grassley,Iowa,Republican
1604,Thu Aug 27 21:33:51 +0000 2015,6.37015E+17,0,6,"Emmet Co town mtg, 49 ppl, topics-EPA, patent laws, Kate's law, edu funding, Iran, abortion, debt, obamacare, soc sec #99countymeetings",ChuckGrassley,Chuck Grassley,Iowa,Republican
1605,Thu Aug 27 19:48:30 +0000 2015,6.36989E+17,3,1,"Palo Alto Co town mtg, 45 ppl, topics- Iran, DOD spending, avian flu, EPA, ethanol, term limits, immig, dep of Ed #99countymeetings",ChuckGrassley,Chuck Grassley,Iowa,Republican
1606,Thu Aug 27 17:54:56 +0000 2015,6.3696E+17,0,3,"Clay co town mtg in Spencer, 35 ppl, topics- soc security, ntl debt, obamacare, Kate's law, ethanol,VA, Iran, military #99countymeetings",ChuckGrassley,Chuck Grassley,Iowa,Republican
1607,Thu Aug 27 15:33:56 +0000 2015,6.36925E+17,0,3,"Pocahontas co mtg, Q&amp;A w 350 students at Pocahontas HS, topics-terrorism, education, planned parenthood, ACA, soc security #99countymeetings",ChuckGrassley,Chuck Grassley,Iowa,Republican
1608,Thu Aug 27 13:30:43 +0000 2015,6.36894E+17,3,18,Iowa wind farmers generate 27% of the state's electricity. Pollution-free energy produced right here… https://t.co/HTAZURv4Ht,ChuckGrassley,Chuck Grassley,Iowa,Republican
1609,Thu Aug 27 13:08:21 +0000 2015,6.36888E+17,3,5,"Cherokee co meeting, 30 ppl, topics- Kate's law, WOTUS, ACA, wind energy, the UN, tax reform, RFS, cybersecurity, Iran #99countymeetings",ChuckGrassley,Chuck Grassley,Iowa,Republican
1610,Wed Aug 26 22:54:08 +0000 2015,6.36673E+17,0,2,"Town mtg in Le Mars, 62 ppl- RFS, immig, Iran, comm college, ntl debt, cybersecurity, planned parenthood, term limits #99countymeetings",ChuckGrassley,Chuck Grassley,Iowa,Republican
1611,Wed Aug 26 22:27:36 +0000 2015,6.36666E+17,7,7,"Held a very good town meeting in Le Mars, the ice cream capital of the world. Time for some ice cream. https://t.co/Io0iKcgyFc",ChuckGrassley,Chuck Grassley,Iowa,Republican
1612,Wed Aug 26 20:20:32 +0000 2015,6.36634E+17,1,3,"O'Brien co mtg, Q&amp;A w 300 Students at South O'Brien HS. Topics being a Sen, ntl debt, avian flu, gay marriage, marijuana #99countymeetings",ChuckGrassley,Chuck Grassley,Iowa,Republican
