,created_at,id_str,reply_count,retweet_count,text,user,name,state,party
2241,Mon Nov 03 17:53:33 +0000 2014,5.29331E+17,4,2,Q&amp;A at UnityPoint at Home Health in Urbandale. 45 employees. Questions about Medicare.,ChuckGrassley,Chuck Grassley,Iowa,Republican
2242,Sun Nov 02 19:30:43 +0000 2014,5.28993E+17,2,7,CedarFalls StTimothy MeChurch had a nice candle lighting service for decease of 2014 thanks to pastorWendi for recognizing my sistrBunny,ChuckGrassley,Chuck Grassley,Iowa,Republican
2243,Sun Nov 02 02:07:35 +0000 2014,5.2873E+17,1,3,4th set UNI over Wichita st 25/22. UNI win match,ChuckGrassley,Chuck Grassley,Iowa,Republican
2244,Sun Nov 02 01:34:48 +0000 2014,5.28722E+17,0,2,UNI over Wichita st 25/23 third set,ChuckGrassley,Chuck Grassley,Iowa,Republican
2245,Sun Nov 02 01:02:38 +0000 2014,5.28714E+17,1,3,UNI loses 25/20 second set to Wichita st,ChuckGrassley,Chuck Grassley,Iowa,Republican
2246,Sun Nov 02 01:01:55 +0000 2014,5.28714E+17,1,9,After I saw UNI beat Illinois st 42/28 in football I came to gym to see UNI volleyball.  UNI over Wichita st first set I didn't see,ChuckGrassley,Chuck Grassley,Iowa,Republican
2247,Sat Nov 01 01:30:41 +0000 2014,5.28358E+17,4,6,UNI ovr MoSt 25/23 3 rd set,ChuckGrassley,Chuck Grassley,Iowa,Republican
2248,Sat Nov 01 00:55:05 +0000 2014,5.28349E+17,3,2,MoSt ovr UNI 25/17 set 2,ChuckGrassley,Chuck Grassley,Iowa,Republican
2249,Sat Nov 01 00:29:31 +0000 2014,5.28343E+17,6,1,UNI over MoSt 25/16 first set,ChuckGrassley,Chuck Grassley,Iowa,Republican
2250,Fri Oct 17 17:08:35 +0000 2014,5.23159E+17,4,8,Congrats to AmbKenQuinn &amp;John Ruahfor outstanding 3day program at DesMoines World Food Prize honoring this year Prize winner Sanjaya Rajaram,ChuckGrassley,Chuck Grassley,Iowa,Republican
2251,Wed Oct 15 18:17:03 +0000 2014,5.22451E+17,2,5,"Nice job... CedarFalls businesses // just named the 2014 eCity for Iowa for the ""strongest online business community"" in Iowa",ChuckGrassley,Chuck Grassley,Iowa,Republican
2252,Wed Oct 15 13:34:54 +0000 2014,5.2238E+17,1,2,"Come to CedarFalls Main St business ""Scratch Cupcakery""  where Mayor Crews will receive google eCity of Iowa award at 10 am",ChuckGrassley,Chuck Grassley,Iowa,Republican
2253,Wed Oct 15 13:30:41 +0000 2014,5.22379E+17,2,3,Today at 10am CedarFalls Iowa will be recognized by google as the 2014 eCity of Iowa!,ChuckGrassley,Chuck Grassley,Iowa,Republican
2254,Tue Oct 14 02:25:39 +0000 2014,5.21849E+17,5,6,Visited GreatAmerica Financial Services in Cedar Rapids. Toured and Q&amp;A with employees,ChuckGrassley,Chuck Grassley,Iowa,Republican
2255,Sun Oct 12 14:01:38 +0000 2014,5.213E+17,4,11,Last nite volleyball victory of UNI ovr So Illinois was 1000 win in 40yrs of sport,ChuckGrassley,Chuck Grassley,Iowa,Republican
2256,Sun Oct 12 01:26:32 +0000 2014,5.2111E+17,0,4,UNI over So Illinois 3/0 to win match,ChuckGrassley,Chuck Grassley,Iowa,Republican
2257,Sun Oct 12 00:56:42 +0000 2014,5.21102E+17,1,3,UNI ovr So Illinois 25/18 2nd set,ChuckGrassley,Chuck Grassley,Iowa,Republican
2258,Sun Oct 12 00:30:02 +0000 2014,5.21095E+17,1,2,UNI ovr SoIllinois first set 25/16,ChuckGrassley,Chuck Grassley,Iowa,Republican
2259,Sat Oct 11 01:22:03 +0000 2014,5.20746E+17,2,5,UNI beats Evansville 3/0 match,ChuckGrassley,Chuck Grassley,Iowa,Republican
2260,Sat Oct 11 00:55:20 +0000 2014,5.20739E+17,2,2,UNI ovr Evansville 25/12 second set,ChuckGrassley,Chuck Grassley,Iowa,Republican
2261,Sat Oct 11 00:34:42 +0000 2014,5.20734E+17,1,2,UNI volley ball over Evansville in set one 25/19,ChuckGrassley,Chuck Grassley,Iowa,Republican
2262,Wed Oct 08 16:35:38 +0000 2014,5.19889E+17,19,30,"410 students. Johnston HS Q&amp;A. Marijuana, Ebola, ISIS, student debt, immigration, VAWA, student aid, etc.",ChuckGrassley,Chuck Grassley,Iowa,Republican
2263,Wed Oct 08 16:32:22 +0000 2014,5.19888E+17,4,4,"Met w 19 Military Retirees at Mcdonalds in Urbandale. Q&amp;A DOD $$, retirement issues, voter ID, budget, civics edu",ChuckGrassley,Chuck Grassley,Iowa,Republican
2264,Mon Oct 06 20:39:05 +0000 2014,5.19225E+17,3,10,Honored 2B recognized today by IA Child Advocacy Bd for work on behalf of foster youth. Need to find these kids a PERMANENT HOME,ChuckGrassley,Chuck Grassley,Iowa,Republican
2265,Mon Sep 29 15:47:55 +0000 2014,5.16615E+17,6,9,"Just had tour and info on world's largest3D printer at UNI CedarValley Techworks in Waterloo It is all abt""advanced manufacturing""",ChuckGrassley,Chuck Grassley,Iowa,Republican
2266,Sat Sep 27 18:50:58 +0000 2014,5.15937E+17,0,7,Enjoyed speaking to fall class of new inductees into ScottishRite Masonry at DesMoines Consistory,ChuckGrassley,Chuck Grassley,Iowa,Republican
2267,Sat Sep 27 15:50:54 +0000 2014,5.15891E+17,14,6,Walked Farmer'sMkt DesMoines for 2 1/2 hrs this morn to talk w any constituent who has Qs  I enjoyed talk w all,ChuckGrassley,Chuck Grassley,Iowa,Republican
2268,Thu Sep 25 02:37:42 +0000 2014,5.14967E+17,5,5,IowaSt wins match 3/2 ovr UNI,ChuckGrassley,Chuck Grassley,Iowa,Republican
2269,Thu Sep 25 02:17:13 +0000 2014,5.14962E+17,2,4,4th set UNI ovr IowaSt 25/16,ChuckGrassley,Chuck Grassley,Iowa,Republican
2270,Thu Sep 25 01:52:23 +0000 2014,5.14956E+17,6,21,I will be at prof Oakland 's classes tomorrow 930 1100 and 215  come and ask Qs U set agenda  it's education college,ChuckGrassley,Chuck Grassley,Iowa,Republican
2271,Thu Sep 25 01:47:28 +0000 2014,5.14954E+17,0,3,3rd set UNI ovr IowaSt 25/19,ChuckGrassley,Chuck Grassley,Iowa,Republican
2272,Thu Sep 25 01:10:08 +0000 2014,5.14945E+17,0,1,2nd set IowaSt ovr UNI 28/26,ChuckGrassley,Chuck Grassley,Iowa,Republican
2273,Thu Sep 25 00:35:29 +0000 2014,5.14936E+17,1,2,First set IowaSt ovr UNI 25/21,ChuckGrassley,Chuck Grassley,Iowa,Republican
2274,Wed Sep 24 23:45:35 +0000 2014,5.14924E+17,3,7,Tonite. IowaSt v UNI  volleyball IowaSt players Bigbee and Kuhrt played Sixpack club ball my son jay has coached for 21 yrs,ChuckGrassley,Chuck Grassley,Iowa,Republican
2275,Wed Sep 24 16:00:30 +0000 2014,5.14807E+17,1,3,Just had nice chat w the king of conservative talk show hosts Jan Mickelson at WHO studio for 30 min,ChuckGrassley,Chuck Grassley,Iowa,Republican
2276,Wed Sep 24 09:07:05 +0000 2014,5.14703E+17,3,6,WStJournal reports GenHolder compliments whistleblower reporting SEC fraud got 30m$ I hope he will encourage IRS to speed up such awards,ChuckGrassley,Chuck Grassley,Iowa,Republican
2277,Sun Sep 21 19:03:55 +0000 2014,5.13766E+17,5,19,"WStJournal reports PresObama is going to ""manage"" air strikes in Syria When LBJ did that in Vietnam it was disastrous",ChuckGrassley,Chuck Grassley,Iowa,Republican
2278,Sun Sep 21 02:03:05 +0000 2014,5.13509E+17,1,2,UNI ovr. Bradley 3/1 to win match,ChuckGrassley,Chuck Grassley,Iowa,Republican
2279,Sun Sep 21 01:40:22 +0000 2014,5.13503E+17,0,2,Bradley ovr UNI 27/25 in 3rd game,ChuckGrassley,Chuck Grassley,Iowa,Republican
2280,Sun Sep 21 01:00:29 +0000 2014,5.13493E+17,1,1,27/25 UNI over Bradley 2nd game,ChuckGrassley,Chuck Grassley,Iowa,Republican
2281,Sun Sep 21 00:32:22 +0000 2014,5.13486E+17,1,8,Final UNI football 46/7  that's game I left to come to volley ball,ChuckGrassley,Chuck Grassley,Iowa,Republican
2282,Sun Sep 21 00:29:57 +0000 2014,5.13485E+17,4,5,1st game UNI ovr Bradley 25/15. That's women volleyball,ChuckGrassley,Chuck Grassley,Iowa,Republican
2283,Sat Sep 20 23:43:45 +0000 2014,5.13474E+17,4,12,I'm leaving end of 3rd qtr.  UNI ahead 39/7 NoColo.   Going to UNI volleyball,ChuckGrassley,Chuck Grassley,Iowa,Republican
2284,Sat Sep 20 22:36:30 +0000 2014,5.13457E+17,2,2,Half.   UNI ovr NoColo 36/0,ChuckGrassley,Chuck Grassley,Iowa,Republican
2285,Sat Sep 20 21:59:12 +0000 2014,5.13447E+17,4,1,UNI adds two pts fr blocked kick safety,ChuckGrassley,Chuck Grassley,Iowa,Republican
2286,Sat Sep 20 21:51:36 +0000 2014,5.13445E+17,0,3,2nd qtr begins UNI ovr NoColo 13//0,ChuckGrassley,Chuck Grassley,Iowa,Republican
2287,Sat Sep 20 21:30:19 +0000 2014,5.1344E+17,2,6,UNI over No Colo 10/0 after 8min,ChuckGrassley,Chuck Grassley,Iowa,Republican
2288,Sat Sep 20 01:32:41 +0000 2014,5.13139E+17,4,3,UNI wins match ovrl Loyola 3/0,ChuckGrassley,Chuck Grassley,Iowa,Republican
2289,Sat Sep 20 01:13:22 +0000 2014,5.13134E+17,5,14,UNI ovr Loyola 2nd game 25/15. Women of course,ChuckGrassley,Chuck Grassley,Iowa,Republican
2290,Sat Sep 20 00:38:27 +0000 2014,5.13125E+17,2,2,UNI over Loyola first game 25/20,ChuckGrassley,Chuck Grassley,Iowa,Republican
2291,Fri Sep 19 23:50:22 +0000 2014,5.13113E+17,22,45,In twenty min I will be tweeting UNI v Loyola volley ball  women of course,ChuckGrassley,Chuck Grassley,Iowa,Republican
2292,Fri Sep 19 02:06:32 +0000 2014,5.12785E+17,6,33,Sorry Agatha I misspelled your name in last Tweet. Thx Agatha Fenech of Cedar Falls 4 work 2 educate ppl abt where food comes from,ChuckGrassley,Chuck Grassley,Iowa,Republican
2293,Thu Sep 18 22:57:23 +0000 2014,5.12737E+17,3,8,"Thx 2 Agatha French youth ambassador 4 natl child awareness month for helping educate ppl abt where food comes from She's frm Cedar Falls,IA",ChuckGrassley,Chuck Grassley,Iowa,Republican
2294,Thu Sep 18 22:57:06 +0000 2014,5.12737E+17,2,4,Appreciate Jack Kinseth of west Des Moines who is promoting civics education in HS. Helps fellow citizens understand our participatory govt,ChuckGrassley,Chuck Grassley,Iowa,Republican
2295,Wed Sep 17 13:57:20 +0000 2014,5.12239E+17,50,218,U.S. Capitol after this am 6.21 mi run. Happy Constitution Day http://t.co/LcB62FkdSs,ChuckGrassley,Chuck Grassley,Iowa,Republican
2296,Wed Sep 17 12:34:12 +0000 2014,5.12218E+17,20,69,"I celebrated my birthday w 6.21 mile-run  I call the ""Home to the Dome"" run  I do once yr  otherwise just run 3miles a day",ChuckGrassley,Chuck Grassley,Iowa,Republican
2297,Wed Sep 17 12:30:18 +0000 2014,5.12217E+17,9,45,Ran 6.21 mi fr my house to Senate this AM Running to U S Capitol is good way to appreciate Constitution's bday Gr8 way to start day,ChuckGrassley,Chuck Grassley,Iowa,Republican
2298,Mon Sep 15 13:30:59 +0000 2014,5.11507E+17,8,21,Since I hv used 30  as the number of terrorist plots in US since 9/11 I stand corrected by CongResearchService numbr 70. Sorry to Iowans,ChuckGrassley,Chuck Grassley,Iowa,Republican
2299,Mon Sep 15 01:52:19 +0000 2014,5.11332E+17,84,87,When Pres Obama says I hv pen and ph if Congress won't I will he's like the Roosevelts he considers Constitution a nuisance,ChuckGrassley,Chuck Grassley,Iowa,Republican
2300,Thu Sep 11 20:00:23 +0000 2014,5.10156E+17,9,15,tragic events of 9/11 R etched in mind thx 2 1st responders &amp; all protecting freedom 2this day Never forget those who gve ultimate sacrifice,ChuckGrassley,Chuck Grassley,Iowa,Republican
2301,Fri Sep 05 14:18:02 +0000 2014,5.07895E+17,4,5,Van of WHO Van and Bonnie show I had an enjoyable 4hrs being Bonnie pro tem  Thanks for asking me.,ChuckGrassley,Chuck Grassley,Iowa,Republican
2302,Fri Sep 05 13:05:40 +0000 2014,5.07877E+17,6,4,Hav 1 more hr WHO on Van and Bonnie.,ChuckGrassley,Chuck Grassley,Iowa,Republican
2303,Fri Sep 05 10:55:12 +0000 2014,5.07844E+17,9,19,I just read the weather for WHO vanand Bonnie.  Remember weather forecasting is right only 80% of time,ChuckGrassley,Chuck Grassley,Iowa,Republican
2304,Fri Sep 05 10:07:41 +0000 2014,5.07832E+17,6,83,"I brought ice cream for bfast for Van and me as ""Bonnie""",ChuckGrassley,Chuck Grassley,Iowa,Republican
2305,Fri Sep 05 09:39:56 +0000 2014,5.07825E+17,5,18,"5am to 9 am I'm going to be ""Bonnie""  on WHO ""Van And Bonnie"" show  Bonnie on vacation",ChuckGrassley,Chuck Grassley,Iowa,Republican
2306,Thu Sep 04 20:48:30 +0000 2014,5.07631E+17,1,2,Toured IA Veterans Home in Marshalltown to be brought up to speed on renovations Also answered Qs from vets throughout tour,ChuckGrassley,Chuck Grassley,Iowa,Republican
2307,Thu Sep 04 18:50:01 +0000 2014,5.07601E+17,0,12,"Tour Renewable Energy Group Ames &amp; Q&amp;A w 105 employees Topics-biodiesel, immig, Social Security, ISIS, budget. REG isVery innovative company",ChuckGrassley,Chuck Grassley,Iowa,Republican
2308,Thu Sep 04 15:15:09 +0000 2014,5.07547E+17,1,4,ISU 1 of 10 chosen to host seminar b/c of excellent cyber security education prgm,ChuckGrassley,Chuck Grassley,Iowa,Republican
2309,Thu Sep 04 15:14:08 +0000 2014,5.07547E+17,2,7,This AM gave update on judiciary comm work on cyber security at seminar 2 educate consumers &amp; biz at Iowa State Univ. Speech on my website,ChuckGrassley,Chuck Grassley,Iowa,Republican
2310,Thu Sep 04 13:43:49 +0000 2014,5.07524E+17,2,5,Q&amp;A w 37 ppl Ames Chamber of commerce good discussion abt natl and local issues + university,ChuckGrassley,Chuck Grassley,Iowa,Republican
2311,Wed Sep 03 22:09:51 +0000 2014,5.07289E+17,2,1,"Jefferson town mtg 55 people Topics-EPA regs, immigration, sequestration, ISIS, Fast &amp; Furious, whistleblowing, IRS, Benghazi, Iraq, Syria",ChuckGrassley,Chuck Grassley,Iowa,Republican
2312,Wed Sep 03 22:01:34 +0000 2014,5.07287E+17,17,43,"Just finished the ""full Grassley "" tour of 99 county meetings for 34th yr in row w the town meeting in  Jefferson  55 ppl attended",ChuckGrassley,Chuck Grassley,Iowa,Republican
2313,Wed Sep 03 20:16:49 +0000 2014,5.07261E+17,2,2,"Q&amp;A w 96 students Carroll high School Topics-partisanship, college aid, gangs, Hobby Lobby, school funding, ISIS, guns, legislative process",ChuckGrassley,Chuck Grassley,Iowa,Republican
2314,Wed Sep 03 18:16:53 +0000 2014,5.07231E+17,1,3,"Denison Town Mtg w 37 ppl Topics-immigration, EPA, highways, Keystone, ISIS, VA, exec orders, min wage, farm bill, tax reform, GMOs",ChuckGrassley,Chuck Grassley,Iowa,Republican
2315,Wed Sep 03 15:51:15 +0000 2014,5.07194E+17,2,1,"Q&amp;A w 84 students West Monona HS Topics-guns, farm prices, Obamacare, Welfare, marijuana, same sex marriage, school funding, ISIS",ChuckGrassley,Chuck Grassley,Iowa,Republican
2316,Wed Sep 03 13:59:24 +0000 2014,5.07166E+17,3,2,"Q&amp;A, tour w 185th Air Refueling Wing Sioux City 300 ppl Topics-Tricare, sequestration, fitness, Social Security, immigration, natl debt",ChuckGrassley,Chuck Grassley,Iowa,Republican
2317,Tue Sep 02 22:03:48 +0000 2014,5.06925E+17,4,9,"Holstein town mtg 28 ppl Topics-Social Security, immig, ethanol, Middle East, EPA regs, coal, wind energy, ISIS, highways, VA, electric cars",ChuckGrassley,Chuck Grassley,Iowa,Republican
2318,Tue Sep 02 21:47:29 +0000 2014,5.06921E+17,3,4,"Q&amp;A, tour w 32 ppl RJ Thomas Manuf. Cherokee Topics-Tyson plant closing, Reid obstruction, immig, ISIS, Middle East, Ukraine, natl security",ChuckGrassley,Chuck Grassley,Iowa,Republican
2319,Tue Sep 02 18:30:51 +0000 2014,5.06872E+17,2,5,"Q&amp;A w Storm Lake Rotary 29 ppl most Rotary mtg Qs focus on policy This time policy was immig otherwise Qs abt start in politics, 99 cty mtgs",ChuckGrassley,Chuck Grassley,Iowa,Republican
2320,Tue Sep 02 16:27:13 +0000 2014,5.06841E+17,2,6,"Odebolt town mtg 37 ppl Topics-Benghazi, Citizens United, ISIS, EPA regs, VA, hydrogen, student loans, RFS, young farmer program",ChuckGrassley,Chuck Grassley,Iowa,Republican
2321,Tue Sep 02 14:37:53 +0000 2014,5.06813E+17,1,4,"Rockwell City town mtg 49ppl Topics-iA pipeline, immig, VA, inversions, ChildCustody, cancer rsch, sec 179, EPA, debt, ForeignAid, IRS, ISIS",ChuckGrassley,Chuck Grassley,Iowa,Republican
2322,Wed Aug 27 19:45:39 +0000 2014,5.04716E+17,5,4,Toured Grandview Christian School in DesMoines Met several classes and attended faculty meeting of 37,ChuckGrassley,Chuck Grassley,Iowa,Republican
2323,Tue Aug 26 02:29:05 +0000 2014,5.04093E+17,11,28,Spoke at field day for Iowa Corn Growers near Dunkerton  Message: 2% of US grow food for 98% That 2% big job to Xplain farming to city ppl,ChuckGrassley,Chuck Grassley,Iowa,Republican
2324,Tue Aug 26 02:15:59 +0000 2014,5.0409E+17,1,7,Bfast w Pro Wayne Svoboda CUNY School of Journalism  First conversation since he covered me in 1980 for DesMoines Reg,ChuckGrassley,Chuck Grassley,Iowa,Republican
2325,Mon Aug 25 00:31:04 +0000 2014,5.03701E+17,5,14,Over 600 ppl came to centennial of JewishFederation of Greater DesMoines   Actor Richard Dreyfus was speaker,ChuckGrassley,Chuck Grassley,Iowa,Republican
2326,Thu Aug 21 00:34:58 +0000 2014,5.02252E+17,4,3,Today we did 44miles onSandhill Journey It was a windshield tour of famous Sandhills of Nebr hiway 2 To farm tomorrow &amp; town meetings,ChuckGrassley,Chuck Grassley,Iowa,Republican
2327,Tue Aug 19 23:13:45 +0000 2014,5.0187E+17,8,7,Our last stop today was Devil'sTower   Quite geological rarity. NativeAmericans considered it and black hills sacred,ChuckGrassley,Chuck Grassley,Iowa,Republican
2328,Tue Aug 19 18:20:21 +0000 2014,5.01796E+17,7,75,"BTW we saw half Iowa vacationing in SoDak. So to b truthful it's nice to hv Iowans come up and say""r u chuck Grassley "" when u not in suit",ChuckGrassley,Chuck Grassley,Iowa,Republican
2329,Tue Aug 19 17:55:39 +0000 2014,5.0179E+17,9,57,We r in Hulett Wy eating and viewing biggies collection off Wild Bill Hickok at a museum by that name This was not a stop on honeymoon,ChuckGrassley,Chuck Grassley,Iowa,Republican
2330,Tue Aug 19 00:57:44 +0000 2014,5.01533E+17,11,26,After MtRushmore mrs G and I went to Crazy Horse monument Started in 1948 u can now see head of Chief When finished it will be worldLargest,ChuckGrassley,Chuck Grassley,Iowa,Republican
2331,Tue Aug 19 00:49:58 +0000 2014,5.01531E+17,9,11,Continuing revisit of honeymoon trip after 60yrs Rushmore faces same but environs improved beyond xpectation  Foundation is gr8 nonprofit,ChuckGrassley,Chuck Grassley,Iowa,Republican
2332,Mon Aug 18 19:56:18 +0000 2014,5.01458E+17,5,10,Our visit to Mitchell SD took us also to Sen Geo McGovern Library. It was closed wkends. So barb and I just took our picture beside GeoStatu,ChuckGrassley,Chuck Grassley,Iowa,Republican
2333,Mon Aug 18 01:05:09 +0000 2014,5.01173E+17,6,8,"WallStJournal ""we union members oppose new(EPA )anti carbon rules that will cost jobs and endanger the grid"" That is electric workers union",ChuckGrassley,Chuck Grassley,Iowa,Republican
2334,Mon Aug 18 00:00:24 +0000 2014,5.01157E+17,6,17,60th anniversary.  Now at famous Wall Drug Wall SD,ChuckGrassley,Chuck Grassley,Iowa,Republican
2335,Sun Aug 17 21:43:39 +0000 2014,5.01122E+17,18,140,Like we did 60 yrs ago on honeymoon we visited Mitchell SD famous CornPalace The corn murals were many more than in '54  and jus as butiful,ChuckGrassley,Chuck Grassley,Iowa,Republican
2336,Sun Aug 17 19:52:23 +0000 2014,5.01094E+17,13,18,Retracing our honeymoon of 60 yrs  we are now in SoDak Badlands,ChuckGrassley,Chuck Grassley,Iowa,Republican
2337,Thu Aug 14 00:39:08 +0000 2014,4.99717E+17,7,5,"Humboldt town hall w 51 people Topics-immig, voter ID, Obamacare, foreign aid, Israel, Sec179 expensing, Iraq, IRS, min wage, EPA regs",ChuckGrassley,Chuck Grassley,Iowa,Republican
2338,Wed Aug 13 21:19:35 +0000 2014,4.99667E+17,3,9,"Pocahontas town hall w 38 ppl Topics-immig, Congo adoptn, terrorism, Iraq, EPA, debt, welfare, Obamacare, Benghazi, IRS, Reid running Senate",ChuckGrassley,Chuck Grassley,Iowa,Republican
2339,Wed Aug 13 18:28:30 +0000 2014,4.99624E+17,4,4,"Q&amp;A w 46 ppl at Iowa Great Lakes Rotary Topics-Reid impeding House passed bills, Iraq, aiding Kurds, immig, housing, debt, Israel/Hamas",ChuckGrassley,Chuck Grassley,Iowa,Republican
2340,Wed Aug 13 16:49:33 +0000 2014,4.99599E+17,1,5,"Estherville town hall w50 ppl Topics-worry abt Reid/Senate, Ukraine, tax extenders, IRA, coal, Iraq,Syria, immig, military/faith, TermLimits",ChuckGrassley,Chuck Grassley,Iowa,Republican
2341,Wed Aug 13 14:56:16 +0000 2014,4.9957E+17,2,8,Toured cellulosic part of POET Emmetsburg ethanol plant. Had Q&amp;A w 25 employees on what U might expect...ethanol,ChuckGrassley,Chuck Grassley,Iowa,Republican
2342,Tue Aug 12 23:42:54 +0000 2014,4.9934E+17,6,13,"Spencer town hall mtg w 28 ppl Topics-pipeline, electric trans lines, med marijuana, wind energy, immig, Iraq, fast&amp;furious, min wage, debt",ChuckGrassley,Chuck Grassley,Iowa,Republican
2343,Tue Aug 12 21:32:06 +0000 2014,4.99307E+17,6,3,"Sheldon town hall mtg w 32 ppl Topics-  Debt, VA, Bergdahl, Lewis and Clark water, Hamas funding, guns, Obamacare, GMO labeling, immig",ChuckGrassley,Chuck Grassley,Iowa,Republican
2344,Tue Aug 12 19:27:34 +0000 2014,4.99276E+17,3,3,"Sibley Town hall mtg w 36 ppl Topics-inversions, EPA regs, tax hikes?, immig, partisanship, energy, Russia, term limits, common Core",ChuckGrassley,Chuck Grassley,Iowa,Republican
2345,Tue Aug 12 17:32:49 +0000 2014,4.99247E+17,3,4,"Rock Rapids Town Hall mtg w 46 ppl Topics-EPA regs, IRS, immigration, Common Core, Lewis and Clark, Iraq, pipeline",ChuckGrassley,Chuck Grassley,Iowa,Republican
2346,Tue Aug 12 15:24:15 +0000 2014,4.99215E+17,2,4,"Sioux Center town hall mtg w 49 ppl Topics-immigration, Obamacare, Lewis and Clark, EPA regs, min wage, Israel/Hamas",ChuckGrassley,Chuck Grassley,Iowa,Republican
2347,Tue Aug 12 13:33:17 +0000 2014,4.99187E+17,6,4,"Q&amp;A w Le Mars Kiwanis 29 ppl Topics-natl debt, immig, marijuana, partisanship, Iraq, VA, 2016 president election",ChuckGrassley,Chuck Grassley,Iowa,Republican
2348,Tue Aug 12 01:41:05 +0000 2014,4.99008E+17,6,10,I'm in Lemars Iowa overnite to do 10county meetings in NW Iowa Tues&amp;Wed. After this wk I will hv 11counties to finish 99counties for 34th yr,ChuckGrassley,Chuck Grassley,Iowa,Republican
2349,Mon Aug 11 23:34:45 +0000 2014,4.98976E+17,5,12,I talked w Dan Looker Successful Farming at farm abt crops on Grassley farm see iview at http://t.co/Cp81zv9DPf,ChuckGrassley,Chuck Grassley,Iowa,Republican
2350,Sun Aug 10 21:46:36 +0000 2014,4.98586E+17,3,10,Went to Memorial service for Bob Formanek my HS baseball coach WWII veteran. Life long educator Lots of NewHartford ppl celebrated his life,ChuckGrassley,Chuck Grassley,Iowa,Republican
2351,Sat Aug 09 20:18:16 +0000 2014,4.98202E+17,5,8,Obama Trade Representative Froman visited Iowa State Fair Besides walking fair he had meeting 21 ag leaders for discussion of trade update,ChuckGrassley,Chuck Grassley,Iowa,Republican
2352,Sat Aug 09 14:24:21 +0000 2014,4.98113E+17,8,20,At IA State Fair. Barbara cancer survivor. Works for cancer cure. Don't believe me just as me http://t.co/twrqolCVWv,ChuckGrassley,Chuck Grassley,Iowa,Republican
2353,Sat Aug 09 13:57:57 +0000 2014,4.98106E+17,12,200,Enjoyed seeing butter cow at state fair this morn @whohd http://t.co/Fal85BrTl2,ChuckGrassley,Chuck Grassley,Iowa,Republican
2354,Sat Aug 09 13:46:10 +0000 2014,4.98103E+17,41,227,Famous IA State corn dogs. Great: if you don't believe me just ask me. http://t.co/2OYz0mOon3,ChuckGrassley,Chuck Grassley,Iowa,Republican
2355,Sat Aug 09 13:19:07 +0000 2014,4.98096E+17,33,245,Second day at the IA State Fair. Famous butter cow: if u don't believe it just ask me. http://t.co/ZA2HIrerQm,ChuckGrassley,Chuck Grassley,Iowa,Republican
2356,Sat Aug 09 13:15:07 +0000 2014,4.98095E+17,8,56,Second day at the great Iowa State Fair. Great: if you don't believe it just ask me. http://t.co/SMdroXBCt3,ChuckGrassley,Chuck Grassley,Iowa,Republican
2357,Sat Aug 09 01:04:32 +0000 2014,4.97911E+17,5,7,First of two days at Iowa St Fair Perfect weather resulted in masses attending Had lots of Qs as I walked among constituents,ChuckGrassley,Chuck Grassley,Iowa,Republican
2358,Fri Aug 08 21:54:34 +0000 2014,4.97863E+17,37,212,Update the BIG BOAR 2014 Iowa State Fair http://t.co/4l1I8wngUZ,ChuckGrassley,Chuck Grassley,Iowa,Republican
2359,Wed Aug 06 03:51:41 +0000 2014,4.96866E+17,17,16,Between 2010&amp;2013 the number of terrorist or those w connections to same in the govt data base more than doubled to a million,ChuckGrassley,Chuck Grassley,Iowa,Republican
2360,Tue Aug 05 21:58:27 +0000 2014,4.96777E+17,3,4,"Tour and Q&amp;A at Edgewater Retirement Community 116 ppl Topics-taxes &amp; debt, Medicare, health care reimbursement",ChuckGrassley,Chuck Grassley,Iowa,Republican
2361,Tue Aug 05 19:48:41 +0000 2014,4.96745E+17,2,1,Finished tour and discussion Primary Health Care in Des Moines w  27 patients doctors medical residents about health care policy,ChuckGrassley,Chuck Grassley,Iowa,Republican
2362,Mon Aug 04 16:23:27 +0000 2014,4.96331E+17,8,13,I urge all Americans to take to heart the warnings of 2014 on 10th anniversary of the Terror Comm report 5/5,ChuckGrassley,Chuck Grassley,Iowa,Republican
2363,Mon Aug 04 16:19:05 +0000 2014,4.96329E+17,0,8,"According to WSJ, Terror Comm Chair Kean said “the sense of alarm surprised me. I have not heard this much concern since 9/11” 4/5",ChuckGrassley,Chuck Grassley,Iowa,Republican
2364,Mon Aug 04 16:15:38 +0000 2014,4.96329E+17,2,6,10 yrs ago Terror Comm feared Iraq wd become failed state New report says “that nightmare scenario may now becoming to pass.” 3/5,ChuckGrassley,Chuck Grassley,Iowa,Republican
2365,Mon Aug 04 16:13:14 +0000 2014,4.96328E+17,2,12,Terror Comm sees cybersecurity as major threat which govt needs 2 address 2/5,ChuckGrassley,Chuck Grassley,Iowa,Republican
2366,Mon Aug 04 16:10:52 +0000 2014,4.96327E+17,2,15,Terror Commission say 10 yrs after 1st report US faces more threats&amp; public is complacent &amp; doesn’t realize potential 4 danger 1/5,ChuckGrassley,Chuck Grassley,Iowa,Republican
2367,Mon Aug 04 03:19:37 +0000 2014,4.96133E+17,7,27,10yrs after the 9/11 commission reported members gathered for a review on status&amp;threat of terrorism  Conclusion: worse than expected,ChuckGrassley,Chuck Grassley,Iowa,Republican
2368,Sun Aug 03 20:35:08 +0000 2014,4.96032E+17,24,17,Talk abt income inequality!!Obama'sFedReserve printing$$(creating asset bubble) causing the income inequality Assume Dems approve Heips 1%,ChuckGrassley,Chuck Grassley,Iowa,Republican
2369,Sun Aug 03 20:25:03 +0000 2014,4.96029E+17,66,157,Why not same outrage when Arabs kill Arabs OR ISIS militants killing Christians in Mosul as there is disapproval of Israel defending itself,ChuckGrassley,Chuck Grassley,Iowa,Republican
