,created_at,id_str,reply_count,retweet_count,text,user,name,state,party
0,Thu May 18 16:52:58 +0000 2017,8.65249E+17,15,3,"Good discussion w community leaders from Ames on energy, farm bill, labor, edu, etc https://t.co/28RegYj9tL",ChuckGrassley,Chuck Grassley,Iowa,Republican
1,Wed May 17 18:49:15 +0000 2017,8.64916E+17,34,4,Weekly satellite news conference w Iowa TV reporters https://t.co/DasryX9P4d,ChuckGrassley,Chuck Grassley,Iowa,Republican
2,Wed May 17 12:56:11 +0000 2017,8.64827E+17,30,3,Nate Gruber from Black Hawk Co also a fellow UNI grad https://t.co/rqb9Nnvclv,ChuckGrassley,Chuck Grassley,Iowa,Republican
3,Wed May 17 12:54:07 +0000 2017,8.64826E+17,8,1,Kendall Lamkey is a professor at ISU https://t.co/h3oLGuVBQK,ChuckGrassley,Chuck Grassley,Iowa,Republican
4,Wed May 17 12:52:56 +0000 2017,8.64826E+17,11,3,"Rick Sanders, Story Co Supervisor https://t.co/uRyhPQHn7g",ChuckGrassley,Chuck Grassley,Iowa,Republican
5,Wed May 17 12:52:15 +0000 2017,8.64826E+17,5,4,The Johnson family of West Des Moines https://t.co/HsWPWzyp6M,ChuckGrassley,Chuck Grassley,Iowa,Republican
6,Tue May 16 21:02:34 +0000 2017,8.64587E+17,79,32,@realDonaldTrump good job getting rid of some bad regs Can do alot more good by getting rid of Obama guidance letters in various agencies,ChuckGrassley,Chuck Grassley,Iowa,Republican
7,Tue May 16 18:52:26 +0000 2017,8.64554E+17,66,66,Iowa Lt Gov Kim Reynolds will can become Gov sometime nxt week bc Gov Branstad will be Ambassador Branstad 530 pm Monday,ChuckGrassley,Chuck Grassley,Iowa,Republican
8,Tue May 16 16:56:09 +0000 2017,8.64525E+17,247,82,Branstad vote delay is 1 more perfect example of Dem obstruction Gov Branstad should b in Beijing by now,ChuckGrassley,Chuck Grassley,Iowa,Republican
9,Tue May 16 16:55:19 +0000 2017,8.64525E+17,33,22,Gov Branstad out of Foreign Relations Comm UNANIMOUSLY yet senate has 2 vote 2 stop debate on Branstad bcoming Amb. 2 China,ChuckGrassley,Chuck Grassley,Iowa,Republican
10,Mon May 15 20:57:02 +0000 2017,8.64223E+17,40,7,2/2 The Iowans last yr who gave the ultimate sacrifice are Sgt Beminio Officer Farrell Patrolmen Martin Sgt Miller + Officer Puente-Morales,ChuckGrassley,Chuck Grassley,Iowa,Republican
11,Mon May 15 20:55:45 +0000 2017,8.64223E+17,10,6,2day=Natl Peace Officers Memorial Day honoring law enforcmnt who lost their lives in line of duty protecting us Including 5 Iowa heroes  1/2,ChuckGrassley,Chuck Grassley,Iowa,Republican
12,Mon May 15 15:15:05 +0000 2017,8.64137E+17,24,3,"At U of Iowa grad on Saturday--my former intern, Sofie, addressed the crowd. Very impressive https://t.co/pUEbCjDpeP",ChuckGrassley,Chuck Grassley,Iowa,Republican
13,Sun May 14 16:08:37 +0000 2017,8.63788E+17,43,11,I was interviewed on C-SPAN's Newsmakers this week. Airs again tonight at 5pm CT https://t.co/nSIQfhscJR,ChuckGrassley,Chuck Grassley,Iowa,Republican
14,Sat May 13 23:29:06 +0000 2017,8.63537E+17,44,2,Ran into Murphy + Craig in Cedar Rapids tonight after Shirley's graduation https://t.co/H5w9v1CSxo,ChuckGrassley,Chuck Grassley,Iowa,Republican
15,Sat May 13 19:28:40 +0000 2017,8.63476E+17,47,6,Granddaughter Shirley graduated UofIowa Social Work https://t.co/nUbfZPZRcZ,ChuckGrassley,Chuck Grassley,Iowa,Republican
16,Sat May 13 18:09:44 +0000 2017,8.63456E+17,24,3,Granddaughter Shirley marched to graduation Social Work major . She one 👍 https://t.co/UPkQ8UGITD,ChuckGrassley,Chuck Grassley,Iowa,Republican
17,Sat May 13 17:50:39 +0000 2017,8.63451E+17,16,6,UofIowa commencement my wife mark/Wendy mother in law grandmother in law husband of graduate… https://t.co/CNBwYqScRt,ChuckGrassley,Chuck Grassley,Iowa,Republican
18,Fri May 12 16:51:30 +0000 2017,8.63074E+17,462,432,#POTUS I read tweet abt possibility of stopping WH PressBriefings.  That wld be wrong.   Even We in Senate follow those briefings,ChuckGrassley,Chuck Grassley,Iowa,Republican
19,Fri May 12 16:14:53 +0000 2017,8.63065E+17,63,41,As result of mtg btwn Trump + Pres Xi progress made on getting Ag prods 2China SecyRoss announces agreement on beef +biotech seeds Good 4 ag,ChuckGrassley,Chuck Grassley,Iowa,Republican
20,Fri May 12 15:23:12 +0000 2017,8.63052E+17,36,16,Tmrw is annual letter carriers' stamp out hunger food drive Put nonperishables in mailbox 2give back 2community Thx 2 Iowa Chapter 4 headsup,ChuckGrassley,Chuck Grassley,Iowa,Republican
21,Thu May 11 20:47:27 +0000 2017,8.62771E+17,54,53,Appreciate the recognition from the National Association of Police Organizations for my work in… https://t.co/odLWY1sDd8,ChuckGrassley,Chuck Grassley,Iowa,Republican
22,Thu May 11 16:00:35 +0000 2017,8.62699E+17,50,5,Good mtg on law enforcement issues w the Iowa State Police Association https://t.co/eUsDA9SF8V,ChuckGrassley,Chuck Grassley,Iowa,Republican
23,Wed May 10 23:28:15 +0000 2017,8.62449E+17,78,7,#DMDC2017 Enjoyed talking w members of the Greater Des Moines Partnership at the Canadian… https://t.co/EmmPFKwsCl,ChuckGrassley,Chuck Grassley,Iowa,Republican
24,Wed May 10 20:05:06 +0000 2017,8.62398E+17,49,7,The Iowa ESOP Association https://t.co/hyYTB4Du1i,ChuckGrassley,Chuck Grassley,Iowa,Republican
25,Wed May 10 18:55:38 +0000 2017,8.62381E+17,40,7,Spoke at the 5th National GrandRally supporting grandparents + caregivers who provide for… https://t.co/RYqGpYSFxi,ChuckGrassley,Chuck Grassley,Iowa,Republican
26,Wed May 10 18:36:08 +0000 2017,8.62376E+17,48,12,Had the opportunity to introduce my friend Sen. Tom Cotton at the #DMDC2017 lunch where he… https://t.co/QH267rc2g5,ChuckGrassley,Chuck Grassley,Iowa,Republican
27,Wed May 10 13:11:54 +0000 2017,8.62294E+17,120,7,Answered Qs on student loans + the environment from Iowa School for the Deaf students https://t.co/FuSp2KPnfA,ChuckGrassley,Chuck Grassley,Iowa,Republican
28,Tue May 09 19:09:50 +0000 2017,8.62022E+17,85,7,Canadian Ambassador to U.S. David MacNaughton + Consul General Nasim met with me on trade policy https://t.co/NIcRjkdkrv,ChuckGrassley,Chuck Grassley,Iowa,Republican
29,Tue May 09 16:24:05 +0000 2017,8.6198E+17,49,6,Good discussion w 38 members of the Iowa Hospital Association https://t.co/iTEmHJ3vna,ChuckGrassley,Chuck Grassley,Iowa,Republican
30,Tue May 09 14:54:03 +0000 2017,8.61957E+17,41,11,Administration clarifies for me something important to Iowans: WH tax reform does not tax inside buildup of Life Insurance Nevr been taxed,ChuckGrassley,Chuck Grassley,Iowa,Republican
31,Tue May 09 14:41:41 +0000 2017,8.61954E+17,61,99,Branstad approved by Foreign Relations Comm by voice vote    The vote indicates easy approval on floor.  On to China to do good work for USA,ChuckGrassley,Chuck Grassley,Iowa,Republican
32,Mon May 08 19:55:46 +0000 2017,8.61671E+17,146,16,Gov Branstad is on agenda of Senate Foreign Relations Comm in the next step to be Ambassador to China,ChuckGrassley,Chuck Grassley,Iowa,Republican
33,Sat May 06 02:07:21 +0000 2017,8.60677E+17,92,4,Better picture of previous Tweet https://t.co/oVeFWAB0CR,ChuckGrassley,Chuck Grassley,Iowa,Republican
34,Sat May 06 02:03:35 +0000 2017,8.60676E+17,22,3,Program for dinner to honor former UNI Pres Curris who received honorary degree at commencement https://t.co/qYAGQQ9HrM,ChuckGrassley,Chuck Grassley,Iowa,Republican
35,Fri May 05 22:54:39 +0000 2017,8.60629E+17,13,9,Jamal White and Tristan Bernhard (Student Body President and Vice President) at UNI honoring… https://t.co/mHl9kbWeE8,ChuckGrassley,Chuck Grassley,Iowa,Republican
36,Fri May 05 16:54:41 +0000 2017,8.60538E+17,21,5,"After Sec Perdue's town meeting in Nevada, I had the pleasure of speaking about Ag on Big Show… https://t.co/Ne1WWc8tsa",ChuckGrassley,Chuck Grassley,Iowa,Republican
37,Fri May 05 16:53:46 +0000 2017,8.60538E+17,14,4,"Had the pleasure of introducing the new voice of American ag, Sec of Ag Sonny Perdue at a town… https://t.co/pBXghyg9bp",ChuckGrassley,Chuck Grassley,Iowa,Republican
38,Fri May 05 16:52:03 +0000 2017,8.60538E+17,10,3,"Had a round table with the new Sec of Ag, farmers and public officials at the Couser farm in… https://t.co/uUPq746AE6",ChuckGrassley,Chuck Grassley,Iowa,Republican
39,Thu May 04 16:53:12 +0000 2017,8.60175E+17,49,5,Good mtg w the Independent Insurance Agents of Iowa https://t.co/Xt6nhVRhMV,ChuckGrassley,Chuck Grassley,Iowa,Republican
40,Thu May 04 16:45:47 +0000 2017,8.60174E+17,20,12,Congrats to the Iowa Corn Growers celebrating their 50th anniversary. Thx for the pin https://t.co/R2k99edyQ0,ChuckGrassley,Chuck Grassley,Iowa,Republican
41,Thu May 04 16:03:09 +0000 2017,8.60163E+17,13,4,Leaders from Growth Energy https://t.co/Ro6hDqG95w,ChuckGrassley,Chuck Grassley,Iowa,Republican
42,Wed May 03 22:47:34 +0000 2017,8.59902E+17,153,14,Live on Greta Van Susteren to talk about my Judiciary Committee FBI oversight hearing today w… https://t.co/i2N4utLzBV,ChuckGrassley,Chuck Grassley,Iowa,Republican
43,Wed May 03 22:16:20 +0000 2017,8.59894E+17,33,9,Honored to have Secretary Ben Carson address the Siouxland Chamber during their 63rd annual trip… https://t.co/YRqTyXP4gU,ChuckGrassley,Chuck Grassley,Iowa,Republican
44,Wed May 03 20:31:33 +0000 2017,8.59868E+17,175,94,"I don't like that Comey hides bhind ""can't answr that Q here"" meaning he wants closed door mtg SO we'll need 2have brief SOON 2get answrs",ChuckGrassley,Chuck Grassley,Iowa,Republican
45,Wed May 03 20:29:44 +0000 2017,8.59868E+17,76,24,FBI Dir Comey came b4 my Judic Comm 2day for oversight hrg Important role of congress 2 hold agencies accountable + increase transparency,ChuckGrassley,Chuck Grassley,Iowa,Republican
46,Wed May 03 13:40:02 +0000 2017,8.59764E+17,138,7,Good talking to Andrew Nordstrom from the Iowa Land Title Association https://t.co/HBNLoBZVBB,ChuckGrassley,Chuck Grassley,Iowa,Republican
47,Tue May 02 20:27:45 +0000 2017,8.59505E+17,49,8,Folks from the State Library of Iowa https://t.co/drSiBy4l5I,ChuckGrassley,Chuck Grassley,Iowa,Republican
48,Tue May 02 14:00:48 +0000 2017,8.59407E+17,24,14,Greeting our governor before his confirmation hearing in the Senate Foreign Relations Committee https://t.co/IH2fWJGcSk,ChuckGrassley,Chuck Grassley,Iowa,Republican
49,Tue May 02 13:44:21 +0000 2017,8.59403E+17,33,10,Happy 2introduce 2my senate colleagues my longtime friend Gov Branstad at his hrg I hope his confirmation happens quickly He's a natural fit,ChuckGrassley,Chuck Grassley,Iowa,Republican
50,Mon May 01 21:13:06 +0000 2017,8.59154E+17,7,6,Libby + Mason Van De Pol of Ankeny https://t.co/JQVDiq0mLt,ChuckGrassley,Chuck Grassley,Iowa,Republican
51,Mon May 01 21:09:29 +0000 2017,8.59153E+17,3,2,Madeline Meyer + Grant Gustafson from Pella https://t.co/TkN1oIocgk,ChuckGrassley,Chuck Grassley,Iowa,Republican
52,Mon May 01 21:07:50 +0000 2017,8.59152E+17,5,4,The Flaherty family from Bettendorf https://t.co/84RvXTOBoA,ChuckGrassley,Chuck Grassley,Iowa,Republican
53,Mon May 01 19:02:34 +0000 2017,8.59121E+17,52,11,Tell Secy DeVos to read 2day's WSJ oped by Harvey Silverglate + ponder whether she shld take his advice Seem like good pts @realDonaldTrump,ChuckGrassley,Chuck Grassley,Iowa,Republican
54,Mon May 01 17:28:12 +0000 2017,8.59097E+17,5,3,Garner Hayfield Ventura 8th grade students https://t.co/1Pp1AQjoba,ChuckGrassley,Chuck Grassley,Iowa,Republican
55,Mon May 01 13:41:13 +0000 2017,8.5904E+17,7,6,I applaud all of the small businesses across Iowa who provide jobs + good services/products to… https://t.co/TPOwWOefRm,ChuckGrassley,Chuck Grassley,Iowa,Republican
56,Sat Apr 29 01:36:14 +0000 2017,8.58133E+17,17,4,Aiden Farnsworth and isaac kopsa I met these two young ppl at That Place in Conrad where I… https://t.co/qWPsaBOBy3,ChuckGrassley,Chuck Grassley,Iowa,Republican
57,Thu Apr 27 20:32:48 +0000 2017,8.57694E+17,6,5,"The Quad Cities folks on their annual trip to D.C. shared their regional priorities with me,… https://t.co/dfUL6GrWYI",ChuckGrassley,Chuck Grassley,Iowa,Republican
58,Thu Apr 27 19:21:09 +0000 2017,8.57676E+17,13,4,Iowans with the Children's Cancer Connection https://t.co/TNcohMr6Jw,ChuckGrassley,Chuck Grassley,Iowa,Republican
59,Thu Apr 27 19:16:41 +0000 2017,8.57675E+17,19,4,Leaders from the Iowa Funeral Directors Association https://t.co/Z1E0XEzVIT,ChuckGrassley,Chuck Grassley,Iowa,Republican
60,Thu Apr 27 16:28:14 +0000 2017,8.57632E+17,0,10,Congrats to Sabrina Ahmed from WOI on her Local Individual Achieving Walter Cronkite Award.… https://t.co/gdhMwoe0VE,ChuckGrassley,Chuck Grassley,Iowa,Republican
61,Thu Apr 27 15:45:20 +0000 2017,8.57622E+17,22,61,"Just met w another VA whistleblower, Brandon Coleman. We must protect our whistleblowers. They… https://t.co/XNPrju67sR",ChuckGrassley,Chuck Grassley,Iowa,Republican
62,Thu Apr 27 14:52:29 +0000 2017,8.57608E+17,11,5,Good mtg w the Iowa State Bar Association https://t.co/PLYbxT2GYa,ChuckGrassley,Chuck Grassley,Iowa,Republican
63,Thu Apr 27 14:50:28 +0000 2017,8.57608E+17,8,4,Yesterday I met w Drake Pharmacy students + the Iowa Pharmacy Association https://t.co/ZkfA0hVz3s,ChuckGrassley,Chuck Grassley,Iowa,Republican
64,Wed Apr 26 13:58:05 +0000 2017,8.57232E+17,12,3,Talked w PE teachers from Iowa at Sen Ernst's constituent coffee this morning https://t.co/elZU9eOpUL,ChuckGrassley,Chuck Grassley,Iowa,Republican
65,Wed Apr 26 13:56:57 +0000 2017,8.57232E+17,5,3,Mallory Smith of West Des Moines https://t.co/y6Muq6DIrT,ChuckGrassley,Chuck Grassley,Iowa,Republican
66,Wed Apr 26 13:56:15 +0000 2017,8.57232E+17,1,4,Members of the Iowa REC https://t.co/Pv7SIIftWF,ChuckGrassley,Chuck Grassley,Iowa,Republican
67,Wed Apr 26 13:55:24 +0000 2017,8.57232E+17,2,2,Good to see Gloria Morels https://t.co/ALo2LBCks6,ChuckGrassley,Chuck Grassley,Iowa,Republican
68,Wed Apr 26 13:54:33 +0000 2017,8.57231E+17,5,7,2day=World Intellectual Property Day celebrating intellectual prop rights in fabric of our society Innovation is bldgblock of modern economy,ChuckGrassley,Chuck Grassley,Iowa,Republican
69,Tue Apr 25 22:13:54 +0000 2017,8.56995E+17,22,15,Pres Trump spoke of our strong partnership w Israel on US Holocaust Remembrance Day 2 honor Jews + victims of the Holocaust,ChuckGrassley,Chuck Grassley,Iowa,Republican
70,Tue Apr 25 22:12:08 +0000 2017,8.56994E+17,55,50,Obama never filled Ag position as advisor on national economic council Thx 2 Pres Trump 4 getting Ray Starling in the WH 2 help farmers,ChuckGrassley,Chuck Grassley,Iowa,Republican
71,Tue Apr 25 22:04:38 +0000 2017,8.56992E+17,31,9,Productive +bipartisan mtg @ WH w Gov Christie senators + WH staff on opioid epidemic Tlked abt what we can do 2 continue 2 help. CARA +more,ChuckGrassley,Chuck Grassley,Iowa,Republican
72,Tue Apr 25 20:51:19 +0000 2017,8.56974E+17,8,4,"Today at World IP Day celebration I had the honor of introducing fellow Iowan, John Sandage, a… https://t.co/IaSYKzmB29",ChuckGrassley,Chuck Grassley,Iowa,Republican
73,Tue Apr 25 16:34:39 +0000 2017,8.56909E+17,7,5,Met with Iowa State Snowmobile Association in the reception room off the Senate floor. https://t.co/1QLS1IBsUP,ChuckGrassley,Chuck Grassley,Iowa,Republican
74,Mon Apr 24 20:25:22 +0000 2017,8.56605E+17,9,2,The Welbes family from Dubuque https://t.co/EMVRnV17oG,ChuckGrassley,Chuck Grassley,Iowa,Republican
75,Mon Apr 24 15:33:47 +0000 2017,8.56532E+17,16,18,Congrats fellow Iowan Peggy Whitson 4 brking US record 4 longest time in space Peggy keynoted a women's leadership conf I held in DesMoines,ChuckGrassley,Chuck Grassley,Iowa,Republican
76,Sat Apr 22 16:48:19 +0000 2017,8.55826E+17,33,15,I recommend reading Senator Sasse's WSJ oped Saturday. Very well spoken analysis of what America and world faces in as ever changing society,ChuckGrassley,Chuck Grassley,Iowa,Republican
77,Sat Apr 22 15:03:29 +0000 2017,8.55799E+17,45,17,"Tweet two: please to all my tweet detractors read the WSJ oped  I referred to before u ""fly off the handle"". Thx",ChuckGrassley,Chuck Grassley,Iowa,Republican
78,Sat Apr 22 15:00:29 +0000 2017,8.55798E+17,21,7,Tweet one:Obama appointee S Koonin suggest an approach to ClimateChange debate in Friday WSJ that both sides shld consider,ChuckGrassley,Chuck Grassley,Iowa,Republican
79,Fri Apr 21 19:26:25 +0000 2017,8.55503E+17,10,4,"Tour + Q&amp;A at Mechdyne in Marshalltown. 46ppl issues: wind/solar energy, corporate tax,… https://t.co/uQJnnwUjFy",ChuckGrassley,Chuck Grassley,Iowa,Republican
80,Fri Apr 21 16:38:04 +0000 2017,8.55461E+17,7,5,"Tour + Q&amp;A at Skiff Medical Center in Newton. 49ppl issues: healthcare, Medicaid, military,… https://t.co/5THG1QIqGp",ChuckGrassley,Chuck Grassley,Iowa,Republican
81,Fri Apr 21 14:17:27 +0000 2017,8.55425E+17,9,3,"Q&amp;A w the Ames Chamber. 45ppl issues: infrastructure, opioids, trade, Ag, innovation, H1B, etc… https://t.co/eTM7iXYMVJ",ChuckGrassley,Chuck Grassley,Iowa,Republican
82,Thu Apr 20 20:57:25 +0000 2017,8.55164E+17,8,4,"Tour + Q&amp;A at American Home Shield in Carroll. 29ppl issues: energy, Medicaid/Medicare, CMS,… https://t.co/qs6fNHZvTC",ChuckGrassley,Chuck Grassley,Iowa,Republican
83,Thu Apr 20 18:50:45 +0000 2017,8.55132E+17,5,7,Q&amp;A Denison Rotary Club 38ppl issues: healthcare natl debt NAFTA immigration natl security SCOTUS ethanol student loan EPA #99countymeetings,ChuckGrassley,Chuck Grassley,Iowa,Republican
84,Thu Apr 20 18:46:58 +0000 2017,8.55131E+17,3,4,Thanked local National Guard members for their service when I ran into them at Cronk's in… https://t.co/9oN4Fj7ycE,ChuckGrassley,Chuck Grassley,Iowa,Republican
85,Thu Apr 20 16:22:46 +0000 2017,8.55094E+17,12,5,Sac City TM 70ppl issues: healthcare biodiesel IRS Iran net neutrality trade DOD$$ farmbill edu Trump taxes immigration #99countymeetings,ChuckGrassley,Chuck Grassley,Iowa,Republican
86,Thu Apr 20 16:18:33 +0000 2017,8.55093E+17,4,3,Sac County Town Meeting in Sac City #99countymeetings https://t.co/0cErgOVojJ,ChuckGrassley,Chuck Grassley,Iowa,Republican
87,Thu Apr 20 14:12:01 +0000 2017,8.55061E+17,14,3,"Tour + Q&amp;A at Puck Custom Enterprises in Manning. 25ppl issues: healthcare, bipartisanship, tax… https://t.co/IpbDKiBZmX",ChuckGrassley,Chuck Grassley,Iowa,Republican
88,Wed Apr 19 22:54:40 +0000 2017,8.54831E+17,7,6,"Tour and Q&amp;A at Bobalee Hydraulics in Laurens. 21ppl Issues: technical training, USDA grants,… https://t.co/qSOjYMnzdF",ChuckGrassley,Chuck Grassley,Iowa,Republican
89,Wed Apr 19 20:44:40 +0000 2017,8.54798E+17,7,6,"68ppl at Buena Vista Regional Medical Center in Storm Lake. Qs on healthcare, immigration,… https://t.co/VupQCIFdq0",ChuckGrassley,Chuck Grassley,Iowa,Republican
90,Wed Apr 19 19:19:59 +0000 2017,8.54777E+17,6,6,"Enjoyed tour and Q&amp;A w 37ppl at Cherokee Regional Medical Center. Issues: healthcare, opioids,… https://t.co/o726w3xdU8",ChuckGrassley,Chuck Grassley,Iowa,Republican
91,Wed Apr 19 18:49:19 +0000 2017,8.54769E+17,7,3,Thanked volunteers for their hard work at Cherokee Regional Medical Center during their annual… https://t.co/8PfatRD09A,ChuckGrassley,Chuck Grassley,Iowa,Republican
92,Wed Apr 19 16:37:55 +0000 2017,8.54736E+17,13,4,"220ppl for Q&amp;A at Ridge View HS in Holstein. Issues: wind turbines, immigration, Afghanistan,… https://t.co/uniiFATMbC",ChuckGrassley,Chuck Grassley,Iowa,Republican
93,Wed Apr 19 14:15:35 +0000 2017,8.547E+17,10,4,"Q&amp;A w 250 faculty + students at South Central Calhoun HS in Lake City. Issues: guns, Russia,… https://t.co/qJkYngwKkc",ChuckGrassley,Chuck Grassley,Iowa,Republican
94,Tue Apr 18 22:14:19 +0000 2017,8.54458E+17,43,51,Trump exec order on H1B use 2day I AGREE protect U.S. workers Prioritize visas Stop H1B abuse Another example Durbin/Grassley legislation,ChuckGrassley,Chuck Grassley,Iowa,Republican
95,Tue Apr 18 21:34:30 +0000 2017,8.54448E+17,17,6,88ppl Sigourney TM issues: FBI judicial vacancies healthcare/drug$$ SCOTUS Ag mergers S-CHIP trade Trump taxes pentagon$$ #99countymeetings,ChuckGrassley,Chuck Grassley,Iowa,Republican
96,Tue Apr 18 21:29:17 +0000 2017,8.54447E+17,3,4,Keokuk County Town Meeting in Sigourney #99countymeetings https://t.co/FTI5IfPUC5,ChuckGrassley,Chuck Grassley,Iowa,Republican
97,Tue Apr 18 18:44:24 +0000 2017,8.54405E+17,12,3,Toured solar installations at the Washington Co fairgrounds + heard about the impressive local… https://t.co/4fZAVdlASu,ChuckGrassley,Chuck Grassley,Iowa,Republican
98,Tue Apr 18 16:47:40 +0000 2017,8.54376E+17,9,5,Honored to receive the NAM award for Manufacturing Legislative Excellence for my work to promote… https://t.co/lLTTOFQ920,ChuckGrassley,Chuck Grassley,Iowa,Republican
99,Tue Apr 18 16:33:50 +0000 2017,8.54372E+17,7,5,Thx to Kent Corp + the National Association of Manufacturers for hosting me for Q&amp;A in… https://t.co/nzN1ZGjOJM,ChuckGrassley,Chuck Grassley,Iowa,Republican
100,Tue Apr 18 13:50:26 +0000 2017,8.54331E+17,12,5,"63ppl Davenport Optimist Club. Qs on healthcare, bipartisanship, drug prices, immigration, regs,… https://t.co/kv7CVlDBN0",ChuckGrassley,Chuck Grassley,Iowa,Republican
101,Tue Apr 18 12:01:56 +0000 2017,8.54304E+17,22,5,"Started my day on WHBF covering the Quad Cities. Talked about North Korea, Justice Gorsuch +… https://t.co/ihwOCjkkDh",ChuckGrassley,Chuck Grassley,Iowa,Republican
102,Tue Apr 18 00:23:59 +0000 2017,8.54128E+17,9,2,"Driving through eastern Iowa for county meetings on a beautiful spring night @ DeWitt, Iowa https://t.co/qPntWT16Fm",ChuckGrassley,Chuck Grassley,Iowa,Republican
103,Tue Apr 18 00:19:36 +0000 2017,8.54127E+17,9,3,"34ppl Q&amp;A w Clinton County Substance Abuse Council Coalitions in Clinton on heroin, marijuana,… https://t.co/KY7lwXjFRR",ChuckGrassley,Chuck Grassley,Iowa,Republican
104,Mon Apr 17 21:54:28 +0000 2017,8.54091E+17,18,7,"Jackson Mfg &amp; Jackson Co Economic Alliance in Maquoketa 31ppl issues: trade, workforce, regs,… https://t.co/8BnCiJJVit",ChuckGrassley,Chuck Grassley,Iowa,Republican
105,Mon Apr 17 19:34:22 +0000 2017,8.54055E+17,11,4,Good to see Tipton HS principal of 23 yrs Chris Habben. Chris is retiring this spring after 40… https://t.co/xeOVDrdW10,ChuckGrassley,Chuck Grassley,Iowa,Republican
106,Mon Apr 17 19:16:32 +0000 2017,8.54051E+17,10,8,"Q&amp;A at Tipton HS 87ppl issues: Senate committees, N Korea, patent reform, criminal justice… https://t.co/i2sPfPwgrb",ChuckGrassley,Chuck Grassley,Iowa,Republican
107,Sat Apr 15 16:52:30 +0000 2017,8.5329E+17,105,26,I don't know Bannon except I read he is controversial. Read WSJ Saturday Noonan oped for a whole different view of Bannon @POTUS,ChuckGrassley,Chuck Grassley,Iowa,Republican
108,Thu Apr 13 21:10:50 +0000 2017,8.5263E+17,20,4,#99countymeetings taking Q&amp;A in Arlington with Farm Bureau members who have questions about… https://t.co/1WSlcxJ9qQ,ChuckGrassley,Chuck Grassley,Iowa,Republican
109,Thu Apr 13 19:24:21 +0000 2017,8.52603E+17,19,7,#99countymeetings Taking Q&amp;A from 470 students at West Delaware HS in Manchester.  Topics of… https://t.co/1ECEjuvqcc,ChuckGrassley,Chuck Grassley,Iowa,Republican
110,Thu Apr 13 16:58:47 +0000 2017,8.52567E+17,19,7,Having a great discussion with students at my alma mater of UNI.  Lots of good question in… https://t.co/zsP3Y6XhEr,ChuckGrassley,Chuck Grassley,Iowa,Republican
111,Thu Apr 13 15:40:21 +0000 2017,8.52547E+17,14,3,"Taking Q&amp;A with 24 students at UNI.  Great questions regarding N. Korea, student loan debt,… https://t.co/WaKny87vvt",ChuckGrassley,Chuck Grassley,Iowa,Republican
112,Mon Apr 10 22:07:14 +0000 2017,8.51557E+17,150,19,I was glad to shepherd an outstanding candidate for the Supreme Court through the Senate.… https://t.co/cWk3d1zuzM,ChuckGrassley,Chuck Grassley,Iowa,Republican
113,Mon Apr 10 15:37:15 +0000 2017,8.51459E+17,149,78,Thank u Justice Gorsuch for thanking me in ur after-swearing in remarks for my handling ur confirmation,ChuckGrassley,Chuck Grassley,Iowa,Republican
114,Mon Apr 10 15:10:50 +0000 2017,8.51452E+17,48,46,@realDonaldTrump   Thx for mentioning my handling of Gorsuch  nomination at rose garden ceremony. I'm in Iowa  sorry to miss  watched on tv,ChuckGrassley,Chuck Grassley,Iowa,Republican
115,Sun Apr 09 19:46:25 +0000 2017,8.51159E+17,10,7,There was large number at the visitation for Jon Crews to honor a person who loved CedarFalls where he was mayor for 30yrs,ChuckGrassley,Chuck Grassley,Iowa,Republican
116,Sat Apr 08 17:58:59 +0000 2017,8.5077E+17,214,93,For the good reason of supporting Intnational law agst Chemical warfare by hit at Syria He also showed detractors he not Putin puppet GET IT,ChuckGrassley,Chuck Grassley,Iowa,Republican
117,Fri Apr 07 23:53:32 +0000 2017,8.50497E+17,5,6,Just informed of long time CedarFalls former mayor Jon Crews death   He was Real public servant serving 30 yrs as mayor,ChuckGrassley,Chuck Grassley,Iowa,Republican
118,Thu Apr 06 22:56:33 +0000 2017,8.5012E+17,10,7,"Kendall Antle, Grand View University Student Body President https://t.co/yzuY2hzSic",ChuckGrassley,Chuck Grassley,Iowa,Republican
119,Thu Apr 06 21:40:57 +0000 2017,8.50101E+17,20,12,This wk=National Crime Victims' Rights Week I introduced a resolution 2commemorate +thank all who work hard 2help survivors/victims of crime,ChuckGrassley,Chuck Grassley,Iowa,Republican
120,Thu Apr 06 20:49:07 +0000 2017,8.50088E+17,37,11,Cong exempted itself from a lot of laws until I got law passed in'95 Even OSHA laws exempted 2day my office recognized 4being OSHA compliant,ChuckGrassley,Chuck Grassley,Iowa,Republican
121,Thu Apr 06 19:34:44 +0000 2017,8.50069E+17,99,22,"Aetna Wellmark pull out of IA Obamacare/coincidentally I hr fr Dems 2 discuss 4 1st time. Law in ""death spiral"" &amp; bipartisan solution needed",ChuckGrassley,Chuck Grassley,Iowa,Republican
122,Thu Apr 06 16:30:03 +0000 2017,8.50023E+17,17,6,"Grammys on the Hill mtg w musicians on copyright issues. Justin is in this group, son of Steve… https://t.co/8HJeXpwzdu",ChuckGrassley,Chuck Grassley,Iowa,Republican
123,Thu Apr 06 16:26:14 +0000 2017,8.50022E+17,10,9,Briar Cliff University President Dr. Hamid Shirvani https://t.co/tsiLA6SXnm,ChuckGrassley,Chuck Grassley,Iowa,Republican
