,created_at,id_str,reply_count,retweet_count,text,user,name,state,party
750,Mon Aug 29 23:08:06 +0000 2016,7.70398E+17,8,3,#99countymeetings Cherokee 68ppl issues: TPP SCOTUS Zika EPA regs Obamacare internet sales/gas tax roads immigration CRP local Tyson plant,ChuckGrassley,Chuck Grassley,Iowa,Republican
751,Mon Aug 29 20:57:36 +0000 2016,7.70365E+17,8,1,#99countymeetings tour of AMPI +Q&amp;A w 28ppl in Sanborn issues:Margin protection program FarmBill immigration WOTUS wind energy dairyindustry,ChuckGrassley,Chuck Grassley,Iowa,Republican
752,Mon Aug 29 20:56:54 +0000 2016,7.70365E+17,3,1,Informative tour + Q&amp;A of AMPI in Sanborn. They make 10% of the cheddar cheese &amp; butter in the… https://t.co/OpmMbQ8r9s,ChuckGrassley,Chuck Grassley,Iowa,Republican
753,Mon Aug 29 18:51:47 +0000 2016,7.70333E+17,9,2,SiouxCity downtown rotary 63ppl Q&amp;A issues:TermLimits Iran Trump/Clinton SCOTUS refugees waterquality debt/stop spending$$ #99countymeetings,ChuckGrassley,Chuck Grassley,Iowa,Republican
754,Mon Aug 29 18:33:40 +0000 2016,7.70329E+17,5,1,Glad to be with the Sioux City Downtown Rotary Club over the noon hour #99countymeetings https://t.co/NiaQ3DbQVk,ChuckGrassley,Chuck Grassley,Iowa,Republican
755,Mon Aug 29 18:29:02 +0000 2016,7.70327E+17,1,1,2/2 special agent Monney also rec. distinguished service medal from ATF. Today I got 2 meet/thank/congratulate them on this gr8 honor,ChuckGrassley,Chuck Grassley,Iowa,Republican
756,Mon Aug 29 18:24:22 +0000 2016,7.70326E+17,1,1,Congrats 2 Detective Sgt Hansen+Detective McCormick both of Sioux City PD &amp; AUSA Fairchild. 1st Iowans to ever receive ATF honor award  1/2,ChuckGrassley,Chuck Grassley,Iowa,Republican
757,Mon Aug 29 15:56:13 +0000 2016,7.70289E+17,5,4,"Sue Bee Honey in Sioux City for tour + Q&amp;A w 37 employees. Qs on immigration, food labeling,… https://t.co/el5FZIeOKy",ChuckGrassley,Chuck Grassley,Iowa,Republican
758,Mon Aug 29 00:15:56 +0000 2016,7.70052E+17,9,13,Found some friends at the Sergeant Bluff DQ up in Woodbury Co. https://t.co/lO9ff9BhT6,ChuckGrassley,Chuck Grassley,Iowa,Republican
759,Sun Aug 28 20:56:52 +0000 2016,7.70002E+17,7,6,"Victory 4academic Freedom/U of Chicago PresZimmer tells new students no""safe spaces"" no""trigger warnings"" UofChicago lives up 2 historic rep",ChuckGrassley,Chuck Grassley,Iowa,Republican
760,Sun Aug 28 16:42:00 +0000 2016,7.69938E+17,11,14,At cf village inn for breakfast w/ family after church. Always order potatoes eggs yogurt and oatmeal.  Nice 2 hear ppls Qs &amp; encouragement,ChuckGrassley,Chuck Grassley,Iowa,Republican
761,Sun Aug 28 01:04:32 +0000 2016,7.69702E+17,4,6,I and Indee&amp;Regan my gr8grandchildren attended celebration of centennial of Hardin county farm… https://t.co/gdT2uWLkGh,ChuckGrassley,Chuck Grassley,Iowa,Republican
762,Sun Aug 28 00:59:16 +0000 2016,7.69701E+17,3,5,Glad to be w the Hardin Co Farm Bureau for their centennial celebration tonight https://t.co/1j0H0ktjzx,ChuckGrassley,Chuck Grassley,Iowa,Republican
763,Sat Aug 27 23:35:04 +0000 2016,7.6968E+17,8,8,I'm w the Mudpuppies Band. They were entertainment at Centennial of Hardin County Farm Bureau https://t.co/78iIYdQ52U,ChuckGrassley,Chuck Grassley,Iowa,Republican
764,Sat Aug 27 16:00:23 +0000 2016,7.69565E+17,4,3,Ran into @repdavidyoung downtown DSM &amp; a family from Marshalltown https://t.co/usym2ymdsi,ChuckGrassley,Chuck Grassley,Iowa,Republican
765,Sat Aug 27 15:56:18 +0000 2016,7.69564E+17,3,4,Walked around the Des Moines farmers' market this morning &amp; talked w constituents https://t.co/CDAxX8By2B,ChuckGrassley,Chuck Grassley,Iowa,Republican
766,Sat Aug 27 00:38:36 +0000 2016,7.69333E+17,0,2,Thx to Les at Latin King for great service tonight. Les also works at the Salvation Army doing… https://t.co/aVXvWmfNnu,ChuckGrassley,Chuck Grassley,Iowa,Republican
767,Fri Aug 26 21:49:48 +0000 2016,7.69291E+17,3,1,Spoke to 73ppl in Ankeny w the Iowa Community Action Association serving Iowans from 17 offices… https://t.co/I250gEWh1j,ChuckGrassley,Chuck Grassley,Iowa,Republican
768,Fri Aug 26 20:10:01 +0000 2016,7.69266E+17,4,4,I had the opportunity to open our forum on ending human trafficking. The panel discussion in Des… https://t.co/1zjwSCZbmX,ChuckGrassley,Chuck Grassley,Iowa,Republican
769,Fri Aug 26 16:10:58 +0000 2016,7.69206E+17,9,2,Thx to Hy-Vee for giving me a tour of their distribution center in Chariton. I also had a Q&amp;A w… https://t.co/LfGtBrofep,ChuckGrassley,Chuck Grassley,Iowa,Republican
770,Fri Aug 26 15:58:10 +0000 2016,7.69202E+17,8,2,#99countymeetings Hy-Vee Distribution Center in Chariton employs1300+.tour+Q&amp;A issues:trade/Ag tuition$ young ppl in politics hcare premiums,ChuckGrassley,Chuck Grassley,Iowa,Republican
771,Fri Aug 26 14:02:40 +0000 2016,7.69173E+17,6,1,#99countymeetings 34ppl Corydon issues: Obamacare mental health immigration SCOTUS CropInsurance Iran corporate tax reform Medicaid VA,ChuckGrassley,Chuck Grassley,Iowa,Republican
772,Thu Aug 25 19:49:28 +0000 2016,7.68898E+17,7,5,Stopped by KWWL to talk about how the dramatic increase in EpiPen pricing is affecting Iowa… https://t.co/lB1plIRPg5,ChuckGrassley,Chuck Grassley,Iowa,Republican
773,Wed Aug 24 01:07:18 +0000 2016,7.68253E+17,13,6,Monthly teletownmtg issues: VA$ on art immigration SCOTUS budget jobs in IA term limits juvenile justice Medicare tax reform renewablefuels,ChuckGrassley,Chuck Grassley,Iowa,Republican
774,Tue Aug 23 22:08:12 +0000 2016,7.68208E+17,6,2,Thx to Jeff Stein for having me in his studio for an interview that will be aired on KXEL… https://t.co/9D3t9CKWGl,ChuckGrassley,Chuck Grassley,Iowa,Republican
775,Tue Aug 23 19:16:44 +0000 2016,7.68165E+17,8,2,Lincoln Savings Bank Reinbeck 37ppl issues:farm credit healthcare$$ creditunions fiduciaryrule too many govt regs SCOTUS #99countymeetings,ChuckGrassley,Chuck Grassley,Iowa,Republican
776,Tue Aug 23 19:08:33 +0000 2016,7.68163E+17,5,3,Had a nice tour and Q&amp;A w employees at Lincoln Savings Bank in Reinbeck #99countymeetings https://t.co/VmOXT6rEd6,ChuckGrassley,Chuck Grassley,Iowa,Republican
777,Sat Aug 20 20:34:11 +0000 2016,7.67097E+17,9,3,In honor of Grant Wood's 125th birthday Cedar Rapids has 'overalls all over' of Wood's famous… https://t.co/eUFMCXEftY,ChuckGrassley,Chuck Grassley,Iowa,Republican
778,Fri Aug 19 22:29:36 +0000 2016,7.66764E+17,4,1,Celia Vanmeter &amp; Tiara Mosley shared their stories as foster youth w me and suggestions for how… https://t.co/tUshIclqXu,ChuckGrassley,Chuck Grassley,Iowa,Republican
779,Fri Aug 19 22:01:56 +0000 2016,7.66757E+17,6,2,Good to meet Neola Washington &amp; Ja'Kyla Johnson. They are 8th graders who participated in the… https://t.co/sHbNN0a54C,ChuckGrassley,Chuck Grassley,Iowa,Republican
780,Fri Aug 19 21:30:43 +0000 2016,7.66749E+17,2,1,Thx to Four Oaks of Cedar Rapids &amp; Casey Family Programs for collaborating w me on my foster… https://t.co/VwUsmxXPkF,ChuckGrassley,Chuck Grassley,Iowa,Republican
781,Fri Aug 19 18:15:39 +0000 2016,7.667E+17,4,1,Appreciated hearing about local law enforcement issues from the Chief of Police from Cedar… https://t.co/WZiOcK8oNI,ChuckGrassley,Chuck Grassley,Iowa,Republican
782,Fri Aug 19 16:36:28 +0000 2016,7.66675E+17,6,1,#99countymeetings 36ppl ITC Midwest in CR issues: energy bill Zika SCOTUS wind energy tax reform soc security Trump bipartisanship NatlDebt,ChuckGrassley,Chuck Grassley,Iowa,Republican
783,Fri Aug 19 15:35:17 +0000 2016,7.6666E+17,6,2,On #nationalaviationday I visited the advanced technology lab at Rockwell Collins in Cedar… https://t.co/4f9KpeKATm,ChuckGrassley,Chuck Grassley,Iowa,Republican
784,Fri Aug 19 15:33:24 +0000 2016,7.66659E+17,6,1,Tour + Q&amp;A 84ppl Rockwell Collins in Cedar Rapids issues: budg tax reform equal pay SCOTUS military innovation DOD #99countymeetings,ChuckGrassley,Chuck Grassley,Iowa,Republican
785,Fri Aug 19 13:42:19 +0000 2016,7.66631E+17,7,5,74ppl CR Daybreak Rotary issues:Senatepriorities guns flood$ casework asset forfeiture bipartisanship needed in DC how 2be a good role model,ChuckGrassley,Chuck Grassley,Iowa,Republican
786,Tue Aug 16 20:01:42 +0000 2016,7.6564E+17,9,4,Thx to Fareway for inviting me to have a Q&amp;A w 250 of their employees at their quarterly mtg in… https://t.co/qJhZjSuM8w,ChuckGrassley,Chuck Grassley,Iowa,Republican
787,Tue Aug 16 19:58:15 +0000 2016,7.65639E+17,7,5,#99countymeetings 250ppl Fareway Store managers in Boone issues: election MinimumWage guns immigration SCOTUS payments 2 Iran Future of USA,ChuckGrassley,Chuck Grassley,Iowa,Republican
788,Tue Aug 16 18:12:34 +0000 2016,7.65612E+17,6,1,Enjoyed my tour and Q&amp;A w employees at Macke Motors in Lake City #99countymeetings https://t.co/Eb4iNtFRoi,ChuckGrassley,Chuck Grassley,Iowa,Republican
789,Tue Aug 16 18:10:37 +0000 2016,7.65612E+17,6,2,#99countymeetings tour+Q&amp;A Macke Motors Lake City 26ppl issues:edu budget Trump SCOTUS Obamacare lawenforcement college tuition welfare,ChuckGrassley,Chuck Grassley,Iowa,Republican
790,Tue Aug 16 16:24:11 +0000 2016,7.65585E+17,8,1,55ppl at Sac City town mtg. Variety of Qs #99countymeetings https://t.co/yyQDOa87H6,ChuckGrassley,Chuck Grassley,Iowa,Republican
791,Tue Aug 16 16:21:06 +0000 2016,7.65584E+17,10,2,#99countymeetings 55ppl Sac City issues: RuralHealthCare WOTUS/EPA regs CMS childcare VA TPP DOD$ bipartisanship SCOTUS SenateMajority,ChuckGrassley,Chuck Grassley,Iowa,Republican
792,Tue Aug 16 00:06:36 +0000 2016,7.65339E+17,13,4,I had the privilege of walking through the Fair today w my colleague @senjoniernst Thx to Joni… https://t.co/Y2RLNIIPsF,ChuckGrassley,Chuck Grassley,Iowa,Republican
793,Mon Aug 15 20:46:54 +0000 2016,7.65289E+17,3,1,Thx to all the Iowa Red Cross volunteers @iowastatefair https://t.co/Ogf6k6EVq5,ChuckGrassley,Chuck Grassley,Iowa,Republican
794,Mon Aug 15 19:24:21 +0000 2016,7.65268E+17,6,1,Sonja Harwood from Dallas Center-Grimes HS won Iowa's Homecoming Queen title and is starting ISU… https://t.co/EiNela2PZE,ChuckGrassley,Chuck Grassley,Iowa,Republican
795,Mon Aug 15 16:20:54 +0000 2016,7.65222E+17,1,1,@Bigshowfarm I will be interviewed in first 30 min on WHO while Im @IowaStateFair,ChuckGrassley,Chuck Grassley,Iowa,Republican
796,Mon Aug 15 16:16:57 +0000 2016,7.65221E+17,6,4,Be sure to visit the Cancer Prevention Booth at the Iowa Farm Bureau Tent. Barbara is a breast… https://t.co/audGhbsZHW,ChuckGrassley,Chuck Grassley,Iowa,Republican
797,Mon Aug 15 16:11:05 +0000 2016,7.65219E+17,6,5,Veterans Day at the Iowa State Fair. Glad to be here to thank Iowans for their service to our… https://t.co/7iV7dXXNeL,ChuckGrassley,Chuck Grassley,Iowa,Republican
798,Mon Aug 15 13:34:04 +0000 2016,7.6518E+17,10,10,"Fred is the champion big boar from Farmersburg in Clayton Co. 1,155 lbs https://t.co/pmkPepY759",ChuckGrassley,Chuck Grassley,Iowa,Republican
799,Mon Aug 15 13:26:40 +0000 2016,7.65178E+17,9,8,"Proud to see the Putney's bull as this year's ""super bull"" Desperado's home is Gladbrook. 2,972 lbs https://t.co/lwgHqsT39L",ChuckGrassley,Chuck Grassley,Iowa,Republican
800,Sat Aug 13 19:33:38 +0000 2016,7.64545E+17,7,5,Still listening to Jan michaelson on WHO   He telling abt his recovering by going to China for doctoring recovering fr stroke,ChuckGrassley,Chuck Grassley,Iowa,Republican
801,Sat Aug 13 19:15:10 +0000 2016,7.64541E+17,5,2,Welcome back Jan Michaelson to WHO radio after 7 month of illness. U sound very strong   Tune into 1040 AM   I m glad to hear abt cure,ChuckGrassley,Chuck Grassley,Iowa,Republican
802,Fri Aug 12 21:04:30 +0000 2016,7.64206E+17,3,2,As u can c  As city of woodbine celebrates 150 yrs the city's municipal utility celebrates 75… https://t.co/qmKVkHPq58,ChuckGrassley,Chuck Grassley,Iowa,Republican
803,Fri Aug 12 20:59:51 +0000 2016,7.64205E+17,3,1,Had #99countymeetings in Woodbine Got T shirt  Go help the thriving town celebrate 150 yrs https://t.co/SOe9uBSMFa,ChuckGrassley,Chuck Grassley,Iowa,Republican
804,Fri Aug 12 20:51:07 +0000 2016,7.64203E+17,1,3,Thx to Central States Teamster retirees for honoring w this TShirt and for asking me to request… https://t.co/PKA4ig3YtL,ChuckGrassley,Chuck Grassley,Iowa,Republican
805,Fri Aug 12 20:36:11 +0000 2016,7.64199E+17,27,8,"First step for senate to consider TPP Obama to Parliamentarian ""I intend to submit"" agreement...I'm surprised since Hillary is agst it",ChuckGrassley,Chuck Grassley,Iowa,Republican
806,Thu Aug 11 20:13:02 +0000 2016,7.63831E+17,9,5,"Congressional Q&amp;A panel at the Community Bankers of Iowa State Fair Conference, discussed the… https://t.co/e7xGIbRjuH",ChuckGrassley,Chuck Grassley,Iowa,Republican
807,Thu Aug 11 17:12:51 +0000 2016,7.63785E+17,13,4,"#99countymeetings-50 at town Mtg/Guthrie CO Hospital:1st&amp;2nd Amend,TPP, internat'l postal Treaty, SCOTUS, term limits,FBI/Hillary,EPA,balBud",ChuckGrassley,Chuck Grassley,Iowa,Republican
808,Thu Aug 11 16:18:52 +0000 2016,7.63772E+17,4,2,#99countymeetings -- had a town mtg with about 50 ppl this morning at the Guthrie County Hospital https://t.co/TQAbY50AgF,ChuckGrassley,Chuck Grassley,Iowa,Republican
809,Thu Aug 11 14:52:35 +0000 2016,7.6375E+17,6,2,"#99countymeetings -17ppl in Greenfield/AdairCo w/ ?s Abt prez race,SCOTUS,EMP, Mental health needs esp 4 kids, TPP,EPA, RFS.",ChuckGrassley,Chuck Grassley,Iowa,Republican
810,Thu Aug 11 14:47:34 +0000 2016,7.63749E+17,4,2,"#99countymeetings -- Q&amp;A w/ 17 ppl in Greenfield after tour of Chemical Research/Technology, one… https://t.co/e4LckZZ4I7",ChuckGrassley,Chuck Grassley,Iowa,Republican
811,Wed Aug 10 21:02:47 +0000 2016,7.63481E+17,17,4,"#99countymeetings - 75ppl-town mtg Woodbine Main Street -wotus, SCOTUS, EPA, defend Constitution, Teamster pension, Iran, SS, Infrastructure",ChuckGrassley,Chuck Grassley,Iowa,Republican
812,Wed Aug 10 20:48:18 +0000 2016,7.63477E+17,3,5,#99countymeetings -- about 75 people for town mtg this afternoon in Woodbine at Main Street Station https://t.co/momJbl2QZO,ChuckGrassley,Chuck Grassley,Iowa,Republican
813,Wed Aug 10 16:26:40 +0000 2016,7.63411E+17,10,2,#99countymeetings -60 ppl in Harlan 4 town mtg.Issues:WOTUS Partisanship SCOTUS VA Immigration Education ReligiousFreedom NursePracticioners,ChuckGrassley,Chuck Grassley,Iowa,Republican
814,Wed Aug 10 16:20:06 +0000 2016,7.6341E+17,4,2,#99countymeetings - 60 ppl in Harlan for town mtg this morning https://t.co/3DulKfa0b1,ChuckGrassley,Chuck Grassley,Iowa,Republican
815,Wed Aug 10 14:23:39 +0000 2016,7.6338E+17,9,5,#99countymeetings Audubon Hospital 22ppl Issues:SCOTUS Medicaid Partisanship MediaBiase Trump StudentDebt DOD$$$,ChuckGrassley,Chuck Grassley,Iowa,Republican
816,Wed Aug 10 14:15:13 +0000 2016,7.63378E+17,6,1,#99countymeetings AudubonHospital TourQ&amp;A https://t.co/aEaleia5ff,ChuckGrassley,Chuck Grassley,Iowa,Republican
817,Tue Aug 09 20:27:23 +0000 2016,7.63109E+17,38,8,I'm on tour of BASF plant Malcom https://t.co/XyF3NX19t4,ChuckGrassley,Chuck Grassley,Iowa,Republican
818,Tue Aug 09 20:24:15 +0000 2016,7.63109E+17,9,7,Q&amp;A w employees of BASF in Malcom  49ppl https://t.co/b2cXUMrto3,ChuckGrassley,Chuck Grassley,Iowa,Republican
819,Tue Aug 09 20:21:29 +0000 2016,7.63108E+17,12,6,#99countymeetings Malcom Tour&amp;Q&amp;A of BASF plant Issues:Trade ElectricCigrettes CitizenUnited Bipartisanship SCOTUS term limits GMO VA,ChuckGrassley,Chuck Grassley,Iowa,Republican
820,Sun Aug 07 17:52:51 +0000 2016,7.62346E+17,6,5,Greek Orthodox Church Chancellor Metropolis of Chicago His Grace Bishop Demitrios invited me to… https://t.co/6jmXMMoe1f,ChuckGrassley,Chuck Grassley,Iowa,Republican
821,Sun Aug 07 01:04:45 +0000 2016,7.62092E+17,7,7,TC of UNI was representing my U and had competition fr Herky and Cy at Bruce R  Summer party At… https://t.co/KTNGqlaVdN,ChuckGrassley,Chuck Grassley,Iowa,Republican
822,Sat Aug 06 18:20:08 +0000 2016,7.6199E+17,8,3,Speaking to a nice crowd of people in Tripoli at the ribbon cutting of the new Sweet Water bike… https://t.co/oay9UeAiGe,ChuckGrassley,Chuck Grassley,Iowa,Republican
823,Sat Aug 06 16:55:10 +0000 2016,7.61969E+17,7,2,Cutting the ribbon for the new Sweet Water bike trail in Tripoli.  Nice turn out. https://t.co/AWdXvLRNYO,ChuckGrassley,Chuck Grassley,Iowa,Republican
824,Sat Aug 06 16:41:04 +0000 2016,7.61965E+17,5,2,Looking at the new Sweet Water Welcome Center in Tripoli. https://t.co/Zfb8j4Iilt,ChuckGrassley,Chuck Grassley,Iowa,Republican
825,Sat Aug 06 00:54:12 +0000 2016,7.61727E+17,3,8,Barbara &amp;I return to Hickory House Waterloo  abt once yr to celebrate anniversary This is where… https://t.co/IKenuQrEQe,ChuckGrassley,Chuck Grassley,Iowa,Republican
826,Thu Aug 04 21:50:04 +0000 2016,7.61318E+17,9,1,Took a second to take in the beautiful view along the Mississippi River during my county mtgs in… https://t.co/Vwr8xd4qca,ChuckGrassley,Chuck Grassley,Iowa,Republican
827,Thu Aug 04 21:21:01 +0000 2016,7.61311E+17,3,1,Had a Q&amp;A w 78 employees after a tour of CaptiveAire in West Union. They manufacture venting for… https://t.co/BXKEf8N0xD,ChuckGrassley,Chuck Grassley,Iowa,Republican
828,Thu Aug 04 21:16:36 +0000 2016,7.6131E+17,3,3,#99countymeetings CaptiveAire in West Union tour+ Q&amp;A 78ppl issues: voterID Obamacare student/Nat'l debt TermLimits Trump soc security VA,ChuckGrassley,Chuck Grassley,Iowa,Republican
829,Thu Aug 04 18:50:46 +0000 2016,7.61273E+17,5,1,Q&amp;A w Guttenberg Rotary Club #99countymeetings https://t.co/J2jXZVj6go,ChuckGrassley,Chuck Grassley,Iowa,Republican
830,Thu Aug 04 18:48:49 +0000 2016,7.61273E+17,8,2,#99countymeetings Guttenburg RotaryClub 15members issues:SCOTUS Obamacare my REACH bill PresElection Trump Medicaid privatization,ChuckGrassley,Chuck Grassley,Iowa,Republican
831,Thu Aug 04 16:38:53 +0000 2016,7.6124E+17,5,1,Jim Jannett showed me the Driftless Area Education + Visitor Center now under construction in… https://t.co/WiaxuVK21A,ChuckGrassley,Chuck Grassley,Iowa,Republican
832,Thu Aug 04 16:31:46 +0000 2016,7.61238E+17,3,3,Town mtg in Lansing w 96ppl #99countymeetings https://t.co/KAFp3sfEsC,ChuckGrassley,Chuck Grassley,Iowa,Republican
833,Thu Aug 04 16:12:15 +0000 2016,7.61233E+17,10,1,#99countymeetings Lansing TM 96ppl issues: immigration Zika EPA regs Trade COLA increase balance budg NAFTA judges Guns UN local jobs,ChuckGrassley,Chuck Grassley,Iowa,Republican
834,Thu Aug 04 13:56:59 +0000 2016,7.61199E+17,5,2,Stopped in Waukon on my way to Lansing for my town mtg. Outside Allamakee Co. Courthouse this… https://t.co/hCESwmm2wm,ChuckGrassley,Chuck Grassley,Iowa,Republican
835,Thu Aug 04 13:22:14 +0000 2016,7.61191E+17,3,4,Enjoyed breakfast at S&amp;D Cafe in Waukon. Here w owner Sandy Halverson &amp; Dr. Brunkhorst https://t.co/3FaRAVmCdY,ChuckGrassley,Chuck Grassley,Iowa,Republican
836,Thu Aug 04 01:46:08 +0000 2016,7.61015E+17,51,31,Hilliary misleading again / oped last yr CedrRapids gazette she supported RFS/ethanol NOW she seems to looking way back out Read Reuters now,ChuckGrassley,Chuck Grassley,Iowa,Republican
837,Thu Aug 04 01:42:40 +0000 2016,7.61014E+17,8,4,This is Dave Allen from my Veterans Fellowship Program. Dave serves as a liaison between Iowa… https://t.co/TcmXM2RxCg,ChuckGrassley,Chuck Grassley,Iowa,Republican
838,Wed Aug 03 01:21:24 +0000 2016,7.60647E+17,17,5,Stopped in That Place for dinner and met Chris from Conrad. Chris is a waitress &amp; a middle… https://t.co/5XSdkIahbu,ChuckGrassley,Chuck Grassley,Iowa,Republican
839,Tue Aug 02 20:59:53 +0000 2016,7.60581E+17,10,6,I was also honored to present Frank Hawk from Norwalk his Purple Heart in front of his family.… https://t.co/VzRwDQo4qC,ChuckGrassley,Chuck Grassley,Iowa,Republican
840,Tue Aug 02 20:39:34 +0000 2016,7.60576E+17,6,1,Don Coderre of West Des Moines served in Iraq as an Army Specialist during Operation Iraqi… https://t.co/OZ40SCboPM,ChuckGrassley,Chuck Grassley,Iowa,Republican
841,Tue Aug 02 19:35:10 +0000 2016,7.6056E+17,16,7,Q&amp;A West Des Moines Rotary 48ppl issues: Zika ISIS balancedbudg student loans my schedule Fast&amp;Furious bipartisanship socialsecurity SCOTUS,ChuckGrassley,Chuck Grassley,Iowa,Republican
842,Tue Aug 02 14:29:23 +0000 2016,7.60483E+17,33,24,RollCall says WH struggles 2explain asking Congress 4 more Zika $$$. they have $ they haven't spent. My ltr to CDC is asking why? No answer,ChuckGrassley,Chuck Grassley,Iowa,Republican
843,Mon Aug 01 20:40:19 +0000 2016,7.60214E+17,10,3,Tour + Q&amp;A at Seneca Foundry in Webster City. Impressed by the hard work they do with molten… https://t.co/1YJ5yLiSTq,ChuckGrassley,Chuck Grassley,Iowa,Republican
844,Mon Aug 01 20:22:53 +0000 2016,7.60209E+17,12,3,#99countymeetings Seneca Foundry Webster City tour+Q&amp;A 37ppl issues: edu guns balancedbudget mfg in IA immigration jobs economy inflation,ChuckGrassley,Chuck Grassley,Iowa,Republican
845,Sat Jul 30 15:13:15 +0000 2016,7.59407E+17,28,21,Last two tweets fr ur friendly Senator who devotes a gr8 deal of effort to encouraging and protecting whistleblowers/often ill treated,ChuckGrassley,Chuck Grassley,Iowa,Republican
846,Sat Jul 30 15:07:39 +0000 2016,7.59405E+17,11,31,Today is Whistleblower Appreciation Day. 238 yrs ago ContinentalCongress passed first law encouraging whistleblowers/In fact requiring it,ChuckGrassley,Chuck Grassley,Iowa,Republican
847,Sat Jul 30 15:01:35 +0000 2016,7.59404E+17,13,13,Govt whistleblowers r patriotic servants who want government just follow law This day 1778 Congress passed first law to report fraud,ChuckGrassley,Chuck Grassley,Iowa,Republican
848,Fri Jul 29 21:54:38 +0000 2016,7.59145E+17,3,2,Louisa County Q&amp;A in Columbus Junction #99countymeetings https://t.co/Xlxqi9tyel,ChuckGrassley,Chuck Grassley,Iowa,Republican
849,Fri Jul 29 21:45:31 +0000 2016,7.59143E+17,13,3,#99countymeetings Columbus Junction 46ppl issues: VA SCOTUS guns soc sec TermLimits puppy mills job corps citizens united Obamacare,ChuckGrassley,Chuck Grassley,Iowa,Republican
850,Fri Jul 29 19:45:20 +0000 2016,7.59113E+17,7,2,#99countymeetings tour and Q&amp;A w employees at Great River Medical serving the Burlington area &amp;… https://t.co/lacvggoU8Q,ChuckGrassley,Chuck Grassley,Iowa,Republican
851,Fri Jul 29 19:41:07 +0000 2016,7.59112E+17,8,1,Nice to meet Dr. John Thurman from Great River Health Systems in Des Moines Co. https://t.co/IK2aKVPXnc,ChuckGrassley,Chuck Grassley,Iowa,Republican
852,Fri Jul 29 19:36:23 +0000 2016,7.5911E+17,5,1,#99countymeetings Great River Medical W Burlington employs 2100 tour+Q&amp;A issues: Medicare durable med equip mental health Obamacare CMS/cuts,ChuckGrassley,Chuck Grassley,Iowa,Republican
853,Fri Jul 29 16:36:18 +0000 2016,7.59065E+17,7,3,Outside Siemens in Ft Madison. Just had tour and Q&amp;A w employees. These 3 blades must be going… https://t.co/EKG5f1NFSN,ChuckGrassley,Chuck Grassley,Iowa,Republican
854,Fri Jul 29 16:29:26 +0000 2016,7.59063E+17,3,3,#99countymeetings Ft Madison 142ppl Siemens tour + Q&amp;A issues:tax credits Medicare mental health welfare wind energy,ChuckGrassley,Chuck Grassley,Iowa,Republican
855,Fri Jul 29 13:48:13 +0000 2016,7.59023E+17,2,2,Coach &amp; Asst. Coach of Ft Madison HS/MS cross country team https://t.co/J27C1nACwd,ChuckGrassley,Chuck Grassley,Iowa,Republican
856,Fri Jul 29 13:03:57 +0000 2016,7.59012E+17,9,3,Former Iowa Sen. James Harlan was in Statuary Hall from 1910 until he was replaced by Norman… https://t.co/Lza1IxEwRh,ChuckGrassley,Chuck Grassley,Iowa,Republican
857,Fri Jul 29 01:03:20 +0000 2016,7.5883E+17,12,39,Stopped at Mt Pleasant DQ for you know what. Gave us a chance to donate $1 for Children's… https://t.co/OL0YXmXzqS,ChuckGrassley,Chuck Grassley,Iowa,Republican
858,Thu Jul 28 22:17:59 +0000 2016,7.58789E+17,4,1,Lots of good Qs in Washington County #99countymeetings https://t.co/SeVl7fMmFn,ChuckGrassley,Chuck Grassley,Iowa,Republican
859,Thu Jul 28 18:10:52 +0000 2016,7.58726E+17,7,1,Thx to the Meyer kids for saying hi during lunch at the Mt Pleasant McDonald's https://t.co/USaKyGfEyY,ChuckGrassley,Chuck Grassley,Iowa,Republican
860,Thu Jul 28 01:38:59 +0000 2016,7.58477E+17,10,3,Eagle Point in Dubuque Co. where Pres Roosevelt came in 1937 to dedicate Lock and Dam #11 on… https://t.co/SNWI2xm8HT,ChuckGrassley,Chuck Grassley,Iowa,Republican
861,Wed Jul 27 15:58:45 +0000 2016,7.58331E+17,11,2,Had a nice tour yesterday at the National Mississippi River Museum &amp; Aquarium in Dubuque.… https://t.co/jYxO8O64q7,ChuckGrassley,Chuck Grassley,Iowa,Republican
862,Mon Jul 25 17:45:01 +0000 2016,7.57633E+17,9,2,Biked late morning w Dubuque constituents on the Heritage Trail 10miles. Trail is old Chicago Northwestern RR bed,ChuckGrassley,Chuck Grassley,Iowa,Republican
863,Mon Jul 25 17:41:32 +0000 2016,7.57632E+17,7,8,This morning my running partners in Dubuque were a business exec and a general surgeon  We ran in MtCarmelSisters of CharityBVM beautfulAREA,ChuckGrassley,Chuck Grassley,Iowa,Republican
864,Sun Jul 24 22:58:18 +0000 2016,7.57349E+17,1,4,Robert J Hibbs Congressional Medal of Honor recipient died in Vietnam. This is a trace of his… https://t.co/QCLeLbbRQF,ChuckGrassley,Chuck Grassley,Iowa,Republican
865,Sat Jul 23 19:50:36 +0000 2016,7.5694E+17,10,3,Traveling Vietnam Memorial Wall in Emmetsburg. Glad to have this piece of history stop in Iowa. https://t.co/0MTeLCibwo,ChuckGrassley,Chuck Grassley,Iowa,Republican
866,Sat Jul 23 00:52:17 +0000 2016,7.56653E+17,5,4,Honored Vietnam veterans tonight. This banquet was at the same time the traveling Vietnam… https://t.co/9yL4ryBloN,ChuckGrassley,Chuck Grassley,Iowa,Republican
867,Fri Jul 22 23:57:42 +0000 2016,7.56639E+17,5,4,Thx to Hannah from West Bend for the great service at Kirby's restaurant in Emmetsburg https://t.co/qP5RMQSMIJ,ChuckGrassley,Chuck Grassley,Iowa,Republican
