,created_at,id_str,reply_count,retweet_count,text,user,name,state,party
0,Mon May 22 13:47:40 +0000 2017,8.66652E+17,7,21,What a treat. Honor flight from Mid-Mo on my Southwest flight to DC this morning. #respect https://t.co/9ppKmFC8ZZ,clairecmc,Claire McCaskill,Missouri,Democratic
1,Sun May 21 05:03:05 +0000 2017,8.66157E+17,3,15,"Thanks guys. Great crowd, amazing energy. #teamclaire https://t.co/Jc8ol3IUQo",clairecmc,Claire McCaskill,Missouri,Democratic
2,Sat May 20 22:28:53 +0000 2017,8.66058E+17,21,39,"I do,but that doesn't solve problem for counties that don't have insurers, may happen if Trump refuses risk coverag… https://t.co/b7FC5MP4mC",clairecmc,Claire McCaskill,Missouri,Democratic
3,Sat May 20 22:25:32 +0000 2017,8.66057E+17,26,95,Change law to allow people who don't have insurer in their county to pick plan/use their subsidy on the D.C. exchan… https://t.co/jRxaTSVEN6,clairecmc,Claire McCaskill,Missouri,Democratic
4,Sat May 20 20:49:36 +0000 2017,8.66033E+17,51,178,Check out my idea for letting folks buy where Members of Congress buy health ins if they don't have plans available. https://t.co/XFZHPyLxo2,clairecmc,Claire McCaskill,Missouri,Democratic
5,Sat May 20 20:47:03 +0000 2017,8.66033E+17,5,67,"DC exchange has national plans, they insure  Cong staffers in all 50 states.Thats why letting folks buy there makes… https://t.co/nPSlWidarV",clairecmc,Claire McCaskill,Missouri,Democratic
6,Fri May 19 02:22:22 +0000 2017,8.65392E+17,101,531,It is a very bad idea to appoint a politician to head the FBI right now. We need a law enforcement professional. #bipartisan support.,clairecmc,Claire McCaskill,Missouri,Democratic
7,Thu May 18 12:49:29 +0000 2017,8.65188E+17,18,37,She deserves it. Party shouldn't  matter. She's working hard to save lives. https://t.co/KCaI033YCJ,clairecmc,Claire McCaskill,Missouri,Democratic
8,Thu May 18 12:40:57 +0000 2017,8.65185E+17,102,1135,I agree with @SenJohnMcCain.Unacceptable. They were assaulting these people on US soil.Turkish Ambassador should be… https://t.co/XfVcyslacr,clairecmc,Claire McCaskill,Missouri,Democratic
9,Wed May 17 13:27:32 +0000 2017,8.64835E+17,16,14,Senate Democrats honored to host law enforcement leaders from all over the country. #policeweek #respect https://t.co/knspW4kJYI,clairecmc,Claire McCaskill,Missouri,Democratic
10,Wed May 17 12:22:03 +0000 2017,8.64818E+17,4,38,"Welcome to the club of cancer warriors! You got this Mazie. ❤️#fightlikeagirl
Hirono Diagnosed With Kidney Cancer https://t.co/ocm6ggFBVI",clairecmc,Claire McCaskill,Missouri,Democratic
11,Tue May 16 14:27:07 +0000 2017,8.64487E+17,47,135,Intelligence on ISIS is our most valuable asset in war against terrorism.Extreme caution must be used to protect it &amp; allies that provide it,clairecmc,Claire McCaskill,Missouri,Democratic
12,Tue May 16 14:23:46 +0000 2017,8.64487E+17,2,9,Whoops. Forgot link. Sorry. https://t.co/9bix38VDty https://t.co/AA9JcBT4iO,clairecmc,Claire McCaskill,Missouri,Democratic
13,Tue May 16 14:20:51 +0000 2017,8.64486E+17,4,4,Thanks Miss Dazey. Here's a link to the op-ed. https://t.co/AA9JcBT4iO,clairecmc,Claire McCaskill,Missouri,Democratic
14,Tue May 16 11:29:16 +0000 2017,8.64443E+17,7,19,"Proud of Boeing.Shelley Lavender and Leanne Caret are their high powered leaders(CEO Defense,Pres Boeing Military)… https://t.co/gjll5vgzuQ",clairecmc,Claire McCaskill,Missouri,Democratic
15,Fri May 12 12:59:48 +0000 2017,8.63016E+17,4,14,I agree. Give Grant a break. The source he cited was just wrong. Thanks all! https://t.co/fK52o2N0my,clairecmc,Claire McCaskill,Missouri,Democratic
16,Fri May 12 12:32:25 +0000 2017,8.63009E+17,32,47,Um. Not true. It's been a couple of weeks. https://t.co/pQ9HTBpHVj,clairecmc,Claire McCaskill,Missouri,Democratic
17,Fri May 12 12:29:35 +0000 2017,8.63008E+17,8,78,Today is military spouses appreciation day. From the bottom of my heart I salute you and the many sacrifices you make for our country. 🇺🇸🇺🇸,clairecmc,Claire McCaskill,Missouri,Democratic
18,Tue May 09 15:27:03 +0000 2017,8.61966E+17,89,235,"Simple fact.When fewer people have health care coverage it makes it more expensive for those that do. 24 mil lose care,premiums will go ⬆️",clairecmc,Claire McCaskill,Missouri,Democratic
19,Mon May 08 04:59:35 +0000 2017,8.61445E+17,6,32,"So the opening screen shot with MISSOURI was great, but Guardians of Galaxy 2 was even better. So fun. We are proud of you @JamesGunn! #STL",clairecmc,Claire McCaskill,Missouri,Democratic
20,Sun May 07 03:10:12 +0000 2017,8.61056E+17,4,16,Thank you! It was an honor to be there. https://t.co/GCelMNlTYJ,clairecmc,Claire McCaskill,Missouri,Democratic
21,Sat May 06 23:22:22 +0000 2017,8.60998E+17,6,8,On my way to interview Sheryl Sandberg about her book. #KC https://t.co/LgF3S3H3Gi,clairecmc,Claire McCaskill,Missouri,Democratic
22,Sat May 06 15:39:03 +0000 2017,8.60882E+17,5,38,Wow. Big turnout. #TeamClaire #KCwomen https://t.co/ozX1ZFvMnQ,clairecmc,Claire McCaskill,Missouri,Democratic
23,Sat May 06 12:05:11 +0000 2017,8.60828E+17,10,85,Great to see the entire Kander family! https://t.co/hwmgEKF0nb,clairecmc,Claire McCaskill,Missouri,Democratic
24,Fri May 05 13:55:17 +0000 2017,8.60493E+17,6,17,Eureka.  https://t.co/zflTBT0248,clairecmc,Claire McCaskill,Missouri,Democratic
25,Fri May 05 13:36:19 +0000 2017,8.60488E+17,8,27,That's not supposed to be an island. https://t.co/4idA23aswX,clairecmc,Claire McCaskill,Missouri,Democratic
26,Fri May 05 13:30:58 +0000 2017,8.60487E+17,3,8,Flying along Missouri River.  https://t.co/YfguN1ShbI,clairecmc,Claire McCaskill,Missouri,Democratic
27,Fri May 05 13:27:31 +0000 2017,8.60486E+17,5,4,Taking off.  https://t.co/y8M31BP8av,clairecmc,Claire McCaskill,Missouri,Democratic
28,Fri May 05 13:14:16 +0000 2017,8.60483E+17,3,11,Preparing for our flood survey this morning. https://t.co/9iYfJ9Z7c3,clairecmc,Claire McCaskill,Missouri,Democratic
29,Fri May 05 13:12:59 +0000 2017,8.60482E+17,7,15,Grateful to Coast Guard for taking me along this morning. Missouri floods. https://t.co/B6kV4TOVss,clairecmc,Claire McCaskill,Missouri,Democratic
30,Fri May 05 03:03:52 +0000 2017,8.60329E+17,60,221,It will dramatically cut Medicaid. It will cut treatment for addiction. https://t.co/3kmL1n7onF,clairecmc,Claire McCaskill,Missouri,Democratic
31,Thu May 04 23:02:06 +0000 2017,8.60268E+17,24,45,Just got off phone with FEMA regional administrator re:devastating flooding across our state. On it. Tomorrow will tour with Army Corps.,clairecmc,Claire McCaskill,Missouri,Democratic
32,Thu May 04 22:51:45 +0000 2017,8.60266E+17,69,179,Yup. It's a tax cut bill for the wealthy that cuts Medicaid and increases premiums for older Missourians. So bad. L… https://t.co/ublscVk8rq,clairecmc,Claire McCaskill,Missouri,Democratic
33,Thu May 04 14:18:19 +0000 2017,8.60137E+17,120,2263,No CBO score but the doctors in America say this about Republican healthcare plan. https://t.co/wFHrFkfGvx,clairecmc,Claire McCaskill,Missouri,Democratic
34,Wed May 03 22:29:34 +0000 2017,8.59898E+17,6,36,Talking to CEO Gail McGovern of the Red Cross today. Thank you to all the amazing volunteers who sheltered 750 Miss… https://t.co/qNpKEzLWOr,clairecmc,Claire McCaskill,Missouri,Democratic
35,Wed May 03 22:26:51 +0000 2017,8.59897E+17,11,79,Want to make sure all Missourians know resources available to deal with our devastating floods. https://t.co/5jrVqzcUyU,clairecmc,Claire McCaskill,Missouri,Democratic
36,Tue May 02 03:23:33 +0000 2017,8.59247E+17,33,142,Nope. It's a victory for those hard working folks who earned their healthcare &amp; pension. Now let's fix truck driver… https://t.co/sl5Ytzu5qr,clairecmc,Claire McCaskill,Missouri,Democratic
37,Mon May 01 17:38:12 +0000 2017,8.591E+17,5,21,Thank you Tracy. Educators rock! https://t.co/9PYoMYqIYC,clairecmc,Claire McCaskill,Missouri,Democratic
38,Mon May 01 01:02:19 +0000 2017,8.58849E+17,11,37,Worried about all of our flooding. https://t.co/tNe7aJmpAA,clairecmc,Claire McCaskill,Missouri,Democratic
39,Sat Apr 29 02:13:42 +0000 2017,8.58142E+17,11,15,We celebrate in Busch as Blues go up 2-1 in 3rd period. #StanleyCupPlayoffs2017 https://t.co/jjDT1a2wOg,clairecmc,Claire McCaskill,Missouri,Democratic
40,Sat Apr 29 00:18:46 +0000 2017,8.58113E+17,10,20,Daughter Mads and I at the Cards game. Go Cards! Let's Go Blues! Big night for STL. https://t.co/apzQIQtE8R,clairecmc,Claire McCaskill,Missouri,Democratic
41,Thu Apr 27 15:55:47 +0000 2017,8.57624E+17,90,612,Wrong. Along with @Sen_JoeManchin the Ds have been fighting for months to get this done. McConnell has been blockin… https://t.co/Ey4aEcyCtR,clairecmc,Claire McCaskill,Missouri,Democratic
42,Thu Apr 20 16:31:53 +0000 2017,8.55097E+17,37,96,Please Mr President. Help us help them! Miners Lament Trump’s Silence on Imperiled Health Plan https://t.co/swrEp79TIP,clairecmc,Claire McCaskill,Missouri,Democratic
43,Thu Apr 20 16:20:27 +0000 2017,8.55094E+17,4,32,"Jerry was the consummate professional, even when all our hearts were breaking over the death of Gov Carnahan. RIP. https://t.co/Bj2famC9yW",clairecmc,Claire McCaskill,Missouri,Democratic
44,Tue Apr 18 19:33:54 +0000 2017,8.54418E+17,32,84,Thanks to all who came out. Good questions. https://t.co/iL3oGPjKT7,clairecmc,Claire McCaskill,Missouri,Democratic
45,Tue Apr 18 18:22:41 +0000 2017,8.544E+17,34,22,"Wish him well but still wrong that college campuses are now 6 mos NBA training camp. ""student athletes""? Nope. #NCAA https://t.co/e2iFdj6Hk8",clairecmc,Claire McCaskill,Missouri,Democratic
46,Sun Apr 16 18:18:42 +0000 2017,8.53674E+17,11,10,Way bigger than him. Love my youngest grandson. Go Chiefs! https://t.co/wb1YvREyQZ,clairecmc,Claire McCaskill,Missouri,Democratic
47,Sat Apr 15 03:04:42 +0000 2017,8.53082E+17,6,32,Sorry @amyklobuchar but...LET'S GO BLUES! #StanleyCupPlayoffs2017,clairecmc,Claire McCaskill,Missouri,Democratic
48,Sat Apr 15 00:44:56 +0000 2017,8.53046E+17,41,84,"With over 5,500 BRAND NEW Missouri donors and avg donation of $58! Thank you! https://t.co/isszV0APk5",clairecmc,Claire McCaskill,Missouri,Democratic
49,Fri Apr 14 22:56:26 +0000 2017,8.53019E+17,11,28,Yikes. https://t.co/KB8fKfG9jM,clairecmc,Claire McCaskill,Missouri,Democratic
50,Fri Apr 14 21:28:42 +0000 2017,8.52997E+17,16,40,Thank you Steve. That means a lot. https://t.co/z4cW5uDcz5,clairecmc,Claire McCaskill,Missouri,Democratic
51,Wed Apr 12 18:53:35 +0000 2017,8.52233E+17,34,44,"Great townhall in Sikeston. Lots of folks came on their lunch hour. Different opinions, good questions.",clairecmc,Claire McCaskill,Missouri,Democratic
52,Wed Apr 12 15:58:59 +0000 2017,8.52189E+17,6,23,Thank you! https://t.co/x9X8noTKyD,clairecmc,Claire McCaskill,Missouri,Democratic
53,Tue Apr 11 21:38:16 +0000 2017,8.51912E+17,3,7,"No, Thursday afternoon.  Hillsboro,Sikeston, and Fulton tomorrow. https://t.co/DuScREROoy",clairecmc,Claire McCaskill,Missouri,Democratic
54,Tue Apr 11 14:04:20 +0000 2017,8.51798E+17,55,161,Town halls this week. Many more to come. https://t.co/6QR4k3jTiq,clairecmc,Claire McCaskill,Missouri,Democratic
55,Sun Apr 09 16:40:51 +0000 2017,8.51113E+17,19,21,"The almost Bride, along with Maid of Honor , and me. Mom. #mygirls https://t.co/Vz26Q2UXN7",clairecmc,Claire McCaskill,Missouri,Democratic
56,Fri Apr 07 16:52:39 +0000 2017,8.50391E+17,61,42,"My statement on strike against Syria:
https://t.co/BjOcEgULqX",clairecmc,Claire McCaskill,Missouri,Democratic
57,Fri Apr 07 13:28:56 +0000 2017,8.5034E+17,33,80,"Hope this is a blip and not a trend. Not good. Job Growth Loses Steam. We only add 98,000 in March, via @nytimes https://t.co/fiDCh0B5cO",clairecmc,Claire McCaskill,Missouri,Democratic
58,Thu Apr 06 15:06:06 +0000 2017,8.50002E+17,42,41,Nope. The town halls will be all over Missouri. https://t.co/IQfa1uxr71,clairecmc,Claire McCaskill,Missouri,Democratic
59,Thu Apr 06 14:52:49 +0000 2017,8.49998E+17,85,267,"Eight townhalls next week. Places, dates, and times coming soon.",clairecmc,Claire McCaskill,Missouri,Democratic
60,Wed Apr 05 21:11:45 +0000 2017,8.49731E+17,78,176,Assad=war criminal. His ally Putin=aiding and abetting.,clairecmc,Claire McCaskill,Missouri,Democratic
61,Wed Apr 05 13:22:19 +0000 2017,8.49613E+17,27,38,Good audit. MO state budget 1/3 federal money. Audit shows MO not paying attention to waste fraud and abuse. https://t.co/G2tyXqr6W8,clairecmc,Claire McCaskill,Missouri,Democratic
62,Sun Apr 02 22:29:40 +0000 2017,8.48664E+17,62,43,Hate to miss opening game but #CapsOn. Go Cards. #Cardinals #OpeningDaySTL https://t.co/HSg4e1L2LQ,clairecmc,Claire McCaskill,Missouri,Democratic
63,Sun Apr 02 12:38:35 +0000 2017,8.48515E+17,33,32,Sunday morning. Grandchildren. Standing at attention while watching Return of the Jedi. Perfect. #StarWars https://t.co/Fk6hvoxUt3,clairecmc,Claire McCaskill,Missouri,Democratic
64,Sat Apr 01 11:52:10 +0000 2017,8.48141E+17,103,143,"Sad! 
Caterpillar shuts plant in Aurora, Illinois, that employs 800 | Reuters https://t.co/HvKH68c7lf",clairecmc,Claire McCaskill,Missouri,Democratic
65,Sat Apr 01 02:26:12 +0000 2017,8.47999E+17,354,354,"Gorsuch: Good for Corporations, Bad for Working People https://t.co/HH8FVzUr1Z",clairecmc,Claire McCaskill,Missouri,Democratic
66,Fri Mar 31 20:12:36 +0000 2017,8.47904E+17,1478,3028,"No on Gorsuch: 
 https://t.co/LfP5n4QyNC",clairecmc,Claire McCaskill,Missouri,Democratic
67,Thu Mar 30 11:59:11 +0000 2017,8.47418E+17,152,224,"Very bad: Trump's travel ban could cost $18B in U.S. tourism, analysis shows https://t.co/HuEHjBFoXw",clairecmc,Claire McCaskill,Missouri,Democratic
68,Tue Mar 28 17:30:42 +0000 2017,8.46777E+17,63,83,We have 5% of world population. 80% of opioids.  https://t.co/7nxfOCvJup. Time to get to the bottom of it.,clairecmc,Claire McCaskill,Missouri,Democratic
69,Tue Mar 28 13:37:07 +0000 2017,8.46718E+17,90,148,Time for investigation into manufacturer &amp; distribution of Opoids.Why is US alone in being flooded with these drugs? https://t.co/kgGWbAkHTV,clairecmc,Claire McCaskill,Missouri,Democratic
70,Sat Mar 25 13:18:16 +0000 2017,8.45626E+17,14,36,And we are very excited. Welcome home to the #1 high school BB player in the nation! @TheMPJ1 #Mizzou https://t.co/ybv7PHQMCl,clairecmc,Claire McCaskill,Missouri,Democratic
71,Thu Mar 23 17:36:41 +0000 2017,8.44966E+17,90,454,It's a tax cut bill for the wealthy that takes healthcare away from everyone else. https://t.co/7v0IgT5Zpj,clairecmc,Claire McCaskill,Missouri,Democratic
72,Thu Mar 23 14:24:28 +0000 2017,8.44918E+17,50,180,Trumpcare is more of a tax cut bill than healthcare bill. Powerful chart that shows priorities.  https://t.co/MfcOAZP6XT,clairecmc,Claire McCaskill,Missouri,Democratic
73,Thu Mar 23 01:12:27 +0000 2017,8.44718E+17,72,265,This is just wrong. How the Rich Gain and the Poor Lose Under the Republican Health Care Plan - The New York Times https://t.co/sbwWtSFop4,clairecmc,Claire McCaskill,Missouri,Democratic
74,Wed Mar 22 20:34:05 +0000 2017,8.44648E+17,21,79,https://t.co/oymuXEXSp0,clairecmc,Claire McCaskill,Missouri,Democratic
75,Wed Mar 22 15:14:55 +0000 2017,8.44568E+17,43,170,Trump healthcare bill 300 BILLION  tax cut for wealthy AND cuts access to treatment for heroin addiction. https://t.co/5wVIKbuZdW,clairecmc,Claire McCaskill,Missouri,Democratic
76,Wed Mar 22 15:10:06 +0000 2017,8.44567E+17,21,17,Trump healt https://t.co/5wVIKbuZdW,clairecmc,Claire McCaskill,Missouri,Democratic
77,Tue Mar 21 14:20:58 +0000 2017,8.44192E+17,97,213,"Seriously? Unbelievable. Exclusive: Tillerson plans to skip NATO meeting, visit Russia in April - sources | Reuters https://t.co/vQNmpybPaY",clairecmc,Claire McCaskill,Missouri,Democratic
78,Sun Mar 19 14:38:02 +0000 2017,8.43472E+17,36,27,Lucky to have so many thank you notes to sign. So grateful. How about $5? https://t.co/XP5h4rmIAT https://t.co/C81W3N2jbK,clairecmc,Claire McCaskill,Missouri,Democratic
79,Sun Mar 19 02:03:15 +0000 2017,8.43282E+17,23,84,A St Louis icon who will be missed. Thank you Chuck for the legacy of your music. https://t.co/VOnatAOEzF,clairecmc,Claire McCaskill,Missouri,Democratic
80,Sun Mar 19 02:00:21 +0000 2017,8.43281E+17,2,31,Impressive. Congrats to a fellow Kewpie! #Mizzou https://t.co/hsU1q4k7uB,clairecmc,Claire McCaskill,Missouri,Democratic
81,Fri Mar 17 23:19:52 +0000 2017,8.42878E+17,10,22,"Down by 13 at half, women Tigers make it happen at the buzzer!  🏀#Mizzou",clairecmc,Claire McCaskill,Missouri,Democratic
82,Fri Mar 17 02:47:19 +0000 2017,8.42568E+17,131,1135,Remember these budget cuts being delivered AT THE SAME TIME President is working to pass a 300 billion dollar tax cut to wealthy.,clairecmc,Claire McCaskill,Missouri,Democratic
83,Thu Mar 16 23:41:01 +0000 2017,8.42521E+17,282,2769,Sorry Frank. The seniors who need  Meals on Wheels are not following your twitter feed. And can't afford broadband/… https://t.co/GiZwBlLyHg,clairecmc,Claire McCaskill,Missouri,Democratic
84,Thu Mar 16 14:15:33 +0000 2017,8.42379E+17,152,1090,"Turns out that the President's idea of ""taking care of people"" is a 300 billion tax cut for the wealthy and eliminating Meals on Wheels.",clairecmc,Claire McCaskill,Missouri,Democratic
85,Wed Mar 15 20:57:51 +0000 2017,8.42118E+17,37,96,2 certainties. 100s of billions of dollars in tax cuts for wealthy and it will be brutal for Missourians b/w 50-64.  https://t.co/EbTn8BQTDZ,clairecmc,Claire McCaskill,Missouri,Democratic
86,Wed Mar 15 13:57:53 +0000 2017,8.42012E+17,9,12,Great advice. You're right. https://t.co/GPdQ3CWN0R,clairecmc,Claire McCaskill,Missouri,Democratic
87,Wed Mar 15 13:35:27 +0000 2017,8.42006E+17,77,7,Taking 15 minute recess to fill out office bracket. Wichita State or Kentucky?,clairecmc,Claire McCaskill,Missouri,Democratic
88,Mon Mar 13 16:16:14 +0000 2017,8.41322E+17,38,33,"On Saturday we had 1,255  people donate to my campaign. Wow. I am so grateful. Thank you so much. 
https://t.co/XP5h4rEjsr",clairecmc,Claire McCaskill,Missouri,Democratic
89,Sat Mar 11 12:03:37 +0000 2017,8.40534E+17,57,281,So much for taking care of the forgotten Americans.  https://t.co/E1BXaZaM3O,clairecmc,Claire McCaskill,Missouri,Democratic
90,Sat Mar 11 11:59:38 +0000 2017,8.40533E+17,35,102,"Is anyone really surprised?So wrong.Wealthy Would Get Billions in Tax Cuts Under Obamacare Repeal Plan, via @nytimes https://t.co/E1BXaZaM3O",clairecmc,Claire McCaskill,Missouri,Democratic
91,Sat Mar 11 04:56:43 +0000 2017,8.40426E+17,5,12,Thank you Sarita. Means a lot to me. https://t.co/Tpx1WPLFgB,clairecmc,Claire McCaskill,Missouri,Democratic
92,Fri Mar 10 18:33:44 +0000 2017,8.40269E+17,18,12,Thank you! Right back at you. I really enjoyed Elgible. https://t.co/xssk4Jp7uh,clairecmc,Claire McCaskill,Missouri,Democratic
93,Thu Mar 09 23:53:48 +0000 2017,8.39988E+17,0,5,@SFofStL Re: prob w/FAFSA u tweeted about last https://t.co/ptBfcv300W's work around. https://t.co/RyCgZf1dIb,clairecmc,Claire McCaskill,Missouri,Democratic
94,Thu Mar 09 18:49:26 +0000 2017,8.39911E+17,5,13,Happy for Kim. And great for the team. M I. Z. https://t.co/VuzTtMGEsp,clairecmc,Claire McCaskill,Missouri,Democratic
95,Thu Mar 09 17:44:49 +0000 2017,8.39895E+17,3,20,Great group of 9th graders from Central Reform Congregation St. Louis visiting DC Thnx 4 stopping by!@WakeUp2Politi… https://t.co/5eVYjPzRv3,clairecmc,Claire McCaskill,Missouri,Democratic
96,Thu Mar 09 13:44:13 +0000 2017,8.39834E+17,76,170,Ironic that Trumpcare hurts older Missourians in rural areas and helps younger in urban areas. #hurtsTrumpvoters,clairecmc,Claire McCaskill,Missouri,Democratic
97,Thu Mar 09 03:21:30 +0000 2017,8.39677E+17,14,46,I'm on it. You will hear from us first thing in the morning. https://t.co/pAs7lFlQH8,clairecmc,Claire McCaskill,Missouri,Democratic
98,Wed Mar 08 17:27:15 +0000 2017,8.39528E+17,72,154,"Trumpcare: ""1. This is a major tax cut for the rich. 2. Lower-income workers are going to feel the biggest squeeze""(From WashingtonPost).",clairecmc,Claire McCaskill,Missouri,Democratic
99,Wed Mar 08 14:12:17 +0000 2017,8.39479E+17,124,172,"We made mistakes on process of passing Obamacare. Trumpcare repeating those mistakes on steroids. Jamming bill, no cost estimate, no D votes",clairecmc,Claire McCaskill,Missouri,Democratic
100,Tue Mar 07 21:18:36 +0000 2017,8.39224E+17,26,22,Great to visit with a warrior for women being treated with respect and dignity. @GretchenCarlson. Watch for her boo… https://t.co/K9kuA2OxMo,clairecmc,Claire McCaskill,Missouri,Democratic
101,Mon Mar 06 18:25:18 +0000 2017,8.38818E+17,22,57,Good luck to all the candidates in St Louis City municipal elections tomorrow. If you live in the city don't forget to vote!,clairecmc,Claire McCaskill,Missouri,Democratic
102,Fri Mar 03 16:42:22 +0000 2017,8.37705E+17,255,108,"WHERE IS THE BILL? G.O.P. Accused of Playing ‘Hide-and-Seek’ With Obamacare Replacement Bill, via @nytimes https://t.co/ZWW7Jtsuhs",clairecmc,Claire McCaskill,Missouri,Democratic
103,Thu Mar 02 16:46:33 +0000 2017,8.37343E+17,1959,361,"As the chief law enforcement officer in this nation,he should resign.He sets the example,good prosecutor knows bett… https://t.co/4OPgAg9oGl",clairecmc,Claire McCaskill,Missouri,Democratic
104,Thu Mar 02 15:37:34 +0000 2017,8.37326E+17,1410,259,4 years ago went to meeting of many Senators about international adoptions. Russian Amb also attended.,clairecmc,Claire McCaskill,Missouri,Democratic
105,Thu Mar 02 15:36:29 +0000 2017,8.37326E+17,1104,463,"Again, As senior member of Armed Serv, never received call or request from Russian Amb for meeting. Never met one on one w/him.",clairecmc,Claire McCaskill,Missouri,Democratic
106,Thu Mar 02 12:06:20 +0000 2017,8.37273E+17,2758,13260,I've been on the Armed Services Com for 10 years.No call or meeting w/Russian ambassador. Ever. Ambassadors call members of Foreign Rel Com.,clairecmc,Claire McCaskill,Missouri,Democratic
107,Wed Mar 01 20:26:44 +0000 2017,8.37036E+17,113,95,So good to see my friend Michael J Fox in the Capitol.He was a big help in my first campaign. Remember the ad? https://t.co/9IgkN6zGN7,clairecmc,Claire McCaskill,Missouri,Democratic
108,Wed Mar 01 05:08:16 +0000 2017,8.36805E+17,32,104,"Deadly tornado in MO this evening, touched down near Perryville. Lives lost. My prayers for their families.",clairecmc,Claire McCaskill,Missouri,Democratic
109,Tue Feb 28 23:05:17 +0000 2017,8.36714E+17,74,113,Insulting to Missouri Rs. They don't need help figuring out critical tweets about me. 😬Besides those tweets are lam… https://t.co/9v24aTNfmS,clairecmc,Claire McCaskill,Missouri,Democratic
110,Tue Feb 28 13:35:49 +0000 2017,8.36571E+17,266,2204,Totally nuts. DeVos pretending that establishment of historically black colleges was about choice not racism. https://t.co/gROpItxRx4,clairecmc,Claire McCaskill,Missouri,Democratic
111,Mon Feb 27 20:50:22 +0000 2017,8.36318E+17,13,17,It was an honor to be there. Lots of good questions! https://t.co/cMazRTWUnn,clairecmc,Claire McCaskill,Missouri,Democratic
112,Sun Feb 26 23:31:51 +0000 2017,8.35996E+17,26,26,First costumes to arrive at family Oscar party. I made Manchester by the Seafood casserole. 😊 https://t.co/xyBMRcf1Pk,clairecmc,Claire McCaskill,Missouri,Democratic
113,Sun Feb 26 01:43:29 +0000 2017,8.35667E+17,18,13,"At PBR in St Louis tonight. Exciting and great fun. With my sisters, one of which is PBR fanatic. https://t.co/dKj6AOGc9H",clairecmc,Claire McCaskill,Missouri,Democratic
114,Fri Feb 24 20:08:17 +0000 2017,8.3522E+17,26,134,These men worked hard &amp;played by the rules. They were promised a pension. I will fight for them. #pensionpromise https://t.co/jOszZ3aeMI,clairecmc,Claire McCaskill,Missouri,Democratic
115,Fri Feb 24 13:40:23 +0000 2017,8.35122E+17,14,127,"‘It wasn’t right,’ says Olathe man wounded at Austins while trying to stop shooter https://t.co/PHIZwtypWi (2/2)",clairecmc,Claire McCaskill,Missouri,Democratic
116,Fri Feb 24 13:39:19 +0000 2017,8.35122E+17,53,238,"Pure hate &amp; one hero in KC. Murderer bragged to bartender about shooting men from ""Middle East"". They were 2 engineers from India.(1/2)",clairecmc,Claire McCaskill,Missouri,Democratic
117,Tue Feb 21 21:42:29 +0000 2017,8.34156E+17,40,26,Wonderful to meet and learn from the Border Patrol. Our night crew. https://t.co/6osibS0OuZ,clairecmc,Claire McCaskill,Missouri,Democratic
118,Mon Feb 20 23:15:30 +0000 2017,8.33817E+17,114,747,"Please catch the hateful, evil people who did this. This is not normal. Or acceptable. This is not what America sta… https://t.co/LNBnMI1n17",clairecmc,Claire McCaskill,Missouri,Democratic
119,Mon Feb 20 22:11:12 +0000 2017,8.33801E+17,38,59,Last night on the Mexican border in Rio Grand Valley with the Border Patrol. Learning about their challenges &amp; need… https://t.co/fafh7bDosD,clairecmc,Claire McCaskill,Missouri,Democratic
120,Thu Feb 16 17:36:24 +0000 2017,8.32282E+17,137,217,Thanks Jason. @Let_AmericaVote  matters too! https://t.co/X6G35Pnme4,clairecmc,Claire McCaskill,Missouri,Democratic
121,Thu Feb 16 01:01:29 +0000 2017,8.32032E+17,42,255,Proud to work with Ashton Kutcher @aplusk to wipe out evil child sex trafficking. His software &amp; people at @thorn a… https://t.co/TSpxgJRqXS,clairecmc,Claire McCaskill,Missouri,Democratic
122,Wed Feb 15 16:32:12 +0000 2017,8.31904E+17,156,417,The question no one can answer yet...why does President Trump refuse to criticize Putin? We must have that answer for our nation's security.,clairecmc,Claire McCaskill,Missouri,Democratic
123,Wed Feb 15 14:34:00 +0000 2017,8.31874E+17,48,60,"Well this is quite a turn of events. Rs said""Repeal and Replace"" for 7 years. Sounded simple?… https://t.co/lbH5pqWSnI",clairecmc,Claire McCaskill,Missouri,Democratic
124,Tue Feb 14 16:42:36 +0000 2017,8.31544E+17,53,610,This is Darrell Issa's former spokesman stating the obvious. Are you paying attention @jasoninthehouse? Hello? https://t.co/m9BuzrmFAJ,clairecmc,Claire McCaskill,Missouri,Democratic
