,created_at,id_str,reply_count,retweet_count,text,user,name,state,party
1971,Sun Dec 18 18:14:54 +0000 2011,1.48466E+17,2,1,@Skoumal No. Unlike Bush tax cuts it is paid for. Will not jeopardize SS.,clairecmc,Claire McCaskill,Missouri,Democratic
1972,Sun Dec 18 18:13:26 +0000 2011,1.48466E+17,1,1,@jvaragona that's what we wanted. Senate Rs insisted on short term deal. I agree with you.,clairecmc,Claire McCaskill,Missouri,Democratic
1973,Sun Dec 18 18:07:12 +0000 2011,1.48464E+17,38,100,"Rs in house will fiercely fight to prevent taxes going up even a dime on mega wealthy,but ok with taxes going up on working families.Weird.",clairecmc,Claire McCaskill,Missouri,Democratic
1974,Sun Dec 18 18:03:22 +0000 2011,1.48463E+17,12,42,Huh? Senate votes 89-10!! to make sure taxes don't go up for working folks. House Rs balking. Talk about extreme.,clairecmc,Claire McCaskill,Missouri,Democratic
1975,Wed Dec 14 21:08:56 +0000 2011,1.47061E+17,18,28,"""If I was in the U.S. Senate,I would fight for a clean up or down vote on extending this tax cut.""says Sarah Steelman.She's right & I am.",clairecmc,Claire McCaskill,Missouri,Democratic
1976,Wed Dec 14 15:31:25 +0000 2011,1.46976E+17,20,16,"To be clear,the D leader asked consent to vote on the House R bill. The leader of the Rs objected. Please. Let's vote. Need to move forward.",clairecmc,Claire McCaskill,Missouri,Democratic
1977,Wed Dec 14 15:10:46 +0000 2011,1.4697E+17,22,43,Only in Washington.Republicans in Senate are blocking our ability to vote on the Republican bill from House.Makes no sense.,clairecmc,Claire McCaskill,Missouri,Democratic
1978,Tue Dec 13 19:09:34 +0000 2011,1.46668E+17,4,11,Congratulations to my colleague Sen Blunt on his election to Republican leadership. Good for Missouri and for the Senate.,clairecmc,Claire McCaskill,Missouri,Democratic
1979,Thu Dec 08 15:46:16 +0000 2011,1.44805E+17,10,16,Oh no! Say it aint so Albert! #stlcards #11in11 #WSChamps,clairecmc,Claire McCaskill,Missouri,Democratic
1980,Tue Dec 06 12:11:16 +0000 2011,1.44026E+17,6,9,"Hearing today, my sub comm on contracting oversight: Protecting whistleblowers,ALL of them, even those that work for govt contractors.",clairecmc,Claire McCaskill,Missouri,Democratic
1981,Tue Dec 06 12:06:13 +0000 2011,1.44025E+17,9,30,"Big news today,bipartisan breakthrough on jobs.Collins-McCaskill bill prevents tax increase for middle class &invests in infrastructure.",clairecmc,Claire McCaskill,Missouri,Democratic
1982,Fri Dec 02 23:10:32 +0000 2011,1.42742E+17,6,7,"First please watch this. http://t.co/tD62yQoz Then do this: bit.ly/cmc_infr 
Thank you.",clairecmc,Claire McCaskill,Missouri,Democratic
1983,Fri Dec 02 03:56:43 +0000 2011,1.42452E+17,21,22,Supported Feinstein amdt today to protect rights of US citizens. We can defend liberties and fight terrorists.    http://t.co/m2thtSL1,clairecmc,Claire McCaskill,Missouri,Democratic
1984,Fri Dec 02 01:19:45 +0000 2011,1.42413E+17,9,4,Rs version of payroll tax cut is great deal for contractors.Does no good to limit fed employees if you don't limit hiring of contractors.,clairecmc,Claire McCaskill,Missouri,Democratic
1985,Thu Dec 01 16:20:18 +0000 2011,1.42277E+17,7,3,Uzbekistan is the major foreign supplier of electricity to Afghnstn.@emptywheel @DaleWLewis,clairecmc,Claire McCaskill,Missouri,Democratic
1986,Thu Dec 01 02:59:08 +0000 2011,1.42075E+17,12,7,Also tomorrow am Morning Joe and Fox with Senator Toomey on our bill for permanent earmark ban.,clairecmc,Claire McCaskill,Missouri,Democratic
1987,Thu Dec 01 02:57:54 +0000 2011,1.42075E+17,9,19,"Tomorrow morning will speak on my amndmnt to pull $ for large infrastructure projects in Afghnstn,instead put it in our  highway trust fund.",clairecmc,Claire McCaskill,Missouri,Democratic
1988,Mon Nov 28 18:29:37 +0000 2011,1.41222E+17,6,8,Just introduced myself to John Brunner in the security line at Lambert airport. He and his wife on my American flight to DC.,clairecmc,Claire McCaskill,Missouri,Democratic
1989,Sun Nov 27 00:33:34 +0000 2011,1.40589E+17,9,5,Here's hoping there are more Border Wars...but as always so sweet to beat the Jayhawks! Almost as sweet as my daughters http://t.co/lsZFJd6m,clairecmc,Claire McCaskill,Missouri,Democratic
1990,Wed Nov 23 23:33:02 +0000 2011,1.39487E+17,10,4,"Turkeys brining,1 for Big Green Egg,1 for oven.Now on to baking,first lemon cake,then pumpkin pies. Did I mention I LOVE Thanksgiving?",clairecmc,Claire McCaskill,Missouri,Democratic
1991,Sun Nov 20 15:30:06 +0000 2011,1.38278E+17,12,2,Off to Kansas City later today for dinner and speech tonight. Back to St Louis early Monday for visit to Boeing.,clairecmc,Claire McCaskill,Missouri,Democratic
1992,Sat Nov 19 19:07:56 +0000 2011,1.3797E+17,19,5,On my way to Mizzou game. M I Z....,clairecmc,Claire McCaskill,Missouri,Democratic
1993,Wed Nov 16 14:27:20 +0000 2011,1.36813E+17,19,7,Why doesn't Fed gov do better job suspending and barring bad contractors? Off to hearing to work on that real problem.,clairecmc,Claire McCaskill,Missouri,Democratic
1994,Sat Nov 12 14:52:32 +0000 2011,1.35369E+17,13,1,"No more teenagers! My youngest Lily is 20 today, Happy Birthday to her!
 Makes me sad/makes me happy....",clairecmc,Claire McCaskill,Missouri,Democratic
1995,Thu Nov 10 01:27:24 +0000 2011,1.34442E+17,7,4,"Just did great teletownhall meeting w/thousands of Missouri veterans & families.Great questions,and some new casework for our office.",clairecmc,Claire McCaskill,Missouri,Democratic
1996,Tue Nov 08 20:05:37 +0000 2011,1.33999E+17,13,40,There should be no R and no D when it comes to protecting and honoring our veterans. Just grateful Americans. http://t.co/5KAyKanx,clairecmc,Claire McCaskill,Missouri,Democratic
1997,Tue Nov 08 20:03:24 +0000 2011,1.33998E+17,4,8,"Today is a gorgeous day in DC, perfect for KC and STL Honor Flights. So great to see and honor #MO veterans. http://t.co/IvZLCOb4",clairecmc,Claire McCaskill,Missouri,Democratic
1998,Sun Nov 06 22:00:24 +0000 2011,1.33303E+17,15,23,"It's official this afternoon. Mizzou to the SEC. Very mixed emotions. Sad, but understand the decision. Hoping we can hold on to KU rivalry.",clairecmc,Claire McCaskill,Missouri,Democratic
1999,Sat Nov 05 23:53:21 +0000 2011,1.32969E+17,8,5,Bulletin. This just in. My sister Lisa spotted on mechanical bull at Texas County Chili Cookoff this afternoon. Good news or bad news?#MO,clairecmc,Claire McCaskill,Missouri,Democratic
2000,Sat Nov 05 18:22:50 +0000 2011,1.32886E+17,5,1,"Thnx to my sisters,representing me at the Texas County Chili Cookoff today while I'm in Springfield.Dad would be happy,Houston his hometown",clairecmc,Claire McCaskill,Missouri,Democratic
2001,Sat Nov 05 12:15:09 +0000 2011,1.32793E+17,11,6,On my way to Springfield #MO today. Want to compare and contrast management of veterans cemetery there with Arlington.,clairecmc,Claire McCaskill,Missouri,Democratic
2002,Fri Nov 04 17:56:33 +0000 2011,1.32517E+17,34,63,GM announces expansion and doubling workforce at Wentzville #MO plant. Guess it's a good thing we saved GM huh?,clairecmc,Claire McCaskill,Missouri,Democratic
2003,Fri Nov 04 17:53:31 +0000 2011,1.32516E+17,2,7,"Reassuring visit to Arlington this morning.Real progress,better systems,aggressive management.We're not there yet, but we're getting there.",clairecmc,Claire McCaskill,Missouri,Democratic
2004,Fri Nov 04 01:01:51 +0000 2011,1.32261E+17,14,12,"Tomorrow visiting Arlington,follow up on oversight on mismarked graves.I won't stop asking ??s, making visits,until confident all fixed",clairecmc,Claire McCaskill,Missouri,Democratic
2005,Thu Nov 03 18:21:00 +0000 2011,1.3216E+17,7,3,I meant splurge. And yes I did. Chocolate. Yum. Of course just cause it was celebrating the best comeback it World Series history!,clairecmc,Claire McCaskill,Missouri,Democratic
2006,Thu Nov 03 18:02:08 +0000 2011,1.32156E+17,13,14,Facing sweet dilemma. Tx Senators are paying off World Series bet with BlueBell ice cream in a few. I say spluge. #11in11,clairecmc,Claire McCaskill,Missouri,Democratic
2007,Thu Nov 03 14:47:05 +0000 2011,1.32107E+17,4,3,Good conversation with AARP about protecting current beneficiaries.,clairecmc,Claire McCaskill,Missouri,Democratic
2008,Thu Nov 03 10:43:07 +0000 2011,1.32045E+17,15,2,Off to Morning Joe.,clairecmc,Claire McCaskill,Missouri,Democratic
2009,Sat Oct 29 14:59:29 +0000 2011,1.30298E+17,8,2,Beautiful drive to Columbia this morning.We are rolling out our veterans satisfaction survey at VA medical facility there before lunch.,clairecmc,Claire McCaskill,Missouri,Democratic
2010,Sat Oct 29 03:26:44 +0000 2011,1.30123E+17,11,85,"""With all these rings we are gonna need more fingers!"". Woooohoooo!!#11in11 Cardinal Nation rejoices. #refusetoquit",clairecmc,Claire McCaskill,Missouri,Democratic
2011,Fri Oct 28 14:38:57 +0000 2011,1.2993E+17,5,11,My voice is rough today from screaming my head off at the game last night. Talk about #refusetoquit.Unbelievable. #worldseries #11in11,clairecmc,Claire McCaskill,Missouri,Democratic
2012,Fri Oct 28 13:52:47 +0000 2011,1.29919E+17,3,1,At job fair for veterans in STL. Then on to do veterans care issues in KC and Columbia.,clairecmc,Claire McCaskill,Missouri,Democratic
2013,Thu Oct 27 17:35:26 +0000 2011,1.29612E+17,15,3,Continuing to work to make sure govt rules and regulation don't go too far. Helping home builders. http://t.co/j95mwUCC,clairecmc,Claire McCaskill,Missouri,Democratic
2014,Tue Oct 25 00:10:45 +0000 2011,1.28625E+17,12,5,"Watching game at home in Kirkwood tonight.Helped my 83 yr old mom,who lives with us,get into her Cardinal gear.I'm making dinner.Go Carp!",clairecmc,Claire McCaskill,Missouri,Democratic
2015,Mon Oct 24 22:31:58 +0000 2011,1.286E+17,1,5,Good all 9  Mo House members co sponsored my legislation(w/Sen Blunt) to straighten out FERC mess for property owners at Lake.#bipartisan,clairecmc,Claire McCaskill,Missouri,Democratic
2016,Mon Oct 24 04:23:15 +0000 2011,1.28326E+17,8,14,Bright spot of today in Missouri sports? The Chiefs beat those dirty rotten Raiders. Go Chiefs!,clairecmc,Claire McCaskill,Missouri,Democratic
2017,Sun Oct 23 15:00:51 +0000 2011,1.28124E+17,10,6,Still pinching myself. No words to describe Pujols last night. So lucky to have been there. Too much fun. #refusetoquit #postseason,clairecmc,Claire McCaskill,Missouri,Democratic
2018,Sun Oct 23 04:28:17 +0000 2011,1.27965E+17,7,10,In Texas.Just was lucky enough to see Pujols and his incredible team write another chapter in the special history of the Cardinals.,clairecmc,Claire McCaskill,Missouri,Democratic
2019,Wed Oct 19 22:55:56 +0000 2011,1.26794E+17,5,7,"Really impt hearing today.It is time to stop funding projects in Afghnstn they can't afford to use or operate.
http://t.co/j78cKJIM",clairecmc,Claire McCaskill,Missouri,Democratic
2020,Wed Oct 19 18:27:07 +0000 2011,1.26726E+17,7,1,Off to my oversight committee on Military Readiness which I chair. Up today? The report from my War Contracting Commission.,clairecmc,Claire McCaskill,Missouri,Democratic
2021,Wed Oct 19 18:07:38 +0000 2011,1.26721E+17,7,7,Impt temporary decorations in my Senate office.Thanks to interns who made these last night. http://t.co/qufyDM3H,clairecmc,Claire McCaskill,Missouri,Democratic
2022,Tue Oct 18 20:47:04 +0000 2011,1.26399E+17,13,4,Why does it make me so happy when my 22yr old daughter texts me that she has been cleaning her apt since noon?,clairecmc,Claire McCaskill,Missouri,Democratic
2023,Tue Oct 18 18:27:06 +0000 2011,1.26364E+17,18,39,In tram that is stuck between stops under Capitol complex. Metaphor for DC?,clairecmc,Claire McCaskill,Missouri,Democratic
2024,Mon Oct 17 03:56:28 +0000 2011,1.25782E+17,12,47,woohoo!! National League Pennant for team that just flat refused to quit!Cardinal Nation is very proud. 11 in 11. #refusetoquit #postseason,clairecmc,Claire McCaskill,Missouri,Democratic
2025,Sat Oct 15 14:34:19 +0000 2011,1.25218E+17,1,4,"Good hearing next week,Armed Services sub comm I chair on military readiness,on report of War Contrctng Commission. http://t.co/kbdV3Deo",clairecmc,Claire McCaskill,Missouri,Democratic
2026,Sat Oct 15 14:22:18 +0000 2011,1.25215E+17,2,14,I'm not sure how baseball could be more fun than this.What a ride our Cardinals are giving us.Note to bullpen:Nice.#refusetoquit #postseason,clairecmc,Claire McCaskill,Missouri,Democratic
2027,Tue Oct 11 15:24:18 +0000 2011,1.23781E+17,18,10,On this one I agree with @JoeNBC.  He is so right about the Christian faith and politics. http://t.co/YgSF2m4M,clairecmc,Claire McCaskill,Missouri,Democratic
2028,Mon Oct 10 19:01:14 +0000 2011,1.23473E+17,2,2,Way cool to meet Aggie Wolf.   http://t.co/3OqlgnPI,clairecmc,Claire McCaskill,Missouri,Democratic
2029,Sat Oct 08 15:42:50 +0000 2011,1.22698E+17,5,6,"To be clear, talented St Louis guy who helped me stay focused re: getting healthy is this person: http://t.co/TpGL5nxz.",clairecmc,Claire McCaskill,Missouri,Democratic
2030,Sat Oct 08 14:45:33 +0000 2011,1.22684E+17,91,26,GOOAALLLLLLLL!! I did it! Lost 50 lbs. Thank you Team Charles and my new BFF...Mr Treadmill. Healthy food and lots of exercise.,clairecmc,Claire McCaskill,Missouri,Democratic
2031,Sat Oct 08 03:13:47 +0000 2011,1.2251E+17,4,25,Beast vs Beast. Our Beast won! Carp rules. Go Cards! #refusetoquit #postseason,clairecmc,Claire McCaskill,Missouri,Democratic
2032,Thu Oct 06 18:47:35 +0000 2011,1.2202E+17,3,1,good stuff in last tweet BUT bad link. This should work. http://t.co/EQOvA12Y,clairecmc,Claire McCaskill,Missouri,Democratic
2033,Thu Oct 06 18:36:49 +0000 2011,1.22017E+17,6,5,Good hearing yesterday. Real $ to recover for taxpayers through better oversight on food contracts. is.gd/kq5rhg,clairecmc,Claire McCaskill,Missouri,Democratic
2034,Wed Oct 05 15:39:40 +0000 2011,1.21611E+17,39,32,If I'd gone to Pres' fundraiser in STL opponents would say that I'd rather hobnob w/big donors than do my job.#damnedifudodamnedifudont,clairecmc,Claire McCaskill,Missouri,Democratic
2035,Tue Oct 04 20:58:09 +0000 2011,1.21328E+17,14,18,"Just briefed,major arrest today in contracting scam involving no bid ANC contracts. ""brazen contracting scandal""Oversight works/more needed.",clairecmc,Claire McCaskill,Missouri,Democratic
2036,Tue Oct 04 20:52:08 +0000 2011,1.21327E+17,9,7,Is the govt getting cheated by companies that it buys food from? Hearing tomorrow in my committee on contracting oversight.,clairecmc,Claire McCaskill,Missouri,Democratic
2037,Mon Oct 03 16:13:12 +0000 2011,1.20894E+17,9,8,Cardinals did a gut check last night. That was some relief pitching. Another gritty comeback. Go Cards! #postseason,clairecmc,Claire McCaskill,Missouri,Democratic
2038,Fri Sep 30 22:07:14 +0000 2011,1.19896E+17,10,2,Great town hall with seniors today in Springfield. Its also a gorgeous day in #MO. Happy weekend everyone.,clairecmc,Claire McCaskill,Missouri,Democratic
2039,Thu Sep 29 10:37:45 +0000 2011,1.1936E+17,5,2,Grant training today in KC. Also town hall for seniors.,clairecmc,Claire McCaskill,Missouri,Democratic
2040,Thu Sep 29 10:36:39 +0000 2011,1.1936E+17,1,6,That's what I call a comeback. Go Cards! #postseason,clairecmc,Claire McCaskill,Missouri,Democratic
2041,Tue Sep 27 02:48:02 +0000 2011,1.18517E+17,7,7,Trying again. Important questions on $ being spent in Afghnstn. http://t.co/T0p7qIvw,clairecmc,Claire McCaskill,Missouri,Democratic
2042,Tue Sep 27 02:20:20 +0000 2011,1.1851E+17,6,4,Important questions about the $ we're spending in Afghanistan. bit.ly/pvdGAM,clairecmc,Claire McCaskill,Missouri,Democratic
2043,Tue Sep 27 02:06:29 +0000 2011,1.18507E+17,6,4,2 big reasons coming to DC is hard.My grandsons.(at our house for Grandpa Joe's grits on Sunday) http://t.co/qT95Mjbs,clairecmc,Claire McCaskill,Missouri,Democratic
2044,Fri Sep 23 12:52:00 +0000 2011,1.1722E+17,52,35,Take my quick online poll: Should millionaires & billionaires pay their fair share toward reducing debt? http://t.co/N4haB8AY #buffettrule,clairecmc,Claire McCaskill,Missouri,Democratic
2045,Thu Sep 22 03:49:06 +0000 2011,1.16721E+17,27,4,So sorry. I apologize for timing of last tweet.,clairecmc,Claire McCaskill,Missouri,Democratic
2046,Thu Sep 22 02:45:40 +0000 2011,1.16705E+17,12,9,Hot! Hot! Hot! = Cardinals.  #Stlcards,clairecmc,Claire McCaskill,Missouri,Democratic
2047,Thu Sep 22 01:27:22 +0000 2011,1.16685E+17,13,9,"Not opposed to free trade, but working to make sure it is fair and we go after those who cheat. Costing #MO jobs. http://t.co/XKeobeVO",clairecmc,Claire McCaskill,Missouri,Democratic
2048,Mon Sep 19 02:04:55 +0000 2011,1.15607E+17,13,57,"So glad that FNL getting recognition it deserves on Emmys. Happy for Coach T, I mean Kyle Chandler.",clairecmc,Claire McCaskill,Missouri,Democratic
2049,Sat Sep 17 15:57:42 +0000 2011,1.15092E+17,18,3,"Hate it so much when one of my children is sick and far away. I know, I know, she's 22 but still....",clairecmc,Claire McCaskill,Missouri,Democratic
2050,Sat Sep 17 14:09:22 +0000 2011,1.15065E+17,6,11,Last night was downright special.New Kauffman Center for Performing Arts lived up to all of the hype.Kansas City should be very very proud.,clairecmc,Claire McCaskill,Missouri,Democratic
2051,Wed Sep 14 01:09:28 +0000 2011,1.13781E+17,16,13,On Rachel Maddow in a few on wasteful government contracting.,clairecmc,Claire McCaskill,Missouri,Democratic
2052,Tue Sep 13 02:56:25 +0000 2011,1.13446E+17,3,14,"Tonite, 9/11 remembrance on Capitol steps.Moment of silence interrupted by the wail of nearby siren,reminder of the brave first responders.",clairecmc,Claire McCaskill,Missouri,Democratic
2053,Fri Sep 09 14:36:42 +0000 2011,1.12173E+17,45,19,It's official. I have divorced bread and pasta. I'm hoping someday we can be friends again.,clairecmc,Claire McCaskill,Missouri,Democratic
2054,Fri Sep 09 14:20:10 +0000 2011,1.12168E+17,8,7,Locations/details of 167 #MO postal facilities #USPS is studying for possible closure/consolidation: http://t.co/KMCmQgB,clairecmc,Claire McCaskill,Missouri,Democratic
2055,Mon Sep 05 23:27:14 +0000 2011,1.10857E+17,9,26,"So sorry to hear about @Linny_Buck.While we disagreed,she was strong woman who loved this country & truly cared.God Bless her family,friends",clairecmc,Claire McCaskill,Missouri,Democratic
2056,Thu Sep 01 03:22:35 +0000 2011,1.09104E+17,16,3,"Tomorrow,St Louis, Columbia, and Jeff City.Start early with visit to St Louis business, then on to Columbia to talk about call/data centers.",clairecmc,Claire McCaskill,Missouri,Democratic
2057,Thu Sep 01 03:13:17 +0000 2011,1.09101E+17,2,3,Today final report of War Contracting Commission.Sen Webb & I passed legislation that created it.They have done impt needed work.More later.,clairecmc,Claire McCaskill,Missouri,Democratic
2058,Thu Sep 01 03:10:47 +0000 2011,1.09101E+17,5,2,"Correcting tweet(sorry, I'm tired)Monday was meeting with St Louis manufacturers on duty evasion,need fair enforceable trade deals.",clairecmc,Claire McCaskill,Missouri,Democratic
2059,Thu Sep 01 03:06:55 +0000 2011,1.091E+17,2,1,"Also Tuesday, Liberty mayor and council members, and then open forum with Liberty business folks.",clairecmc,Claire McCaskill,Missouri,Democratic
2060,Thu Sep 01 03:05:34 +0000 2011,1.091E+17,4,4,"Tuesday, good meeting with leaders in NW Mo about flooding issues/river management. Holt and Atchinson counties have really suffered.",clairecmc,Claire McCaskill,Missouri,Democratic
2061,Thu Sep 01 03:01:56 +0000 2011,1.09099E+17,3,1,"Monday, meeting with St Louis manufacturers to work on problem of du evasion.",clairecmc,Claire McCaskill,Missouri,Democratic
2062,Sun Aug 28 04:40:13 +0000 2011,1.07674E+17,1,2,Today another trip to Springfield.Lots of folks came out for gathering. Beautiful summer day in Mo.Hoping those in the bad storm are coping.,clairecmc,Claire McCaskill,Missouri,Democratic
2063,Sun Aug 28 04:36:54 +0000 2011,1.07673E+17,2,2,"Milbank Manufacturing....correcting previous post. @MilbankPowerGen
Thank you for tour. 
 http://t.co/IhoHqFL",clairecmc,Claire McCaskill,Missouri,Democratic
2064,Sun Aug 28 02:21:52 +0000 2011,1.07639E+17,2,4,"In Concordia I visited Milbank manufacturing. Great workers, great management team, working together.#mikbankpowergen http://t.co/BujvxTZ",clairecmc,Claire McCaskill,Missouri,Democratic
2065,Sun Aug 28 01:58:04 +0000 2011,1.07633E+17,1,2,"Friday it was Oak Grove, Concordia, Sedalia, and Columbia. Huge growth at Sedalia's Pro Energy.",clairecmc,Claire McCaskill,Missouri,Democratic
2066,Sun Aug 28 00:53:58 +0000 2011,1.07617E+17,8,5,"After Joplin,it was on to SpringfieldClinton, &Kansas City for manufctrng job training roundtable.Many Mo manufctrers need skilled workers.",clairecmc,Claire McCaskill,Missouri,Democratic
2067,Thu Aug 25 12:04:42 +0000 2011,1.06699E+17,6,8,Joplin continues to show what a special place it is. Great visit to federal jobs program that is putting people back to work.#joplinrecovery,clairecmc,Claire McCaskill,Missouri,Democratic
2068,Thu Aug 25 12:01:44 +0000 2011,1.06698E+17,2,3,"First stop yesterday was Detroit Tool in Lebanon,they're expanding and adding jobs with federal$.Good private public mix. Managed locally.",clairecmc,Claire McCaskill,Missouri,Democratic
2069,Tue Aug 23 18:03:35 +0000 2011,1.06064E+17,7,15,Eartquake 5.8 just occurred in DC. My DC staff in emergency location. Hope everyone is ok.,clairecmc,Claire McCaskill,Missouri,Democratic
2070,Tue Aug 23 03:23:43 +0000 2011,1.05843E+17,2,10,"Seriously, if you want some kickyouknowwhat fruit,nut,shade trees check out www.starkbros.com. These people know what they're doing.",clairecmc,Claire McCaskill,Missouri,Democratic
2071,Tue Aug 23 03:15:41 +0000 2011,1.05841E+17,3,10,"Loved the folks @Stark_Bros orchards/nursery in Louisiana,Mo.@Since1816 they have been producing worlds finest fruit trees.Proud Mo company.",clairecmc,Claire McCaskill,Missouri,Democratic
2072,Tue Aug 23 03:05:52 +0000 2011,1.05838E+17,4,5,Stops today at Continental Casting in Monroe City & Watlow in Hannibal. Listened to their views on manufacturing job growth.Learned a lot.,clairecmc,Claire McCaskill,Missouri,Democratic
2073,Thu Aug 11 12:45:32 +0000 2011,1.01635E+17,55,2,Re: State Fair visit. Since I've been on this health kick I guess a funnel cake is out of the question?,clairecmc,Claire McCaskill,Missouri,Democratic
2074,Thu Aug 11 12:42:42 +0000 2011,1.01635E+17,4,3,"Today on my way to the State Fair, then stops in Lee's Summit: battery manufacturer, and business and community leaders.",clairecmc,Claire McCaskill,Missouri,Democratic
2075,Tue Aug 09 11:45:09 +0000 2011,1.00895E+17,22,6,"More manufacturing jobs visits today. Troy, O'Fallon, St Louis. Listening to what they need for growth.",clairecmc,Claire McCaskill,Missouri,Democratic
2076,Tue Aug 09 02:57:01 +0000 2011,1.00762E+17,7,3,"At Alan Wire in Sikeston, which employs around 170 people, met 8 new employees as they finished their first shift on their first day.",clairecmc,Claire McCaskill,Missouri,Democratic
2077,Tue Aug 09 02:46:53 +0000 2011,1.0076E+17,9,12,"Great day in SE Mo today. Perryville,Jackson,Sikeston, and East Prarie. Talked manufacturing jobs and rebuilding Bird's Point levee.",clairecmc,Claire McCaskill,Missouri,Democratic
2078,Sat Aug 06 19:54:26 +0000 2011,9.99314E+16,20,53,My heart hurts for the families of the fallen heroes killed in Afghanistan. God Bless our military.,clairecmc,Claire McCaskill,Missouri,Democratic
2079,Fri Aug 05 20:02:15 +0000 2011,9.95709E+16,16,7,"The smartest, strongest, and most wonderful woman in the world was born today. Happy Birthday Mom!",clairecmc,Claire McCaskill,Missouri,Democratic
2080,Sat Jul 30 18:31:12 +0000 2011,9.73737E+16,74,75,"Taking a blanket and pillow to the Capitol. 
#neveragoodsign",clairecmc,Claire McCaskill,Missouri,Democratic
2081,Sat Jul 30 15:53:11 +0000 2011,9.73339E+16,105,92,Just spent a couple of hours answering the phones in my office. Dominant message? Don't cut Soc Sec or Medicare and #compromise.,clairecmc,Claire McCaskill,Missouri,Democratic
2082,Sat Jul 30 12:47:58 +0000 2011,9.72873E+16,26,5,Doing @meetthepress in the morning with @SenJohnThune. Looking forward to it even though it looks like we'll be pulling all nighter tonight.,clairecmc,Claire McCaskill,Missouri,Democratic
2083,Sat Jul 30 00:56:57 +0000 2011,9.71084E+16,9,2,@DaneilSperling We have compromised. No revenues. Spending cuts exceeding amt of debt ceiling rise per CBO. Let's get this done.,clairecmc,Claire McCaskill,Missouri,Democratic
2084,Sat Jul 30 00:09:35 +0000 2011,9.70965E+16,90,173,McConnell told Senator Reid at around 6pm that he will not negotiate with him.  Sigh. Very Disappointing.  #compromise,clairecmc,Claire McCaskill,Missouri,Democratic
2085,Fri Jul 29 23:27:37 +0000 2011,9.70859E+16,45,69,Not a good sign. Someone on R side objected to us even beginning to do business. Requiring silly procedural vote. #compromise,clairecmc,Claire McCaskill,Missouri,Democratic
2086,Fri Jul 29 21:57:29 +0000 2011,9.70632E+16,59,46,We'll obviously be working all weekend.I'm going to spend some time on my office switchboard answering calls myself.,clairecmc,Claire McCaskill,Missouri,Democratic
2087,Thu Jul 21 15:35:22 +0000 2011,9.4068E+16,40,1,"Very very special guest visiting me in DC this week.his picture in my apt this morning. Ian, my grandson.  http://t.co/aD7Lin2",clairecmc,Claire McCaskill,Missouri,Democratic
2088,Tue Jul 19 13:34:02 +0000 2011,9.33126E+16,38,27,"In the room. 25 Rs,21Ds, 1 I here. Folks are coming and going but it's basically 50/50. Could this be the moment that we compromise?",clairecmc,Claire McCaskill,Missouri,Democratic
2089,Tue Jul 19 13:16:18 +0000 2011,9.33082E+16,31,23,I can't tell you how thrilling it is to be in a room with BOTH Rs and Ds working on our debt problem. Gang of 5 plus 50 Senators.,clairecmc,Claire McCaskill,Missouri,Democratic
