,created_at,id_str,reply_count,retweet_count,text,user,name,state,party
1506,Wed May 06 17:15:14 +0000 2015,5.96E+17,0,1,Thank you @JerryMoran @Sen_JoeManchin @SenToomey @MartinHeinrich @SenatorTester @SenatorCollins @DavidVitter for your support. #VABacklog,SenDeanHeller,Dean Heller,Nevada,Republican
1507,Wed May 06 16:52:50 +0000 2015,5.95995E+17,0,2,Great working with @SenBobCasey on legislation to address the #VABacklog. #KeepThePromise http://t.co/xIg1CttZp6,SenDeanHeller,Dean Heller,Nevada,Republican
1508,Wed May 06 16:31:46 +0000 2015,5.95989E+17,0,2,.@SenBobCasey and I released the #VABacklog Working Group 2015 Report today. READ IT HERE: http://t.co/CYUq5qd6um #KeepThePromise,SenDeanHeller,Dean Heller,Nevada,Republican
1509,Wed May 06 16:04:04 +0000 2015,5.95982E+17,0,4,"Today, @SenBobCasey &amp; I introduced legislation to address the #VABacklog. Click here to read more: http://t.co/DvBsHLKxqW #KeepThePromise",SenDeanHeller,Dean Heller,Nevada,Republican
1510,Wed May 06 15:43:43 +0000 2015,5.95977E+17,0,4,Great to work with this bipartisan group of Senators to address the #VABacklog. #KeepThePromise http://t.co/MH0YticWAf,SenDeanHeller,Dean Heller,Nevada,Republican
1511,Tue May 05 18:57:48 +0000 2015,5.95664E+17,0,2,"Happy Birthday to Nevada's Lt. Governor, @Hutch4Nevada! Enjoy your day in the #SilverState.",SenDeanHeller,Dean Heller,Nevada,Republican
1512,Tue May 05 15:41:29 +0000 2015,5.95614E+17,0,4,"Congrats to NV's top youth volunteers: Nasya Mancini, @cityofsparks, &amp; Lexie Wilder, @CityOfLasVegas. Cc.@PruSpirit http://t.co/EIvx5U3p47",SenDeanHeller,Dean Heller,Nevada,Republican
1513,Tue May 05 13:18:48 +0000 2015,5.95578E+17,2,11,.@ChandlerSmithNV will always remain a valued member of Team Heller. She will be an outstanding addition to @SenJohnThune &amp; the @Senate_GOPs,SenDeanHeller,Dean Heller,Nevada,Republican
1514,Mon May 04 17:46:18 +0000 2015,5.95283E+17,0,6,Happy #TeacherAppreciationWeek. Thankful for all of Nevada's teachers working to educate our communities and our youth.,SenDeanHeller,Dean Heller,Nevada,Republican
1515,Mon May 04 17:30:18 +0000 2015,5.95279E+17,0,6,"Congrats to Hyde Park Middle School, selected as a regional winner for the ExploraVision Awards. Cc. @ClarkCountySch @ToshibaInnovate @NSTA",SenDeanHeller,Dean Heller,Nevada,Republican
1516,Sun May 03 12:59:11 +0000 2015,5.94849E+17,0,7,Last night's #MayPac fight lived up to its reputation. The @CityOfLasVegas proved yet again why it is the premier venue for these events.,SenDeanHeller,Dean Heller,Nevada,Republican
1517,Sun May 03 02:44:41 +0000 2015,5.94694E+17,1,8,Thoughts and prayers are with Mayor @HillaryForReno and her entire family during this difficult time.,SenDeanHeller,Dean Heller,Nevada,Republican
1518,Fri May 01 19:39:30 +0000 2015,5.94225E+17,0,5,Congratulations to Grammy Award-winning musician Joe Vento from the @CityOfLasVegas on receiving the Century Award! http://t.co/N0vRmZgHR7,SenDeanHeller,Dean Heller,Nevada,Republican
1519,Fri May 01 19:22:20 +0000 2015,5.9422E+17,0,4,Congrats to Justice Best from @SSHS_Cougars on her selection as Second Prize winner in @cspan’s national competition http://t.co/aWRt1ilV6m,SenDeanHeller,Dean Heller,Nevada,Republican
1520,Fri May 01 18:00:07 +0000 2015,5.942E+17,0,4,"This month, we celebrate Older Americans Month. Today, @washoecounty held its opening event! http://t.co/bXqekhFbmZ",SenDeanHeller,Dean Heller,Nevada,Republican
1521,Fri May 01 15:28:54 +0000 2015,5.94162E+17,0,4,It is time Members of Congress realize #Yucca is dead. READ MORE: http://t.co/HL3GsWVHkX,SenDeanHeller,Dean Heller,Nevada,Republican
1522,Fri May 01 15:08:09 +0000 2015,5.94156E+17,0,5,Today’s actions in the House emphasize complete disregard for the people of NV. It is time Members of Congress realize #Yucca is dead.,SenDeanHeller,Dean Heller,Nevada,Republican
1523,Thu Apr 30 17:00:30 +0000 2015,5.93822E+17,0,6,Honored to receive the Champion Award from the American Motorcyclist Association. @ama_rights http://t.co/A8ukGl50d6,SenDeanHeller,Dean Heller,Nevada,Republican
1524,Thu Apr 30 16:45:34 +0000 2015,5.93818E+17,1,8,Great to meet with survivor Debbie Smith and @RAINN01 to discuss national efforts to address the rape kit backlog. http://t.co/I7UdExViRU,SenDeanHeller,Dean Heller,Nevada,Republican
1525,Thu Apr 30 16:34:48 +0000 2015,5.93816E+17,0,4,"#TBT to when Lynne, Emmy, and I joined friends in support of the Carson City Cancer Center. #RideForTheCure http://t.co/ESy6tYEB3j",SenDeanHeller,Dean Heller,Nevada,Republican
1526,Thu Apr 30 16:18:37 +0000 2015,5.93812E+17,1,4,.@SenatorReid &amp; I introduced legislation honoring Officer Stanley Cooper. WATCH HERE: https://t.co/SdqpINV5dB via @KTNV’s @TriciaKean,SenDeanHeller,Dean Heller,Nevada,Republican
1527,Wed Apr 29 17:54:19 +0000 2015,5.93473E+17,0,7,There is no reason Officer Stanley Cooper’s heroism should not be honored. More here: http://t.co/nkZ5I9fTdS Cc: @SenatorReid,SenDeanHeller,Dean Heller,Nevada,Republican
1528,Wed Apr 29 16:39:05 +0000 2015,5.93454E+17,0,3,ICYMI: New draft of samaritan bill advances in U.S. House via @reviewjournal http://t.co/fFs9DbcItK,SenDeanHeller,Dean Heller,Nevada,Republican
1529,Wed Apr 29 16:25:42 +0000 2015,5.93451E+17,0,5,Congrats to @GalenaHigh students on their selection as national winners. http://t.co/CbnOHWpcQr Cc. @Samsungtweets http://t.co/l6e8pqhwbt,SenDeanHeller,Dean Heller,Nevada,Republican
1530,Wed Apr 29 16:07:37 +0000 2015,5.93447E+17,0,7,It was a great honor to have @AbeShinzo address a #JointMeeting of Congress this morning. #Japan #AbeVisit #AbeInTheUSA,SenDeanHeller,Dean Heller,Nevada,Republican
1531,Wed Apr 29 13:20:18 +0000 2015,5.93404E+17,0,5,"ICYMI: Last night, the @USHouseRep passed the Good Samaritan Search and Recovery Act via @8NewsNow https://t.co/OGWySQxQHD CC: @RepJoeHeck",SenDeanHeller,Dean Heller,Nevada,Republican
1532,Wed Apr 29 00:45:06 +0000 2015,5.93214E+17,0,6,Great 2 see @CommerceGOP bill improving vehicle safety &amp; creating greater accountability 4 auto industry pass Senate: http://t.co/vfWi9t4fi0,SenDeanHeller,Dean Heller,Nevada,Republican
1533,Wed Apr 29 00:08:56 +0000 2015,5.93205E+17,0,3,Glad to see the Good Samaritan Search and Recovery Act pass through the House. http://t.co/u7T7A1QoZa Cc.@RepJoeHeck,SenDeanHeller,Dean Heller,Nevada,Republican
1534,Tue Apr 28 22:00:20 +0000 2015,5.93173E+17,0,5,.@SenDeanHeller Acts to Stop the Government from Spying on Nevadans http://t.co/kp8bziFMd7,SenDeanHeller,Dean Heller,Nevada,Republican
1535,Tue Apr 28 20:12:01 +0000 2015,5.93146E+17,1,14,Great to meet NV students from Reed &amp; Canyon Springs High Schools today Cc @CivicEducation @ClarkCountySch @WCSDTweet http://t.co/kE7noiTjpw,SenDeanHeller,Dean Heller,Nevada,Republican
1536,Tue Apr 28 18:33:29 +0000 2015,5.93121E+17,0,7,Honored to have received the National Park Heritage Award from the @NPCA. http://t.co/TEHZSYidN9 Cc. @tulespringsnps http://t.co/khEa6efkot,SenDeanHeller,Dean Heller,Nevada,Republican
1537,Tue Apr 28 17:16:14 +0000 2015,5.93101E+17,1,1,Thx @ChuckGrassley @maziehirono &amp; @SenatorBaldwin for supporting S.471 to provide care to women #vets Cc @PattyMurray http://t.co/ov9UfnGleq,SenDeanHeller,Dean Heller,Nevada,Republican
1538,Tue Apr 28 16:08:01 +0000 2015,5.93084E+17,1,2,ICYMI: @SenDeanHeller Doubles Down on Need for Collaboration &amp; Transparency on International Insurance Issues. https://t.co/y7IQNNskle,SenDeanHeller,Dean Heller,Nevada,Republican
1539,Tue Apr 28 15:07:13 +0000 2015,5.93069E+17,1,4,"Today, I introduced a bill with @PattyMurray to assist children of veterans. READ MORE: http://t.co/ov9UfnGleq",SenDeanHeller,Dean Heller,Nevada,Republican
1540,Tue Apr 28 14:51:40 +0000 2015,5.93065E+17,1,7,Read about my amendment reaffirming America’s commitment to Israel to relocate U.S. Embassy from Tel Aviv 2 Jerusalem http://t.co/3pBL0JbEmW,SenDeanHeller,Dean Heller,Nevada,Republican
1541,Mon Apr 27 21:17:08 +0000 2015,5.928E+17,0,7,"Congrats to Principal Decker &amp; Walter Bracken STEAM Academy, selected as a 2015 School of Excellence @MagnetSchlsMSA https://t.co/0mkjLzZDta",SenDeanHeller,Dean Heller,Nevada,Republican
1542,Mon Apr 27 19:50:11 +0000 2015,5.92778E+17,0,3,.@SenatorTester &amp; I intro'd legislation encouraging collaboration &amp; transparency on international insurance issues. http://t.co/pprsRugTQa,SenDeanHeller,Dean Heller,Nevada,Republican
1543,Sat Apr 25 15:24:31 +0000 2015,5.91986E+17,1,4,"Thanks for your support of S. 117 @tedcruz. ""@DavidMDrucker: @tedcruz on Day 1 of prez wld move U.S. embassy frm Tel Aviv 2 Jerusalem""",SenDeanHeller,Dean Heller,Nevada,Republican
1544,Fri Apr 24 16:24:25 +0000 2015,5.91639E+17,0,1,#FF @HonorFlightNV @NatlParkService @NVNationalGuard @SenCoryGardner @Sen_JoeManchin @RepMarkWalker @washingtonpost @WWIIMemorial,SenDeanHeller,Dean Heller,Nevada,Republican
1545,Thu Apr 23 19:59:31 +0000 2015,5.91331E+17,0,5,"ICYMI: @washingtonpost: Is she here for her husband? Her son? No. She’s a veteran, too.http://t.co/FuirZvmoBj",SenDeanHeller,Dean Heller,Nevada,Republican
1546,Thu Apr 23 19:28:30 +0000 2015,5.91323E+17,0,7,The Medical Device Tax is a job killer. WATCH: https://t.co/efPdNKNFwc,SenDeanHeller,Dean Heller,Nevada,Republican
1547,Thu Apr 23 19:19:11 +0000 2015,5.9132E+17,0,7,#TBT to meeting some of Nevada's heroes as they toured their @WWIIMemorial. Cc. @HonorFlightNV http://t.co/5Tz60jnyh4,SenDeanHeller,Dean Heller,Nevada,Republican
1548,Thu Apr 23 18:58:33 +0000 2015,5.91315E+17,0,2,Great to see my amendment helping to #EndTrafficking pass the Senate http://t.co/YBElLPRrle #JVTA,SenDeanHeller,Dean Heller,Nevada,Republican
1549,Thu Apr 23 18:36:47 +0000 2015,5.9131E+17,0,2,Thank you to our brave officers that work daily to keep our communities safe. READ MORE: http://t.co/5AdETAiiW0 via @reviewjournal,SenDeanHeller,Dean Heller,Nevada,Republican
1550,Thu Apr 23 18:11:51 +0000 2015,5.91303E+17,1,2,ICYMI: @NVNationalGuard hires first woman ever to command brigade via @NevadaAppeal http://t.co/X34X9VWp7W http://t.co/x74HXsuUA0,SenDeanHeller,Dean Heller,Nevada,Republican
1551,Thu Apr 23 17:48:35 +0000 2015,5.91298E+17,1,2,Our women vets deserve the best care when returning home. READ MORE: http://t.co/FuirZv4NJL Cc. @washingtonpost,SenDeanHeller,Dean Heller,Nevada,Republican
1552,Thu Apr 23 17:37:54 +0000 2015,5.91295E+17,0,2,Proud to support legislation easing regulatory burdens for American job creators. MORE HERE: http://t.co/wOyuxs3rVa,SenDeanHeller,Dean Heller,Nevada,Republican
1553,Thu Apr 23 14:25:06 +0000 2015,5.91246E+17,0,3,".@SenatorReid &amp; I welcomed the Senate guest Chaplain, Dr. Ralph E. Williamson, from the @CityOfLasVegas. https://t.co/I9rJsT6pwM",SenDeanHeller,Dean Heller,Nevada,Republican
1554,Thu Apr 23 14:03:57 +0000 2015,5.91241E+17,0,5,Another bipartisan bill passed the Senate yesterday. #WorkingAgain #EndTrafficking #JVTA http://t.co/ARyjDTMhYk,SenDeanHeller,Dean Heller,Nevada,Republican
1555,Wed Apr 22 21:23:16 +0000 2015,5.90989E+17,2,9,Great to work with @RepMarkWalker to put an end to human trafficking. http://t.co/ARyjDTMhYk #EndTrafficking,SenDeanHeller,Dean Heller,Nevada,Republican
1556,Wed Apr 22 20:50:34 +0000 2015,5.90981E+17,0,5,Pleased my amendment seeking justice for victims of human trafficking passed the Senate. http://t.co/ARyjDTMhYk #EndTrafficking,SenDeanHeller,Dean Heller,Nevada,Republican
1557,Wed Apr 22 20:48:35 +0000 2015,5.90981E+17,0,2,Proud to support the Justice for Victims of Trafficking Act today. #EndTrafficking http://t.co/8mXKgwEtzX,SenDeanHeller,Dean Heller,Nevada,Republican
1558,Wed Apr 22 18:19:25 +0000 2015,5.90943E+17,1,4,.@SenDeanHeller and @Sen_JoeManchin RIDE Together to Prevent Overburdening Regulations http://t.co/RpKz7hQ2Ag,SenDeanHeller,Dean Heller,Nevada,Republican
1559,Wed Apr 22 18:00:22 +0000 2015,5.90938E+17,1,1,Disappointed the House Committee on Appropriations continues to try and waste taxpayer money on #Yucca.,SenDeanHeller,Dean Heller,Nevada,Republican
1560,Wed Apr 22 15:19:19 +0000 2015,5.90898E+17,1,5,ICYMI: @NVNationalGuard unveils combat veteran tribute wall via @nevadaappeal http://t.co/WhfB1bQL18 Cc. @TaylorNVAppeal,SenDeanHeller,Dean Heller,Nevada,Republican
1561,Tue Apr 21 22:01:42 +0000 2015,5.90637E+17,0,6,ICYMI: @SenDeanHeller Fights for Nevada's Women Veterans http://t.co/y8QYf6fO1M #KeepThePromise,SenDeanHeller,Dean Heller,Nevada,Republican
1562,Tue Apr 21 20:25:43 +0000 2015,5.90612E+17,0,1,Good news! Work done by NV’s local officials to show NV can support sage grouse w/o a listing has paid off. Read more http://t.co/v6bBh98QaO,SenDeanHeller,Dean Heller,Nevada,Republican
1563,Mon Apr 20 15:03:40 +0000 2015,5.90169E+17,18,18,100 days of progress. #WorkingAgain http://t.co/Mj1OY317hg,SenDeanHeller,Dean Heller,Nevada,Republican
1564,Mon Apr 20 14:29:04 +0000 2015,5.9016E+17,0,5,Welcome home @HonorFlightNV vets! http://t.co/WL7COslFjv,SenDeanHeller,Dean Heller,Nevada,Republican
1565,Sat Apr 18 14:23:17 +0000 2015,5.89434E+17,0,8,MUST WATCH! @HonorFlightNV video: https://t.co/sPqYAaYbMG #BattleBorn,SenDeanHeller,Dean Heller,Nevada,Republican
1566,Fri Apr 17 19:44:17 +0000 2015,5.89152E+17,0,4,It's been a great year for @MundoFOXVegas. Congratulations on your one-year anniversary!,SenDeanHeller,Dean Heller,Nevada,Republican
1567,Fri Apr 17 17:16:50 +0000 2015,5.89115E+17,0,2,"Congrats to Shirley McLee from the @ClarkChargers, selected as Regional Magnet Teacher of the Year by @MagnetSchlsMSA http://t.co/6VSrLnxqqE",SenDeanHeller,Dean Heller,Nevada,Republican
1568,Fri Apr 17 15:37:51 +0000 2015,5.8909E+17,2,7,Little Jerry is in my family’s thoughts and prayers. Stay strong @MrsT106 and @DannyTarkanian.,SenDeanHeller,Dean Heller,Nevada,Republican
1569,Thu Apr 16 21:45:53 +0000 2015,5.88821E+17,3,10,Veterans’ Claims Backlog Latest in Slew of VA Scandals http://t.co/f50hXiz9iE,SenDeanHeller,Dean Heller,Nevada,Republican
1570,Thu Apr 16 21:11:27 +0000 2015,5.88812E+17,0,12,The bipartisan #TPA legislation intro'd today puts Congress in the driver's seat &amp; will help move American workers &amp; the US economy forward.,SenDeanHeller,Dean Heller,Nevada,Republican
1571,Thu Apr 16 20:20:21 +0000 2015,5.88799E+17,2,9,"Congrats to Laura Willis, NV Assistant Principal of the Year, from @ClarkCountySch’s Canyon Springs High. http://t.co/Rgbt49MlH1",SenDeanHeller,Dean Heller,Nevada,Republican
1572,Thu Apr 16 20:17:03 +0000 2015,5.88798E+17,1,6,#100Days #Budget #NoBudgetNoPay @Senate_GOPs http://t.co/i3ctSa4a4n,SenDeanHeller,Dean Heller,Nevada,Republican
1573,Thu Apr 16 20:07:48 +0000 2015,5.88796E+17,16,39,"This month, we honor military children who sacrifice so much for our freedom. Thank you! #MonthOfTheMilitaryChild http://t.co/oJvhVREng2",SenDeanHeller,Dean Heller,Nevada,Republican
1574,Thu Apr 16 19:54:55 +0000 2015,5.88793E+17,0,3,This happened in the first 100 days:  Cc. @Senate_GOPs  #WorkingAgain http://t.co/IMCCA4WPCJ,SenDeanHeller,Dean Heller,Nevada,Republican
1575,Thu Apr 16 19:20:14 +0000 2015,5.88784E+17,0,2,What would be the impact if the Mortgage Debt Relief Act were to expire? WATCH: https://t.co/IUqzCPkUz6 Cc: @SenStabenow,SenDeanHeller,Dean Heller,Nevada,Republican
1576,Thu Apr 16 19:00:28 +0000 2015,5.88779E+17,0,4,GREAT NEWS! The House passed the State &amp; Local Sales Tax Deduction Fairness Act. Read more: http://t.co/irQ0imDMoD,SenDeanHeller,Dean Heller,Nevada,Republican
1577,Thu Apr 16 18:46:28 +0000 2015,5.88775E+17,0,4,Today marks the 100th day of the new @Senate_GOPs majority. Here is what we have been up to: http://t.co/dRKLA6nfQw,SenDeanHeller,Dean Heller,Nevada,Republican
1578,Thu Apr 16 18:07:09 +0000 2015,5.88766E+17,1,6,#TBT to these Nevadans coming home. #MonthOfTheMilitaryChild http://t.co/3aZywWdgFs,SenDeanHeller,Dean Heller,Nevada,Republican
1579,Thu Apr 16 13:52:33 +0000 2015,5.88702E+17,0,3,Proud to work with @RTCWashoe &amp; @USACESacramento to advance the SE Connector project. Important project for NW NV http://t.co/c9ieW98Pj7,SenDeanHeller,Dean Heller,Nevada,Republican
1580,Wed Apr 15 20:42:04 +0000 2015,5.88442E+17,0,4,Read how @RepHardy and I are working to ease restrictions on eastern Nevada land: http://t.co/9azmGEo1H2,SenDeanHeller,Dean Heller,Nevada,Republican
1581,Wed Apr 15 20:12:27 +0000 2015,5.88435E+17,0,4,Impersonating the #IRS during tax season has become one of the largest scams in recent history. WATCH HERE: https://t.co/qxKElmGjE4 #TaxDay,SenDeanHeller,Dean Heller,Nevada,Republican
1582,Wed Apr 15 20:04:36 +0000 2015,5.88433E+17,4,7,Proud to support @JohnCornyn's bill to assist small businesses in cutting through #IRS red tape. READ MORE: http://t.co/jbxgZu0Zlp #TaxDay,SenDeanHeller,Dean Heller,Nevada,Republican
1583,Wed Apr 15 18:10:42 +0000 2015,5.88404E+17,0,3,#TaxDay http://t.co/xVSJcWhf6Y,SenDeanHeller,Dean Heller,Nevada,Republican
1584,Tue Apr 14 17:32:17 +0000 2015,5.88032E+17,0,7,Great story @GuyClifton! This Lincoln bust is in my office. http://t.co/0Q2JDJ41KK Cc. @rgj http://t.co/u18VcBSCjy,SenDeanHeller,Dean Heller,Nevada,Republican
1585,Tue Apr 14 17:26:31 +0000 2015,5.88031E+17,0,2,ICYMI: Senate Bill Requires @TheNCUA Budget Hearings http://t.co/IIVkgKll2C Cc: @MarkWarner,SenDeanHeller,Dean Heller,Nevada,Republican
1586,Tue Apr 14 17:14:39 +0000 2015,5.88028E+17,0,6,Congrats to the @NevadaWolfPack boxing team on winning the 2015 @NCBABoxing National Team Title! Story via @rgj http://t.co/o8ZL1Z81CU,SenDeanHeller,Dean Heller,Nevada,Republican
1587,Tue Apr 14 16:31:34 +0000 2015,5.88017E+17,1,4,"I support equal pay for equal work, which is why I introduced the End Pay Discrimination Through Information Act (S.83) #NationalEqualPayDay",SenDeanHeller,Dean Heller,Nevada,Republican
1588,Tue Apr 14 16:00:33 +0000 2015,5.88009E+17,0,2,"ICYMI: Last week, I addressed the #NVLeg. WATCH HERE: https://t.co/mueq4DpdZO",SenDeanHeller,Dean Heller,Nevada,Republican
1589,Mon Apr 13 18:04:22 +0000 2015,5.87678E+17,0,6,"Happy National Public Safety Telecommunications Week, honoring all of our dispatchers who work each day to save lives.",SenDeanHeller,Dean Heller,Nevada,Republican
1590,Fri Apr 10 16:38:18 +0000 2015,5.86569E+17,0,4,#FF @GovSandoval @News3LV @JessicaNews3LV @KOLO8 @KTVN @sendebbiesmith @HonorFlightNV,SenDeanHeller,Dean Heller,Nevada,Republican
1591,Fri Apr 10 02:09:10 +0000 2015,5.8635E+17,0,7,Thoughts and prayers are with Commissioner @Giunchigliani and her entire family during this difficult time.,SenDeanHeller,Dean Heller,Nevada,Republican
1592,Thu Apr 09 18:22:17 +0000 2015,5.86233E+17,1,7,#Yucca Trip Is Political Sideshow http://t.co/FtU3X0ZhVE,SenDeanHeller,Dean Heller,Nevada,Republican
1593,Thu Apr 09 15:56:00 +0000 2015,5.86196E+17,0,4,#TBT to the first @HonorFlightNV http://t.co/mYsX4dMTRH,SenDeanHeller,Dean Heller,Nevada,Republican
1594,Thu Apr 09 15:40:51 +0000 2015,5.86192E+17,0,3,So happy to have @sendebbiesmith back at the #NVLeg. Story via @reviewjournal http://t.co/E3DccKa2jM,SenDeanHeller,Dean Heller,Nevada,Republican
1595,Wed Apr 08 15:48:32 +0000 2015,5.85832E+17,0,8,ICYMI: Heller Addresses Sandoval and Nevada Legislature via @KOLO8 http://t.co/DH5ySNmrqX,SenDeanHeller,Dean Heller,Nevada,Republican
1596,Tue Apr 07 20:56:05 +0000 2015,5.85547E+17,0,2,"Last night, I had the honor of addressing the #NVLeg. WATCH HERE: https://t.co/PTjfyQjLdn via @KTVN",SenDeanHeller,Dean Heller,Nevada,Republican
1597,Tue Apr 07 19:09:45 +0000 2015,5.8552E+17,0,2,ICYMI: @SenDeanHeller addresses Nevada Legislature via @KOLO8 https://t.co/BqqEXEGI4I,SenDeanHeller,Dean Heller,Nevada,Republican
1598,Tue Apr 07 17:31:21 +0000 2015,5.85495E+17,0,3,Yesterday marked the groundbreaking of I-11. WATCH HERE: https://t.co/mNiw6kSyIG via @News3LV @JessicaNews3LV,SenDeanHeller,Dean Heller,Nevada,Republican
1599,Mon Apr 06 22:00:22 +0000 2015,5.852E+17,1,4,"Excited to address the #NVLeg in a couple of hours. Tune in live online @ 5:00 PM PT, HERE: https://t.co/xGYTVgdgZ1",SenDeanHeller,Dean Heller,Nevada,Republican
1600,Mon Apr 06 18:13:10 +0000 2015,5.85143E+17,0,6,"GREAT NEWS! Today, we broke ground on I-11. http://t.co/yckn6siBiM",SenDeanHeller,Dean Heller,Nevada,Republican
1601,Mon Apr 06 16:54:33 +0000 2015,5.85123E+17,1,4,"Tonight at 5:00 PM PT, I will address the #NVLeg. To watch live online, TUNE IN HERE: https://t.co/xGYTVguSnB",SenDeanHeller,Dean Heller,Nevada,Republican
1602,Sun Apr 05 14:08:33 +0000 2015,5.84719E+17,1,5,Wishing all Nevadans a Happy Easter.,SenDeanHeller,Dean Heller,Nevada,Republican
1603,Fri Apr 03 01:19:14 +0000 2015,5.83801E+17,2,8,Stopped in to see some friends at Asi Es Mi Tierra Restaurant in Reno for their fabulous food and pupusas! http://t.co/qXwmXlEV7P,SenDeanHeller,Dean Heller,Nevada,Republican
1604,Thu Apr 02 23:40:38 +0000 2015,5.83776E+17,0,3,I had a great time addressing the #vets town hall today in Reno. http://t.co/CVZ0LhGfjp,SenDeanHeller,Dean Heller,Nevada,Republican
1605,Thu Apr 02 21:06:23 +0000 2015,5.83737E+17,0,4,Progress finally made on the Truckee Meadows Flood Risk Management Project. More HERE: http://t.co/SppoYPl3EQ,SenDeanHeller,Dean Heller,Nevada,Republican
1606,Thu Apr 02 19:18:15 +0000 2015,5.8371E+17,1,7,"Yesterday, I launched the Southern NV Veterans Advisory Council. Watch this @8NewsNow video to learn more: https://t.co/2owJslO5VI #8NN",SenDeanHeller,Dean Heller,Nevada,Republican
1607,Thu Apr 02 18:57:43 +0000 2015,5.83705E+17,0,5,Outside @uscapitol with my first Senate interns. More on our internship program here: http://t.co/y3nuSKcvCR #TBT http://t.co/rAZb1M7p93,SenDeanHeller,Dean Heller,Nevada,Republican
1608,Thu Apr 02 18:16:02 +0000 2015,5.83694E+17,2,5,The S. Nevada Veterans Advisory Council will uncover ways to ensure Vets receive the care they deserve. @KTNV VIDEO: https://t.co/AzVLl6oO2h,SenDeanHeller,Dean Heller,Nevada,Republican
1609,Thu Apr 02 17:09:46 +0000 2015,5.83678E+17,0,3,Always great to catch up with @VegasMyNews3's @jgillanNews3LV. WATCH: https://t.co/9bzwtNmKs6,SenDeanHeller,Dean Heller,Nevada,Republican
1610,Thu Apr 02 16:05:36 +0000 2015,5.83662E+17,1,3,The entire @DeptVetAffairs system needs improvement. Video via @KTNV https://t.co/B3pY8JMlk7 #KeepThePromise,SenDeanHeller,Dean Heller,Nevada,Republican
1611,Thu Apr 02 15:56:59 +0000 2015,5.83659E+17,0,3,UASI funding will keep @CityOfLasVegas a premier destination for years to come http://t.co/u155fivK1r 2/2,SenDeanHeller,Dean Heller,Nevada,Republican
1612,Thu Apr 02 15:56:42 +0000 2015,5.83659E+17,0,3,Pleased @CityOfLasVegas received an increase in funding from @DHSgov to combat terror threats http://t.co/u155fivK1r 1/2,SenDeanHeller,Dean Heller,Nevada,Republican
1613,Wed Apr 01 20:24:50 +0000 2015,5.83364E+17,0,4,"It was an honor to meet @RenoPolice’s German Rodriguez. No doubt, he’s a real hero. https://t.co/AIhr4DKo4G",SenDeanHeller,Dean Heller,Nevada,Republican
1614,Wed Apr 01 20:16:40 +0000 2015,5.83362E+17,0,4,ICYMI: @RenoPolice Officer Honored With Congressional Award via @KTVN's @kris10remington. http://t.co/sTYRimRfAW,SenDeanHeller,Dean Heller,Nevada,Republican
1615,Tue Mar 31 23:00:15 +0000 2015,5.83041E+17,3,8,They call it the Great State for a reason. #HomeMeansNevada http://t.co/jrlKYrMexF,SenDeanHeller,Dean Heller,Nevada,Republican
1616,Tue Mar 31 20:44:53 +0000 2015,5.83007E+17,0,2,Congratulations to fellow Nevadan German Rodriguez on receiving the Congressional Badge of Bravery. http://t.co/c9NOWsikVi,SenDeanHeller,Dean Heller,Nevada,Republican
1617,Tue Mar 31 20:42:41 +0000 2015,5.83007E+17,0,4,Honored to present the Congressional Badge of Bravery to fellow Nevadan German Rodriguez. http://t.co/6PW4omL8C1,SenDeanHeller,Dean Heller,Nevada,Republican
1618,Fri Mar 27 20:43:14 +0000 2015,5.81557E+17,1,7,Congrats to Bill Brewer on his retirement from the @usdaRD after 30 years &amp; on continuing w/ @NVRuralHousing. http://t.co/3frOJcAVfV,SenDeanHeller,Dean Heller,Nevada,Republican
1619,Fri Mar 27 20:25:47 +0000 2015,5.81553E+17,0,6,Thank you to @GoodwillVegas for all it does for our vets! Read more here: http://t.co/HV4yI8octy,SenDeanHeller,Dean Heller,Nevada,Republican
1620,Fri Mar 27 20:06:56 +0000 2015,5.81548E+17,0,5,Great News! @FisherHouseFdtn &amp; NV Military Support Alliance broke ground on NV's 1st Fisher House to serve vets. http://t.co/394gOQblfo,SenDeanHeller,Dean Heller,Nevada,Republican
1621,Fri Mar 27 16:57:26 +0000 2015,5.815E+17,0,9,Read my statement on @SenatorReid's retirement here: http://t.co/ahWTeI339I,SenDeanHeller,Dean Heller,Nevada,Republican
1622,Fri Mar 27 16:47:24 +0000 2015,5.81498E+17,0,2,"#FF @SWGas, @SenatorReid, @SenJohnMcCain, @JeffFlake, @NASTARHQ, @SenJohnThune, @KTNV, @8NewsNow, @SenateMajLdr, @SenCapito, @SenRandPaul",SenDeanHeller,Dean Heller,Nevada,Republican
1623,Fri Mar 27 16:07:34 +0000 2015,5.81488E+17,0,6,"Harry's coming home to Nevada. I have no doubt his family is looking forward to catching up on lost time, especially the grandchildren.",SenDeanHeller,Dean Heller,Nevada,Republican
1624,Fri Mar 27 08:19:13 +0000 2015,5.8137E+17,1,10,Extending I-11 is an important step toward increasing Nevada’s economic competitiveness http://t.co/FBBuO2wtHj #budget,SenDeanHeller,Dean Heller,Nevada,Republican
1625,Fri Mar 27 08:16:08 +0000 2015,5.81369E+17,0,6,Pleased my Senate colleagues joined me in keeping our nation’s promise to provide every veteran quality care. http://t.co/tjCFznOKeY #budget,SenDeanHeller,Dean Heller,Nevada,Republican
1626,Thu Mar 26 17:27:11 +0000 2015,5.81145E+17,0,5,#tbt to time spent spring cleaning back home in Nevada. http://t.co/FryAb1KhfF,SenDeanHeller,Dean Heller,Nevada,Republican
1627,Thu Mar 26 16:28:05 +0000 2015,5.81131E+17,0,3,"Proud to join @SenateMajLdr, @SenCapito, and @SenRandPaul  on a bill that fights for housing needs in rural Nevada. http://t.co/Ya6N9bNnVi",SenDeanHeller,Dean Heller,Nevada,Republican
