,created_at,id_str,reply_count,retweet_count,text,user,name,state,party
451,Thu Aug 11 20:31:27 +0000 2016,7.63835E+17,1,2,#TBT to meeting with #vets in @PahrumpNV to discuss updates on the #VA clinic. https://t.co/AueluZC61F,SenDeanHeller,Dean Heller,Nevada,Republican
452,Thu Aug 11 18:33:07 +0000 2016,7.63805E+17,0,1,#NevadaTravel continues to grow! @rgj: New @RenoAirport - to - @LBAirport flights start Monday on @JetBlue https://t.co/M6YNkc15uj,SenDeanHeller,Dean Heller,Nevada,Republican
453,Tue Aug 09 19:40:17 +0000 2016,7.63098E+17,6,8,"Today, I will be speaking at the @USATodayMoney/@WellsFargo economic forum. Tune in at 1:00 PM PT: https://t.co/nYYTqMa8Az #RealEconomy",SenDeanHeller,Dean Heller,Nevada,Republican
454,Tue Aug 09 19:08:47 +0000 2016,7.6309E+17,0,1,Learn important information about #CarsonValleySchool bus routes via @RecordCourierNV: https://t.co/HMpVKtyIoT,SenDeanHeller,Dean Heller,Nevada,Republican
455,Mon Aug 08 18:55:16 +0000 2016,7.62724E+17,0,2,Congrats to these stellar #Nevadans! @ElyTimes: Local teens shine at rodeo nationals #BattleBorn https://t.co/nBBS1YvZJC,SenDeanHeller,Dean Heller,Nevada,Republican
456,Fri Aug 05 21:20:57 +0000 2016,7.61673E+17,0,7,Wishing my friend @GovSandoval a very happy birthday today! Hope it's a great one! #BattleBorn,SenDeanHeller,Dean Heller,Nevada,Republican
457,Thu Aug 04 20:18:26 +0000 2016,7.61295E+17,0,3,#TBT to meeting with Principal Katie Decker and #BattleBorn students at @ccsdbracken. Cc: @ClarkCountySch https://t.co/YndkA8xL40,SenDeanHeller,Dean Heller,Nevada,Republican
458,Tue Aug 02 18:24:52 +0000 2016,7.60542E+17,0,6,"Happy birthday to a true Nevadan statesman, Paul Laxalt. You taught a generation of us what public service means to our state &amp; our nation.",SenDeanHeller,Dean Heller,Nevada,Republican
459,Tue Aug 02 18:06:29 +0000 2016,7.60537E+17,0,2,Congratulating Mari Kay Bickett on her retirement after serving as CEO of the @NCJFCJ for over five years. https://t.co/a7txtYFR2o,SenDeanHeller,Dean Heller,Nevada,Republican
460,Mon Aug 01 19:01:08 +0000 2016,7.60189E+17,0,1,"Congratulating an extremely talented #NV athlete and dedicated mentor, Trenton Alenik. Read more: https://t.co/lVVBB2Y5LO",SenDeanHeller,Dean Heller,Nevada,Republican
461,Mon Aug 01 16:49:04 +0000 2016,7.60155E+17,2,4,My thoughts and prayers are with all of the #Nevada family affected by the #VirginiaMtnFire - Stay safe! #NVFire,SenDeanHeller,Dean Heller,Nevada,Republican
462,Thu Jul 28 20:19:50 +0000 2016,7.58759E+17,0,1,"#TBT to when Lynne &amp; I watched a play about the settling of the town ""Center of the Universe"" while in #Panaca. https://t.co/uJRey52L5b",SenDeanHeller,Dean Heller,Nevada,Republican
463,Thu Jul 28 18:42:09 +0000 2016,7.58734E+17,0,2,The importance of #NVTravel cannot be overstated. @reviewjournal: @LASairport logs best June performance since 2007 https://t.co/k1LJHfcrny,SenDeanHeller,Dean Heller,Nevada,Republican
464,Wed Jul 27 18:41:04 +0000 2016,7.58372E+17,0,2,Congrats to @CarsonTahoe! @nevadaappeal: Long-Term Acute Care earns #NV's 1st CIHQ Center of Excellence Designation https://t.co/s6Ams9FoiD,SenDeanHeller,Dean Heller,Nevada,Republican
465,Tue Jul 26 20:10:56 +0000 2016,7.58032E+17,2,1,#NevadaProud ICYMI: @Nevada_Magazine's Best of Nevada 2016. Check it out! https://t.co/CEnMH0TZKG,SenDeanHeller,Dean Heller,Nevada,Republican
466,Mon Jul 25 17:43:21 +0000 2016,7.57632E+17,0,1,"#Nevada travel continues to grow! @LASairport moves up, ranked No. 8 in North American airports via @reviewjournal https://t.co/JXm2s9OulM",SenDeanHeller,Dean Heller,Nevada,Republican
467,Mon Jul 25 15:57:46 +0000 2016,7.57606E+17,0,2,Congrats to @HonorFlightNV! #BattleBorn @nevadaappeal: Honor Flight Nevada continues to grow https://t.co/UhuLkeXCri,SenDeanHeller,Dean Heller,Nevada,Republican
468,Fri Jul 22 20:00:49 +0000 2016,7.5658E+17,0,1,#FF @nvbaa @UWSN @TerriJanison @BobMorganLV @JonDPonder @lasvegasfd @RenoFireDept @VetsVillageLV @haileys_hand @UNLVEngineering,SenDeanHeller,Dean Heller,Nevada,Republican
469,Fri Jul 22 18:36:49 +0000 2016,7.56559E+17,1,3,"Great news for #NV! @reviewjournal: Nevada led US in solar electricity per capita, study says #NevadaProud https://t.co/KVjDlSQmoD",SenDeanHeller,Dean Heller,Nevada,Republican
470,Fri Jul 22 17:21:26 +0000 2016,7.5654E+17,0,2,"ICYMI: One View: Politicians, conservationists, ranchers collaborate on #Pershing County land plan via @rgj https://t.co/z3XPox8AnZ",SenDeanHeller,Dean Heller,Nevada,Republican
471,Thu Jul 21 17:26:45 +0000 2016,7.56179E+17,0,6,"Recognizing Pearl Harbor survivor &amp; WWII #vet, Howard Hayes. Thank you for your service. https://t.co/8YGmJ87O1h Cc: @HonorFlightNV",SenDeanHeller,Dean Heller,Nevada,Republican
472,Wed Jul 20 20:17:45 +0000 2016,7.55859E+17,0,2,"Recognizing one of #Nevada’s brightest students, Brandon Rasmussen, a 2016 Barry Goldwater Scholar. Read more: https://t.co/4TP7ZnLz4r",SenDeanHeller,Dean Heller,Nevada,Republican
473,Wed Jul 20 18:23:44 +0000 2016,7.55831E+17,1,4,Great meeting with Arnold Stalk of @VetsVillageLV yesterday. Thank you for supporting our #Vets! https://t.co/vkq11px8VU,SenDeanHeller,Dean Heller,Nevada,Republican
474,Tue Jul 19 20:03:09 +0000 2016,7.55493E+17,0,3,Thank you for coming to the office today and meeting with me @JonDPonder. https://t.co/kW1FtDhXA1,SenDeanHeller,Dean Heller,Nevada,Republican
475,Tue Jul 19 19:39:41 +0000 2016,7.55487E+17,1,4,I met with @BobMorganLV and @TerriJanison earlier today to discuss key issues facing the @UWSN. https://t.co/7JBjoDfcbv,SenDeanHeller,Dean Heller,Nevada,Republican
476,Tue Jul 19 18:51:16 +0000 2016,7.55475E+17,1,5,I enjoyed testing out what students of the Global Robot And Drone Deployment program have been working on.cc: @nvbaa https://t.co/3L4LR1xqsr,SenDeanHeller,Dean Heller,Nevada,Republican
477,Fri Jul 15 19:49:19 +0000 2016,7.5404E+17,0,1,#FF @DRIScience @BaileyGumm @MissAmericaNV @OppVillageLV @DavidsonGifted,SenDeanHeller,Dean Heller,Nevada,Republican
478,Fri Jul 15 18:18:09 +0000 2016,7.54017E+17,0,5,"Recognizing Taylor Wilson, a NV student &amp; the youngest individual to create nuclear fusion. https://t.co/AN02HnKqmA CC: @DavidsonGifted",SenDeanHeller,Dean Heller,Nevada,Republican
479,Fri Jul 15 16:13:25 +0000 2016,7.53986E+17,0,2,Pleased the Senate passed our bill awarding the Congressional Gold Medal to WWII Filipino #Vets. Cc: @maziehirono https://t.co/LIpNBPxRts,SenDeanHeller,Dean Heller,Nevada,Republican
480,Fri Jul 15 15:01:39 +0000 2016,7.53968E+17,0,9,"Yesterday, @SenatorTimScott delivered an inspiring @SenateFloor speech. I was fortunate to have witnessed it. ICYMI: https://t.co/GmKGUkycNz",SenDeanHeller,Dean Heller,Nevada,Republican
481,Fri Jul 15 14:08:43 +0000 2016,7.53954E+17,0,10,"My thoughts &amp; prayers are w/ all affected in the tragic #NiceAttack. I stand in solidarity w/ France, one of our oldest allies. #PrayForNice",SenDeanHeller,Dean Heller,Nevada,Republican
482,Thu Jul 14 21:30:24 +0000 2016,7.53703E+17,0,4,#TBT to presenting Staff Sergeant Arthur with his Purple Heart. He is a true hero and one of Nevada's finest. https://t.co/bN0MJJLExD,SenDeanHeller,Dean Heller,Nevada,Republican
483,Thu Jul 14 20:38:08 +0000 2016,7.5369E+17,1,2,I spoke on the Senate floor urging my colleagues to support the  @DeptVetAffairs #Appropriations bill. TUNE IN:  https://t.co/4DBg6Mg9Mf,SenDeanHeller,Dean Heller,Nevada,Republican
484,Thu Jul 14 20:03:17 +0000 2016,7.53681E+17,0,1,Thanks to this upstanding Nevadan for keeping our community safe for half a century! @rgj story: https://t.co/bMXYi3SKIz,SenDeanHeller,Dean Heller,Nevada,Republican
485,Thu Jul 14 19:03:42 +0000 2016,7.53666E+17,0,5,Obamacare's #CadillacTax needs to be fully repealed. Pleased to see 300 members of the House sign on to legislation doing just that!,SenDeanHeller,Dean Heller,Nevada,Republican
486,Thu Jul 14 18:27:54 +0000 2016,7.53657E+17,0,5,"ICYMI: FAA bill extends Nevada drone testing, addresses human trafficking via @LasVegasSun https://t.co/jQgDGnh9Gd",SenDeanHeller,Dean Heller,Nevada,Republican
487,Thu Jul 14 17:23:51 +0000 2016,7.53641E+17,0,4,It was an honor wearing this #NV blue tie while presiding. Thank you to those at @OppVillageLV who made it for me! https://t.co/GXi8ELWSyp,SenDeanHeller,Dean Heller,Nevada,Republican
488,Thu Jul 14 15:35:48 +0000 2016,7.53614E+17,0,4,Always a pleasure meeting with @OppVillageLV! Thank you to Bob and this great group of Nevadans for stopping by. https://t.co/Vfggoe3Lo6,SenDeanHeller,Dean Heller,Nevada,Republican
489,Wed Jul 13 21:54:39 +0000 2016,7.53347E+17,0,1,I spoke at a @GOPSenFinance hearing on the importance of tele-medicine for dementia patients in rural #NV. TUNE IN: https://t.co/eeipKTPpgq,SenDeanHeller,Dean Heller,Nevada,Republican
490,Wed Jul 13 21:36:07 +0000 2016,7.53342E+17,0,1,"I applaud Senate passage of the #FAA bill, which includes my provisions that will serve our #NV communities well. https://t.co/7ZliHFe7cq",SenDeanHeller,Dean Heller,Nevada,Republican
491,Wed Jul 13 20:54:59 +0000 2016,7.53332E+17,0,4,Great teaming up w/ @MarkAmodeiNV2 on legislation in support of #Pershing County. Pleased to see this important bill intro'd in the House!,SenDeanHeller,Dean Heller,Nevada,Republican
492,Wed Jul 13 19:14:34 +0000 2016,7.53307E+17,0,1,"ICYMI: @SenDeanHeller, Other Western Senators Applaud  Committee Passage of Drought Bill. Read more: https://t.co/K0CG3LS3Xf",SenDeanHeller,Dean Heller,Nevada,Republican
493,Wed Jul 13 18:13:44 +0000 2016,7.53291E+17,0,10,Thanks to these Nevadans with @GirlUp for meeting to discuss education! #girlslead16 https://t.co/MvMcDsaSEy,SenDeanHeller,Dean Heller,Nevada,Republican
494,Wed Jul 13 16:17:38 +0000 2016,7.53262E+17,1,11,Always enjoy when #Nevada students stop by. Great having you here in Washington with @CloseUp_DC. https://t.co/99tf7WYXc9,SenDeanHeller,Dean Heller,Nevada,Republican
495,Tue Jul 12 21:50:08 +0000 2016,7.52983E+17,1,6,Thanks to these #Nevada representatives with @ACSCAN for stopping by today! https://t.co/jDbTrLPp70,SenDeanHeller,Dean Heller,Nevada,Republican
496,Tue Jul 12 21:26:59 +0000 2016,7.52978E+17,0,3,Pleased to see the House pass legislation empowering student loan borrowers through financial literacy. Read more: https://t.co/Uc15bD49Am,SenDeanHeller,Dean Heller,Nevada,Republican
497,Tue Jul 12 20:57:18 +0000 2016,7.5297E+17,0,8,"Enjoyed meeting Miss Nevada 2016, @BaileyGumm. Good luck representing #Nevada at @MissAmericaOrg Cc: @MissAmericaNV https://t.co/6vlBSEwlQx",SenDeanHeller,Dean Heller,Nevada,Republican
498,Tue Jul 12 20:08:22 +0000 2016,7.52958E+17,0,3,Great working with @MartinHeinrich on a bill establishing incentives for business &amp; home use of energy storage. https://t.co/GLraDffGPI,SenDeanHeller,Dean Heller,Nevada,Republican
499,Tue Jul 12 14:36:15 +0000 2016,7.52874E+17,0,10,Saddened to hear of the 2 BLM firefighters who passed on Sunday. My prayers are with all affected. Their service will never be forgotten.,SenDeanHeller,Dean Heller,Nevada,Republican
500,Mon Jul 11 21:25:45 +0000 2016,7.52615E+17,0,3,"Recognizing William Park, who has served the Smith Valley Fire Protection District for over 50 yrs! https://t.co/kTEcKOMyor #BattleBorn",SenDeanHeller,Dean Heller,Nevada,Republican
501,Thu Jul 07 17:00:33 +0000 2016,7.51099E+17,4,6,"Today, Lynne and I celebrate our 32nd wedding anniversary. Am very grateful for my amazing wife and family. https://t.co/tjJb2gMu0I",SenDeanHeller,Dean Heller,Nevada,Republican
502,Thu Jul 07 14:56:56 +0000 2016,7.51067E+17,1,6,I wrote a letter to @HouseCommerce re #Yucca mountain. The solution is not forcing the burden on Nevada. Read more: https://t.co/V2azHdc5Uz,SenDeanHeller,Dean Heller,Nevada,Republican
503,Wed Jul 06 20:55:57 +0000 2016,7.50795E+17,0,2,"Remembering a true Nevada statesman and dedicated public servant, Coe Swobe. Read more: https://t.co/0VxsZxE3Ox",SenDeanHeller,Dean Heller,Nevada,Republican
504,Wed Jul 06 18:29:30 +0000 2016,7.50759E+17,0,2,.@washoecounty Thank you @TMFPD for keeping our communities safe!,SenDeanHeller,Dean Heller,Nevada,Republican
505,Wed Jul 06 14:59:44 +0000 2016,7.50706E+17,1,3,"Congratulations to @Hutch4Nevada &amp; Cary on welcoming their granddaughter, Quinn Petra Tueller, into their family last night!",SenDeanHeller,Dean Heller,Nevada,Republican
506,Tue Jul 05 16:53:41 +0000 2016,7.50372E+17,0,2,Good luck to this #RenoHigh grad! @mellawrence29 reaches steeplechase finals via @rgj https://t.co/rh3wLHW970,SenDeanHeller,Dean Heller,Nevada,Republican
507,Tue Jul 05 15:03:49 +0000 2016,7.50344E+17,0,1,Congrats to Nevada's @vashtizzle_ who will be competing in the @Rio2016_en! #BattleBorn Story via @SInow: https://t.co/VlhzuZ8It0,SenDeanHeller,Dean Heller,Nevada,Republican
508,Mon Jul 04 16:53:51 +0000 2016,7.5001E+17,0,8,"Great morning with my wife, Lynne, in the @CityOfLasVegas at the Summerlin Council Patriotic Parade! https://t.co/6zDTzAvSh6",SenDeanHeller,Dean Heller,Nevada,Republican
509,Mon Jul 04 13:00:21 +0000 2016,7.49951E+17,0,10,Happy #IndependenceDay to fellow Nevadans across the state. https://t.co/5wSyIDhY44,SenDeanHeller,Dean Heller,Nevada,Republican
510,Fri Jul 01 17:41:44 +0000 2016,7.48935E+17,1,3,"Recognizing Stacie Mathewson, who has gone above &amp; beyond in her endeavors to help Nevadans Cc: @SMF_YouthRecvry https://t.co/GctUTLQH06",SenDeanHeller,Dean Heller,Nevada,Republican
511,Fri Jul 01 15:45:14 +0000 2016,7.48905E+17,0,5,Absolutely incredible! #BattleBorn @CityofReno's Wise makes history after being cleared to return to duty @rgj: https://t.co/S1j7dsmi1L,SenDeanHeller,Dean Heller,Nevada,Republican
512,Thu Jun 30 19:38:20 +0000 2016,7.48602E+17,1,3,#TBT to riding on the Percheron Hitch at the @renorodeo! Such a great #Nevada event. https://t.co/Ao4GFt58X1,SenDeanHeller,Dean Heller,Nevada,Republican
513,Thu Jun 30 18:27:31 +0000 2016,7.48584E+17,2,2,Congrats &amp; good luck to these #NV students! Bright futures ahead: @unevadareno students receive Fulbright award https://t.co/qYcIoQr18S,SenDeanHeller,Dean Heller,Nevada,Republican
514,Thu Jun 30 17:27:10 +0000 2016,7.48569E+17,0,3,Good luck to this @CarsonCityGov native! @MARNOLDPV has chance to make Olympic team via @nevadaappeal #BattleBorn https://t.co/zmcdRpgacK,SenDeanHeller,Dean Heller,Nevada,Republican
515,Wed Jun 29 19:00:33 +0000 2016,7.4823E+17,0,4,Congrats to @ElkoCounty's Markus Mariluch - becomes 1st Nevadan bull-riding champ at @renorodeo! @ElkoDaily: https://t.co/J4TNdobgUE,SenDeanHeller,Dean Heller,Nevada,Republican
516,Wed Jun 29 17:01:42 +0000 2016,7.482E+17,1,1,Thanks to Lindsay Anderson of @WCSDTweet for stopping by to talk about #NV education! https://t.co/Bz4Y1XYwtY,SenDeanHeller,Dean Heller,Nevada,Republican
517,Wed Jun 29 16:28:02 +0000 2016,7.48191E+17,1,2,Great working w/ @MarkWarner @SenKaineOffice &amp; @SenCoryGardner in intro'ing legislation to empower student borrowers https://t.co/lCblv9k1xj,SenDeanHeller,Dean Heller,Nevada,Republican
518,Wed Jun 29 01:08:04 +0000 2016,7.4796E+17,1,1,Calling out to rural #Nevada for tonight's telephone town hall.,SenDeanHeller,Dean Heller,Nevada,Republican
519,Tue Jun 28 20:49:30 +0000 2016,7.47895E+17,4,2,It's always good to have Nevadans visiting Capitol Hill. Enjoyed meeting with @AaronDFordNV and Dr. Tyree Carr today https://t.co/AbtFsHUWH6,SenDeanHeller,Dean Heller,Nevada,Republican
520,Tue Jun 28 20:03:15 +0000 2016,7.47883E+17,3,5,It was an honor meeting Champion Tennyson Hunter &amp; his family with @CMNHospitals - @cityofsparks! #ChampionsForKids https://t.co/8B624Zyjt9,SenDeanHeller,Dean Heller,Nevada,Republican
521,Tue Jun 28 19:31:43 +0000 2016,7.47875E+17,0,4,Pleased to see @NevadaDMV roll out specialty license plates supporting #Vets. Check out @KRNV &amp; @fox11reno coverage: https://t.co/PP601CL3qG,SenDeanHeller,Dean Heller,Nevada,Republican
522,Tue Jun 28 18:52:03 +0000 2016,7.47865E+17,1,4,Congrats to @CityofReno's Weiss! Reno's Weiss finishes 14th in 200M free at Olympic trials via @rgj https://t.co/uWEr03j1Xo #BattleBorn,SenDeanHeller,Dean Heller,Nevada,Republican
523,Tue Jun 28 18:12:48 +0000 2016,7.47855E+17,0,1,Learn more about the legislation here: https://t.co/CXJHogTtun 3/3,SenDeanHeller,Dean Heller,Nevada,Republican
524,Tue Jun 28 18:12:22 +0000 2016,7.47855E+17,1,1,The bill provides the community long-term economic development opportunities while reducing fire risks &amp; enhancing wildlife habit 2/3,SenDeanHeller,Dean Heller,Nevada,Republican
525,Tue Jun 28 18:11:56 +0000 2016,7.47855E+17,0,2,Proud to introduce the #PershingCounty Economic Development &amp; Conservation Act https://t.co/ZGzVFuMYPk 1/3,SenDeanHeller,Dean Heller,Nevada,Republican
526,Tue Jun 28 16:57:58 +0000 2016,7.47836E+17,0,1,"#NVTravel continues to grow! @Allegiant launching new 
 @LASairport service to Florida, New York City @reviewjournal https://t.co/CEhgdJ7jwt",SenDeanHeller,Dean Heller,Nevada,Republican
527,Tue Jun 28 15:28:18 +0000 2016,7.47814E+17,0,1,Praying for those affected by the #LovellFire. Follow @HumboldtToiyabe for the latest updates.,SenDeanHeller,Dean Heller,Nevada,Republican
528,Mon Jun 27 21:21:43 +0000 2016,7.4754E+17,0,1,Congrats to @TravelNevada! Campaign honored as best travel marketing program nationwide via @nevadaappeal https://t.co/MwfVSCbn1S,SenDeanHeller,Dean Heller,Nevada,Republican
529,Mon Jun 27 19:27:02 +0000 2016,7.47512E+17,0,2,Great read on #NV students! @NASA sends @cityofhenderson 5th-graders’ soybean experiment into space. @reviewjournal: https://t.co/tG108a3jDX,SenDeanHeller,Dean Heller,Nevada,Republican
530,Mon Jun 27 18:59:53 +0000 2016,7.47505E+17,2,2,Today is National Post-Traumatic Stress Awareness Day. Retweet and support our heroes who experience #PTS. https://t.co/liWxdoqZnP,SenDeanHeller,Dean Heller,Nevada,Republican
531,Fri Jun 24 15:46:00 +0000 2016,7.46369E+17,1,2,"Tuesday, I asked @federalreserve Chair Yellen what is US plan if #Brexit happens. She didn't answer. NOW what? https://t.co/sm5wWRli9j",SenDeanHeller,Dean Heller,Nevada,Republican
532,Fri Jun 24 14:49:04 +0000 2016,7.46354E+17,1,2,Empowering Nevadans with financial info is the goal of new bipartisan bill I introduced with @SenGaryPeters: https://t.co/eZhutN7t9x,SenDeanHeller,Dean Heller,Nevada,Republican
533,Thu Jun 23 17:05:14 +0000 2016,7.46026E+17,0,1,Enjoyed having Eric Edelstein &amp; other @Aces reps stop by. Always fun watching the #Aces play in the @CityofReno! https://t.co/GJwPOKvV1U,SenDeanHeller,Dean Heller,Nevada,Republican
534,Thu Jun 23 01:14:35 +0000 2016,7.45787E+17,0,1,"Calling out to @CarsonCityGov, @LYONOEM, @CountyofDouglas, and @StoreyCounty for tonight's telephone town hall.",SenDeanHeller,Dean Heller,Nevada,Republican
535,Wed Jun 22 21:07:39 +0000 2016,7.45725E+17,4,9,It's official! Excited to see @NHL approval of expansion to the @CityOfLasVegas. @espn: https://t.co/AzC68qY6Bi #NevadaProud,SenDeanHeller,Dean Heller,Nevada,Republican
536,Wed Jun 22 19:52:58 +0000 2016,7.45706E+17,5,1,Enjoyed speaking with #Nevada representatives of @NATA1950 this morning. https://t.co/C7JympWneW,SenDeanHeller,Dean Heller,Nevada,Republican
537,Wed Jun 22 19:19:01 +0000 2016,7.45698E+17,1,6,Thanks to Principals Robert Mars &amp; Derek Bellow of @ClarkCountySch for stopping by! https://t.co/dBRc9qtBkc,SenDeanHeller,Dean Heller,Nevada,Republican
538,Wed Jun 22 18:05:09 +0000 2016,7.45679E+17,2,1,More #NV travel growth! @FlyFrontier adding new service to Nashville &amp; Tampa from @LASairport via @reviewjournal https://t.co/StxYPe0uVO,SenDeanHeller,Dean Heller,Nevada,Republican
539,Wed Jun 22 17:17:12 +0000 2016,7.45667E+17,3,3,"Great to see new @Nature_Nevada Director Juan Palma, Kathryn Landreth &amp; Joel Laub in DC &amp; talk about #NVconservation https://t.co/YUaNZmGMdu",SenDeanHeller,Dean Heller,Nevada,Republican
540,Wed Jun 22 15:24:57 +0000 2016,7.45639E+17,1,3,Follow @NevadaForestry &amp; @TMFPD for the latest updates on the fire near Galena Creek Bridge. My thoughts &amp; prayers are w/ this #NV community,SenDeanHeller,Dean Heller,Nevada,Republican
541,Tue Jun 21 18:52:58 +0000 2016,7.45329E+17,3,4,Enjoyed having Executive Director Andy Cole and other representatives of @BarrickGold stop by today! https://t.co/Q2J2NrCFB0,SenDeanHeller,Dean Heller,Nevada,Republican
542,Tue Jun 21 18:29:31 +0000 2016,7.45323E+17,2,1,Recognizing Staff Sergeant Kat Kaelin for her outstanding contributions in serving our country. Read more: https://t.co/WOtIft2rOr,SenDeanHeller,Dean Heller,Nevada,Republican
543,Tue Jun 21 16:25:12 +0000 2016,7.45291E+17,2,1,I questioned @federalreserve Chairwoman Yellen over the state of the U.S. economy &amp; influencing factors. TUNE IN: https://t.co/sm5wWRli9j,SenDeanHeller,Dean Heller,Nevada,Republican
544,Mon Jun 20 22:45:35 +0000 2016,7.45025E+17,4,3,".@GuyClifton, Proud of her every time. She always shines bright under the big lights. The #renorodeo is one of our family's favorite events.",SenDeanHeller,Dean Heller,Nevada,Republican
545,Mon Jun 20 20:24:30 +0000 2016,7.44989E+17,7,2,Had a great time yesterday with Lynne and my grandchildren at the @renorodeo! https://t.co/0kAyVNO4O8,SenDeanHeller,Dean Heller,Nevada,Republican
546,Mon Jun 20 19:35:27 +0000 2016,7.44977E+17,1,3,Recognizing Carole Vilardo after three decades of service to the Great State of #Nevada. https://t.co/pPsTlES6VL Cc: @NevadaTaxpayers,SenDeanHeller,Dean Heller,Nevada,Republican
547,Mon Jun 20 18:48:03 +0000 2016,7.44965E+17,1,2,"Happy birthday to the Gold ‘N Silver, here’s to another 60 more! https://t.co/GYHEW1OY39",SenDeanHeller,Dean Heller,Nevada,Republican
548,Fri Jun 17 20:12:55 +0000 2016,7.43899E+17,3,1,Direct flights between @LASairport and @fly2ohare starts today on @FlyFrontier! Story via @LasVegasSun:  https://t.co/0ig1ENbymd  #NVTravel,SenDeanHeller,Dean Heller,Nevada,Republican
549,Fri Jun 17 19:29:46 +0000 2016,7.43888E+17,7,2,.@DeptVetAffairs won't use its fast-track firing powers to hold employees accountable. This is a disappointment and disservice to #veterans.,SenDeanHeller,Dean Heller,Nevada,Republican
550,Thu Jun 16 19:02:16 +0000 2016,7.43519E+17,3,1,#TBT to last year's @renorodeo. Had a great time catching up with fellow Nevadans! #BattleBorn https://t.co/h9kCNtnOU9,SenDeanHeller,Dean Heller,Nevada,Republican
551,Thu Jun 16 16:50:36 +0000 2016,7.43486E+17,3,2,Great having @HonorFlightNV's Jon Yuspa stop by. Thanks for all you do for Nevada's #vets. https://t.co/2FTMl8GGQC https://t.co/5hrA90Waud,SenDeanHeller,Dean Heller,Nevada,Republican
552,Thu Jun 16 14:51:03 +0000 2016,7.43456E+17,4,1,My thoughts and prayers are with my fellow #Nevadans affected by the #HawkenFire. Follow @TMFPD for the latest updates.,SenDeanHeller,Dean Heller,Nevada,Republican
553,Wed Jun 15 19:32:20 +0000 2016,7.43164E+17,6,3,Enjoyed meeting #Nevada students with @NationalHistory Day this afternoon. #BattleBorn https://t.co/qksZVzEshN,SenDeanHeller,Dean Heller,Nevada,Republican
554,Wed Jun 15 18:29:13 +0000 2016,7.43148E+17,3,1,"Thanks to @OPD5, @Valley_Electric, and @NvRuralElectric youth for stopping by! https://t.co/uqjCx0dkRf",SenDeanHeller,Dean Heller,Nevada,Republican
555,Wed Jun 15 17:44:22 +0000 2016,7.43137E+17,3,4,"Always nice catching up with @OppVillageLV, an organization helping thousands with disabilities! https://t.co/0quLTSrB4R",SenDeanHeller,Dean Heller,Nevada,Republican
556,Tue Jun 14 17:26:11 +0000 2016,7.4277E+17,3,7,"Great news for #Nevada! Excited to welcome @NHL expansion to @cityoflasvegas, via @AP: https://t.co/OARDw3JLE9",SenDeanHeller,Dean Heller,Nevada,Republican
557,Mon Jun 13 18:11:41 +0000 2016,7.42419E+17,3,2,Great read on @HydePark_MS students w/ waste-smart design for city of the future via @LasVegasSun https://t.co/OMyNJa52cd Cc: @DiscoverEorg,SenDeanHeller,Dean Heller,Nevada,Republican
558,Mon Jun 13 16:13:21 +0000 2016,7.42389E+17,0,1,More #NV travel growth! @reviewjournal: @CityOfLasVegas to Munich @Condor_America flights to begin in 2017 https://t.co/rxs3ihiLeV CC @LVCVA,SenDeanHeller,Dean Heller,Nevada,Republican
559,Sun Jun 12 13:29:31 +0000 2016,7.41986E+17,3,2,"Happy birthday to my friend and fellow Nevadan, @MarkAmodeiNV2. https://t.co/tmTRih5YV1",SenDeanHeller,Dean Heller,Nevada,Republican
560,Fri Jun 10 19:51:24 +0000 2016,7.41357E+17,0,1,#FF @SouthwestAir @BetsyFretwell @StavrosAnthony @CSNCoyote @bobbylucey @RTCWashoe @lvmpd @lvchamber @kabilez23 @CarsonTahoe @Allegiant,SenDeanHeller,Dean Heller,Nevada,Republican
561,Fri Jun 10 19:20:53 +0000 2016,7.41349E+17,1,1,TUNE IN: @NewsTalk780KOH coverage of my discussion w/ @USDOT @SecretaryFoxx about I-11 https://t.co/tRNSvlEqwB,SenDeanHeller,Dean Heller,Nevada,Republican
562,Fri Jun 10 16:15:54 +0000 2016,7.41303E+17,16,12,My pro-gun amendment to the #NDAA aims to do one thing: stand tall for the rights of gun owners in Nevada. Read more https://t.co/YITEYIke5i,SenDeanHeller,Dean Heller,Nevada,Republican
563,Thu Jun 09 20:44:23 +0000 2016,7.41008E+17,0,2,.@NewsTalk780KOH coverage: Key #Nevada Lands Bill  passes House https://t.co/FPj5RRg65K. Good work @RepHardy! https://t.co/oXZTbuGYuE,SenDeanHeller,Dean Heller,Nevada,Republican
564,Thu Jun 09 16:54:00 +0000 2016,7.4095E+17,0,3,"Thanks for taking care of us, congrats! @CarsonTahoe unveils latest liver cancer treatment via @nevadaappeal: https://t.co/Aoa6Ftlrki",SenDeanHeller,Dean Heller,Nevada,Republican
565,Thu Jun 09 15:07:24 +0000 2016,7.40923E+17,1,4,Enjoyed speaking w/ members of the @lvchamber! Great having you in Washington to discuss issues pertinent to #NV. https://t.co/YxmTpwbFyq,SenDeanHeller,Dean Heller,Nevada,Republican
566,Wed Jun 08 21:22:46 +0000 2016,7.40655E+17,3,2,"Today, I spoke at a @SenateCommerce hearing highlighting the 
 importance of building I-11 to Secretary Foxx. WATCH: https://t.co/5rCACOy1Pj",SenDeanHeller,Dean Heller,Nevada,Republican
