,created_at,id_str,reply_count,retweet_count,text,user,name,state,party
0,Fri May 19 21:30:01 +0000 2017,8.65681E+17,10,7,Was honored to nominate Nevadan 1st Lt. Dylan Kay to @USAirForce Academy in '10. Proud to learn of his success w/ t… https://t.co/8IcirSfj8p,SenDeanHeller,Dean Heller,Nevada,Republican
1,Fri May 19 20:45:01 +0000 2017,8.6567E+17,8,3,"Congratulations Nevada Commission on POST, Academy Class 2017-01! Ceremony was in Carson City yesterday. https://t.co/2fbJrwUUte",SenDeanHeller,Dean Heller,Nevada,Republican
2,Fri May 19 20:09:30 +0000 2017,8.65661E+17,14,7,Introduced a bill w/ @MarkWarner to help families track down a missing loved one: https://t.co/NEdhvDcBdE,SenDeanHeller,Dean Heller,Nevada,Republican
3,Fri May 19 15:17:39 +0000 2017,8.65587E+17,21,3,"Tourism is the backbone of #NV’s economy, and that’s why I fight for solutions for safe, efficient airports &amp; roads. https://t.co/seHnn9KRt7",SenDeanHeller,Dean Heller,Nevada,Republican
4,Thu May 18 20:23:39 +0000 2017,8.65302E+17,88,9,Leaving briefing on Russia investigation with Deputy AG Rosenstein. It's important Nevadans get the answers they ex… https://t.co/QmEFrKJLrP,SenDeanHeller,Dean Heller,Nevada,Republican
5,Thu May 18 20:22:03 +0000 2017,8.65301E+17,9,2,"Met w/ Marci, Acting #NV BLM Director and BLM Dep Director of Ops John Ruhs to discuss public lands concerns from p… https://t.co/xqxERH5QGF",SenDeanHeller,Dean Heller,Nevada,Republican
6,Thu May 18 20:12:16 +0000 2017,8.65299E+17,5,3,"Met with @NVARnevada today &amp; discussed how we can promote a healthy housing market in our state. Great group, thank… https://t.co/g3m6oZeFOy",SenDeanHeller,Dean Heller,Nevada,Republican
7,Thu May 18 18:37:16 +0000 2017,8.65275E+17,9,9,Storing nuclear waste in #YuccaMountain would endanger the entire country. Here’s why: https://t.co/JvxWwhQGWF,SenDeanHeller,Dean Heller,Nevada,Republican
8,Wed May 17 21:22:29 +0000 2017,8.64954E+17,19,16,Congratulations on the grand opening of the Boys &amp; Girls Club of Winnemucca! https://t.co/vLK1r313xL,SenDeanHeller,Dean Heller,Nevada,Republican
9,Wed May 17 20:56:17 +0000 2017,8.64948E+17,7,2,VIDEO: Today I spoke at a @VAChair hearing about ways to help the VA work better for #NV veterans. https://t.co/oGs1UTApNa,SenDeanHeller,Dean Heller,Nevada,Republican
10,Wed May 17 18:43:50 +0000 2017,8.64914E+17,15,3,Proud to introduce the Back the Blue Act in support of #NV law enforcement. RELEASE: https://t.co/LULhV3crHG,SenDeanHeller,Dean Heller,Nevada,Republican
11,Wed May 17 16:20:41 +0000 2017,8.64878E+17,60,5,"It’s time to move the U.S. Embassy from Tel Aviv to #Israel’s Capital, Jerusalem. MORE: https://t.co/eAMT0OtwUG",SenDeanHeller,Dean Heller,Nevada,Republican
12,Wed May 17 15:25:00 +0000 2017,8.64864E+17,21,5,Very glad to hear that my friend Senator Tillis is doing better. https://t.co/893SD0Bs2l,SenDeanHeller,Dean Heller,Nevada,Republican
13,Tue May 16 21:19:32 +0000 2017,8.64591E+17,61,3,"Met w/ NV representatives of @alsassociation to discuss research funding, rehab technologies, &amp; home health initiat… https://t.co/WSv2kzii4m",SenDeanHeller,Dean Heller,Nevada,Republican
14,Tue May 16 20:30:55 +0000 2017,8.64579E+17,14,10,"In honor of #PoliceWeek, I spoke on the Senate floor about Nevada's loss of North Las Vegas Detective Chad Parque: https://t.co/9wk0afjn0P",SenDeanHeller,Dean Heller,Nevada,Republican
15,Tue May 16 20:14:22 +0000 2017,8.64575E+17,17,5,Met w/ Vinton Hawley from Pyramid Lake Paiute Tribe to discuss the #NV tribal community's concerns with the debate… https://t.co/1UE4AhADME,SenDeanHeller,Dean Heller,Nevada,Republican
16,Tue May 16 19:09:00 +0000 2017,8.64558E+17,22,1,Today I sat down w/ the @DRIScience to talk about #NV flooding issues and my support for funding to help #NV recove… https://t.co/ENtxJ4CrvO,SenDeanHeller,Dean Heller,Nevada,Republican
17,Tue May 16 18:38:54 +0000 2017,8.64551E+17,18,2,I want to thank Rodney Mike from the Duckwater Shoshone Tribe for speaking with me to discuss infrastructure improv… https://t.co/ErC2UMDSCd,SenDeanHeller,Dean Heller,Nevada,Republican
18,Mon May 15 19:00:02 +0000 2017,8.64194E+17,45,7,It’s time for action on #NoBudgetNoPay. RELEASE: https://t.co/4N3SnFoPPK,SenDeanHeller,Dean Heller,Nevada,Republican
19,Mon May 15 17:54:22 +0000 2017,8.64177E+17,17,5,"This #PoliceWeek, we pay tribute to those who lost their lives in the line of duty and are reminded of #NV law enfo… https://t.co/35Z9k2v0Bt",SenDeanHeller,Dean Heller,Nevada,Republican
20,Mon May 15 17:09:31 +0000 2017,8.64166E+17,16,8,I reintroduced bipartisan legislation to protect pregnant workers from workplace discrimination: https://t.co/5qfXnJrqW8,SenDeanHeller,Dean Heller,Nevada,Republican
21,Sat May 13 00:20:40 +0000 2017,8.63187E+17,51,8,I introduced legislation to promote #accountability at the @DeptVetAffairs. #NV veterans deserve more: https://t.co/3pv4AedpwZ,SenDeanHeller,Dean Heller,Nevada,Republican
22,Fri May 12 21:25:23 +0000 2017,8.63143E+17,10,5,Great to see Tommy at the Latin Chamber event today. Not surprised by his generosity to soon-to-be-college grads -… https://t.co/mJk7sqTUJ2,SenDeanHeller,Dean Heller,Nevada,Republican
23,Fri May 12 18:29:50 +0000 2017,8.63099E+17,15,12,ICYMI: The tunnel collapse in Washington State is a reminder that #NV cannot be the nation’s nuclear waste dump. https://t.co/Pd65e6g9Oy,SenDeanHeller,Dean Heller,Nevada,Republican
24,Thu May 11 21:00:02 +0000 2017,8.62774E+17,44,3,#NV rheumatologists from @ACRheum met w/ me to discuss medical research &amp; the healthcare workforce. Appreciate thei… https://t.co/jpDt5ZF4xe,SenDeanHeller,Dean Heller,Nevada,Republican
25,Thu May 11 18:59:23 +0000 2017,8.62744E+17,38,5,"Met w/ #NV #outdoorsmen from @SafariClubIntl to discuss safe, fair, and efficient management of our state’s lands. https://t.co/l24i8ojE1d",SenDeanHeller,Dean Heller,Nevada,Republican
26,Thu May 11 01:57:08 +0000 2017,8.62487E+17,32,13,Great News: @Apple is expanding its data center in #Reno which will create hundreds of jobs. https://t.co/EINN3hL9Y9,SenDeanHeller,Dean Heller,Nevada,Republican
27,Wed May 10 23:33:52 +0000 2017,8.62451E+17,45,5,Tourism contributed $2.1 billion to the Southern #NV economy in 2016. It’s why I keep fighting to support NV tourism https://t.co/Tr14scnSLQ,SenDeanHeller,Dean Heller,Nevada,Republican
28,Wed May 10 21:37:45 +0000 2017,8.62421E+17,74,9,My good friend @senorrinhatch stopped by today to celebrate my birthday. Thanks for the cake Senator! https://t.co/vcbXXBMXjq,SenDeanHeller,Dean Heller,Nevada,Republican
29,Wed May 10 21:04:15 +0000 2017,8.62413E+17,15,5,Thanks to @CloseUp_DC for bringing #NV students from Pyramid Lake High School to meet w/ me in DC. Great discussion… https://t.co/FJXg1sWrQK,SenDeanHeller,Dean Heller,Nevada,Republican
30,Tue May 09 21:12:42 +0000 2017,8.62053E+17,60,14,VIDEO: Today on the Senate floor I discussed why #YuccaMountain could threaten the Las Vegas economy. https://t.co/vpYE72epaX,SenDeanHeller,Dean Heller,Nevada,Republican
31,Tue May 09 20:21:51 +0000 2017,8.6204E+17,22,7,Met w/ #NV representatives from @ADL_National and discussed our shared goal of combating hate across this country. https://t.co/ixHis3hocG,SenDeanHeller,Dean Heller,Nevada,Republican
32,Tue May 09 17:53:43 +0000 2017,8.62003E+17,13,2,"Veterans in #Ely #NV received positive news yesterday, but we have work to do to ensure a permanent solution. More: https://t.co/PTeF7wITXW",SenDeanHeller,Dean Heller,Nevada,Republican
33,Mon May 08 17:04:50 +0000 2017,8.61628E+17,17,2,"Spoke at the @APTA_info Conference in Reno, #NV. Appreciate all of their work to ensure our transit system keeps pa… https://t.co/elvCCSYisG",SenDeanHeller,Dean Heller,Nevada,Republican
34,Fri May 05 21:10:00 +0000 2017,8.60603E+17,33,2,Working w/ @SenCortezMasto &amp; local #NV officials on legislation to bolster conservation &amp; economic development https://t.co/DDNzoyigj0,SenDeanHeller,Dean Heller,Nevada,Republican
35,Fri May 05 20:33:43 +0000 2017,8.60593E+17,11,6,Grateful to again attend the James Hoff Memorial honoring the heroism of #NV law enforcement &amp; all of those who mad… https://t.co/UYrCfgm1FR,SenDeanHeller,Dean Heller,Nevada,Republican
36,Thu May 04 23:17:22 +0000 2017,8.60272E+17,45,9,"Spoke w/ a Senate Task Force on Hispanic Affairs about important issues to the community like tax reform, health ca… https://t.co/Wnsw4QMVXd",SenDeanHeller,Dean Heller,Nevada,Republican
37,Thu May 04 21:28:21 +0000 2017,8.60245E+17,22,7,"Great to see @TeslaMotors on Capitol Hill today. Look forward to seeing more from them, especially in #NV. https://t.co/3aDp0rDkVr",SenDeanHeller,Dean Heller,Nevada,Republican
38,Thu May 04 20:30:10 +0000 2017,8.6023E+17,13,2,"Met w/ @NatUrbanLeague’s Clark County organization to discuss #jobs, #infrastructure, #education, and how we can su… https://t.co/BPszBycAVK",SenDeanHeller,Dean Heller,Nevada,Republican
39,Thu May 04 19:24:20 +0000 2017,8.60214E+17,22,6,My statement on why I voted no on the spending deal: https://t.co/SQ8tnlDIYc #NoBudgetNoPay,SenDeanHeller,Dean Heller,Nevada,Republican
40,Wed May 03 23:30:01 +0000 2017,8.59913E+17,58,23,"Just filed #NoBudgetNoPay as an amendment to spending bill. If Congress doesn’t do its job, we shouldn’t be paid. https://t.co/IZDGwXoelc",SenDeanHeller,Dean Heller,Nevada,Republican
41,Wed May 03 20:18:26 +0000 2017,8.59865E+17,7,1,Met w/ @unevadareno President Marc Johnson to discuss their efforts to bolster #NV's competitiveness. Appreciate ev… https://t.co/rDMDgb9EIj,SenDeanHeller,Dean Heller,Nevada,Republican
42,Wed May 03 01:00:00 +0000 2017,8.59573E+17,12,4,"Small businesses are a pillar of #NV's economy &amp; support 450,000+ jobs in our state. Their success makes #NV strong… https://t.co/Ookvisc9kk",SenDeanHeller,Dean Heller,Nevada,Republican
43,Tue May 02 22:35:04 +0000 2017,8.59537E+17,36,9,Met w/Jaimie from #Reno and discussed my efforts to protect pregnant workers from workplace discrimination &amp; addres… https://t.co/urOZYYue92,SenDeanHeller,Dean Heller,Nevada,Republican
44,Tue May 02 21:05:35 +0000 2017,8.59514E+17,9,5,Former Sen. Mike McGinness and the late Sen. Debbie Smith were inducted into the #NV Senate Hall of Fame. Grateful… https://t.co/yNo53wVndD,SenDeanHeller,Dean Heller,Nevada,Republican
45,Tue May 02 19:30:00 +0000 2017,8.5949E+17,13,1,Met w/ @BreakthruVegas today to discuss #TaxReform and how we can limit DC intrusion so they can grow and hire. https://t.co/uRHNrSpsvi,SenDeanHeller,Dean Heller,Nevada,Republican
46,Tue May 02 18:30:02 +0000 2017,8.59475E+17,20,4,"Met w/ Women's Mining Coalition of #NV. We discussed permitting delays, public lands issues, &amp; regulatory burdens t… https://t.co/0zOltqA0Ct",SenDeanHeller,Dean Heller,Nevada,Republican
47,Tue May 02 17:21:46 +0000 2017,8.59458E+17,4,3,Heard from @NVArchiveRecord and the role they play in certifications for #manufacturing &amp; closing the skills gap fo… https://t.co/5d0sj3cmRF,SenDeanHeller,Dean Heller,Nevada,Republican
48,Tue May 02 16:00:40 +0000 2017,8.59437E+17,7,1,"I’m fighting to permanently authorize #PILT, a critical public lands program that helps local governments across NV: https://t.co/2W9B2RvLbe",SenDeanHeller,Dean Heller,Nevada,Republican
49,Mon May 01 18:04:02 +0000 2017,8.59106E+17,5,2,"Congratulations to Rob Lugg and Ramona Sanchez for grabbing 1st place at the @RenoRiverRun
https://t.co/bzZBUUAg28 #HomeMeansNevada",SenDeanHeller,Dean Heller,Nevada,Republican
50,Mon May 01 00:42:14 +0000 2017,8.58844E+17,1,5,"We will never forget Robert's passion, personality, &amp; service to #NV. My thoughts and prayers go out to his family. https://t.co/hmCX5Dj0YE",SenDeanHeller,Dean Heller,Nevada,Republican
51,Fri Apr 28 21:06:19 +0000 2017,8.58065E+17,22,7,#NV’s mining industry is a critical part of our economy. I will continue to defend it. RELEASE: https://t.co/zahdDtNr4x,SenDeanHeller,Dean Heller,Nevada,Republican
52,Fri Apr 28 18:25:24 +0000 2017,8.58024E+17,2,3,Wishing new @UNLVathletics Director Desiree Reed-Francois the best of luck at @UNLV! https://t.co/rFia5PMXmd #HomeMeansNevada,SenDeanHeller,Dean Heller,Nevada,Republican
53,Thu Apr 27 23:31:47 +0000 2017,8.57739E+17,26,8,.@POTUS opening Office of Accountability and Whistleblower Protection at the @DeptVetAffairs is a positive step forward for #NV #veterans,SenDeanHeller,Dean Heller,Nevada,Republican
54,Thu Apr 27 22:30:02 +0000 2017,8.57724E+17,4,3,"Met w/ Steve Friedlander from Las Vegas &amp; discussed issues affecting the ophthalmology community, including regulat… https://t.co/qbJzSmwB30",SenDeanHeller,Dean Heller,Nevada,Republican
55,Thu Apr 27 21:45:00 +0000 2017,8.57712E+17,13,3,Met w/ the #NV Orthopedic Society about important reforms to promote access to care and support medical professiona… https://t.co/Rvc5AU12a6,SenDeanHeller,Dean Heller,Nevada,Republican
56,Thu Apr 27 20:00:01 +0000 2017,8.57686E+17,9,2,Great meeting w/ Fran Ford Jr. whose business is based out of #Sparks #NV. We talked about tax reform and how we ca… https://t.co/zh8y32wTZP,SenDeanHeller,Dean Heller,Nevada,Republican
57,Thu Apr 27 19:59:52 +0000 2017,8.57686E+17,21,7,I am telling @SecretaryPerry that #NV will not be our nation’s nuclear waste dump: https://t.co/CSss4l9EV4 https://t.co/5TRE80zHeH,SenDeanHeller,Dean Heller,Nevada,Republican
58,Thu Apr 27 19:16:49 +0000 2017,8.57675E+17,6,5,Job well done to @CimarrOnSpartan for placing 3rd overall in the Robotics World Championship. Nevada is proud of their success!,SenDeanHeller,Dean Heller,Nevada,Republican
59,Wed Apr 26 22:00:03 +0000 2017,8.57354E+17,7,2,Definitely a must read if you are visiting the @CityofReno anytime soon: https://t.co/9gckW9f1p5,SenDeanHeller,Dean Heller,Nevada,Republican
60,Wed Apr 26 21:00:02 +0000 2017,8.57339E+17,21,2,Met w/ Gina from @impact360sports. We discussed important topics to #NV's sports &amp; wellness industries and promotin… https://t.co/dhEPBRaWZp,SenDeanHeller,Dean Heller,Nevada,Republican
61,Wed Apr 26 20:30:01 +0000 2017,8.57331E+17,6,1,"Great to hear from Dale and Russell w/ @UNLV. We discussed American innovation, manufacturing for optical science,… https://t.co/Tf5n4A9oPr",SenDeanHeller,Dean Heller,Nevada,Republican
62,Wed Apr 26 20:00:02 +0000 2017,8.57323E+17,6,12,Proud of this #NV couple &amp; their selfless act to honor our veterans through @HonorFlightNV. Please read/watch &amp; RT: https://t.co/lQmL7rUGTA,SenDeanHeller,Dean Heller,Nevada,Republican
63,Wed Apr 26 18:40:49 +0000 2017,8.57303E+17,12,8,WATCH: I testified today on behalf of Nevadans who reject #Yucca Mountain. I’m leading their fight. https://t.co/sdJDoYfPFT,SenDeanHeller,Dean Heller,Nevada,Republican
64,Wed Apr 26 14:11:56 +0000 2017,8.57236E+17,32,15,"I am about to testify against a failed proposal to revive #Yucca Mountain. I will continue to tell those in DC that #NV remains a ""NO.""",SenDeanHeller,Dean Heller,Nevada,Republican
65,Tue Apr 25 23:00:01 +0000 2017,8.57006E+17,5,2,.@RTCWashoe explains why the @CityofReno is the place to be for APTA’s Bus &amp; Paratransit Conference &amp; Roadeo: https://t.co/4rJLCJzGC2,SenDeanHeller,Dean Heller,Nevada,Republican
66,Tue Apr 25 22:40:57 +0000 2017,8.57002E+17,53,96,I am working w/ @RandPaul on legislation to limit DC intrusion &amp; further empower #NV to protect its own ecosystem https://t.co/dSGjYRUZJP,SenDeanHeller,Dean Heller,Nevada,Republican
67,Tue Apr 25 22:15:00 +0000 2017,8.56995E+17,3,4,"I want to thank @NAEMT_ , @REMSAEMS as well as the @CityofReno Fire Dept. for meeting with me today &amp; all they do 2… https://t.co/7Jsu23zTD7",SenDeanHeller,Dean Heller,Nevada,Republican
68,Tue Apr 25 21:40:18 +0000 2017,8.56986E+17,6,2,"In order to promote jobs &amp; travel across #NV, I am leaning on @USDOT to include #I11 in any infrastructure package: https://t.co/0z9ihWme1N",SenDeanHeller,Dean Heller,Nevada,Republican
69,Tue Apr 25 18:34:27 +0000 2017,8.56939E+17,28,2,Met w/ @USDOL nominee Alexander Acosta. Great discussion on addressing burdensome overtime rule &amp; creating a true 2… https://t.co/D2RiNjhIBs,SenDeanHeller,Dean Heller,Nevada,Republican
70,Tue Apr 25 16:15:13 +0000 2017,8.56904E+17,12,4,Met w/ #NV Rural Electric Assoc. to discuss energy policies &amp; environmental regulations that impact our state's rur… https://t.co/npApI3VdUO,SenDeanHeller,Dean Heller,Nevada,Republican
71,Tue Apr 25 01:02:26 +0000 2017,8.56675E+17,3,11,Joining w/ #Israel in honoring #HolocaustRemembranceDay. We must never forget the millions of Jewish lives lost during the Holocaust.,SenDeanHeller,Dean Heller,Nevada,Republican
72,Mon Apr 24 22:52:49 +0000 2017,8.56642E+17,7,4,ICYMI: @GovSandoval and I want alternatives to #Yucca that work for #NV https://t.co/olRPsxhLcC,SenDeanHeller,Dean Heller,Nevada,Republican
73,Mon Apr 24 18:15:00 +0000 2017,8.56572E+17,12,6,It’s not just the @Raiders. Great read about the possibility that #NV hosts a @MLB team! https://t.co/wYxaj1pru0,SenDeanHeller,Dean Heller,Nevada,Republican
74,Mon Apr 24 17:22:11 +0000 2017,8.56559E+17,20,7,"#Yucca is not the solution. Instead, I am calling for a viable approach to our nation’s nuclear waste problem: https://t.co/LfMUyNaIUg",SenDeanHeller,Dean Heller,Nevada,Republican
75,Sun Apr 23 20:57:27 +0000 2017,8.56251E+17,8,4,Appreciated the opportunity to speak and do Q&amp;A at @Valley_Electric's annual meeting. Discussed energy and broadban… https://t.co/9xWi8eEHOU,SenDeanHeller,Dean Heller,Nevada,Republican
76,Sun Apr 23 17:52:46 +0000 2017,8.56204E+17,5,6,Interested in attending a U.S. Service Academy? Applications for Nevadans seeking a nomination now available here: https://t.co/GZAM3VV3h4,SenDeanHeller,Dean Heller,Nevada,Republican
77,Sat Apr 22 21:39:53 +0000 2017,8.55899E+17,17,3,"Great to visit with people in Pahrump, #NV and talk issues - like telemedicine and broadband access - that are impo… https://t.co/BszBrq52jL",SenDeanHeller,Dean Heller,Nevada,Republican
78,Sat Apr 22 21:02:44 +0000 2017,8.5589E+17,5,2,Had the chance to visit with so many #NV heroes today. #BattleBorn https://t.co/zqNh5s5wxt,SenDeanHeller,Dean Heller,Nevada,Republican
79,Sat Apr 22 20:20:24 +0000 2017,8.55879E+17,17,2,Thanks to Desert View Hospital for the invitation to a ribbon cutting and all they do to improve #NV's tele-health… https://t.co/fCCMa59HOF,SenDeanHeller,Dean Heller,Nevada,Republican
80,Sat Apr 22 18:02:59 +0000 2017,8.55844E+17,15,10,"Touring @Valley_Electric in #Pahrump #NV, learning about their important work to bolster cyber security and protect… https://t.co/nZypvGGJoh",SenDeanHeller,Dean Heller,Nevada,Republican
81,Wed Apr 19 20:52:01 +0000 2017,8.548E+17,6,8,Interested in attending a U.S. Service Academy? Applications for Nevadans seeking a nomination now available here: https://t.co/GZAM3VDrSu,SenDeanHeller,Dean Heller,Nevada,Republican
82,Tue Apr 18 20:02:20 +0000 2017,8.54425E+17,82,6,"As Nevadans file on #TaxDay, it's a reminder that we need a fairer, simpler tax code for families &amp; small businesses. Time for #TaxReform!",SenDeanHeller,Dean Heller,Nevada,Republican
83,Tue Apr 18 14:32:48 +0000 2017,8.54342E+17,16,14,First Tesla now @Google. #NV continues to show the country we are a place for tech sector and job growth! https://t.co/LdG6ZbfGYj,SenDeanHeller,Dean Heller,Nevada,Republican
84,Tue Apr 18 03:05:17 +0000 2017,8.54169E+17,86,5,"Whether it's fighting for NV vets, opposing #Yucca, or defending important public lands programs, I'm making sure #NV voices are heard (2/2)",SenDeanHeller,Dean Heller,Nevada,Republican
85,Tue Apr 18 03:02:32 +0000 2017,8.54168E+17,36,5,Honored to address the #NV Legislature today and talk about my efforts to fight on behalf of Nevadans. (1/2) https://t.co/yX1oBdYyQj,SenDeanHeller,Dean Heller,Nevada,Republican
86,Sun Apr 16 17:17:26 +0000 2017,8.53659E+17,38,5,Have a Happy and blessed Easter! https://t.co/oPU3zlFcyB,SenDeanHeller,Dean Heller,Nevada,Republican
87,Thu Apr 13 20:07:54 +0000 2017,8.52614E+17,3,6,@GovSandoval and @NevadaAG have my support in the fight against #YuccaMountain. https://t.co/ZNGlSH9gsP,SenDeanHeller,Dean Heller,Nevada,Republican
88,Thu Apr 13 19:24:26 +0000 2017,8.52603E+17,65,4,".@United Airlines rightfully apologized, but we need to know more. I’m calling for answers to protect consumers. https://t.co/OgcmGPqAcj",SenDeanHeller,Dean Heller,Nevada,Republican
89,Thu Apr 13 18:00:53 +0000 2017,8.52582E+17,23,6,I am asking my colleagues to abandon #Yucca proposal in favor of long-term solutions: https://t.co/pqeZjYjb3N,SenDeanHeller,Dean Heller,Nevada,Republican
90,Tue Apr 11 19:50:47 +0000 2017,8.51885E+17,8,3,Good luck to the @Aces in tonight’s home opener! https://t.co/sCgTXkGBl9,SenDeanHeller,Dean Heller,Nevada,Republican
91,Mon Apr 10 15:20:46 +0000 2017,8.51455E+17,136,21,Judge Neil Gorsuch has been sworn in as a #SCOTUS justice. Proud to see a fellow Westerner join the nation's highes… https://t.co/MVSxHGZhHE,SenDeanHeller,Dean Heller,Nevada,Republican
92,Fri Apr 07 16:15:40 +0000 2017,8.50382E+17,114,12,"Today, I voted to #ConfirmGorsuch to #SCOTUS. My statement: https://t.co/lOip0gfR1K",SenDeanHeller,Dean Heller,Nevada,Republican
93,Fri Apr 07 14:59:48 +0000 2017,8.50362E+17,50,10,My statement on U.S. Military strikes in #Syria: https://t.co/oWk55pu27e,SenDeanHeller,Dean Heller,Nevada,Republican
94,Thu Apr 06 21:45:34 +0000 2017,8.50102E+17,15,5,Our delegation is asking the @NCAA: Why not #NV? https://t.co/XvkhWXxohw,SenDeanHeller,Dean Heller,Nevada,Republican
95,Thu Apr 06 20:14:32 +0000 2017,8.50079E+17,18,5,Don Rickles took comedy to a different level - making Nevadans and people everywhere laugh for more than half a century. He'll be missed.,SenDeanHeller,Dean Heller,Nevada,Republican
96,Thu Apr 06 17:11:02 +0000 2017,8.50033E+17,21,2,"Met w/ #NV job creators from @AEDSocial to discuss tax reform, #infrastructure, &amp; what we can do to close the skill… https://t.co/YbDuW7IkzG",SenDeanHeller,Dean Heller,Nevada,Republican
97,Thu Apr 06 00:00:02 +0000 2017,8.49774E+17,166,9,ICYMI: Why I am voting to #ConfirmGorsuch this week: https://t.co/Dy6LzPlp79,SenDeanHeller,Dean Heller,Nevada,Republican
98,Wed Apr 05 19:00:03 +0000 2017,8.49698E+17,10,7,Proud to meet w/ these #NV heroes from @MilitaryOfficers to discuss important issues such as the elimination of the… https://t.co/X3Qc3dxxnM,SenDeanHeller,Dean Heller,Nevada,Republican
99,Wed Apr 05 17:36:25 +0000 2017,8.49677E+17,17,5,"Talked w/ Operating Engineers Local 3, discussed importance of infrastructure investment like #I11 &amp; their work bui… https://t.co/0YKZ226lkF",SenDeanHeller,Dean Heller,Nevada,Republican
100,Wed Apr 05 16:02:06 +0000 2017,8.49653E+17,17,3,Pleasure to meet w/ #NV representatives from @LungAssociation. Inspired by June’s story about being a 4 time cancer… https://t.co/WrYXixorDD,SenDeanHeller,Dean Heller,Nevada,Republican
101,Wed Apr 05 00:40:47 +0000 2017,8.49422E+17,10,1,Great to have @UNevadaReno's School of Community Health Sciences in today. Thanks for coming in! https://t.co/NPfoVrdNyc,SenDeanHeller,Dean Heller,Nevada,Republican
102,Tue Apr 04 21:57:31 +0000 2017,8.4938E+17,14,2,Met w/ #NV’s Dr. Paul Tomasic. We discussed legislation to address diabetes &amp; other initiatives to improve the heal… https://t.co/rdAfuwNpic,SenDeanHeller,Dean Heller,Nevada,Republican
103,Tue Apr 04 21:12:23 +0000 2017,8.49369E+17,17,4,I am working to defend an important #NV public lands program &amp; the economic development it provides for our state: https://t.co/ZLDpVaVVCl,SenDeanHeller,Dean Heller,Nevada,Republican
104,Tue Apr 04 20:02:52 +0000 2017,8.49352E+17,10,7,Discussed the importance of tourism w/ @renotahoe and all #RenoTahoe has to offer as an outdoor destination with ac… https://t.co/E1sW9N0ljS,SenDeanHeller,Dean Heller,Nevada,Republican
105,Tue Apr 04 18:56:55 +0000 2017,8.49335E+17,20,6,"On #EqualPayDay I restate support for a fair workplace, equal pay &amp; my bill to protect employees from discrimination https://t.co/qYCBN9YKSJ",SenDeanHeller,Dean Heller,Nevada,Republican
106,Tue Apr 04 17:24:14 +0000 2017,8.49312E+17,15,2,Met w/ #NV representatives from @SchoolLunch to discuss lunch and breakfast programs as well as healthy eating for… https://t.co/x55LdWMXtE,SenDeanHeller,Dean Heller,Nevada,Republican
107,Tue Apr 04 14:51:35 +0000 2017,8.49273E+17,15,2,We’re excited for the #Raiders move to #LasVegas. If only I can get my hands on a @GoldenKnights banner. https://t.co/IudXjTHAYH,SenDeanHeller,Dean Heller,Nevada,Republican
108,Tue Apr 04 13:05:44 +0000 2017,8.49247E+17,7,3,(2/2) My office remains in close contact w/ the VA &amp; stands ready to assist veterans any way we can. Contact us at https://t.co/C2qgPC4oj9,SenDeanHeller,Dean Heller,Nevada,Republican
109,Tue Apr 04 13:04:13 +0000 2017,8.49246E+17,5,4,"(1/2) Thanks to the many #NV veterans who attended the VA forum in Ely, and thanks to Director Stoval and her staff… https://t.co/fNsCGNmZfp",SenDeanHeller,Dean Heller,Nevada,Republican
110,Mon Apr 03 22:24:13 +0000 2017,8.49025E+17,19,5,Working with Democrats and Republicans to get results for #NV’s veterans. Read more here: https://t.co/YT1TUE2o2S,SenDeanHeller,Dean Heller,Nevada,Republican
111,Mon Apr 03 20:39:03 +0000 2017,8.48998E+17,26,5,I am teaming up w/ @PattyMurray on legislation to strengthen health care access &amp; quality for #NV's women veterans https://t.co/CQ8sZXVKwe,SenDeanHeller,Dean Heller,Nevada,Republican
112,Mon Apr 03 19:21:15 +0000 2017,8.48979E+17,297,76,Here’s why I am voting to #ConfirmGorsuch this week: https://t.co/Dy6LzPlp79,SenDeanHeller,Dean Heller,Nevada,Republican
