,created_at,id_str,reply_count,retweet_count,text,user,name,state,party
0,Sat May 20 23:29:55 +0000 2017,8.66074E+17,10,13,So proud to have @SecretarySonny at the Fischer Ranch today to meet our friends &amp; neighbors #LoveNebraska… https://t.co/eYfdorfTW4,SenatorFischer,Deb Fischer,Nebraska,Republican
1,Sat May 20 16:10:10 +0000 2017,8.65963E+17,6,10,Bruce and I are excited to welcome @SecretarySonny to Cherry County today. Read more in my op-ed in @NorfolkNews: https://t.co/FudrzNSMhZ,SenatorFischer,Deb Fischer,Nebraska,Republican
2,Sat May 20 14:00:04 +0000 2017,8.6593E+17,27,184,Thank you to all those who have served to protect our freedom #ArmedForcesDay #USA https://t.co/8VvzYT05De,SenatorFischer,Deb Fischer,Nebraska,Republican
3,Thu May 18 17:40:33 +0000 2017,8.65261E+17,8,2,Giving the keynote address at the Women's Energy Resource Council Leadership Forum. #WomenLeaders #USEnergy https://t.co/ou0Q7WA3ds,SenatorFischer,Deb Fischer,Nebraska,Republican
4,Wed May 17 21:32:56 +0000 2017,8.64957E+17,4,1,.@UNL students were chosen to participate in #MicrogNExT program &amp; test their simulated microgravity project. More: https://t.co/2zZKV60brt,SenatorFischer,Deb Fischer,Nebraska,Republican
5,Wed May 17 21:24:26 +0000 2017,8.64955E+17,11,14,Joined @SteveDaines @amyklobuchar &amp; @SenBillNelson to intro leg to protect families from online booking scams. More: https://t.co/cuyuT6B1Z8,SenatorFischer,Deb Fischer,Nebraska,Republican
6,Wed May 17 18:03:34 +0000 2017,8.64904E+17,6,2,Weather Watch: Tornado watch has been issued for parts of eastern Nebraska. Tune in to local news for updates and stay safe. #NEweather,SenatorFischer,Deb Fischer,Nebraska,Republican
7,Wed May 17 15:31:04 +0000 2017,8.64866E+17,11,2,A step fwd in cutting wasteful gov’t spending: #HSGAC approved my #StopImproperFederalBonusesAct w @clairemn &amp; @SenDeanHeller,SenatorFischer,Deb Fischer,Nebraska,Republican
8,Wed May 17 14:42:58 +0000 2017,8.64854E+17,5,5,NOW: discussing Nebraska #transportation priorities at @EPWGOP hearing w/ @SecElaineChao https://t.co/QcNfjXnm9j #infrastructureweek,SenatorFischer,Deb Fischer,Nebraska,Republican
9,Wed May 17 13:50:27 +0000 2017,8.64841E+17,8,2,Looking forward to talking w @SecElaineChao about NE #transportation priorities in today’s @EPWGOP hearing. Watch: https://t.co/QcNfjXnm9j,SenatorFischer,Deb Fischer,Nebraska,Republican
10,Wed May 17 13:20:31 +0000 2017,8.64833E+17,6,5,Enjoyed talking with Nebraskans visiting the U.S. Capitol this morning at our weekly Nebraska Breakfast. #Tradition https://t.co/p8dyazjCGB,SenatorFischer,Deb Fischer,Nebraska,Republican
11,Wed May 17 13:14:50 +0000 2017,8.64832E+17,1,6,Praying for my friend @SenThomTillis.,SenatorFischer,Deb Fischer,Nebraska,Republican
12,Tue May 16 20:27:32 +0000 2017,8.64578E+17,1,9,"@maziehirono Wishing my friend from Hawaii @maziehirono strength in the fight against cancer. Mazie, you will win t… https://t.co/QFLYac0l6d",SenatorFischer,Deb Fischer,Nebraska,Republican
13,Tue May 16 17:45:29 +0000 2017,8.64537E+17,9,6,Discussing how we can tackle challenges women face in the workplace at @IWF #WomenLead Summit. #EqualPay #paidleave https://t.co/1c2ANysmqT,SenatorFischer,Deb Fischer,Nebraska,Republican
14,Mon May 15 21:38:44 +0000 2017,8.64234E+17,18,14,.@JeffFlake &amp; I led 16 other senators in a letter to @USTradeRep Lighthizer stressing economic benefits of #NAFTA : https://t.co/O6axNkJman,SenatorFischer,Deb Fischer,Nebraska,Republican
15,Mon May 15 20:42:30 +0000 2017,8.64219E+17,5,1,REMINDER: Tomorrow my staff will hold local office hours in Arthur &amp; Perkins counties. More info here: https://t.co/BDi0O8yQZj,SenatorFischer,Deb Fischer,Nebraska,Republican
16,Mon May 15 19:01:24 +0000 2017,8.64194E+17,3,2,During #PoliceWeek2017 we honor those who risk their own safety every day to keep our families and communities safe… https://t.co/iB0PcSS7sk,SenatorFischer,Deb Fischer,Nebraska,Republican
17,Mon May 15 18:32:57 +0000 2017,8.64187E+17,2,1,"In my column, I address graduates across our state. You’re the pride of NE &amp; I wish you all the best! #ClassOf2017 https://t.co/JyvwvUOcyu",SenatorFischer,Deb Fischer,Nebraska,Republican
18,Sun May 14 14:00:05 +0000 2017,8.63756E+17,19,3,One of the greatest gifts in life is being a mom. To mothers in Nebraska and across the country: Happy #MothersDay! https://t.co/LP6hre3j8n,SenatorFischer,Deb Fischer,Nebraska,Republican
19,Fri May 12 15:50:43 +0000 2017,8.63059E+17,16,3,Bill would improve collection/accuracy of wireless coverage data so more NE families can access the broadband service they need. (2/2),SenatorFischer,Deb Fischer,Nebraska,Republican
20,Fri May 12 15:50:10 +0000 2017,8.63059E+17,6,3,Joined @Sen_JoeManchin @SenatorWicker @SenBrianSchatz to reintro #RuralWirelessAccessAct (1/2) https://t.co/Mw73IfpUDE,SenatorFischer,Deb Fischer,Nebraska,Republican
21,Thu May 11 18:59:05 +0000 2017,8.62744E+17,14,2,"Joined @SenDuckworth @Clairemc to intro #FAMact, which would make life easier for new mothers traveling in airports: https://t.co/vWJYP93qON",SenatorFischer,Deb Fischer,Nebraska,Republican
22,Thu May 11 15:00:02 +0000 2017,8.62684E+17,26,2,"Questioning Gen Clapper, Gen Hayden &amp; Admiral Stavridis on #Cyber policy in SASC. This critical nat’l security issu… https://t.co/kXB1rzmV7j",SenatorFischer,Deb Fischer,Nebraska,Republican
23,Thu May 11 14:33:37 +0000 2017,8.62677E+17,4,1,NOW: Asking questions on #cyber strategy at @SASCMajority hearing. WATCH: https://t.co/mz1zEYJD3Q,SenatorFischer,Deb Fischer,Nebraska,Republican
24,Thu May 11 13:31:53 +0000 2017,8.62662E+17,11,2,On my way to this AM’s @SASCmajority hearing where we will hear testimony on how we can improve U.S. cyber strategy https://t.co/mz1zEYJD3Q,SenatorFischer,Deb Fischer,Nebraska,Republican
25,Wed May 10 23:19:07 +0000 2017,8.62447E+17,47,8,Also underscores importance of Congress continuing work so Americans can access compassionate &amp; affordable health care they deserve 3/3,SenatorFischer,Deb Fischer,Nebraska,Republican
26,Wed May 10 23:16:31 +0000 2017,8.62446E+17,30,10,It’s further proof that Obamacare is simply unsustainable. (2/3),SenatorFischer,Deb Fischer,Nebraska,Republican
27,Wed May 10 23:16:10 +0000 2017,8.62446E+17,28,11,Today’s news on Aetna means fewer choices and likely higher costs for families across Nebraska. (1/3) https://t.co/32syxsKpZ2,SenatorFischer,Deb Fischer,Nebraska,Republican
28,Wed May 10 18:51:11 +0000 2017,8.6238E+17,15,3,REMINDER: My staff will be hosting several local office hours across NE tomorrow. Check out times/locations here: https://t.co/e9LEpYUAyG,SenatorFischer,Deb Fischer,Nebraska,Republican
29,Wed May 10 15:32:41 +0000 2017,8.6233E+17,17,5,Congrats to @KLINradio for winning 11 awards (five in 1st place) in the ’16 Great Plains AP Broadcast Contest. #NEradio #ProudNebraskan,SenatorFischer,Deb Fischer,Nebraska,Republican
30,Tue May 09 18:30:16 +0000 2017,8.62012E+17,12,2,Watch: At 2:30PM I’ll chair @SenateCommerce Surface Transportation subcommittee hearing on Maritime Transportation. https://t.co/zbBaiaArfo,SenatorFischer,Deb Fischer,Nebraska,Republican
31,Tue May 09 16:50:50 +0000 2017,8.61987E+17,2,4,With Kaylee Snowardt &amp; Erin Weidenhamer from Andersen Middle School. These students were named National Oratory Fel… https://t.co/BTlGg0pFA8,SenatorFischer,Deb Fischer,Nebraska,Republican
32,Tue May 09 14:22:04 +0000 2017,8.61949E+17,2,1,NOW: Watch my exchange with Adm. Rogers at today’s @SASCMajority hearing on U.S. #Cyber Command: https://t.co/yED1MivWyf,SenatorFischer,Deb Fischer,Nebraska,Republican
33,Tue May 09 14:03:14 +0000 2017,8.61945E+17,5,1,Congrats to Mary Degraff of Plattsmouth and Ella Alberts of Omaha for being named @PruSpirit top youth volunteers f… https://t.co/TkCiyljf0n,SenatorFischer,Deb Fischer,Nebraska,Republican
34,Tue May 09 13:30:07 +0000 2017,8.61936E+17,1,4,STARTING SOON: @SASCMajority hearing on U.S. Cyber Command with Adm Mike Rogers. WATCH: https://t.co/yED1MivWyf,SenatorFischer,Deb Fischer,Nebraska,Republican
35,Mon May 08 21:39:33 +0000 2017,8.61697E+17,6,7,May is #MilitaryAppreciationMonth. Show gratitude to those who have sacrificed for our freedom #Service… https://t.co/bBLpH2dnAi,SenatorFischer,Deb Fischer,Nebraska,Republican
36,Mon May 08 21:33:35 +0000 2017,8.61696E+17,4,2,I recently joined more than 650 NE vets on the largest #HonorFlight for #VietnamVets to date. Read more in my column https://t.co/C2DcFIQbC0,SenatorFischer,Deb Fischer,Nebraska,Republican
37,Fri May 05 21:37:18 +0000 2017,8.60609E+17,5,5,More about the #PAWSAct &amp; how it would provide relief for #vets with PTSD in this @EnterprisePub editorial: https://t.co/TF90ns4lhq,SenatorFischer,Deb Fischer,Nebraska,Republican
38,Fri May 05 20:13:59 +0000 2017,8.60588E+17,5,2,Great exchange of ideas at my small business roundtable hosted by Nebraska Enterprise Fund in North Omaha today.… https://t.co/LL2wRBRftA,SenatorFischer,Deb Fischer,Nebraska,Republican
39,Fri May 05 16:27:12 +0000 2017,8.60531E+17,9,5,May is Beef Month in Nebraska. #NEBeef #ItsWhatsForDinner #Delicious https://t.co/7Re22C8SvH,SenatorFischer,Deb Fischer,Nebraska,Republican
40,Thu May 04 18:24:39 +0000 2017,8.60199E+17,2,2,My statement on today’s government spending bill vote: https://t.co/iLSPtyxk7q,SenatorFischer,Deb Fischer,Nebraska,Republican
41,Thu May 04 13:29:11 +0000 2017,8.60124E+17,3,5,Headed to @SASCMajority hearing on U.S. Special Operations Command. Tune in live: https://t.co/EYdvoYIzXe,SenatorFischer,Deb Fischer,Nebraska,Republican
42,Thu May 04 13:02:47 +0000 2017,8.60118E+17,11,6,".@mortonOWH in today's @OWHnews: ""Fischer renews effort to provide service dogs for #veterans with PTSD""
https://t.co/zRUsIWWZNO #PAWSAct",SenatorFischer,Deb Fischer,Nebraska,Republican
43,Wed May 03 20:34:06 +0000 2017,8.59869E+17,3,14,"#PAWSAct is a bicameral, bipartisan bill that would help provide #vets w/ support, peace &amp; joy as they confront the invisible scars of war.",SenatorFischer,Deb Fischer,Nebraska,Republican
44,Wed May 03 20:33:42 +0000 2017,8.59869E+17,7,13,"Today @CoryBooker &amp; I reintroduced #PAWSAct, which would increase access to service dogs for vets with PTSD. More:… https://t.co/eAULqHxca7",SenatorFischer,Deb Fischer,Nebraska,Republican
45,Wed May 03 20:30:51 +0000 2017,8.59868E+17,5,10,I was honored to speak about reintroducing bipartisan #PAWSAct today alongside @lyle_cole @k9sforwarriors &amp; House s… https://t.co/o29lKG9XVt,SenatorFischer,Deb Fischer,Nebraska,Republican
46,Wed May 03 19:12:30 +0000 2017,8.59848E+17,0,2,Speaking at press conference on #PAWSAct. Proud to reintroduce this good bill to provide relief to our #vets with P… https://t.co/bkuwjwZfNA,SenatorFischer,Deb Fischer,Nebraska,Republican
47,Wed May 03 15:21:40 +0000 2017,8.5979E+17,5,4,Enjoyed talking to students from @OmaStreetSchool about their trip and my work on the #PAWSAct. It was another succ… https://t.co/VmdnEWLXg0,SenatorFischer,Deb Fischer,Nebraska,Republican
48,Wed May 03 15:10:07 +0000 2017,8.59787E+17,0,2,Asking questions now at @SenateCommerce #broadband hearing. https://t.co/xMs6hKKG9J,SenatorFischer,Deb Fischer,Nebraska,Republican
49,Tue May 02 19:34:52 +0000 2017,8.59491E+17,6,5,TOMORROW @ 3:00 pm ET: Joining @RepDeSantis @lyle_cole &amp; others for press conference on the #PAWSAct More info: https://t.co/h4LGdA4F80,SenatorFischer,Deb Fischer,Nebraska,Republican
50,Mon May 01 21:43:09 +0000 2017,8.59161E+17,7,2,My weekly column talks about the CRAs Congress has passed this year to unleash prosperity for the American people: https://t.co/xck8jY9Ys4,SenatorFischer,Deb Fischer,Nebraska,Republican
51,Mon May 01 19:58:39 +0000 2017,8.59135E+17,2,3,REMINDER: My staff will hold local office hours in Dawson/Lincoln counties tomorrow. Stop by for answers to your ca… https://t.co/qq3XyvpmAg,SenatorFischer,Deb Fischer,Nebraska,Republican
52,Mon May 01 15:44:12 +0000 2017,8.59071E+17,1,6,Check out some photos of the flight from NE to DC &amp; the visit to the Vietnam Wall. #HonorFlight #NEVets… https://t.co/OfDZY0fpOy,SenatorFischer,Deb Fischer,Nebraska,Republican
53,Mon May 01 15:40:24 +0000 2017,8.5907E+17,3,6,It was my honor to fly from NE to DC w/ over 650 NE Vietnam vets this AM. This is the largest #HonorFlight for Vietnam vets to date #Service,SenatorFischer,Deb Fischer,Nebraska,Republican
54,Sun Apr 30 23:31:39 +0000 2017,8.58826E+17,1,5,In La Vista speaking to 652 Nebraska Vietnam vets &amp; their families @ a dinner before tomorrow's #HonorFlight… https://t.co/hdccJ6qOLh,SenatorFischer,Deb Fischer,Nebraska,Republican
55,Fri Apr 28 13:39:17 +0000 2017,8.57952E+17,5,19,Happy Arbor Day! Nebraska is the proud home of this great American tradition. #ArborDay #LoveNebraska https://t.co/Vi63nWPxOu,SenatorFischer,Deb Fischer,Nebraska,Republican
56,Thu Apr 27 22:47:50 +0000 2017,8.57728E+17,5,2,I was honored to welcome Dawson County honor flight veterans to the U.S. Capitol today. #ThankAVet #HonorFlight https://t.co/fQpgM57ad0,SenatorFischer,Deb Fischer,Nebraska,Republican
57,Thu Apr 27 19:35:22 +0000 2017,8.5768E+17,1,3,Tomorrow my staff will hold local office hours in Keith County. Stop by for guidance on your casework Qs… https://t.co/J4EsDOXOvo,SenatorFischer,Deb Fischer,Nebraska,Republican
58,Thu Apr 27 19:15:52 +0000 2017,8.57675E+17,0,6,Are you a high school student interested in attending a service academy? Join my staff on Sat. @BellevueU. Info: https://t.co/HItxRDvRZ3,SenatorFischer,Deb Fischer,Nebraska,Republican
59,Thu Apr 27 15:59:45 +0000 2017,8.57625E+17,2,4,#HBD to my friend @CoryBooker! Thanks for always laughing at my jokes on the dais. #BipartisanBuddies https://t.co/zQbW07KJDl,SenatorFischer,Deb Fischer,Nebraska,Republican
60,Thu Apr 27 14:26:26 +0000 2017,8.57602E+17,1,4,Asking questions now at today's @SASCMajority hearing on @PacificCommand &amp; US Forces in #Korea. Livestream: https://t.co/DNlnKGwIVp,SenatorFischer,Deb Fischer,Nebraska,Republican
61,Thu Apr 27 13:34:28 +0000 2017,8.57589E+17,1,2,Honored to receive @USChamber Spirit of Enterprise Award from members of the @NebraskaChamber. #NEentrepreneurs… https://t.co/PEhv1EYu4C,SenatorFischer,Deb Fischer,Nebraska,Republican
62,Thu Apr 27 13:26:37 +0000 2017,8.57587E+17,1,3,Good read in @theindependent on how #NEvets will benefit from the #ChipInForVets Act with new Omaha VA clinic. https://t.co/DrjlnSJ70y,SenatorFischer,Deb Fischer,Nebraska,Republican
63,Wed Apr 26 22:43:34 +0000 2017,8.57365E+17,1,4,So proud to congratulate @GeringBulldogs students for being one of three national winners in the #SamsungSolve cont… https://t.co/QazX6dxluM,SenatorFischer,Deb Fischer,Nebraska,Republican
64,Wed Apr 26 21:51:12 +0000 2017,8.57351E+17,1,6,Had a wonderful time greeting some @gpbcrescentmoon sisters. I have many great memories from my time in… https://t.co/IIsvla5aBi,SenatorFischer,Deb Fischer,Nebraska,Republican
65,Wed Apr 26 19:49:42 +0000 2017,8.57321E+17,2,2,"At today’s @EPWGOP hearing, witnesses cast doubt on the legality of #WOTUS. Watch: https://t.co/KpSNK0W9dy",SenatorFischer,Deb Fischer,Nebraska,Republican
66,Wed Apr 26 18:39:42 +0000 2017,8.57303E+17,0,10,Today I met w @GeringBulldogs students who were chosen as one of 10 national finalists for their innovative… https://t.co/B3wfIsSYnR,SenatorFischer,Deb Fischer,Nebraska,Republican
67,Wed Apr 26 15:05:16 +0000 2017,8.57249E+17,1,2,"With rock-star Bailee of Lincoln, a @PoetryOutLoud national finalist who was chosen out of 310K competitors.… https://t.co/MITmQPzDf0",SenatorFischer,Deb Fischer,Nebraska,Republican
68,Wed Apr 26 14:31:03 +0000 2017,8.57241E+17,4,3,"Wednesday mornings at the #NEBreakfast are the best. If you’re visiting Capitol Hill, stop by &amp; say hello. https://t.co/4HcnNixT1a",SenatorFischer,Deb Fischer,Nebraska,Republican
69,Tue Apr 25 19:55:00 +0000 2017,8.5696E+17,1,1,Tomorrow my staff will hold office hours in Cheyenne and Deuel counties. Please stop by if you have any Q’s regardi… https://t.co/zBVbwvTaKt,SenatorFischer,Deb Fischer,Nebraska,Republican
70,Tue Apr 25 18:24:53 +0000 2017,8.56937E+17,0,2,Bill Bailey is a true Nebraska hero. I am honored to tell his story. #NEHeroes #ProudNebraskan,SenatorFischer,Deb Fischer,Nebraska,Republican
71,Tue Apr 25 18:24:27 +0000 2017,8.56937E+17,0,2,"Bill was a wonderful husband, brother, son, father. He dedicated quite a bit of his life to helping other people. #NEHeroes",SenatorFischer,Deb Fischer,Nebraska,Republican
72,Tue Apr 25 18:24:02 +0000 2017,8.56937E+17,0,1,"Specialist Bailey earned several military awards including the Purple Heart, Bronze Star, Iraqi Campaign Medal &amp; Combat Action Badge. #Honor",SenatorFischer,Deb Fischer,Nebraska,Republican
73,Tue Apr 25 18:23:44 +0000 2017,8.56937E+17,0,1,More than one thousand people gathered in Bellevue to remember Bill. #NEHeroes,SenatorFischer,Deb Fischer,Nebraska,Republican
74,Tue Apr 25 18:23:22 +0000 2017,8.56937E+17,0,1,"On May 25, 2007, during a security escort mission, Bill’s vehicle struck an improvised explosive device. Bill Bailey was killed. #NEHeroes",SenatorFischer,Deb Fischer,Nebraska,Republican
75,Tue Apr 25 18:22:16 +0000 2017,8.56936E+17,0,1,"By 2007, the insurgency in Iraq had erupted to new levels of violence. Increased American forces sought to destroy the al Qaeda network.",SenatorFischer,Deb Fischer,Nebraska,Republican
76,Tue Apr 25 18:21:54 +0000 2017,8.56936E+17,0,1,"In 2006, his unit was deployed and assigned to provide security escorts for truck convoys operating out of Balad Air Base in #Iraq.",SenatorFischer,Deb Fischer,Nebraska,Republican
77,Tue Apr 25 18:21:19 +0000 2017,8.56936E+17,0,1,"That deep desire to serve the country continued to tug at him. In 2005, Bill re-enlisted in the @NENationalGuard #Courage",SenatorFischer,Deb Fischer,Nebraska,Republican
78,Tue Apr 25 18:20:50 +0000 2017,8.56936E+17,0,1,Bill’s protective nature made him a great father. It also made him a great firefighter. #NeHeroes,SenatorFischer,Deb Fischer,Nebraska,Republican
79,Tue Apr 25 18:20:23 +0000 2017,8.56936E+17,0,1,"After 9/11, Bill felt the call to serve his country again. But, first things first. Bill and Dee married in 2004.",SenatorFischer,Deb Fischer,Nebraska,Republican
80,Tue Apr 25 18:20:01 +0000 2017,8.56936E+17,0,1,"In December 2000, Bill met Dee. She was a bank teller at Wells Fargo; he drove an armored truck. They met through a service window.",SenatorFischer,Deb Fischer,Nebraska,Republican
81,Tue Apr 25 18:19:38 +0000 2017,8.56936E+17,0,1,Bill attended Bellevue East where the call to protect his country prompted him to enlist in the @NENationalGuard in 1995.,SenatorFischer,Deb Fischer,Nebraska,Republican
82,Tue Apr 25 18:17:02 +0000 2017,8.56935E+17,1,1,NOW: Headed to the #SenateFloor to honor the life of Specialist Bill Bailey of Bellevue. #NEHeroes Watch: https://t.co/xXeEzY478o,SenatorFischer,Deb Fischer,Nebraska,Republican
83,Tue Apr 25 18:16:48 +0000 2017,8.56935E+17,1,3,I’m continuing to pay tribute on the #Senate floor to #NEHeroes who gave their lives in Afghanistan &amp; Iraq #Service,SenatorFischer,Deb Fischer,Nebraska,Republican
84,Mon Apr 24 22:38:17 +0000 2017,8.56638E+17,0,11,Joining @amyklobuchar &amp; @Gardner_LM for a bipartisan discussion on #infrastructure. #strongcommunities… https://t.co/UFFAjPabDd,SenatorFischer,Deb Fischer,Nebraska,Republican
85,Mon Apr 24 22:10:04 +0000 2017,8.56631E+17,6,10,"Congratulations, Secretary Perdue. #AGsec https://t.co/6k5XJ6SgEy",SenatorFischer,Deb Fischer,Nebraska,Republican
86,Mon Apr 24 21:43:20 +0000 2017,8.56625E+17,3,2,Good meeting w/ @americanmothers &amp; their little mascot today. We talked about their work to combat human traffickin… https://t.co/rcCZ9hsl2C,SenatorFischer,Deb Fischer,Nebraska,Republican
87,Mon Apr 24 19:40:53 +0000 2017,8.56594E+17,1,1,Want to know what I’ve been up to? Read my new column about my time #OnTheRoad in #NE: https://t.co/YpEhBhayF9,SenatorFischer,Deb Fischer,Nebraska,Republican
88,Mon Apr 24 19:35:25 +0000 2017,8.56592E+17,5,9,"""What is done cannot be undone, but at least you can stop it from happening again."" - Anne Frank #NeverAgain… https://t.co/kposMLC1Lr",SenatorFischer,Deb Fischer,Nebraska,Republican
89,Mon Apr 24 19:28:40 +0000 2017,8.56591E+17,1,3,#StrongFamiliesAct is a #PaidLeave bill that can pass &amp; provide relief to families juggling daily responsibilities https://t.co/rKLUXfFcn0,SenatorFischer,Deb Fischer,Nebraska,Republican
90,Mon Apr 24 19:27:46 +0000 2017,8.56591E+17,2,4,.@pewresearch found 87% of Americans want a #paidleave solution like my #StrongFamiliesAct https://t.co/81N56PI6ZI https://t.co/JgFPcesec0,SenatorFischer,Deb Fischer,Nebraska,Republican
91,Mon Apr 24 19:27:09 +0000 2017,8.5659E+17,1,5,Analysis of @pewresearch study notes most Americans are “extremely supportive” of my #StrongFamiliesAct with … https://t.co/6vfkbrYozH,SenatorFischer,Deb Fischer,Nebraska,Republican
92,Mon Apr 24 19:25:04 +0000 2017,8.5659E+17,0,1,Excited to share this positive feedback about my #PaidLeave #StrongFamiliesAct from @pewresearch study analysis https://t.co/8dJXvlUD2J,SenatorFischer,Deb Fischer,Nebraska,Republican
93,Thu Apr 20 16:21:27 +0000 2017,8.55094E+17,5,7,.@DanielPMalloy with @ozy covers my efforts to make life easier for families: https://t.co/5PvwPA0jUW #EqualPay #PaidLeave,SenatorFischer,Deb Fischer,Nebraska,Republican
94,Wed Apr 19 19:32:48 +0000 2017,8.5478E+17,3,3,Honored to speak at the inaugural ceremony for the Lancaster County Veterans Court this afternoon in Lincoln.… https://t.co/Y5J0LvSG01,SenatorFischer,Deb Fischer,Nebraska,Republican
95,Tue Apr 18 19:44:40 +0000 2017,8.5442E+17,6,3,Thanks to the folks at the Sarpy County Chamber for letting me attend today's lunch and give an update on my work i… https://t.co/bJujWBWIin,SenatorFischer,Deb Fischer,Nebraska,Republican
96,Tue Apr 18 17:25:03 +0000 2017,8.54385E+17,7,4,Speaking today with members of the @SarpyCounty Chamber. I gave an update on legislative business in the U.S. Senat… https://t.co/EWYTBPpZaZ,SenatorFischer,Deb Fischer,Nebraska,Republican
97,Sun Apr 16 13:30:01 +0000 2017,8.53601E+17,4,8,#HappyEaster https://t.co/ijke5Vm2om,SenatorFischer,Deb Fischer,Nebraska,Republican
98,Sat Apr 15 19:13:53 +0000 2017,8.53326E+17,4,4,Proud to take part in a welcome home ceremony for members of the G-Company in #LNK today. #ProudNebraskan https://t.co/QFCio2G27h,SenatorFischer,Deb Fischer,Nebraska,Republican
99,Sat Apr 15 14:00:03 +0000 2017,8.53247E+17,3,10,#GBR https://t.co/OTEMsjgyya,SenatorFischer,Deb Fischer,Nebraska,Republican
100,Fri Apr 14 20:00:29 +0000 2017,8.52975E+17,12,9,Terrible news of Nebraskans being struck by a truck outside of LNK Planned Parenthood. My prayers are w all those impacted.,SenatorFischer,Deb Fischer,Nebraska,Republican
101,Fri Apr 14 18:45:29 +0000 2017,8.52956E+17,0,3,I was honored to speak at today's @NENationalGuard departure ceremony for the 641st in LNK. #ProudNebraskan https://t.co/Jx9HcThrnW,SenatorFischer,Deb Fischer,Nebraska,Republican
102,Fri Apr 14 13:26:59 +0000 2017,8.52876E+17,9,4,Privileged to join the 52nd Annual Greater Omaha Leadership Prayer Breakfast to share a scripture passage this morn… https://t.co/verIz5KqaF,SenatorFischer,Deb Fischer,Nebraska,Republican
103,Wed Apr 12 19:53:29 +0000 2017,8.52248E+17,5,6,Great time eating lunch w the Lincoln firefighters. Thanks to @IAFFLocal644 for hosting my mom and me today! https://t.co/70su2ZMsOu,SenatorFischer,Deb Fischer,Nebraska,Republican
104,Wed Apr 12 15:18:23 +0000 2017,8.52179E+17,3,6,More on my work w/ @AmyKlobuchar &amp; 54 other sens. in @theHill: “Senators press FCC on rural broadband affordability” https://t.co/64K4wA4q8K,SenatorFischer,Deb Fischer,Nebraska,Republican
105,Tue Apr 11 20:58:10 +0000 2017,8.51902E+17,2,1,"In Beatrice, leading economic development roundtable. Productive conversation on ways to build stronger &amp; more pros… https://t.co/BWYzPvpeVU",SenatorFischer,Deb Fischer,Nebraska,Republican
106,Tue Apr 11 20:29:27 +0000 2017,8.51895E+17,2,9,Happy #NationalPetDay from Fred Fischer. #FunWithFred https://t.co/tILySNYghH,SenatorFischer,Deb Fischer,Nebraska,Republican
107,Tue Apr 11 20:26:26 +0000 2017,8.51894E+17,7,4,Led bipartisan letter w @amyklobuchar &amp; 54 senators urging @FCC to continue advancing broadband in rural areas More: https://t.co/0EmMsfXa6Q,SenatorFischer,Deb Fischer,Nebraska,Republican
108,Tue Apr 11 17:53:43 +0000 2017,8.51856E+17,9,5,Loved stopping by @Runza in Beatrice for lunch and visiting with their wonderful team! #Delicious #NEtradition https://t.co/byTj0wEny7,SenatorFischer,Deb Fischer,Nebraska,Republican
109,Tue Apr 11 15:07:10 +0000 2017,8.51814E+17,6,2,Kicking off a great day in NE with an Economic Development Roundtable in Plattsmouth. #Jobs #OnTheRoadinNE https://t.co/WEvFOU1Y78,SenatorFischer,Deb Fischer,Nebraska,Republican
110,Tue Apr 11 01:44:52 +0000 2017,8.51612E+17,5,1,Wishing my friends and neighbors across Nebraska a joyous Passover celebration.,SenatorFischer,Deb Fischer,Nebraska,Republican
111,Mon Apr 10 18:45:17 +0000 2017,8.51506E+17,37,9,I was proud to support Justice Gorsuch and I think he will do an exceptional job for the American people. My column: https://t.co/Dj81zuP4qr,SenatorFischer,Deb Fischer,Nebraska,Republican
112,Mon Apr 10 15:18:40 +0000 2017,8.51454E+17,64,69,"Congratulations, Justice Neil Gorsuch #SCOTUS https://t.co/po4InTkBlq",SenatorFischer,Deb Fischer,Nebraska,Republican
113,Mon Apr 10 13:56:10 +0000 2017,8.51434E+17,2,4,"Congrats to Robert Carper of Blue Hill, NE on his gold/silver medals in cross-country skiing at the @SpecialOlympics https://t.co/6icU9lSRqX",SenatorFischer,Deb Fischer,Nebraska,Republican
