,created_at,id_str,reply_count,retweet_count,text,user,name,state,party
687,Mon Jun 27 22:23:25 +0000 2016,7.47556E+17,0,4,"The Senate voted 90-0 to confirm Bob Rossiter to serve as a federal judge for Nebraska. #WorkingForNebraska
https://t.co/s3W25jmFsC",SenatorFischer,Deb Fischer,Nebraska,Republican
688,Mon Jun 27 22:20:49 +0000 2016,7.47555E+17,3,4,"Rossiter will serve Nebraska with integrity, professionalism, and dedication to the rule of law.
https://t.co/gv2JGBdgil",SenatorFischer,Deb Fischer,Nebraska,Republican
689,Mon Jun 27 22:17:53 +0000 2016,7.47555E+17,2,3,"Thrilled that the Senate has voted to confirm a new federal judge for Nebraska. Congratulations, Bob Rossiter. #ProudNebraskan",SenatorFischer,Deb Fischer,Nebraska,Republican
690,Mon Jun 27 21:29:21 +0000 2016,7.47542E+17,1,3,Senate will soon vote on nomination of Bob Rossiter to serve on NE’s federal district court. #WorkingforNebraska,SenatorFischer,Deb Fischer,Nebraska,Republican
691,Mon Jun 27 20:44:39 +0000 2016,7.47531E+17,1,2,NOW: I’m speaking live on #SenateFloor in support of Bob Rossiter’s nomination to the federal bench in NE. Watch: https://t.co/4rQuH9Qcwu,SenatorFischer,Deb Fischer,Nebraska,Republican
692,Mon Jun 27 17:29:14 +0000 2016,7.47482E+17,6,4,NE state law prohibiting abortions after 20 weeks is good policy &amp; supported by both sides. It should be adopted at the federal level.,SenatorFischer,Deb Fischer,Nebraska,Republican
693,Mon Jun 27 17:28:35 +0000 2016,7.47482E+17,0,6,"SCOTUS decision today in Texas #HB2 case is disappointing. We need common-sense, pro-life policies that show compassion for women &amp; unborn",SenatorFischer,Deb Fischer,Nebraska,Republican
694,Sun Jun 26 19:19:18 +0000 2016,7.47147E+17,0,3,REMINDER: Tomorrow (6/27) my staff will hold Mobile Office Hours in Cedar and Dixon counties. More info here: https://t.co/rBkwCVj5vR,SenatorFischer,Deb Fischer,Nebraska,Republican
695,Thu Jun 23 16:51:50 +0000 2016,7.46023E+17,10,14,"Pleased to see Pres Obama’s executive amnesty plan blocked today. We are a nation of laws. POTUS needs to work with, not around, Congress.",SenatorFischer,Deb Fischer,Nebraska,Republican
696,Wed Jun 22 20:18:36 +0000 2016,7.45713E+17,1,6,Thanks to fellow #LNK Southeast HS alum Emily Johnson for stopping by during her @WorkshopsWire seminar #Knights https://t.co/fHHwXALt6A,SenatorFischer,Deb Fischer,Nebraska,Republican
697,Wed Jun 22 16:37:30 +0000 2016,7.45657E+17,0,5,.@POTUS has signed the #PIPESact into law. H/T to @CoryBooker @SteveDaines &amp; @SenGaryPeters for the great teamwork #BackToWork,SenatorFischer,Deb Fischer,Nebraska,Republican
698,Wed Jun 22 15:27:24 +0000 2016,7.45639E+17,1,4,"I’ve cosponsored the #ACEKidsAct, which would create networks to care for children w medical complexities like Emery https://t.co/GWIdEPD2Jz",SenatorFischer,Deb Fischer,Nebraska,Republican
699,Wed Jun 22 14:44:11 +0000 2016,7.45628E+17,0,1,Hugs from @ChildrensOmaha advocate Emory of #LNK. Loved her performance of “Let’s Go Fly A Kite!” @ the NE Bfast https://t.co/bV36KmJFEc,SenatorFischer,Deb Fischer,Nebraska,Republican
700,Tue Jun 21 21:12:25 +0000 2016,7.45364E+17,1,1,Throwing it back to my visit with Adams Central students for #NationalSelfieDay https://t.co/Yh2F7RWcNJ,SenatorFischer,Deb Fischer,Nebraska,Republican
701,Tue Jun 21 20:48:03 +0000 2016,7.45358E+17,1,6,"Congratulations to Brent Miller of Lyons, NE. Brent is Nebraska’s 2016 Presidential Scholar. #ProudNebraskan https://t.co/Ms0qdaDQWh",SenatorFischer,Deb Fischer,Nebraska,Republican
702,Tue Jun 21 13:34:32 +0000 2016,7.45249E+17,3,2,"I’ll be at a @SenateCommerce hearing on the status of the public safety broadband network, @FirstNetGov. Tune in: https://t.co/hC8MHSTwJF",SenatorFischer,Deb Fischer,Nebraska,Republican
703,Sun Jun 19 14:05:12 +0000 2016,7.44531E+17,2,3,"A good man. A wonderful father. My dad is always with me, in my heart. https://t.co/15oCfz3h97",SenatorFischer,Deb Fischer,Nebraska,Republican
704,Sat Jun 18 15:54:28 +0000 2016,7.44197E+17,1,2,Honored to speak at the @DAVHQ convention today in Kearney. #ProudNebraskan https://t.co/ciZcnHhmyZ,SenatorFischer,Deb Fischer,Nebraska,Republican
705,Sat Jun 18 14:00:47 +0000 2016,7.44168E+17,0,5,It’s that time of year again! Who’s ready for opening day? #CollegeWorldSeries #RoadToOmaha https://t.co/YqzpzH8bPf,SenatorFischer,Deb Fischer,Nebraska,Republican
706,Fri Jun 17 19:25:51 +0000 2016,7.43887E+17,1,8,Awesome visit to Ames Fire Station # 21 in Omaha today. Thx for all you do to keep Omaha safe.  #ProudNebraskan https://t.co/yqZTviTb3F,SenatorFischer,Deb Fischer,Nebraska,Republican
707,Fri Jun 17 13:28:48 +0000 2016,7.43798E+17,2,6,.@OWHnews: Fischer calls for cutting DOJ funding unless it issues plan on state-level pot legalization. Full story: https://t.co/hwYVK3P1V3,SenatorFischer,Deb Fischer,Nebraska,Republican
708,Thu Jun 16 21:17:16 +0000 2016,7.43553E+17,8,3,We must unite to ensure ISIL’s lasting defeat. Watch my full floor speech on the Orlando terrorist attack: https://t.co/EvDVqR5IC1,SenatorFischer,Deb Fischer,Nebraska,Republican
709,Thu Jun 16 20:42:40 +0000 2016,7.43544E+17,2,4,Lovely mtg @NebraskaFFA member Taylor Nielsen of Waverly. She is attending a FFA leadership conference #bluejackets https://t.co/wPRHQrs7el,SenatorFischer,Deb Fischer,Nebraska,Republican
710,Thu Jun 16 19:52:43 +0000 2016,7.43532E+17,3,1,Headed to the #Senate floor to deliver remarks on the #Orlando terrorist attack. Tune in: https://t.co/v5qiAiEQnj,SenatorFischer,Deb Fischer,Nebraska,Republican
711,Thu Jun 16 13:43:00 +0000 2016,7.43439E+17,1,1,.@SASCMajority hearing @ 9:45 am ET on the nomination of Gen David Goldfein to be @usairforce Chief of Staff  Watch: https://t.co/Tmo66hVlKm,SenatorFischer,Deb Fischer,Nebraska,Republican
712,Wed Jun 15 20:42:00 +0000 2016,7.43182E+17,3,28,"My deepest condolences to the Graves family of Elkhorn, Nebraska. Our prayers are with you and my office stands ready  to help in any way.",SenatorFischer,Deb Fischer,Nebraska,Republican
713,Wed Jun 15 20:22:04 +0000 2016,7.43177E+17,2,2,The latest from @MortonOWH in @OWHNews: Air Force finalizes plans to upgrade Offutt runway. https://t.co/sx8i3yMSr4,SenatorFischer,Deb Fischer,Nebraska,Republican
714,Wed Jun 15 20:16:18 +0000 2016,7.43175E+17,2,3,"Great news for Offutt, our military, &amp; Nebraska. @USAirForce finalizes plan to upgrade Offutt runway. Read more: https://t.co/a03kXlwkLo",SenatorFischer,Deb Fischer,Nebraska,Republican
715,Wed Jun 15 16:20:17 +0000 2016,7.43116E+17,3,4,"Currently, Nebraska hosts more than 3,300 miles of railroads. @UnionPacific @BNSF #economicimpact",SenatorFischer,Deb Fischer,Nebraska,Republican
716,Wed Jun 15 16:19:31 +0000 2016,7.43116E+17,2,7,"According to report by researchers at Towson University, class I freight railroads generated $274 billion of economic activity in 2014.",SenatorFischer,Deb Fischer,Nebraska,Republican
717,Wed Jun 15 16:19:09 +0000 2016,7.43116E+17,0,8,Speaking at a @AAR_FreightRail briefing on importance of freight railroads to the nation’s economy. #economicimpact https://t.co/kBz7HDPa9p,SenatorFischer,Deb Fischer,Nebraska,Republican
718,Wed Jun 15 14:20:40 +0000 2016,7.43086E+17,1,7,Joined @RepAdrianSmith in welcoming @Nebraska4H groups from Custer &amp; York/Polk counties to Capitol Hill #TrueLeaders https://t.co/Y5WeY9OFqk,SenatorFischer,Deb Fischer,Nebraska,Republican
719,Wed Jun 15 14:19:05 +0000 2016,7.43085E+17,0,1,Big crowd at the #NebraskaBreakfast this morning! Great time visiting with folks. https://t.co/FoBDnAsVAJ,SenatorFischer,Deb Fischer,Nebraska,Republican
720,Wed Jun 15 13:20:35 +0000 2016,7.43071E+17,0,12,Praying for the safe return of young Nebraskan in #DisneyWorld. My office is monitoring the situation &amp; ready to provide any assistance.,SenatorFischer,Deb Fischer,Nebraska,Republican
721,Tue Jun 14 19:40:56 +0000 2016,7.42804E+17,3,2,It was a pleasure visiting with the Wolfe family of Elkhorn today. https://t.co/I2ev3xcpHP,SenatorFischer,Deb Fischer,Nebraska,Republican
722,Tue Jun 14 18:19:33 +0000 2016,7.42784E+17,0,2,Good to see the Beels from Johnstown in the #Senate today. Hope you enjoyed your Capitol tour! https://t.co/zPIhQuSsJk,SenatorFischer,Deb Fischer,Nebraska,Republican
723,Tue Jun 14 14:16:05 +0000 2016,7.42722E+17,0,15,"The Stars and Stripes are a powerful symbol of freedom, here at home and around the world. Happy #FlagDay. https://t.co/e2x5vORJBD",SenatorFischer,Deb Fischer,Nebraska,Republican
724,Tue Jun 14 13:07:59 +0000 2016,7.42705E+17,1,4,"Nice read. @OWHNews editorial on #FlagDay: ""Our flag has had powerful meanings over the generations, here &amp; abroad."" https://t.co/zpqRnt3wvM",SenatorFischer,Deb Fischer,Nebraska,Republican
725,Mon Jun 13 22:51:35 +0000 2016,7.4249E+17,2,1,The #PIPESAct will offer states better tools to address incidents like the #Omaha Old Market explosion this past January.,SenatorFischer,Deb Fischer,Nebraska,Republican
726,Mon Jun 13 22:50:59 +0000 2016,7.42489E+17,0,3,#PIPESAct will create a safer pipeline network across our country. It is a major bipartisan achievement. https://t.co/B4kiZsxtie,SenatorFischer,Deb Fischer,Nebraska,Republican
727,Mon Jun 13 22:50:34 +0000 2016,7.42489E+17,0,6,Proud to work on bipartisan #PIPESAct with @CoryBooker @SteveDaines @SenGaryPeters @SenJohnThune @SenatorBoxer @SenFeinstein,SenatorFischer,Deb Fischer,Nebraska,Republican
728,Mon Jun 13 22:50:18 +0000 2016,7.42489E+17,0,3,Senate has passed #PIPESAct. Bill now heads to @POTUS’s desk.,SenatorFischer,Deb Fischer,Nebraska,Republican
729,Sun Jun 12 15:24:49 +0000 2016,7.42015E+17,50,12,Bruce and I send our heartfelt condolences to the victims and families affected by the Orlando shooting.,SenatorFischer,Deb Fischer,Nebraska,Republican
730,Fri Jun 10 18:36:29 +0000 2016,7.41338E+17,1,1,#BestStaffEver https://t.co/AcpMsQVv01,SenatorFischer,Deb Fischer,Nebraska,Republican
731,Thu Jun 09 19:42:46 +0000 2016,7.40993E+17,0,2,Kicking off our conversation on women in the #Senate w/ @amyklobuchar moderated by @mollyesque. #AtlanticWOW https://t.co/lDdSHr5Ne3,SenatorFischer,Deb Fischer,Nebraska,Republican
732,Thu Jun 09 18:08:05 +0000 2016,7.40969E+17,2,6,Loved visiting w/ these young aggies from Wisner-Pilger during their @NebraskaFFA trip to the Senate. #Ag https://t.co/KXaZKrp5HE,SenatorFischer,Deb Fischer,Nebraska,Republican
733,Thu Jun 09 17:42:30 +0000 2016,7.40962E+17,1,1,"At today’s @EPWmaj hearing, I highlighted how the #CleanPowerPlan will raise costs for NE families. Watch video: https://t.co/WKBIDpZ489",SenatorFischer,Deb Fischer,Nebraska,Republican
734,Thu Jun 09 14:31:40 +0000 2016,7.40914E+17,1,2,Great op-ed by @RepAdrianSmith in @TheHill on #biotechnology. Read it here: https://t.co/mD04nC13Vj #NEAg #FeedtheWorld,SenatorFischer,Deb Fischer,Nebraska,Republican
735,Thu Jun 09 14:27:57 +0000 2016,7.40913E+17,0,1,Asking questions now at @EPWmaj hearing on #CleanPowerPlan. Watch: https://t.co/VtYRxS0uiQ,SenatorFischer,Deb Fischer,Nebraska,Republican
736,Thu Jun 09 13:30:57 +0000 2016,7.40899E+17,0,9,"Headed to @EPWMaj hearing on #CleanPowerPlan. Look fwd to hearing testimony from Mike McInnes, CEO of @TriStateGT.  https://t.co/VtYRxS0uiQ",SenatorFischer,Deb Fischer,Nebraska,Republican
737,Wed Jun 08 18:16:58 +0000 2016,7.40609E+17,1,1,Looking forward to this afternoon’s @SenateCommerce hearing with @SecretaryFoxx. Tune in here: https://t.co/gNdfJnCgwS #FASTact,SenatorFischer,Deb Fischer,Nebraska,Republican
738,Wed Jun 08 16:08:11 +0000 2016,7.40576E+17,0,3,Welcoming Dr. Deepak Gangahar of Lincoln as my guest for today’s address by PM @NarendraModi’s to Congress. https://t.co/0cc1MKG4gz,SenatorFischer,Deb Fischer,Nebraska,Republican
739,Wed Jun 08 15:02:08 +0000 2016,7.4056E+17,2,5,This morning I chatted with students from York &amp; Fillmore high schools during their @CloseUp_DC trip. #YoungLeaders https://t.co/I6jejFkFSi,SenatorFischer,Deb Fischer,Nebraska,Republican
740,Wed Jun 08 14:21:46 +0000 2016,7.40549E+17,0,4,Thanks to friends from @NECattlemen for stopping by the #NebraskaBreakfast this morning 👍🏼 https://t.co/QEZxYw7mNh,SenatorFischer,Deb Fischer,Nebraska,Republican
741,Tue Jun 07 22:59:39 +0000 2016,7.40317E+17,0,3,Need assistance navigating federal gov’t hurdles? Check below to see if my staff will be in your area this week. https://t.co/Ek61Y8DYQ3,SenatorFischer,Deb Fischer,Nebraska,Republican
742,Tue Jun 07 20:09:52 +0000 2016,7.40275E+17,1,14,Surprise visit from @CoryBooker while mtg w/ students from Waverly &amp; Adams Central middle schools! #BipartisanSelfie https://t.co/vMBVRWAhpT,SenatorFischer,Deb Fischer,Nebraska,Republican
743,Tue Jun 07 15:51:15 +0000 2016,7.4021E+17,6,3,Enjoyed meeting Hastings native &amp; @BorenAwards scholarship recipient Suzette Escamilla Morales today #ProudNebraskan https://t.co/mBwLBFc1bO,SenatorFischer,Deb Fischer,Nebraska,Republican
744,Mon Jun 06 20:45:56 +0000 2016,7.39921E+17,1,2,Our nation is forever grateful for their service. 🇺🇸 #NEHonorFlight https://t.co/Qtfk8BwiKh,SenatorFischer,Deb Fischer,Nebraska,Republican
745,Mon Jun 06 20:43:42 +0000 2016,7.39921E+17,1,1,These heroes shared their stories &amp; determination to honor those who made the ultimate sacrifice. #NEHonorFlight https://t.co/nRhfHJTSIJ,SenatorFischer,Deb Fischer,Nebraska,Republican
746,Mon Jun 06 20:42:35 +0000 2016,7.3992E+17,1,13,I was honored to welcome more than 500 Vietnam #vets from Nebraska to our nation’s capital today. #NEHonorFlight https://t.co/sPAajdNl6p,SenatorFischer,Deb Fischer,Nebraska,Republican
747,Mon Jun 06 18:23:15 +0000 2016,7.39885E+17,1,11,"72 years ago today, American heroes stormed the beaches of Normandy to liberate a continent. #DDay https://t.co/qStZvb63QQ",SenatorFischer,Deb Fischer,Nebraska,Republican
748,Fri Jun 03 19:48:45 +0000 2016,7.3882E+17,1,1,Honored to thank them on behalf of all Nebraskans for their service and sacrifice to this country. #SupportOurTroops https://t.co/ULz2z8n4yJ,SenatorFischer,Deb Fischer,Nebraska,Republican
749,Fri Jun 03 13:07:18 +0000 2016,7.38719E+17,0,3,Good recap of my York #CommunityCoffee yesterday in the @yorknewstimes. Read it here: https://t.co/noR9eTr5z4 #HearingFromYou,SenatorFischer,Deb Fischer,Nebraska,Republican
750,Thu Jun 02 17:29:05 +0000 2016,7.38422E+17,1,2,Giving an update on my work in the #Senate today during my Community Coffee in York. #OnTheRoad https://t.co/js07LanNMu,SenatorFischer,Deb Fischer,Nebraska,Republican
751,Wed Jun 01 17:00:32 +0000 2016,7.38053E+17,2,7,"Touring @McBattasPP in Fairbury, a proud manufacturer of American flags. #RedWhiteandBlue #AmericanMade 🇺🇸 https://t.co/VOxKQtkt9C",SenatorFischer,Deb Fischer,Nebraska,Republican
752,Wed Jun 01 15:43:07 +0000 2016,7.38033E+17,0,2,Talking with great folks from Fairbury at this morning’s Community Coffee #LoveNebraska #HearingFromYou https://t.co/dQOGTmOXFS,SenatorFischer,Deb Fischer,Nebraska,Republican
753,Tue May 31 21:33:15 +0000 2016,7.37759E+17,0,3,Visiting with Nebraskans in Falls City at my Community Coffee. #LoveNebraska #OnTheRoad https://t.co/Snd0cXHCmk,SenatorFischer,Deb Fischer,Nebraska,Republican
754,Tue May 31 19:55:28 +0000 2016,7.37734E+17,0,1,Special thanks to baby Luke for coming to my Community Coffee in Auburn today. #FutureLeader https://t.co/qusBxOb7a4,SenatorFischer,Deb Fischer,Nebraska,Republican
755,Tue May 31 19:36:38 +0000 2016,7.3773E+17,0,2,Good conversations at my Auburn #CommunityCoffee today. Thx to all who came by! https://t.co/9UqrVM44rh,SenatorFischer,Deb Fischer,Nebraska,Republican
756,Tue May 31 19:13:55 +0000 2016,7.37724E+17,0,3,Fun stop by at Chocolate Dreams &amp; Sweet Things in Nebraska City. #Cupcakes https://t.co/JV0muzEf3N,SenatorFischer,Deb Fischer,Nebraska,Republican
757,Tue May 31 16:03:55 +0000 2016,7.37676E+17,0,2,Great time touring @Sysco’s business resource facility in #LNK this AM #OnTheRoad #LoveNE https://t.co/AzAGtJLJqJ,SenatorFischer,Deb Fischer,Nebraska,Republican
758,Mon May 30 17:08:48 +0000 2016,7.3733E+17,3,5,Remembering brave Americans who made the ultimate sacrifice with Nebraskans at Forest Lawn Cemetery. #MemorialDay https://t.co/ujLX8LKFbw,SenatorFischer,Deb Fischer,Nebraska,Republican
759,Mon May 30 13:00:12 +0000 2016,7.37267E+17,2,11,"All gave some, some gave all. Thank a veteran today. #MemorialDay https://t.co/InVN7Qsbox",SenatorFischer,Deb Fischer,Nebraska,Republican
760,Fri May 27 13:46:40 +0000 2016,7.36192E+17,0,2,Honored to pay tribute to #Scottsbluff native Marine Corporal Adrian Robles. Read today’s @sbstarherald article https://t.co/MsIikiRvom,SenatorFischer,Deb Fischer,Nebraska,Republican
761,Fri May 27 00:58:01 +0000 2016,7.35998E+17,0,5,#Tornado warning issued for McCook. Make sure to take precautions &amp; follow your local weather.,SenatorFischer,Deb Fischer,Nebraska,Republican
762,Thu May 26 21:32:08 +0000 2016,7.35947E+17,1,7,"Today, I honored the life of Marine Corporal Adrian Robles of Scottsbluff, Nebraska. #SemperFi. https://t.co/SOZ9WJsiQ0",SenatorFischer,Deb Fischer,Nebraska,Republican
763,Thu May 26 20:58:14 +0000 2016,7.35938E+17,0,1,Also reports of #tornado warnings for Clatonia in Gage Co. &amp; South Central Lancaster Co. Please be safe.,SenatorFischer,Deb Fischer,Nebraska,Republican
764,Thu May 26 20:52:31 +0000 2016,7.35937E+17,0,1,Marine Corporal Adrian Robles is a hero and I am honored to tell his story. #SemperFi #NebraskaHeroes,SenatorFischer,Deb Fischer,Nebraska,Republican
765,Thu May 26 20:51:13 +0000 2016,7.35936E+17,0,1,Adrian embodied the strength and determination that #Nebraskans are known for all over the world.,SenatorFischer,Deb Fischer,Nebraska,Republican
766,Thu May 26 20:50:32 +0000 2016,7.35936E+17,0,1,"Adrian’s mother, Yolanda, recalls that his life’s passion was to serve his country. #Patriotism #SemperFi",SenatorFischer,Deb Fischer,Nebraska,Republican
767,Thu May 26 20:49:54 +0000 2016,7.35936E+17,0,1,Corporal Robles was killed instantly. His unit was scheduled to leave Afghanistan two months later. #NEHeroes #USMC,SenatorFischer,Deb Fischer,Nebraska,Republican
768,Thu May 26 20:49:43 +0000 2016,7.35936E+17,0,1,"A few months later, on October 22, 2008, Adrian was on patrol when suddenly his vehicle was hit by an IED.",SenatorFischer,Deb Fischer,Nebraska,Republican
769,Thu May 26 20:49:03 +0000 2016,7.35936E+17,0,1,"In the spring of 2008, Corporal Adrian Robles deployed to #Afghanistan as part of the 2nd Battalion, 1st Marine Division.",SenatorFischer,Deb Fischer,Nebraska,Republican
770,Thu May 26 20:48:02 +0000 2016,7.35936E+17,0,1,He graduated from Scottsbluff High School in May of 2005 &amp; immediately enlisted in @USMC #Marines,SenatorFischer,Deb Fischer,Nebraska,Republican
771,Thu May 26 20:46:53 +0000 2016,7.35935E+17,0,1,"The WWII stories of Adrian’s grandfather, Pedro, inspired Adrian to become a Marine. #USMC",SenatorFischer,Deb Fischer,Nebraska,Republican
772,Thu May 26 20:46:18 +0000 2016,7.35935E+17,0,1,NOW: I’m continuing my tribute to NE’s fallen heroes. Today I’ll honor Marine Corporal Adrian Robles of Scottsbluff. https://t.co/v5qiAiEQnj,SenatorFischer,Deb Fischer,Nebraska,Republican
773,Thu May 26 19:49:38 +0000 2016,7.35921E+17,0,4,Local weather stations have issued a tornado watch for Omaha and the surrounding area. Please stay tuned to your local news. #StaySafe,SenatorFischer,Deb Fischer,Nebraska,Republican
774,Thu May 26 18:20:41 +0000 2016,7.35898E+17,1,9,Just intro’d #FUELSAct. Bill would lower costs &amp; cut red tape for Nebraska families who work hard to #FeedtheWorld. https://t.co/GbgFl7fy6l,SenatorFischer,Deb Fischer,Nebraska,Republican
775,Wed May 25 22:17:45 +0000 2016,7.35596E+17,2,3,Meeting w/ students from @ACpepSquad &amp; @OmahaPubSchool participating in @CloseUp_DC on this beautiful afternoon. https://t.co/pKZifgntFK,SenatorFischer,Deb Fischer,Nebraska,Republican
776,Wed May 25 15:48:11 +0000 2016,7.35498E+17,0,3,Honored to be a @NRFnews  “Hero of Main Street.” Retailers small &amp; large grow our #economy. #NebraskaBiz https://t.co/QfHJ8C8vjE,SenatorFischer,Deb Fischer,Nebraska,Republican
777,Tue May 24 19:56:28 +0000 2016,7.35198E+17,0,2,SOON: I will speak on #SenateFloor about my concerns with the #fiduciary rule &amp; its effect on NE businesses/families https://t.co/cUhIotz2pQ,SenatorFischer,Deb Fischer,Nebraska,Republican
778,Tue May 24 19:40:01 +0000 2016,7.35194E+17,0,1,Asking questions now at @EPWMaj sbcmte hearing. Will highlight #WOTUS rule &amp; its negative impact on citizens in NE. https://t.co/KerMapMdhF,SenatorFischer,Deb Fischer,Nebraska,Republican
779,Tue May 24 18:28:59 +0000 2016,7.35176E+17,0,2,Headed to @EPWmaj subcommittee hearing on oversight of the administration’s #WOTUS rule. Tune in: https://t.co/LHlDbQOayo,SenatorFischer,Deb Fischer,Nebraska,Republican
780,Tue May 24 14:15:34 +0000 2016,7.35112E+17,0,1,Such talent! Check out @TheHannahHuston powerhouse performances in @NBCtheVoice finale last night. #ProudNebraskan https://t.co/Pv2DNvE5ej,SenatorFischer,Deb Fischer,Nebraska,Republican
781,Mon May 23 20:46:43 +0000 2016,7.34848E+17,1,2,Wishing NE’s @TheHannahHuston good luck in tonight’s @NBCtheVoice finale! #SingIt #ProudNebraskan https://t.co/vCRqPbj0HA,SenatorFischer,Deb Fischer,Nebraska,Republican
782,Sun May 22 14:00:24 +0000 2016,7.34383E+17,1,2,REMINDER: My staff will hold mobile office hours in Grant &amp; Imperial on Tuesday 5/24 https://t.co/0aPcCRMYJ1,SenatorFischer,Deb Fischer,Nebraska,Republican
783,Sat May 21 14:28:59 +0000 2016,7.34028E+17,0,8,To all who serve and their families who support them: thank you. #ArmedForcesDay 🇺🇸 https://t.co/EGz0XSRtHe,SenatorFischer,Deb Fischer,Nebraska,Republican
784,Thu May 19 20:30:47 +0000 2016,7.33394E+17,0,3,Today I intro’d new bill that would accelerate upgrades to #VA health care facilities. #Veterans https://t.co/k6R4vHVRvM,SenatorFischer,Deb Fischer,Nebraska,Republican
785,Thu May 19 13:46:19 +0000 2016,7.33293E+17,0,7,So honored to receive the Spirit of Enterprise award presented to me last night by the @NebraskaChamber. https://t.co/L1ARADxMDY,SenatorFischer,Deb Fischer,Nebraska,Republican
786,Wed May 18 21:24:06 +0000 2016,7.33046E+17,1,3,Discussed duplicitous pesticide permitting regulations with folks from @GCBAA. My #SEPA bill would address this. https://t.co/whzsSBck9g,SenatorFischer,Deb Fischer,Nebraska,Republican
787,Wed May 18 20:30:27 +0000 2016,7.33032E+17,2,4,Honored to receive the @ACUconservative award for conservative excellence from @MSchlapp today. https://t.co/JO7LubPyIR,SenatorFischer,Deb Fischer,Nebraska,Republican
788,Wed May 18 16:38:09 +0000 2016,7.32974E+17,0,1,HAPPENING SOON: I will speak on the #Senate floor regarding #THUD &amp; #MilConVA approps. Tune in: https://t.co/OSPXDkGCXz,SenatorFischer,Deb Fischer,Nebraska,Republican
789,Wed May 18 14:45:22 +0000 2016,7.32945E+17,0,3,Busy morning at the #NebraskaBreakfast. Always love meeting with constituents visiting DC. #NebraskaNeighbors https://t.co/q0h2W5v8YL,SenatorFischer,Deb Fischer,Nebraska,Republican
790,Wed May 18 13:54:49 +0000 2016,7.32932E+17,0,2,Nebraska star @TheHannahHuston will compete in the @NBCtheVoice finals! Way to go #SingIt #ProudNebraskan  https://t.co/F0bkzcDAzw,SenatorFischer,Deb Fischer,Nebraska,Republican
791,Wed May 18 13:31:48 +0000 2016,7.32927E+17,0,1,"In this morning’s @EPWMaj markup, we will consider a number of legislative items. Watch live: https://t.co/XVUksNeXwG #EPW",SenatorFischer,Deb Fischer,Nebraska,Republican
792,Tue May 17 13:49:39 +0000 2016,7.32569E+17,1,4,I’m fighting misguided OSHA regulations that are harming Nebraska farmers. More from: @NTVsSteveWhite https://t.co/6CHmlW4pFz,SenatorFischer,Deb Fischer,Nebraska,Republican
793,Mon May 16 19:11:13 +0000 2016,7.32287E+17,0,9,Thank a police officer this week. #SupportBlue #NationalPoliceWeek https://t.co/LS5HpdBnKa,SenatorFischer,Deb Fischer,Nebraska,Republican
794,Mon May 16 16:29:10 +0000 2016,7.32247E+17,1,2,"It’s very simple: if you want to know how your salary compares to your coworkers, you should have every right to ask. #EqualPay",SenatorFischer,Deb Fischer,Nebraska,Republican
795,Mon May 16 16:28:31 +0000 2016,7.32246E+17,0,5,Pleased to see @RepLynnJenkins intro House version of my #equalpay bill today. #KnowledgeisPower https://t.co/YqmRf57vBs,SenatorFischer,Deb Fischer,Nebraska,Republican
796,Mon May 16 14:30:55 +0000 2016,7.32217E+17,0,3,.@OWHnews reports on my provisions in #Senate FAA bill which would strengthen funding for NE’s rural airports. Read: https://t.co/RAFda1OO6c,SenatorFischer,Deb Fischer,Nebraska,Republican
797,Sun May 15 18:16:14 +0000 2016,7.31911E+17,2,5,On Peace Officers Memorial Day we honor brave officers like Omaha's Kerrie Orozco who make the ultimate sacrifice to keep us safe #KerrieOn,SenatorFischer,Deb Fischer,Nebraska,Republican
798,Fri May 13 20:59:53 +0000 2016,7.31227E+17,4,1,Meeting w/ new @ChildrensOmaha CEO Dr. Richard Azizkhan. Great to hear about his exciting vision for the hospital. https://t.co/ZMwwMxYcS0,SenatorFischer,Deb Fischer,Nebraska,Republican
799,Fri May 13 17:49:40 +0000 2016,7.3118E+17,0,2,In Papillion visiting the North Central States Regional Council of Carpenters. On the carpenter training floor. https://t.co/epQNZ6LBNn,SenatorFischer,Deb Fischer,Nebraska,Republican
800,Thu May 12 22:26:49 +0000 2016,7.30887E+17,2,5,Resolution honoring Officer Kerrie Orozco just passed #Senate. Proud to work with @SenSasse @ChuckGrassley @SenJoniErnst on this. #KerrieOn,SenatorFischer,Deb Fischer,Nebraska,Republican
801,Thu May 12 22:02:30 +0000 2016,7.30881E+17,0,7,Today I honored the life of fallen @OmahaPolice officer Kerrie Orozco on the Senate floor. Read more from @MortonOWH https://t.co/NJWJwreB30,SenatorFischer,Deb Fischer,Nebraska,Republican
