,created_at,id_str,reply_count,retweet_count,text,user,name,state,party
2268,Mon Aug 03 22:13:14 +0000 2015,6.28328E+17,50,44,Senate stood up for women by rejecting effort to defund Planned Parenthood. Read my statement on today’s vote: http://t.co/3kV7dYM6OO,SenFeinstein,Dianne Feinstein,California,Democratic
2269,Mon Aug 03 21:46:17 +0000 2015,6.28321E+17,32,67,"Planned Parenthood provides 500k breast exams, 400k cervical cancer screenings per year—I #StandWithPP to protect their essential services.",SenFeinstein,Dianne Feinstein,California,Democratic
2270,Mon Aug 03 21:37:51 +0000 2015,6.28319E+17,37,103,"80% of Planned Parenthood’s patients are low-income women who rely on it’s affordable, quality health care. #StandWithPP",SenFeinstein,Dianne Feinstein,California,Democratic
2271,Mon Aug 03 21:10:47 +0000 2015,6.28312E+17,46,43,"Nearly 3 million women, men and young people count on Planned Parenthood every year for quality health care. Proud to #StandWithPP.",SenFeinstein,Dianne Feinstein,California,Democratic
2272,Mon Aug 03 20:47:53 +0000 2015,6.28306E+17,20,35,We need to confront climate change head-on. The Clean Power Plan is a strong step in the right direction: http://t.co/aQzc3yL8hv,SenFeinstein,Dianne Feinstein,California,Democratic
2273,Mon Aug 03 19:29:52 +0000 2015,6.28287E+17,4,13,Wildfires and drought will only get worse without action on climate change—#CleanPowerPlan takes a necessary step. http://t.co/aQzc3yL8hv,SenFeinstein,Dianne Feinstein,California,Democratic
2274,Mon Aug 03 18:42:22 +0000 2015,6.28275E+17,4,10,"By 2030, the US is set to increase renewable energy to account for 28% of energy capacity &amp; grow clean tech investments. #ActOnClimate",SenFeinstein,Dianne Feinstein,California,Democratic
2275,Mon Aug 03 18:41:40 +0000 2015,6.28275E+17,6,13,The president’s Clean Power Plan sets realistic goals for reducing carbon pollution. Learn more from @EPA: http://t.co/8LHoBWJMKZ,SenFeinstein,Dianne Feinstein,California,Democratic
2276,Mon Aug 03 18:39:43 +0000 2015,6.28274E+17,14,14,32% cut in carbon dioxide emissions from power plants by 2030—an achievable goal for confronting climate change. http://t.co/S7m7UDsmME,SenFeinstein,Dianne Feinstein,California,Democratic
2277,Fri Jul 31 19:21:08 +0000 2015,6.27197E+17,8,9,"Economic effects of drought are dire. $2.7 bil in economic damages, 18.6k jobs lost, 563k acres of farmland fallowed. http://t.co/7zRF730lcF",SenFeinstein,Dianne Feinstein,California,Democratic
2278,Fri Jul 31 19:20:21 +0000 2015,6.27197E+17,7,10,This historic drought has hurt our state’s economy. Our bill aims to reverse these trends. http://t.co/IipxF9Enus,SenFeinstein,Dianne Feinstein,California,Democratic
2279,Thu Jul 30 21:16:43 +0000 2015,6.26864E+17,5,6,"In short-term, we need to move water more efficiently. The water bill does that without violating environmental laws. http://t.co/19Fmt58W1y",SenFeinstein,Dianne Feinstein,California,Democratic
2280,Thu Jul 30 20:57:56 +0000 2015,6.26859E+17,7,16,"50 years ago today, with our most vulnerable in mind, Medicare &amp; Medicaid were signed into law. #KeepingUSHealthy http://t.co/3nQ4hmoKwi",SenFeinstein,Dianne Feinstein,California,Democratic
2281,Thu Jul 30 20:03:05 +0000 2015,6.26845E+17,10,11,"Climate change will make droughts longer, more severe—we need long-term water solutions like recycling, desalination. http://t.co/7zRF730lcF",SenFeinstein,Dianne Feinstein,California,Democratic
2282,Thu Jul 30 18:13:27 +0000 2015,6.26818E+17,2,5,Discussing drought relief and the new water legislation with 120 Californians yesterday. http://t.co/5EEhz5Tl48,SenFeinstein,Dianne Feinstein,California,Democratic
2283,Thu Jul 30 16:17:55 +0000 2015,6.26789E+17,7,9,"Bill identifies 26 California desalination projects capable of creating an additional 330,000 acre-ft. of water. http://t.co/7zRF730lcF",SenFeinstein,Dianne Feinstein,California,Democratic
2284,Thu Jul 30 16:16:49 +0000 2015,6.26789E+17,2,11,"Water bill authorizes $600 million for storage projects, identifies 105 recycling projects capable of producing 854,000 acre-feet of water.",SenFeinstein,Dianne Feinstein,California,Democratic
2285,Thu Jul 30 16:16:06 +0000 2015,6.26788E+17,5,17,"My staff visited dozens of projects in Calif. for ideas to support desalination, water recycling and storage efforts. http://t.co/o8NXX4BOsJ",SenFeinstein,Dianne Feinstein,California,Democratic
2286,Wed Jul 29 21:46:12 +0000 2015,6.26509E+17,6,5,Water bill helps cope with the ongoing drought and puts in place tools to combat future droughts. http://t.co/EJRoLcWqbR,SenFeinstein,Dianne Feinstein,California,Democratic
2287,Wed Jul 29 21:41:27 +0000 2015,6.26508E+17,9,19,"More than 2,000 wells in California are dry or soon will be. The new bill assists these drought-stricken communities. http://t.co/ePW7uEEEkd",SenFeinstein,Dianne Feinstein,California,Democratic
2288,Wed Jul 29 21:14:15 +0000 2015,6.26501E+17,3,7,The bill aims to help communities most affected by the historic drought in California. More info here: http://t.co/7zRF730lcF,SenFeinstein,Dianne Feinstein,California,Democratic
2289,Wed Jul 29 19:42:17 +0000 2015,6.26478E+17,3,16,Calif Emergency Drought Relief Act has solutions to fight ongoing drought. More on bill introduced w/ @SenatorBoxer: http://t.co/w1r8oS3w12,SenFeinstein,Dianne Feinstein,California,Democratic
2290,Tue Jul 28 21:05:02 +0000 2015,6.26136E+17,4,8,Water reductions reached as high as 40% in the case of Contra Costa Water District. Great job! http://t.co/vSWWBWhZjv @CCWD,SenFeinstein,Dianne Feinstein,California,Democratic
2291,Tue Jul 28 21:04:30 +0000 2015,6.26136E+17,11,7,Bay Area water districts are hitting their water conservation marks. Pleased that all residents are pitching in.,SenFeinstein,Dianne Feinstein,California,Democratic
2292,Tue Jul 28 20:01:46 +0000 2015,6.2612E+17,7,16,"Today in history: 70 years ago, the Senate ratified the @UN Charter, the beginning of a new age for diplomacy. #UN70 http://t.co/uU0rkM0aoJ",SenFeinstein,Dianne Feinstein,California,Democratic
2293,Tue Jul 28 18:47:18 +0000 2015,6.26102E+17,3,12,Wonderful discussion yesterday afternoon with my summer interns. California certainly has some bright young minds! http://t.co/EdRNDzfTb2,SenFeinstein,Dianne Feinstein,California,Democratic
2294,Mon Jul 27 19:29:52 +0000 2015,6.2575E+17,0,15,"It's an honor for Los Angeles to host the 2015 @SpecialOlympics this week. Good luck to all of the talented, inspiring athletes! Go USA!",SenFeinstein,Dianne Feinstein,California,Democratic
2295,Sun Jul 26 17:58:50 +0000 2015,6.25365E+17,10,28,"The Americans With Disabilities Act, signed into law 25 years ago, protects millions of people with disabilities from discrimination. #ADA25",SenFeinstein,Dianne Feinstein,California,Democratic
2296,Fri Jul 24 20:55:04 +0000 2015,6.24684E+17,5,18,"Great job by @CaltransHQ expediting I-10 repairs. Delays remain, but this vital corridor is now open for travelers. http://t.co/pJpNBHBHoB",SenFeinstein,Dianne Feinstein,California,Democratic
2297,Fri Jul 24 17:31:55 +0000 2015,6.24633E+17,3,9,Orange County on pace to add most jobs in 17 years. Exciting times ahead for the OC—many projects on the horizon. http://t.co/ozeVfZ7v57,SenFeinstein,Dianne Feinstein,California,Democratic
2298,Thu Jul 23 21:33:15 +0000 2015,6.24331E+17,3,4,"EU allies are vital partners in halting proliferation. Great meeting with @ElmarBrok_MEP, Chairman of @EP_ForeignAff. http://t.co/QBqoARka5K",SenFeinstein,Dianne Feinstein,California,Democratic
2299,Thu Jul 23 20:41:04 +0000 2015,6.24318E+17,12,11,"Last week, jobless claims fell by 26,000 to 255,000, the fewest since Nov. 1973. More good news for the U.S. economy.http://t.co/y9gUYdUh0J",SenFeinstein,Dianne Feinstein,California,Democratic
2300,Thu Jul 23 19:51:51 +0000 2015,6.24306E+17,6,36,LGBT Americans must be protected from discrimination in all aspects of life. Proud to cosponsor the #EqualityAct. http://t.co/OoP0z1q1kM,SenFeinstein,Dianne Feinstein,California,Democratic
2301,Thu Jul 23 19:51:06 +0000 2015,6.24306E+17,8,22,"63% of LGBT people have been discriminated against, fired from their jobs or denied housing and services. That's just wrong.",SenFeinstein,Dianne Feinstein,California,Democratic
2302,Thu Jul 23 18:38:45 +0000 2015,6.24288E+17,2,4,.@USDOT needs to complete a safety study before we allow longer trucks on our roads. Effect on safety still unknown. http://t.co/CRR9YBwvAr,SenFeinstein,Dianne Feinstein,California,Democratic
2303,Thu Jul 23 18:21:19 +0000 2015,6.24283E+17,4,4,"3,900+ fatalities from trucks in 2013. My amendment to highway bill ensures U.S. drivers aren’t further endangered. http://t.co/CRR9YBwvAr",SenFeinstein,Dianne Feinstein,California,Democratic
2304,Thu Jul 23 17:27:09 +0000 2015,6.2427E+17,6,7,Must-read @WashingtonPost op-ed by @JohnKerry and @ErnestMoniz: The case for the nuclear deal with Iran. http://t.co/ojHWSwgIhE,SenFeinstein,Dianne Feinstein,California,Democratic
2305,Wed Jul 22 20:31:22 +0000 2015,6.23954E+17,3,12,Great to see Sheryl Sandberg today. I’ve always been impressed by her work ethic &amp; strength in the face of adversity. http://t.co/DSXN2O4Mpc,SenFeinstein,Dianne Feinstein,California,Democratic
2306,Tue Jul 21 20:32:42 +0000 2015,6.23591E+17,5,5,Former Dept. of Transportation safety official @JoanClaybrook is clear: let’s make highway safety our first goal. http://t.co/USVdRavN2j,SenFeinstein,Dianne Feinstein,California,Democratic
2307,Tue Jul 21 20:30:57 +0000 2015,6.23591E+17,12,12,"Fatalities from truck crashes have increased 17% in four years. The Senate must focus on safety standards, not allowing longer trucks.",SenFeinstein,Dianne Feinstein,California,Democratic
2308,Tue Jul 21 19:06:43 +0000 2015,6.2357E+17,12,8,"Through our trade legislation, we must send signal to the world that we’re serious about climate change. Read letter: http://t.co/TBRbgEeTOI",SenFeinstein,Dianne Feinstein,California,Democratic
2309,Mon Jul 20 21:39:43 +0000 2015,6.23246E+17,12,5,I introduced legislation last month which would improve safety measures connected to consumer drone use. Info here: http://t.co/SYwXs19KsP,SenFeinstein,Dianne Feinstein,California,Democratic
2310,Mon Jul 20 21:39:14 +0000 2015,6.23246E+17,1,10,Aerial firefighting efforts must be suspended when unauthorized drones are in the area to protect pilots and public. http://t.co/1LJFgsi39H,SenFeinstein,Dianne Feinstein,California,Democratic
2311,Mon Jul 20 21:38:25 +0000 2015,6.23246E+17,6,34,Five hobby drones delayed efforts to fight the North Fire by 20 minutes. This is becoming a disturbing trend. http://t.co/ixkuSLj11i,SenFeinstein,Dianne Feinstein,California,Democratic
2312,Mon Jul 20 20:11:30 +0000 2015,6.23224E+17,7,17,Cuba and the U.S. officially re-opened embassies today—a historic day and the start of a much-needed new era. http://t.co/z6btRCzjpQ,SenFeinstein,Dianne Feinstein,California,Democratic
2313,Mon Jul 20 17:27:22 +0000 2015,6.23182E+17,12,7,I was on CBS's @FaceTheNation yesterday to discuss the nuclear agreement with Iran and the shootings in Chattanooga. http://t.co/2Zj9Hb3uvt,SenFeinstein,Dianne Feinstein,California,Democratic
2314,Fri Jul 17 21:18:58 +0000 2015,6.22154E+17,7,14,Joined five colleagues in urging Secretary McDonald to ensure veterans receive quality education with GI benefits. http://t.co/W9rqQzwdcp,SenFeinstein,Dianne Feinstein,California,Democratic
2315,Fri Jul 17 21:18:06 +0000 2015,6.22153E+17,7,18,"More than 2,000 unaccredited schools are receiving GI benefits according to a new report. That is not the intent of the program.",SenFeinstein,Dianne Feinstein,California,Democratic
2316,Fri Jul 17 18:13:21 +0000 2015,6.22107E+17,5,17,My @TIME op-ed with @ChuckGrassley talks about why more research on CBD is needed and how we can facilitate that. http://t.co/GIl8cp1Oir,SenFeinstein,Dianne Feinstein,California,Democratic
2317,Fri Jul 17 18:13:00 +0000 2015,6.22107E+17,6,22,"Mallory Minahan suffered from as many as 30-40 seizures per month before she was treated with CBD oil, derived from the marijuana plant.",SenFeinstein,Dianne Feinstein,California,Democratic
2318,Fri Jul 17 15:55:42 +0000 2015,6.22072E+17,2,12,"My Lake Tahoe bill includes funding for protection from invasive species, like the Quagga mussel. More info here: http://t.co/dECrHG7QEN",SenFeinstein,Dianne Feinstein,California,Democratic
2319,Fri Jul 17 15:55:15 +0000 2015,6.22072E+17,2,9,"May not look threatening, but Quagga mussels and other invasive species can cause massive damage to Calif’s water system &amp; pristine lakes.",SenFeinstein,Dianne Feinstein,California,Democratic
2320,Fri Jul 17 15:54:51 +0000 2015,6.22072E+17,11,9,Display I have in my office of Quagga mussels clinging to section of a pipe. These pests must stay out of Lake Tahoe. http://t.co/OyE07Llt94,SenFeinstein,Dianne Feinstein,California,Democratic
2321,Thu Jul 16 20:58:25 +0000 2015,6.21786E+17,13,7,My heart is with victims of the Chattanooga shooting. There will be investigation into any connection w/ terrorism—we must remain vigilant.,SenFeinstein,Dianne Feinstein,California,Democratic
2322,Thu Jul 16 20:21:48 +0000 2015,6.21777E+17,19,31,"British Amb. @PeterWestmacott and I both agree, Iran agreement is the right path for US, UK &amp; entire int'l community. http://t.co/YkfXNPsZLj",SenFeinstein,Dianne Feinstein,California,Democratic
2323,Thu Jul 16 19:39:02 +0000 2015,6.21766E+17,0,5,Congrats to @SFMTA_muni on the upcoming launch of the E-Embarcadero streetcar line. It’s been a long time coming! http://t.co/sFAb7HwMp3,SenFeinstein,Dianne Feinstein,California,Democratic
2324,Thu Jul 16 17:32:10 +0000 2015,6.21734E+17,5,9,On @MorningEdition I asked critics of the Iran agreement a simple question: What’s their alternative? Full interview: http://t.co/JH2GvL0Jig,SenFeinstein,Dianne Feinstein,California,Democratic
2325,Thu Jul 16 16:14:19 +0000 2015,6.21714E+17,5,4,I was on @MorningEdition today to discuss the diplomatic and scientific strength of the nuclear agreement with Iran. http://t.co/JH2GvL0Jig,SenFeinstein,Dianne Feinstein,California,Democratic
2326,Wed Jul 15 21:10:26 +0000 2015,6.21427E+17,2,10,"It’s estimated that more than 500,000 drones have been purchased in the U.S.—close calls are becoming more and more common.",SenFeinstein,Dianne Feinstein,California,Democratic
2327,Wed Jul 15 21:10:01 +0000 2015,6.21427E+17,6,5,Drone recently crashed on Golden Gate Bridge roadway. Clear rules are needed so hobbyists don’t fly drones near airports or major landmarks.,SenFeinstein,Dianne Feinstein,California,Democratic
2328,Wed Jul 15 21:08:52 +0000 2015,6.21426E+17,2,2,"Read my San Francisco Chronicle op-ed with Denis Mulligan, CEO of Golden Gate Bridge, on the reasons why. http://t.co/pS38wg7jhk",SenFeinstein,Dianne Feinstein,California,Democratic
2329,Wed Jul 15 21:08:25 +0000 2015,6.21426E+17,7,9,Consumer drones endanger airplanes and our airspace. We need commonsense rules to guide their use. http://t.co/pS38wg7jhk,SenFeinstein,Dianne Feinstein,California,Democratic
2330,Wed Jul 15 19:42:35 +0000 2015,6.21405E+17,2,5,Discussing the Preamble to the U.S. Constitution with Californians visiting DC this morning over breakfast. http://t.co/eUlUavsCyw,SenFeinstein,Dianne Feinstein,California,Democratic
2331,Wed Jul 15 18:46:12 +0000 2015,6.2139E+17,0,6,"After three billion miles, New Horizon’s spacecraft takes a close look at Pluto. Very proud, @NASA! Gorgeous photos. http://t.co/HqEdqXj63y",SenFeinstein,Dianne Feinstein,California,Democratic
2332,Wed Jul 15 17:49:29 +0000 2015,6.21376E+17,11,21,Negotiators were able to overcome decades of animosity and extract serious concessions from Iran. They deserve enormous credit.,SenFeinstein,Dianne Feinstein,California,Democratic
2333,Wed Jul 15 17:49:04 +0000 2015,6.21376E+17,10,7,Congratulations to @JohnKerry and all U.S. negotiators who have come so far in the last 18 months. http://t.co/uFIKshjeF7,SenFeinstein,Dianne Feinstein,California,Democratic
2334,Wed Jul 15 16:06:26 +0000 2015,6.2135E+17,7,20,"As @POTUS said, all options for preventing Iran from developing nuclear weapon remain available if they fail to comply with agreement.",SenFeinstein,Dianne Feinstein,California,Democratic
2335,Wed Jul 15 16:06:02 +0000 2015,6.2135E+17,15,31,Iran will be subject to highest level of scrutiny under international law. The whole world will be watching. http://t.co/uFIKshjeF7,SenFeinstein,Dianne Feinstein,California,Democratic
2336,Tue Jul 14 21:57:54 +0000 2015,6.21076E+17,6,8,"Focus must be put on repairing our highways and strengthening cargo transport via rail, not larger trucks. http://t.co/LeluQeVyV5",SenFeinstein,Dianne Feinstein,California,Democratic
2337,Tue Jul 14 21:57:23 +0000 2015,6.21076E+17,4,4,"Senate committee recently approved longer trailer trucks on highways, putting profits ahead of safety.",SenFeinstein,Dianne Feinstein,California,Democratic
2338,Tue Jul 14 21:56:55 +0000 2015,6.21076E+17,6,3,"3,914 people were killed in 2013 in accidents involving large trucks. Must focus on safety, not increasing truck size.",SenFeinstein,Dianne Feinstein,California,Democratic
2339,Tue Jul 14 21:56:35 +0000 2015,6.21076E+17,13,8,Read my op-ed in @TheHill on how longer trailer trucks make highways less safe. http://t.co/LeluQeVyV5,SenFeinstein,Dianne Feinstein,California,Democratic
2340,Tue Jul 14 20:55:02 +0000 2015,6.2106E+17,3,8,Met with these two brave California service members who are back from Afghanistan. http://t.co/PsVHDDNRjf,SenFeinstein,Dianne Feinstein,California,Democratic
2341,Tue Jul 14 19:36:11 +0000 2015,6.21041E+17,21,24,"If Iran attempts to cheat on the agreement, a mechanism is in place to reinstate the full slate of sanctions.",SenFeinstein,Dianne Feinstein,California,Democratic
2342,Tue Jul 14 19:35:37 +0000 2015,6.2104E+17,9,29,"Parts of Iran agreement last for 10, 15, 20 &amp; 25 yrs. Other pieces are indefinite. The pressure is on Iran to comply. http://t.co/uFIKshjeF7",SenFeinstein,Dianne Feinstein,California,Democratic
2343,Tue Jul 14 18:33:12 +0000 2015,6.21025E+17,11,11,Iran’s nuclear enrichment capabilities will also be severely constrained.,SenFeinstein,Dianne Feinstein,California,Democratic
2344,Tue Jul 14 18:32:28 +0000 2015,6.21024E+17,13,19,"Under the Iran agreement, the country will be subject to unprecedented &amp; intrusive inspections to verify cooperation. http://t.co/uFIKshjeF7",SenFeinstein,Dianne Feinstein,California,Democratic
2345,Tue Jul 14 17:21:23 +0000 2015,6.21007E+17,32,81,I support the #IranDeal because Iran’s pathways to a nuclear bomb are blocked through the agreement.,SenFeinstein,Dianne Feinstein,California,Democratic
2346,Tue Jul 14 17:20:46 +0000 2015,6.21006E+17,10,37,Nuclear agreement between world powers and Iran is strong and will stand the test of time. My statement: http://t.co/uFIKshjeF7,SenFeinstein,Dianne Feinstein,California,Democratic
2347,Mon Jul 13 21:50:49 +0000 2015,6.20712E+17,14,9,My bill would help firefighters do their jobs by increasing the safety of consumer drones. http://t.co/SYwXs19KsP,SenFeinstein,Dianne Feinstein,California,Democratic
2348,Mon Jul 13 21:49:28 +0000 2015,6.20712E+17,4,6,Another instance of a recreational drone interfering with the ability to fight wildfires in San Bernardino County. http://t.co/V22daFh0F0,SenFeinstein,Dianne Feinstein,California,Democratic
2349,Mon Jul 13 21:25:46 +0000 2015,6.20706E+17,6,15,Wow! Just look at this photo! Now everyone knows why we must protect this beautiful region! #Berryessa #FindYourPark http://t.co/D6NglAgMzp,SenFeinstein,Dianne Feinstein,California,Democratic
2350,Mon Jul 13 21:19:27 +0000 2015,6.20704E+17,3,5,"331k acres of Berryessa Snow Mountain designated as a Nat'l Monument, among Calif's most biologically diverse areas. http://t.co/FOc2hgBnKM",SenFeinstein,Dianne Feinstein,California,Democratic
2351,Fri Jul 10 20:40:30 +0000 2015,6.19607E+17,16,12,Doing well in school is the best way to end homelessness for children in California and across the country.,SenFeinstein,Dianne Feinstein,California,Democratic
2352,Fri Jul 10 20:40:10 +0000 2015,6.19607E+17,5,14,Senate passed my amendment with @SenRobPortman yesterday to ensure access to educational services for homeless youth. http://t.co/L3RRXJjPxN,SenFeinstein,Dianne Feinstein,California,Democratic
2353,Fri Jul 10 20:39:27 +0000 2015,6.19607E+17,15,38,"1.3 million children are homeless in the U.S., 310,000 in California alone. These children need help to end this cycle of despair.",SenFeinstein,Dianne Feinstein,California,Democratic
2354,Fri Jul 10 19:27:07 +0000 2015,6.19589E+17,17,21,I support legislation to ensure same-sex couples are treated equally at tax time. #LoveIsLove http://t.co/DgTqtKVwPk,SenFeinstein,Dianne Feinstein,California,Democratic
2355,Fri Jul 10 19:01:12 +0000 2015,6.19582E+17,12,20,Tax Code needs to be updated following Supreme Court decision giving same-sex couples right to marry. #LoveIsLove http://t.co/s3lQNjI8kL,SenFeinstein,Dianne Feinstein,California,Democratic
2356,Fri Jul 10 16:42:23 +0000 2015,6.19547E+17,3,8,I want to make sure Lake Tahoe stays beautiful for all future generations. http://t.co/npXr3AKcz6 http://t.co/nJPxE916V3,SenFeinstein,Dianne Feinstein,California,Democratic
2357,Fri Jul 10 16:39:55 +0000 2015,6.19547E+17,6,15,Anyone who has been to Lake Tahoe knows its pristine beauty—we need to keep it that way! http://t.co/npXr3AKcz6 http://t.co/tQRtUuCAVw,SenFeinstein,Dianne Feinstein,California,Democratic
2358,Thu Jul 09 21:16:53 +0000 2015,6.19254E+17,4,10,We need to do more to protect and restore Lake Tahoe. http://t.co/npXr3AKcz6 http://t.co/Wq5c3vYp4x,SenFeinstein,Dianne Feinstein,California,Democratic
2359,Thu Jul 09 21:15:33 +0000 2015,6.19254E+17,1,6,Lake Tahoe is an awe-inspiring natural wonder. I can think of no other place as worthy of protection. http://t.co/npXr3B1NqE,SenFeinstein,Dianne Feinstein,California,Democratic
2360,Thu Jul 09 21:14:48 +0000 2015,6.19253E+17,5,9,Today @SenDeanHeller @SenatorReid @SenatorBoxer and I today introduced the Lake Tahoe Restoration Act. http://t.co/npXr3AKcz6,SenFeinstein,Dianne Feinstein,California,Democratic
2361,Thu Jul 09 17:53:21 +0000 2015,6.19203E+17,2,2,Introduced a bill earlier this year to improve breast cancer detection by notifying women of dense tissue. http://t.co/XzAfAEzdk0,SenFeinstein,Dianne Feinstein,California,Democratic
2362,Thu Jul 09 17:52:51 +0000 2015,6.19203E+17,1,1,I met with @DrNancyCappello last month. She’s a tireless advocate for women—her work is very impressive.,SenFeinstein,Dianne Feinstein,California,Democratic
2363,Thu Jul 09 17:52:31 +0000 2015,6.19202E+17,3,10,"Women should be notified if mammograms show dense breast tissue. The more info we have, the better. From @USNews: http://t.co/0R5rOmQCfO",SenFeinstein,Dianne Feinstein,California,Democratic
2364,Wed Jul 08 21:33:13 +0000 2015,6.18896E+17,13,7,Listening to FBI Director Comey’s testimony at today’s Intelligence Committee hearing on encryption technology. http://t.co/O01XiWOoHG,SenFeinstein,Dianne Feinstein,California,Democratic
2365,Wed Jul 08 20:17:06 +0000 2015,6.18876E+17,17,28,"From deodorant to shampoo to lotion, we all use personal care products daily. We must ensure the ingredients are safe. #SafeProducts",SenFeinstein,Dianne Feinstein,California,Democratic
2366,Wed Jul 08 19:50:46 +0000 2015,6.1887E+17,4,7,"These groups represent women, minorities, LGBT Americans and seniors. Personal care products safety affects us all. #SafeProducts",SenFeinstein,Dianne Feinstein,California,Democratic
2367,Wed Jul 08 17:05:29 +0000 2015,6.18828E+17,7,16,17 national health organizations have endorsed the Personal Care Products Safety Act. #SafeProducts http://t.co/u6qiXuCm6I,SenFeinstein,Dianne Feinstein,California,Democratic
2368,Wed Jul 08 17:04:00 +0000 2015,6.18828E+17,11,24,Rules to ensure safety of products like shampoo &amp; deodorant are 77 years old. @US_FDA needs ability to review ingredients. #SafeProducts,SenFeinstein,Dianne Feinstein,California,Democratic
2369,Tue Jul 07 21:54:22 +0000 2015,6.18539E+17,21,13,Calling on SF to join Priority Enforcement Program—would enable better cooperation to fight public safety threats. http://t.co/82x0Gwppka,SenFeinstein,Dianne Feinstein,California,Democratic
2370,Tue Jul 07 21:53:26 +0000 2015,6.18538E+17,54,13,"Killing of Kathryn Steinle in SF is an absolute tragedy. Suspect should have been removed from U.S., not released. http://t.co/82x0Gwppka",SenFeinstein,Dianne Feinstein,California,Democratic
2371,Tue Jul 07 20:09:58 +0000 2015,6.18512E+17,6,19,"When all students are given a chance to learn, we strengthen our future workforce and the backbone of our country. http://t.co/PSO3tQcdOt",SenFeinstein,Dianne Feinstein,California,Democratic
2372,Tue Jul 07 19:50:25 +0000 2015,6.18507E+17,6,14,All students deserve a quality education—regardless of where they live or how they learn. #EveryChildAchievesAct http://t.co/E5RwcEptXU,SenFeinstein,Dianne Feinstein,California,Democratic
2373,Tue Jul 07 19:09:38 +0000 2015,6.18497E+17,5,7,"10 yrs since the tragic London subway bombings. We mourn those lost but cherish the relationship with UK, our best counterterrorism partner.",SenFeinstein,Dianne Feinstein,California,Democratic
2374,Mon Jul 06 19:59:41 +0000 2015,6.18147E+17,8,19,"Happy birthday to my friend, His Holiness the @DalaiLama, whose message of peace and compassion has inspired millions around the world.",SenFeinstein,Dianne Feinstein,California,Democratic
2375,Sun Jul 05 19:48:08 +0000 2015,6.17782E+17,1,40,Good luck to the #USAWomensSoccer team! #USAvJPN,SenFeinstein,Dianne Feinstein,California,Democratic
2376,Sat Jul 04 14:39:30 +0000 2015,6.17342E+17,16,11,Happy Fourth of July everyone!,SenFeinstein,Dianne Feinstein,California,Democratic
