,created_at,id_str,reply_count,retweet_count,text,user,name,state,party
756,Tue Dec 13 22:53:02 +0000 2016,8.08807E+17,11,48,"(2/3) Sen. Sessions has produced 150,000+ pages of material—many times more than previous nominees. We need time for a thorough review.",SenFeinstein,Dianne Feinstein,California,Democratic
757,Tue Dec 13 22:52:43 +0000 2016,8.08807E+17,22,95,(1/3) Judiciary Committee must have ample time to review record of Sen. Sessions. The nomination for attorney general is very serious.,SenFeinstein,Dianne Feinstein,California,Democratic
758,Mon Dec 12 22:30:21 +0000 2016,8.08439E+17,7,27,(2/2) Two years ago we released the 450-page summary of the CIA torture report. Read about it here: https://t.co/l0PHMEug4i #ReadTheReport,SenFeinstein,Dianne Feinstein,California,Democratic
759,Mon Dec 12 22:29:37 +0000 2016,8.08439E+17,8,32,(1/2) @POTUS will include CIA torture report as part of his presidential records: https://t.co/tDUFRH6F6J #ReadTheReport,SenFeinstein,Dianne Feinstein,California,Democratic
760,Mon Dec 12 21:38:14 +0000 2016,8.08426E+17,4,23,"For health insurance starting on Jan. 1, be sure to enroll through @CoveredCA by Dec. 15 for quality coverage.… https://t.co/0d6JN9hycG",SenFeinstein,Dianne Feinstein,California,Democratic
761,Sun Dec 11 00:29:00 +0000 2016,8.07744E+17,18,46,Our water bill fights the drought without violating environmental protections like the Endangered Species Act https://t.co/FuCmESqLe3,SenFeinstein,Dianne Feinstein,California,Democratic
762,Sat Dec 10 21:49:00 +0000 2016,8.07704E+17,10,20,The Senate passed our Lake Tahoe Restoration Act last night with funds for Tahoe Basin projects. https://t.co/270jrR03ud,SenFeinstein,Dianne Feinstein,California,Democratic
763,Sat Dec 10 19:08:00 +0000 2016,8.07663E+17,10,23,"After 6 years of drought, our bill addresses California's water needs while preserving environmental protections.  https://t.co/FuCmESIm5B",SenFeinstein,Dianne Feinstein,California,Democratic
764,Sat Dec 10 16:05:14 +0000 2016,8.07617E+17,20,40,"Water bill is a big win for California’s aging water infrastructure, flood protection and ecosystem restoration. https://t.co/270jrQIsCF",SenFeinstein,Dianne Feinstein,California,Democratic
765,Sat Dec 10 03:29:53 +0000 2016,8.07427E+17,26,129,Complete record needed for Sessions nomination. We must have enough time for due diligence. https://t.co/dJNYABCiBa,SenFeinstein,Dianne Feinstein,California,Democratic
766,Thu Dec 08 22:41:52 +0000 2016,8.06992E+17,6,15,"(3/3) Denisse, a medical student, wants to serve low-income communities. She deserves that opportunity. #SaveDACA https://t.co/QJ0hGTksw5",SenFeinstein,Dianne Feinstein,California,Democratic
767,Thu Dec 08 22:41:09 +0000 2016,8.06992E+17,11,21,(2/3) My @SFChronicle op-ed on the need to #SaveDACA. These young people should not have to live in fear. https://t.co/Q6RTuHJTnR,SenFeinstein,Dianne Feinstein,California,Democratic
768,Thu Dec 08 22:40:12 +0000 2016,8.06992E+17,10,14,(1/3) Denisse Rojas is the face of a program that gives undocumented young people the chance to go to school &amp; work. https://t.co/Q6RTuHJTnR,SenFeinstein,Dianne Feinstein,California,Democratic
769,Thu Dec 08 22:01:29 +0000 2016,8.06982E+17,3,18,(2/2) Our Personal Care Products Safety Act would finally require independent review of ingredients for safety. #SafeProducts @EWG,SenFeinstein,Dianne Feinstein,California,Democratic
770,Thu Dec 08 22:00:58 +0000 2016,8.06982E+17,5,26,(1/2) Environmental Working Group: many products sold to African-American women have ingredients that may be harmful https://t.co/C38fGct1vb,SenFeinstein,Dianne Feinstein,California,Democratic
771,Thu Dec 08 21:05:01 +0000 2016,8.06968E+17,1,27,John Glenn was an American hero. His contributions and public service will never be forgotten. He will be missed.,SenFeinstein,Dianne Feinstein,California,Democratic
772,Thu Dec 08 20:18:35 +0000 2016,8.06956E+17,14,19,(5/5) We have an obligation to prevent deportation of #DACA students and keep families together. Their contributions make the U.S. stronger.,SenFeinstein,Dianne Feinstein,California,Democratic
773,Thu Dec 08 20:17:25 +0000 2016,8.06956E+17,3,16,"(4/5) I’m joining the effort to protect more than 350,000 young Californians who are living, working and learning in California. #SaveDACA",SenFeinstein,Dianne Feinstein,California,Democratic
774,Thu Dec 08 20:16:56 +0000 2016,8.06956E+17,8,10,(3/5) They want to live their lives in the only home they’ve known: the United States. Let’s help them achieve their dreams. #SaveDACA,SenFeinstein,Dianne Feinstein,California,Democratic
775,Thu Dec 08 20:16:15 +0000 2016,8.06956E+17,3,11,"(2/5) 750,000 young people nationwide have registered for the Deferred Action for Childhood Arrivals program—nearly half in California",SenFeinstein,Dianne Feinstein,California,Democratic
776,Thu Dec 08 20:15:46 +0000 2016,8.06955E+17,9,38,(1/5) My @SFChronicle op-ed discusses the importance of supporting high-achieving undocumented students. https://t.co/Q6RTuHJTnR,SenFeinstein,Dianne Feinstein,California,Democratic
777,Wed Dec 07 21:46:18 +0000 2016,8.06616E+17,7,8,(3/3) Cures Act also strengthens programs to ensure those who need mental health treatment are able to get it. Very important.,SenFeinstein,Dianne Feinstein,California,Democratic
778,Wed Dec 07 21:45:46 +0000 2016,8.06616E+17,2,9,(2/3) U.S. mired in opioid crisis—Cures Act will expand access to substance abuse treatment and prescription drug monitoring.,SenFeinstein,Dianne Feinstein,California,Democratic
779,Wed Dec 07 21:44:00 +0000 2016,8.06615E+17,3,14,"(1/3) Great strides made improving cancer detection, treatment and survival rates—Cures Act continues the momentum. https://t.co/8O8w5Af4fB",SenFeinstein,Dianne Feinstein,California,Democratic
780,Wed Dec 07 16:17:42 +0000 2016,8.06533E+17,9,32,75 years since an attack that shook the world. We’ll never forget the sacrifice of Americans who died that day. #PearlHarborRemembranceDay,SenFeinstein,Dianne Feinstein,California,Democratic
781,Wed Dec 07 00:07:02 +0000 2016,8.06289E+17,6,23,Positive step by tech companies to fight terrorism. I urge quick implementation to prevent recruitment and attacks. https://t.co/e7ouDollQg,SenFeinstein,Dianne Feinstein,California,Democratic
782,Tue Dec 06 22:31:42 +0000 2016,8.06265E+17,2,12,".@CFTC must prevent excessive speculation in energy and agricultural markets—delays risk harm to consumers, workers. https://t.co/IXQvHwISpL",SenFeinstein,Dianne Feinstein,California,Democratic
783,Tue Dec 06 00:11:00 +0000 2016,8.05927E+17,15,23,Our Tahoe bill provides $45 million to combat invasive species like quagga mussels which harm lake health &amp; clarity. https://t.co/8r1kBMhdht,SenFeinstein,Dianne Feinstein,California,Democratic
784,Tue Dec 06 00:10:01 +0000 2016,8.05927E+17,5,15,Invasive species pose threat to U.S. economic &amp; environmental interests—glad @POTUS is working to reduce the impact. https://t.co/aZNlRkZxKK,SenFeinstein,Dianne Feinstein,California,Democratic
785,Mon Dec 05 23:08:18 +0000 2016,8.05912E+17,2,15,"(2/2) After working countless hours with state and federal agencies, our plan does not violate the Endangered Speci… https://t.co/BXnlr0vr2r",SenFeinstein,Dianne Feinstein,California,Democratic
786,Mon Dec 05 23:07:11 +0000 2016,8.05911E+17,8,17,(1/2) Our water bill is the best way forward to combat drought—my statement on California drought language. https://t.co/PuTn6Wv9sE,SenFeinstein,Dianne Feinstein,California,Democratic
787,Sun Dec 04 19:01:29 +0000 2016,8.05487E+17,2,9,I'm encouraged by Mayor @LibbySchaaf's quick and compassionate response and will help in any way I can. https://t.co/SohI7PyBsG,SenFeinstein,Dianne Feinstein,California,Democratic
788,Sat Dec 03 19:59:30 +0000 2016,8.05139E+17,2,29,Thank you to the more than 50 firefighters who responded and helped save lives.,SenFeinstein,Dianne Feinstein,California,Democratic
789,Sat Dec 03 19:58:15 +0000 2016,8.05139E+17,37,65,Devastated by the tragic fire in #Oakland. My thoughts are with the victims and their families.,SenFeinstein,Dianne Feinstein,California,Democratic
790,Fri Dec 02 17:50:06 +0000 2016,8.04744E+17,12,29,"(2/2) I’m pleased to see the unemployment rate fall to 4.6%, its lowest level since August 2007. https://t.co/R3DJYZafLu #JobsReport",SenFeinstein,Dianne Feinstein,California,Democratic
791,Fri Dec 02 17:49:33 +0000 2016,8.04744E+17,36,200,"(1/2) Another solid jobs report out this morning, the U.S. economy has added 15.6 million private-sector jobs in th… https://t.co/oXHP9AJjkj",SenFeinstein,Dianne Feinstein,California,Democratic
792,Fri Dec 02 16:50:23 +0000 2016,8.04729E+17,1,9,(2/2) Let’s use today to honor those who lost their lives and offer hope to those working their way back from horrific injuries. #SBStrong,SenFeinstein,Dianne Feinstein,California,Democratic
793,Fri Dec 02 16:50:04 +0000 2016,8.04729E+17,3,13,"(1/2) One year after the awful terrorist attack, the San Bernardino community has shown the nation its resolve &amp; stands stronger than ever.",SenFeinstein,Dianne Feinstein,California,Democratic
794,Thu Dec 01 23:36:01 +0000 2016,8.04469E+17,5,22,I’m pleased at the progress we’ve made—almost a $7 billion increase of federal funding to fight domestic HIV since… https://t.co/Iw23cOoLuH,SenFeinstein,Dianne Feinstein,California,Democratic
795,Thu Dec 01 22:35:01 +0000 2016,8.04454E+17,3,15,.@POTUS recaps what we’re fighting for on #WorldAIDSDay. Looking forward to his continued leadership on the issue. https://t.co/IKjooQszlH,SenFeinstein,Dianne Feinstein,California,Democratic
796,Thu Dec 01 21:14:25 +0000 2016,8.04433E+17,5,40,37 mil. people have HIV &amp; it remains a leading cause of death worldwide—let’s use #WorldAIDSDay to reach out to tho… https://t.co/QTbrOPSFVQ,SenFeinstein,Dianne Feinstein,California,Democratic
797,Thu Dec 01 20:41:51 +0000 2016,8.04425E+17,2,9,"San Francisco’s #GettingToZero initiative has a simple mission: Eliminate HIV/AIDS infections, deaths and stigmas. https://t.co/FAPVAEPk3U",SenFeinstein,Dianne Feinstein,California,Democratic
798,Thu Dec 01 20:22:57 +0000 2016,8.04421E+17,2,27,(3/3) We owe early advocates a debt of gratitude. Tremendous advances in HIV/AIDS treatment are due in large part to their courage. #WAD2016,SenFeinstein,Dianne Feinstein,California,Democratic
799,Thu Dec 01 20:22:14 +0000 2016,8.0442E+17,2,25,(2/3) Fear of HIV/AIDS was widespread. San Francisco was among the first cities to devote funding to research and treatment. #WorldAIDSDay,SenFeinstein,Dianne Feinstein,California,Democratic
800,Thu Dec 01 20:21:55 +0000 2016,8.0442E+17,5,40,(1/3) I was mayor of San Francisco during the HIV/AIDS epidemic. It was one of the most formative experiences of my time in public service.,SenFeinstein,Dianne Feinstein,California,Democratic
801,Thu Dec 01 19:18:06 +0000 2016,8.04404E+17,2,16,"(2/2) His resume is sterling. As a member of congressional leadership &amp; a former deputy attorney general, I believe he is ready for the job.",SenFeinstein,Dianne Feinstein,California,Democratic
802,Thu Dec 01 19:17:35 +0000 2016,8.04404E+17,2,38,(1/2) Xavier Becerra is an excellent choice to be California’s Attorney General. He is a seasoned public servant who knows our state well.,SenFeinstein,Dianne Feinstein,California,Democratic
803,Wed Nov 30 22:58:43 +0000 2016,8.04097E+17,8,11,Defense bill includes our proposal to protect National Guard bonuses and repay soldiers who already made payments. https://t.co/MAa4O7KqYj,SenFeinstein,Dianne Feinstein,California,Democratic
804,Wed Nov 30 21:59:34 +0000 2016,8.04082E+17,7,10,Worked with @SenatorBoxer &amp; @RepAdamSchiff to ensure California National Guard soldiers keep bonuses they earned. https://t.co/MAa4O7KqYj,SenFeinstein,Dianne Feinstein,California,Democratic
805,Wed Nov 30 20:47:21 +0000 2016,8.04064E+17,5,12,Defense bill includes measures we fought for to ensure California National Guard soldiers keep their bonuses. https://t.co/MAa4O7KqYj,SenFeinstein,Dianne Feinstein,California,Democratic
806,Wed Nov 30 19:42:36 +0000 2016,8.04048E+17,149,132,I’m proud to say that half of DACA recipients call California home. I’ll do whatever it takes to #SaveDACA. https://t.co/HuqvdTbEMz,SenFeinstein,Dianne Feinstein,California,Democratic
807,Wed Nov 30 18:33:59 +0000 2016,8.04031E+17,6,50,This op-ed cuts through toxic rhetoric to see DACA for what it really is—a program to give motivated youngsters rea… https://t.co/kYeE3QggAU,SenFeinstein,Dianne Feinstein,California,Democratic
808,Wed Nov 30 18:05:20 +0000 2016,8.04024E+17,30,197,We are a nation of immigrants—Dreamers make California and the entire nation stronger. #SaveDACA https://t.co/qUcwkUtiGl,SenFeinstein,Dianne Feinstein,California,Democratic
809,Wed Nov 30 18:03:33 +0000 2016,8.04023E+17,46,247,The Deferred Action for Childhood Arrivals (DACA) program gives high-achieving undocumented youth the opportunity to succeed. #SaveDACA,SenFeinstein,Dianne Feinstein,California,Democratic
810,Tue Nov 29 17:36:24 +0000 2016,8.03654E+17,19,48,"Pres. Carter sees real opportunity now to create ""two states, living side by side in peace."" Bold op-ed on peace fo… https://t.co/s62F2B9AwG",SenFeinstein,Dianne Feinstein,California,Democratic
811,Sat Nov 26 16:42:00 +0000 2016,8.02553E+17,9,38,Small businesses are the backbone of the American economy. Be sure to #ShopSmall in your neighborhood this weekend.… https://t.co/JjaNLqHmoF,SenFeinstein,Dianne Feinstein,California,Democratic
812,Thu Nov 24 20:03:01 +0000 2016,8.01879E+17,9,13,Wishing everyone a very Happy Thanksgiving! I hope you’re spending your day surrounded by family and friends.,SenFeinstein,Dianne Feinstein,California,Democratic
813,Thu Nov 24 16:32:00 +0000 2016,8.01826E+17,2,12,Avoid under cooking your Turkey today. Follow these @USDA tips: https://t.co/a7GocyjXm8 https://t.co/2qY8jUYKT5,SenFeinstein,Dianne Feinstein,California,Democratic
814,Wed Nov 23 23:49:01 +0000 2016,8.01573E+17,7,22,Unsafe handling of turkey and poultry can be dangerous. Be sure to read these helpful tips from @USDA:… https://t.co/jyYND3HMQ2,SenFeinstein,Dianne Feinstein,California,Democratic
815,Wed Nov 23 18:06:20 +0000 2016,8.01487E+17,12,21,Fire season will be far more destructive if we fail to remove 100 million dead trees in California. We must act now: https://t.co/jmRVTrIwxc,SenFeinstein,Dianne Feinstein,California,Democratic
816,Wed Nov 23 17:27:35 +0000 2016,8.01477E+17,35,129,I believe the Affordable Care Act matters because insurers can no longer deny coverage based on pre-existing condit… https://t.co/3JORPkMPXr,SenFeinstein,Dianne Feinstein,California,Democratic
817,Tue Nov 22 16:13:19 +0000 2016,8.01096E+17,6,18,Open enrollment is here! Quality health care #CoverageMatters. View your options from @CoveredCA: https://t.co/iZuHrUsWJJ,SenFeinstein,Dianne Feinstein,California,Democratic
818,Mon Nov 21 20:33:03 +0000 2016,8.00799E+17,2,16,(2/2) @PattyMurray and I proudly support their efforts—responses we've received from U.S. Soccer Federation don't justify pay disparities.,SenFeinstein,Dianne Feinstein,California,Democratic
819,Mon Nov 21 20:32:23 +0000 2016,8.00799E+17,18,44,(1/2) @60Minutes spoke w/ @CarliLloyd &amp; her teammates on efforts to ensure U.S. women’s soccer team is paid fairly. https://t.co/B7st12wdzW,SenFeinstein,Dianne Feinstein,California,Democratic
820,Sat Nov 19 18:32:01 +0000 2016,8.00044E+17,6,68,"Nearly 108,000 U.S. foster children are eligible to be adopted and are waiting for a family. https://t.co/S6eLcGfxpr #NationalAdoptionDay",SenFeinstein,Dianne Feinstein,California,Democratic
821,Fri Nov 18 22:09:39 +0000 2016,7.99736E+17,11,10,(2/2) I will continue to push for more federal funding to remove the trees that pose the biggest threat to Californians and their homes.,SenFeinstein,Dianne Feinstein,California,Democratic
822,Fri Nov 18 22:09:01 +0000 2016,7.99736E+17,5,13,(1/2) U.S. @ForestService has identified an additional 36 million dead trees in California—100 million total. https://t.co/OiAx9SZkWP,SenFeinstein,Dianne Feinstein,California,Democratic
823,Fri Nov 18 21:40:10 +0000 2016,7.99729E+17,12,31,Looking forward to working with you to #StopSexTrafficking. A vital issue to Californians and all Americans. https://t.co/BBdRpkPnxY,SenFeinstein,Dianne Feinstein,California,Democratic
824,Fri Nov 18 17:12:47 +0000 2016,7.99662E+17,46,70,.@TheJusticeDept upholds all laws &amp; protects all Americans. Atty gen nominee Sessions will be intensely scrutinized. https://t.co/pISwETSxHx,SenFeinstein,Dianne Feinstein,California,Democratic
825,Thu Nov 17 21:54:37 +0000 2016,7.9937E+17,6,19,"(2/2) Our bill guarantees that even under a new administration, claw backs of National Guard bonuses will stop. https://t.co/ZFJdqQdMKK",SenFeinstein,Dianne Feinstein,California,Democratic
826,Thu Nov 17 21:54:06 +0000 2016,7.9937E+17,8,38,(1/2) Working with @SenatorBoxer and @RepAdamSchiff to ensure National Guard service members keep the bonuses and benefits they’ve earned.,SenFeinstein,Dianne Feinstein,California,Democratic
827,Thu Nov 17 21:03:07 +0000 2016,7.99357E+17,2,14,(3/3) My op-ed outlines what we’ve accomplished and where we can go from here to combat sex trafficking. https://t.co/hGR8I6gEkp,SenFeinstein,Dianne Feinstein,California,Democratic
828,Thu Nov 17 21:01:55 +0000 2016,7.99357E+17,2,16,"(2/3) This policy would be in line with Alameda County, which has cracked down on sex trafficking under @NancyOMalley’s leadership.",SenFeinstein,Dianne Feinstein,California,Democratic
829,Thu Nov 17 21:00:47 +0000 2016,7.99357E+17,5,24,(1/3) Encouraged that @SFPD is considering changing protocols in order to deter individuals from purchasing sex from trafficking victims.,SenFeinstein,Dianne Feinstein,California,Democratic
830,Thu Nov 17 17:07:01 +0000 2016,7.99298E+17,5,13,Antibiotic prescribing guidelines must be closely followed—too many instances of other circumstances influencing de… https://t.co/1WsUVP9Pku,SenFeinstein,Dianne Feinstein,California,Democratic
831,Wed Nov 16 22:55:18 +0000 2016,7.99023E+17,16,59,"Important discussion today with Arturo Rodriguez of United Farm Workers on protecting children, minorities &amp; immigr… https://t.co/5zT1rWChm2",SenFeinstein,Dianne Feinstein,California,Democratic
832,Wed Nov 16 19:29:26 +0000 2016,7.98971E+17,7,36,"(2/2) A recent Bay Area operation led to the rescue of nine victims—14 buyers, 83 traffickers arrested. #StopSexTrafficking",SenFeinstein,Dianne Feinstein,California,Democratic
833,Wed Nov 16 19:28:50 +0000 2016,7.98971E+17,4,32,"(1/2) We’ve seen successful local, state and federal coordination. Let’s keep it up. My #StopSexTrafficking op-ed: https://t.co/hGR8I6gEkp",SenFeinstein,Dianne Feinstein,California,Democratic
834,Wed Nov 16 18:30:01 +0000 2016,7.98956E+17,9,37,Israel should reject a bill to retroactively legalize settlements on private Palestinian land in the West Bank. https://t.co/ptyXpocjXh,SenFeinstein,Dianne Feinstein,California,Democratic
835,Wed Nov 16 18:03:01 +0000 2016,7.9895E+17,5,30,Many common illnesses do not require antibiotics—avoiding unnecessary use is key to preserving efficacy for years t… https://t.co/e7prec7loB,SenFeinstein,Dianne Feinstein,California,Democratic
836,Wed Nov 16 17:01:05 +0000 2016,7.98934E+17,2,17,"Very real consequences to antibiotic resistance—more than 2 million illnesses, 23,000 deaths. #AntibioticSmart… https://t.co/HA6jNrYZvl",SenFeinstein,Dianne Feinstein,California,Democratic
837,Wed Nov 16 15:50:52 +0000 2016,7.98916E+17,37,121,It’s an honor &amp; a privilege to follow in @SenatorLeahy’s footsteps and become Ranking Member of the Judiciary Cmte. https://t.co/PoRLjKFx89,SenFeinstein,Dianne Feinstein,California,Democratic
838,Tue Nov 15 21:56:39 +0000 2016,7.98646E+17,137,643,Someone known for belittling minorities and women has no place advising the president. My statement on Steve Bannon: https://t.co/7iC7IbvGtd,SenFeinstein,Dianne Feinstein,California,Democratic
839,Tue Nov 15 21:18:09 +0000 2016,7.98636E+17,10,25,"(3/3) I’ve made it one of my top priorities to #StopSexTrafficking and we’ve taken major steps recently. However, plenty of work remains.",SenFeinstein,Dianne Feinstein,California,Democratic
840,Tue Nov 15 21:17:38 +0000 2016,7.98636E+17,7,26,(2/3) Sex trafficking is a $100 billion industry worldwide—victims are as young as 11 or 12 years old. #StopSexTrafficking,SenFeinstein,Dianne Feinstein,California,Democratic
841,Tue Nov 15 21:17:11 +0000 2016,7.98636E+17,7,34,(1/3) Victims of sex trafficking face unspeakable horrors. Read my op-ed on what we can do to #StopSexTrafficking: https://t.co/hGR8I6gEkp,SenFeinstein,Dianne Feinstein,California,Democratic
842,Tue Nov 15 20:25:00 +0000 2016,7.98623E+17,7,25,Let’s each do our part to keep America beautiful. Find information and events near you for #AmericaRecyclesDay:… https://t.co/L3hv3ebTOv,SenFeinstein,Dianne Feinstein,California,Democratic
843,Tue Nov 15 19:04:01 +0000 2016,7.98602E+17,3,8,Doctors play an important role and must be responsible when prescribing antibiotics. #AntibioticSmart… https://t.co/7YzpdHKIeN,SenFeinstein,Dianne Feinstein,California,Democratic
844,Tue Nov 15 17:19:59 +0000 2016,7.98576E+17,9,32,This week let’s get smart about antibiotic use. Preserving efficacy is vital to U.S. public health.… https://t.co/hV9nIcgfxs,SenFeinstein,Dianne Feinstein,California,Democratic
845,Mon Nov 14 21:35:59 +0000 2016,7.98278E+17,4,4,"(2/2) A 20-year vet, Wallace was a vital part of the Stanislaus County community. My thoughts are with his family and colleagues.",SenFeinstein,Dianne Feinstein,California,Democratic
846,Mon Nov 14 21:35:28 +0000 2016,7.98278E+17,7,12,"(1/2) I’m mourning the death of Stanislaus County sheriff’s Deputy Dennis Wallace, killed Sunday in the line of duty https://t.co/bKw4cHyjGg",SenFeinstein,Dianne Feinstein,California,Democratic
847,Mon Nov 14 19:24:14 +0000 2016,7.98245E+17,10,129,Gwen Ifill was an outstanding journalist who reported with courage and integrity. We will all miss her.,SenFeinstein,Dianne Feinstein,California,Democratic
848,Fri Nov 11 16:50:01 +0000 2016,7.97119E+17,26,59,Today we honor the service and sacrifice of the brave Americans who served and defended our nation. Happy Veterans… https://t.co/M7XAdHd2Kk,SenFeinstein,Dianne Feinstein,California,Democratic
849,Thu Nov 10 23:12:00 +0000 2016,7.96853E+17,8,23,"The Marine Corps legacy is truly special. Today we celebrate 241 years of valor, distinction and excellence. @USMC https://t.co/yLiQXNtCHl",SenFeinstein,Dianne Feinstein,California,Democratic
850,Thu Nov 10 20:51:44 +0000 2016,7.96818E+17,3,14,Critical infrastructure is essential—its security and resilience is vital to American prosperity and well-being.… https://t.co/YFENSEKXaI,SenFeinstein,Dianne Feinstein,California,Democratic
851,Tue Nov 08 22:17:29 +0000 2016,7.96114E+17,17,18,Janet Reno combined an expertise in criminal justice with an independent mind. My statement on her passing: https://t.co/99l4WOB574,SenFeinstein,Dianne Feinstein,California,Democratic
852,Tue Nov 08 19:21:39 +0000 2016,7.9607E+17,15,60,"If you have not mailed your ballot, it must be postmarked today. You may also drop it off at your polling location. https://t.co/vLmyurwbly",SenFeinstein,Dianne Feinstein,California,Democratic
853,Tue Nov 08 19:20:18 +0000 2016,7.9607E+17,6,42,The polls in California are open until 8 p.m. Find your polling station here: https://t.co/Ff4s5wBEuH,SenFeinstein,Dianne Feinstein,California,Democratic
854,Mon Nov 07 20:46:10 +0000 2016,7.95729E+17,14,94,"As our nation’s first female attorney general, Janet Reno lived her life with integrity and resolve—a true trailblazer. She will be missed.",SenFeinstein,Dianne Feinstein,California,Democratic
855,Fri Nov 04 20:00:11 +0000 2016,7.9463E+17,6,4,"(3/3) Thank you Anne Miskey, Supervisor @mridleythomas and First Lady Amy Wakeland for a productive discussion. https://t.co/OmpwvtG9O2",SenFeinstein,Dianne Feinstein,California,Democratic
856,Fri Nov 04 19:57:37 +0000 2016,7.9463E+17,4,9,"(2/3) I spoke with Yvonne, a formerly homeless veteran. Her strength was inspiring. https://t.co/gcF4v4yfTb @DWCweb https://t.co/qtsrPx8ePn",SenFeinstein,Dianne Feinstein,California,Democratic
857,Fri Nov 04 19:55:25 +0000 2016,7.94629E+17,9,24,"(1/3) Yesterday, I joined Supervisor Ridley-Thomas to learn more about efforts to combat homelessness in Los Angele… https://t.co/4Q7d2fdBVt",SenFeinstein,Dianne Feinstein,California,Democratic
858,Fri Nov 04 16:22:49 +0000 2016,7.94576E+17,1,29,(2/2) Average hourly earnings are up 2.8% this year—most rapid one year gain since 2009. Let’s keep up the momentum… https://t.co/MGw8atNMxV,SenFeinstein,Dianne Feinstein,California,Democratic
859,Fri Nov 04 16:21:35 +0000 2016,7.94575E+17,22,99,"(1/2) Great news: The U.S. economy continues to show it’s strength—161,000 jobs created in October, jobless rate fa… https://t.co/LPkP8j0eJK",SenFeinstein,Dianne Feinstein,California,Democratic
860,Wed Nov 02 18:39:58 +0000 2016,7.93885E+17,8,12,"For #MilitaryFamilyMonth, we honor those who show unwavering devotion to their loved ones in the armed forces. https://t.co/gx15ClPTnm",SenFeinstein,Dianne Feinstein,California,Democratic
861,Tue Nov 01 21:11:20 +0000 2016,7.93561E+17,16,7,Today is the first day of open enrollment under the Affordable Care Act. Visit https://t.co/iZuHrUsWJJ to #GetCovered.@CoveredCA,SenFeinstein,Dianne Feinstein,California,Democratic
862,Tue Nov 01 18:49:17 +0000 2016,7.93525E+17,8,25,(3/3) The Paycheck Fairness Act would go a long way toward closing the wage gap. Congress should pass this bill. #LatinaEqualPay,SenFeinstein,Dianne Feinstein,California,Democratic
