,created_at,id_str,reply_count,retweet_count,text,user,name,state,party
1511,Fri Apr 15 18:35:23 +0000 2016,7.21044E+17,7,12,(1/3) This week we turn our attention to the rights of those victimized by crime. I believe it’s vital to do all we can for these Americans.,SenFeinstein,Dianne Feinstein,California,Democratic
1512,Thu Apr 14 20:44:15 +0000 2016,7.20714E+17,4,23,There’s nothing quite like a desert sunset. Thank you @AppleValleyCA for your continued effort to #ProtectCADesert. https://t.co/Zk3Vdw3CBZ,SenFeinstein,Dianne Feinstein,California,Democratic
1513,Thu Apr 14 17:02:28 +0000 2016,7.20658E+17,8,42,Important discussion this morning on #EqualPay with Patricia Arquette. Many thanks for stopping by! @PattyArquette https://t.co/YRQoAle5fS,SenFeinstein,Dianne Feinstein,California,Democratic
1514,Thu Apr 14 15:10:37 +0000 2016,7.2063E+17,3,13,"Proud of our @Warriors, whose 73rd win is the most ever in a season! Next step, keep that championship trophy in the Golden State!",SenFeinstein,Dianne Feinstein,California,Democratic
1515,Wed Apr 13 20:00:59 +0000 2016,7.20341E+17,3,8,"(5/5) The Senate should act on the Personal Care Product Safety Act, which would ensure #SafeProducts for Americans and their families.",SenFeinstein,Dianne Feinstein,California,Democratic
1516,Wed Apr 13 20:00:40 +0000 2016,7.20341E+17,3,6,(4/5) @US_FDA may determine that chemicals that are OK for adults are not OK for children. #SafeProducts https://t.co/Y6bnGkbyGS,SenFeinstein,Dianne Feinstein,California,Democratic
1517,Wed Apr 13 20:00:02 +0000 2016,7.20341E+17,1,4,(3/5) Children absorb chemicals at a much higher rate than adults. That's why we need chemical review. #SafeProducts https://t.co/hNhUjbItkV,SenFeinstein,Dianne Feinstein,California,Democratic
1518,Wed Apr 13 19:58:54 +0000 2016,7.20341E+17,1,2,"(2/5) Just like other children’s items, ingredients in personal care products should be independently evaluated for safety. #SafeProducts",SenFeinstein,Dianne Feinstein,California,Democratic
1519,Wed Apr 13 19:58:29 +0000 2016,7.2034E+17,3,4,(1/5) @_CaliforniaBaby CEO Jessica Iclisoy and I wrote an op-ed on the need to ensure safe children's products. https://t.co/RxXlmipLts,SenFeinstein,Dianne Feinstein,California,Democratic
1520,Wed Apr 13 18:33:52 +0000 2016,7.20319E+17,8,2,White House Science Fair is happening now. Great projects by some of America’s brightest young minds! https://t.co/MQAOdjJcSv #WHScienceFair,SenFeinstein,Dianne Feinstein,California,Democratic
1521,Wed Apr 13 16:12:11 +0000 2016,7.20283E+17,10,8,"160 Californians joined me for breakfast in DC to talk about today’s most vital issues. Thanks for coming, everyone! https://t.co/i8QnNLfKB3",SenFeinstein,Dianne Feinstein,California,Democratic
1522,Tue Apr 12 20:05:36 +0000 2016,7.1998E+17,10,29,The Paycheck Fairness Act ends the secrecy that contributes to the gender wage gap. #EqualPayDay https://t.co/JCFWhavEzZ,SenFeinstein,Dianne Feinstein,California,Democratic
1523,Tue Apr 12 19:32:38 +0000 2016,7.19972E+17,32,128,"The U.S. women’s soccer team is one of the world’s best, but they’re paid 60% less than the men’s team. #EqualPayDay https://t.co/ANkZFyQMai",SenFeinstein,Dianne Feinstein,California,Democratic
1524,Tue Apr 12 18:55:48 +0000 2016,7.19962E+17,5,20,The wage gap persists when women perform the same job with the same level of education. #EqualPayDay https://t.co/p2pD6h3sG0,SenFeinstein,Dianne Feinstein,California,Democratic
1525,Tue Apr 12 18:27:50 +0000 2016,7.19955E+17,6,13,The gender wage gap hurts California women and families. The facts speak for themselves: https://t.co/nm0OKbZFLg #EqualPayDay,SenFeinstein,Dianne Feinstein,California,Democratic
1526,Tue Apr 12 18:10:36 +0000 2016,7.19951E+17,6,25,"It’s better than the national average, but California’s wage gap is still a staggering $8,053. #EqualPayDay https://t.co/V9tggron6R",SenFeinstein,Dianne Feinstein,California,Democratic
1527,Tue Apr 12 16:34:49 +0000 2016,7.19927E+17,28,115,"Gender wage gap spans all races, ethnicities. I’m committed to #EqualPay and closing the gap for good. #EqualPayDay https://t.co/ZEis8uLuar",SenFeinstein,Dianne Feinstein,California,Democratic
1528,Tue Apr 12 14:25:31 +0000 2016,7.19894E+17,0,20,The Belmont-Paul Women's Equality National Monument commemorates the many women who fought for equality https://t.co/KBRJQGF0lJ #EqualPayDay,SenFeinstein,Dianne Feinstein,California,Democratic
1529,Mon Apr 11 21:19:19 +0000 2016,7.19636E+17,14,59,I believe Merrick Garland is a supremely qualified candidate who deserves full Senate consideration for #SCOTUS. https://t.co/ZzeZIEX2OJ,SenFeinstein,Dianne Feinstein,California,Democratic
1530,Fri Apr 08 20:57:28 +0000 2016,7.18543E+17,8,7,(2/2) Our amendment allows flexibility for states/cities and their unique challenges. https://t.co/ISNUm229qf @SenThomTillis @SenBlumenthal,SenFeinstein,Dianne Feinstein,California,Democratic
1531,Fri Apr 08 20:53:12 +0000 2016,7.18542E+17,40,13,"(1/2) We need tough federal standards for hobby drones, but states &amp; cities should also be able to make their own stricter rules #SafeDrones",SenFeinstein,Dianne Feinstein,California,Democratic
1532,Fri Apr 08 19:01:20 +0000 2016,7.18514E+17,5,47,(2/2) Garland served his country following a devastating terrorist attack. He deserves consideration. #SCOTUS https://t.co/WDQqpBpNJ0,SenFeinstein,Dianne Feinstein,California,Democratic
1533,Fri Apr 08 19:00:36 +0000 2016,7.18514E+17,2,35,(1/2) Merrick Garland's conduct after Oklahoma City shows his qualifications. Read my @USATODAY op-ed. https://t.co/EpK4YxswfU #SCOTUS,SenFeinstein,Dianne Feinstein,California,Democratic
1534,Thu Apr 07 21:11:10 +0000 2016,7.18184E+17,8,5,"For today’s #WorldHealthDay, I’m joining the call—let’s work together to halt the rise in global diabetes rates. https://t.co/IwVsVUGuKs",SenFeinstein,Dianne Feinstein,California,Democratic
1535,Thu Apr 07 19:30:31 +0000 2016,7.18159E+17,4,15,Spoke with the press about my meeting with #SCOTUS nominee Merrick Garland yesterday. Watch here: https://t.co/70np54gH2g #DoYourJob,SenFeinstein,Dianne Feinstein,California,Democratic
1536,Wed Apr 06 21:49:26 +0000 2016,7.17832E+17,24,95,I sat down w/ Merrick Garland today. He has a thorough understanding of law &amp; would be a reasoned voice on #SCOTUS. https://t.co/1S0mJe6isS,SenFeinstein,Dianne Feinstein,California,Democratic
1537,Wed Apr 06 21:32:40 +0000 2016,7.17827E+17,18,58,Astounding that in 2016 the wage gap between men and women is so high. It’s time we do more for #PaycheckFairness. https://t.co/O3cvcZc95s,SenFeinstein,Dianne Feinstein,California,Democratic
1538,Wed Apr 06 18:38:56 +0000 2016,7.17784E+17,8,14,(2/2) Let’s do all we can to end #Alzheimers once and for all. I’m proud to support research funding to combat this terrible condition.,SenFeinstein,Dianne Feinstein,California,Democratic
1539,Wed Apr 06 18:38:30 +0000 2016,7.17784E+17,1,36,(1/2) The numbers are staggering. More than 5 million Americans live with #Alzheimers. #EndAlz https://t.co/vpuOtfPfQV,SenFeinstein,Dianne Feinstein,California,Democratic
1540,Tue Apr 05 21:28:19 +0000 2016,7.17464E+17,13,45,"I’m meeting tomorrow with Merrick Garland, the president’s #SCOTUS nominee. Looking forward to the discussion. #DoYourJob",SenFeinstein,Dianne Feinstein,California,Democratic
1541,Tue Apr 05 20:58:04 +0000 2016,7.17456E+17,1,11,Learn more about the Personal Care Products Safety Act here: https://t.co/yFAQCIzBQN #SafeProducts https://t.co/xXRUde8oPX,SenFeinstein,Dianne Feinstein,California,Democratic
1542,Tue Apr 05 20:57:05 +0000 2016,7.17456E+17,18,15,The Personal Care Products Safety Act would finally give @US_FDA the authority to review ingredients. https://t.co/qmyBGBj6oZ #SafeProducts,SenFeinstein,Dianne Feinstein,California,Democratic
1543,Tue Apr 05 20:23:43 +0000 2016,7.17448E+17,8,10,Senator Burr and I had a productive meeting today with Qatari Foreign Minister Al-Thani and Ambassador Al Kuwari. https://t.co/aObqgAvcnc,SenFeinstein,Dianne Feinstein,California,Democratic
1544,Tue Apr 05 19:36:03 +0000 2016,7.17436E+17,0,9,Our skin is our largest organ and it absorbs many chemicals in these products. Independent evaluation is needed. https://t.co/yjQz90zTf9,SenFeinstein,Dianne Feinstein,California,Democratic
1545,Tue Apr 05 19:35:14 +0000 2016,7.17435E+17,2,40,We need a uniform safety standard for personal care products. Read my @TIME op-ed w/ Ken Cook @EWGPrez https://t.co/qmyBGBj6oZ #SafeProducts,SenFeinstein,Dianne Feinstein,California,Democratic
1546,Tue Apr 05 18:06:07 +0000 2016,7.17413E+17,2,4,"(2/2) In Feb., colleagues and I urged @USTreasury to take action against corporate inversions. That letter is here: https://t.co/cNaQ3Lczsm",SenFeinstein,Dianne Feinstein,California,Democratic
1547,Tue Apr 05 18:05:32 +0000 2016,7.17413E+17,5,12,(1/2) @USTreasury is cracking down on tax avoidance strategies used by U.S. companies. Good move. https://t.co/U5qumqDfbH,SenFeinstein,Dianne Feinstein,California,Democratic
1548,Tue Apr 05 16:23:01 +0000 2016,7.17387E+17,4,3,(2/2) We should be doing all we can to protect the intellectual property of American businesses. I’m hopeful the House will act on the bill.,SenFeinstein,Dianne Feinstein,California,Democratic
1549,Tue Apr 05 16:22:35 +0000 2016,7.17387E+17,3,11,"(1/2) Good news: Yesterday afternoon, the Senate unanimously passed our bill, the Defend Trade Secrets Act. https://t.co/sEli49Hvg5",SenFeinstein,Dianne Feinstein,California,Democratic
1550,Mon Apr 04 21:09:09 +0000 2016,7.17097E+17,15,27,California and @JerryBrownGov took a strong step today to help the state’s workforce. https://t.co/uEdKLa1jpG,SenFeinstein,Dianne Feinstein,California,Democratic
1551,Mon Apr 04 20:05:06 +0000 2016,7.17081E+17,3,11,Grim warning from San Diego Union-Tribune on perils of a deadlocked #SCOTUS. https://t.co/FTvRpSEbha #DoYourJob https://t.co/2ZkHT1c3Xi,SenFeinstein,Dianne Feinstein,California,Democratic
1552,Fri Apr 01 16:24:03 +0000 2016,7.15938E+17,13,78,Positive jobs report this morning. 73 straight months of private-sector job growth—14.4 million created in that time https://t.co/S011wAtlhx,SenFeinstein,Dianne Feinstein,California,Democratic
1553,Thu Mar 31 19:31:11 +0000 2016,7.15622E+17,12,34,(2/2) Political attacks against Planned Parenthood must stop. It is a trusted health care provider that serves all in need of care.,SenFeinstein,Dianne Feinstein,California,Democratic
1554,Thu Mar 31 19:29:53 +0000 2016,7.15622E+17,10,42,"(1/2) Without Planned Parenthood, millions of low-income women wouldn't have access to basic health care. #StandWithPP",SenFeinstein,Dianne Feinstein,California,Democratic
1555,Thu Mar 31 17:46:05 +0000 2016,7.15596E+17,4,120,"On #CesarChavez day, we remember his ability to organize people to fight for much needed change in our country. https://t.co/EtvTJrFvWS",SenFeinstein,Dianne Feinstein,California,Democratic
1556,Wed Mar 30 19:51:02 +0000 2016,7.15265E+17,3,14,This month we celebrate the everyday heroes at the American @RedCross. They do so much to help save lives. https://t.co/Kjjtiis6oa,SenFeinstein,Dianne Feinstein,California,Democratic
1557,Tue Mar 29 20:50:58 +0000 2016,7.14918E+17,7,14,(3/3) This crisis requires a comprehensive response. We must prevent prescription drug abuse and expand access to treatment. #RxSummit,SenFeinstein,Dianne Feinstein,California,Democratic
1558,Tue Mar 29 20:50:09 +0000 2016,7.14918E+17,2,11,(2/3) It’s not a coincidence that prescription overdose deaths quadrupled during the same period that prescriptions quadrupled. #RxSummit,SenFeinstein,Dianne Feinstein,California,Democratic
1559,Tue Mar 29 20:48:40 +0000 2016,7.14917E+17,7,16,(1/3) Opioid addiction is an epidemic in this country. @WhiteHouse today announced new steps to combat it. https://t.co/d6uDFnyIPt #RxSummit,SenFeinstein,Dianne Feinstein,California,Democratic
1560,Tue Mar 29 18:22:34 +0000 2016,7.1488E+17,5,11,.@SacBeeEditBoard says Republican senators should meet with @SCOTUSnom and hold hearings. https://t.co/rUY3wXXhF4 https://t.co/BLZHrFQH6T,SenFeinstein,Dianne Feinstein,California,Democratic
1561,Mon Mar 28 17:10:35 +0000 2016,7.145E+17,17,12,(2 of 2) We can and we must work together to defeat the scourge of terrorism.  We’ll stand strong in the face of this evil.,SenFeinstein,Dianne Feinstein,California,Democratic
1562,Mon Mar 28 17:10:16 +0000 2016,7.145E+17,7,43,"My thoughts are with the victims of the terror attack in Lahore.  To see so many dead, especially children, is heartbreaking.  (1 of 2)",SenFeinstein,Dianne Feinstein,California,Democratic
1563,Sun Mar 27 18:20:15 +0000 2016,7.14155E+17,6,10,"Wishing a wonderful day to those celebrating Easter in California, the U.S. and around the world!",SenFeinstein,Dianne Feinstein,California,Democratic
1564,Fri Mar 25 14:32:37 +0000 2016,7.13373E+17,14,21,Santa Rosa Press Democrat says Senate must fulfill constitutional duty on #SCOTUS. https://t.co/QXG0kmpZjT https://t.co/13oHO8SVLt,SenFeinstein,Dianne Feinstein,California,Democratic
1565,Thu Mar 24 19:17:15 +0000 2016,7.13082E+17,9,23,"Ventura Country Star calls Judge Garland ""eminently qualified"" for #SCOTUS. https://t.co/q4Y2kKCMFI #DoYourJob https://t.co/vWRhwiKZpG",SenFeinstein,Dianne Feinstein,California,Democratic
1566,Wed Mar 23 19:57:50 +0000 2016,7.1273E+17,41,48,Affordable Care Act has increased the number of Americans with health coverage to an all-time high. #ACAanniversary https://t.co/kxgALx0Wim,SenFeinstein,Dianne Feinstein,California,Democratic
1567,Wed Mar 23 17:58:00 +0000 2016,7.127E+17,18,36,"Today marks the 6th anniversary of the Affordable Care Act, which has provided millions with health coverage. https://t.co/2njFkMeBfG",SenFeinstein,Dianne Feinstein,California,Democratic
1568,Wed Mar 23 16:25:39 +0000 2016,7.12677E+17,5,13,San Jose Mercury News editorial urges #SCOTUS confirmation. https://t.co/scYfFLIFEI #DoYourJob https://t.co/d6bnLBDla2,SenFeinstein,Dianne Feinstein,California,Democratic
1569,Wed Mar 23 15:15:19 +0000 2016,7.12659E+17,11,45,"Contraception is basic health care for women. It is vital that all women have access, just as Congress intended. #SCOTUS",SenFeinstein,Dianne Feinstein,California,Democratic
1570,Tue Mar 22 15:26:36 +0000 2016,7.12299E+17,13,11,(3/3) I refuse to accept this as the ‘new normal.’ The way to prevent attacks like this is good intelligence and always staying vigilant.,SenFeinstein,Dianne Feinstein,California,Democratic
1571,Tue Mar 22 15:26:03 +0000 2016,7.12299E+17,2,14,"(2/3) Today, as on all days, we stand in solidarity with Belgium and our allies in fighting terrorism. My statement: https://t.co/N2AEYKZB0B",SenFeinstein,Dianne Feinstein,California,Democratic
1572,Tue Mar 22 15:25:31 +0000 2016,7.12299E+17,3,15,(1/3) My thoughts are with the victims and the people of Belgium following the horrific terrorist attacks in Brussels.,SenFeinstein,Dianne Feinstein,California,Democratic
1573,Mon Mar 21 21:31:33 +0000 2016,7.12029E+17,1,6,Our drone legislation aims to prevent these close calls. Read more about it here: https://t.co/ysfsYdXOVs #SafeDrones,SenFeinstein,Dianne Feinstein,California,Democratic
1574,Mon Mar 21 21:31:01 +0000 2016,7.12029E+17,4,14,Yet another instance of a recreational drone coming too close to a passenger plane at LAX—disaster narrowly avoided. https://t.co/3dMykMwwuR,SenFeinstein,Dianne Feinstein,California,Democratic
1575,Mon Mar 21 16:36:56 +0000 2016,7.11955E+17,13,45,.@LATimesOpinion says Republican obstruction on @SCOTUSnom is “dangerous.” https://t.co/aBUVaMa1mv #DoYourJob https://t.co/G9lmwGpZ1U,SenFeinstein,Dianne Feinstein,California,Democratic
1576,Fri Mar 18 20:24:33 +0000 2016,7.10925E+17,13,13,(2/2) Everyone must do their part to ensure that the water problems seen in Flint do not occur in another community.,SenFeinstein,Dianne Feinstein,California,Democratic
1577,Fri Mar 18 20:23:57 +0000 2016,7.10925E+17,10,16,(1/2) I’m joining with 17 senators to call for a boost in water infrastructure investments. https://t.co/wfkLNJi3EP,SenFeinstein,Dianne Feinstein,California,Democratic
1578,Fri Mar 18 17:32:28 +0000 2016,7.10882E+17,8,27,"Make no mistake, Merrick Garland is exceptionally qualified. I talked about the #SCOTUS vacancy in Judiciary Cmte: https://t.co/6zLoNGjKVJ",SenFeinstein,Dianne Feinstein,California,Democratic
1579,Fri Mar 18 15:33:00 +0000 2016,7.10852E+17,43,119,Americans agree: Senate Republicans should offer fair consideration for Judge Merrick Garland’s #SCOTUS nomination. https://t.co/iWSgzSGt82,SenFeinstein,Dianne Feinstein,California,Democratic
1580,Thu Mar 17 17:35:23 +0000 2016,7.1052E+17,16,17,A nominee as qualified as Judge Garland should not be subject to politics—Republicans must do the job for which they were elected. #SCOTUS,SenFeinstein,Dianne Feinstein,California,Democratic
1581,Thu Mar 17 17:34:49 +0000 2016,7.1052E+17,6,28,I spoke this morning in the Judiciary Committee urging the Senate to act on #SCOTUS nominee Merrick Garland: https://t.co/wSxP8A2B5y,SenFeinstein,Dianne Feinstein,California,Democratic
1582,Thu Mar 17 16:08:04 +0000 2016,7.10498E+17,7,8,Happy St. Patrick’s Day! I have fond memories of my 1985 visit with Dublin’s Lord Mayor Jim Tunney. #TBT https://t.co/CTMru0equ3,SenFeinstein,Dianne Feinstein,California,Democratic
1583,Thu Mar 17 15:04:05 +0000 2016,7.10482E+17,4,36,(4/4) @SeaWorld and the @HumaneSociety will also be working together to combat illegal fishing and improve the health of oceans. Great news!,SenFeinstein,Dianne Feinstein,California,Democratic
1584,Thu Mar 17 15:03:27 +0000 2016,7.10482E+17,7,54,(3/4) Orcas are highly intelligent and social animals. I strongly believe this is the right thing to do. #SeaWorld,SenFeinstein,Dianne Feinstein,California,Democratic
1585,Thu Mar 17 15:02:47 +0000 2016,7.10482E+17,6,58,(2/4) Today's announcement means the generation of orcas currently in captivity in the United States will be the last. #SeaWorld,SenFeinstein,Dianne Feinstein,California,Democratic
1586,Thu Mar 17 15:02:23 +0000 2016,7.10481E+17,3,64,(1/4) @SeaWorld has made the right decision to end captive breeding and cease its use of orcas in shows. https://t.co/5VguWC91ch,SenFeinstein,Dianne Feinstein,California,Democratic
1587,Wed Mar 16 19:01:20 +0000 2016,7.10179E+17,8,34,(3/3) @TheJusticeDept has the authority to go after the owners of these websites. Read my @NYTopinion letter. https://t.co/gyS3pd8l9Z,SenFeinstein,Dianne Feinstein,California,Democratic
1588,Wed Mar 16 19:00:03 +0000 2016,7.10179E+17,4,30,(2/3) @NickKristof is right. We simply can't look the other way when we know these sites are being used to sell young victims for sex.,SenFeinstein,Dianne Feinstein,California,Democratic
1589,Wed Mar 16 18:59:22 +0000 2016,7.10179E+17,4,28,(1/3) @NickKristof last week wrote about how websites like Backpage facilitate the trafficking of young victims. https://t.co/HuYQflvW2E,SenFeinstein,Dianne Feinstein,California,Democratic
1590,Wed Mar 16 16:53:29 +0000 2016,7.10147E+17,2,2,".@CDCgov guidelines help doctors determine whether patients should start or continue opioid treatment, as well as info on dosing, follow-up.",SenFeinstein,Dianne Feinstein,California,Democratic
1591,Wed Mar 16 16:52:39 +0000 2016,7.10147E+17,3,5,"Opioid abuse is an epidemic. In too many cases, doctors prescribe opioids, even when there are other options. @CDCgov",SenFeinstein,Dianne Feinstein,California,Democratic
1592,Wed Mar 16 16:51:59 +0000 2016,7.10147E+17,3,7,New CDC opioid prescriber guidelines are the first step toward stopping overuse. My statement: https://t.co/khW1ocrT5k @CDCgov,SenFeinstein,Dianne Feinstein,California,Democratic
1593,Wed Mar 16 15:37:24 +0000 2016,7.10128E+17,6,48,"(3 of 3) President did his job, now it’s Judiciary Committee’s turn. I look forward to meeting with Judge Garland and reviewing his record.",SenFeinstein,Dianne Feinstein,California,Democratic
1594,Wed Mar 16 15:36:51 +0000 2016,7.10128E+17,2,33,(2 of 3) Judge Garland has a strong record. Supervised Unabmober and Oklahoma City bomber prosecutions and clerked for Justice Brennan.,SenFeinstein,Dianne Feinstein,California,Democratic
1595,Wed Mar 16 15:36:16 +0000 2016,7.10128E+17,5,43,"(1 of 3) In nominating Merrick Garland for #SCOTUS, the president chose a distinguished judge spoken highly of by senators in both parties.",SenFeinstein,Dianne Feinstein,California,Democratic
1596,Tue Mar 15 22:01:08 +0000 2016,7.09862E+17,8,26,Senate Republicans refusal to hold hearings &amp; consider a #SCOTUS nominee is purely political—I call on them to rethink their obstructionism.,SenFeinstein,Dianne Feinstein,California,Democratic
1597,Tue Mar 15 21:59:23 +0000 2016,7.09862E+17,10,35,#SCOTUS can’t function properly with just 8 justices. Watch my Senate speech about the danger of a deadlocked court. https://t.co/EqVj2T0kRm,SenFeinstein,Dianne Feinstein,California,Democratic
1598,Tue Mar 15 18:50:10 +0000 2016,7.09814E+17,5,6,"Thrilled to have the support of @BaboBotanicals, @DrBronner &amp; @MamaMelinda in our effort to ensure #SafeProducts. https://t.co/4K3gkbbMtd",SenFeinstein,Dianne Feinstein,California,Democratic
1599,Tue Mar 15 18:49:35 +0000 2016,7.09814E+17,5,17,"Everyone uses personal care products like lotion and shampoo, but rules to ensure they’re safe are nearly 80 years old. #SafeProducts",SenFeinstein,Dianne Feinstein,California,Democratic
1600,Mon Mar 14 22:08:44 +0000 2016,7.09502E+17,15,14,Last week I spoke in the Judiciary Committee about the negative effects of only eight #SCOTUS justices: https://t.co/E4kKeVi74P,SenFeinstein,Dianne Feinstein,California,Democratic
1601,Mon Mar 14 22:08:11 +0000 2016,7.09501E+17,35,45,To Senate Republicans who will say they’ll refuse to consider a #SCOTUS nominee: #DoYourJob. Unprecedented for Senate to not hold hearings.,SenFeinstein,Dianne Feinstein,California,Democratic
1602,Mon Mar 14 21:56:42 +0000 2016,7.09499E+17,4,12,"To #BringBacktheBees, we must collect more data &amp; reduce unnecessary pesticide use. Read our letter to @USDA, @EPA: https://t.co/Lcxg8DWliW",SenFeinstein,Dianne Feinstein,California,Democratic
1603,Mon Mar 14 20:06:11 +0000 2016,7.09471E+17,5,35,"Losses to U.S. honeybee population are unsustainable. Read our letter to @USDA, @EPA on efforts to reverse trend: https://t.co/Lcxg8DWliW",SenFeinstein,Dianne Feinstein,California,Democratic
1604,Sat Mar 12 23:14:04 +0000 2016,7.08793E+17,2,9,Learn more about the Personal Care Products Safety Act here: https://t.co/4K3gkbbMtd #SafeProducts #ExpoWest,SenFeinstein,Dianne Feinstein,California,Democratic
1605,Sat Mar 12 23:13:30 +0000 2016,7.08793E+17,4,5,The bill also requires adverse event reporting and gives @US_FDA the authority to recall unsafe products. #SafeProducts,SenFeinstein,Dianne Feinstein,California,Democratic
1606,Sat Mar 12 23:12:08 +0000 2016,7.08793E+17,1,4,"Review will tell us whether ingredients can continue to be used, and if so, what the right concentration is. #SafeProducts",SenFeinstein,Dianne Feinstein,California,Democratic
1607,Sat Mar 12 23:09:04 +0000 2016,7.08792E+17,1,4,"While many ingredients are not a cause for concern, there are questions about others. That's why we need independent review. #SafeProducts",SenFeinstein,Dianne Feinstein,California,Democratic
1608,Sat Mar 12 23:06:57 +0000 2016,7.08791E+17,4,7,Ingredient review is one of the bill's key provisions. @US_FDA would review at least five chemicals per year. #SafeProducts,SenFeinstein,Dianne Feinstein,California,Democratic
1609,Sat Mar 12 23:03:16 +0000 2016,7.0879E+17,4,10,My bill with @SenatorCollins updates our laws. It's supported by health groups like @ewg and companies like @_CaliforniaBaby. #SafeProducts,SenFeinstein,Dianne Feinstein,California,Democratic
1610,Sat Mar 12 23:00:51 +0000 2016,7.0879E+17,2,13,Federal safety rules for personal care products are based on a law from 1938. That's nearly 80 years without an update. #SafeProducts,SenFeinstein,Dianne Feinstein,California,Democratic
1611,Sat Mar 12 22:59:21 +0000 2016,7.0879E+17,6,22,"From shampoo to lotion, we all use personal care products, but there are few protections to ensure their safety. #SafeProducts #ExpoWest",SenFeinstein,Dianne Feinstein,California,Democratic
1612,Fri Mar 11 18:39:18 +0000 2016,7.08362E+17,1,7,Chatting w/ Senate pages from Calif. They work so hard! Great intro to our legislative system. @SenateYouth #USSYP https://t.co/DGwTSTZjmN,SenFeinstein,Dianne Feinstein,California,Democratic
1613,Fri Mar 11 17:01:45 +0000 2016,7.08337E+17,3,5,"During Consumer Protection Week, renew your commitment to fight fraud and promote consumer rights. More info: https://t.co/seAiS68fgj #NCPW",SenFeinstein,Dianne Feinstein,California,Democratic
1614,Fri Mar 11 16:21:34 +0000 2016,7.08327E+17,10,16,With @CoveredCA’s Peter Lee discussing the status of Affordable Care Act implementation in California. #ACAWorks https://t.co/wd4yagVHQM,SenFeinstein,Dianne Feinstein,California,Democratic
1615,Thu Mar 10 22:21:26 +0000 2016,7.08055E+17,12,41,I’m asking Senate Republicans to #DoYourJob and give a #SCOTUS nominee careful consideration. https://t.co/Fc5dNb5LL9,SenFeinstein,Dianne Feinstein,California,Democratic
1616,Thu Mar 10 21:18:21 +0000 2016,7.08039E+17,3,4,"We must do more to combat this scourge, including prescriber education and improving follow-up treatment. https://t.co/ky9VdwZDTA",SenFeinstein,Dianne Feinstein,California,Democratic
1617,Thu Mar 10 21:17:52 +0000 2016,7.08039E+17,5,10,Opioid epidemic is partly due to a surge in prescription drugs—overdose deaths &amp; painkiller prescriptions quadrupled during the same period.,SenFeinstein,Dianne Feinstein,California,Democratic
