,created_at,id_str,reply_count,retweet_count,text,user,name,state,party
0,Wed May 17 21:42:03 +0000 2017,8.64959E+17,2,7,"Students from my alma mater, Convent of the Sacred Heart, stopped by today! They even brought some of my old school… https://t.co/64mIe679c0",SenFeinstein,Dianne Feinstein,California,Democratic
1,Wed May 17 21:22:43 +0000 2017,8.64954E+17,12,45,We’re fighting to protect health care for the most vulnerable. That includes the 39% of children insured through… https://t.co/qqkqfoJmpg,SenFeinstein,Dianne Feinstein,California,Democratic
2,Wed May 17 17:28:03 +0000 2017,8.64895E+17,21,70,My friend Mazie is a fighter. She never quits. I’m confident she’ll emerge from this challenge better than ever. https://t.co/c6yX1wdud3,SenFeinstein,Dianne Feinstein,California,Democratic
3,Wed May 17 15:15:43 +0000 2017,8.64862E+17,3,20,Glad to see you’re doing well! Best wishes for a speedy recovery. https://t.co/iSBoWbXLuF,SenFeinstein,Dianne Feinstein,California,Democratic
4,Tue May 16 18:06:15 +0000 2017,8.64543E+17,62,128,We need serious solutions to fight the opioid crisis. Cutting Medicaid is a non-starter and would worsen the epidem… https://t.co/djTFco8WWE,SenFeinstein,Dianne Feinstein,California,Democratic
5,Mon May 15 21:57:10 +0000 2017,8.64238E+17,26,61,"@Caltrain (3/3) @Caltrain project will improve the Bay Area commute and create 10,000 jobs nationwide. My statement: https://t.co/ULDXijKwku",SenFeinstein,Dianne Feinstein,California,Democratic
6,Mon May 15 21:56:32 +0000 2017,8.64238E+17,14,66,"@Caltrain (2/3) Congress approved the @Caltrain project funding, it’s ready to go. There’s no rational justificatio… https://t.co/vwKtj0jpJA",SenFeinstein,Dianne Feinstein,California,Democratic
7,Mon May 15 21:55:23 +0000 2017,8.64238E+17,73,155,(1/3) I will oppose every nominee for the Transportation Department until the Trump administration approves the grant for @Caltrain.,SenFeinstein,Dianne Feinstein,California,Democratic
8,Mon May 15 21:18:35 +0000 2017,8.64229E+17,15,71,(2/2) Let’s make sure to keep the #VotingRights conversation going. We can’t allow the attempt to suppress votes succeed.,SenFeinstein,Dianne Feinstein,California,Democratic
9,Mon May 15 21:18:03 +0000 2017,8.64228E+17,23,149,(1/2) I’m cheering today’s #SupremeCourt decision to end the push to reinstate North Carolina’s discriminatory voter ID law. #SCOTUS,SenFeinstein,Dianne Feinstein,California,Democratic
10,Mon May 15 18:19:42 +0000 2017,8.64184E+17,9,38,(2/2) Join me in honoring the 394 officers killed in the line of duty who will be added to the National Law Enforcement Officers Memorial.,SenFeinstein,Dianne Feinstein,California,Democratic
11,Mon May 15 18:18:11 +0000 2017,8.64183E+17,17,50,(1/2) This week we pay tribute to the men and women who keep our communities safe every day. #PoliceWeek2017,SenFeinstein,Dianne Feinstein,California,Democratic
12,Sun May 14 16:02:44 +0000 2017,8.63787E+17,42,76,Happy #MothersDay to all the moms in California and across the country. I hope you have a wonderful day with your families.,SenFeinstein,Dianne Feinstein,California,Democratic
13,Sun May 14 03:17:47 +0000 2017,8.63594E+17,85,586,"FBI Director McCabe said the Russia investigation is ""highly significant."" The A.G.'s recusal should apply to choosing the FBI director.",SenFeinstein,Dianne Feinstein,California,Democratic
14,Sun May 14 03:14:48 +0000 2017,8.63593E+17,392,4199,Attorney General Sessions has recused himself from the Russia investigations. He shouldn't be involved in picking the new FBI director.,SenFeinstein,Dianne Feinstein,California,Democratic
15,Sat May 13 17:16:27 +0000 2017,8.63443E+17,402,3364,I'm calling for Judiciary Committee hearings on the firing of FBI Director Comey. https://t.co/qC4CvzThto,SenFeinstein,Dianne Feinstein,California,Democratic
16,Sat May 13 00:03:09 +0000 2017,8.63183E+17,770,11293,I support @SenatorDurbin's call for Deputy Attorney General Rod Rosenstein to resign if he is unwilling to appoint a special counsel.,SenFeinstein,Dianne Feinstein,California,Democratic
17,Fri May 12 23:58:18 +0000 2017,8.63182E+17,51,354,(2/2) The Judiciary Committee needs to hold hearings and get to the bottom of this. https://t.co/qC4CvzThto,SenFeinstein,Dianne Feinstein,California,Democratic
18,Fri May 12 23:56:31 +0000 2017,8.63181E+17,67,438,(1/2) President Trump and the White House have presented an ever-changing narrative on the rationale for the firing of Director Comey.,SenFeinstein,Dianne Feinstein,California,Democratic
19,Fri May 12 23:47:34 +0000 2017,8.63179E+17,504,1443,Any recordings of conversations between President Trump and FBI Director Comey must be preserved by the White House. https://t.co/Y2Ykk7XPGd,SenFeinstein,Dianne Feinstein,California,Democratic
20,Fri May 12 19:17:52 +0000 2017,8.63111E+17,18,107,"San Gabriel Mountains National Monument is more than 346,000 acres of nature easily accessible to those living in L… https://t.co/h7HNVrfmcI",SenFeinstein,Dianne Feinstein,California,Democratic
21,Fri May 12 19:09:06 +0000 2017,8.63109E+17,19,166,"We fought hard to designate the 154,000 acres of Sand to Snow as a National Monument and we intend to have it stay… https://t.co/CvO1xUXVc8",SenFeinstein,Dianne Feinstein,California,Democratic
22,Fri May 12 18:50:59 +0000 2017,8.63104E+17,19,94,There’s nothing quite like the serenity of Calif.’s desert. You can hike Mojave Trails Nat’l Monument to see craggy… https://t.co/XjXyhSejFf,SenFeinstein,Dianne Feinstein,California,Democratic
23,Fri May 12 18:36:32 +0000 2017,8.63101E+17,20,160,Calif’s mammoth sequoias grow almost 300 feet tall—seeing them in person is fantastic! Let’s recommit to protecting… https://t.co/pPxP2uAArF,SenFeinstein,Dianne Feinstein,California,Democratic
24,Fri May 12 17:57:50 +0000 2017,8.63091E+17,7,98,The wildflowers of Carrizo Plain National Monument embody what we find so beautiful about California. We won’t let… https://t.co/N3kz6vIB2Q,SenFeinstein,Dianne Feinstein,California,Democratic
25,Fri May 12 17:28:25 +0000 2017,8.63083E+17,10,114,"Berryessa Snow Mountain National Monument offers 330,000 acres of scenic vistas, beautiful flowers &amp; unique biodive… https://t.co/F7Mtq4BcMl",SenFeinstein,Dianne Feinstein,California,Democratic
26,Fri May 12 16:57:13 +0000 2017,8.63076E+17,81,732,"A Trump Executive Order threatens national monuments in Calif. Take action, express your support for our monuments: https://t.co/g5EoqQiHfq",SenFeinstein,Dianne Feinstein,California,Democratic
27,Fri May 12 15:19:36 +0000 2017,8.63051E+17,286,2144,"""If this president expects to control the FBI, what decisions they make and what investigations they conduct, then… https://t.co/UEJRq7zJiq",SenFeinstein,Dianne Feinstein,California,Democratic
28,Thu May 11 22:14:21 +0000 2017,8.62793E+17,53,460,Americans have died to secure the right to vote. We can't allow lies about widespread voter fraud to fuel voter suppression.,SenFeinstein,Dianne Feinstein,California,Democratic
29,Thu May 11 22:13:18 +0000 2017,8.62793E+17,86,521,It’s absurd that a commission will investigate false claims of voter fraud when states are making it harder to vote. https://t.co/GtKUJtl1Y5,SenFeinstein,Dianne Feinstein,California,Democratic
30,Thu May 11 21:13:37 +0000 2017,8.62778E+17,3,25,Tibor Rubin was a true American hero and I’m thrilled the veterans hospital in Long Beach will honor his memory. https://t.co/EldBsYWOMn,SenFeinstein,Dianne Feinstein,California,Democratic
31,Thu May 11 19:40:50 +0000 2017,8.62754E+17,15,52,Wonderful to see California nurses in D.C. for #NursesWeek. Thank you so much for all the work you do to keep Ameri… https://t.co/VdcQPeOHkE,SenFeinstein,Dianne Feinstein,California,Democratic
32,Thu May 11 16:16:10 +0000 2017,8.62703E+17,118,1153,(2/2) I’ve now read the Rosenstein memo three times. With each read I’m more troubled by this document. https://t.co/zZeHqY4dL6,SenFeinstein,Dianne Feinstein,California,Democratic
33,Thu May 11 16:14:25 +0000 2017,8.62702E+17,278,3461,(1/2) I’m calling on the attorney general and deputy attorney general to recuse themselves from involvement in choosing a special counsel.,SenFeinstein,Dianne Feinstein,California,Democratic
34,Thu May 11 15:25:50 +0000 2017,8.6269E+17,56,89,White House must understand we’ll never stop the flow of illicit drugs and opioids without fully-funded programs. https://t.co/dlU4ZixBhW,SenFeinstein,Dianne Feinstein,California,Democratic
35,Thu May 11 14:08:37 +0000 2017,8.62671E+17,18,31,Happening now: The Senate Judiciary Committee marks up our bill to protect young athletes from abuse: https://t.co/71fbdTliqI,SenFeinstein,Dianne Feinstein,California,Democratic
36,Wed May 10 20:58:25 +0000 2017,8.62412E+17,8,18,A wonderful group of 5th graders from Village School in Pacific Palisades stopped by this afternoon. Enjoy your vis… https://t.co/jCa8bb7rlC,SenFeinstein,Dianne Feinstein,California,Democratic
37,Wed May 10 19:31:20 +0000 2017,8.6239E+17,171,527,"At a minimum, #ComeyFiring raises questions about the timing of firing the person in charge of an investigation tha… https://t.co/Sr245T53Lj",SenFeinstein,Dianne Feinstein,California,Democratic
38,Wed May 10 18:15:02 +0000 2017,8.6237E+17,197,483,"As I reflect on the #ComeyFiring, the president’s decision leaves me incredulous, considering the ongoing Trump/Rus… https://t.co/aV6ef1EYh0",SenFeinstein,Dianne Feinstein,California,Democratic
39,Wed May 10 17:17:19 +0000 2017,8.62356E+17,11,28,Thanks for coming in! Keep fighting! https://t.co/4YiR0hG7zb,SenFeinstein,Dianne Feinstein,California,Democratic
40,Wed May 10 15:40:41 +0000 2017,8.62332E+17,323,1315,I discussed my concern with the #ComeyFiring and called for an independent prosecutor in the Trump/Russia investiga… https://t.co/zqXBySFRDb,SenFeinstein,Dianne Feinstein,California,Democratic
41,Wed May 10 14:23:27 +0000 2017,8.62312E+17,113,308,Speaking now in the Senate Judiciary Committee about the #ComeyFiring. Watch live: https://t.co/TVEcNBJs6s,SenFeinstein,Dianne Feinstein,California,Democratic
42,Wed May 10 13:46:45 +0000 2017,8.62303E+17,236,1279,We need an independent prosecutor to oversee the Russia investigation. I plan to work closely with @SenBlumenthal on this.,SenFeinstein,Dianne Feinstein,California,Democratic
43,Wed May 10 13:41:37 +0000 2017,8.62302E+17,183,539,If Director Comey was fired to stifle the Russia investigation that simply can't be allowed to happen. https://t.co/7wn6w5P8FX #ComeyFiring,SenFeinstein,Dianne Feinstein,California,Democratic
44,Tue May 09 18:49:13 +0000 2017,8.62017E+17,51,156,(4/4) Sen. @ChuckGrassley and I introduced a bill in January to eliminate the EB-5 program. Please support S. 232! https://t.co/31MPtNCVeA,SenFeinstein,Dianne Feinstein,California,Democratic
45,Tue May 09 18:48:13 +0000 2017,8.62016E+17,13,123,(3/4) EB-5 is rife with fraud and abuse. There have been many cases of securities fraud. The program should expire. https://t.co/v598KYsYeZ,SenFeinstein,Dianne Feinstein,California,Democratic
46,Tue May 09 18:47:28 +0000 2017,8.62016E+17,22,116,"(2/4) EB-5 sends a terrible message. A wealthy investor buys a visa while 4.4 million people wait in line, some for 20+ years. That's wrong.",SenFeinstein,Dianne Feinstein,California,Democratic
47,Tue May 09 18:46:59 +0000 2017,8.62016E+17,21,205,(1/4) The EB-5 program presents a stark conflict of interest for the White House. https://t.co/Vf9FsQJ1TW,SenFeinstein,Dianne Feinstein,California,Democratic
48,Tue May 09 18:26:06 +0000 2017,8.62011E+17,81,183,20 million Americans gained health coverage through the Affordable Care Act. We’re fighting to protect that progress and improve that bill.,SenFeinstein,Dianne Feinstein,California,Democratic
49,Tue May 09 17:53:17 +0000 2017,8.62003E+17,56,180,Every single Senate Democrat agrees: The Republican plan to repeal the Affordable Care Act is a nonstarter! #AHCA https://t.co/zn4z9PlxBy,SenFeinstein,Dianne Feinstein,California,Democratic
50,Tue May 09 16:47:23 +0000 2017,8.61986E+17,34,111,(3/3) Our bill provides farmworkers with earned legal status (a blue card) and an eventual path to citizenship. https://t.co/Mbb5ms1C6k,SenFeinstein,Dianne Feinstein,California,Democratic
51,Tue May 09 16:45:35 +0000 2017,8.61986E+17,23,82,(2/3) We must do all we can to prevent these hardworking people who are so important to our economy from being deported.,SenFeinstein,Dianne Feinstein,California,Democratic
52,Tue May 09 16:45:18 +0000 2017,8.61985E+17,48,191,"(1/3) Farmworkers do backbreaking work to put food on American tables, yet they still live in fear of deportation. That’s unacceptable.",SenFeinstein,Dianne Feinstein,California,Democratic
53,Tue May 09 16:24:00 +0000 2017,8.6198E+17,455,4117,13 white men are in charge of drafting the Senate Republican health care bill that would affect 125 million women. That's ridiculous. #AHCA,SenFeinstein,Dianne Feinstein,California,Democratic
54,Tue May 09 14:54:45 +0000 2017,8.61958E+17,33,169,A free and open internet is vital for women. It promotes civic engagement as well as economic and social mobility. https://t.co/8yKd2r2ILn,SenFeinstein,Dianne Feinstein,California,Democratic
55,Mon May 08 22:04:11 +0000 2017,8.61703E+17,27,69,".@Caltrain (3/3) Modern trains will reduce San Francisco-San Jose commute times, cut emissions &amp; reduce congestion.… https://t.co/jaul57PhBh",SenFeinstein,Dianne Feinstein,California,Democratic
56,Mon May 08 22:03:04 +0000 2017,8.61703E+17,6,68,".@Caltrain (2/3) In the bipartisan funding bill, Congress committed $100 million to @Caltrain upgrades. We’re ready… https://t.co/qBjQcIXEAA",SenFeinstein,Dianne Feinstein,California,Democratic
57,Mon May 08 22:02:42 +0000 2017,8.61703E+17,27,113,"(1/3) Trump administration needlessly put @Caltrain upgrades on hold. For Bay Area commuters, grant agreement must be approved.",SenFeinstein,Dianne Feinstein,California,Democratic
58,Mon May 08 21:14:27 +0000 2017,8.61691E+17,72,875,Sally Yates on Michael Flynn: “You don’t want the national security advisor to be in a position where the Russians have leverage over him.”,SenFeinstein,Dianne Feinstein,California,Democratic
59,Mon May 08 20:49:08 +0000 2017,8.61684E+17,242,1483,Sally Yates said she told White House in January that Michael Flynn was compromised. He wasn’t fired until 18 days later. Deeply troubling.,SenFeinstein,Dianne Feinstein,California,Democratic
60,Mon May 08 20:35:43 +0000 2017,8.61681E+17,71,901,My staff and @SenWhitehouse’s staff put together a timeline of key events involving General Michael Flynn. https://t.co/JcUn3FCE4Q,SenFeinstein,Dianne Feinstein,California,Democratic
61,Mon May 08 20:00:09 +0000 2017,8.61672E+17,40,111,Full house for today’s Judiciary Committee hearing. I’m questioning Sally Yates about possible Trump administration… https://t.co/wRez5BHEJq,SenFeinstein,Dianne Feinstein,California,Democratic
62,Mon May 08 19:01:37 +0000 2017,8.61657E+17,34,133,We won’t let President Trump take our desert monuments away—join the #MonumentsForAll rally tonight to protect Moja… https://t.co/UVAaTnUo0q,SenFeinstein,Dianne Feinstein,California,Democratic
63,Mon May 08 18:16:29 +0000 2017,8.61646E+17,34,141,Watch Sally Yates testify before the Judiciary Committee today at 2:30 p.m. EST here: https://t.co/BXl73324KO,SenFeinstein,Dianne Feinstein,California,Democratic
64,Mon May 08 17:55:57 +0000 2017,8.61641E+17,16,41,I was on @MeetThePress yesterday to discuss my opposition to the Republican health care bill and the Comey hearing. https://t.co/jVEmNBMYma,SenFeinstein,Dianne Feinstein,California,Democratic
65,Sat May 06 00:02:01 +0000 2017,8.60646E+17,191,338,Terrible! 24 million people would lose their health coverage to pay for a tax cut for millionaires and billionaires. #AHCA,SenFeinstein,Dianne Feinstein,California,Democratic
66,Fri May 05 22:31:00 +0000 2017,8.60623E+17,116,407,Anyone could receive a devastating diagnosis—that's why the Affordable Care Act prevents insurers from raising rates when someone gets sick.,SenFeinstein,Dianne Feinstein,California,Democratic
67,Fri May 05 20:37:00 +0000 2017,8.60594E+17,49,226,The House Republican health care bill is an attack on California women. @LATimesOpinion explains why: https://t.co/Su4RvKuxbF #AHCA,SenFeinstein,Dianne Feinstein,California,Democratic
68,Fri May 05 20:00:20 +0000 2017,8.60585E+17,175,1211,"The Republican bill ends Medicaid as we know it, cutting nearly $1 trillion. This is an attack on poor, elderly and disabled people. #AHCA",SenFeinstein,Dianne Feinstein,California,Democratic
69,Fri May 05 18:47:37 +0000 2017,8.60567E+17,31,47,"After last month’s San Francisco town hall, a constituent emailed me a question about money in politics. https://t.co/oQaOLeMpfq",SenFeinstein,Dianne Feinstein,California,Democratic
70,Fri May 05 17:26:54 +0000 2017,8.60546E+17,16,34,"After last month’s San Francisco town hall, a constituent emailed me a question about the @PeaceCorps. https://t.co/qFRJKU4lDy",SenFeinstein,Dianne Feinstein,California,Democratic
71,Fri May 05 15:28:02 +0000 2017,8.60516E+17,44,59,"After last month’s San Francisco town hall, a constituent emailed me a question about voting rights. https://t.co/GCwa7Ph0FI",SenFeinstein,Dianne Feinstein,California,Democratic
72,Thu May 04 22:27:05 +0000 2017,8.6026E+17,150,460,The Republican health care bill would make the lives of millions of people worse. It flies in the face of our jobs as public servants. #AHCA,SenFeinstein,Dianne Feinstein,California,Democratic
73,Thu May 04 21:50:24 +0000 2017,8.6025E+17,28,61,I appeared on @MSNBC’s @MitchellReports today to discuss the Comey hearing and the Republican health care plan. https://t.co/PJiAWS8UM6,SenFeinstein,Dianne Feinstein,California,Democratic
74,Thu May 04 19:47:52 +0000 2017,8.60219E+17,65,557,Affordable Care Act reduced personal bankruptcies by 50%. Republicans are ignoring the numbers. Awful! #VoteNOAHCA https://t.co/wDi6LHTYel,SenFeinstein,Dianne Feinstein,California,Democratic
75,Thu May 04 18:48:28 +0000 2017,8.60204E+17,283,2521,Ridiculous! Republican health plan blocks Calif. from receiving tax credits because our state covers reproductive health care. #VoteNoAHCA,SenFeinstein,Dianne Feinstein,California,Democratic
76,Thu May 04 18:27:57 +0000 2017,8.60199E+17,62,326,Medicaid in California would be decimated under the Republican health care plan! $6 billion cut by 2020. Terrible! #VoteNoAHCA,SenFeinstein,Dianne Feinstein,California,Democratic
77,Thu May 04 18:01:39 +0000 2017,8.60193E+17,79,315,House will vote to repeal the Affordable Care Act—and kick 24 million off their health care—and they don’t even know how much it will cost!,SenFeinstein,Dianne Feinstein,California,Democratic
78,Thu May 04 17:39:47 +0000 2017,8.60187E+17,56,328,Call your Congressman and tell them to vote no on the House health care plan—24 mil. would be kicked off their health insurance! #VoteNoAHCA,SenFeinstein,Dianne Feinstein,California,Democratic
79,Thu May 04 17:15:37 +0000 2017,8.60181E+17,146,824,"Under the Republican health care plan, 3.5 million Californians would LOSE health coverage. This is unacceptable! #VoteNoAHCA",SenFeinstein,Dianne Feinstein,California,Democratic
80,Wed May 03 19:44:23 +0000 2017,8.59856E+17,49,155,(3/3) 7.5 million Californians don’t have workplace retirement accounts. Why make it harder for Americans to save for retirement?,SenFeinstein,Dianne Feinstein,California,Democratic
81,Wed May 03 19:43:52 +0000 2017,8.59856E+17,9,138,(2/3) Not every employer offers retirement savings plans—middle class families should be given savings options. #SaveRetirement,SenFeinstein,Dianne Feinstein,California,Democratic
82,Wed May 03 19:43:33 +0000 2017,8.59856E+17,62,387,(1/3) Senate will vote shortly to repeal a rule allowing states to establish programs to help hard working Americans save for retirement.,SenFeinstein,Dianne Feinstein,California,Democratic
83,Wed May 03 18:26:57 +0000 2017,8.59837E+17,12,27,"(2/2) In the last five years, the number of small businesses in California has grown by 5.2%. Now that’s progress! Let’s keep it up! @SBAgov",SenFeinstein,Dianne Feinstein,California,Democratic
84,Wed May 03 18:26:22 +0000 2017,8.59837E+17,9,23,(1/2) It’s #SmallBusinessWeek! I think small businesses are vital to our economy. 6.8 million Californians are empl… https://t.co/xgtYDuJXJB,SenFeinstein,Dianne Feinstein,California,Democratic
85,Wed May 03 17:17:19 +0000 2017,8.59819E+17,6,17,Mike Brown of L.A. used a Labor Dept. apprenticeship program as a springboard to a carpentry career. Great job Mike! https://t.co/LB1w437stJ,SenFeinstein,Dianne Feinstein,California,Democratic
86,Wed May 03 15:59:06 +0000 2017,8.59799E+17,131,116,Watch my opening statement at today’s FBI oversight hearing on actions during the election. https://t.co/HSXmJtbVO6,SenFeinstein,Dianne Feinstein,California,Democratic
87,Tue May 02 21:25:00 +0000 2017,8.59519E+17,65,114,"(3/3) We’ve got to condemn every form of hate, no matter who is targeted, and I believe that to the depth of my bei… https://t.co/gys3QUz6L8",SenFeinstein,Dianne Feinstein,California,Democratic
88,Tue May 02 21:23:18 +0000 2017,8.59519E+17,17,57,(2/3) He talked about the need for leaders to speak out against hate. I echoed that sentiment at today's hearing on religious hate crimes.,SenFeinstein,Dianne Feinstein,California,Democratic
89,Tue May 02 21:22:22 +0000 2017,8.59518E+17,15,72,"(1/3) During my town hall in San Francisco, Steve, a constituent, shared the tragic story of his family’s persecution under the Nazis.",SenFeinstein,Dianne Feinstein,California,Democratic
90,Tue May 02 20:49:22 +0000 2017,8.5951E+17,24,104,"In my view, the United States must have the strongest #LGBT nondiscrimination policies possible. Info on our bill:… https://t.co/zrKlVC0GKt",SenFeinstein,Dianne Feinstein,California,Democratic
91,Tue May 02 19:39:15 +0000 2017,8.59493E+17,7,25,Thanks Fresno County! Great to see everyone to talk about land subsidence and the need for vital infrastructure inv… https://t.co/FtDouGUnbP,SenFeinstein,Dianne Feinstein,California,Democratic
92,Tue May 02 17:42:41 +0000 2017,8.59463E+17,190,2157,Another reason to oppose ACA repeal: Republican plan blocks ALL financial help for Calif. because we require reproductive health coverage.,SenFeinstein,Dianne Feinstein,California,Democratic
93,Tue May 02 16:06:30 +0000 2017,8.59439E+17,24,127,Calif. knows what it’s like to suffer through an oil spill. I wouldn’t wish that on any state. Read about our bill: https://t.co/pFFAs1ybO9,SenFeinstein,Dianne Feinstein,California,Democratic
94,Tue May 02 15:15:42 +0000 2017,8.59426E+17,11,66,"“So we’ve got to stand together. And we have to make clear that hate has no place in our country, and these crimes will be investigated.”",SenFeinstein,Dianne Feinstein,California,Democratic
95,Tue May 02 15:15:01 +0000 2017,8.59426E+17,19,101,"""The rise in hate crimes is due, in part, to the perception that people in positions of power are indifferent to what’s happening.” #EndHate",SenFeinstein,Dianne Feinstein,California,Democratic
96,Tue May 02 15:14:21 +0000 2017,8.59426E+17,10,92,"“First, it’s incumbent, as I said, on all leaders to loudly condemn these crimes. That includes race as well as religion.” #EndHate",SenFeinstein,Dianne Feinstein,California,Democratic
97,Tue May 02 14:36:43 +0000 2017,8.59416E+17,8,48,(2/2) The Judiciary Committee is holding an important hearing on religious hate crimes at 10:30 a.m. Watch live: https://t.co/4w33mQstru,SenFeinstein,Dianne Feinstein,California,Democratic
98,Tue May 02 14:36:19 +0000 2017,8.59416E+17,21,63,(1/2) I’ve seen how hate tears communities apart. We must prioritize addressing the alarming increase in religious hate crimes.,SenFeinstein,Dianne Feinstein,California,Democratic
99,Mon May 01 22:32:51 +0000 2017,8.59174E+17,40,179,(2/2) It would allow insurers to charge sick Americans exorbitant premiums for junk plans that don’t provide the care they need. #SaveACA,SenFeinstein,Dianne Feinstein,California,Democratic
100,Mon May 01 22:31:54 +0000 2017,8.59174E+17,40,372,(1/2) The latest House Republican plan to replace the Affordable Care Act would NOT protect those with preexisting conditions.,SenFeinstein,Dianne Feinstein,California,Democratic
101,Mon May 01 22:01:30 +0000 2017,8.59166E+17,11,37,Students from Main Street School in Soquel know it's vital we protect our environment. I was heartened by the great… https://t.co/EkTsJNZA8Z,SenFeinstein,Dianne Feinstein,California,Democratic
102,Mon May 01 20:40:50 +0000 2017,8.59146E+17,14,35,Thanks for stopping by my office! Great to see so many smiling faces! https://t.co/glnhs7Jubh,SenFeinstein,Dianne Feinstein,California,Democratic
103,Mon May 01 20:02:56 +0000 2017,8.59136E+17,161,49,"Charter schools do a terrific job giving students from a multitude of backgrounds a quality, comprehensive educatio… https://t.co/lxTkDMVFIG",SenFeinstein,Dianne Feinstein,California,Democratic
104,Mon May 01 17:06:08 +0000 2017,8.59092E+17,19,67,(2/2) The United States has always been a beacon for those wishing to thrive and prosper—we intend for our country to stay that way. #MayDay,SenFeinstein,Dianne Feinstein,California,Democratic
105,Mon May 01 17:05:35 +0000 2017,8.59091E+17,32,93,"(1/2) Today, #MayDay marches will be held across the nation to support #ImmigrantRights. I’m proud to support these efforts!",SenFeinstein,Dianne Feinstein,California,Democratic
106,Sun Apr 30 21:40:00 +0000 2017,8.58798E+17,64,217,Our nation cannot recede from the world—cutting State Department staff would unacceptably reduce American influence. https://t.co/WsVBzZUFTU,SenFeinstein,Dianne Feinstein,California,Democratic
