,created_at,id_str,reply_count,retweet_count,text,user,name,state,party
1299,Wed Oct 21 23:02:17 +0000 2015,6.56969E+17,1,5,My statement on the vandalism of the Claremont Planned Parenthood facility: https://t.co/nhmvfHrwI7,SenatorShaheen,Jeanne Shaheen,New Hampshire,Democratic
1300,Wed Oct 21 22:22:58 +0000 2015,6.56959E+17,0,2,"Our budget process is broken. CR's hurt our economy &amp; national security and waste $$. @Politico #BiennialBudgeting
https://t.co/MmyfTL32Ss",SenatorShaheen,Jeanne Shaheen,New Hampshire,Democratic
1301,Wed Oct 21 19:31:36 +0000 2015,6.56916E+17,2,11,Great to have JT the “Minister of Propaganda” with @Smuttynosebeer in Washington this AM! #BrewNH #NHBeer https://t.co/28yshnPISD,SenatorShaheen,Jeanne Shaheen,New Hampshire,Democratic
1302,Wed Oct 21 15:43:15 +0000 2015,6.56858E+17,0,1,Check out all of the fantastic photos sent in from around the Granite State and keep you fall photos coming! https://t.co/n2M7jYK4TS,SenatorShaheen,Jeanne Shaheen,New Hampshire,Democratic
1303,Wed Oct 21 15:23:33 +0000 2015,6.56853E+17,1,8,Here’s another great NH fall foliage photo from @Lori_Zibel in Bow https://t.co/xYMqhSuP0c,SenatorShaheen,Jeanne Shaheen,New Hampshire,Democratic
1304,Wed Oct 21 15:06:36 +0000 2015,6.56849E+17,0,5,TY to everyone who submitted pics of our beautiful fall foliage. Here's one from Michelle of Elbow Pond in Andover https://t.co/g6Te583Nde,SenatorShaheen,Jeanne Shaheen,New Hampshire,Democratic
1305,Wed Oct 21 14:40:12 +0000 2015,6.56842E+17,0,3,My bill would encourage sustainable forestry practices on private land &amp; promote use of wood products. More here:  https://t.co/SvaSjwiIhJ,SenatorShaheen,Jeanne Shaheen,New Hampshire,Democratic
1306,Wed Oct 21 14:39:54 +0000 2015,6.56842E+17,0,3,It’s National Forests Products Week! Our forest industry promotes our economy and protects our beautiful forests in NH #CelebrateFP,SenatorShaheen,Jeanne Shaheen,New Hampshire,Democratic
1307,Tue Oct 20 19:20:41 +0000 2015,6.56551E+17,1,4,At @Helsinkicomm w/ Anne Richard of @StatePRM discussing how we can better address growing European refugee crisis. https://t.co/nGY6Rhfna2,SenatorShaheen,Jeanne Shaheen,New Hampshire,Democratic
1308,Tue Oct 20 18:34:26 +0000 2015,6.56539E+17,0,2,NH law enforcement does amazing work to keep us safe. More on Congressional Law Enforcement Awards in my newsletter: https://t.co/vWXKRiyNrw,SenatorShaheen,Jeanne Shaheen,New Hampshire,Democratic
1309,Mon Oct 19 22:18:47 +0000 2015,6.56233E+17,5,5,"Following my trip to Europe to get an up-close look at the refugee crisis, I spoke w/ @BBCWorld this evening. WATCH https://t.co/EvQvMfeWOo",SenatorShaheen,Jeanne Shaheen,New Hampshire,Democratic
1310,Mon Oct 19 18:27:40 +0000 2015,6.56175E+17,0,1,Introducing Gary Hart after his come from behind victory in the 1984 #NHPrimary Watch here: https://t.co/CUTU0FXk8K https://t.co/deRqLnzk7C,SenatorShaheen,Jeanne Shaheen,New Hampshire,Democratic
1311,Mon Oct 19 18:26:18 +0000 2015,6.56175E+17,1,3,It’s not Thursday but we’re throwing way back to the ‘84 #NHPrimary &amp; Gary Hart Campaign on @WMUR9 w/@AdamSextonWMUR https://t.co/CUTU0FXk8K,SenatorShaheen,Jeanne Shaheen,New Hampshire,Democratic
1312,Mon Oct 19 17:16:18 +0000 2015,6.56157E+17,0,2,It’s official! Helping cut the ribbon at the new Manchester Job Corps center http://t.co/ZemM3338nh,SenatorShaheen,Jeanne Shaheen,New Hampshire,Democratic
1313,Mon Oct 19 16:19:46 +0000 2015,6.56143E+17,1,2,Manchester Job Corps will provide low-income youth w/important education &amp; job training. Its opening is great news for NH jobs &amp; economy,SenatorShaheen,Jeanne Shaheen,New Hampshire,Democratic
1314,Mon Oct 19 00:06:21 +0000 2015,6.55898E+17,0,8,Huge game tonight and the @Colts don't stand a chance. Let's go @Patriots! #GoPats #TB12,SenatorShaheen,Jeanne Shaheen,New Hampshire,Democratic
1315,Sat Oct 17 15:55:34 +0000 2015,6.55412E+17,0,9,"James Foley was a loving son &amp; brother, courageous journalist &amp; humanitarian. He cared deeply about people caught up in conflict #IrunforJim",SenatorShaheen,Jeanne Shaheen,New Hampshire,Democratic
1316,Sat Oct 17 15:50:23 +0000 2015,6.55411E+17,1,5,A big thank you to everyone who is honoring the memory of James Foley today at the Foley Foundation 5K. #IRunForJim http://t.co/vFJprcNeVT,SenatorShaheen,Jeanne Shaheen,New Hampshire,Democratic
1317,Fri Oct 16 23:02:53 +0000 2015,6.55157E+17,0,1,"At Congressional Law Enforcement Awards, paid tribute to the life of Steve Arkell, killed in the line of duty. A courageous &amp; selfless hero",SenatorShaheen,Jeanne Shaheen,New Hampshire,Democratic
1318,Fri Oct 16 22:55:47 +0000 2015,6.55155E+17,1,1,"Tonight, at Congressional Law Enforcement Awards, had the opportunity to honor all of our law enforcement officers &amp; their important work",SenatorShaheen,Jeanne Shaheen,New Hampshire,Democratic
1319,Fri Oct 16 19:20:57 +0000 2015,6.55101E+17,0,14,"75,000 @AmeriCorps members are being sworn in today! Wishing them the best as they help communities around the US. http://t.co/whz1PK919Q",SenatorShaheen,Jeanne Shaheen,New Hampshire,Democratic
1320,Fri Oct 16 16:44:17 +0000 2015,6.55062E+17,0,1,A big congrats to Hancock’s @SyTheAuthor on being named a finalist for the National Book Award in nonfiction. http://t.co/oETBHkjtkI,SenatorShaheen,Jeanne Shaheen,New Hampshire,Democratic
1321,Fri Oct 16 14:59:21 +0000 2015,6.55035E+17,0,1,Brought this group together to work thru challenges of providing mental health services to vets &amp; raise awareness of ChoiceCard coverage 2/2,SenatorShaheen,Jeanne Shaheen,New Hampshire,Democratic
1322,Fri Oct 16 14:59:02 +0000 2015,6.55035E+17,1,1,"Today in Manchester, I organized an important discussion b/w vets, mental health providers &amp; VA officials on vets mental health coverage 1/2",SenatorShaheen,Jeanne Shaheen,New Hampshire,Democratic
1323,Thu Oct 15 15:17:33 +0000 2015,6.54677E+17,0,3,"Women-owned small businesses secure &lt; 5% of fed. contracts. How we change that, in my post on @Forbes: http://t.co/VRZSpZ8gQn",SenatorShaheen,Jeanne Shaheen,New Hampshire,Democratic
1324,Wed Oct 14 20:04:06 +0000 2015,6.54387E+17,2,1,"Today, federal agencies can begin awarding sole-source contracts to women-owned small biz. Great opportunity for women entrepreneurs",SenatorShaheen,Jeanne Shaheen,New Hampshire,Democratic
1325,Wed Oct 14 19:31:18 +0000 2015,6.54379E+17,3,7,Met w/ government officials in Greece Ukraine &amp; Germany &amp; had opportunity to talk with Syrian refugees. Photos here: https://t.co/8XcW8v8v5F,SenatorShaheen,Jeanne Shaheen,New Hampshire,Democratic
1326,Wed Oct 14 19:28:56 +0000 2015,6.54378E+17,0,4,Today I'm wrapping up a trip to Europe for briefs on the refugee crisis &amp; situation in Ukrainian. My statement: http://t.co/S0GT6NuRFT,SenatorShaheen,Jeanne Shaheen,New Hampshire,Democratic
1327,Tue Oct 13 20:36:07 +0000 2015,6.54033E+17,0,3,Happy 240th birthday to @USNavy. Thank you to all our sailors who work tirelessly to keep us safe around the world. http://t.co/M39ZNXm9u9,SenatorShaheen,Jeanne Shaheen,New Hampshire,Democratic
1328,Tue Oct 13 18:30:47 +0000 2015,6.54001E+17,0,4,"Grant to Northeast Passage @UofNH supports adaptive sports for disabled vets.Great for comradery, healthy lifestyles http://t.co/7sriO8Z6zH",SenatorShaheen,Jeanne Shaheen,New Hampshire,Democratic
1329,Mon Oct 12 19:13:57 +0000 2015,6.5365E+17,1,3,I’ve introduced a bill that would deter drones from being flown near disaster relief efforts. @WIRED reports: http://t.co/GavC1nk2xi,SenatorShaheen,Jeanne Shaheen,New Hampshire,Democratic
1330,Mon Oct 12 17:09:30 +0000 2015,6.53619E+17,2,2,Meeting in Kiev with Ukrainian officials including Prime Minister Arseniy Yatsenyuk http://t.co/74k7qIbZdu,SenatorShaheen,Jeanne Shaheen,New Hampshire,Democratic
1331,Mon Oct 12 15:51:59 +0000 2015,6.53599E+17,4,4,There r over 4M refugees who have fled Syria. Would encourage u to watch this helpful video that explains the crisis https://t.co/pHDmHhpDpH,SenatorShaheen,Jeanne Shaheen,New Hampshire,Democratic
1332,Sun Oct 11 20:08:06 +0000 2015,6.53301E+17,3,7,Looking forward to the @Patriots coming out strong after their bye week and beating the @dallascowboys! #GoPats,SenatorShaheen,Jeanne Shaheen,New Hampshire,Democratic
1333,Fri Oct 09 17:58:43 +0000 2015,6.52544E+17,0,4,"ICYMI @NationalJournal calls my effort w/@SenatorTimScott to improve ACA achieving ""the unthinkable"" http://t.co/zMrublZcP0 #nhpolitics",SenatorShaheen,Jeanne Shaheen,New Hampshire,Democratic
1334,Fri Oct 09 12:59:45 +0000 2015,6.52468E+17,1,6,.@NationalJournal reports on behind-the-scenes of how my bipartisan bill to improve ACA became law. Good read--&gt;http://t.co/zMrublZcP0,SenatorShaheen,Jeanne Shaheen,New Hampshire,Democratic
1335,Thu Oct 08 20:33:44 +0000 2015,6.5222E+17,0,5,"In June, I recommended Emily Gray Rice as U.S. Attorney for NH. Today, President Obama nominated her. My statement: http://t.co/oWn23l682S",SenatorShaheen,Jeanne Shaheen,New Hampshire,Democratic
1336,Thu Oct 08 19:28:43 +0000 2015,6.52204E+17,2,7,Be sure to share your thoughts with @USTreasury on which woman you think should appear on #TheNew10  http://t.co/5UK4aPdhvi,SenatorShaheen,Jeanne Shaheen,New Hampshire,Democratic
1337,Thu Oct 08 15:27:49 +0000 2015,6.52143E+17,1,5,Growth of NH craft beer scene is good news for our economy &amp; everyone who enjoys a good brew http://t.co/RmR7Q549IB @seacoastonline @BrewNH,SenatorShaheen,Jeanne Shaheen,New Hampshire,Democratic
1338,Thu Oct 08 13:17:35 +0000 2015,6.52111E+17,0,6,Last night @POTUS signed my bipartisan bill to improve the Affordable Care Act for small &amp; mid-size businesses: http://t.co/Pxv3fFOPQA,SenatorShaheen,Jeanne Shaheen,New Hampshire,Democratic
1339,Wed Oct 07 18:42:35 +0000 2015,6.5183E+17,3,2,Drones have interfered too often w/ efforts to fight wildfires. My bill wld deter use near disaster relief efforts: http://t.co/irZzH0c7wR,SenatorShaheen,Jeanne Shaheen,New Hampshire,Democratic
1340,Wed Oct 07 17:27:55 +0000 2015,6.51811E+17,1,4,#LWCF is important to economy &amp; conservation in NH. GOP leadership needs to allow reauthorization vote http://t.co/Tv6JOF3Duo #SaveLWCF,SenatorShaheen,Jeanne Shaheen,New Hampshire,Democratic
1341,Wed Oct 07 17:27:33 +0000 2015,6.51811E+17,0,1,I support Democratic leadership’s call to @SenateMajLdr to reauthorize &amp; fund #LWCF http://t.co/Tv6JOF3Duo #SaveLWCF,SenatorShaheen,Jeanne Shaheen,New Hampshire,Democratic
1342,Wed Oct 07 14:34:00 +0000 2015,6.51767E+17,0,1,".@NHPR report on over-prescription of painkillers shows why we need to pass my bill to support drug monitoring 
http://t.co/RYJlfNZfAp",SenatorShaheen,Jeanne Shaheen,New Hampshire,Democratic
1343,Tue Oct 06 21:55:15 +0000 2015,6.51516E+17,1,5,Backlog of vet disability claim appeals is a national crisis. Not the time to reduce # of judges reviewing cases: https://t.co/k11ufMKx1t,SenatorShaheen,Jeanne Shaheen,New Hampshire,Democratic
1344,Tue Oct 06 20:58:03 +0000 2015,6.51502E+17,1,3,For a school project my grandson sent “Flat Nico” to visit me in Washington. Enjoying time in the office together! http://t.co/OvA1jqDFgQ,SenatorShaheen,Jeanne Shaheen,New Hampshire,Democratic
1345,Tue Oct 06 18:09:29 +0000 2015,6.51459E+17,0,3,Agree w/@TripAdvisor that North Conway is one of the best places to view fall colors in the country http://t.co/MylMES3RpM,SenatorShaheen,Jeanne Shaheen,New Hampshire,Democratic
1346,Tue Oct 06 17:47:22 +0000 2015,6.51454E+17,0,2,.@MaryPaigeProvos @JeanWMUR &amp; @NHChronicle have made NH proud w/terrific work promoting adoption. Congrats on #AngelsInAdoption recognition,SenatorShaheen,Jeanne Shaheen,New Hampshire,Democratic
1347,Mon Oct 05 18:11:44 +0000 2015,6.51097E+17,2,12,Great discussion in Manchester today on the importance of early childhood education &amp; preparing tomorrow’s workforce http://t.co/8iMg4AcxNT,SenatorShaheen,Jeanne Shaheen,New Hampshire,Democratic
1348,Sat Oct 03 13:00:23 +0000 2015,6.50294E+17,0,2,Congratulations to the German people on the 25th anniversary of German reunification. #GermanDayofUnity,SenatorShaheen,Jeanne Shaheen,New Hampshire,Democratic
1349,Fri Oct 02 19:45:07 +0000 2015,6.50034E+17,0,7,"Manchester, NH getting more recognition. #1 small biz friendly city &amp; now top 10 city for millennial entrepreneurs. http://t.co/LsvifWkfAV",SenatorShaheen,Jeanne Shaheen,New Hampshire,Democratic
1350,Fri Oct 02 12:35:42 +0000 2015,6.49926E+17,0,1,A win for businesses across this country &amp; a win for bipartisanship: http://t.co/is28Wygyhy w/ @SenatorTimScott,SenatorShaheen,Jeanne Shaheen,New Hampshire,Democratic
1351,Thu Oct 01 22:20:29 +0000 2015,6.49711E+17,0,1,Release of more than $1M for NH fisheries is good news for our fishermen &amp; coastal communities. My statement: http://t.co/E0Jr40bdDV,SenatorShaheen,Jeanne Shaheen,New Hampshire,Democratic
1352,Thu Oct 01 21:19:45 +0000 2015,6.49695E+17,0,2,This is a win for businesses across this country &amp; a win for bipartisanship https://t.co/wJunZo3Cbi,SenatorShaheen,Jeanne Shaheen,New Hampshire,Democratic
1353,Thu Oct 01 21:17:09 +0000 2015,6.49695E+17,1,2,My bipartisan bill w/ @SenatorTimScott makes helpful adjustment to #ACA 4 businesses. Now headed to President's desk https://t.co/TEgjtfG5tG,SenatorShaheen,Jeanne Shaheen,New Hampshire,Democratic
1354,Thu Oct 01 20:21:00 +0000 2015,6.4968E+17,0,4,On Senate floor I again called for confirmation of Gayle Smith to head USAID. Her nomination is blocked by 1 person  https://t.co/fNjG8yyhkC,SenatorShaheen,Jeanne Shaheen,New Hampshire,Democratic
1355,Thu Oct 01 19:12:47 +0000 2015,6.49663E+17,0,12,This afternoon I asked for the Senate to immediately reauthorize #LWCF: https://t.co/qmDANtJJqb But some GOP Sens. still refuse to #SaveLWCF,SenatorShaheen,Jeanne Shaheen,New Hampshire,Democratic
1356,Wed Sep 30 23:24:10 +0000 2015,6.49364E+17,1,7,Tonight we saw a concerted effort from several GOP Senators to shutter #LWCF at midnight: http://t.co/9CjMS2gsCh #SAVELWCF,SenatorShaheen,Jeanne Shaheen,New Hampshire,Democratic
1357,Wed Sep 30 18:05:14 +0000 2015,6.49284E+17,2,1,No effort was made by this Republican-led Congress to #SaveLWCF. My full statement: http://t.co/kRYz9lVwyl,SenatorShaheen,Jeanne Shaheen,New Hampshire,Democratic
1358,Tue Sep 29 22:11:18 +0000 2015,6.48983E+17,1,8,There's a backlog of Afghan interpreters who have helped the US.3000 additional visas will help those seeking refuge http://t.co/dd8wCqCkVn,SenatorShaheen,Jeanne Shaheen,New Hampshire,Democratic
1359,Tue Sep 29 21:16:18 +0000 2015,6.4897E+17,1,6,Really enjoyed meeting @TheDeepikaKurup (Nashua) today. Read about her invention in Forbes: http://t.co/3aVpjEiYCb http://t.co/qzsiJ8dgOS,SenatorShaheen,Jeanne Shaheen,New Hampshire,Democratic
1360,Tue Sep 29 20:52:42 +0000 2015,6.48964E+17,0,3,As #HungerActionMonth comes to a close a huge thank you to @NHFB for all they do to combat hunger in New Hampshire http://t.co/eNVdqf3ngG,SenatorShaheen,Jeanne Shaheen,New Hampshire,Democratic
1361,Tue Sep 29 15:03:36 +0000 2015,6.48876E+17,6,29,"On behalf of the 12,000 women Planned Parenthood served last year in NH #StandWithPP",SenatorShaheen,Jeanne Shaheen,New Hampshire,Democratic
1362,Tue Sep 29 15:03:31 +0000 2015,6.48876E+17,0,4,I #StandWithPP. Change your profile pic and show your support for reproductive health &amp; rights! → http://t.co/YNvbBIoMkP,SenatorShaheen,Jeanne Shaheen,New Hampshire,Democratic
1363,Tue Sep 29 15:02:00 +0000 2015,6.48875E+17,0,6,So good to see Lynn Stanley of @NHafterschool &amp; Donald Bossi of @FRCTeams Manchester at @MottFoundation #STEM Summit http://t.co/DtLHerjCBT,SenatorShaheen,Jeanne Shaheen,New Hampshire,Democratic
1364,Tue Sep 29 14:59:42 +0000 2015,6.48875E+17,1,36,On behalf of the millions of women who are served by Planned Parenthood #StandWithPP,SenatorShaheen,Jeanne Shaheen,New Hampshire,Democratic
1365,Tue Sep 29 14:23:48 +0000 2015,6.48866E+17,0,1,.@SenatorTimScott &amp; I welcomed House passage of our bill to improve #ACA for small &amp; mid-size businesses: http://t.co/gYZIWVyDMs,SenatorShaheen,Jeanne Shaheen,New Hampshire,Democratic
1366,Tue Sep 29 14:08:54 +0000 2015,6.48862E+17,1,1,Congrats to the students &amp; teachers of Canaan Elementary School &amp; the Gilmanton School for being named National Blue Ribbon Schools for '15,SenatorShaheen,Jeanne Shaheen,New Hampshire,Democratic
1367,Mon Sep 28 14:26:50 +0000 2015,6.48504E+17,0,5,"This AM, it was an honor to be sworn-in to serve on @NavalAcademy board that provides oversight http://t.co/HxcfY2lmkL",SenatorShaheen,Jeanne Shaheen,New Hampshire,Democratic
1368,Mon Sep 28 12:44:49 +0000 2015,6.48478E+17,0,2,Great story in @UnionLeader today about WWII vet Leo Buote's visit to DC thanks to Honor Flight New England: http://t.co/bjfmxKA7Am,SenatorShaheen,Jeanne Shaheen,New Hampshire,Democratic
1369,Sun Sep 27 16:45:04 +0000 2015,6.48177E+17,0,3,Good luck to the @Patriots this afternoon against @Jaguars! Let's make it 3-0  #GoPats #PatriotsNation,SenatorShaheen,Jeanne Shaheen,New Hampshire,Democratic
1370,Sat Sep 26 14:10:19 +0000 2015,6.47775E+17,3,3,"Opioid abuse is taking a terrible toll in NH, but you can help. More from me on National Drug Take-Back Day: http://t.co/AyvgPNqkS8",SenatorShaheen,Jeanne Shaheen,New Hampshire,Democratic
1371,Fri Sep 25 21:00:00 +0000 2015,6.47516E+17,2,2,"Today @Pontifex lit a candle at Ground Zero made in Contoocook,NH. Story in @ConMonitorNews http://t.co/VZOge6hgtT http://t.co/66v7OBbrCA",SenatorShaheen,Jeanne Shaheen,New Hampshire,Democratic
1372,Fri Sep 25 20:51:12 +0000 2015,6.47514E+17,0,2,".@USAirForce announcement to treat all 3 wells at Pease a big step fwd,shows commitment to rid wells of contaminants:http://t.co/GXmZl8FA33",SenatorShaheen,Jeanne Shaheen,New Hampshire,Democratic
1373,Fri Sep 25 20:18:43 +0000 2015,6.47506E+17,0,7,"As Syrian refugee crisis worsens, I’m leading a resolution calling for international cooperation to address issue:  http://t.co/8957fzP9OY",SenatorShaheen,Jeanne Shaheen,New Hampshire,Democratic
1374,Fri Sep 25 17:16:28 +0000 2015,6.4746E+17,0,4,Remember that every day you can safely dispose of Rx drugs. You can find a #DrugTakeBack location near you here: http://t.co/U6cKFAXdoK,SenatorShaheen,Jeanne Shaheen,New Hampshire,Democratic
1375,Fri Sep 25 17:12:37 +0000 2015,6.47459E+17,1,3,#DrugTakeBack day is tomorrow. Lets all pitch in &amp; do our part in the fight against heroin &amp; opioid abuse epidemic. http://t.co/LfcbbizIEB,SenatorShaheen,Jeanne Shaheen,New Hampshire,Democratic
1376,Fri Sep 25 15:47:18 +0000 2015,6.47437E+17,0,1,"From @Portsmouthnhpd, “It’s time.” https://t.co/a643n6vyE4",SenatorShaheen,Jeanne Shaheen,New Hampshire,Democratic
1377,Fri Sep 25 15:16:47 +0000 2015,6.4743E+17,4,9,#NationalLobsterDay is a delicious reminder of the importance of lobstering to the seacoast economy! http://t.co/oOvudsHWB8,SenatorShaheen,Jeanne Shaheen,New Hampshire,Democratic
1378,Fri Sep 25 14:31:29 +0000 2015,6.47418E+17,0,1,Lobstering is an important part of NH’s heritage &amp; continues to support families on NH seacoast. Happy #NationalLobsterDay,SenatorShaheen,Jeanne Shaheen,New Hampshire,Democratic
1379,Fri Sep 25 11:51:19 +0000 2015,6.47378E+17,0,1,"Today, Gen Joe Dunford takes over as Chairman of the Joint Chiefs. He'll do a great job. &amp; thank you to Gen. Dempsey for service as Chairman",SenatorShaheen,Jeanne Shaheen,New Hampshire,Democratic
1380,Thu Sep 24 22:18:59 +0000 2015,6.47173E+17,0,2,".@ENERGY will issue supplement to EIS, extend public comment period &amp; delay public hearings on N.Pass. More NH input http://t.co/Okm5PzNFs4",SenatorShaheen,Jeanne Shaheen,New Hampshire,Democratic
1381,Thu Sep 24 22:04:20 +0000 2015,6.4717E+17,0,1,W/NH Delegation urging @ENERGY Inspector General to ensure greater public input in @FERC review of pipeline proposal http://t.co/BiXUyBxPyf,SenatorShaheen,Jeanne Shaheen,New Hampshire,Democratic
1382,Thu Sep 24 15:14:11 +0000 2015,6.47067E+17,3,7,Wonderful to hear @Pontifex powerful vision of hope and kindness. We should all heed his call to treat one another with respect.,SenatorShaheen,Jeanne Shaheen,New Hampshire,Democratic
1383,Thu Sep 24 13:44:30 +0000 2015,6.47044E+17,0,3,.@Pontifex has now arrived at the Capitol. Billy &amp; I are very excited to hear his message to Congress.,SenatorShaheen,Jeanne Shaheen,New Hampshire,Democratic
1384,Thu Sep 24 13:42:20 +0000 2015,6.47043E+17,0,2,My thoughts &amp; prayers are with the victims of the stampede at the annual Hajj pilgrimage &amp; their families. So tragic.,SenatorShaheen,Jeanne Shaheen,New Hampshire,Democratic
1385,Thu Sep 24 13:09:09 +0000 2015,6.47035E+17,0,7,A powerful report in today’s @UnionLeader of NH parents bravely telling the story of their son’s death to warn others http://t.co/tcnpsmRrB5,SenatorShaheen,Jeanne Shaheen,New Hampshire,Democratic
1386,Wed Sep 23 21:13:34 +0000 2015,6.46795E+17,0,3,Disgraceful that LWCFfund-which has done so much 2 protect NH’s beautiful spaces-is being ignored by GOP leadership http://t.co/mG2iIhNKCt,SenatorShaheen,Jeanne Shaheen,New Hampshire,Democratic
1387,Wed Sep 23 17:54:50 +0000 2015,6.46745E+17,1,22,"In June, I presented the @AtlanticCouncil Freedom award in absentia to Nadiya's sister, Vira, #FreeSavchenko http://t.co/abFU8SU6PN",SenatorShaheen,Jeanne Shaheen,New Hampshire,Democratic
1388,Wed Sep 23 17:54:12 +0000 2015,6.46744E+17,1,13,"Yesterday, Russia began a show-trial of Nadiya Savchenko. My letter to the Russian ambassador --&gt; http://t.co/YlFhfyJW8u #FreeSavchenko",SenatorShaheen,Jeanne Shaheen,New Hampshire,Democratic
1389,Wed Sep 23 17:49:19 +0000 2015,6.46743E+17,0,4,".@Pontifex message of hope &amp; mercy, &amp; his personal example of humility &amp; grace are an inspiration to Americans of all faiths",SenatorShaheen,Jeanne Shaheen,New Hampshire,Democratic
1390,Wed Sep 23 17:46:23 +0000 2015,6.46742E+17,1,6,Was a great honor to see @Pontifex at the White House this AM. My full statement welcoming him on 1st visit to US: http://t.co/lUMYV4UFnj,SenatorShaheen,Jeanne Shaheen,New Hampshire,Democratic
1391,Tue Sep 22 22:16:37 +0000 2015,6.46448E+17,0,7,#Energyefficiency is a key building block of the new Democratic energy bill. My statement at press conference today: https://t.co/OOn5PdI4aK,SenatorShaheen,Jeanne Shaheen,New Hampshire,Democratic
1392,Tue Sep 22 20:47:49 +0000 2015,6.46426E+17,1,4,I wish everyone observing Yom Kippur an easy fast.,SenatorShaheen,Jeanne Shaheen,New Hampshire,Democratic
1393,Tue Sep 22 17:52:03 +0000 2015,6.46381E+17,0,6,A big congratulations to @GraniteStateIL CEO Clyde Terry on his appointment to be Chairperson of @NatCounDis,SenatorShaheen,Jeanne Shaheen,New Hampshire,Democratic
1394,Tue Sep 22 16:33:16 +0000 2015,6.46362E+17,0,5,"As #Irandeal path is cleared, I've sent European allies a letter urging unified response to any Iran violations: http://t.co/8Qko0pgXWK",SenatorShaheen,Jeanne Shaheen,New Hampshire,Democratic
1395,Mon Sep 21 22:20:53 +0000 2015,6.46087E+17,4,15,My full statement on the Senate floor denouncing the Republican threat to shutdown gov't over @PPFA funding WATCH: https://t.co/zuGIi00HMc,SenatorShaheen,Jeanne Shaheen,New Hampshire,Democratic
1396,Mon Sep 21 21:38:11 +0000 2015,6.46076E+17,3,4,Speaking on the Senate floor now about Republican threat to shutdown gov't over women's health care. Watch: http://t.co/Nb1OEQUUma,SenatorShaheen,Jeanne Shaheen,New Hampshire,Democratic
1397,Mon Sep 21 18:23:28 +0000 2015,6.46027E+17,5,3,Last time Republicans recklessly shutdown the gov’t it hurt tourism &amp; our economy in NH. Employees were furloughed &amp; businesses suffered,SenatorShaheen,Jeanne Shaheen,New Hampshire,Democratic
1398,Mon Sep 21 18:01:38 +0000 2015,6.46021E+17,0,2,Must read op-ed by @GovPeterShumlin in today’s NYTimes on FDA decision to prescribe OxyContin to kids: http://t.co/QOiv4LYYln,SenatorShaheen,Jeanne Shaheen,New Hampshire,Democratic
1399,Mon Sep 21 17:41:35 +0000 2015,6.46016E+17,0,3,Our military rescued Yazidis trapped on Mt. Sinjar over 1 year ago. We must continue protecting Iraqi minorities: http://t.co/BfmkQEhwuk,SenatorShaheen,Jeanne Shaheen,New Hampshire,Democratic
1400,Mon Sep 21 15:58:50 +0000 2015,6.45991E+17,0,6,"I #StandWithPP in Exeter, NH today http://t.co/epE11Lcu7z",SenatorShaheen,Jeanne Shaheen,New Hampshire,Democratic
1401,Mon Sep 21 14:43:22 +0000 2015,6.45972E+17,2,26,"It is reckless to shut down fed govt for any reason, but to do so to deny women access to health care is beyond irresponsible #StandWithPP",SenatorShaheen,Jeanne Shaheen,New Hampshire,Democratic
1402,Mon Sep 21 14:38:50 +0000 2015,6.4597E+17,2,17,"On behalf of millions of women served by @PPFA , I will oppose any attempt to defund women’s health care services in Congress #StandWithPP",SenatorShaheen,Jeanne Shaheen,New Hampshire,Democratic
1403,Mon Sep 21 14:35:11 +0000 2015,6.4597E+17,4,7,"In NH last year alone, @PPFA of N. New England served more than 12,000 women, many of whom are low-income #StandWithPP",SenatorShaheen,Jeanne Shaheen,New Hampshire,Democratic
1404,Mon Sep 21 14:32:41 +0000 2015,6.45969E+17,1,3,I'll be at @PPFA in Exeter today for a press conf. to address the latest threat to shut down the Gov’t over women’s health care #StandWithPP,SenatorShaheen,Jeanne Shaheen,New Hampshire,Democratic
1405,Sun Sep 20 16:42:47 +0000 2015,6.45639E+17,0,4,Good luck to the @Patriots today! #GoPats,SenatorShaheen,Jeanne Shaheen,New Hampshire,Democratic
1406,Fri Sep 18 13:58:58 +0000 2015,6.44873E+17,1,2,Proud of 157th Air Refueling Wing at Pease for earning the right to be the Guard's first home base for the KC-46 http://t.co/JQd9lKh6BA,SenatorShaheen,Jeanne Shaheen,New Hampshire,Democratic
