,created_at,id_str,reply_count,retweet_count,text,user,name,state,party
0,Fri May 19 21:07:25 +0000 2017,8.65675E+17,5,46,"Very disappointed that Trump admin budget includes deep cuts to EPA, incl. Superfund program &amp; state enviro. grants https://t.co/XexFIXc6f4",SenatorShaheen,Jeanne Shaheen,New Hampshire,Democratic
1,Fri May 19 14:03:17 +0000 2017,8.65569E+17,0,4,Very impt op-ed from Joe Pepe of @CMCHealth on threat from carfentanil. Could be lethal new chapter in opioid crisis https://t.co/1q8FKmxVro,SenatorShaheen,Jeanne Shaheen,New Hampshire,Democratic
2,Fri May 19 13:54:15 +0000 2017,8.65566E+17,2,9,CDBG fund NH treatment centers like Friendship House--critical for people like Kimberley Phillips from Bethlehem https://t.co/acNgeIrY1e,SenatorShaheen,Jeanne Shaheen,New Hampshire,Democratic
3,Thu May 18 18:29:11 +0000 2017,8.65273E+17,8,50,"I’m contacting State Dept abt these visa requests for LGBT individuals fleeing Chechnya. U.S. should be safe haven 
https://t.co/AROlWGtrXF",SenatorShaheen,Jeanne Shaheen,New Hampshire,Democratic
4,Thu May 18 12:51:56 +0000 2017,8.65188E+17,5,30,@Cosmopolitan Today I'll introduce the Keeping Girls in School Act to address obstacles 130 million girls face in g… https://t.co/BhBKOK2x9A,SenatorShaheen,Jeanne Shaheen,New Hampshire,Democratic
5,Thu May 18 12:51:31 +0000 2017,8.65188E+17,5,17,"Great chatting w/@Cosmopolitan yday about girls education, Russia probe &amp; why it's impt to have women at the table https://t.co/R3mTZ2YU6X",SenatorShaheen,Jeanne Shaheen,New Hampshire,Democratic
6,Wed May 17 22:39:47 +0000 2017,8.64974E+17,12,42,My statement on former FBI Director Robert Mueller being appointed as special counsel: https://t.co/qcIKaAGnAv,SenatorShaheen,Jeanne Shaheen,New Hampshire,Democratic
7,Wed May 17 20:10:37 +0000 2017,8.64936E+17,5,9,LGBT rights are human rights &amp; I've intro'd leg that punishes those who would commit violence #EyesOnChechnya https://t.co/WqOt3hEtPh,SenatorShaheen,Jeanne Shaheen,New Hampshire,Democratic
8,Wed May 17 20:10:03 +0000 2017,8.64936E+17,3,10,"While we have made tremendous progress, #IDAHOT is reminder that LGBT community should be free from violence&amp; harassment in both US&amp; abroad.",SenatorShaheen,Jeanne Shaheen,New Hampshire,Democratic
9,Wed May 17 18:24:29 +0000 2017,8.6491E+17,2,8,#LWCF preserves NH sites like White Mountain Natl Forest &amp; strengthens the outdoor economy. I led a bipartisan lett… https://t.co/mU3mciDbLE,SenatorShaheen,Jeanne Shaheen,New Hampshire,Democratic
10,Wed May 17 15:10:25 +0000 2017,8.64861E+17,20,45,What’s next in @realDonaldTrump’s campaign to roll back women’s rights?,SenatorShaheen,Jeanne Shaheen,New Hampshire,Democratic
11,Wed May 17 15:10:04 +0000 2017,8.64861E+17,22,143,"Tues, Trump met w/Turkey's Erdogan, who rolled back women's rights &amp; pushed policies loosening sexual assault &amp; dom… https://t.co/PUhyM6Ko90",SenatorShaheen,Jeanne Shaheen,New Hampshire,Democratic
12,Wed May 17 15:09:17 +0000 2017,8.6486E+17,9,77,"Monday, Trump admin expanded dangerous Global Gag Rule, which will severely impact millions of vulnerable women &amp; f… https://t.co/NUYU6aKyE8",SenatorShaheen,Jeanne Shaheen,New Hampshire,Democratic
13,Wed May 17 15:08:22 +0000 2017,8.6486E+17,21,104,"Sunday, Trump “celebrated” national women’s health week, but his policies undermine progress and endanger the healt… https://t.co/4ZNqSzyFj2",SenatorShaheen,Jeanne Shaheen,New Hampshire,Democratic
14,Tue May 16 19:36:52 +0000 2017,8.64565E+17,7,13,".@SenatorHassan &amp; I intro’d leg to preserve &amp; protect ONDCP, which is critical to NH's fight against opioid epidemic https://t.co/JrTFyKoAUS",SenatorShaheen,Jeanne Shaheen,New Hampshire,Democratic
15,Tue May 16 19:17:49 +0000 2017,8.64561E+17,1,1,"Great meeting Lauren Cavignano from Amherst, a junior at Souhegan HS &amp; a U.S. Senate Page. Glad to have her in DC o… https://t.co/ANSjVqvhxX",SenatorShaheen,Jeanne Shaheen,New Hampshire,Democratic
16,Tue May 16 18:09:53 +0000 2017,8.64543E+17,0,5,Met w/@SenScottBrown ahead of his hearing to serve as ambassador to New Zealand. Wished him best of luck &amp; reiterat… https://t.co/J2hVUk2SUk,SenatorShaheen,Jeanne Shaheen,New Hampshire,Democratic
17,Tue May 16 15:42:33 +0000 2017,8.64506E+17,4,9,With my colleagues from states hardest by the opioid epidemic speaking out against GOP healthcare repeal bill https://t.co/szcxw5eybG,SenatorShaheen,Jeanne Shaheen,New Hampshire,Democratic
18,Tue May 16 15:11:50 +0000 2017,8.64499E+17,5,45,Colleagues &amp; I are speaking out against GOP healthcare repeal &amp;its disastrous impact on opioid epidemic. Watch live: https://t.co/VZkN1zYF9w,SenatorShaheen,Jeanne Shaheen,New Hampshire,Democratic
19,Mon May 15 23:03:55 +0000 2017,8.64255E+17,37,115,"Sharing intel w/ adversaries undermines key relationships w/ allies &amp; threatens our national security. If true, this is reckless &amp; dangerous",SenatorShaheen,Jeanne Shaheen,New Hampshire,Democratic
20,Mon May 15 20:39:57 +0000 2017,8.64219E+17,1,10,Thank you to all the men &amp; women in uniform who serve our communities &amp; help keep our families safe. #NationalPoliceWeek,SenatorShaheen,Jeanne Shaheen,New Hampshire,Democratic
21,Mon May 15 20:17:44 +0000 2017,8.64213E+17,0,4,"This AM, former NFLer Jeff Hatch &amp; I spoke w/Portsmouth High students about preventing substance misuse among stude… https://t.co/nLfK6ocdFZ",SenatorShaheen,Jeanne Shaheen,New Hampshire,Democratic
22,Mon May 15 20:03:49 +0000 2017,8.6421E+17,0,5,TY @gmfus for hosting 70th anniv. of Marshall Plan panel. Investing in other countries is critical for natl security https://t.co/dSjFC2FGsE,SenatorShaheen,Jeanne Shaheen,New Hampshire,Democratic
23,Mon May 15 19:29:33 +0000 2017,8.64201E+17,8,92,Trump admin's expanded #GlobalGag has severe consequences for millions of vulnerable women &amp; undermines US humanita… https://t.co/MeHLNmnIzg,SenatorShaheen,Jeanne Shaheen,New Hampshire,Democratic
24,Mon May 15 18:50:06 +0000 2017,8.64191E+17,6,24,Assad has committed heinous crimes against Syrians. I’m a cosponsor of Syrian War Crimes Accountability Act--Assad… https://t.co/oxqBKtc5SI,SenatorShaheen,Jeanne Shaheen,New Hampshire,Democratic
25,Sun May 14 14:44:16 +0000 2017,8.63767E+17,1,8,"Happy #MothersDay! Best wishes to everyone celebrating their moms, grandmothers &amp; influential women in their lives today",SenatorShaheen,Jeanne Shaheen,New Hampshire,Democratic
26,Fri May 12 22:39:36 +0000 2017,8.63162E+17,8,37,Very concerned by recent news at EPA.US must continue to lead in unbiased scientific research &amp; environmental policy https://t.co/Krpy8WcxjL,SenatorShaheen,Jeanne Shaheen,New Hampshire,Democratic
27,Fri May 12 17:26:34 +0000 2017,8.63083E+17,18,146,"Dir Mulvaney’s comments on diabetes show ignorance for millions of Americans living w/t1 &amp; t2 diabetes, &amp; economic toll it takes on families",SenatorShaheen,Jeanne Shaheen,New Hampshire,Democratic
28,Fri May 12 15:59:11 +0000 2017,8.63061E+17,0,9,Had a great visit to Rockingham Brewery Company in Derry. Excited to have them participating in 8th Annual Experien… https://t.co/2j7o1mNhtQ,SenatorShaheen,Jeanne Shaheen,New Hampshire,Democratic
29,Fri May 12 15:24:20 +0000 2017,8.63052E+17,0,4,Great to meet AF academy nominee Adam Morris &amp; Salem high students this am w/@SenatorHassan after our Washington Up… https://t.co/2rpGDTsoKh,SenatorShaheen,Jeanne Shaheen,New Hampshire,Democratic
30,Thu May 11 15:41:26 +0000 2017,8.62694E+17,17,59,.@SenatorLeahy &amp; I sent a letter to Dep AG Rosentein seeking info on former FBI Dir. Comey’s reported request for R… https://t.co/OxjdbEzMEP,SenatorShaheen,Jeanne Shaheen,New Hampshire,Democratic
31,Thu May 11 14:33:54 +0000 2017,8.62677E+17,46,118,Russians knew what they were doing yesterday. This sends horrible message to the world. https://t.co/w3XTwPb5vn,SenatorShaheen,Jeanne Shaheen,New Hampshire,Democratic
32,Wed May 10 20:24:00 +0000 2017,8.62403E+17,4,26,".@SecPriceMD said Trump admin's focus is to provide care to every American, but words don't match actions. My state… https://t.co/zlBKEPxkBQ",SenatorShaheen,Jeanne Shaheen,New Hampshire,Democratic
33,Wed May 10 16:18:24 +0000 2017,8.62341E+17,35,138,I intend to look into this through my role as Ranking of Approps Subcommittee which oversees Justice/FBI budget https://t.co/8rf8pWOARz,SenatorShaheen,Jeanne Shaheen,New Hampshire,Democratic
34,Wed May 10 00:01:28 +0000 2017,8.62095E+17,99,602,My statement on @realDonaldTrump firing of FBI Director James Comey https://t.co/66C8tTuKnB,SenatorShaheen,Jeanne Shaheen,New Hampshire,Democratic
35,Tue May 09 19:47:13 +0000 2017,8.62031E+17,3,15,Congratulations to @GYKAntler &amp; @BadgerBalmUSA -- two NH companies named 2017 'Best #Smallbiz' by @forbes… https://t.co/UNAza6Hxwj,SenatorShaheen,Jeanne Shaheen,New Hampshire,Democratic
36,Tue May 09 18:40:40 +0000 2017,8.62014E+17,60,75,What's wrong with this picture? https://t.co/iS4qL55899,SenatorShaheen,Jeanne Shaheen,New Hampshire,Democratic
37,Tue May 09 15:36:16 +0000 2017,8.61968E+17,1,10,"On #NationalTeachersDay &amp; every day, TY to all the Granite State educators who dedicate themselves to our children’s futures",SenatorShaheen,Jeanne Shaheen,New Hampshire,Democratic
38,Mon May 08 18:56:01 +0000 2017,8.61656E+17,10,49,Today’s #NationalWomensCheckupDay–a reminder that women in NH depend on @PPact for healthcare. But GOP repeal bill… https://t.co/w0r1mjLmq7,SenatorShaheen,Jeanne Shaheen,New Hampshire,Democratic
39,Mon May 08 18:44:39 +0000 2017,8.61653E+17,1,6,.@BostonGlobe @nytimes And @washingtonpost: https://t.co/zVUmZMqWjC,SenatorShaheen,Jeanne Shaheen,New Hampshire,Democratic
40,Mon May 08 18:43:48 +0000 2017,8.61653E+17,2,9,.@BostonGlobe @nytimes From Bloomberg: https://t.co/MRU1FR0NIM,SenatorShaheen,Jeanne Shaheen,New Hampshire,Democratic
41,Mon May 08 18:42:20 +0000 2017,8.61653E+17,2,4,.@BostonGlobe From the @nytimes: https://t.co/uZK15oKsd7,SenatorShaheen,Jeanne Shaheen,New Hampshire,Democratic
42,Mon May 08 18:41:37 +0000 2017,8.61652E+17,2,9,From the @BostonGlobe: https://t.co/oFnM0bsAcM,SenatorShaheen,Jeanne Shaheen,New Hampshire,Democratic
43,Mon May 08 18:38:55 +0000 2017,8.61652E+17,4,43,Editorial boards across the country are calling out disastrous House GOP repeal bill. From the Concord Monitor: https://t.co/tvkUcFW3KS,SenatorShaheen,Jeanne Shaheen,New Hampshire,Democratic
44,Mon May 08 15:12:00 +0000 2017,8.616E+17,4,13,"""If GOP repeal bill became law it would take a wrecking ball to progress we've made to address the opioid epidemic""
https://t.co/fWil1chNqV",SenatorShaheen,Jeanne Shaheen,New Hampshire,Democratic
45,Mon May 08 15:02:28 +0000 2017,8.61597E+17,8,11,.@SenatorHassan &amp; I are talking about #AHCA &amp; devastating impact it would have on NH &amp; the opioid epidemic. Tune in: https://t.co/cKNw3BPoGE,SenatorShaheen,Jeanne Shaheen,New Hampshire,Democratic
46,Sun May 07 22:17:22 +0000 2017,8.61344E+17,13,35,"Congrats to Emmanuel Macron! Kremlin tried dirty tricks to influence outcome but in the end, a resounding rebuttal from the French people",SenatorShaheen,Jeanne Shaheen,New Hampshire,Democratic
47,Sat May 06 15:57:41 +0000 2017,8.60886E+17,1,3,.@NHSBDC Team #LaneyAndLu is nothing but love. Pop in on a weekly café recognized holiday “Haturday” to see what th… https://t.co/xD3IKUEds7,SenatorShaheen,Jeanne Shaheen,New Hampshire,Democratic
48,Sat May 06 15:56:42 +0000 2017,8.60886E+17,1,9,".@NHSBDC This NH #smallbusiness reduces environmental impact - they use compostable packaging, eco-friendly product… https://t.co/JInZZ1fZM9",SenatorShaheen,Jeanne Shaheen,New Hampshire,Democratic
49,Sat May 06 15:55:47 +0000 2017,8.60886E+17,1,4,".@NHSBDC #LaneyAndLu serves up vibrant, fresh food in downtown Exeter. The cafe sources from local farmers and merc… https://t.co/uhsDKJXvwe",SenatorShaheen,Jeanne Shaheen,New Hampshire,Democratic
50,Sat May 06 15:55:15 +0000 2017,8.60886E+17,2,5,"#SmallBusinessWeek celebration continues with #LaneyAndLu in Exeter, another #smallbusiness that was helped by grea… https://t.co/Vl4lf7J5qj",SenatorShaheen,Jeanne Shaheen,New Hampshire,Democratic
51,Fri May 05 19:54:17 +0000 2017,8.60583E+17,5,23,.@realDonaldTrump must keep his word &amp; preserve Office of Natl Drug Control Policy--critical in fight to combat NH'… https://t.co/NlHLIHRO91,SenatorShaheen,Jeanne Shaheen,New Hampshire,Democratic
52,Fri May 05 17:39:25 +0000 2017,8.6055E+17,7,13,.@POTUS Ensuring women can access affordable preventive care should be a no-brainer. That's why I co-spons the Save… https://t.co/A2xAT6muys,SenatorShaheen,Jeanne Shaheen,New Hampshire,Democratic
53,Fri May 05 17:38:52 +0000 2017,8.60549E+17,10,30,"Btwn House passage of ACA repeal &amp; @POTUS religious EO, yday was a sad day for women’s health &amp; the progress we’ve fought so hard for 1/2",SenatorShaheen,Jeanne Shaheen,New Hampshire,Democratic
54,Thu May 04 21:10:31 +0000 2017,8.6024E+17,6,20,I'm leading a bipartisan effort to get answers from the Trump admin about our nation's refugee policies. More: https://t.co/HXqpBpRpcL,SenatorShaheen,Jeanne Shaheen,New Hampshire,Democratic
55,Thu May 04 18:43:49 +0000 2017,8.60203E+17,72,491,"As NH battles opioid crisis, House GOP votes to takeaway treatment. I'll be working across the aisle to stop this plan in its tracks",SenatorShaheen,Jeanne Shaheen,New Hampshire,Democratic
56,Thu May 04 17:09:41 +0000 2017,8.6018E+17,5,33,Trump EO continues dangerous campaign to roll back repro rights &amp; allows employers to target women’s health under guise of religious freedom,SenatorShaheen,Jeanne Shaheen,New Hampshire,Democratic
57,Thu May 04 14:33:47 +0000 2017,8.6014E+17,3,13,Devastating bill that has only been made worse in recent weeks--reckless to force vote w/o knowing how many more people will be impacted 2/2,SenatorShaheen,Jeanne Shaheen,New Hampshire,Democratic
58,Thu May 04 14:32:50 +0000 2017,8.6014E+17,8,27,"Healthcare repeal wld be a huge blow to NH by raising costs, reducing coverage, eliminating pre-existing protections &amp; opioid treatment 1/2",SenatorShaheen,Jeanne Shaheen,New Hampshire,Democratic
59,Wed May 03 18:00:26 +0000 2017,8.5983E+17,0,3,.@NHSBDC The Bagshaw’s credit a diverse workforce for continued success over 147 years! Lucky to have this NH… https://t.co/Bu6rgzDAiD,SenatorShaheen,Jeanne Shaheen,New Hampshire,Democratic
60,Wed May 03 17:59:54 +0000 2017,8.5983E+17,1,3,".@NHSBDC helped Bagshaw plan for acquisition of Minnesota Ice Picks, allowing this NH #smallbusiness to grow with n… https://t.co/zRtN9oe3Xb",SenatorShaheen,Jeanne Shaheen,New Hampshire,Democratic
61,Wed May 03 17:59:24 +0000 2017,8.5983E+17,1,2,Old and new tech comes together at W.H. Bagshaw. Investment in CNC equipment allowed Adria &amp; Aaron to double size o… https://t.co/R8kNu3UIxw,SenatorShaheen,Jeanne Shaheen,New Hampshire,Democratic
62,Wed May 03 17:58:57 +0000 2017,8.5983E+17,1,4,"Our #smallbusinessweek celebration continues with Nashua-based W.H Bagshaw, a family-owned #smallbusiness that’s ma… https://t.co/pVJuipCdJA",SenatorShaheen,Jeanne Shaheen,New Hampshire,Democratic
63,Wed May 03 17:16:23 +0000 2017,8.59819E+17,1,4,.@MarkHuddleston has accomplished so much at @UofNH. TY for all your hard work&amp;congrats on your retirement next year--will be well deserved!,SenatorShaheen,Jeanne Shaheen,New Hampshire,Democratic
64,Wed May 03 16:28:47 +0000 2017,8.59807E+17,0,1,Congrats to our 3 NH @EPA Merit Award winners &amp; Tom Burack &amp;John Aber! Proud of Granite Staters leading the fight to protect our environment,SenatorShaheen,Jeanne Shaheen,New Hampshire,Democratic
65,Wed May 03 13:18:05 +0000 2017,8.59759E+17,0,2,Congrats to Madbury’s Grace Henderson on making the US Ski Team &amp; good luck!,SenatorShaheen,Jeanne Shaheen,New Hampshire,Democratic
66,Wed May 03 12:26:18 +0000 2017,8.59746E+17,2,5,"For #SmallBusinessWeek, I’m about to speak at @TheHillEvents #MainStreet2017. You can watch it here: https://t.co/e5BOnmApqq",SenatorShaheen,Jeanne Shaheen,New Hampshire,Democratic
67,Tue May 02 19:18:37 +0000 2017,8.59487E+17,4,7,"Wow! During Drug Take Back Day on Sat. NH rounded up 14,840 lbs of prescription drugs–a new record! Big congrats to all who participated!",SenatorShaheen,Jeanne Shaheen,New Hampshire,Democratic
68,Tue May 02 18:40:36 +0000 2017,8.59478E+17,0,7,Congrats to Londonderry PVC Pirates' FIRST team on their division title at @FIRSTweets Robotic World Championship!,SenatorShaheen,Jeanne Shaheen,New Hampshire,Democratic
69,Tue May 02 17:32:39 +0000 2017,8.59461E+17,4,34,Trump's appointee to oversee impt family planning program said contraception “doesn’t work.” My statement on Teresa… https://t.co/ArtfAd5qka,SenatorShaheen,Jeanne Shaheen,New Hampshire,Democratic
70,Tue May 02 15:55:16 +0000 2017,8.59436E+17,1,11,"For #SmallBusinessWeek, I wrote an op-ed w/@SenatorRisch on the importance of supporting small businesses &amp; owners: https://t.co/TxBlza3ShX",SenatorShaheen,Jeanne Shaheen,New Hampshire,Democratic
71,Tue May 02 15:17:00 +0000 2017,8.59427E+17,0,3,"When not in the lab, the Celdara Medical team spends time volunteering in the beautiful New Hampshire woods. A grea… https://t.co/dXiZkWnafU",SenatorShaheen,Jeanne Shaheen,New Hampshire,Democratic
72,Tue May 02 15:15:43 +0000 2017,8.59426E+17,1,3,Celdara CEO Jake Reder won the SBA's Small Business Person of the Year award but he knows his scientists make all t… https://t.co/6kEIDtZlX9,SenatorShaheen,Jeanne Shaheen,New Hampshire,Democratic
73,Tue May 02 15:15:07 +0000 2017,8.59426E+17,1,2,Celdara Medical scientists are working on therapies for some of the world's deadliest diseases with the assistance… https://t.co/V1y5mXmJ0W,SenatorShaheen,Jeanne Shaheen,New Hampshire,Democratic
74,Tue May 02 15:14:35 +0000 2017,8.59426E+17,2,5,"Celebrating #smallbusinessweek by highlighting a few great NH companies. Celdara Medical is a great #biotech #smallbusiness in Lebanon, NH",SenatorShaheen,Jeanne Shaheen,New Hampshire,Democratic
75,Tue May 02 14:15:08 +0000 2017,8.59411E+17,2,8,Thank you @jimmykimmel https://t.co/JKa4L7YhjV,SenatorShaheen,Jeanne Shaheen,New Hampshire,Democratic
76,Tue May 02 14:10:26 +0000 2017,8.5941E+17,1,16,A big congrats to @UofNH on your 150th anniversary! Quality ed &amp; research they provide are so important for the Granite State,SenatorShaheen,Jeanne Shaheen,New Hampshire,Democratic
77,Tue May 02 13:05:08 +0000 2017,8.59393E+17,2,13,"Admin says they support empowering girls – if so, I look forward to working w/them on my Keeping Girls in School Act https://t.co/bNh4TqGY8E",SenatorShaheen,Jeanne Shaheen,New Hampshire,Democratic
78,Mon May 01 22:11:32 +0000 2017,8.59168E+17,4,17,".@SenatorHassan &amp; I got to meet Rumor, the 2017 Westminster Best in Show winner -- highlight of the evening https://t.co/gLUmxrKhiJ",SenatorShaheen,Jeanne Shaheen,New Hampshire,Democratic
79,Mon May 01 21:59:51 +0000 2017,8.59165E+17,4,36,Will soon intro Keeping Girls in School Act to build on #LetGirlsLearn legacy &amp; address unique obstacles faced by girls seeking edu. 2/2,SenatorShaheen,Jeanne Shaheen,New Hampshire,Democratic
80,Mon May 01 21:59:28 +0000 2017,8.59165E+17,15,87,Disappointed Trump admin is ending #LetGirlsLearn. I stand w/adolescent girls who are denied opportunity to reach their full potential 1/2,SenatorShaheen,Jeanne Shaheen,New Hampshire,Democratic
81,Mon May 01 19:10:11 +0000 2017,8.59123E+17,1,9,Govt funding bill has additional $ for #VAWA to help prevent violence against women. Excited to make bipartisan progress on this issue!,SenatorShaheen,Jeanne Shaheen,New Hampshire,Democratic
82,Mon May 01 17:31:05 +0000 2017,8.59098E+17,1,2,...Includes full funding 21st Century Cures &amp; CARA. I'll continue to fight for these life-saving efforts in the Sen… https://t.co/vABNkLPMjc,SenatorShaheen,Jeanne Shaheen,New Hampshire,Democratic
83,Mon May 01 17:25:16 +0000 2017,8.59096E+17,8,16,Helped secure $822M for the opioid fight across the country in govt funding bill--More help is on the way: https://t.co/mCHCr1Il2B,SenatorShaheen,Jeanne Shaheen,New Hampshire,Democratic
84,Mon May 01 16:13:14 +0000 2017,8.59078E+17,1,7,Thx @PopzupPopcorn for hosting me to kick off #SmallBusinessWeek. Small biz make up 99% of NH employers &amp; create 2… https://t.co/paECg6b75J,SenatorShaheen,Jeanne Shaheen,New Hampshire,Democratic
85,Mon May 01 14:18:57 +0000 2017,8.5905E+17,5,16,"My statement on the 2500 Afghan interpreter visas in govt funding bill. In March, I requested this amount be added:… https://t.co/935497s5ok",SenatorShaheen,Jeanne Shaheen,New Hampshire,Democratic
86,Mon May 01 14:02:37 +0000 2017,8.59045E+17,10,25,Relieved govt funding bill has 2500 visas for Afghan interpreters &amp; support staff. Potentially life-saving for these brave men &amp; women,SenatorShaheen,Jeanne Shaheen,New Hampshire,Democratic
87,Sun Apr 30 14:22:53 +0000 2017,8.58688E+17,15,80,Duterte's death squads have murdered thousands on drug suspicions. Appalling that POTUS praised drug response&amp;offered WH visit.Must rescind!,SenatorShaheen,Jeanne Shaheen,New Hampshire,Democratic
88,Sat Apr 29 19:14:51 +0000 2017,8.58399E+17,4,20,"Great to join the People’s Climate March in Concord today. We must take action, stop climate change &amp; preserve our… https://t.co/WN9xK4TkKq",SenatorShaheen,Jeanne Shaheen,New Hampshire,Democratic
89,Sat Apr 29 18:02:01 +0000 2017,8.58381E+17,2,17,Today marks Day of Remembrance for All Victims of Chemical Warfare. We must eliminate the use of chemical weapons &amp; deliver justice.,SenatorShaheen,Jeanne Shaheen,New Hampshire,Democratic
90,Thu Apr 27 21:27:04 +0000 2017,8.57708E+17,3,8,Great to meet w/ @Vets4AmerIdeals today. TY for all you do for Afghan interpreters/support staff. Critical that Con… https://t.co/rxbJQq0eoG,SenatorShaheen,Jeanne Shaheen,New Hampshire,Democratic
91,Thu Apr 27 19:47:26 +0000 2017,8.57683E+17,2,6,"Great to meet Lucy today, daughter of Kate on my staff. Lucy is already an accomplished gymnast and--as you can see… https://t.co/c4o8wBEDZV",SenatorShaheen,Jeanne Shaheen,New Hampshire,Democratic
92,Thu Apr 27 16:25:20 +0000 2017,8.57632E+17,2,9,We cannot allow partisanship to prevent us from taking action. We must respond because our national security and our democracy are at stake,SenatorShaheen,Jeanne Shaheen,New Hampshire,Democratic
93,Thu Apr 27 16:24:47 +0000 2017,8.57632E+17,3,10,I have intro'd leg to prevent RT from using a shell corporation to dodge US laws &amp; to require documentation on their funding sources,SenatorShaheen,Jeanne Shaheen,New Hampshire,Democratic
94,Thu Apr 27 16:23:23 +0000 2017,8.57631E+17,1,6,"We should be committing more resources, not less, to these successful efforts to challenge Russia in the information space.",SenatorShaheen,Jeanne Shaheen,New Hampshire,Democratic
95,Thu Apr 27 16:22:51 +0000 2017,8.57631E+17,3,11,"Trump admin has proposed draconian cuts to the State Dept budget &amp; elimination of Voice of America, Radio Free Europe. This is a mistake.",SenatorShaheen,Jeanne Shaheen,New Hampshire,Democratic
96,Thu Apr 27 16:20:37 +0000 2017,8.57631E+17,3,4,"4 components: imposing more rigorous sanctions, bolstering NATO &amp; our allies, demonstrating support 4 Ukraine, &amp;cou… https://t.co/IqF7mpMexo",SenatorShaheen,Jeanne Shaheen,New Hampshire,Democratic
97,Thu Apr 27 16:19:01 +0000 2017,8.5763E+17,15,14,We must be united around one question: How do we prevent a recurrence of Putin’s interference in our election?,SenatorShaheen,Jeanne Shaheen,New Hampshire,Democratic
98,Thu Apr 27 16:18:22 +0000 2017,8.5763E+17,8,19,"If Russia gets a pass, it will interfere in future US elections not only at the presidential level, but also at the Senate and House level",SenatorShaheen,Jeanne Shaheen,New Hampshire,Democratic
99,Thu Apr 27 16:17:58 +0000 2017,8.5763E+17,3,12,"Despite the evidence, President Trump continues to publicly reject the idea that Russia interfered in the 2016 elec… https://t.co/Y8Fxw18b4y",SenatorShaheen,Jeanne Shaheen,New Hampshire,Democratic
100,Thu Apr 27 16:13:32 +0000 2017,8.57629E+17,8,18,Every American should be outraged. This outrage isn’t about party or partisanship. It’s about patriotism &amp; defending America’s democracy,SenatorShaheen,Jeanne Shaheen,New Hampshire,Democratic
101,Thu Apr 27 16:11:54 +0000 2017,8.57628E+17,2,10,Putin dramatically raised the stakes for the US by interfering in our 2016 election.,SenatorShaheen,Jeanne Shaheen,New Hampshire,Democratic
102,Thu Apr 27 16:11:11 +0000 2017,8.57628E+17,20,41,"The American people need to fully understand what Putin is doing.  And, together with our allies, we need to stop him.",SenatorShaheen,Jeanne Shaheen,New Hampshire,Democratic
103,Thu Apr 27 15:58:47 +0000 2017,8.57625E+17,4,12,"About to deliver my speech at @CAPAction outlining US response to Russian interference, watch it here: https://t.co/WDNlnMlqji",SenatorShaheen,Jeanne Shaheen,New Hampshire,Democratic
104,Thu Apr 27 14:11:44 +0000 2017,8.57598E+17,4,14,At noon I’ll be speaking at @CAPAction on Russia’s attacks on democracy &amp; need for US strategy. Watch it live here: https://t.co/WDNlnMlqji,SenatorShaheen,Jeanne Shaheen,New Hampshire,Democratic
105,Wed Apr 26 22:28:14 +0000 2017,8.57361E+17,1,7,National Rx Drug Take Back Day is this Saturday. Find the closest center for you to dispose of your old Rx drugs:… https://t.co/o5XJvvXrll,SenatorShaheen,Jeanne Shaheen,New Hampshire,Democratic
106,Wed Apr 26 17:26:12 +0000 2017,8.57285E+17,2,8,HELP Committee just passed my bipartisan bill to establish a national commission to advance diabetes care &amp; prevention. Let's find a cure,SenatorShaheen,Jeanne Shaheen,New Hampshire,Democratic
