,created_at,id_str,reply_count,retweet_count,text,user,name,state,party
1160,Mon Jun 22 15:18:40 +0000 2015,6.13003E+17,1,3,"VIDEO: Sen. Alexander congratulates @SenBobCorker for championing U.S. leadership, receiving @USGLC award:  http://t.co/hVvbar54yJ",SenAlexander,Lamar Alexander,Tennessee,Republican
1161,Fri Jun 19 16:43:12 +0000 2015,6.11937E+17,0,9,ICYMI: @thehill’s AB Stoddard writes that Sen Alexander is poised to end the federal mandate on #CommonCore: http://t.co/hJu7NU4J1u,SenAlexander,Lamar Alexander,Tennessee,Republican
1162,Fri Jun 19 14:35:57 +0000 2015,6.11905E+17,8,4,"""Democrats should have worked with Republicans to “improve this legislation to help keep the American people safe.” #ISIS #NationalSecurity",SenAlexander,Lamar Alexander,Tennessee,Republican
1163,Fri Jun 19 14:35:32 +0000 2015,6.11905E+17,1,2,"On @DeptofDefense funding: ""I voted for bipartisan legislation that supports our troops &amp; national defense.” #ISIS http://t.co/lR54otAT9C",SenAlexander,Lamar Alexander,Tennessee,Republican
1164,Thu Jun 18 19:28:16 +0000 2015,6.11616E+17,1,3,Alexander votes for Defense Authorization Act that supports #military and #nationalsecurity: http://t.co/0QCmmMExEK,SenAlexander,Lamar Alexander,Tennessee,Republican
1165,Thu Jun 18 19:11:17 +0000 2015,6.11612E+17,3,3,"Funding bill pushes back on @EPA regulations that “mean higher costs for #TN families, farmers &amp; businesses”: http://t.co/NSp5rPBafg",SenAlexander,Lamar Alexander,Tennessee,Republican
1166,Thu Jun 18 19:04:57 +0000 2015,6.11611E+17,1,2,"Alexander voted for approps. bill that would fund @GSMNP, Cherokee Nat’l Forest, Dale Hollow &amp; Erwin Fish Hatcheries: http://t.co/NSp5rPBafg",SenAlexander,Lamar Alexander,Tennessee,Republican
1167,Thu Jun 18 18:05:49 +0000 2015,6.11596E+17,2,2,AUDIO: “It is a dangerous practice to say that we are going to stop” b/c President #Obama threatens a #veto.: http://t.co/3cye0hFv7D [1:16],SenAlexander,Lamar Alexander,Tennessee,Republican
1168,Thu Jun 18 17:57:05 +0000 2015,6.11593E+17,1,5,Sen. Alexander votes to support #Tennessee outdoors and restrain @EPA regulations: http://t.co/NSp5rPBafg,SenAlexander,Lamar Alexander,Tennessee,Republican
1169,Thu Jun 18 12:24:53 +0000 2015,6.1151E+17,0,2,VIDEO: Alexander discusses “unleashing #nuclear power &amp; doubling basic #energy research to create #jobs” http://t.co/EJU9JarLIF,SenAlexander,Lamar Alexander,Tennessee,Republican
1170,Wed Jun 17 16:16:49 +0000 2015,6.11206E+17,0,6,Sen. Alexander welcomes @TNELECTRIC ‘s Washington Youth Tour essay winners to the U.S. Capitol: http://t.co/IP70JLH0Qc,SenAlexander,Lamar Alexander,Tennessee,Republican
1171,Wed Jun 17 14:25:50 +0000 2015,6.11178E+17,0,2,#TN students on the Capitol steps discussing what they did to be selected as finalists for TN History Day: http://t.co/ujk74PhGjs,SenAlexander,Lamar Alexander,Tennessee,Republican
1172,Tue Jun 16 18:21:26 +0000 2015,6.10875E+17,0,2,Sen. Alexander enjoyed visiting w/ Riverdale Elementary students at this morning’s #Tennessee constituent breakfast: http://t.co/hCWjzh6SrL,SenAlexander,Lamar Alexander,Tennessee,Republican
1173,Mon Jun 15 17:51:24 +0000 2015,6.10505E+17,1,4,Alexander:Give colleges/universities “skin in the game” to keep costs down &amp; keep students from borrowing too much $:http://t.co/3fqyexqRuD,SenAlexander,Lamar Alexander,Tennessee,Republican
1174,Thu Jun 11 18:44:05 +0000 2015,6.09069E+17,4,3,Says #Democrats should drop threats to “block consideration of legislation that is so important to keeping the #American people safe.”,SenAlexander,Lamar Alexander,Tennessee,Republican
1175,Thu Jun 11 18:43:42 +0000 2015,6.09069E+17,0,1,"Votes for appropriations bills to set budget priorities &amp; support “our troops, national defense and law enforcement” http://t.co/qIPyXf8iRD",SenAlexander,Lamar Alexander,Tennessee,Republican
1176,Thu Jun 11 15:48:37 +0000 2015,6.09024E+17,0,4,"Sen. Alexander asks @natlparkservice to support legislation to study Polk Home in Columbia, #Tennessee: http://t.co/8lneS1aYOt",SenAlexander,Lamar Alexander,Tennessee,Republican
1177,Wed Jun 10 19:30:25 +0000 2015,6.08718E+17,1,9,Alexander gets commitment from @natlparkservice to support legislation that preserves President Polk’s home and belongings.,SenAlexander,Lamar Alexander,Tennessee,Republican
1178,Wed Jun 10 16:15:33 +0000 2015,6.08669E+17,0,4,TUNE-IN @ 2:30: Alexander talks abt. preserving President James K. Polk home @ Energy &amp; Nat. Resources Cmte. hearing: http://t.co/Ip1AswJJIA,SenAlexander,Lamar Alexander,Tennessee,Republican
1179,Tue Jun 09 21:08:22 +0000 2015,6.0838E+17,2,6,"Sen. Alexander enjoyed spending time with Jessica Meyer, the 2015 Children’s Miracle Network Champion for #TN. http://t.co/MXp5NmWGJi",SenAlexander,Lamar Alexander,Tennessee,Republican
1180,Tue Jun 09 19:19:27 +0000 2015,6.08353E+17,1,1,Sen. Alexander's office was glad to welcome the Nashville songwriters to DC today. http://t.co/DxTRbHh5x8,SenAlexander,Lamar Alexander,Tennessee,Republican
1181,Tue Jun 09 15:48:32 +0000 2015,6.083E+17,0,1,Alexander talks abt. supercomputing &amp; doubling basic #energy research with America COMPETES. #jobs #nationalsecurity:https://t.co/IdIBEKDNSj,SenAlexander,Lamar Alexander,Tennessee,Republican
1182,Mon Jun 08 19:06:13 +0000 2015,6.07987E+17,2,8,WATCH: Sen. Alexander special on C-SPAN talking abt. his career &amp; #Tennessee history: http://t.co/PuiSJ4zbOz,SenAlexander,Lamar Alexander,Tennessee,Republican
1183,Mon Jun 08 18:51:33 +0000 2015,6.07983E+17,0,3,ICYMI: Sen. Alexander on C-SPAN’s American History TV: http://t.co/PuiSJ4zbOz,SenAlexander,Lamar Alexander,Tennessee,Republican
1184,Fri Jun 05 17:36:24 +0000 2015,6.06877E+17,1,3,"Alexander discusses his #ECAA bill to #FixNCLB, among other topics, with the @TimesFreePress editorial board today. http://t.co/rD9LrhT7y0",SenAlexander,Lamar Alexander,Tennessee,Republican
1185,Fri Jun 05 17:05:30 +0000 2015,6.06869E+17,5,5,Alexander cosponsors bill by @SenJohnThune to delay “burdensome regulations” from #EPA on #ozone standards http://t.co/sjcJykOexK,SenAlexander,Lamar Alexander,Tennessee,Republican
1186,Thu Jun 04 19:07:14 +0000 2015,6.06538E+17,0,3,Time to “preserve President Polk’s home and belongings and elevate the site to the nat’l treasure it deserves to be”:http://t.co/lLVJc7jOHa,SenAlexander,Lamar Alexander,Tennessee,Republican
1187,Thu Jun 04 18:16:36 +0000 2015,6.06525E+17,0,3,"Alexander introduces study bill to preserve James K. Polk Home in Columbia, #TN as national treasure: http://t.co/lLVJc7jOHa",SenAlexander,Lamar Alexander,Tennessee,Republican
1188,Wed Jun 03 20:52:13 +0000 2015,6.06202E+17,1,6,Sen. Alexander enjoyed having Madison Co. 4-H in his office today and talking abt. simplifying the #FAFSA http://t.co/kMsGVl30D9,SenAlexander,Lamar Alexander,Tennessee,Republican
1189,Wed Jun 03 14:31:16 +0000 2015,6.06106E+17,0,3,"READ-IN:  May Newsletter – Alexander proposes doubling basic #energy research, helping facilities in Oak Ridge: http://t.co/pims6BAB11",SenAlexander,Lamar Alexander,Tennessee,Republican
1190,Tue Jun 02 20:56:33 +0000 2015,6.0584E+17,0,1,Alexander welcomes students from @baylorschool to Tennessee Tuesday this morning. http://t.co/VMm4zXyon8,SenAlexander,Lamar Alexander,Tennessee,Republican
1191,Tue Jun 02 20:21:13 +0000 2015,6.05832E+17,0,1,READ IN: May newsletter – Alexander holds roundtable on low-cost #energy: http://t.co/pims6BSbSz,SenAlexander,Lamar Alexander,Tennessee,Republican
1192,Mon Jun 01 20:15:57 +0000 2015,6.05468E+17,2,5,"Sen. Alexander monitoring incident of #anthrax shipment to TN labs"": http://t.co/bGzCBLHyCS",SenAlexander,Lamar Alexander,Tennessee,Republican
1193,Mon Jun 01 19:12:53 +0000 2015,6.05452E+17,2,1,Wants to simplify financial aid programs to “save students time and money and stop discouraging so many students”: http://t.co/6HpxN5cxaz,SenAlexander,Lamar Alexander,Tennessee,Republican
1194,Mon Jun 01 17:49:59 +0000 2015,6.05431E+17,0,7,ICYMI: Alexander holds roundtable to discuss getting Washington out of schools &amp; eliminating #CommonCore mandate: http://t.co/6HpxN5cxaz,SenAlexander,Lamar Alexander,Tennessee,Republican
1195,Fri May 29 20:37:41 +0000 2015,6.04386E+17,3,2,"Wants to ""eliminate Washington red tape to make it easier to go to college"" by removing obstacles like the #FAFSA http://t.co/FSagK0V7Zw",SenAlexander,Lamar Alexander,Tennessee,Republican
1196,Fri May 29 20:11:17 +0000 2015,6.0438E+17,3,4,"Plans to #FixNCLb by ""restoring responsibility to states &amp; local govt, reversing trend to nat'l school board, &amp; ending #CommonCore mandate”",SenAlexander,Lamar Alexander,Tennessee,Republican
1197,Fri May 29 20:11:09 +0000 2015,6.04379E+17,0,9,Alexander hosted roundtable in Jackson to discuss his bill to #FixNCLB &amp; his plan to simplify the #FAFSA http://t.co/0sQjyJTnNL,SenAlexander,Lamar Alexander,Tennessee,Republican
1198,Fri May 29 19:38:50 +0000 2015,6.04371E+17,2,5,"Sen. Alexander checks out the #CountryMusic selection at the @CrackerBarrel in Jackson, #Tennessee http://t.co/qQdDdYQXQr",SenAlexander,Lamar Alexander,Tennessee,Republican
1199,Wed May 27 19:45:52 +0000 2015,6.03648E+17,1,3,"Alexander writes that #TVA's announcement is ""good news for the businesses that create #jobs and depend on fishing in Tennessee"" @knoxnews",SenAlexander,Lamar Alexander,Tennessee,Republican
1200,Wed May 27 19:06:26 +0000 2015,6.03638E+17,1,1,".@USFWSHQ director told Alexander ""#TVA's announcement reps a 'permanent solution' to keep TN's hatcheries open for yrs to come"" @knoxnews",SenAlexander,Lamar Alexander,Tennessee,Republican
1201,Wed May 27 19:05:05 +0000 2015,6.03638E+17,0,3,"ICYMI: Check out Alexander's op-ed in @knoxnews, ""Lamar Alexander: TVA, hatcheries solution good for Erwin, anglers"" http://t.co/dPFjJSf8Rw",SenAlexander,Lamar Alexander,Tennessee,Republican
1202,Mon May 25 18:37:57 +0000 2015,6.02906E+17,2,3,"3/3: ""We owe all the men and women who have worn the uniform of our Armed Services a debt of gratitude that we couldn’t possibly repay.""",SenAlexander,Lamar Alexander,Tennessee,Republican
1203,Mon May 25 18:36:23 +0000 2015,6.02906E+17,0,3,1/3: “Today we remember the countless Americans and their families who have sacrificed so much to preserve our freedoms and way of life ...,SenAlexander,Lamar Alexander,Tennessee,Republican
1204,Sun May 24 02:33:50 +0000 2015,6.02301E+17,0,4,Greeting Kallen Esperian after her beautiful performance at #MemphisInMay right before he takes the stage. http://t.co/DjNu8DRiHx,SenAlexander,Lamar Alexander,Tennessee,Republican
1205,Sun May 24 02:05:38 +0000 2015,6.02294E+17,1,9,A little Elvis to get the crowd going. #MemphisInMay http://t.co/wdNkDDgNpG,SenAlexander,Lamar Alexander,Tennessee,Republican
1206,Sun May 24 01:35:47 +0000 2015,6.02287E+17,0,10,Up next after intermission. #MemphisInMay http://t.co/bKgqeGezGr,SenAlexander,Lamar Alexander,Tennessee,Republican
1207,Sun May 24 00:24:16 +0000 2015,6.02269E+17,1,6,Pre-show prep. #MemphisInMay http://t.co/UFonP8kNlN,SenAlexander,Lamar Alexander,Tennessee,Republican
1208,Sun May 24 00:23:53 +0000 2015,6.02269E+17,1,8,Great crowd out for tonight's Sunset Symphony. #MemphisInMay http://t.co/i1X9g0tr0b,SenAlexander,Lamar Alexander,Tennessee,Republican
1209,Sat May 23 20:05:03 +0000 2015,6.02204E+17,0,4,"@3onyourside asked how he learned to play piano: ""My mother started me and she wouldn't let me stop."" #MemphisInMay http://t.co/2bT7dgP61W",SenAlexander,Lamar Alexander,Tennessee,Republican
1210,Sat May 23 19:56:27 +0000 2015,6.02201E+17,3,4,"""People are hungry for community and family, and that's what the Sunset Symphony is all about."" #MemphisInMay",SenAlexander,Lamar Alexander,Tennessee,Republican
1211,Sat May 23 15:08:06 +0000 2015,6.02129E+17,0,2,READ IN: Alexander's op-ed in @memphisnews about #Memphis music &amp; tonight's Sunset Symphony: http://t.co/mKo6niEP7a #MemphisInMay,SenAlexander,Lamar Alexander,Tennessee,Republican
1212,Fri May 22 21:31:59 +0000 2015,6.01863E+17,0,2,@AP story on Sen. Alexander's 3rd &amp; final performance tomorrow night at @memphisinmay: http://t.co/oIynQOUE7X #memphisinmay,SenAlexander,Lamar Alexander,Tennessee,Republican
1213,Thu May 21 16:57:11 +0000 2015,6.01432E+17,3,2,Alexander says #Washington spending problem is out-of-control entitlements. #fixthedebt #budget2015,SenAlexander,Lamar Alexander,Tennessee,Republican
1214,Thu May 21 16:12:24 +0000 2015,6.0142E+17,1,2,"Alexander says Senate has ""poor record"" of passing approps bills—that needs to change in order to set #budget priorities""",SenAlexander,Lamar Alexander,Tennessee,Republican
1215,Thu May 21 15:45:02 +0000 2015,6.01413E+17,1,2,Alexander: E &amp; W Approps Bill doubles basic energy research/ strengthens and rebuilds waterways and ports: http://t.co/N5Qfcuh3Gp,SenAlexander,Lamar Alexander,Tennessee,Republican
1216,Thu May 21 14:06:44 +0000 2015,6.01389E+17,2,1,TUNE IN @ 11: Alexander Energy and Water bill comes before Appropriations Committee: http://t.co/N5Qfcuh3Gp,SenAlexander,Lamar Alexander,Tennessee,Republican
1217,Wed May 20 17:30:33 +0000 2015,6.01078E+17,2,8,"To maintain our brainpower advantage &amp; create clean, cheap, reliable #energy, ""we need to fuel innovation” in free market. #COMPETES",SenAlexander,Lamar Alexander,Tennessee,Republican
1218,Wed May 20 17:26:09 +0000 2015,6.01076E+17,0,12,"Alexander, bipartisan grp of senators intro bill to reauth #energy programs in America #COMPETES to help create #jobs http://t.co/Y4JhgCkCSf",SenAlexander,Lamar Alexander,Tennessee,Republican
1219,Tue May 19 21:56:31 +0000 2015,6.00782E+17,1,4,"Says today’s subcmte vote means ""we are 1 step closer to doubling basic #energy research, removing major obstacles to #nuclear power""",SenAlexander,Lamar Alexander,Tennessee,Republican
1220,Tue May 19 21:53:21 +0000 2015,6.00781E+17,0,1,"Alexander: E&amp;W Approps Bill Supports #Energy Research, Waterways and National Security http://t.co/zDRsi4jLuI http://t.co/TnN9aCoxCT",SenAlexander,Lamar Alexander,Tennessee,Republican
1221,Mon May 18 18:46:56 +0000 2015,6.00372E+17,1,1,"Alexander: ""If we want more good #jobs &amp; higher family incomes, #TVA should stick to its mission of low rates"" http://t.co/Rp6HQrK1iN",SenAlexander,Lamar Alexander,Tennessee,Republican
1222,Mon May 18 16:21:54 +0000 2015,6.00336E+17,0,3,Sen. Alexander and @SenBobCorker host a roundtable on #TVA's long-term power plan @HowardBakerCntr today http://t.co/JYI9UgBayJ,SenAlexander,Lamar Alexander,Tennessee,Republican
1223,Thu May 14 13:40:40 +0000 2015,5.98845E+17,0,1,TUNE IN @ 10am: Labor Approps hearing on the president's #budget request for #NLRB http://t.co/JpbxUNzmVX,SenAlexander,Lamar Alexander,Tennessee,Republican
1224,Wed May 13 15:59:34 +0000 2015,5.98518E+17,38,4,"""Relying on wind when #nuclear plants are available is like going to war in sailboats when nuclear ships are available”",SenAlexander,Lamar Alexander,Tennessee,Republican
1225,Wed May 13 14:38:58 +0000 2015,5.98498E+17,0,2,Alexander spoke @NEI event abt overcoming obstacles for #nuclear power to help ensure a bright #energy future in US http://t.co/J7k24kyVRK,SenAlexander,Lamar Alexander,Tennessee,Republican
1226,Mon May 11 20:30:11 +0000 2015,5.97861E+17,1,3,"ICYMI: In commencement speech, Alexander told @WaltersState grads to ""find the good &amp; praise it"" http://t.co/9G7X6VbdoW @CitizenTribune",SenAlexander,Lamar Alexander,Tennessee,Republican
1227,Mon May 11 16:59:47 +0000 2015,5.97808E+17,1,2,"""Now #TVA will have an even greater role in making sure Tennesseans continue to enjoy some of the best trout fishing in the country""@JCPress",SenAlexander,Lamar Alexander,Tennessee,Republican
1228,Mon May 11 16:45:00 +0000 2015,5.97805E+17,0,2,"via @JCPress, ""Alexander: Fish Hatchery funding solution is 'permanent,'"" on agreement announced w/ #TVA today: http://t.co/5EFUe3gBsz",SenAlexander,Lamar Alexander,Tennessee,Republican
1229,Mon May 11 16:35:58 +0000 2015,5.97802E+17,0,6,Alexander tours Erwin National Fish Hatchery after announcement of permanent solution to keep TN fish hatcheries open http://t.co/AJOcpliVza,SenAlexander,Lamar Alexander,Tennessee,Republican
1230,Mon May 11 16:23:34 +0000 2015,5.97799E+17,0,1,"Agreement w/ #TVA is ""good news for the businesses that create #jobs &amp; depend on fishing in #TN"" http://t.co/ODaqAKrcSV",SenAlexander,Lamar Alexander,Tennessee,Republican
1231,Mon May 11 16:20:34 +0000 2015,5.97798E+17,0,1,Sen. Alexander says agreement w/ #TVA is a “permanent solution” to keep #TN fish hatcheries open http://t.co/NFmheBv1gL,SenAlexander,Lamar Alexander,Tennessee,Republican
1232,Fri May 08 20:54:19 +0000 2015,5.9678E+17,3,5,Alexander: being able to import certified industrial hemp seeds for research is “very important” to TN http://t.co/vfSFo2wBrT,SenAlexander,Lamar Alexander,Tennessee,Republican
1233,Thu May 07 21:55:50 +0000 2015,5.96433E+17,3,4,"Commends @SenBobCorker for his work ""to ensure Congress has the ability to review, &amp; reject if necessary,"" any deal btw Obama admin &amp; #Iran",SenAlexander,Lamar Alexander,Tennessee,Republican
1234,Thu May 07 21:55:06 +0000 2015,5.96433E+17,1,4,Alexander voted for @SenBobCorker's #IranNuclear bill to ensure Congress has a chance to review any final deal w Iran http://t.co/whAEqfgnXr,SenAlexander,Lamar Alexander,Tennessee,Republican
1235,Thu May 07 14:48:36 +0000 2015,5.96326E+17,1,2,TUNE IN NOW: #Budget hearing for the Dept. of Justice w/ #LorettaLynch in Approps CJS Subcmte: http://t.co/urxfvsF2Nb,SenAlexander,Lamar Alexander,Tennessee,Republican
1236,Thu May 07 13:58:26 +0000 2015,5.96313E+17,0,1,TUNE IN @ 10:30: #Budget hearing for the Dept. of Justice w/ #LorettaLynch in Approps CJS Subcmte: http://t.co/urxfvsF2Nb,SenAlexander,Lamar Alexander,Tennessee,Republican
1237,Tue May 05 22:41:15 +0000 2015,5.9572E+17,4,3,"Alexander votes for GOP #budget bc it is a ""long-overdue starting pt"" to bring US's $18 trillion debt under control http://t.co/yrCWY4NG7W",SenAlexander,Lamar Alexander,Tennessee,Republican
1238,Mon May 04 16:58:32 +0000 2015,5.95271E+17,1,3,"Receiving #cleanair attainment status from #EPA will help Knox, Anderson &amp; Blount counties with creating #jobs. @DailyTimes",SenAlexander,Lamar Alexander,Tennessee,Republican
1239,Thu Apr 30 22:25:20 +0000 2015,5.93904E+17,5,5,Alexander to #EPA : Favoring wind &amp; solar #energy over #nuclear power hurts #TN &amp; Tennesseans http://t.co/CmRrKESWK6,SenAlexander,Lamar Alexander,Tennessee,Republican
1240,Thu Apr 30 13:06:34 +0000 2015,5.93763E+17,1,4,TUNE IN @ 10am EST: Labor-HHS Approps Subcmte hearing on president's 2016 #budget request for #NIH: http://t.co/ewfuiPNTNR,SenAlexander,Lamar Alexander,Tennessee,Republican
1241,Wed Apr 29 17:25:12 +0000 2015,5.93466E+17,0,2,TUNE IN @ 2:30pm EST: #EPA budget hearing in Interior/Environment Approps Subcmte: http://t.co/whnAFEQGTY,SenAlexander,Lamar Alexander,Tennessee,Republican
1242,Tue Apr 28 21:39:06 +0000 2015,5.93168E+17,0,5,Sen. Alexander met w/ @NissanUSA Exec VP Jose Munoz to discuss the 2016 Maxima being made in Smyrna. #jobs http://t.co/Tl8kxm4xIk,SenAlexander,Lamar Alexander,Tennessee,Republican
1243,Mon Apr 27 16:42:20 +0000 2015,5.92731E+17,2,2,"...""Then, @Nissan made no cars, trucks in the US. Today, 85% of what Nissan sells in the US, it makes in the US""http://t.co/Ec6kUA9rq1 (2/2)",SenAlexander,Lamar Alexander,Tennessee,Republican
1244,Mon Apr 27 16:26:24 +0000 2015,5.92727E+17,0,3,"""35 years ago, #TN had almost no auto #jobs. Today, one-third of its manufacturing jobs are auto-related jobs"" (1/2) ...",SenAlexander,Lamar Alexander,Tennessee,Republican
1245,Mon Apr 27 16:09:08 +0000 2015,5.92722E+17,0,6,"ICYMI: Check out Sen. Alexander's op-ed, ""Human faces tell how @Nissan transformed #TN economy,"" in the @Tennessean: http://t.co/Ec6kUA9rq1",SenAlexander,Lamar Alexander,Tennessee,Republican
1246,Thu Apr 23 19:50:09 +0000 2015,5.91328E+17,1,2,"""I'm proud that the American Eagle Foundation has played a leading role in preserving [the American Bald Eagle]"" http://t.co/lrwWhK9Csj",SenAlexander,Lamar Alexander,Tennessee,Republican
1247,Thu Apr 23 19:36:42 +0000 2015,5.91325E+17,4,6,Sen. Alexander and @SenBobCorker welcome #ChallengerTheEagle of the American Eagle Foundation to the U.S. Capitol. http://t.co/AMJ4X9sxtw,SenAlexander,Lamar Alexander,Tennessee,Republican
1248,Thu Apr 23 19:19:50 +0000 2015,5.91321E+17,0,2,"Alexander on #ECAA: ""Basically what we do is we move decisions abt how 2 help students learn back 2 states/schools where it belongs""@dnj_com",SenAlexander,Lamar Alexander,Tennessee,Republican
1249,Thu Apr 23 19:16:31 +0000 2015,5.9132E+17,2,2,"Alexander says under the #EveryChildAchievesAct, all decisions about academic standards will be ""entirely Tennessee's decision"" @dnj_com",SenAlexander,Lamar Alexander,Tennessee,Republican
1250,Thu Apr 23 18:56:27 +0000 2015,5.91315E+17,1,7,ICYMI: @dnj_com article on #ECAA that would ban the federal govt from mandating #education standards like #CommonCore:http://t.co/cSNN7I8UjT,SenAlexander,Lamar Alexander,Tennessee,Republican
1251,Thu Apr 23 18:36:12 +0000 2015,5.9131E+17,5,3,"Alexander votes NO on #LorettaLynch for AG ""to express my disapproval of President #Obama's abuse of exec authority” http://t.co/FjUDwaYsi7",SenAlexander,Lamar Alexander,Tennessee,Republican
1252,Thu Apr 23 13:52:49 +0000 2015,5.91238E+17,1,2,TUNE IN at 10am ET: Labor-HHS Approps Subcmte holds hearing w/ @SecBurwell on president's 2016 HHS #budget request http://t.co/eygj62H9Qu,SenAlexander,Lamar Alexander,Tennessee,Republican
1253,Wed Apr 22 22:07:09 +0000 2015,5.91E+17,1,2,Alexander voted YES on #JVTA to help #EndTrafficking http://t.co/aeSzx4vDsx,SenAlexander,Lamar Alexander,Tennessee,Republican
1254,Wed Apr 22 18:38:13 +0000 2015,5.90948E+17,0,4,"TUNE IN @ 3PM: E&amp;W Approps Chairman Alexander holds 1st oversight hearing on ""The US without #nuclearpower"": http://t.co/BqEHovaknx",SenAlexander,Lamar Alexander,Tennessee,Republican
1255,Wed Apr 22 14:16:06 +0000 2015,5.90882E+17,0,3,TUNE IN NOW: Senate Energy &amp; Natural Resources Cmte hearing on reauthorization &amp; potential reforms to #LWCF http://t.co/Ip1AswJJIA,SenAlexander,Lamar Alexander,Tennessee,Republican
1256,Tue Apr 21 20:30:57 +0000 2015,5.90614E+17,0,1,"via @DailyTimes, unanimous HELP cmte passage of #EveryChildAchievesAct ""demonstrates power of knowledge"" http://t.co/tyKrzpI86c #FixNCLB",SenAlexander,Lamar Alexander,Tennessee,Republican
1257,Tue Apr 21 17:26:45 +0000 2015,5.90567E+17,1,6,"Alexander joins @BillHaslam, @NissanUSA execs in Smyrna for the launch of the production of Nissan's 2016 Maxima http://t.co/2Ca75kKyjB",SenAlexander,Lamar Alexander,Tennessee,Republican
1258,Tue Apr 21 17:25:46 +0000 2015,5.90567E+17,0,2,Alexander says the @NissanUSA announcement will help continue TN's auto success as the best state for new auto jobs http://t.co/R0m38B8ZjC,SenAlexander,Lamar Alexander,Tennessee,Republican
1259,Tue Apr 21 17:25:26 +0000 2015,5.90567E+17,0,6,"Announcement that 2016 Nissan Maxima will be built @ Smyrna, Decherd plants is ""one more ex. of how @NissanUSA has transformed TN's economy""",SenAlexander,Lamar Alexander,Tennessee,Republican
1260,Mon Apr 20 20:26:08 +0000 2015,5.9025E+17,1,4,Read @knoxnews article on Alexander &amp; @SenBobCorker's work to get 2 bills unanimously passed thru their cmtes last wk:http://t.co/FtGAnzMmAH,SenAlexander,Lamar Alexander,Tennessee,Republican
1261,Mon Apr 20 20:21:04 +0000 2015,5.90249E+17,1,5,"Alexander, @SenBobCorker continue tradition of Howard Baker—""to listen &amp; consult"" w all sides to get results http://t.co/UdNzocwyNu @ParisPI",SenAlexander,Lamar Alexander,Tennessee,Republican
1262,Mon Apr 20 17:42:50 +0000 2015,5.90209E+17,0,2,Completion of @NatlParkService survey proves efforts by Columbia’s citizens to preserve Polk Home are making progress http://t.co/ojTncwmVlc,SenAlexander,Lamar Alexander,Tennessee,Republican
1263,Fri Apr 17 16:37:15 +0000 2015,5.89105E+17,3,3,"#FixNCLB bill passed by HELP Cmte would produce ""more appropriate ways to measure student achievement"" http://t.co/gyr2k5VTx2 @USATODAY",SenAlexander,Lamar Alexander,Tennessee,Republican
1264,Thu Apr 16 21:22:49 +0000 2015,5.88815E+17,1,5,Alexander congratulates Principal Serrano from Siegel HS in Murfreesboro on being named TN Asst Principal of the Year http://t.co/ywNtLqZAfD,SenAlexander,Lamar Alexander,Tennessee,Republican
1265,Thu Apr 16 18:05:32 +0000 2015,5.88765E+17,4,23,"Senate HELP Cmte passes #EveryChildAchievesAct 22-0, bipartisan agreement to #FixNCLB. Bill now heads to full Senate. http://t.co/FAM2lLaX8L",SenAlexander,Lamar Alexander,Tennessee,Republican
1266,Thu Apr 16 14:34:01 +0000 2015,5.88712E+17,4,8,Congratulations to @SenBobCorker on being named one of @TIME's 100 Most Influential People http://t.co/LfuTbWbYfN #TIME100,SenAlexander,Lamar Alexander,Tennessee,Republican
1267,Wed Apr 15 12:45:17 +0000 2015,5.88322E+17,5,2,"#DocFix includes 10 yrs of funding for TN's Medicaid DSH program, which helps TN hospitals cover cost of caring for low-income patients",SenAlexander,Lamar Alexander,Tennessee,Republican
1268,Wed Apr 15 12:45:01 +0000 2015,5.88322E+17,1,7,"Senate passes #DocFix to ""permanently end threat of $$ cuts to drs serving Medicare patients in TN, throughout US"" http://t.co/hzeocpoEpm",SenAlexander,Lamar Alexander,Tennessee,Republican
1269,Tue Apr 14 19:16:31 +0000 2015,5.88058E+17,0,4,@GOPHELP Chairman Alexander says #EveryChildAchievesAct reflects “remarkable consensus” abt “urgent need” to #FixNCLB http://t.co/CMmed2kIWI,SenAlexander,Lamar Alexander,Tennessee,Republican
