,created_at,id_str,reply_count,retweet_count,text,user,name,state,party
1144,Sat Jun 06 03:58:39 +0000 2015,6.07034E+17,0,6,Sending my best wishes to all of the Special Olympics athletes competing this weekend in the 2015 Special Olympics Alaska Summer Games!,lisamurkowski,Lisa Murkowski,Alaska,Republican
1145,Sat Jun 06 00:26:53 +0000 2015,6.06981E+17,0,4,"This week, the Senate passed a resolution applauding craft breweries nationwide. It’s a small… https://t.co/HNnHQETiW8",lisamurkowski,Lisa Murkowski,Alaska,Republican
1146,Fri Jun 05 00:52:20 +0000 2015,6.06625E+17,0,2,Great news! Fort Wainwright will be the home base for 9 Gray Eagle Unmanned Combat Air Vehicles. http://t.co/Qq8lb7PwA2 cc: @PAOFWA,lisamurkowski,Lisa Murkowski,Alaska,Republican
1147,Fri Jun 05 00:12:18 +0000 2015,6.06614E+17,1,3,"I introduced a bill to help fight the obesity epidemic-it's not only a health concern, but an economic crisis too: http://t.co/9RF066gXeI",lisamurkowski,Lisa Murkowski,Alaska,Republican
1148,Thu Jun 04 21:54:42 +0000 2015,6.0658E+17,1,5,"Spoke to students at UAF's Kuskokwim campus in Bethel via VTC! Bethel is 3,751 miles away...technology is amazing! http://t.co/ptGaUIrTqI",lisamurkowski,Lisa Murkowski,Alaska,Republican
1149,Thu Jun 04 19:53:53 +0000 2015,6.06549E+17,0,23,Safe travels @USCG Cutter Roanoke Island crew as you leave AK. Thank you for your service to our state. http://t.co/SaZqIrgIH1,lisamurkowski,Lisa Murkowski,Alaska,Republican
1150,Thu Jun 04 18:11:51 +0000 2015,6.06524E+17,0,4,Raining eels? This is almost too hard to believe: http://t.co/ahYQAagTUP #AlaskaHeadlines cc: @newsminer,lisamurkowski,Lisa Murkowski,Alaska,Republican
1151,Thu Jun 04 16:35:53 +0000 2015,6.065E+17,1,7,"Thank you, @JuneauEmpire, for taking the time to do a 'deep dive' with me on the need for urgency in the Arctic! https://t.co/7L7rshro7E",lisamurkowski,Lisa Murkowski,Alaska,Republican
1152,Thu Jun 04 00:44:20 +0000 2015,6.0626E+17,0,7,Great to see @AlaskaAir is looking to power a biofuel flight using leftover branches &amp; limbs from forest harvests! http://t.co/Isfz6nRASu,lisamurkowski,Lisa Murkowski,Alaska,Republican
1153,Tue Jun 02 23:15:52 +0000 2015,6.05876E+17,1,1,Distracted driving is a serious threat to Alaskans on the road. The #ImprovingDriverSafetyAct would protect lives. http://t.co/SxcDMlPtbK,lisamurkowski,Lisa Murkowski,Alaska,Republican
1154,Tue Jun 02 20:52:39 +0000 2015,6.05839E+17,4,1,I co-sponsored &amp; voted for the bipartisan #USAFreedomAct b/c it reins in the overreaching (and illegal) bulk surveillance of phone records.,lisamurkowski,Lisa Murkowski,Alaska,Republican
1155,Tue Jun 02 20:50:08 +0000 2015,6.05839E+17,1,2,"I acknowledge the reality we face against tech-savvy terrorists, but our lives/privacy can still be protected w/targeted surveillance reform",lisamurkowski,Lisa Murkowski,Alaska,Republican
1156,Tue Jun 02 20:48:11 +0000 2015,6.05838E+17,1,1,Today's a great day for freedom &amp; individual liberty! It's a win for us who've been circumspect of the PATRIOT Act since it was enacted.,lisamurkowski,Lisa Murkowski,Alaska,Republican
1157,Tue Jun 02 19:17:37 +0000 2015,6.05816E+17,0,3,"This bill, named after Walter Soboleff, will empower AK Native youth against the complicated challenges they face: http://t.co/9w6NQ3cSPm.",lisamurkowski,Lisa Murkowski,Alaska,Republican
1158,Tue Jun 02 02:17:04 +0000 2015,6.05559E+17,8,5,(2/2) I've opposed ACA since Day 1: the math doesn't add up for rural states like AK &amp; we keep seeing consequences: http://t.co/48zoMxf1J7.,lisamurkowski,Lisa Murkowski,Alaska,Republican
1159,Tue Jun 02 02:14:47 +0000 2015,6.05558E+17,3,4,(1/2) Premera just announced that it must raise premium rates in Alaska by 38.7% because of the Affordable Care Act.,lisamurkowski,Lisa Murkowski,Alaska,Republican
1160,Tue Jun 02 00:25:06 +0000 2015,6.05531E+17,1,7,Couldn't agree more! The U.S. can't continue to fall behind in the Arctic.  https://t.co/jGDQVUk6aM,lisamurkowski,Lisa Murkowski,Alaska,Republican
1161,Mon Jun 01 22:16:46 +0000 2015,6.05498E+17,0,1,"Wow!  Way to go, Kyle Sage! https://t.co/XjnZ8DdyuS",lisamurkowski,Lisa Murkowski,Alaska,Republican
1162,Mon Jun 01 19:10:19 +0000 2015,6.05451E+17,0,1,Congrats @USFWSAlaska for opening up the new Kenai National Wildlife Refuge visitor center in #Soldotna. http://t.co/APGbU1Xe5o,lisamurkowski,Lisa Murkowski,Alaska,Republican
1163,Mon Jun 01 17:27:56 +0000 2015,6.05426E+17,1,7,"Summer doesn’t just mean end of classes, but for many kids in AK it means the end of healthy meals: http://t.co/R1NSNV0mwr. cc:@adndotcom",lisamurkowski,Lisa Murkowski,Alaska,Republican
1164,Mon Jun 01 13:50:15 +0000 2015,6.05371E+17,2,3,Last night I voted on the motion to proceed to take up the #USAFreedomAct to end bulk surveillance. Here's why: http://t.co/ChBgWWbkjm.,lisamurkowski,Lisa Murkowski,Alaska,Republican
1165,Sun May 31 04:41:42 +0000 2015,6.0487E+17,0,12,"My thoughts and prayers are with @VP and the Biden family tonight. Beau Biden, rest in peace.",lisamurkowski,Lisa Murkowski,Alaska,Republican
1166,Sat May 30 03:10:51 +0000 2015,6.04485E+17,0,2,Just further proof of how unique and special Alaska is! Here's a video of students at Chickaloon… https://t.co/2EntwGeKip,lisamurkowski,Lisa Murkowski,Alaska,Republican
1167,Fri May 29 22:39:35 +0000 2015,6.04417E+17,0,2,Great to be back in the Golden Heart City and catch up with so many of you in Fairbanks at my annual spring luncheon. http://t.co/M7U9hbVEbD,lisamurkowski,Lisa Murkowski,Alaska,Republican
1168,Fri May 29 21:48:13 +0000 2015,6.04404E+17,0,1,Yesterday I had the opportunity to visit the Fisher House and the Warrior Transition Unit at… https://t.co/64eiICVXlY,lisamurkowski,Lisa Murkowski,Alaska,Republican
1169,Thu May 28 20:59:00 +0000 2015,6.04029E+17,0,3,Great crowd at the @AOGA luncheon! Happy to be able to give an update on what's happening on the energy front in DC. http://t.co/sah7zrq8OB,lisamurkowski,Lisa Murkowski,Alaska,Republican
1170,Thu May 28 19:18:52 +0000 2015,6.04004E+17,0,3,(2/2) Thank you for outlining the LNG project at the federal level and how important it is that we move forward.,lisamurkowski,Lisa Murkowski,Alaska,Republican
1171,Thu May 28 19:18:38 +0000 2015,6.04004E+17,0,3,"(1/2) Thanks to today's panelists: @ENERGY's Elizabeth Sherwood-Randall &amp; Paula Gant, @FERC's Ann Miles, and @Interior's Tommy Beaudreau.",lisamurkowski,Lisa Murkowski,Alaska,Republican
1172,Thu May 28 18:50:11 +0000 2015,6.03997E+17,1,1,I also asked them to address the key challenges to moving Alaska LNG forward and how we can work together to better expedite this process.,lisamurkowski,Lisa Murkowski,Alaska,Republican
1173,Thu May 28 18:49:31 +0000 2015,6.03997E+17,2,3,I asked energy officials at the roundtable a question I repeatedly hear: will low oil prices have an impact on the LNG export project?,lisamurkowski,Lisa Murkowski,Alaska,Republican
1174,Thu May 28 18:48:01 +0000 2015,6.03996E+17,2,2,Today I hosted a roundtable discussion on the federal permitting processes for the Alaska LNG export project. http://t.co/DyqhqtZPu9,lisamurkowski,Lisa Murkowski,Alaska,Republican
1175,Thu May 28 17:54:55 +0000 2015,6.03983E+17,0,5,Thrilled to see Alaska reclaim its place at the forefront of the Pacific LNG market!  https://t.co/ZVzWlQq3Ik,lisamurkowski,Lisa Murkowski,Alaska,Republican
1176,Wed May 27 19:51:50 +0000 2015,6.0365E+17,0,2,Good piece out of Juneau about the hazards and Alaska impacts of #WOTUS http://t.co/7oFU09GoMR,lisamurkowski,Lisa Murkowski,Alaska,Republican
1177,Wed May 27 18:37:42 +0000 2015,6.03631E+17,0,2,"Last week in the Senate, I explained why Alaskans are telling me they have real fear about this flawed #WOTUS rule. http://t.co/XjxprF9bxv",lisamurkowski,Lisa Murkowski,Alaska,Republican
1178,Wed May 27 18:34:04 +0000 2015,6.0363E+17,2,7,"The EPA’s new #WOTUS rule will have an outsized, negative impact on Alaskan construction and development activity. http://t.co/GmBhiWjhA8",lisamurkowski,Lisa Murkowski,Alaska,Republican
1179,Tue May 26 21:08:19 +0000 2015,6.03307E+17,1,5,"We talked public service, leadership and I shared my favorite saying: ""Life begins at the end of your comfort zone."" http://t.co/6YzXgoVYi9",lisamurkowski,Lisa Murkowski,Alaska,Republican
1180,Tue May 26 21:06:46 +0000 2015,6.03306E+17,0,1,The Anchorage Chamber's young professionals group and I just wrapped up a great lunch and conversation -- thanks for the warm welcome!,lisamurkowski,Lisa Murkowski,Alaska,Republican
1181,Tue May 26 19:32:57 +0000 2015,6.03283E+17,0,1,The U.S. Coast Guard does tremendous things in Alaska's vast waters.  We thank them for their service! https://t.co/q1fwElB0q6,lisamurkowski,Lisa Murkowski,Alaska,Republican
1182,Tue May 26 18:40:41 +0000 2015,6.0327E+17,0,2,Great to see my friends at @DenaliBrewing doing so well! Alaska's breweries are real success stories! http://t.co/bL1OdKjKAh,lisamurkowski,Lisa Murkowski,Alaska,Republican
1183,Tue May 26 01:56:32 +0000 2015,6.03017E+17,1,3,"Great visits in the Valley: Palmer Veterans &amp; Pioneer Home, VFW Post 9365, America Post 15, and Mat-Su Wall of Honor. http://t.co/egHPz3DKZz",lisamurkowski,Lisa Murkowski,Alaska,Republican
1184,Mon May 25 20:19:16 +0000 2015,6.02932E+17,1,2,"Wonderful Memorial Day ceremony at Byers Lake, honoring our nation's heroes. https://t.co/Y0T06kYE0y",lisamurkowski,Lisa Murkowski,Alaska,Republican
1185,Mon May 25 18:56:54 +0000 2015,6.02911E+17,1,3,I encourage AK to remember what #MDW is about--it’s to remember the dedication &amp; sacrifices of our fallen soldiers: http://t.co/jSzo9utpBm.,lisamurkowski,Lisa Murkowski,Alaska,Republican
1186,Sat May 23 22:35:36 +0000 2015,6.02241E+17,0,1,Thankful to all the Alaskans who are working to address the flooding on the Dalton Highway as quickly… https://t.co/2nzfRwpEvV,lisamurkowski,Lisa Murkowski,Alaska,Republican
1187,Sat May 23 04:43:32 +0000 2015,6.01972E+17,3,11,Just voted for the USA Freedom Act to reform the Patriot Act and halt bulk surveillance of Americans' phone records. http://t.co/9uVLDqdrTJ,lisamurkowski,Lisa Murkowski,Alaska,Republican
1188,Sat May 23 02:12:56 +0000 2015,6.01934E+17,2,2,"An Alaska-sized 'thank you' to everyone who reached out to wish me a Happy Birthday today, and all your thoughtful notes or tweets.",lisamurkowski,Lisa Murkowski,Alaska,Republican
1189,Sat May 23 02:09:18 +0000 2015,6.01933E+17,5,6,Just voted to broaden and strengthen our economic relationships with nations in the Pacific Rim region. http://t.co/bmg833HyKp,lisamurkowski,Lisa Murkowski,Alaska,Republican
1190,Fri May 22 21:48:56 +0000 2015,6.01867E+17,0,4,Great news for AK: Clear AFS has been chosen as the future site of the long range discrimination radar system: http://t.co/ay476zT8Nq.,lisamurkowski,Lisa Murkowski,Alaska,Republican
1191,Thu May 21 22:29:42 +0000 2015,6.01515E+17,1,1,"The 2016 military construction/VA funding bill underscores Alaska's importance, and improves care for our veterans. http://t.co/qrEQFtVru8",lisamurkowski,Lisa Murkowski,Alaska,Republican
1192,Thu May 21 16:20:02 +0000 2015,6.01422E+17,0,2,AK has world-class fisheries &amp; military....glad to see the Navy &amp; Cordova residents engaging directly over concerns. https://t.co/H6GN3DK3fX,lisamurkowski,Lisa Murkowski,Alaska,Republican
1193,Thu May 21 00:22:15 +0000 2015,6.01181E+17,1,1,Great to see Palmer Chamber of Commerce held a military appreciation luncheon to show support for our veterans. http://t.co/xkKjB9i0bi,lisamurkowski,Lisa Murkowski,Alaska,Republican
1194,Wed May 20 13:21:56 +0000 2015,6.01015E+17,0,1,"Happy Bike to Work Day, Anchorage! Be extra careful on the roads and make sure to look out for each other!",lisamurkowski,Lisa Murkowski,Alaska,Republican
1195,Wed May 20 01:00:31 +0000 2015,6.00828E+17,3,16,"I introduced bipartisan legislation to authorize 6 heavy icebreakers. From a military perspective, it's imperative. http://t.co/RdhcwXVJQW",lisamurkowski,Lisa Murkowski,Alaska,Republican
1196,Tue May 19 19:45:37 +0000 2015,6.00749E+17,1,2,"Updated @DucksUnlimited on my Bipartisan Sportsmen's Act to open up lands for hunters, fishermen, and outdoorsmen. http://t.co/pdIvqOsUdS",lisamurkowski,Lisa Murkowski,Alaska,Republican
1197,Tue May 19 18:48:26 +0000 2015,6.00735E+17,2,5,"Great op-ed from @defense_news on what many in AK know: the Arctic is full of opportunities, and the US must engage: http://t.co/ZUoJNhnJ28.",lisamurkowski,Lisa Murkowski,Alaska,Republican
1198,Mon May 18 16:36:57 +0000 2015,6.00339E+17,0,1,"This past weekend, a grateful crowd of Alaskans came together to salute the 2nd Engineer Brigade at a… https://t.co/kZUMnemk7q",lisamurkowski,Lisa Murkowski,Alaska,Republican
1199,Mon May 18 16:05:04 +0000 2015,6.00331E+17,3,7,Proud to cosponsor USA Freedom Act to protect privacy; @washingtonpost says “It should pass...the sooner the better.” http://t.co/2YKJdFb8lr,lisamurkowski,Lisa Murkowski,Alaska,Republican
1200,Sat May 16 23:17:20 +0000 2015,5.99715E+17,0,6,"In honor of #ArmedForcesDay, I want to thank all the men and women who so bravely serve our great nation.",lisamurkowski,Lisa Murkowski,Alaska,Republican
1201,Sat May 16 19:12:07 +0000 2015,5.99654E+17,1,4,View from downtown Seattle showing Terminal 5 in the distance with Polar Pioneer safely at the dock. https://t.co/ERCvHIyP7Y,lisamurkowski,Lisa Murkowski,Alaska,Republican
1202,Sat May 16 18:58:28 +0000 2015,5.9965E+17,1,2,Ceremonial 1st fish of the Copper River salmon season arrived in Anchorage today &amp; thousands of lbs of salmon! http://t.co/xBuj7yIriI,lisamurkowski,Lisa Murkowski,Alaska,Republican
1203,Sat May 16 01:52:02 +0000 2015,5.99392E+17,0,3,Ceremonial 1st fish of the Copper River salmon season arrived in Anchorage today &amp; thousands of lbs of salmon! http://t.co/RR0RRbifLN,lisamurkowski,Lisa Murkowski,Alaska,Republican
1204,Thu May 14 22:39:54 +0000 2015,5.98981E+17,0,5,Congrats @uafairbanks for being selected into an exclusive coalition to advance unmanned aerial systems w/ FAA. http://t.co/nAOhihnXIc,lisamurkowski,Lisa Murkowski,Alaska,Republican
1205,Thu May 14 22:02:10 +0000 2015,5.98972E+17,2,2,Consider it done.  I was an original co-sponsor of the Senate version of this important bill. http://t.co/k5p6wP0xk0 https://t.co/v7ybTXcdbE,lisamurkowski,Lisa Murkowski,Alaska,Republican
1206,Thu May 14 19:34:18 +0000 2015,5.98934E+17,0,2,"On Senate floor discussing #NationalPoliceWeek, foreign trade, oil exports &amp; other issues Alaskans are talking about. http://t.co/X6hbpKylA9",lisamurkowski,Lisa Murkowski,Alaska,Republican
1207,Thu May 14 18:02:35 +0000 2015,5.98911E+17,0,2,Thrilled to be touting the benefits of unmanned aerial systems in Alaska!! http://t.co/iZI2Z9gjo1,lisamurkowski,Lisa Murkowski,Alaska,Republican
1208,Thu May 14 16:48:01 +0000 2015,5.98893E+17,0,2,Thanks for getting the word out! https://t.co/yvYIBeoZcC,lisamurkowski,Lisa Murkowski,Alaska,Republican
1209,Thu May 14 01:49:02 +0000 2015,5.98666E+17,0,4,Honored to read the names of Alaska's fallen officers at Vigil. We won't forget your sacrifice #NationalPoliceWeek http://t.co/xvaeTGTF4P,lisamurkowski,Lisa Murkowski,Alaska,Republican
1210,Thu May 14 01:29:05 +0000 2015,5.98661E+17,0,1,"As a final roll call of honor, the names of fallen officers, including AK officers being read now @ Candlelight Vigil http://t.co/Njx0o9UDYx",lisamurkowski,Lisa Murkowski,Alaska,Republican
1211,Thu May 14 00:33:41 +0000 2015,5.98647E+17,0,1,"Candlelight Vigil happening right now in DC, honoring those we've lost in the line of duty. Watch live: http://t.co/N7THRgaYyT #PoliceWeek",lisamurkowski,Lisa Murkowski,Alaska,Republican
1212,Wed May 13 14:01:14 +0000 2015,5.98488E+17,0,1,1/4 of all #BLM lands are located in Alaska...the largest portion of which is the National Petroleum Reserve-Alaska.,lisamurkowski,Lisa Murkowski,Alaska,Republican
1213,Wed May 13 13:59:16 +0000 2015,5.98488E+17,0,1,Getting ready to gavel in an Interior Appropriations hearing on #BLM’s budget request for FY2016. Watch--&gt; http://t.co/bWefwZtUWT.,lisamurkowski,Lisa Murkowski,Alaska,Republican
1214,Wed May 13 00:26:49 +0000 2015,5.98283E+17,0,1,Thank you Brig. Gen.Bridges of AK National Guard for faithfully serving our nation for 35 yrs. I wish you well as you head into retirement!,lisamurkowski,Lisa Murkowski,Alaska,Republican
1215,Mon May 11 21:26:22 +0000 2015,5.97875E+17,10,12,An important step toward the U.S. assuming a leadership role in the Arctic! https://t.co/1BWu0fcWLs,lisamurkowski,Lisa Murkowski,Alaska,Republican
1216,Mon May 11 20:00:34 +0000 2015,5.97854E+17,1,3,"@PostReid So much going on in the Arctic, and with the U.S. taking the Chair of the Arctic Council, we really need to step up our engagement",lisamurkowski,Lisa Murkowski,Alaska,Republican
1217,Sat May 09 22:37:08 +0000 2015,5.97168E+17,1,4,"Thank you to everyone--businesses, schools, families, including my staff--who chipped in and hit the… https://t.co/DffucWduB6",lisamurkowski,Lisa Murkowski,Alaska,Republican
1218,Fri May 08 23:33:54 +0000 2015,5.9682E+17,1,2,What am amazing way to celebrate V-E Day's 70th Anniversary -- a #WW2Flyover of the National Mall by… https://t.co/uanHYT8Tam,lisamurkowski,Lisa Murkowski,Alaska,Republican
1219,Fri May 08 00:23:41 +0000 2015,5.9647E+17,0,3,Today I pressed Attorney General Loretta Lynch for a commitment to make Alaska Native safety a priority at the DOJ. http://t.co/YYJp78sLK9,lisamurkowski,Lisa Murkowski,Alaska,Republican
1220,Thu May 07 19:44:38 +0000 2015,5.964E+17,5,8,Next Tues. I'll intro legislation to #LiftTheBan on US oil #exports. Check @ENR_GOP for more: http://t.co/jDFkyow73j https://t.co/C4dJUVhKXI,lisamurkowski,Lisa Murkowski,Alaska,Republican
1221,Thu May 07 19:25:42 +0000 2015,5.96396E+17,0,2,"Alaska aviation legend Urban Rahoi, a 95-year old WWII vet, will be flying in the nose of a B-17!  https://t.co/WgFx4JA6yE",lisamurkowski,Lisa Murkowski,Alaska,Republican
1222,Thu May 07 15:13:39 +0000 2015,5.96332E+17,8,12,Exactly why I'm backing the #USAFREEDOMAct: http://t.co/XzwILCAyRR. https://t.co/29WCW3t9VM,lisamurkowski,Lisa Murkowski,Alaska,Republican
1223,Thu May 07 15:10:54 +0000 2015,5.96331E+17,0,2,"About to question new AG Loretta Lynch about her priorities on many Alaska issues, tune in to watch here: http://t.co/ZfH8LJQV3B.",lisamurkowski,Lisa Murkowski,Alaska,Republican
1224,Wed May 06 23:18:26 +0000 2015,5.96092E+17,1,6,"Starting tomorrow, Alaskans can opt for the retro ’76 grizzly license plates. Who’s getting one? http://t.co/MtkIO5ryBa",lisamurkowski,Lisa Murkowski,Alaska,Republican
1225,Wed May 06 22:01:49 +0000 2015,5.96072E+17,2,5,Thx to Sec. Carter of the @DeptofDefense for testifying about the importance of the Arctic today. http://t.co/1sKHPNkXv3 Let's get moving!,lisamurkowski,Lisa Murkowski,Alaska,Republican
1226,Wed May 06 17:22:08 +0000 2015,5.96002E+17,1,2,Praying that this Alaskan finds her mom. https://t.co/EZ48zFebuV,lisamurkowski,Lisa Murkowski,Alaska,Republican
1227,Wed May 06 00:19:37 +0000 2015,5.95745E+17,3,9,Thankful Congress just passed a 10yr #BalancedBudget w/out raising taxes. First time since 2001! http://t.co/lcV7C8WLVv,lisamurkowski,Lisa Murkowski,Alaska,Republican
1228,Tue May 05 19:43:09 +0000 2015,5.95675E+17,0,2,Congrats to the @GirlscoutsAK Gold Award winners—the highest award in Girl Scouts. An amazing achievement! http://t.co/oetlHtMwbj,lisamurkowski,Lisa Murkowski,Alaska,Republican
1229,Tue May 05 17:31:16 +0000 2015,5.95642E+17,0,8,"If you live in Anchorage, make sure to vote in today’s mayoral election! Find your voting site here: http://t.co/D6TCcxacju #ANCmayor",lisamurkowski,Lisa Murkowski,Alaska,Republican
1230,Tue May 05 15:09:59 +0000 2015,5.95606E+17,1,5,Congrats to Ketchikan's Cassandra Adams and Juneau's Amara Sanguni on their Prudential Spirit of Community Awards! http://t.co/UnXMvT48wg,lisamurkowski,Lisa Murkowski,Alaska,Republican
1231,Tue May 05 13:43:22 +0000 2015,5.95585E+17,0,4,Love today’s Google Doodle in honor of Nellie Bly—a pioneering journalist &amp; adventurer who was way ahead of her time. http://t.co/vtBF24Z4nw,lisamurkowski,Lisa Murkowski,Alaska,Republican
1232,Mon May 04 23:48:14 +0000 2015,5.95374E+17,0,2,This weekend I was honored to speak at the Victims for Justice Awards Banquet as they recognized… https://t.co/vDODFDzXfs,lisamurkowski,Lisa Murkowski,Alaska,Republican
1233,Mon May 04 20:34:11 +0000 2015,5.95326E+17,2,3,"We deserve defense against those who seek to harm us, but we shouldn't sacrifice our liberty to do so. #USAFREEDOMAct http://t.co/XzwILCAyRR",lisamurkowski,Lisa Murkowski,Alaska,Republican
1234,Sat May 02 22:16:29 +0000 2015,5.94627E+17,2,3,I got to try my hand at using the F-35 simulator at the Military Appreciation Banquet in Fairbanks! https://t.co/GKZBJ9NiF8,lisamurkowski,Lisa Murkowski,Alaska,Republican
1235,Thu Apr 30 14:43:38 +0000 2015,5.93788E+17,0,2,Way to go Maeva! https://t.co/qdFky26ldq,lisamurkowski,Lisa Murkowski,Alaska,Republican
1236,Thu Apr 30 00:49:37 +0000 2015,5.93578E+17,0,5,"Inspirational! 4 vets aim to summit Denali on Memorial Day &amp; carry over 100 names of Americans who've died serving. 
http://t.co/THieKIUGc0",lisamurkowski,Lisa Murkowski,Alaska,Republican
1237,Tue Apr 28 20:49:49 +0000 2015,5.93155E+17,0,3,Glad I could participate in the @JointOceanCI Arctic Ocean Leadership Roundtable by video message! http://t.co/M0nrjKlFPo,lisamurkowski,Lisa Murkowski,Alaska,Republican
1238,Mon Apr 27 23:28:48 +0000 2015,5.92833E+17,2,1,What an awesome opportunity! Fort Yukon H.S. student heading to Australia to represent Alaska in Tourney this summer. http://t.co/oo9Fxm4ioJ,lisamurkowski,Lisa Murkowski,Alaska,Republican
1239,Mon Apr 27 19:53:32 +0000 2015,5.92779E+17,4,9,It was an honor to be at @ArcticCouncil mtgs as the US officially assumed Chair. #OneArctic http://t.co/SiRfOA7njM,lisamurkowski,Lisa Murkowski,Alaska,Republican
1240,Fri Apr 24 22:55:16 +0000 2015,5.91737E+17,1,5,Couldn't agree more!  https://t.co/5g395suXeo,lisamurkowski,Lisa Murkowski,Alaska,Republican
1241,Fri Apr 24 19:16:02 +0000 2015,5.91682E+17,0,2,@ArcticCouncil watch party at @uaanchorage today! Alaskans know our Chairmanship is important! #OneArctic http://t.co/JLkzOiUMZO,lisamurkowski,Lisa Murkowski,Alaska,Republican
1242,Fri Apr 24 16:56:05 +0000 2015,5.91647E+17,0,8,"Only 1 hour to go until the US officially becomes Chair of the @ArcticCouncil. At 10 am in Alaska, tune in to watch: http://t.co/V6yfEnhRCd.",lisamurkowski,Lisa Murkowski,Alaska,Republican
1243,Thu Apr 23 21:56:11 +0000 2015,5.9136E+17,0,2,"No, thank you for boosting awareness!! https://t.co/t4MNzkFLJn",lisamurkowski,Lisa Murkowski,Alaska,Republican
1244,Thu Apr 23 16:30:39 +0000 2015,5.91278E+17,7,5,"Today I voted against the nomination of Attorney General candidate Loretta Lynch, and here's why: http://t.co/YjjrgzpXLW.",lisamurkowski,Lisa Murkowski,Alaska,Republican
1245,Wed Apr 22 20:46:20 +0000 2015,5.9098E+17,0,1,"Between votes today, @sendansullivan and I were able to meet with some impressive students from… https://t.co/epRdUfwvlg",lisamurkowski,Lisa Murkowski,Alaska,Republican
1246,Tue Apr 21 21:43:51 +0000 2015,5.90632E+17,0,1,Staff Sgt. Kimberly Daugherty’s determination is truly incredible! https://t.co/cOe9GgqfxG,lisamurkowski,Lisa Murkowski,Alaska,Republican
1247,Tue Apr 21 20:02:14 +0000 2015,5.90606E+17,0,2,Safe travels to the 23 veterans–of WWII &amp; Korea-who are flying to D.C. as part of The Last Frontier Honor Flight! http://t.co/V9gx4pXy5y,lisamurkowski,Lisa Murkowski,Alaska,Republican
1248,Tue Apr 21 19:00:35 +0000 2015,5.90591E+17,1,3,Congrats to @CraigAKLibrary for being named winner of the National Medal for Museum and Library Services…truly well-deserved!,lisamurkowski,Lisa Murkowski,Alaska,Republican
1249,Tue Apr 21 16:32:23 +0000 2015,5.90554E+17,1,11,Just a few days to go until the U.S. takes the Chair of the Arctic Council! https://t.co/GKcpZlIGoQ,lisamurkowski,Lisa Murkowski,Alaska,Republican
1250,Thu Apr 16 23:09:34 +0000 2015,5.88842E+17,0,5,"Best of luck to all the NYO Games athletes! The games kick off today, celebrating AK's rich culture and traditions. http://t.co/ltdCzJeMir",lisamurkowski,Lisa Murkowski,Alaska,Republican
1251,Thu Apr 16 14:30:16 +0000 2015,5.88711E+17,0,1,The first 100 days tell a strong story: the U.S. Senate is back to work for America. http://t.co/a9QLolWetO,lisamurkowski,Lisa Murkowski,Alaska,Republican
1252,Wed Apr 15 21:46:42 +0000 2015,5.88458E+17,5,19,It takes Americans an estimated 1.35 billion hours to file individual returns and pay $4.4 billion in compliance costs #TaxDay,lisamurkowski,Lisa Murkowski,Alaska,Republican
1253,Wed Apr 15 01:43:27 +0000 2015,5.88156E+17,2,1,Many of you might recognize this face --- Sue Aikens of the show lifebelowzero was in D.C. today!… https://t.co/PmpvtgQuhB,lisamurkowski,Lisa Murkowski,Alaska,Republican
1254,Tue Apr 14 19:42:45 +0000 2015,5.88065E+17,1,4,"America needs Eielson, which is why the @usairforce has decided to keep the F-16s there: http://t.co/1H2sqBtnBt. http://t.co/7eeTliJRbA",lisamurkowski,Lisa Murkowski,Alaska,Republican
1255,Mon Apr 13 21:02:20 +0000 2015,5.87723E+17,0,2,"Congrats to Kenai's Allie Ostrander, “Allie-O”, who broke the 10 minute mark in the 3,200 meter run--truly amazing! http://t.co/jVqBbFVoZC",lisamurkowski,Lisa Murkowski,Alaska,Republican
1256,Mon Apr 13 18:40:48 +0000 2015,5.87687E+17,1,1,"@EricaMartinson, welcome to the AK journalism scene!  Look forward to working (more) with you on Alaskan issues and our energy future.",lisamurkowski,Lisa Murkowski,Alaska,Republican
1257,Fri Apr 10 16:45:47 +0000 2015,5.86571E+17,1,5,Just gorgeous! https://t.co/fBNvBzvVcF,lisamurkowski,Lisa Murkowski,Alaska,Republican
