,created_at,id_str,reply_count,retweet_count,text,user,name,state,party
0,Wed May 17 16:53:37 +0000 2017,8.64887E+17,448,954,"Like many Alaskans, I’m concerned about the continuous and often conflicting reports about President Trump, the FBI… https://t.co/E8O6Prfo7I",lisamurkowski,Lisa Murkowski,Alaska,Republican
1,Tue May 16 21:45:17 +0000 2017,8.64598E+17,7,12,Sending @maziehirono and her family strength as she battles this terrible disease. https://t.co/eEBHsZ8mnV,lisamurkowski,Lisa Murkowski,Alaska,Republican
2,Tue May 16 20:27:35 +0000 2017,8.64578E+17,5,8,Headed to Senate floor to talk about #NationalPoliceWeek &amp; honor life of fallen Fbks office Sgt. Brandt. Watch live: https://t.co/UxNdvdct3X,lisamurkowski,Lisa Murkowski,Alaska,Republican
3,Mon May 15 20:25:09 +0000 2017,8.64215E+17,17,8,"This weekend kicked off #NationalPoliceWeek, as we reflect on the service &amp; sacrifice made by our law enforcement o… https://t.co/wP62BlhhF7",lisamurkowski,Lisa Murkowski,Alaska,Republican
4,Mon May 15 16:53:46 +0000 2017,8.64162E+17,9,6,I had a lovely #MothersDay picking fiddlehead ferns with my son Nic in Girdwood! https://t.co/jlo9iJSjAO,lisamurkowski,Lisa Murkowski,Alaska,Republican
5,Fri May 12 18:25:02 +0000 2017,8.63098E+17,31,5,Love this photo. Alaska is truly the heart of America’s Arctic. https://t.co/oQN0A5gPxP,lisamurkowski,Lisa Murkowski,Alaska,Republican
6,Fri May 12 17:58:32 +0000 2017,8.63091E+17,21,7,"Great talk w/ mayors from 8 Arctic nations, highlighting the role of local government in addressing challenges/oppo… https://t.co/tyGodOWObL",lisamurkowski,Lisa Murkowski,Alaska,Republican
7,Thu May 11 22:43:51 +0000 2017,8.628E+17,17,7,"At the opening ceremony at Arctic Council Ministerial with minister Timo Soini of Finland, the new chair of the Arc… https://t.co/hEkuFIN2Gz",lisamurkowski,Lisa Murkowski,Alaska,Republican
8,Wed May 10 15:01:48 +0000 2017,8.62322E+17,223,118,My statement on President Trump's announcement that he fired FBI Director James Comey: https://t.co/lU6R1GBEsb,lisamurkowski,Lisa Murkowski,Alaska,Republican
9,Tue May 09 20:36:02 +0000 2017,8.62044E+17,20,8,Happy #NationalTeacherDay! Thank you to the teachers who have dedicated themselves to enriching and bettering the l… https://t.co/p5aPCDz6kF,lisamurkowski,Lisa Murkowski,Alaska,Republican
10,Tue May 09 15:20:47 +0000 2017,8.61964E+17,3,4,".@SenDanSullivan Many communities in Tongass &amp; Chugach rely on SRS to fund vital services like public schooling, em… https://t.co/kJ6iMSU7Db",lisamurkowski,Lisa Murkowski,Alaska,Republican
11,Tue May 09 15:20:06 +0000 2017,8.61964E+17,4,3,.@SenDanSullivan SRS helps resource-dependent communities with tax-exempt federal lands to provide essential public services.,lisamurkowski,Lisa Murkowski,Alaska,Republican
12,Tue May 09 15:19:29 +0000 2017,8.61964E+17,7,9,I appreciate @SenateMajLrd commitment to work w/ @SenDanSullivan &amp; me to reauthorize Secure Rural Schools program. https://t.co/BGytr9PhrO,lisamurkowski,Lisa Murkowski,Alaska,Republican
13,Mon May 08 19:55:59 +0000 2017,8.61671E+17,10,13,"Arctic Week starts today, w/ more than 1,000 ppl from around the world meeting in #Fairbanks for the @ArcticCouncil… https://t.co/QIE4OkrrV0",lisamurkowski,Lisa Murkowski,Alaska,Republican
14,Mon May 08 16:16:54 +0000 2017,8.61616E+17,3,1,Great showing at the Alaska Aviation Gathering in Anchorage this past weekend! https://t.co/C9ioqSypx1,lisamurkowski,Lisa Murkowski,Alaska,Republican
15,Sat May 06 00:27:52 +0000 2017,8.60652E+17,2,12,"Today Anchorage honored the men &amp; women of law enforcement for Alaska Police Memorial Day, to remember the lives lo… https://t.co/mffPYoIzb8",lisamurkowski,Lisa Murkowski,Alaska,Republican
16,Fri May 05 19:39:54 +0000 2017,8.6058E+17,7,3,I thank John Lee for his years of service as the CEO of Mat-Su Regional Medical Center. Best of luck with your futu… https://t.co/Z2FauyDma4,lisamurkowski,Lisa Murkowski,Alaska,Republican
17,Thu May 04 18:57:39 +0000 2017,8.60207E+17,16,8,"Senate passed omnibus funding bill today, which provides critical stability, protections, &amp; opportunities for AK:… https://t.co/d2Q950yyTu",lisamurkowski,Lisa Murkowski,Alaska,Republican
18,Thu May 04 16:40:17 +0000 2017,8.60172E+17,7,3,Headed to the @SenateFloor to discuss the Omnibus Bill &amp; how it impacts Alaskans. Watch live floor here: https://t.co/JMtOTcYT6C,lisamurkowski,Lisa Murkowski,Alaska,Republican
19,Wed May 03 21:20:31 +0000 2017,8.5988E+17,17,5,I'm holding a Facebook Live discussion tomorrow on funding the government &amp; Alaska's priorities. I can't wait to he… https://t.co/VLCA703lGv,lisamurkowski,Lisa Murkowski,Alaska,Republican
20,Tue May 02 21:35:04 +0000 2017,8.59522E+17,2,4,Congrats to the winners of the 2017 50th Annual Masonic Outstanding Student Awards - a truly impressive group of yo… https://t.co/8OIPbee0uY,lisamurkowski,Lisa Murkowski,Alaska,Republican
21,Mon May 01 14:56:31 +0000 2017,8.59059E+17,5,8,Sounds like Alaskans in Southeast experienced quite an earthquake this morning – hope everyone is safe! https://t.co/45HzKz4m6x,lisamurkowski,Lisa Murkowski,Alaska,Republican
22,Sun Apr 30 18:05:02 +0000 2017,8.58744E+17,3,3,It was an honor to receive an award from the Close-Up Foundation with the teachers and parents who help us bring yo… https://t.co/LNpQa54ZXW,lisamurkowski,Lisa Murkowski,Alaska,Republican
23,Sat Apr 29 20:00:04 +0000 2017,8.58411E+17,7,9,Met w/ AK Assoc. of Secondary School Principals to discuss important education issues like teacher shortages &amp; grea… https://t.co/rg0qTSWNKi,lisamurkowski,Lisa Murkowski,Alaska,Republican
24,Sat Apr 29 00:04:03 +0000 2017,8.5811E+17,1,8,Good luck to the young athletes celebrating Alaska’s rich cultural heritage by partaking in The 47th Native Youth O… https://t.co/NsqfVUmRnF,lisamurkowski,Lisa Murkowski,Alaska,Republican
25,Fri Apr 28 19:56:59 +0000 2017,8.58047E+17,47,33,Alaskans support offshore Arctic development. I applaud @POTUS's commitment to explore development opportunities:… https://t.co/UUgvFLqDhZ,lisamurkowski,Lisa Murkowski,Alaska,Republican
26,Thu Apr 27 17:05:50 +0000 2017,8.57642E+17,2,6,"Had the pleasure of meeting Bob Williams, an exceptional educator &amp; the first Alaskan to be inducted into the Natio… https://t.co/Cm84QDBHV0",lisamurkowski,Lisa Murkowski,Alaska,Republican
27,Thu Apr 27 03:24:17 +0000 2017,8.57435E+17,19,12,2nd EO signed by @POTUS returns control of education decisions to those closest to students &amp; reduces gov. control. https://t.co/Rm8UYd5eg1,lisamurkowski,Lisa Murkowski,Alaska,Republican
28,Thu Apr 27 00:21:09 +0000 2017,8.57389E+17,0,4,"Thanks to the crews for your heroism, bravery &amp; determination during this mission &amp; cont'd. efforts to keep us safe. https://t.co/aMYW6YFebh",lisamurkowski,Lisa Murkowski,Alaska,Republican
29,Thu Apr 27 00:08:01 +0000 2017,8.57386E+17,3,4,"Congrats to the crews of Air Force Rescue 466/471/2108, the Guardian Angel team Bruin 01, &amp; members of the Alaska R… https://t.co/tcZMVjOOCb",lisamurkowski,Lisa Murkowski,Alaska,Republican
30,Wed Apr 26 23:13:06 +0000 2017,8.57372E+17,21,27,Thanks @POTUS. I’ll hold you to it! https://t.co/cKAt7mAgDz,lisamurkowski,Lisa Murkowski,Alaska,Republican
31,Tue Apr 25 21:58:59 +0000 2017,8.56991E+17,8,4,Met with the staff of the Fairbanks Cancer Care Physicians to discuss cancer care in Interior Alaska. Our state is… https://t.co/jWmkA2T4sC,lisamurkowski,Lisa Murkowski,Alaska,Republican
32,Mon Apr 24 22:13:30 +0000 2017,8.56632E+17,4,5,Congrats to Gov. Sonny Perdue on his successful confirmation to be our next @USDA Secretary:… https://t.co/65a6jO9FBm,lisamurkowski,Lisa Murkowski,Alaska,Republican
33,Mon Apr 24 21:49:34 +0000 2017,8.56626E+17,9,11,"On #HolocaustRemembranceDay, we remember the millions of innocent people who lost their lives. They will not be forgotten. #NeverAgain",lisamurkowski,Lisa Murkowski,Alaska,Republican
34,Mon Apr 24 16:30:37 +0000 2017,8.56546E+17,20,7,"Headed back to Washington, DC today. Beautiful views flying out of Anchorage. https://t.co/GlzpZ9X4AR",lisamurkowski,Lisa Murkowski,Alaska,Republican
35,Fri Apr 21 23:53:48 +0000 2017,8.5557E+17,5,6,Spoke to @AKAlliance members in Kenai today on the need to access and responsibly develop our resources. https://t.co/QhdUBchA1D,lisamurkowski,Lisa Murkowski,Alaska,Republican
36,Fri Apr 21 20:14:04 +0000 2017,8.55515E+17,1,3,Beacon Fire Training Facility facility provides valuable service training crews for aircraft rescue &amp; fire fighting. https://t.co/S0ZcEOOGyM,lisamurkowski,Lisa Murkowski,Alaska,Republican
37,Fri Apr 21 20:06:45 +0000 2017,8.55513E+17,1,4,"Went to @ Beacon Fire Training Facility in Kenai, the sole FAA-certified regional fire training center in AK. https://t.co/kUVuVu8RQJ",lisamurkowski,Lisa Murkowski,Alaska,Republican
38,Thu Apr 20 23:00:44 +0000 2017,8.55195E+17,3,7,Met w/members of the Nat'l Restaurant Assoc. today to discuss tax reform and other issues impacting AK's small busi… https://t.co/l8Bd7eYDFQ,lisamurkowski,Lisa Murkowski,Alaska,Republican
39,Wed Apr 19 21:24:16 +0000 2017,8.54808E+17,7,11,"Great visit to Mat-Su Career/Technical High School, touring the new building, &amp; seeing the world-class training the… https://t.co/xVwmZ40xHO",lisamurkowski,Lisa Murkowski,Alaska,Republican
40,Wed Apr 19 00:43:39 +0000 2017,8.54496E+17,6,6,Such a warm welcome at Meade River School in Atqasuk. https://t.co/f5Umbh1RlD,lisamurkowski,Lisa Murkowski,Alaska,Republican
41,Tue Apr 18 23:01:24 +0000 2017,8.5447E+17,3,3,Fantastic visit to Meade River School in Atqasuk! https://t.co/ZB1l7UvHQC,lisamurkowski,Lisa Murkowski,Alaska,Republican
42,Tue Apr 18 17:38:06 +0000 2017,8.54389E+17,6,8,#Quintillion Fiber Optic System will deliver high-speed broadband &amp; bring more opportunities to rural communities. https://t.co/oLQ3eVUZ7t,lisamurkowski,Lisa Murkowski,Alaska,Republican
43,Tue Apr 18 17:32:37 +0000 2017,8.54387E+17,5,7,Proud to join @SenDanSullivan &amp; @repdonyoung in Deadhorse @ launch of the #Quintillion fiber system. https://t.co/YRXUSAZ3Rv,lisamurkowski,Lisa Murkowski,Alaska,Republican
44,Mon Apr 17 18:35:39 +0000 2017,8.54041E+17,20,5,Flying over the Brooks Range headed to Prudhoe Bay. #Alaska https://t.co/7u4PvgwuwG,lisamurkowski,Lisa Murkowski,Alaska,Republican
45,Sun Apr 16 22:23:30 +0000 2017,8.53736E+17,7,7,One of my favorite family traditions this time of yr - our annual egg decorating contest. Happy Easter everyone! https://t.co/8ngPMRKG38,lisamurkowski,Lisa Murkowski,Alaska,Republican
46,Fri Apr 14 22:02:31 +0000 2017,8.53006E+17,9,7,At @AESymposium I spoke about the current &amp; future state of the Arctic &amp; how we can ensure continued U.S. engagemen… https://t.co/FXEYm1lR7j,lisamurkowski,Lisa Murkowski,Alaska,Republican
47,Thu Apr 13 17:26:55 +0000 2017,8.52574E+17,15,2,"Proud to intro. OPENS Act w/ @SenDanSullivan -- will help create jobs, reduce our deficits &amp; keep energy affordable. https://t.co/kYtG7a8jS5",lisamurkowski,Lisa Murkowski,Alaska,Republican
48,Wed Apr 12 22:56:14 +0000 2017,8.52294E+17,8,14,Beautiful sight of @USCG Cutter John McCormick Commissioning in Ketchikan. 1st fast response cutter stationed in AK. https://t.co/1FQULawVzs,lisamurkowski,Lisa Murkowski,Alaska,Republican
49,Tue Apr 11 04:55:48 +0000 2017,8.5166E+17,5,3,I'm fortunate to have such great brothers and sisters (Brothers not pictured). Happy… https://t.co/FAUturlDMS,lisamurkowski,Lisa Murkowski,Alaska,Republican
50,Sun Apr 09 01:08:09 +0000 2017,8.50878E+17,22,10,Sad day for AK hockey. Tonight is likely the @AlaskaAces last game in Anchorage after 15 action-packed seasons &amp; 3 Kelly Cups.,lisamurkowski,Lisa Murkowski,Alaska,Republican
51,Fri Apr 07 19:33:04 +0000 2017,8.50431E+17,40,10,Congratulations to Judge Neil #Gorsuch on becoming our newest #SCOTUS justice! https://t.co/fD0MhBddEk https://t.co/vnBUWLyO9i,lisamurkowski,Lisa Murkowski,Alaska,Republican
52,Fri Apr 07 15:55:58 +0000 2017,8.50377E+17,2,1,I’ve been working tirelessly w/ @SenDanSullivan and @repdonyoung to reverse the proposed downsize of the 4/25 since 2014.,lisamurkowski,Lisa Murkowski,Alaska,Republican
53,Fri Apr 07 15:55:41 +0000 2017,8.50377E+17,2,4,Alaskans are waking up to news we’ve been waiting to hear – the 4/25 Army Brigade Combat Team @ JBER remains intact: https://t.co/YfRlr8KDc3,lisamurkowski,Lisa Murkowski,Alaska,Republican
54,Fri Apr 07 15:03:09 +0000 2017,8.50363E+17,4,2,"Talking w/Rick Rydell on @650keni re: Syria, SCOTUS, &amp; breaking news regarding the 4/25 brigade @ JBER. Tune in now: https://t.co/3953JGO9x7",lisamurkowski,Lisa Murkowski,Alaska,Republican
55,Thu Apr 06 21:12:34 +0000 2017,8.50094E+17,128,8,Dems decision to filibuster Judge Gorsuch left no other way to advance an exceptionally well-qualified individual w… https://t.co/95LA59oxz0,lisamurkowski,Lisa Murkowski,Alaska,Republican
56,Wed Apr 05 20:57:58 +0000 2017,8.49728E+17,58,10,"Judge Gorsuch will be his own man, following the law where it leads and that is what we should want in a Supreme Court justice.",lisamurkowski,Lisa Murkowski,Alaska,Republican
57,Wed Apr 05 20:57:45 +0000 2017,8.49728E+17,196,73,I pride myself as one who believes in the traditions of the Senate. But it's not the tradition of the Senate to fil… https://t.co/xRlZSLSdxC,lisamurkowski,Lisa Murkowski,Alaska,Republican
58,Wed Apr 05 19:03:09 +0000 2017,8.49699E+17,3,8,Honored to receive @NSSF Legislator of the Year award yesterday &amp; look forward to continuing my work to support Ame… https://t.co/uFbF5ZW1al,lisamurkowski,Lisa Murkowski,Alaska,Republican
59,Wed Apr 05 15:04:31 +0000 2017,8.49639E+17,69,5,Speaking on the Senate floor on the need to confirm Judge Gorsuch. Tune in here: https://t.co/Rgshy28eGw.,lisamurkowski,Lisa Murkowski,Alaska,Republican
60,Tue Apr 04 21:30:26 +0000 2017,8.49374E+17,15,19,Glad to see @POTUS is on board w/ leveraging hydropower as a renewable energy source. https://t.co/BF4yFm9A3T,lisamurkowski,Lisa Murkowski,Alaska,Republican
61,Tue Apr 04 19:03:57 +0000 2017,8.49337E+17,3,4,My support for this group stems from a simple reason – AK &amp; entire nation depend on the men &amp; women who build/maintain infrastructure. (2/2),lisamurkowski,Lisa Murkowski,Alaska,Republican
62,Tue Apr 04 19:03:18 +0000 2017,8.49337E+17,5,6,"Honored to receive first-ever Legislator of the Year Award from the United Assoc. Union of Plumbers, Fitters, Welde… https://t.co/T04ZJHmsp5",lisamurkowski,Lisa Murkowski,Alaska,Republican
63,Tue Apr 04 15:57:50 +0000 2017,8.4929E+17,43,9,Pleased to get call from @POTUS after he signed resolution to undo rule restricting Alaska's ability to manage wildlife on refuge lands.,lisamurkowski,Lisa Murkowski,Alaska,Republican
64,Mon Apr 03 22:03:01 +0000 2017,8.49019E+17,72,12,Today Judiciary Comm voted Judge Gorsuch out of committee to be considered by the Senate. He's proven himself &amp; sho… https://t.co/V02YF0rGQ8,lisamurkowski,Lisa Murkowski,Alaska,Republican
65,Sat Apr 01 15:22:30 +0000 2017,8.48194E+17,4,1,"@SenDanSullivan &amp; I intro'd leg for 150th anniversary of the Alaska Purchase, recognizing what makes AK unique https://t.co/LR74qYVa36",lisamurkowski,Lisa Murkowski,Alaska,Republican
66,Fri Mar 31 16:35:09 +0000 2017,8.4785E+17,12,10,I co-sponsored bipartisan legislation with @SenDanSullivan to provide the tools needed to tackle growing issue of… https://t.co/4rqGPNvOB6,lisamurkowski,Lisa Murkowski,Alaska,Republican
67,Thu Mar 30 21:28:03 +0000 2017,8.47561E+17,11,17,"On 150th anniversary of #AlaskaPurchase, @WSJ asked the question ""was it worth it?"" My answer -- absolutely. https://t.co/aFWlz5lYop",lisamurkowski,Lisa Murkowski,Alaska,Republican
68,Thu Mar 30 20:19:12 +0000 2017,8.47544E+17,3,5,2 squadrons of F-35s headed to @EielsonAFB_AK in 2020! https://t.co/6MHJ6lE8lz,lisamurkowski,Lisa Murkowski,Alaska,Republican
69,Wed Mar 29 21:57:32 +0000 2017,8.47206E+17,10,9,Today @USArmy Surgeon Gen. confirmed support for military's ALS Research Program. There's high disproportionate rat… https://t.co/bNMe2RDIFZ,lisamurkowski,Lisa Murkowski,Alaska,Republican
70,Wed Mar 29 19:13:59 +0000 2017,8.47165E+17,4,2,AK's @MartinSensmeier is testifying @ @IndianCommittee hearing on Diabetes Prevention Through Healthy Living. Watch: https://t.co/6FNqPcldMv,lisamurkowski,Lisa Murkowski,Alaska,Republican
71,Wed Mar 29 17:21:24 +0000 2017,8.47137E+17,15,5,I reintro'd bipartisan Sportsmen's Act to provide new opportunities for Alaskan outdoorsmen to access federal lands. https://t.co/aAoNSnt9pY,lisamurkowski,Lisa Murkowski,Alaska,Republican
72,Wed Mar 29 14:38:32 +0000 2017,8.47096E+17,14,9,"Here at Department of Interior this morning -- found the portrait of Alaska's one and only Secretary of Interior, W… https://t.co/iwvywcndrb",lisamurkowski,Lisa Murkowski,Alaska,Republican
73,Tue Mar 28 01:03:06 +0000 2017,8.46528E+17,11,19,"Happy Seward’s Day, Alaska! Today we commemorate the US purchase of Alaska from Russia in 1867 – at a bargain of 2… https://t.co/vSep4c7cLy",lisamurkowski,Lisa Murkowski,Alaska,Republican
74,Mon Mar 27 21:43:19 +0000 2017,8.46478E+17,28,11,Was at the White House today as @POTUS signed bill to repeal BLM Planning 2.0 &amp; returns power/decision-making autho… https://t.co/4wieDiXLKY,lisamurkowski,Lisa Murkowski,Alaska,Republican
75,Mon Mar 27 18:23:12 +0000 2017,8.46427E+17,3,31,#OnThisDay in 1964 Alaska was rocked by a magnitude 9.2 earthquake. https://t.co/AT5o3sOBdG,lisamurkowski,Lisa Murkowski,Alaska,Republican
76,Mon Mar 27 16:55:24 +0000 2017,8.46405E+17,1,5,Speaking at @TheWilsonCenter in 10 minutes on regional collaboration in the Arctic. Watch live here: https://t.co/vHwu9UWEow.,lisamurkowski,Lisa Murkowski,Alaska,Republican
77,Fri Mar 24 17:21:57 +0000 2017,8.45325E+17,24,10,"Yesterday my staff in DC &amp; in Alaska participated in Choose Respect Marches, taking a stand against domestic violen… https://t.co/rmsvICQyTS",lisamurkowski,Lisa Murkowski,Alaska,Republican
78,Thu Mar 23 15:59:37 +0000 2017,8.44942E+17,8,11,Great group of women at the @ELLEmagazine #ELLEWIW event! https://t.co/IhAohQuygK,lisamurkowski,Lisa Murkowski,Alaska,Republican
79,Thu Mar 23 15:58:14 +0000 2017,8.44941E+17,12,11,"Honored to be named in @ELLEmagazine Women in Washington Power List, recognizing accomplishments of women. #ELLEWIW https://t.co/DwrQrokqsv",lisamurkowski,Lisa Murkowski,Alaska,Republican
80,Thu Mar 23 15:29:06 +0000 2017,8.44934E+17,18,13,Happy #NationalPuppyDay! https://t.co/z31sdY7BU3,lisamurkowski,Lisa Murkowski,Alaska,Republican
81,Thu Mar 23 15:14:54 +0000 2017,8.4493E+17,4,2,.@FDNMeditor Good question - a Facebook live video. I'll give a brief update and then answer questions posed by Alaskans in the comments.,lisamurkowski,Lisa Murkowski,Alaska,Republican
82,Thu Mar 23 15:07:12 +0000 2017,8.44929E+17,10,7,At 12:30 AKDT I'll be live on FB to talk about where things stand w/ healthcare reform &amp; answer questions:… https://t.co/kilZKFIlRQ,lisamurkowski,Lisa Murkowski,Alaska,Republican
83,Wed Mar 22 17:06:28 +0000 2017,8.44596E+17,12,20,Horrified to learn of terrorist incident outside Parliament in London. Praying for everyone there &amp; for the safety of the officers.,lisamurkowski,Lisa Murkowski,Alaska,Republican
84,Wed Mar 22 00:48:14 +0000 2017,8.4435E+17,52,20,"Senate voted to return ability to manage fish/wildlife back to the states, as promised to Alaska at statehood: https://t.co/5UqnA6D0xN.",lisamurkowski,Lisa Murkowski,Alaska,Republican
85,Tue Mar 21 16:51:48 +0000 2017,8.4423E+17,27,8,Today I had the honor of receiving the 2017 Congressional Arts Leadership Award due to my commitment to the arts. https://t.co/VfNtWVZQiV,lisamurkowski,Lisa Murkowski,Alaska,Republican
86,Mon Mar 20 21:38:12 +0000 2017,8.4394E+17,19,7,Are you subscribed to my newsletter? Stay up to date on the work I’m doing in D.C. and at home in Alaska: https://t.co/10bIrinGgs.,lisamurkowski,Lisa Murkowski,Alaska,Republican
87,Sat Mar 18 21:20:58 +0000 2017,8.43211E+17,5,6,Great article the two innovative Alaskans I met with in Juneau last month who are harvesting kelp from our waters. https://t.co/t2zBIhMdwB,lisamurkowski,Lisa Murkowski,Alaska,Republican
88,Fri Mar 17 16:57:23 +0000 2017,8.42782E+17,6,2,Way to go Doug and all Circle of Honor drivers with @UPS! https://t.co/Ne2ghZWCzQ,lisamurkowski,Lisa Murkowski,Alaska,Republican
89,Thu Mar 16 19:54:09 +0000 2017,8.42464E+17,47,15,"Budget request is simply first step in long process -- President proposes, but Congress disposes. Ready to get to work as an appropriator.",lisamurkowski,Lisa Murkowski,Alaska,Republican
90,Thu Mar 16 19:53:35 +0000 2017,8.42464E+17,15,7,Click here for my statement on @POTUS budget request: https://t.co/GdLpmlbZFm.,lisamurkowski,Lisa Murkowski,Alaska,Republican
91,Wed Mar 15 21:47:22 +0000 2017,8.4213E+17,24,15,Next week I will be hosting a Facebook Live to give a legislative update on healthcare policy. Tune into my page @… https://t.co/ChR8eeVyLg,lisamurkowski,Lisa Murkowski,Alaska,Republican
92,Wed Mar 15 00:07:43 +0000 2017,8.41803E+17,21,16,Huge congrats to Mitch Seavey on his record-breaking #iditarod2017 win! https://t.co/1bMycWVQaS,lisamurkowski,Lisa Murkowski,Alaska,Republican
93,Tue Mar 14 20:30:01 +0000 2017,8.41748E+17,23,4,Skype with @TananaChiefs today to discuss challenges and opportunities within Native communities. https://t.co/2OiMZAUP4f,lisamurkowski,Lisa Murkowski,Alaska,Republican
94,Tue Mar 14 18:25:07 +0000 2017,8.41717E+17,5,12,Only in Alaska... https://t.co/s9V1otjYs2,lisamurkowski,Lisa Murkowski,Alaska,Republican
95,Tue Mar 14 00:41:27 +0000 2017,8.41449E+17,20,9,Alaska is set to receive $$ to help improve air quality in Fairbanks through voluntary wood stove change-outs: https://t.co/hyuat4d3qL,lisamurkowski,Lisa Murkowski,Alaska,Republican
96,Mon Mar 13 16:23:07 +0000 2017,8.41324E+17,5,8,Best of luck to the two athletes representing Alaska at the 2017 Special Olympics World Winter Games in Austria! https://t.co/p0Muc0WR2L,lisamurkowski,Lisa Murkowski,Alaska,Republican
97,Thu Mar 09 21:05:59 +0000 2017,8.39945E+17,21,10,"Hosted lunch for Senate colleagues today and served Alaska halibut, pollock, crab, and carrots. Nothing like fresh… https://t.co/4kB9nFdrig",lisamurkowski,Lisa Murkowski,Alaska,Republican
98,Thu Mar 09 20:31:25 +0000 2017,8.39937E+17,2,10,The 2nd Alaskan I’m highlighting is Nora Venes Guinn – the 1st female &amp; Alaska Native District Court Judge:… https://t.co/ixe8mr0pBI,lisamurkowski,Lisa Murkowski,Alaska,Republican
99,Thu Mar 09 18:45:03 +0000 2017,8.3991E+17,4,16,Enjoyed meeting with the @ArthritisFdn about juvenile arthritis earlier this week - you are a great advocate for al… https://t.co/vjpbDNWWtF,lisamurkowski,Lisa Murkowski,Alaska,Republican
100,Wed Mar 08 16:24:31 +0000 2017,8.39512E+17,16,17,"On #InternationalWomensDay we acknowledge the female trailblazers who transformed our communities, country, and world for the better.",lisamurkowski,Lisa Murkowski,Alaska,Republican
101,Tue Mar 07 20:58:45 +0000 2017,8.39219E+17,19,21,Today I joined with every one of my Senate colleagues to call for swift action regarding recent anti-Semitic threat… https://t.co/tO5MyxNDPo,lisamurkowski,Lisa Murkowski,Alaska,Republican
102,Tue Mar 07 16:47:24 +0000 2017,8.39156E+17,7,7,"Met this morning with members of the @naihc_national regarding housing, community, and infrastructure policy for ou… https://t.co/IwafbPxIO9",lisamurkowski,Lisa Murkowski,Alaska,Republican
103,Mon Mar 06 21:46:47 +0000 2017,8.38868E+17,8,6,"After ceremonial start in Anchorage, #Iditarod2017 officially begins in Fairbanks today! My Capitol Hill office wil… https://t.co/a1pMUJ5CGC",lisamurkowski,Lisa Murkowski,Alaska,Republican
104,Mon Mar 06 19:58:14 +0000 2017,8.38841E+17,6,8,"To celebrate #WomensHistoryMonth  I'll be highlighting women in AK's history, starting w/ Susan Butcher: https://t.co/BQxg49gbcl",lisamurkowski,Lisa Murkowski,Alaska,Republican
105,Mon Mar 06 17:02:09 +0000 2017,8.38797E+17,15,4,Heading back east. Tough to leave after a fabulously beautiful weekend. https://t.co/HO8h56jk1t,lisamurkowski,Lisa Murkowski,Alaska,Republican
106,Sat Mar 04 23:28:14 +0000 2017,8.38169E+17,11,9,"Wishing a very happy birthday to our new Secretary of Energy, @SecretaryPerry. Your gift from Alaska is in the mail! https://t.co/A2gra95gVT",lisamurkowski,Lisa Murkowski,Alaska,Republican
107,Sat Mar 04 20:02:54 +0000 2017,8.38118E+17,4,21,And they're off! Beautiful day in Anchorage for the start of #Iditarod2017. https://t.co/CiMHg6ve0i,lisamurkowski,Lisa Murkowski,Alaska,Republican
108,Fri Mar 03 21:20:58 +0000 2017,8.37775E+17,7,11,Love this article about the @aksalmonsisters -- Alaskan women living a fishing life. https://t.co/RDzuj0Ia4s,lisamurkowski,Lisa Murkowski,Alaska,Republican
109,Fri Mar 03 17:57:33 +0000 2017,8.37724E+17,1,3,NMFS is moving forward w/necessary regulations to issue quota &amp; ensure on-time halibut fishery in AK this spring: https://t.co/oLFfeiLGSD.,lisamurkowski,Lisa Murkowski,Alaska,Republican
110,Thu Mar 02 22:14:26 +0000 2017,8.37426E+17,6,13,Alaska high school and college students – only two weeks remaining to apply for a summer internship in my DC office: https://t.co/NryqrHGNp9,lisamurkowski,Lisa Murkowski,Alaska,Republican
111,Thu Mar 02 20:04:37 +0000 2017,8.37393E+17,12,2,He will provide leadership at @ENERGY as we pursue broad benefits of energy innovation &amp; greater security for energy infrastructure. (2/2),lisamurkowski,Lisa Murkowski,Alaska,Republican
112,Thu Mar 02 20:04:17 +0000 2017,8.37393E+17,19,5,I congratulate @GovernorPerry on his successful confirmation to be our nation’s next Secretary of Energy: https://t.co/rPJ4o3d7Le (1/2),lisamurkowski,Lisa Murkowski,Alaska,Republican
