,created_at,id_str,reply_count,retweet_count,text,user,name,state,party
1832,Wed Dec 11 02:36:45 +0000 2013,4.10599E+17,0,3,Thanks @ABCWorldNews &amp; @DianeSawyer for sharing my thoughts about the DC 'winter' #weather that shut down DC today,lisamurkowski,Lisa Murkowski,Alaska,Republican
1833,Tue Dec 10 17:56:10 +0000 2013,4.10468E+17,0,5,Great job to the women who organized the #WIAC13 it was great to stop by and chat! @womeninadvocacy http://t.co/uGEJQ9lgO9,lisamurkowski,Lisa Murkowski,Alaska,Republican
1834,Tue Dec 10 17:50:08 +0000 2013,4.10466E+17,2,1,Giving a quick speech at the @womeninadvocacy lunch #WIAC13 #women #energyisgood http://t.co/IrUXuxP7rJ,lisamurkowski,Lisa Murkowski,Alaska,Republican
1835,Tue Dec 10 01:35:55 +0000 2013,4.10221E+17,50,55,"After 3 days, on and off, of browser glitches &amp; frustration, I believe I'm enrolled in the DC healthcare exchange http://t.co/dkGkYZ3VPV",lisamurkowski,Lisa Murkowski,Alaska,Republican
1836,Mon Dec 09 22:47:33 +0000 2013,4.10179E+17,1,1,4 #Alaska airmen have received Bronze Stars for bravery &amp; courage in #Afghanistan. Read their amazing stories here: http://t.co/fKCdiekF3U,lisamurkowski,Lisa Murkowski,Alaska,Republican
1837,Mon Dec 09 02:31:55 +0000 2013,4.09873E+17,1,1,#Alaska girls rock! http://t.co/zUozFxjkXd,lisamurkowski,Lisa Murkowski,Alaska,Republican
1838,Sun Dec 08 01:43:51 +0000 2013,4.09499E+17,0,2,On this #PearlHarbor Remembrance Day I'm honoring #Alaska WWII vet Norman Hogg. See his amazing story here: http://t.co/LUrJ6S2oCP,lisamurkowski,Lisa Murkowski,Alaska,Republican
1839,Thu Dec 05 22:07:43 +0000 2013,4.08719E+17,1,8,"RIP: Nelson Mandela, a living testament to the power of positivity and perseverance through struggle and adversity.",lisamurkowski,Lisa Murkowski,Alaska,Republican
1840,Wed Dec 04 18:33:09 +0000 2013,4.08303E+17,1,1,"MT: Our #HolidayParty w/ @AEDC is tonight, 4:30 - 6:30 p.m. at the Peterson Tower in #Anchorage! Stop by and say hi! http://t.co/raDfn6pEGy",lisamurkowski,Lisa Murkowski,Alaska,Republican
1841,Wed Dec 04 00:38:33 +0000 2013,4.08033E+17,2,2,Greg from my #Anchorage office delivering cookies to @asymca for single soldiers this holiday season #GivingTuesday http://t.co/ZmvtNEM9Bj,lisamurkowski,Lisa Murkowski,Alaska,Republican
1842,Mon Dec 02 18:05:47 +0000 2013,4.07571E+17,1,3,I have a new Legislative Director in DC: Kate Williams of #Juneau. Help me welcome her http://t.co/MgenZ5M1E7,lisamurkowski,Lisa Murkowski,Alaska,Republican
1843,Fri Nov 29 23:44:37 +0000 2013,4.06569E+17,2,11,Tomorrow is #SmallBizSaturday. I encourage all Alaskans to #ShopSmall to empower &amp; connect to our #AK community http://t.co/f6ciqvvLtf,lisamurkowski,Lisa Murkowski,Alaska,Republican
1844,Wed Nov 27 19:22:15 +0000 2013,4.05779E+17,1,5,I'm #thankful for our state &amp; all #Alaskans I have the privilege of working for. I wouldn’t be here w/o you #AKThanks http://t.co/cBzj2eNLWV,lisamurkowski,Lisa Murkowski,Alaska,Republican
1845,Tue Nov 26 23:45:25 +0000 2013,4.05482E+17,2,6,I couldn't do my job without the help of some great staff members. Today I'm thankful for them #AKThanks http://t.co/V49IbyX6m3,lisamurkowski,Lisa Murkowski,Alaska,Republican
1846,Tue Nov 26 18:36:53 +0000 2013,4.05405E+17,4,5,Finally: the #GSA isn’t going to let 3rd party groups tell #Alaska how #sustainable our fisheries are: http://t.co/I6DOsR8McN,lisamurkowski,Lisa Murkowski,Alaska,Republican
1847,Tue Nov 26 18:06:22 +0000 2013,4.05397E+17,2,3,"Thanks, @Sitkasentinel for covering #AKThanks campaign.  Hope to hear from Sitkans and other SE Alaskans about what they're grateful for!",lisamurkowski,Lisa Murkowski,Alaska,Republican
1848,Mon Nov 25 19:29:30 +0000 2013,4.05056E+17,3,4,Day 3 of my #AKThanks campaign &amp; I’m thankful for our Alaskan Winters &amp; #snow. What are you thankful for #Alaska? http://t.co/hmCUk5Ur6n,lisamurkowski,Lisa Murkowski,Alaska,Republican
1849,Mon Nov 25 18:09:45 +0000 2013,4.05036E+17,0,1,@Ch2KTUU and @KTOOpubmedia covered my #AKThanks campaign.  What are you grateful for this year?,lisamurkowski,Lisa Murkowski,Alaska,Republican
1850,Sun Nov 24 00:37:40 +0000 2013,4.04408E+17,1,5,"Thx, @KSRMam for covering my #AKThanks campaign!  Let's not take for granted all our blessings. What are you thankful for this year?",lisamurkowski,Lisa Murkowski,Alaska,Republican
1851,Sun Nov 24 00:26:15 +0000 2013,4.04406E+17,0,5,"As Thanksgiving approaches, my #AKThanks campaign is focusing on all we are grateful for. 1st for me? Family.  You? http://t.co/ivwkPG9i6k",lisamurkowski,Lisa Murkowski,Alaska,Republican
1852,Fri Nov 22 20:31:13 +0000 2013,4.03984E+17,0,2,I welcome @DeptofDefense’s new #Arctic Strategy. We need to be involved to keep threat level low: http://t.co/k0eqTmf2I1,lisamurkowski,Lisa Murkowski,Alaska,Republican
1853,Fri Nov 22 00:51:19 +0000 2013,4.03687E+17,11,10,Here’s what I think of the #NuclearOption by the Senate Democrats today: http://t.co/v00yNanvl8,lisamurkowski,Lisa Murkowski,Alaska,Republican
1854,Fri Nov 22 00:44:25 +0000 2013,4.03685E+17,3,4,Calling into @KFQD's Dave Stieren Show to talk about the Senate Democrat's #PowerGrab #NuclearOption today http://t.co/dCJOlIKItw,lisamurkowski,Lisa Murkowski,Alaska,Republican
1855,Wed Nov 20 23:19:21 +0000 2013,4.03302E+17,0,17,This is not what zero tolerance looks like and we cannot let military sexual assault continue #PassMJIA http://t.co/GVHiUcRlhV,lisamurkowski,Lisa Murkowski,Alaska,Republican
1856,Wed Nov 20 22:57:57 +0000 2013,4.03296E+17,0,2,Miracles of tech: @RonWyden &amp; I connecting via live video w/ @alaskardc to talk future #Alaska resource development http://t.co/ikuZBWrwX1,lisamurkowski,Lisa Murkowski,Alaska,Republican
1857,Wed Nov 20 21:10:21 +0000 2013,4.03269E+17,1,2,.@Sengillibrand Happy to help on such an important bill #PassMJIA,lisamurkowski,Lisa Murkowski,Alaska,Republican
1858,Tue Nov 19 19:31:11 +0000 2013,4.02882E+17,1,3,"We need a detailed, concrete plan for the #Arctic now. #Alaskans and our nation can’t wait http://t.co/4IRjlgk3Fe",lisamurkowski,Lisa Murkowski,Alaska,Republican
1859,Sun Nov 17 01:15:45 +0000 2013,4.01881E+17,2,14,40 years ago today Nixon authorized construction of the #TransAlaskaOilPipeline- the rest is history http://t.co/sGEK87i0gF… #TAPS #Alaska,lisamurkowski,Lisa Murkowski,Alaska,Republican
1860,Fri Nov 15 02:27:04 +0000 2013,4.01174E+17,7,7,I feel like I'm fighting the administration &amp; #IHS to get #Alaskans the healthcare funding they need: http://t.co/7jnRlIbnUJ,lisamurkowski,Lisa Murkowski,Alaska,Republican
1861,Thu Nov 14 22:15:37 +0000 2013,4.01111E+17,7,2,Here’s what I think about the POTUS #Obamacare fix: http://t.co/s0tBQfgCM6,lisamurkowski,Lisa Murkowski,Alaska,Republican
1862,Thu Nov 14 15:09:09 +0000 2013,4.01004E+17,10,11,Heading to the Senate floor to share Alaskans' concerns over ACA.  You can watch online at http://t.co/wEFHEIrtbp or on TV at C-SPAN2.,lisamurkowski,Lisa Murkowski,Alaska,Republican
1863,Wed Nov 13 22:47:11 +0000 2013,4.00757E+17,2,6,Here’s my takeaway from the WH #TribalNations Conference today: both good &amp; troubling things out of POTUS speech: http://t.co/id4Sn2G947,lisamurkowski,Lisa Murkowski,Alaska,Republican
1864,Wed Nov 13 21:45:26 +0000 2013,4.00741E+17,2,1,I’m worried that to drive down $ we are putting our country &amp; national #defense in jeopardy. We need a better system http://t.co/JSiH7Wh0cz,lisamurkowski,Lisa Murkowski,Alaska,Republican
1865,Wed Nov 13 21:27:18 +0000 2013,4.00737E+17,3,11,Listening to Pres @ #TribalNations Conference &amp; hoping he'll support keeping this nation's promises to our 1st people http://t.co/AA49ZavueL,lisamurkowski,Lisa Murkowski,Alaska,Republican
1866,Tue Nov 12 16:15:48 +0000 2013,4.00296E+17,0,8,"As Alaskans pray for #Haiyan victims in the Philippines, I ask everyone to consider any donations you can spare.
http://t.co/hlug7tUnZv",lisamurkowski,Lisa Murkowski,Alaska,Republican
1867,Thu Nov 07 19:43:38 +0000 2013,3.98536E+17,7,14,I proudly cast my vote in favor of #ENDA. All #Alaskans deserve to be protected from discrimination in the workplace http://t.co/6nVoJR3dAk,lisamurkowski,Lisa Murkowski,Alaska,Republican
1868,Wed Nov 06 23:27:55 +0000 2013,3.9823E+17,4,3,Words don't stop military sex assault. We must protect those who protect us w/ Military Justice Improvement Act http://t.co/GGBpckt6BG,lisamurkowski,Lisa Murkowski,Alaska,Republican
1869,Wed Nov 06 19:23:23 +0000 2013,3.98169E+17,9,7,"5,000+ #Alaskans are being forced off their health insurance plans by #Obamacare. My new bill aims to change that:  http://t.co/X5MpWl7ScV",lisamurkowski,Lisa Murkowski,Alaska,Republican
1870,Tue Nov 05 22:41:37 +0000 2013,3.97856E+17,0,1,Congrats to @NOAA’s Ted Stevens Research Institute in Juneau #AK for its GreenGov Presidential Award. It’s ocean heat project = 0 emissions,lisamurkowski,Lisa Murkowski,Alaska,Republican
1871,Tue Nov 05 21:00:08 +0000 2013,3.97831E+17,15,17,#Obamacare isn’t working in #Alaska &amp; I'm not convinced the new health care plans are secure accessible or affordable http://t.co/ZrKcxY0U3K,lisamurkowski,Lisa Murkowski,Alaska,Republican
1872,Thu Oct 31 23:03:30 +0000 2013,3.9605E+17,0,4,"Go Althea! RT @AKbirder My favorite @lisamurkowski staffer, dressed in honor of all the natural gas talk lately: http://t.co/IfvXk2Y41m",lisamurkowski,Lisa Murkowski,Alaska,Republican
1873,Thu Oct 31 22:40:03 +0000 2013,3.96044E+17,0,4,Snow's coming but #Galena hasn’t recovered yet from a Spring flood disaster. I called for an investigation into why: http://t.co/gc8uEdQpm7,lisamurkowski,Lisa Murkowski,Alaska,Republican
1874,Tue Oct 29 21:52:08 +0000 2013,3.95307E+17,5,2,16day gov #shutdown impacted Alaskans across our state I’m co-sponsoring an effort to ensure it doesn’t happen again http://t.co/9YKc9TCVW2,lisamurkowski,Lisa Murkowski,Alaska,Republican
1875,Tue Oct 29 18:07:51 +0000 2013,3.95251E+17,4,4,#NSA shouldn’t have free reign to snoop &amp; monitor calls. I’m backing a bill to curb NSA power &amp; provide oversight  http://t.co/x1GjdVhwbM,lisamurkowski,Lisa Murkowski,Alaska,Republican
1876,Sat Oct 26 20:56:39 +0000 2013,3.94206E+17,3,2,Thanks to #AFN2013 for the warm embrace I felt giving my speech.  Together we can bring about enduring change! http://t.co/3PsLePHAIu,lisamurkowski,Lisa Murkowski,Alaska,Republican
1877,Thu Oct 24 17:46:28 +0000 2013,3.93433E+17,1,9,This picture says it all: Alaska's WWII vets visited the the WWII Memorial today. Thank you for your service! http://t.co/SO9yMtUmQx,lisamurkowski,Lisa Murkowski,Alaska,Republican
1878,Fri Oct 18 17:39:21 +0000 2013,3.91257E+17,1,7,"""Eight stars of gold on a field of blue…"" so happy to be spending this #AlaskaDay home with Alaskans!",lisamurkowski,Lisa Murkowski,Alaska,Republican
1879,Wed Oct 16 13:00:14 +0000 2013,3.90462E+17,8,8,"Alaskans, @SavannahGuthrie had me on the “Today Show” with @SenatorCollins @KellyAyotte and talked abt our work to end the shutdown. 7am AK!",lisamurkowski,Lisa Murkowski,Alaska,Republican
1880,Wed Oct 09 22:07:56 +0000 2013,3.88063E+17,4,2,"I like this guy: “These are our memorials."" http://t.co/fIkoAmGKNG",lisamurkowski,Lisa Murkowski,Alaska,Republican
1881,Wed Oct 09 21:24:14 +0000 2013,3.88052E+17,3,4,There is a common-sense way for the Commerce Dept to be flexible and allow AK's crab fisheries to open. http://t.co/60MSd8Ecjk,lisamurkowski,Lisa Murkowski,Alaska,Republican
1882,Tue Oct 08 23:02:55 +0000 2013,3.87715E+17,10,8,"To end the #shutdown, I backed a plan today for a 6 month funding bill that repeals the pacemaker tax. http://t.co/XONrhpwflv",lisamurkowski,Lisa Murkowski,Alaska,Republican
1883,Thu Oct 03 18:52:48 +0000 2013,3.8584E+17,7,12,Thankful everyone in my office is safe and sound. Thoughts and prayers with everyone on Capitol Hill and first responders.,lisamurkowski,Lisa Murkowski,Alaska,Republican
1884,Wed Oct 02 23:52:38 +0000 2013,3.85553E+17,5,4,"We did it, Alaska! http://t.co/ujzlkzbIew",lisamurkowski,Lisa Murkowski,Alaska,Republican
1885,Tue Oct 01 22:07:25 +0000 2013,3.85164E+17,13,5,The ripple effect of what we do has consequences &amp; I hope we can resolve this #Govshutdown soon: http://t.co/lDrxXdnuuj,lisamurkowski,Lisa Murkowski,Alaska,Republican
1886,Fri Sep 27 00:07:28 +0000 2013,3.83382E+17,36,5,"DC gridlock? Yes, but I’m still working for #Alaska getting $50m to clean up legacy wells in bill going to POTUS http://t.co/wY5UEFd1Ca",lisamurkowski,Lisa Murkowski,Alaska,Republican
1887,Thu Sep 26 20:43:02 +0000 2013,3.83331E+17,72,17,#Obamacare is a mess &amp; w/ another WH delay today enough is enough: I’m co-sponsoring 1year delay 2 individual mandate http://t.co/97Y7znOtzq,lisamurkowski,Lisa Murkowski,Alaska,Republican
1888,Tue Sep 24 00:02:19 +0000 2013,3.82294E+17,24,7,The #GSA flip-flopping in a good way: no longer allowing NGOs to dictate if #Alaska seafood is sustainable. http://t.co/Y12a1FnTda,lisamurkowski,Lisa Murkowski,Alaska,Republican
1889,Thu Sep 19 22:10:10 +0000 2013,3.80816E+17,15,6,Big day: held a Senate subsistence hearing &amp; passed an important helium bill. But still need 2 tweet a hearty ‘Arr’ for #TalkLikeAPirateDay!,lisamurkowski,Lisa Murkowski,Alaska,Republican
1890,Thu Sep 19 14:01:05 +0000 2013,3.80693E+17,6,4,"I'm holding a Senate Committee hearing on Alaska subsistence right now. If you'd like to watch, the live-stream is at http://t.co/xaNUNGhkTo",lisamurkowski,Lisa Murkowski,Alaska,Republican
1891,Wed Sep 18 21:13:19 +0000 2013,3.80439E+17,2,3,AK’s #seafood is the best in the world. My new bill would bar the feds from having foreign NGOs meddle in the process http://t.co/fwfmSlOm6j,lisamurkowski,Lisa Murkowski,Alaska,Republican
1892,Wed Sep 18 16:27:07 +0000 2013,3.80367E+17,0,1,Met w/ AK Native CEO Assoc to discuss how to get government to clean up its #LegacyWell mess &amp; contamination in #AK http://t.co/PnipxhCItc,lisamurkowski,Lisa Murkowski,Alaska,Republican
1893,Mon Sep 16 22:26:38 +0000 2013,3.79733E+17,5,3,#WhiteHouse STILL shortchanging its contract &amp; Supreme Court mandated obligations to Native's health http://t.co/5U5BgBMMtR #Unacceptable,lisamurkowski,Lisa Murkowski,Alaska,Republican
1894,Mon Sep 16 15:19:04 +0000 2013,3.79625E+17,4,3,"My concerns and prayers go to the #NavyYardShooting community, my thanks to first responders for defending and protecting them.",lisamurkowski,Lisa Murkowski,Alaska,Republican
1895,Wed Sep 11 19:08:49 +0000 2013,3.77871E+17,7,4,"God Bless America, today &amp; every day.  We will #NeverForget 9/11   http://t.co/yMvcF9Yf6c",lisamurkowski,Lisa Murkowski,Alaska,Republican
1896,Wed Sep 11 12:47:57 +0000 2013,3.77776E+17,10,9,"I ask every Alaskan and American to share a moment of silence with me now at 8:46, to remember 9/11.  #NeverForget",lisamurkowski,Lisa Murkowski,Alaska,Republican
1897,Tue Sep 03 22:10:52 +0000 2013,3.75018E+17,12,1,.@SecretaryJewell &amp; I toured King Cove #AK clinic where workers explained the proposed gravel road would save lives: http://t.co/aTCb5ZfwiY,lisamurkowski,Lisa Murkowski,Alaska,Republican
1898,Fri Aug 30 18:03:40 +0000 2013,3.73506E+17,5,3,Off to King Cove #AK w/ @SecretaryJewell to show her how important the 10 mile stretch of road they want to build is http://t.co/1HdEuv7lyz,lisamurkowski,Lisa Murkowski,Alaska,Republican
1899,Tue Aug 20 02:04:28 +0000 2013,3.69641E+17,9,4,My trip to #Galena was eye opening for me &amp; for FEMA which has unrealistic timelines for recovery from #SpringFlood: http://t.co/rLzHGz4rGK,lisamurkowski,Lisa Murkowski,Alaska,Republican
1900,Tue Aug 13 21:37:43 +0000 2013,3.674E+17,6,2,"Federal overreach in #Alaska can be as big as #ANWR, but more &amp; more, little intrusions into our everyday lives: http://t.co/HrzArAJc9K",lisamurkowski,Lisa Murkowski,Alaska,Republican
1901,Thu Aug 08 22:40:49 +0000 2013,3.65604E+17,1,3,Glad you're seeing it! MT @AjitPaiFCC Inupiat whaling combos paammaagigniq (cooperation) &amp; tech (radio cellphone GPS) http://t.co/6IXpuMYXde,lisamurkowski,Lisa Murkowski,Alaska,Republican
1902,Thu Aug 08 21:06:08 +0000 2013,3.6558E+17,2,3,#Alaska has so many unique communications challenges. My thanks to @AjitPaiFCC for coming and learning first-hand what we face,lisamurkowski,Lisa Murkowski,Alaska,Republican
1903,Thu Aug 08 18:09:43 +0000 2013,3.65535E+17,0,2,"I’m trying to make it easier 4 #Alaskans to #hunt fed lands, streamline duck stamps &amp; remove equipment restrictions: http://t.co/yHkguzSjqB",lisamurkowski,Lisa Murkowski,Alaska,Republican
1904,Wed Aug 07 16:41:54 +0000 2013,3.65151E+17,2,1,Meeting w/ Petersburg Vessel Owners Association. Big thanks to busy fishermen who came to discuss their industry #AK http://t.co/3t5n7ZyGUC,lisamurkowski,Lisa Murkowski,Alaska,Republican
1905,Thu Aug 01 20:45:16 +0000 2013,3.63038E+17,4,2,Alaskans know #Alaska- so why didn’t US Army command listen to the Alaska Fire Service &amp; the Ft Wainwright Garrison? http://t.co/3NTq2N81MY,lisamurkowski,Lisa Murkowski,Alaska,Republican
1906,Wed Jul 31 19:13:09 +0000 2013,3.62652E+17,0,1,My #Veteran Spotlight is on James Hastings: 22 year Army Infantry vet who helps battle wounded &amp; battle weary in #AK: http://t.co/KshDJd5B1H,lisamurkowski,Lisa Murkowski,Alaska,Republican
1907,Tue Jul 30 18:01:15 +0000 2013,3.62272E+17,1,4,If Eielson AFB is so ideal for F-35s what’s the rationale for the transfer of F-16s? Simple answer: there isn’t one: http://t.co/Qg3803E8dG,lisamurkowski,Lisa Murkowski,Alaska,Republican
1908,Tue Jul 30 17:09:22 +0000 2013,3.62259E+17,1,7,Happy #Alaska National Guard Day! Join me in thanking @AK_GUARD for serving our state &amp; nation today and everyday,lisamurkowski,Lisa Murkowski,Alaska,Republican
1909,Fri Jul 26 19:33:26 +0000 2013,3.60845E+17,2,3,Tomorrow is #TedStevens Day so join me in getting out &amp; enjoying our beautiful #Alaska in his honor: http://t.co/Q7oYL3zT5d,lisamurkowski,Lisa Murkowski,Alaska,Republican
1910,Wed Jul 24 22:58:34 +0000 2013,3.60172E+17,3,7,Good news for students: the college student loan bill the Senate just passed is a permanent fix for all college loans http://t.co/zrWSWTOK8s,lisamurkowski,Lisa Murkowski,Alaska,Republican
1911,Mon Jul 22 22:36:51 +0000 2013,3.59442E+17,1,3,#Alaska is our first line of nat'l defense from Pacific threats &amp; I'm going to remind the Pentagon of that tomorrow: http://t.co/xYT9185y23,lisamurkowski,Lisa Murkowski,Alaska,Republican
1912,Fri Jul 19 20:43:54 +0000 2013,3.58326E+17,1,3,"I talk up #Alaska every chance I get, but this live bear cam explains how special Alaska is without saying a word. http://t.co/5E9YaLgcoU",lisamurkowski,Lisa Murkowski,Alaska,Republican
1913,Fri Jul 19 00:28:59 +0000 2013,3.58021E+17,0,3,"2 approps bills are now ready for Senate floor that address #Alaskan priorities: fishery disaster relief, USCG &amp; more http://t.co/Lv0EYgKs8X",lisamurkowski,Lisa Murkowski,Alaska,Republican
1914,Thu Jul 18 17:58:38 +0000 2013,3.57922E+17,0,1,Getting ready to call into @ksrmam to talk abt #fisheries in the approps bill and fed overreach. Tune in if you can: http://t.co/NLQ0F2D2wb,lisamurkowski,Lisa Murkowski,Alaska,Republican
1915,Thu Jul 18 13:39:39 +0000 2013,3.57857E+17,1,1,"RT @ENR_GOP Today in ENR, we're taking up the issue of Clean Energy Financing, and focusing on DOE loan programs &amp; steps to improve them.",lisamurkowski,Lisa Murkowski,Alaska,Republican
1916,Wed Jul 17 23:42:57 +0000 2013,3.57647E+17,1,7,On this 40th ann. of the Trans-Alaska Pipeline I am reminded of how bad we need to access to #Alaska’s oil potential: http://t.co/haC4fPnYq6,lisamurkowski,Lisa Murkowski,Alaska,Republican
1917,Wed Jul 17 00:42:26 +0000 2013,3.57299E+17,0,2,"I made sure #Arctic priorities are included in the DHS approps bill: @USCG, icebreaker, firefighters &amp; TWIC: http://t.co/GPbfHJrS7S",lisamurkowski,Lisa Murkowski,Alaska,Republican
1918,Tue Jul 16 18:22:53 +0000 2013,3.57204E+17,0,1,"Salmon disaster $, better bycatch monitoring &amp; tsunami debris protections- some #Alaska benefits in this Approps bill http://t.co/Rn8Iwdz1Kq",lisamurkowski,Lisa Murkowski,Alaska,Republican
1919,Mon Jul 15 22:55:10 +0000 2013,3.5691E+17,0,2,#Alaskans are with @SenatorTimScott in mourning the loss of South Carolinians in our state,lisamurkowski,Lisa Murkowski,Alaska,Republican
1920,Wed Jul 10 22:09:26 +0000 2013,3.55086E+17,0,7,Obesity-related illnesses costs #AK $459 million/year but there’s good news: Anchorage #childhoodobesity is down! http://t.co/O7RlhfYPLm,lisamurkowski,Lisa Murkowski,Alaska,Republican
1921,Wed Jul 10 21:02:41 +0000 2013,3.5507E+17,15,4,Today’s vote was a band-aid that wouldn’t help all students. I’m still working on long-term fix to the loan rates http://t.co/vFHDHwIvrx,lisamurkowski,Lisa Murkowski,Alaska,Republican
1922,Wed Jul 10 16:28:06 +0000 2013,3.55E+17,12,36,"People should be judged on if they can do the job not their sexual orientation, which is why I voted for #ENDA today http://t.co/hz9KaBenVS",lisamurkowski,Lisa Murkowski,Alaska,Republican
1923,Tue Jul 09 20:46:58 +0000 2013,3.54703E+17,1,1,Pleased to welcome my 2nd group of summer #interns to my D.C. office. #Alaskans: spot anyone you know? http://t.co/SrcR5QiP8U,lisamurkowski,Lisa Murkowski,Alaska,Republican
1924,Tue Jul 09 16:58:24 +0000 2013,3.54646E+17,4,8,"Our college students deserve certainty &amp; lowest loan rates possible. So, I’m co-sponsoring this: http://t.co/gcCWPo8XXm #DontDoubleMyRate",lisamurkowski,Lisa Murkowski,Alaska,Republican
1925,Thu Jul 04 17:31:49 +0000 2013,3.52842E+17,3,3,"This #IndependenceDay, let us appreciate all that we have but we must also thank all who have secured our #liberty http://t.co/ITGP1Lay4L",lisamurkowski,Lisa Murkowski,Alaska,Republican
1926,Wed Jul 03 20:40:17 +0000 2013,3.52527E+17,1,1,"A #Vietnam POW/MIA bracelet, a Wasilla #AK woman &amp; a #military family: one amazing story of connections through hope http://t.co/Mqw2jO6haJ",lisamurkowski,Lisa Murkowski,Alaska,Republican
1927,Mon Jul 01 21:46:13 +0000 2013,3.51819E+17,0,2,Summer on the Kuskokwim River is about #subsistence #salmon fishing. I visited fish camps to see it first hand: http://t.co/408ui2DR8z #AK,lisamurkowski,Lisa Murkowski,Alaska,Republican
1928,Fri Jun 28 20:30:39 +0000 2013,3.50713E+17,0,5,Today I asked ?s on the NSA/FBI issue: What else are they collecting? Are they tracking us? Is it even working? http://t.co/C9Woja7c8o,lisamurkowski,Lisa Murkowski,Alaska,Republican
1929,Thu Jun 27 21:25:22 +0000 2013,3.50364E+17,21,15,I just voted for #immigration reform because America is a nation of immigrants and also a nation of laws. http://t.co/8xD1lPSq5K,lisamurkowski,Lisa Murkowski,Alaska,Republican
1930,Wed Jun 26 15:44:26 +0000 2013,3.49916E+17,13,12,"Fed government should empower households, respect the decisions of states and otherwise get out of the way. http://t.co/fmXlca9zcW",lisamurkowski,Lisa Murkowski,Alaska,Republican
1931,Tue Jun 25 21:52:00 +0000 2013,3.49646E+17,5,5,The President's energy speech boils down to new regs and higher costs -- the opposite of what Americans are seeking. http://t.co/lEYHgMicqy,lisamurkowski,Lisa Murkowski,Alaska,Republican
1932,Mon Jun 24 22:15:48 +0000 2013,3.4929E+17,7,9,Glad @USSupremeCourt will look at POTUS recess appointments. It’s not about politics; it’s about separation of powers http://t.co/yGOoz4IXZ7,lisamurkowski,Lisa Murkowski,Alaska,Republican
1933,Thu Jun 20 16:47:01 +0000 2013,3.47757E+17,11,21,Good news for #AK #salmon: my amendment to label #Frankenfish has been adopted by @SenateApprops,lisamurkowski,Lisa Murkowski,Alaska,Republican
1934,Wed Jun 19 18:11:22 +0000 2013,3.47416E+17,13,18,"Thank you to so many for your support, RT's and responses.  Here is video of my sit-down interview with @Ch2KTUU http://t.co/LA7FhuC3Ry",lisamurkowski,Lisa Murkowski,Alaska,Republican
1935,Wed Jun 19 15:23:38 +0000 2013,3.47374E+17,72,338,Americans should be able to love &amp; marry whom they choose - gay or straight- &amp; government should get out of the way http://t.co/iMbiBGQtzo,lisamurkowski,Lisa Murkowski,Alaska,Republican
1936,Wed Jun 19 00:27:16 +0000 2013,3.47149E+17,1,2,Alaska’s #veterans face a bureaucracy battleground when they try to get the benefits they earned. I’m trying to help: http://t.co/nAnf8nwXuF,lisamurkowski,Lisa Murkowski,Alaska,Republican
1937,Tue Jun 18 17:08:17 +0000 2013,3.47038E+17,6,7,I’m tired of the rubber stamp for #NSA’s surveillance tactics so I'm co-sponsoring a bill to tighten their standards http://t.co/P8NlOCifz4,lisamurkowski,Lisa Murkowski,Alaska,Republican
1938,Wed Jun 12 19:04:54 +0000 2013,3.44893E+17,2,2,15 definitions of “#rural” doesn’t make our country better- neither does adding 5 new defs w/ a new #education office http://t.co/H7JSizLYLr,lisamurkowski,Lisa Murkowski,Alaska,Republican
1939,Wed Jun 12 17:36:42 +0000 2013,3.44871E+17,2,2,Glad to appear before Veteran Affairs Comm. to talk about an honor I want to extend to #Hmong #Vietnam volunteers: http://t.co/rcmwqGZd0c,lisamurkowski,Lisa Murkowski,Alaska,Republican
1940,Tue Jun 11 22:09:27 +0000 2013,3.44577E+17,2,5,Not all American war heroes are Americans during #Vietnam Hmong vols. worked in secret for US. I want to honor them http://t.co/nKFXQhMseT,lisamurkowski,Lisa Murkowski,Alaska,Republican
1941,Tue Jun 11 19:14:32 +0000 2013,3.44533E+17,6,4,"As the Senate talks #NCLB this week, I’m introducing 2 bills that bring #education from DC back to the local level: http://t.co/nRpkYgy6bZ",lisamurkowski,Lisa Murkowski,Alaska,Republican
1942,Mon Jun 10 20:43:20 +0000 2013,3.44193E+17,2,2,Relieved @usairforce is listening &amp; postponed #Eielson F-16 draft EIS hearings to week of July 15th- let's not rush http://t.co/G4vwW1hUrv,lisamurkowski,Lisa Murkowski,Alaska,Republican
