,created_at,id_str,reply_count,retweet_count,text,user,name,state,party
658,Mon Feb 06 21:18:16 +0000 2017,8.28714E+17,8,31,Granite State educators like Evan Czyzowski from Sanborn Regional HS understand the danger Betsy #DeVos poses to ou… https://t.co/xP6x8DFQDa,SenatorHassan,Maggie Hassan,New Hampshire,Democratic
659,Mon Feb 06 19:10:56 +0000 2017,8.28682E+17,12,30,My statement on why I’m opposing Steve Mnuchin’s nomination to serve as Treasury Secretary https://t.co/xtG3jWIkAZ https://t.co/hzCkQeHY4o,SenatorHassan,Maggie Hassan,New Hampshire,Democratic
660,Mon Feb 06 17:53:16 +0000 2017,8.28663E+17,28,139,All of our children deserve a quality public education &amp; they deserve better than Betsy #DeVos https://t.co/PguLCqpJcN,SenatorHassan,Maggie Hassan,New Hampshire,Democratic
661,Mon Feb 06 16:32:49 +0000 2017,8.28643E+17,2,8,Thank you NH School Administrators Association for having me at your legislative breakfast in Concord #nhpolitics https://t.co/zxvqVBhKsY,SenatorHassan,Maggie Hassan,New Hampshire,Democratic
662,Mon Feb 06 03:30:30 +0000 2017,8.28446E+17,3,43,#GOAT https://t.co/YqVrAaYisG,SenatorHassan,Maggie Hassan,New Hampshire,Democratic
663,Mon Feb 06 03:27:22 +0000 2017,8.28445E+17,1,29,Super Bowl champions!! #GOAT #Patriots #SB51,SenatorHassan,Maggie Hassan,New Hampshire,Democratic
664,Mon Feb 06 03:07:49 +0000 2017,8.2844E+17,4,8,Touchdown! #goat #sb51,SenatorHassan,Maggie Hassan,New Hampshire,Democratic
665,Mon Feb 06 02:44:56 +0000 2017,8.28434E+17,0,8,One possession game #Patriots #SB51,SenatorHassan,Maggie Hassan,New Hampshire,Democratic
666,Mon Feb 06 01:36:36 +0000 2017,8.28417E+17,6,4,Ready for a second half comeback #Patriots #OneMore #SB51,SenatorHassan,Maggie Hassan,New Hampshire,Democratic
667,Sun Feb 05 19:04:31 +0000 2017,8.28318E+17,8,38,It’s almost game time…Let’s go #Patriots! #OneMore #SB51 https://t.co/C0mvKUwzIc,SenatorHassan,Maggie Hassan,New Hampshire,Democratic
668,Fri Feb 03 20:56:49 +0000 2017,8.27622E+17,61,171,I’m deeply concerned with Scott Pruitt’s unwillingness to fight climate change &amp; I’ll vote no on his nomination… https://t.co/kdDcUn5Tyh,SenatorHassan,Maggie Hassan,New Hampshire,Democratic
669,Fri Feb 03 20:40:12 +0000 2017,8.27618E+17,15,41,"This morning, I voted against undoing anti-bribery measures for big oil companies https://t.co/qtkk8CLQCF",SenatorHassan,Maggie Hassan,New Hampshire,Democratic
670,Fri Feb 03 19:42:45 +0000 2017,8.27603E+17,7,32,.@SenatorShaheen &amp; I tell @POTUS: repealing the ACA would hurt Granite Staters battling addiction https://t.co/s0UUKGqxcy,SenatorHassan,Maggie Hassan,New Hampshire,Democratic
671,Fri Feb 03 19:20:04 +0000 2017,8.27598E+17,2,6,Great to be at #NHDigitalEquity Summit in Manchester. Increasing access to broadband is critical to NH's future… https://t.co/o31VFxx3jq,SenatorHassan,Maggie Hassan,New Hampshire,Democratic
672,Fri Feb 03 18:11:17 +0000 2017,8.2758E+17,18,120,We need one more GOP Senator to break with @realDonaldTrump and oppose #DeVos https://t.co/Marpwm7EtM,SenatorHassan,Maggie Hassan,New Hampshire,Democratic
673,Fri Feb 03 16:11:44 +0000 2017,8.2755E+17,13,35,I’m wearing red to raise awareness about heart disease as the leading cause of death among women in the U.S.… https://t.co/OBgm77QQKi,SenatorHassan,Maggie Hassan,New Hampshire,Democratic
674,Fri Feb 03 15:21:49 +0000 2017,8.27538E+17,41,215,I’m voting no on Betsy #DeVos because she is unqualified &amp; unprepared. Read my @nytimes Op-Ed: https://t.co/mmiqlxxKTY,SenatorHassan,Maggie Hassan,New Hampshire,Democratic
675,Fri Feb 03 01:49:41 +0000 2017,8.27333E+17,11,74,I agree. Thanks to @timkaine and Tom Harkin for speaking out https://t.co/vTnMwIssxb,SenatorHassan,Maggie Hassan,New Hampshire,Democratic
676,Fri Feb 03 01:08:45 +0000 2017,8.27323E+17,31,213,Betsy #DeVos is unqualified and unprepared to serve as Secretary of Education. I’m voting no and I urge my colleagu… https://t.co/jDgeRYdYom,SenatorHassan,Maggie Hassan,New Hampshire,Democratic
677,Thu Feb 02 20:26:56 +0000 2017,8.27252E+17,2,18,Got to meet some awesome @High_Exeter student Senators at the Capitol today! #nhpolitics https://t.co/jwsMsJOftU,SenatorHassan,Maggie Hassan,New Hampshire,Democratic
678,Thu Feb 02 18:19:41 +0000 2017,8.2722E+17,7,14,.@RepMickMulvaney has played politics with our economy &amp; supported government shutdowns he can’t be trusted to implement the federal budget,SenatorHassan,Maggie Hassan,New Hampshire,Democratic
679,Thu Feb 02 18:17:46 +0000 2017,8.27219E+17,11,26,I do not support @RepMickMulvaney’s nomination to lead OMB. Read my statement: https://t.co/pYD8a49umk,SenatorHassan,Maggie Hassan,New Hampshire,Democratic
680,Thu Feb 02 18:07:18 +0000 2017,8.27217E+17,3,7,Read more on DOD heeding @SenatorShaheen &amp; my request to protect shipyard workers from @POTUS’ federal hiring freeze https://t.co/yaIwEOKoVy,SenatorHassan,Maggie Hassan,New Hampshire,Democratic
681,Thu Feb 02 16:28:14 +0000 2017,8.27192E+17,4,7,I’ll keep working to protect employees like those at Portsmouth Naval Shipyard who are critical to our national security &amp; NH's economy,SenatorHassan,Maggie Hassan,New Hampshire,Democratic
682,Thu Feb 02 16:27:30 +0000 2017,8.27192E+17,5,26,I’m grateful DOD has made civilian shipyard employees exempt from @POTUS's federal hiring freeze following @SenatorShaheen and my request.,SenatorHassan,Maggie Hassan,New Hampshire,Democratic
683,Wed Feb 01 22:52:37 +0000 2017,8.26926E+17,12,29,Repealing the ACA would also cause premiums in the Individual Market to skyrocket. Read more on today’s HELP hearing https://t.co/MAYURXCnUY,SenatorHassan,Maggie Hassan,New Hampshire,Democratic
684,Wed Feb 01 22:49:49 +0000 2017,8.26926E+17,10,48,Repealing the ACA &amp; Medicaid expansion would hurt state budgets across the nation &amp; @Steve__Beshear agrees https://t.co/SSmTIXOdLr,SenatorHassan,Maggie Hassan,New Hampshire,Democratic
685,Wed Feb 01 21:25:46 +0000 2017,8.26904E+17,160,1576,We only need one more GOP Senator to break with @realDonaldTrump on #DeVos. I urge my colleagues to stand up for public education &amp; vote no.,SenatorHassan,Maggie Hassan,New Hampshire,Democratic
686,Wed Feb 01 20:08:54 +0000 2017,8.26885E+17,18,28,I have deep concerns about whether Mr. Tillerson will stand up to @POTUS on policies that would undermine our national security,SenatorHassan,Maggie Hassan,New Hampshire,Democratic
687,Wed Feb 01 20:08:35 +0000 2017,8.26885E+17,137,120,"Today, I voted against Rex Tillerson to serve as Secretary of State",SenatorHassan,Maggie Hassan,New Hampshire,Democratic
688,Wed Feb 01 17:59:26 +0000 2017,8.26852E+17,12,35,"Americans deserve an HHS Secretary who will expand access to quality, affordable health care, not one who supports stripping it away",SenatorHassan,Maggie Hassan,New Hampshire,Democratic
689,Wed Feb 01 17:58:50 +0000 2017,8.26852E+17,16,66,I oppose @RepTomPrice’s nomination to serve as Secretary of Health and Human Services https://t.co/d7yKDCUQaV,SenatorHassan,Maggie Hassan,New Hampshire,Democratic
690,Wed Feb 01 01:51:46 +0000 2017,8.26609E+17,57,59,My statement on @POTUS’s pick of Judge Gorsuch to serve on the Supreme Court: https://t.co/M7bBWRZRl2,SenatorHassan,Maggie Hassan,New Hampshire,Democratic
691,Tue Jan 31 23:11:46 +0000 2017,8.26569E+17,6,11,The highly skilled workers at Portsmouth Naval Shipyard contribute to our national security &amp; economic vitality. I’ll keep fighting for them,SenatorHassan,Maggie Hassan,New Hampshire,Democratic
692,Tue Jan 31 23:10:59 +0000 2017,8.26568E+17,8,19,I’m proud to co-sponsor legislation to exempt shipyard civilian employees from @POTUS’s federal hiring freeze https://t.co/cZITFh3I9W,SenatorHassan,Maggie Hassan,New Hampshire,Democratic
693,Tue Jan 31 19:15:29 +0000 2017,8.26509E+17,48,108,Watch part of my opening statement during today's HELP Committee hearing explaining why I voted no on #DeVos https://t.co/V87hQ5LrpQ,SenatorHassan,Maggie Hassan,New Hampshire,Democratic
694,Tue Jan 31 18:00:25 +0000 2017,8.2649E+17,59,105,I don't have confidence @SenatorSessions would put rights of all Americans before whims of @POTUS as AG. I will vot… https://t.co/mE4N5vIIFZ,SenatorHassan,Maggie Hassan,New Hampshire,Democratic
695,Tue Jan 31 17:17:39 +0000 2017,8.2648E+17,103,400,I voted no on #DeVos in committee today &amp; I urge my colleagues to do the same when her nomination reaches the floor https://t.co/VFHsRirB8H,SenatorHassan,Maggie Hassan,New Hampshire,Democratic
696,Tue Jan 31 13:39:40 +0000 2017,8.26425E+17,53,209,Reminder that today is the last day of open enrollment. #getcovered NOW at https://t.co/96EWg4uwYv,SenatorHassan,Maggie Hassan,New Hampshire,Democratic
697,Tue Jan 31 03:03:06 +0000 2017,8.26265E+17,23,230,#ThankYouSallyYates,SenatorHassan,Maggie Hassan,New Hampshire,Democratic
698,Mon Jan 30 23:54:46 +0000 2017,8.26217E+17,4,78,"IMPORTANT: Open enrollment ends tomorrow. Don’t wait, visit https://t.co/96EWg4uwYv NOW to #getcovered",SenatorHassan,Maggie Hassan,New Hampshire,Democratic
699,Mon Jan 30 23:34:10 +0000 2017,8.26212E+17,35,80,I’m joining @SenFeinstein &amp; others in introducing a measure to reverse @POTUS’s dangerous &amp; un-American exec. order https://t.co/Njp42fpFXM,SenatorHassan,Maggie Hassan,New Hampshire,Democratic
700,Mon Jan 30 22:40:45 +0000 2017,8.26198E+17,27,102,Going to the Supreme Court shortly to stand with my fellow @SenateDems &amp; demand reversal of @POTUS’ executive order https://t.co/4RjF5hB4Eg,SenatorHassan,Maggie Hassan,New Hampshire,Democratic
701,Mon Jan 30 20:44:47 +0000 2017,8.26169E+17,21,70,Mr. Tillerson owes it to the American people to clearly state his views on @POTUS’s un-American immigration order that makes us less safe,SenatorHassan,Maggie Hassan,New Hampshire,Democratic
702,Mon Jan 30 20:44:02 +0000 2017,8.26169E+17,25,67,My statement on why I oppose Rex Tillerson’s nomination for Secretary of State https://t.co/f5u89yp1WU,SenatorHassan,Maggie Hassan,New Hampshire,Democratic
703,Mon Jan 30 18:42:45 +0000 2017,8.26139E+17,14,42,"On Homeland Security Committee, I'll seek answers on troubling reports WH political advisors like Steve Bannon overruled @DHSgov",SenatorHassan,Maggie Hassan,New Hampshire,Democratic
704,Mon Jan 30 18:41:37 +0000 2017,8.26138E+17,37,44,I’m demanding a briefing and answers from @DHSgov Sec. Kelly on @POTUS’s un-American &amp; dangerous executive order  https://t.co/ybZlHUABtY,SenatorHassan,Maggie Hassan,New Hampshire,Democratic
705,Sun Jan 29 04:22:39 +0000 2017,8.2556E+17,87,840,Report WH political advisors overruled Dept. of Homeland Security is latest disturbing news. I'll seek answers https://t.co/D4M2hiT3Rp,SenatorHassan,Maggie Hassan,New Hampshire,Democratic
706,Sun Jan 29 03:23:22 +0000 2017,8.25545E+17,36,146,"Tonight's stay was a victory, but a limited one. This executive order must be reversed. https://t.co/6cBcY7DE6D",SenatorHassan,Maggie Hassan,New Hampshire,Democratic
707,Sat Jan 28 21:46:49 +0000 2017,8.2546E+17,1,8,Wishing a warm welcome home to members of the @NHNationalGuard's 197th Field Artillery Brigade! Thank you for all you do to keep us safe.,SenatorHassan,Maggie Hassan,New Hampshire,Democratic
708,Sat Jan 28 19:53:17 +0000 2017,8.25432E+17,58,93,I will also work in Congress to override this executive action.,SenatorHassan,Maggie Hassan,New Hampshire,Democratic
709,Sat Jan 28 19:50:52 +0000 2017,8.25431E+17,11,51,...and I will support efforts by @SenatorShaheen and @SenJohnMcCain to authorize visas for these interpreters.,SenatorHassan,Maggie Hassan,New Hampshire,Democratic
710,Sat Jan 28 19:49:39 +0000 2017,8.25431E+17,4,31,It is both our moral obligation and a national security imperative to assist those who have helped us...,SenatorHassan,Maggie Hassan,New Hampshire,Democratic
711,Sat Jan 28 19:48:14 +0000 2017,8.2543E+17,7,81,It's also disgraceful that these executive actions would turn away brave men &amp; women who have risked their lives to serve as interpreters.,SenatorHassan,Maggie Hassan,New Hampshire,Democratic
712,Sat Jan 28 19:46:46 +0000 2017,8.2543E+17,11,27,...but discriminating against individuals on the basis of their religion will only harm our national security interests.,SenatorHassan,Maggie Hassan,New Hampshire,Democratic
713,Sat Jan 28 19:46:15 +0000 2017,8.2543E+17,6,20,We must always be working to strengthen the vetting process for all entryways into the U.S...,SenatorHassan,Maggie Hassan,New Hampshire,Democratic
714,Sat Jan 28 17:26:11 +0000 2017,8.25395E+17,56,300,President Trump's executive action imposing a religious test on refugees runs counter to our American values. It also makes us less safe.,SenatorHassan,Maggie Hassan,New Hampshire,Democratic
715,Sat Jan 28 16:56:38 +0000 2017,8.25387E+17,8,68,Today we remember Christa McAuliffe and the entire Challenger crew. Thank you for pushing the boundaries of human knowledge &amp; discovery,SenatorHassan,Maggie Hassan,New Hampshire,Democratic
716,Sat Jan 28 14:18:20 +0000 2017,8.25347E+17,7,18,Happy birthday to my friend &amp; colleague @SenatorShaheen! https://t.co/I8ufSAL4j9,SenatorHassan,Maggie Hassan,New Hampshire,Democratic
717,Fri Jan 27 22:56:30 +0000 2017,8.25115E+17,6,18,Innovative companies like @Dyn are helping position NH to lead in the 21st century innovation economy… https://t.co/KLisQhLuP1,SenatorHassan,Maggie Hassan,New Hampshire,Democratic
718,Fri Jan 27 21:54:10 +0000 2017,8.251E+17,10,55,Join me in the fight against efforts to repeal the ACA. Share how the ACA has helped you by emailing Healthstories@hassan.senate.gov,SenatorHassan,Maggie Hassan,New Hampshire,Democratic
719,Fri Jan 27 21:09:14 +0000 2017,8.25088E+17,15,36,I’ll fight any effort to repeal the ACA for health care providers &amp; those on the front lines of the opioid crisis https://t.co/z78tBZrDpe,SenatorHassan,Maggie Hassan,New Hampshire,Democratic
720,Fri Jan 27 21:03:53 +0000 2017,8.25087E+17,1,3,Congrats to Hercules for becoming the @rochesterpolice's newest K-9! https://t.co/vgmfpqJe8c,SenatorHassan,Maggie Hassan,New Hampshire,Democratic
721,Fri Jan 27 20:43:36 +0000 2017,8.25082E+17,100,372,#DeVos’ nomination is the top issue my office is hearing from Granite Staters. I’ll vote against her nomination &amp; urge others to do the same,SenatorHassan,Maggie Hassan,New Hampshire,Democratic
722,Fri Jan 27 20:42:49 +0000 2017,8.25082E+17,24,139,Her lack of experience with public education &amp; unresolved potential conflicts of interest make #DeVos completely unqualified to lead DOE,SenatorHassan,Maggie Hassan,New Hampshire,Democratic
723,Fri Jan 27 19:51:34 +0000 2017,8.25069E+17,8,63,"On #HolocaustMemorialDay &amp; everyday, we must remember to always fight against the dangers of intolerance &amp; hatred to prevent such atrocities",SenatorHassan,Maggie Hassan,New Hampshire,Democratic
724,Fri Jan 27 18:55:57 +0000 2017,8.25055E+17,1,13,Congrats to this year’s @NH_StatePolice award winners. Thank you for all that you do to keep our communities &amp; stat… https://t.co/btYthBvj0G,SenatorHassan,Maggie Hassan,New Hampshire,Democratic
725,Fri Jan 27 16:37:32 +0000 2017,8.2502E+17,5,13,I appreciated hearing from health care providers and treatment &amp; recovery experts at @HarborHomesInc on the importa… https://t.co/EaNnVOvKoD,SenatorHassan,Maggie Hassan,New Hampshire,Democratic
726,Fri Jan 27 14:32:22 +0000 2017,8.24988E+17,3,21,.@POTUS reinstating the global gag rule will have a devastating impact on most vulnerable around the world https://t.co/SDMCUAnnE0,SenatorHassan,Maggie Hassan,New Hampshire,Democratic
727,Thu Jan 26 23:06:33 +0000 2017,8.24755E+17,14,39,I’m proud to stand with @SenatorShaheen to fight for Portsmouth Naval Shipyard workers. https://t.co/DwUik8ZGAa,SenatorHassan,Maggie Hassan,New Hampshire,Democratic
728,Thu Jan 26 22:04:47 +0000 2017,8.2474E+17,4,14,"This week I voted for measures to encourage women to enter STEM fields, promote innovation &amp; expand broadband access https://t.co/fTHVf8RCxc",SenatorHassan,Maggie Hassan,New Hampshire,Democratic
729,Thu Jan 26 21:17:16 +0000 2017,8.24728E+17,27,107,Betsy DeVos’ Letter on IDEA reinforces that she’s unfit to serve as Secretary of Education https://t.co/TPfb2O6OKJ,SenatorHassan,Maggie Hassan,New Hampshire,Democratic
730,Thu Jan 26 18:29:28 +0000 2017,8.24686E+17,2,10,I'm proud to co-sponsor the Trafficking Survivors Relief Act to support trafficking survivors across the nation https://t.co/tjIT1x948E,SenatorHassan,Maggie Hassan,New Hampshire,Democratic
731,Thu Jan 26 18:02:28 +0000 2017,8.24679E+17,36,175,"All students, regardless of circumstance, deserve a quality public education. #DeVos hasn’t proven she is equipped to protect all students",SenatorHassan,Maggie Hassan,New Hampshire,Democratic
732,Thu Jan 26 17:15:09 +0000 2017,8.24667E+17,10,51,"Climate change threatens our economy, environment, people &amp; way of life. Human activity is responsible #climatefacts https://t.co/mDwil0iZEG",SenatorHassan,Maggie Hassan,New Hampshire,Democratic
733,Thu Jan 26 14:41:12 +0000 2017,8.24628E+17,7,27,Our veterans have sacrificed bravely for our nation. I urge @POTUS to protect them from his freeze on federal hiring https://t.co/irFOnC4ot4,SenatorHassan,Maggie Hassan,New Hampshire,Democratic
734,Wed Jan 25 23:43:46 +0000 2017,8.24402E+17,18,34,Let’s show those in Washington trying to repeal the ACA what it’d do to the health &amp; well-being of Granite Staters… https://t.co/ZTzqrig4SL,SenatorHassan,Maggie Hassan,New Hampshire,Democratic
735,Wed Jan 25 21:57:05 +0000 2017,8.24376E+17,17,72,I’m proud to co-sponsor a constitutional amendment to help overturn Citizens United and #getmoneyout https://t.co/aWRLJnzTdg,SenatorHassan,Maggie Hassan,New Hampshire,Democratic
736,Wed Jan 25 21:37:36 +0000 2017,8.24371E+17,4,5,.@RepMickMulvaney has opposed funding for @PPFA. I urged him to make decisions based on merit not ideology https://t.co/fcOkh8UnGG,SenatorHassan,Maggie Hassan,New Hampshire,Democratic
737,Wed Jan 25 20:52:46 +0000 2017,8.24359E+17,11,27,".@RepMickMulvaney, the science is clear: global climate change caused by human activities is occurring now https://t.co/u4Ltu1aUSd",SenatorHassan,Maggie Hassan,New Hampshire,Democratic
738,Wed Jan 25 17:07:08 +0000 2017,8.24303E+17,19,109,Important read  @DianeRavitch urges against confirming Betsy DeVos https://t.co/4c3MPhkJFZ,SenatorHassan,Maggie Hassan,New Hampshire,Democratic
739,Tue Jan 24 23:42:11 +0000 2017,8.2404E+17,9,10,My statement on @nikkihaley’s confirmation as U.S. Ambassador to the U.N. https://t.co/ApiGA9LZ4f,SenatorHassan,Maggie Hassan,New Hampshire,Democratic
740,Tue Jan 24 23:37:41 +0000 2017,8.24038E+17,14,58,Repealing the ACA would have a devastating impact on our efforts to combat the substance abuse crisis in NH. https://t.co/FuZvoqh5cq,SenatorHassan,Maggie Hassan,New Hampshire,Democratic
741,Tue Jan 24 23:33:17 +0000 2017,8.24037E+17,8,15,"Today, I questioned @RepMickMulvaney on his previous support of government shutdowns, cutting Medicaid, &amp; more https://t.co/t8zogcVbp9",SenatorHassan,Maggie Hassan,New Hampshire,Democratic
742,Tue Jan 24 21:01:53 +0000 2017,8.23999E+17,5,8,I’m participating in the hearing for #OMBnom @RepMickMulvaney. Tune in now:  https://t.co/TIcabTTgMC,SenatorHassan,Maggie Hassan,New Hampshire,Democratic
743,Tue Jan 24 18:27:29 +0000 2017,8.2396E+17,4,6,I look forward to working with Secretary Chao to strengthen transportation infrastructure &amp; with Mr. Ross to boost… https://t.co/DXIq57P1Zf,SenatorHassan,Maggie Hassan,New Hampshire,Democratic
744,Mon Jan 23 18:39:19 +0000 2017,8.23601E+17,23,80,We can’t let efforts to roll back women’s rights go unchecked. I’ll support @SenatorShaheen’s legislation to repeal… https://t.co/0IuXbQlBCa,SenatorHassan,Maggie Hassan,New Hampshire,Democratic
745,Mon Jan 23 18:38:34 +0000 2017,8.23601E+17,11,72,The gag rule is a dangerous restriction on foreign aid to some of our world’s most vulnerable people &amp; isn’t consistent with our values,SenatorHassan,Maggie Hassan,New Hampshire,Democratic
746,Mon Jan 23 18:36:55 +0000 2017,8.236E+17,7,38,.@POTUS re-instituted a backward policy that'll limit women’s access to reproductive health care around the world https://t.co/SI1UrSG2Lo,SenatorHassan,Maggie Hassan,New Hampshire,Democratic
747,Mon Jan 23 16:59:54 +0000 2017,8.23576E+17,2,43,"The work of inclusion is not easy, but as we honor disability rights advocate Ed Roberts today, we must remember th… https://t.co/0VpX6Pv1ih",SenatorHassan,Maggie Hassan,New Hampshire,Democratic
748,Mon Jan 23 15:54:36 +0000 2017,8.2356E+17,4,7,This National Drug &amp; Alcohol Facts Week - &amp; every week - it's critical to educate teens about substance abuse #NDAFW https://t.co/QRZmYDw4UM,SenatorHassan,Maggie Hassan,New Hampshire,Democratic
749,Mon Jan 23 02:47:35 +0000 2017,8.23362E+17,4,41,Super Bowl bound! #Patriots #SB51 https://t.co/iabeMS3rwX,SenatorHassan,Maggie Hassan,New Hampshire,Democratic
750,Sun Jan 22 23:08:10 +0000 2017,8.23306E+17,2,10,"Here we go, game time, drive for five continues! #PatriotsNation",SenatorHassan,Maggie Hassan,New Hampshire,Democratic
751,Sun Jan 22 22:37:51 +0000 2017,8.23299E+17,7,50,Protecting a woman’s right to make her own health care decisions is essential to our economic vitality #Roe44 https://t.co/diUyNRBEBK,SenatorHassan,Maggie Hassan,New Hampshire,Democratic
752,Sat Jan 21 16:05:08 +0000 2017,8.22837E+17,26,323,I’m proud to join #WomensMarch in Concord. We must speak up every day #nhpolitics https://t.co/nfgSpVH1S6,SenatorHassan,Maggie Hassan,New Hampshire,Democratic
753,Fri Jan 20 23:24:37 +0000 2017,8.22586E+17,4,9,I look forward to working with General Kelly to keep NH &amp; America safe &amp; secure. Read my statement on today's vote: https://t.co/skx6QUayWT,SenatorHassan,Maggie Hassan,New Hampshire,Democratic
754,Fri Jan 20 23:05:06 +0000 2017,8.22581E+17,14,38,I voted to confirm General Mattis as Secretary of Defense &amp; will work with him to support those defending our nation https://t.co/4ppQnzhpsv,SenatorHassan,Maggie Hassan,New Hampshire,Democratic
755,Fri Jan 20 19:27:54 +0000 2017,8.22526E+17,21,11,My statement on the inauguration of President Donald Trump https://t.co/j4IhIjZB20,SenatorHassan,Maggie Hassan,New Hampshire,Democratic
756,Thu Jan 19 19:14:32 +0000 2017,8.2216E+17,2,28,WATCH people share their stories of how the ACA impacts their lives &amp; what Rep. Price’s policies would mean for them https://t.co/CqNTSweOqO,SenatorHassan,Maggie Hassan,New Hampshire,Democratic
757,Thu Jan 19 18:17:53 +0000 2017,8.22146E+17,7,80,Rep. Price didn’t believe women had been fired for their reproductive health choices. Here are just a few stories: https://t.co/KNmQbKmmoH,SenatorHassan,Maggie Hassan,New Hampshire,Democratic
758,Thu Jan 19 17:15:53 +0000 2017,8.2213E+17,2,26,"Important read from @SenatorShaheen. We must come together to improve health coverage for Americans, not repeal it. https://t.co/sve62hilEn",SenatorHassan,Maggie Hassan,New Hampshire,Democratic
759,Thu Jan 19 15:46:11 +0000 2017,8.22108E+17,3,22,Thanks NHDOJ for investigating marketing by opioid makers that may have contributed to substance abuse crisis in NH https://t.co/yF5DIHjYXn,SenatorHassan,Maggie Hassan,New Hampshire,Democratic
760,Thu Jan 19 03:27:40 +0000 2017,8.21922E+17,46,317,There is nothing obscure to families like mine about the Individuals with Disabilities Education Act https://t.co/fHCAXcqvU0,SenatorHassan,Maggie Hassan,New Hampshire,Democratic
761,Thu Jan 19 02:42:07 +0000 2017,8.21911E+17,41,375,I went on @MSNBC to discuss my concerns with Betsy DeVos' lack of understanding of challenges facing students with… https://t.co/n4NXeJhdRd,SenatorHassan,Maggie Hassan,New Hampshire,Democratic
762,Thu Jan 19 01:16:49 +0000 2017,8.21889E+17,41,34,Tune in ➡️ I'll be on @allinwithchris on @MSNBC soon highlighting my concerns with Betsy DeVos' nomination.,SenatorHassan,Maggie Hassan,New Hampshire,Democratic
763,Wed Jan 18 23:25:49 +0000 2017,8.21861E+17,1,15,Thinking of George and Barbara Bush and hoping for a speedy recovery.,SenatorHassan,Maggie Hassan,New Hampshire,Democratic
764,Wed Jan 18 22:11:08 +0000 2017,8.21842E+17,1,5,In my meeting with OMB nominee Rep. Mulvaney I highlighted the importance of fiscal responsibility. Read my full st… https://t.co/0GRA3p78eY,SenatorHassan,Maggie Hassan,New Hampshire,Democratic
765,Wed Jan 18 21:40:44 +0000 2017,8.21835E+17,2,2,I appreciated the opportunity to ask Mr. Ross his plan to support small businesses &amp; NH’s important fishing industry https://t.co/lVo9RuB7aw,SenatorHassan,Maggie Hassan,New Hampshire,Democratic
766,Wed Jan 18 20:29:09 +0000 2017,8.21817E+17,15,29,"In today’s hearing, I pressed Rep. Price on the harm of repealing the ACA on efforts to combat substance abuse https://t.co/gq3bI2JAu8",SenatorHassan,Maggie Hassan,New Hampshire,Democratic
767,Wed Jan 18 20:13:27 +0000 2017,8.21813E+17,536,6834,Rep. Price refused to answer my question on his vote against protecting women from being fired for their reproducti… https://t.co/ZZx3N4vvnr,SenatorHassan,Maggie Hassan,New Hampshire,Democratic
768,Wed Jan 18 15:18:03 +0000 2017,8.21738E+17,45,56,New report shows 18 million people would lose health insurance in first year if ACA is repealed without replacement https://t.co/KQf2cqRZlj,SenatorHassan,Maggie Hassan,New Hampshire,Democratic
769,Wed Jan 18 14:47:01 +0000 2017,8.21731E+17,29,47,I'm concerned about Rep. Price’s nomination to serve as HHS Secretary. Watch me question him at today's hearing: https://t.co/Mjc0zjC7wA,SenatorHassan,Maggie Hassan,New Hampshire,Democratic
