,created_at,id_str,reply_count,retweet_count,text,user,name,state,party
1331,Sat Apr 16 17:19:35 +0000 2016,7.21388E+17,1,1,“The Marine Raiders bravely &amp; courageously represented their country in WWII &amp; we are grateful for their service.” – Gov. Hassan,SenatorHassan,Maggie Hassan,New Hampshire,Democratic
1332,Sat Apr 16 17:18:59 +0000 2016,7.21387E+17,0,3,Honored to pay special tribute to the Marine Raiders of WWII at the monument dedication ceremony in Boscawen https://t.co/yFlhwdT5Or,SenatorHassan,Maggie Hassan,New Hampshire,Democratic
1333,Sat Apr 16 17:16:46 +0000 2016,7.21387E+17,0,5,"Great to attend another successful Wild NH Day, which reminds us of the natural beauty that makes our state special https://t.co/1GzngHdDzT",SenatorHassan,Maggie Hassan,New Hampshire,Democratic
1334,Sat Apr 16 17:13:37 +0000 2016,7.21386E+17,0,2,“Thank you @NAMI_NH for your continued advocacy to strengthen our mental health system in the Granite State.” – Gov. Hassan,SenatorHassan,Maggie Hassan,New Hampshire,Democratic
1335,Sat Apr 16 17:13:01 +0000 2016,7.21386E+17,1,3,Proud to be a part of the annual @NAMI_NH  Conference in Concord https://t.co/JO5fw4THUa,SenatorHassan,Maggie Hassan,New Hampshire,Democratic
1336,Fri Apr 15 18:17:36 +0000 2016,7.2104E+17,1,1,“The graduates of the NH Corrections Academy stand well-trained &amp; prepared… to preserve justice &amp; keep our communities safe.” – Gov. Hassan,SenatorHassan,Maggie Hassan,New Hampshire,Democratic
1337,Fri Apr 15 17:19:34 +0000 2016,7.21025E+17,0,6,"On #OneBostonDay we remain united in our resilience, our gratitude for first responders and our support of the victims &amp; their families",SenatorHassan,Maggie Hassan,New Hampshire,Democratic
1338,Thu Apr 14 19:46:18 +0000 2016,7.207E+17,0,2,“I encourage all Granite Staters to join  me in the fight against hunger by purchasing a Nothing Can this year.” – Gov. Hassan,SenatorHassan,Maggie Hassan,New Hampshire,Democratic
1339,Thu Apr 14 19:46:06 +0000 2016,7.207E+17,1,3,Helping to kick off the @NHFB “Nothing” campaign in Londonderry to fight against food insecurity in NH https://t.co/Ply80zEejb,SenatorHassan,Maggie Hassan,New Hampshire,Democratic
1340,Thu Apr 14 17:43:38 +0000 2016,7.20669E+17,2,7,Proud to proclaim April as Donate Life Month in NH @DLNewEngland https://t.co/EBeaFqqJaC,SenatorHassan,Maggie Hassan,New Hampshire,Democratic
1341,Wed Apr 13 17:45:21 +0000 2016,7.20307E+17,2,17,"Proud to sign this bipartisan legislation into law that will help increase safe, affordable housing options in NH https://t.co/rkczItO5nn",SenatorHassan,Maggie Hassan,New Hampshire,Democratic
1342,Wed Apr 13 17:34:14 +0000 2016,7.20304E+17,1,2,Congratulations to Nashua's Deepika Kurup! https://t.co/fPesRJphBv,SenatorHassan,Maggie Hassan,New Hampshire,Democratic
1343,Tue Apr 12 22:41:52 +0000 2016,7.20019E+17,0,1,"“When our young people succeed, our communities are stronger.”",SenatorHassan,Maggie Hassan,New Hampshire,Democratic
1344,Tue Apr 12 22:41:30 +0000 2016,7.20019E+17,0,1,Honored to join a group of talented &amp; dedicated individuals as a 2016 Early Learning NH Champion https://t.co/HWRgCLpLpi,SenatorHassan,Maggie Hassan,New Hampshire,Democratic
1345,Tue Apr 12 15:18:29 +0000 2016,7.19908E+17,1,1,Governor Hassan Announces Job Training Grants for Nine New Hampshire Companies in March https://t.co/AOH3nozVpR,SenatorHassan,Maggie Hassan,New Hampshire,Democratic
1346,Mon Apr 11 16:31:30 +0000 2016,7.19564E+17,0,3,Proud that NH was named the state with the Best Taxpayer ROI according to a recent study https://t.co/PTEkj1bM8F,SenatorHassan,Maggie Hassan,New Hampshire,Democratic
1347,Mon Apr 11 16:07:05 +0000 2016,7.19557E+17,0,2,“We must continue working together to strengthen protections for our most vulnerable &amp; to keep children everywhere safe from harm.”,SenatorHassan,Maggie Hassan,New Hampshire,Democratic
1348,Mon Apr 11 16:06:50 +0000 2016,7.19557E+17,0,1,Gov. Hassan: “The courage of these individuals in standing up &amp; speaking out is making our state safer &amp; better for all of our people.”,SenatorHassan,Maggie Hassan,New Hampshire,Democratic
1349,Mon Apr 11 16:06:24 +0000 2016,7.19557E+17,0,1,Honored to speak at NH Victims’ Rights Day event in Concord this morning https://t.co/nFywzGcYx0,SenatorHassan,Maggie Hassan,New Hampshire,Democratic
1350,Sat Apr 09 14:32:49 +0000 2016,7.18809E+17,1,3,“Our former prisoners of war serve as a constant reminder that the people of NH will never give up on those who are missing.” – Gov. Hassan,SenatorHassan,Maggie Hassan,New Hampshire,Democratic
1351,Sat Apr 09 14:32:24 +0000 2016,7.18809E+17,0,4,Honored to pay tribute to former POWs today at the NH Veterans Cemetery in Boscawen https://t.co/zDkcJneUe2,SenatorHassan,Maggie Hassan,New Hampshire,Democratic
1352,Thu Apr 07 18:05:55 +0000 2016,7.18138E+17,1,3,"Statement from Governor Hassan on Senate Passage of Net Metering Legislation
https://t.co/BxAAJ8B9c5",SenatorHassan,Maggie Hassan,New Hampshire,Democratic
1353,Thu Apr 07 18:03:46 +0000 2016,7.18137E+17,0,1,Continuing the Gateway to Work Community College tour at @NHTI in Concord today https://t.co/bEltcXuFjy,SenatorHassan,Maggie Hassan,New Hampshire,Democratic
1354,Wed Apr 06 20:29:27 +0000 2016,7.17811E+17,0,2,"Governor Hassan Calls for Regular Updates on Efforts to Shorten VA Wait Times
https://t.co/biEorB5deL",SenatorHassan,Maggie Hassan,New Hampshire,Democratic
1355,Wed Apr 06 17:53:28 +0000 2016,7.17772E+17,1,1,Governor Hassan’s Statement on Confirmation of Jerry Little as Commissioner of New Hampshire Banking Department https://t.co/30GLu9uiE7,SenatorHassan,Maggie Hassan,New Hampshire,Democratic
1356,Wed Apr 06 17:34:52 +0000 2016,7.17768E+17,0,3,Gov. Hassan’s Statement on Executive Council Approval of MOU for Gov.'s Advisor on Addiction and Behavioral Health https://t.co/KTLv1HqAIs,SenatorHassan,Maggie Hassan,New Hampshire,Democratic
1357,Tue Apr 05 20:33:52 +0000 2016,7.1745E+17,0,5,Statement from Governor Hassan on NHDES Clean Water Letter to Saint-Gobain https://t.co/n0gGJdaAvf,SenatorHassan,Maggie Hassan,New Hampshire,Democratic
1358,Tue Apr 05 18:52:35 +0000 2016,7.17425E+17,0,2,Leaders Across the State Applaud Governor's Signing of Bipartisan Bill Reauthorizing NHHPP https://t.co/q2KWcLDhmk,SenatorHassan,Maggie Hassan,New Hampshire,Democratic
1359,Tue Apr 05 16:59:14 +0000 2016,7.17396E+17,0,6,Governor Hassan Signs Bipartisan Legislation Reauthorizing New Hampshire Health Protection Program https://t.co/J81aRrXYDx,SenatorHassan,Maggie Hassan,New Hampshire,Democratic
1360,Tue Apr 05 16:14:28 +0000 2016,7.17385E+17,0,1,"(2/2) “And we know that reauthorization is also critical to our businesses, to our economy &amp; to the ongoing battle with substance misuse.”",SenatorHassan,Maggie Hassan,New Hampshire,Democratic
1361,Tue Apr 05 16:14:04 +0000 2016,7.17385E+17,0,3,(3/3) “We are taking another historic step forward by reauthorizing this critical health care expansion program.”,SenatorHassan,Maggie Hassan,New Hampshire,Democratic
1362,Tue Apr 05 16:13:36 +0000 2016,7.17385E+17,1,31,Proud to sign bipartisan legislation today reauthorizing NH Health Protection Program https://t.co/Ysa1kxtSse,SenatorHassan,Maggie Hassan,New Hampshire,Democratic
1363,Tue Apr 05 12:50:36 +0000 2016,7.17334E+17,0,3,Gov.Hassan Continues to Urge Legislature to Approve Additional Resources to Combat Opioid Crisis https://t.co/vXg6ZIWESq,SenatorHassan,Maggie Hassan,New Hampshire,Democratic
1364,Mon Apr 04 20:00:05 +0000 2016,7.17079E+17,1,1,"Governor Hassan to Nominate One Judge to Superior Court, Three to Circuit Court https://t.co/U5rhk9jHRZ",SenatorHassan,Maggie Hassan,New Hampshire,Democratic
1365,Mon Apr 04 14:16:02 +0000 2016,7.16993E+17,4,3,Happy Opening Day! Let's go @RedSox!,SenatorHassan,Maggie Hassan,New Hampshire,Democratic
1366,Sat Apr 02 16:18:25 +0000 2016,7.16299E+17,6,4,"“On behalf of the citizens of NH, I want to express our gratitude to our Vietnam veterans for your courageous sacrifices.” – Gov. Hassan",SenatorHassan,Maggie Hassan,New Hampshire,Democratic
1367,Sat Apr 02 16:17:57 +0000 2016,7.16299E+17,0,9,Honored to join General Reddel in hosting the 4th Annual Vietnam Veterans Welcome Home Ceremony in Hanover https://t.co/yo8oRpsTL8,SenatorHassan,Maggie Hassan,New Hampshire,Democratic
1368,Sat Apr 02 16:14:45 +0000 2016,7.16298E+17,0,3,“Thank you @NHHEAF for today’s event &amp; for your efforts to make higher education more accessible to all NH students.” – Gov. Hassan,SenatorHassan,Maggie Hassan,New Hampshire,Democratic
1369,Sat Apr 02 16:14:19 +0000 2016,7.16298E+17,1,4,Excited to attend the 17th Annual @NHHEAF Destination College Convention in Manchester this morning https://t.co/kt8HOmNYFK,SenatorHassan,Maggie Hassan,New Hampshire,Democratic
1370,Sat Apr 02 13:00:23 +0000 2016,7.16249E+17,2,13,Wear blue today on #AutismAwarenessDay to raise awareness about autism as a global public health priority #LIUB,SenatorHassan,Maggie Hassan,New Hampshire,Democratic
1371,Fri Apr 01 13:55:53 +0000 2016,7.159E+17,0,2,“The work of Ambers Place &amp; @HOPE4NH is helping save lives &amp; the people of NH are profoundly grateful.” – Gov. Hassan,SenatorHassan,Maggie Hassan,New Hampshire,Democratic
1372,Fri Apr 01 13:55:35 +0000 2016,7.159E+17,1,4,Honored to participate in the ribbon cutting ceremony for Ambers Place in Manchester https://t.co/A7VbeszoEQ,SenatorHassan,Maggie Hassan,New Hampshire,Democratic
1373,Thu Mar 31 20:56:35 +0000 2016,7.15644E+17,0,3,Governor Hassan’s Statement on Signing Bill that Creates MtBE Trust Fund to Ensure Access to Clean Drinking Water https://t.co/EYMU4ipLnr,SenatorHassan,Maggie Hassan,New Hampshire,Democratic
1374,Thu Mar 31 20:23:41 +0000 2016,7.15636E+17,0,4,"“Clean air is critical to public health, public safety &amp; our economy.” – Gov. Hassan",SenatorHassan,Maggie Hassan,New Hampshire,Democratic
1375,Thu Mar 31 20:23:24 +0000 2016,7.15636E+17,2,8,Proud to participate in @CleanAirMoms Read-In at the State House in Concord today https://t.co/dpIxnVxsel,SenatorHassan,Maggie Hassan,New Hampshire,Democratic
1376,Thu Mar 31 18:37:12 +0000 2016,7.15609E+17,0,1,"Gov. Hassan, State Emergency Management, PUC Coordinating Response to Suspicious Devices Found in Tyngsborough, MA https://t.co/nzu2rxno7w",SenatorHassan,Maggie Hassan,New Hampshire,Democratic
1377,Thu Mar 31 18:01:27 +0000 2016,7.156E+17,1,10,Governor Hassan Applauds Senate Vote to Reauthorize Bipartisan New Hampshire Health Protection Program https://t.co/mB8RL4wbDM,SenatorHassan,Maggie Hassan,New Hampshire,Democratic
1378,Wed Mar 30 19:12:47 +0000 2016,7.15255E+17,0,2,“I encourage all of NH’s innovative start ups to register for @livefreestart’s Ultimate Connection Competition.” https://t.co/ACxIzyJ0P6,SenatorHassan,Maggie Hassan,New Hampshire,Democratic
1379,Wed Mar 30 19:12:09 +0000 2016,7.15255E+17,0,1,Gov. Hassan: “Thank you to @livefreestart for building on NH’s entrepreneurial spirit &amp; helping innovative businesses start up &amp; grow.”,SenatorHassan,Maggie Hassan,New Hampshire,Democratic
1380,Wed Mar 30 19:11:29 +0000 2016,7.15255E+17,0,4,Great to help launch @livefreestart’s Ultimate Connection Competition at the @alpha_loft in Manchester today https://t.co/UOObtI9uMh,SenatorHassan,Maggie Hassan,New Hampshire,Democratic
1381,Wed Mar 30 14:32:15 +0000 2016,7.15185E+17,0,10,"Deepest condolences to the family &amp; loved ones of Lyndeborough volunteer fire fighter Derek Lankowski, who we tragically lost far too soon",SenatorHassan,Maggie Hassan,New Hampshire,Democratic
1382,Tue Mar 29 18:52:48 +0000 2016,7.14888E+17,0,4,Gov. Hassan’s Statement on President Obama’s Announcement of Additional Actions to Combat Heroin and Opioid Crisis https://t.co/ivCZVkasCC,SenatorHassan,Maggie Hassan,New Hampshire,Democratic
1383,Sun Mar 27 12:30:15 +0000 2016,7.14067E+17,2,3,“Wishing everyone a happy and safe Easter!” – Gov. Hassan,SenatorHassan,Maggie Hassan,New Hampshire,Democratic
1384,Sun Mar 27 02:24:00 +0000 2016,7.13914E+17,0,1,“Thank you @CityYearNH for your steadfast commitment to supporting some of our most vulnerable young people.” – Gov. Hassan,SenatorHassan,Maggie Hassan,New Hampshire,Democratic
1385,Sun Mar 27 02:23:10 +0000 2016,7.13914E+17,2,3,Gov. Hassan speaking at the 16th Annual @CityYearNH Starry Starry Night Gala in New Castle https://t.co/oFZB3Lm5mn,SenatorHassan,Maggie Hassan,New Hampshire,Democratic
1386,Sat Mar 26 14:46:26 +0000 2016,7.13739E+17,1,3,Gov. Hassan &amp; the First Gentleman Tom Hassan hosting the annual Easter Egg Hunt at the State House in Concord https://t.co/eDWYPIAscN,SenatorHassan,Maggie Hassan,New Hampshire,Democratic
1387,Fri Mar 25 20:12:49 +0000 2016,7.13459E+17,1,1,Gov. Hassan meeting w/employees &amp; touring the facility at New England Wire Technologies in Lisbon https://t.co/L9XlC0ceLc,SenatorHassan,Maggie Hassan,New Hampshire,Democratic
1388,Fri Mar 25 18:15:55 +0000 2016,7.13429E+17,0,1,"Gov Hassan Meets with Coos County Police Chiefs, Urges Passage of Bill Enacting Protections for Border Patrol Agents https://t.co/fqqMGRtxzX",SenatorHassan,Maggie Hassan,New Hampshire,Democratic
1389,Fri Mar 25 16:10:32 +0000 2016,7.13398E+17,1,1,“Gateway to Work will help give more of our families the opportunity to work their way into the middle class.” – Gov. Hassan,SenatorHassan,Maggie Hassan,New Hampshire,Democratic
1390,Fri Mar 25 16:10:02 +0000 2016,7.13398E+17,1,3,Gov. Hassan continuing her Gateway to Work Community College Tour at White Mountains Community College in Berlin https://t.co/QHRf7wSMJH,SenatorHassan,Maggie Hassan,New Hampshire,Democratic
1391,Fri Mar 25 16:05:02 +0000 2016,7.13396E+17,0,3,Gov Hassan at Capone Iron Works in Berlin highlighting the importance of supporting innovative businesses across NH https://t.co/nlZMuDHbYb,SenatorHassan,Maggie Hassan,New Hampshire,Democratic
1392,Fri Mar 25 16:01:34 +0000 2016,7.13395E+17,0,2,"Gov. Hassan in Groveton w/ Coos County Police Chiefs, thanking them for their commitment to public safety &amp; service https://t.co/9neWYyA2ic",SenatorHassan,Maggie Hassan,New Hampshire,Democratic
1393,Thu Mar 24 21:22:49 +0000 2016,7.13114E+17,0,4,Statement from Gov. Hassan on Amendment to Legislation Providing Resources for Substance Misuse https://t.co/i3tetfoK11,SenatorHassan,Maggie Hassan,New Hampshire,Democratic
1394,Thu Mar 24 20:44:07 +0000 2016,7.13104E+17,12,148,“NC's anti-LGBT legislation is reprehensible. We must fully include all people in order to thrive economically &amp; as a society.” –Gov. Hassan,SenatorHassan,Maggie Hassan,New Hampshire,Democratic
1395,Thu Mar 24 20:34:37 +0000 2016,7.13102E+17,0,2,Governor Hassan's Statement on Senate Passage of Bill to Continue Streamlining Access to Treatment https://t.co/L4aHSOr1mO,SenatorHassan,Maggie Hassan,New Hampshire,Democratic
1396,Thu Mar 24 18:55:56 +0000 2016,7.13077E+17,1,1,Statement from Governor Hassan on Senate Passage of Bill to Support Police Standards and Training Council https://t.co/IOsjSaYQkF,SenatorHassan,Maggie Hassan,New Hampshire,Democratic
1397,Thu Mar 24 16:35:30 +0000 2016,7.13042E+17,0,3,"""Thank you to the young women of @ASDNHorg for your enthusiasm for technology &amp; congrats on your success in this challenge."" - Gov. Hassan",SenatorHassan,Maggie Hassan,New Hampshire,Democratic
1398,Thu Mar 24 16:35:01 +0000 2016,7.13041E+17,0,7,Gov. Hassan at @ASDNHorg in Nashua honoring young women for their success in the @verizongiving App Challenge https://t.co/Ht1KdC5QFo,SenatorHassan,Maggie Hassan,New Hampshire,Democratic
1399,Thu Mar 24 13:08:51 +0000 2016,7.1299E+17,1,1,"""The Tri-Chambers are working to build a stronger economic future &amp; a better community, helping to drive our state's economy."" - Gov. Hassan",SenatorHassan,Maggie Hassan,New Hampshire,Democratic
1400,Thu Mar 24 13:08:15 +0000 2016,7.12989E+17,0,2,Gov. Hassan addressing the Tri-Chambers of Commerce SOTS Breakfast Forum in Rochester https://t.co/3mcNlQoaZh,SenatorHassan,Maggie Hassan,New Hampshire,Democratic
1401,Wed Mar 23 19:56:20 +0000 2016,7.1273E+17,0,1,Statement from Governor Hassan on House Passage of Drug Forfeiture Bill https://t.co/EOJpL6jvhK,SenatorHassan,Maggie Hassan,New Hampshire,Democratic
1402,Wed Mar 23 16:47:05 +0000 2016,7.12682E+17,1,4,Governor and Council Approve Funds for Statewide Substance Misuse Treatment and Recovery Services https://t.co/UwuJInuazl,SenatorHassan,Maggie Hassan,New Hampshire,Democratic
1403,Wed Mar 23 11:00:26 +0000 2016,7.12595E+17,1,6,Call 844 650 VETS (8387) today for @eastersealsnh's Veterans Count Radiothon to support NH veterans &amp; their families https://t.co/XmGge8AaDE,SenatorHassan,Maggie Hassan,New Hampshire,Democratic
1404,Tue Mar 22 21:55:05 +0000 2016,7.12397E+17,0,5,Statement from Governor Hassan on New FDA Opioid Warning Labeling Requirement https://t.co/6lJSUgiiCR,SenatorHassan,Maggie Hassan,New Hampshire,Democratic
1405,Tue Mar 22 21:08:08 +0000 2016,7.12385E+17,2,4,Flags to Half-Staff in Honor of Victims of Brussels Terrorist Attacks https://t.co/d21tSgvVI0,SenatorHassan,Maggie Hassan,New Hampshire,Democratic
1406,Tue Mar 22 14:26:21 +0000 2016,7.12284E+17,0,10,Statement from Governor Hassan on Terrorist Attacks in Brussels https://t.co/nmuco60iRL,SenatorHassan,Maggie Hassan,New Hampshire,Democratic
1407,Mon Mar 21 17:45:46 +0000 2016,7.11972E+17,0,2,Governor Hassan Names James Vara Governor's Advisor on Addiction and Behavioral Health https://t.co/QQgK7d3Xfo,SenatorHassan,Maggie Hassan,New Hampshire,Democratic
1408,Sun Mar 20 18:12:47 +0000 2016,7.11616E+17,0,3,Gov. Hassan marching in the City of Manchester’s St. Patrick’s Day Parade https://t.co/2dVuzLS6Yc,SenatorHassan,Maggie Hassan,New Hampshire,Democratic
1409,Fri Mar 18 23:07:56 +0000 2016,7.10966E+17,0,1,“Businesses represented at the NH State Home Show are driving our economy forward &amp; helping maintain our high quality of life.”–Gov. Hassan,SenatorHassan,Maggie Hassan,New Hampshire,Democratic
1410,Fri Mar 18 23:07:26 +0000 2016,7.10966E+17,0,1,Gov. Hassan speaking at the 49th Annual NH State Home Show in Manchester https://t.co/TMBMefMb1B,SenatorHassan,Maggie Hassan,New Hampshire,Democratic
1411,Fri Mar 18 16:32:12 +0000 2016,7.10866E+17,0,3,Gov. Hassan at a ceremony in the State House today where she proclaimed Francophonie Month in New Hampshire https://t.co/LWopMftmak,SenatorHassan,Maggie Hassan,New Hampshire,Democratic
1412,Fri Mar 18 13:51:30 +0000 2016,7.10826E+17,1,5,Gov. Hassan at the ribbon-cutting ceremony for the new STEAM Innovation Lab at the @kidmuseumnh in Dover https://t.co/FUwjboPJVM,SenatorHassan,Maggie Hassan,New Hampshire,Democratic
1413,Thu Mar 17 22:51:31 +0000 2016,7.10599E+17,2,5,“Thank you to everyone attending for helping to make higher education more accessible to all of our young people in NH.” –Gov. Hassan,SenatorHassan,Maggie Hassan,New Hampshire,Democratic
1414,Thu Mar 17 22:50:30 +0000 2016,7.10599E+17,3,1,Gov. Hassan speaking at the 38th Annual Bobby Stephen St. Patrick’s Day Celebration in Manchester https://t.co/1pXim0u4zE,SenatorHassan,Maggie Hassan,New Hampshire,Democratic
1415,Thu Mar 17 18:51:35 +0000 2016,7.10539E+17,3,4,Gov. Hassan meeting w/ students &amp; learning about their projects at the NH Science &amp; Engineering Expo in Concord https://t.co/arwrqGk6RF,SenatorHassan,Maggie Hassan,New Hampshire,Democratic
1416,Thu Mar 17 18:43:41 +0000 2016,7.10537E+17,1,5,"Gov. Hassan &amp; DHHS Commissioner Meyers Announce New Division to Unify Response to Mental Health, Substance Misuse https://t.co/8MT1uGvPBT",SenatorHassan,Maggie Hassan,New Hampshire,Democratic
1417,Thu Mar 17 18:41:42 +0000 2016,7.10537E+17,3,3,Gov. Hassan honoring the legacy of John Ganley at the annual John Ganley St. Patrick’s Day Luncheon in Salem today https://t.co/cpRGixaH04,SenatorHassan,Maggie Hassan,New Hampshire,Democratic
1418,Thu Mar 17 13:22:27 +0000 2016,7.10456E+17,1,2,“Thank you to this year’s heroes for your unyielding dedication to strengthening our communities and our state.” – Gov. Hassan,SenatorHassan,Maggie Hassan,New Hampshire,Democratic
1419,Thu Mar 17 13:21:58 +0000 2016,7.10456E+17,1,3,Gov. Hassan honoring the 2016 @NHRedCross Heroes in Manchester last night https://t.co/yXaGcjn7cv,SenatorHassan,Maggie Hassan,New Hampshire,Democratic
1420,Thu Mar 17 12:58:23 +0000 2016,7.1045E+17,0,1,“Thank you to everyone for coming out to support the PLUS Company &amp; their work to strengthen NH’s tradition of inclusion.” – Gov. Hassan,SenatorHassan,Maggie Hassan,New Hampshire,Democratic
1421,Thu Mar 17 12:58:12 +0000 2016,7.1045E+17,3,1,Gov. Hassan at the annual PLUS Company Wild Irish Breakfast in Nashua https://t.co/SOnnRsLnCq,SenatorHassan,Maggie Hassan,New Hampshire,Democratic
1422,Wed Mar 16 23:58:41 +0000 2016,7.10254E+17,0,2,“Tonight’s honorees exemplify the impact young professionals have on our economy &amp; in our communities.” – Gov. Hassan,SenatorHassan,Maggie Hassan,New Hampshire,Democratic
1423,Wed Mar 16 23:58:21 +0000 2016,7.10254E+17,1,4,Gov. Hassan speaking at the @UnionLeader’s 40 Under Forty Award Ceremony in Concord tonight https://t.co/pfcjSsqS1r,SenatorHassan,Maggie Hassan,New Hampshire,Democratic
1424,Wed Mar 16 18:12:21 +0000 2016,7.10167E+17,1,4,"Governor Hassan’s Statement on Signing Bipartisan Bill on Accessory Dwelling Units
https://t.co/JSuGdRFO3x",SenatorHassan,Maggie Hassan,New Hampshire,Democratic
1425,Tue Mar 15 21:43:44 +0000 2016,7.09858E+17,0,2,Statement from Governor Hassan on New CDC Prescription Guidelines https://t.co/z6kez15egC,SenatorHassan,Maggie Hassan,New Hampshire,Democratic
1426,Tue Mar 15 15:47:24 +0000 2016,7.09768E+17,0,1,"Governor Hassan Highlights Importance of Engaging Young Women in STEM Fields at Girls Technology Day
 https://t.co/mx46nUCtCv",SenatorHassan,Maggie Hassan,New Hampshire,Democratic
1427,Tue Mar 15 13:08:43 +0000 2016,7.09728E+17,1,6,Gov. Hassan highlighting the importance of STEM education at Girls Technology Day at @NHTI in Concord https://t.co/cea3YtaJGS,SenatorHassan,Maggie Hassan,New Hampshire,Democratic
1428,Mon Mar 14 13:35:13 +0000 2016,7.09372E+17,0,2,Congrats to mathletes of Fairgrounds MS &amp; @ASDNHorg for qualifying for the national @MATHCOUNTS competition in DC! https://t.co/wJ0jKVHFvT,SenatorHassan,Maggie Hassan,New Hampshire,Democratic
1429,Sun Mar 13 18:02:13 +0000 2016,7.09077E+17,0,7,Congratulations to the NH Men's and Women's teams on winning the @NENSA U16 Championship!,SenatorHassan,Maggie Hassan,New Hampshire,Democratic
1430,Fri Mar 11 20:14:17 +0000 2016,7.08386E+17,0,2,Governor Hassan Applauds @SenatorShaheen's  Sexual Assault Survivor's Rights Act https://t.co/aqXWS59Hgz,SenatorHassan,Maggie Hassan,New Hampshire,Democratic
1431,Fri Mar 11 19:43:13 +0000 2016,7.08378E+17,0,2,Gov. Hassan's Statement on Announcement of ACA Grants to NH Health Centers to Improve Substance Abuse Treatment https://t.co/5VCGtHZqAO,SenatorHassan,Maggie Hassan,New Hampshire,Democratic
1432,Fri Mar 11 01:26:35 +0000 2016,7.08102E+17,1,3,Governor Hassan’s Statement on House Passage of Ridesharing Services Bill https://t.co/E3QrkmymBx,SenatorHassan,Maggie Hassan,New Hampshire,Democratic
1433,Thu Mar 10 20:29:01 +0000 2016,7.08027E+17,0,2,Statement from Governor Hassan on House Passage of Ten-Year Transportation Improvement Plan https://t.co/pjqgTIsPLe,SenatorHassan,Maggie Hassan,New Hampshire,Democratic
1434,Thu Mar 10 19:42:01 +0000 2016,7.08015E+17,0,3,"Statement from Governor Hassan on Senate Action on Substance Misuse Bills
https://t.co/JN1odzq0Xh",SenatorHassan,Maggie Hassan,New Hampshire,Democratic
1435,Thu Mar 10 19:30:35 +0000 2016,7.08012E+17,1,3,"Gov. Hassan, @NYGovCuomo &amp; @GovPeterShumlin Urge EPA to Review &amp; Issue New PFOA Guidelines for Safe Drinking Water https://t.co/UZhN5i7rUT",SenatorHassan,Maggie Hassan,New Hampshire,Democratic
1436,Wed Mar 09 21:31:28 +0000 2016,7.0768E+17,1,1,"Governor Hassan’s Statement on Bill to Combat Human Trafficking
https://t.co/MZucTZb7eG",SenatorHassan,Maggie Hassan,New Hampshire,Democratic
1437,Wed Mar 09 21:29:11 +0000 2016,7.0768E+17,0,1,Statement from Governor Hassan on Bipartisan House Vote to Pass Bill Requiring Prescribing Rules for Opioids https://t.co/aDwzW2tqel,SenatorHassan,Maggie Hassan,New Hampshire,Democratic
1438,Wed Mar 09 21:06:35 +0000 2016,7.07674E+17,0,2,"""Congratulations to Rep-elect Mike Edgar! I look forward to working with you to keep our state's economy moving forward."" - Gov. Hassan",SenatorHassan,Maggie Hassan,New Hampshire,Democratic
1439,Wed Mar 09 17:14:17 +0000 2016,7.07616E+17,0,7,"Governor and Council Approve Funds to Combat Substance Misuse in Monadnock Region
https://t.co/ZwCw7z7HQg",SenatorHassan,Maggie Hassan,New Hampshire,Democratic
1440,Wed Mar 09 16:45:55 +0000 2016,7.07608E+17,0,1,"Contract for Independent Review of DCYF Approved by Governor and Council
https://t.co/IrC1M6G38w",SenatorHassan,Maggie Hassan,New Hampshire,Democratic
1441,Wed Mar 09 15:26:23 +0000 2016,7.07588E+17,0,2,Statement from Governor Hassan on House Vote to Pass MtBE Bill https://t.co/wal2aTIws7,SenatorHassan,Maggie Hassan,New Hampshire,Democratic
1442,Tue Mar 08 17:42:16 +0000 2016,7.0726E+17,2,4,"Governor Hassan, Harbor Homes and @NHHFA Announce Housing Choice Vouchers to Veterans Initiative https://t.co/eqkjWO1oUj",SenatorHassan,Maggie Hassan,New Hampshire,Democratic
1443,Tue Mar 08 15:33:12 +0000 2016,7.07228E+17,0,1,“This program builds on our efforts to help ensure that our veterans receive the full support they deserve.”,SenatorHassan,Maggie Hassan,New Hampshire,Democratic
