,created_at,id_str,reply_count,retweet_count,text,user,name,state,party
1903,Tue Jul 14 15:30:21 +0000 2015,6.20979E+17,0,4,Gov. Hassan visits the @SEESciCtr summer camp in Manchester http://t.co/4a53dfRyyt,SenatorHassan,Maggie Hassan,New Hampshire,Democratic
1904,Mon Jul 13 19:08:14 +0000 2015,6.20671E+17,1,2,Statement from Governor Hassan on Signing SB 254 https://t.co/kYCyf4Ot2e,SenatorHassan,Maggie Hassan,New Hampshire,Democratic
1905,Fri Jul 10 21:52:37 +0000 2015,6.19625E+17,5,6,Gov. Hassan fully supports the State of Israel &amp; its right to exist &amp; defend itself. The Governor believes the BDS effort is wrong &amp; harmful,SenatorHassan,Maggie Hassan,New Hampshire,Democratic
1906,Fri Jul 10 19:31:41 +0000 2015,6.1959E+17,2,1,Governor Hassan’s Veto Message Regarding SB 169 http://t.co/HyhIgdJjpV,SenatorHassan,Maggie Hassan,New Hampshire,Democratic
1907,Fri Jul 10 19:16:13 +0000 2015,6.19586E+17,0,3,Governor Hassan’s Veto Message Regarding SB 179 https://t.co/uwGMRdOUuW,SenatorHassan,Maggie Hassan,New Hampshire,Democratic
1908,Fri Jul 10 16:22:06 +0000 2015,6.19542E+17,0,1,Gov. Hassan at the ribbon cutting for the @WhiteMountainNF Lower Falls Recreation Site http://t.co/LQziKMqdXG,SenatorHassan,Maggie Hassan,New Hampshire,Democratic
1909,Thu Jul 09 21:05:54 +0000 2015,6.19251E+17,0,2,Statement from Governor Hassan on Signing SB 221 http://t.co/jTnzbKbkBW,SenatorHassan,Maggie Hassan,New Hampshire,Democratic
1910,Thu Jul 09 18:42:01 +0000 2015,6.19215E+17,0,1,Governor Hassan Signs Capital Budget http://t.co/FZ7ct9ehD4,SenatorHassan,Maggie Hassan,New Hampshire,Democratic
1911,Wed Jul 08 20:37:14 +0000 2015,6.18882E+17,1,1,Governor Hassan’s Statement on Signing HB 614 https://t.co/gwt4rfxobs,SenatorHassan,Maggie Hassan,New Hampshire,Democratic
1912,Wed Jul 08 19:22:04 +0000 2015,6.18863E+17,0,1,Statement from Governor Hassan on Signing HB 270 https://t.co/B4WYxm5XcQ,SenatorHassan,Maggie Hassan,New Hampshire,Democratic
1913,Tue Jul 07 14:31:19 +0000 2015,6.18427E+17,0,5,"Gov. Hassan visits @sequoyatech in Peterborough, receiving a demo of their tech support services http://t.co/P6wkGV7XAj",SenatorHassan,Maggie Hassan,New Hampshire,Democratic
1914,Mon Jul 06 18:20:31 +0000 2015,6.18122E+17,7,3,Governor Hassan’s Veto Message Regarding SB 116 https://t.co/Kai9M7zndm,SenatorHassan,Maggie Hassan,New Hampshire,Democratic
1915,Mon Jul 06 15:57:53 +0000 2015,6.18086E+17,0,1,Governor Hassan’s Statement on Signing SB 55 https://t.co/Y53OjI6CXO,SenatorHassan,Maggie Hassan,New Hampshire,Democratic
1916,Mon Jul 06 14:26:44 +0000 2015,6.18064E+17,1,7,"Gov. Hassan signs bipartisan law to ban the sale, use or possession of synthetic drugs http://t.co/VrcoKpTcwd",SenatorHassan,Maggie Hassan,New Hampshire,Democratic
1917,Mon Jul 06 00:54:17 +0000 2015,6.17859E+17,1,10,"Go USA!!! Congrats to our World Cup champions, @ussoccer_wnt!!!",SenatorHassan,Maggie Hassan,New Hampshire,Democratic
1918,Sat Jul 04 19:03:50 +0000 2015,6.17408E+17,0,3,Gov. Hassan marches in the annual Town of Amherst 4th of July Parade this morning http://t.co/ErULtwqJpB,SenatorHassan,Maggie Hassan,New Hampshire,Democratic
1919,Sat Jul 04 13:26:02 +0000 2015,6.17323E+17,2,5,A safe and happy Independence Day to Granite Staters and Americans everywhere!,SenatorHassan,Maggie Hassan,New Hampshire,Democratic
1920,Thu Jul 02 17:34:15 +0000 2015,6.16661E+17,2,4,Gov. Hassan at the ribbon cutting for the new White River Junction Vet Center http://t.co/iHYoXGihbM,SenatorHassan,Maggie Hassan,New Hampshire,Democratic
1921,Wed Jul 01 14:33:45 +0000 2015,6.16253E+17,1,9,Gov. Hassan &amp; @RedCrossNNE ask Granite Staters to #ChooseYourDay &amp; donate blood this summer http://t.co/Jz51KwJS2N http://t.co/jrMHHgDfez,SenatorHassan,Maggie Hassan,New Hampshire,Democratic
1922,Tue Jun 30 20:50:03 +0000 2015,6.15986E+17,0,2,Governor Hassan Sends Letter to Senate Finance https://t.co/6tMhvCHZPU,SenatorHassan,Maggie Hassan,New Hampshire,Democratic
1923,Mon Jun 29 19:29:12 +0000 2015,6.15603E+17,0,2,Governor Hassan’s Statement on USNH Tuition https://t.co/grK7k7rutl,SenatorHassan,Maggie Hassan,New Hampshire,Democratic
1924,Fri Jun 26 14:40:01 +0000 2015,6.14443E+17,2,21,Governor Hassan's Statement Celebrating Momentous #MarriageEquality Victory: https://t.co/68GECzJ0GP #nhpolitics,SenatorHassan,Maggie Hassan,New Hampshire,Democratic
1925,Fri Jun 26 14:12:57 +0000 2015,6.14436E+17,1,42,#MarriageEquality is the law of the land! Proud NH helped lead the way to this historic day in our enduring quest for full inclusion of all!,SenatorHassan,Maggie Hassan,New Hampshire,Democratic
1926,Thu Jun 25 20:49:46 +0000 2015,6.14174E+17,1,4,"Responding to state's request, US Dept of Energy has made prelim. historic resources reviews on #NorthernPass public http://t.co/zTm0Vkte6n",SenatorHassan,Maggie Hassan,New Hampshire,Democratic
1927,Thu Jun 25 17:32:03 +0000 2015,6.14124E+17,1,3,Governor Hassan’s Statement on Signing Continuing Resolution https://t.co/qb9xJYSUvd,SenatorHassan,Maggie Hassan,New Hampshire,Democratic
1928,Thu Jun 25 14:47:19 +0000 2015,6.14082E+17,0,28,"SCOTUS decision is a victory for the more than 30,000 Granite Staters who receive affordable health insurance through NH's marketplace",SenatorHassan,Maggie Hassan,New Hampshire,Democratic
1929,Thu Jun 25 14:44:03 +0000 2015,6.14082E+17,2,7,Governor Hassan's Veto Message Regarding HB 1 and HB 2: https://t.co/SiSWtAgGhm,SenatorHassan,Maggie Hassan,New Hampshire,Democratic
1930,Wed Jun 24 20:28:13 +0000 2015,6.13806E+17,0,4,"Governor Hassan Reiterates Intention to Veto Fiscally Irresponsible Budget, Supports Continuing Resolution https://t.co/RJun2GhO37",SenatorHassan,Maggie Hassan,New Hampshire,Democratic
1931,Tue Jun 23 21:41:05 +0000 2015,6.13462E+17,0,1,Belknap and Coos counties now under tornado warning status. EOC remains open to provide support as necessary,SenatorHassan,Maggie Hassan,New Hampshire,Democratic
1932,Tue Jun 23 21:16:59 +0000 2015,6.13456E+17,1,6,The EOC has been partially activated for the current tornado watch. Emergency management officials will continue closely monitor events,SenatorHassan,Maggie Hassan,New Hampshire,Democratic
1933,Tue Jun 23 20:36:16 +0000 2015,6.13445E+17,0,1,Visit http://t.co/CWCmom8SNW for @NH_HSEM for safety and preparedness tips during the tornado watch,SenatorHassan,Maggie Hassan,New Hampshire,Democratic
1934,Tue Jun 23 20:03:52 +0000 2015,6.13437E+17,0,3,Governor Hassan to Nominate Kate Bailey to Public Utilities Commission http://t.co/NqfRIQJSzP,SenatorHassan,Maggie Hassan,New Hampshire,Democratic
1935,Mon Jun 22 21:08:53 +0000 2015,6.13091E+17,1,4,Sending our thoughts and prayers to @SenAngusKing and his family as he fights cancer,SenatorHassan,Maggie Hassan,New Hampshire,Democratic
1936,Mon Jun 22 20:32:14 +0000 2015,6.13082E+17,0,6,Granite Staters are sending our thoughts and prayers to Gov. @LarryHogan in his battle with cancer,SenatorHassan,Maggie Hassan,New Hampshire,Democratic
1937,Mon Jun 22 20:21:06 +0000 2015,6.13079E+17,0,2,Incredibly grateful for the heroic actions of our courageous firefighters http://t.co/4Q8SRtzOFi,SenatorHassan,Maggie Hassan,New Hampshire,Democratic
1938,Mon Jun 22 17:22:53 +0000 2015,6.13034E+17,0,3,Governor Hassan’s Statement on the Passing of Representative Robbie Parsons https://t.co/yjNvhLqhiF,SenatorHassan,Maggie Hassan,New Hampshire,Democratic
1939,Sun Jun 21 13:08:29 +0000 2015,6.12608E+17,2,5,Wishing a very happy Father's Day to fathers everywhere!,SenatorHassan,Maggie Hassan,New Hampshire,Democratic
1940,Fri Jun 19 18:46:26 +0000 2015,6.11968E+17,1,1,Governor Hassan’s Statement on a Continuing Resolution https://t.co/B9wqMlEWBc,SenatorHassan,Maggie Hassan,New Hampshire,Democratic
1941,Thu Jun 18 15:55:30 +0000 2015,6.11563E+17,0,2,Governor Hassan Reiterates Intention to Veto Republican Budget If It Comes to Her Desk as It Is https://t.co/BfxmJfOZpC,SenatorHassan,Maggie Hassan,New Hampshire,Democratic
1942,Thu Jun 18 14:51:20 +0000 2015,6.11547E+17,1,6,"Gov. Hassan reiterates her intention to veto fiscally irresponsible, unbalanced budget if it comes to her desk as is http://t.co/OTPQXWxvdH",SenatorHassan,Maggie Hassan,New Hampshire,Democratic
1943,Thu Jun 18 01:03:03 +0000 2015,6.11338E+17,4,26,"Governor: Republican Budget Is Fiscally Irresponsible &amp; Unbalanced, Will Veto If Comes to Desk As It Is https://t.co/RPBvyI2Qo8 #nhpolitics",SenatorHassan,Maggie Hassan,New Hampshire,Democratic
1944,Wed Jun 17 17:34:32 +0000 2015,6.11225E+17,0,4,Gov. Hassan meets with press at the Legislative Office Building before the budget committee of conference resumes http://t.co/2IOO7j7Ey4,SenatorHassan,Maggie Hassan,New Hampshire,Democratic
1945,Tue Jun 16 22:22:52 +0000 2015,6.10936E+17,1,6,Congrats to @smuttynosebeer for their recent AEE award for sustainable energy practices! http://t.co/3KIPHw0pmw,SenatorHassan,Maggie Hassan,New Hampshire,Democratic
1946,Tue Jun 16 15:16:58 +0000 2015,6.10828E+17,1,3,"Gov. Hassan Continues to Stress the Need for Responsible, Compromise Budget at @NashuaChamber State of the State http://t.co/5f7HNmggFL",SenatorHassan,Maggie Hassan,New Hampshire,Democratic
1947,Tue Jun 16 12:06:27 +0000 2015,6.1078E+17,0,5,Gov. Hassan addresses the @NashuaChamber at their State of the State breakfast http://t.co/tjcgjXQsK8,SenatorHassan,Maggie Hassan,New Hampshire,Democratic
1948,Mon Jun 15 22:02:41 +0000 2015,6.10568E+17,0,4,"Help Rundlett Middle Schooler Emilee Mills reach her goal of collecting 10,000 letters of thanks for our troops https://t.co/xuNr1LpByn",SenatorHassan,Maggie Hassan,New Hampshire,Democratic
1949,Sun Jun 14 18:16:22 +0000 2015,6.10149E+17,1,12,Gov. Hassan at Fenway Park for NH Day and the Red Sox Service Scholarship Awards for Granite Staters http://t.co/mKsXbb6X78,SenatorHassan,Maggie Hassan,New Hampshire,Democratic
1950,Sun Jun 14 13:17:32 +0000 2015,6.10074E+17,1,6,Gov. Hassan and @NHStateParks hosted the #CapitalCampout at Bear Brook State Park yesterday http://t.co/UbMVmoO0zL,SenatorHassan,Maggie Hassan,New Hampshire,Democratic
1951,Fri Jun 12 21:36:52 +0000 2015,6.09474E+17,1,4,"Gov. Hassan ceremonially signs SB30 at the Balsams, which will help advance the resort's revitalization http://t.co/9pZYnnWdPn",SenatorHassan,Maggie Hassan,New Hampshire,Democratic
1952,Fri Jun 12 15:22:58 +0000 2015,6.0938E+17,1,1,Governor Hassan’s Veto Message Regarding HB 603 https://t.co/TxEuTLwkRI,SenatorHassan,Maggie Hassan,New Hampshire,Democratic
1953,Thu Jun 11 20:44:41 +0000 2015,6.09099E+17,0,2,Governor Hassan’s Statement on Signing HB 520 https://t.co/qTHr0KrKGS,SenatorHassan,Maggie Hassan,New Hampshire,Democratic
1954,Thu Jun 11 20:41:01 +0000 2015,6.09098E+17,0,1,Statement from Governor Hassan on Signing SB 244 https://t.co/dSMyL3iHpE,SenatorHassan,Maggie Hassan,New Hampshire,Democratic
1955,Thu Jun 11 17:39:01 +0000 2015,6.09052E+17,0,4,Gov. Hassan speaks at this morning's @LaconiaMCWeek Kickoff Press Conference http://t.co/63xQURsNNn,SenatorHassan,Maggie Hassan,New Hampshire,Democratic
1956,Thu Jun 11 17:21:01 +0000 2015,6.09048E+17,0,3,Governor Hassan’s Statement on New Hampshire’s 2014 Economic Growth Rate https://t.co/kicFXwQOuW,SenatorHassan,Maggie Hassan,New Hampshire,Democratic
1957,Wed Jun 10 17:22:33 +0000 2015,6.08686E+17,0,2,Gov. Hassan honors our service members and helps cut a cake celebrating the 240th birthday of the U.S. Army http://t.co/T3FDhW4KWm,SenatorHassan,Maggie Hassan,New Hampshire,Democratic
1958,Tue Jun 09 17:01:30 +0000 2015,6.08318E+17,0,4,Gov. Hassan recognizes the Profile School Class of 2015 for their selfless actions to support their Principal http://t.co/S2w464FOqi,SenatorHassan,Maggie Hassan,New Hampshire,Democratic
1959,Tue Jun 09 14:55:38 +0000 2015,6.08286E+17,0,2,"Gov. Hassan, providers at Plymouth Mid-State Health Center to discuss success of bipartisan healthcare expansion plan http://t.co/3E33yYzndG",SenatorHassan,Maggie Hassan,New Hampshire,Democratic
1960,Mon Jun 08 19:36:48 +0000 2015,6.07995E+17,2,1,Governor Hassan’s Statement on Signing HB 205 https://t.co/DhSV9tNqRX,SenatorHassan,Maggie Hassan,New Hampshire,Democratic
1961,Fri Jun 05 19:45:57 +0000 2015,6.0691E+17,0,4,Gov. Hassan hosted #USNH &amp; #CCSNH leadership for signing of NH Dual Admission program MOU http://t.co/GChXaNlA5o http://t.co/4FyY1fQPDC,SenatorHassan,Maggie Hassan,New Hampshire,Democratic
1962,Thu Jun 04 23:14:50 +0000 2015,6.066E+17,1,1,Governor Hassan’s Statement on Amendment to HB 550 https://t.co/dMcD6Ooe6j,SenatorHassan,Maggie Hassan,New Hampshire,Democratic
1963,Thu Jun 04 21:39:16 +0000 2015,6.06576E+17,0,1,Statement from Governor Hassan on Senate Budget https://t.co/CKw14LlHLR,SenatorHassan,Maggie Hassan,New Hampshire,Democratic
1964,Thu Jun 04 13:30:09 +0000 2015,6.06453E+17,0,1,"“Wishing a very happy birthday to my friend and colleague, Councilor @ChrisPappasNH!” ~ Gov. Hassan",SenatorHassan,Maggie Hassan,New Hampshire,Democratic
1965,Wed Jun 03 20:13:19 +0000 2015,6.06192E+17,0,5,Governor Hassan Applauds House Passage of SB 221 https://t.co/QIWG1sDxGE,SenatorHassan,Maggie Hassan,New Hampshire,Democratic
1966,Wed Jun 03 18:59:07 +0000 2015,6.06173E+17,0,5,"Gov. Hassan to @grtrmanchester : We Must “Work Toward a Compromise, Bipartisan Budget that Moves NH Forward.”http://t.co/IEUdh5la1H",SenatorHassan,Maggie Hassan,New Hampshire,Democratic
1967,Wed Jun 03 18:42:30 +0000 2015,6.06169E+17,1,1,Governor Hassan Applauds House Passage of Uniform Securities Act https://t.co/puwtKfaKnF,SenatorHassan,Maggie Hassan,New Hampshire,Democratic
1968,Wed Jun 03 12:18:01 +0000 2015,6.06072E+17,0,5,Gov. Hassan addresses the @grtrmanchester Chamber of Commerce at their State of the State Breakfast Forum http://t.co/rnbly6d76r,SenatorHassan,Maggie Hassan,New Hampshire,Democratic
1969,Tue Jun 02 21:43:46 +0000 2015,6.05852E+17,0,6,.@pickup_patrol @livefreestart A great meeting with an exciting company that represents the entrepreneurial spirit that NH is known for!,SenatorHassan,Maggie Hassan,New Hampshire,Democratic
1970,Tue Jun 02 19:52:21 +0000 2015,6.05824E+17,1,2,Governor Hassan’s Veto Message Regarding HB 122 https://t.co/SYoc3X0Jxz,SenatorHassan,Maggie Hassan,New Hampshire,Democratic
1971,Tue Jun 02 18:15:33 +0000 2015,6.058E+17,0,2,Governor Hassan’s Veto Message Regarding HB 151 https://t.co/omXkx9zLIk,SenatorHassan,Maggie Hassan,New Hampshire,Democratic
1972,Tue Jun 02 15:02:50 +0000 2015,6.05751E+17,0,2,Statement from Governor Hassan on Signing on HB 136 https://t.co/nitzyTApi6,SenatorHassan,Maggie Hassan,New Hampshire,Democratic
1973,Tue Jun 02 14:02:55 +0000 2015,6.05736E+17,1,5,Governor Hassan’s Statement on Signing on HB 271 https://t.co/9GuoR01Eos,SenatorHassan,Maggie Hassan,New Hampshire,Democratic
1974,Sun May 31 02:06:41 +0000 2015,6.04831E+17,0,15,"""Tom, Ben, Meg and I are sending our thoughts and prayers to the Bidens during this very difficult and sad time."" ~ Gov. Hassan",SenatorHassan,Maggie Hassan,New Hampshire,Democratic
1975,Sat May 30 19:23:49 +0000 2015,6.0473E+17,0,8,Gov. Hassan honors our fallen heroes at the State Veterans Cemetery Memorial Day ceremony in Boscawen this morning http://t.co/SIx8IF1evE,SenatorHassan,Maggie Hassan,New Hampshire,Democratic
1976,Thu May 28 19:28:33 +0000 2015,6.04006E+17,0,2,"Gov. Hassan w/ @_SNHHS in Nashua this morning, highlighting success of NH's bipartisan health care expansion plan http://t.co/FYbyDvONRN",SenatorHassan,Maggie Hassan,New Hampshire,Democratic
1977,Thu May 28 13:22:46 +0000 2015,6.03914E+17,0,8,Governor Hassan Expresses Serious Concerns about Senate Finance Budget http://t.co/sA4kIldAB9,SenatorHassan,Maggie Hassan,New Hampshire,Democratic
1978,Wed May 27 21:35:05 +0000 2015,6.03676E+17,1,3,Great visit this afternoon to @GirlsIncNH in Concord http://t.co/zLKZDPkudX,SenatorHassan,Maggie Hassan,New Hampshire,Democratic
1979,Tue May 26 15:10:05 +0000 2015,6.03217E+17,0,3,Gov. Hassan marks Older Americans Month at the Ingram Senior Center in Salem http://t.co/5vddE72UyM,SenatorHassan,Maggie Hassan,New Hampshire,Democratic
1980,Mon May 25 12:13:02 +0000 2015,6.0281E+17,1,7,It is an honor to remember our heroes and their families on Memorial Day,SenatorHassan,Maggie Hassan,New Hampshire,Democratic
1981,Fri May 22 14:37:28 +0000 2015,6.01759E+17,2,12,Gov. Hassan honors our fallen heroes and their families at the Law Enforcement Memorial in Concord http://t.co/2igUhmzial,SenatorHassan,Maggie Hassan,New Hampshire,Democratic
1982,Fri May 22 14:01:26 +0000 2015,6.0175E+17,0,2,"Flags to Half-Staff in Observance of Memorial Day on Monday, May 25, and Saturday, May 30 http://t.co/jCczzmSXN4",SenatorHassan,Maggie Hassan,New Hampshire,Democratic
1983,Thu May 21 20:17:33 +0000 2015,6.01482E+17,0,1,Statement from Governor Hassan on Signing SB 31 https://t.co/GIIKiYLRA1,SenatorHassan,Maggie Hassan,New Hampshire,Democratic
1984,Wed May 20 20:49:03 +0000 2015,6.01128E+17,0,2,Governor Hassan’s Statement on Signing SB 30 https://t.co/9EAnT6qTqd,SenatorHassan,Maggie Hassan,New Hampshire,Democratic
1985,Wed May 20 20:28:10 +0000 2015,6.01122E+17,4,7,"Gov. Hassan signs SB 30, bipartisan bill that is an important step forward for the Balsams redevelopment project http://t.co/dOgISM76Ck",SenatorHassan,Maggie Hassan,New Hampshire,Democratic
1986,Tue May 19 18:21:47 +0000 2015,6.00728E+17,1,1,Gov. Hassan visits the completed renovations of Stevens High School in Claremont http://t.co/t8IZdBHAio,SenatorHassan,Maggie Hassan,New Hampshire,Democratic
1987,Tue May 19 14:12:36 +0000 2015,6.00665E+17,1,2,Gov. Hassan visits Itaconix in Stratham #InnovateNH http://t.co/pJBBAZKYtl,SenatorHassan,Maggie Hassan,New Hampshire,Democratic
1988,Mon May 18 19:15:27 +0000 2015,6.00379E+17,2,4,"Gov. Hassan speaks at the ""Ribbon Chopping"" for the new @USFoods distribution center in Seabrook http://t.co/rts9HkYYax",SenatorHassan,Maggie Hassan,New Hampshire,Democratic
1989,Mon May 18 15:25:45 +0000 2015,6.00321E+17,1,5,Gov. Hassan joins @wkxlnh for the ribbon cutting of their new studio on Main Street in Concord http://t.co/tmKBJ1k1ZX,SenatorHassan,Maggie Hassan,New Hampshire,Democratic
1990,Sat May 16 18:22:12 +0000 2015,5.99641E+17,1,7,"On #ArmedForcesDay, we're proud to honor and thank all of the men and women who bravely serve and defend our freedoms",SenatorHassan,Maggie Hassan,New Hampshire,Democratic
1991,Fri May 15 15:07:09 +0000 2015,5.9923E+17,1,2,Gov. Hassan joins the NH Good Roads Association infrastructure bus tour at the new Fed Ex building in Londonderry http://t.co/pDV0AoDb29,SenatorHassan,Maggie Hassan,New Hampshire,Democratic
1992,Fri May 15 13:09:59 +0000 2015,5.992E+17,2,2,Gov. Hassan joins Mike Pomp for Open Mic on WTSN AM 1270. On now! http://t.co/K58StJwXb7,SenatorHassan,Maggie Hassan,New Hampshire,Democratic
1993,Thu May 14 18:33:47 +0000 2015,5.98919E+17,0,4,Gov. Hassan visits with Green Acres Elementary FIRST Junior STEAM Ahead students in Manchester http://t.co/aBTup9vtuy,SenatorHassan,Maggie Hassan,New Hampshire,Democratic
1994,Tue May 12 21:13:36 +0000 2015,5.98235E+17,1,8,Gov. Hassan is proud to support the @DrugFreeNH Check the Stats campaign #pledge2talk http://t.co/SOCtfgfVaz http://t.co/l6vMhxQOw9,SenatorHassan,Maggie Hassan,New Hampshire,Democratic
1995,Tue May 12 19:33:47 +0000 2015,5.98209E+17,0,1,Governor Hassan’s Statement on Manchester Police Chief David Mara https://t.co/Qdi9YiH7qh,SenatorHassan,Maggie Hassan,New Hampshire,Democratic
1996,Tue May 12 17:34:44 +0000 2015,5.9818E+17,0,3,Gov. Hassan thanks volunteers across the state and @VolunteerNH at the Governor's Conference on Volunteerism http://t.co/4mftO8Ttvj,SenatorHassan,Maggie Hassan,New Hampshire,Democratic
1997,Mon May 11 16:13:17 +0000 2015,5.97797E+17,0,1,Governor Hassan Appeals FEMA Decision to Deny Disaster Extension for January Blizzard http://t.co/1u80Ljn4Uo,SenatorHassan,Maggie Hassan,New Hampshire,Democratic
1998,Mon May 11 15:45:16 +0000 2015,5.9779E+17,0,3,Gov. Hassan speaks the #CCSNH Running Start Advocates Awards in Concord http://t.co/lbVjhNELrF,SenatorHassan,Maggie Hassan,New Hampshire,Democratic
1999,Sun May 10 20:23:00 +0000 2015,5.97497E+17,1,5,Wishing mothers everywhere the happiest of Mother's Days!,SenatorHassan,Maggie Hassan,New Hampshire,Democratic
2000,Sat May 09 19:09:05 +0000 2015,5.97116E+17,0,2,Gov. Hassan at the @ksc_web commencement this afternoon http://t.co/tX5uuGn1iT,SenatorHassan,Maggie Hassan,New Hampshire,Democratic
2001,Fri May 08 14:57:06 +0000 2015,5.9669E+17,0,4,Governor Hassan’s Veto Message Regarding SB 101 https://t.co/B25aWYrIUA,SenatorHassan,Maggie Hassan,New Hampshire,Democratic
2002,Thu May 07 20:35:02 +0000 2015,5.96413E+17,0,3,"Earlier at the State House, Gov. Hassan proclaimed today as Children's Mental Health Awareness Day in NH http://t.co/yJjTYXsRZS",SenatorHassan,Maggie Hassan,New Hampshire,Democratic
2003,Thu May 07 19:46:35 +0000 2015,5.96401E+17,0,2,Governor Hassan’s Statement on Signing Senate Bill 47 https://t.co/1Km7whcYsO,SenatorHassan,Maggie Hassan,New Hampshire,Democratic
2004,Thu May 07 19:20:16 +0000 2015,5.96394E+17,4,27,Gov. Hassan signs bill making NH first state to prohibit paying sub-min. wage to those who experience disabilities http://t.co/K5vcaGkXwP,SenatorHassan,Maggie Hassan,New Hampshire,Democratic
2005,Thu May 07 17:44:02 +0000 2015,5.9637E+17,0,3,Gov. Hassan speaks at the GE Aviation expansion groundbreaking in Hooksett http://t.co/g4FqI3kQUH,SenatorHassan,Maggie Hassan,New Hampshire,Democratic
2006,Wed May 06 16:20:44 +0000 2015,5.95987E+17,1,2,Governor Hassan’s Statement on Senate Bill 30 https://t.co/2mYqHYyERJ,SenatorHassan,Maggie Hassan,New Hampshire,Democratic
2007,Wed May 06 15:11:34 +0000 2015,5.95969E+17,0,3,Gov. Hassan and the @NHSpeaker with the historic U.S. Centennial Broadside Document this morning at the State House http://t.co/Cx9btPB2CF,SenatorHassan,Maggie Hassan,New Hampshire,Democratic
2008,Tue May 05 20:25:55 +0000 2015,5.95686E+17,0,1,Gov. Hassan speaks at the Governor's Conference on Tourism in Keene http://t.co/gFnkqRd2tb,SenatorHassan,Maggie Hassan,New Hampshire,Democratic
2009,Tue May 05 19:07:17 +0000 2015,5.95666E+17,0,2,Governor Hassan and HHS to Implement House Finance Plan to Restore Funds for Rate Increase for Nursing Homes http://t.co/22zbm8oQrY,SenatorHassan,Maggie Hassan,New Hampshire,Democratic
2010,Tue May 05 18:31:48 +0000 2015,5.95657E+17,2,7,"On #TeacherAppreciationDay, we thank all of our teachers for helping to prepare our young people for future success #ThankATeacher",SenatorHassan,Maggie Hassan,New Hampshire,Democratic
2011,Tue May 05 14:28:24 +0000 2015,5.95596E+17,0,5,Gov. Hassan visits Omni Components in Hudson http://t.co/H1m2bWSAK1,SenatorHassan,Maggie Hassan,New Hampshire,Democratic
2012,Fri May 01 21:04:55 +0000 2015,5.94246E+17,1,1,"@gabie569 Gabie, please contact our office directly at (603) 271-2121",SenatorHassan,Maggie Hassan,New Hampshire,Democratic
2013,Fri May 01 15:35:38 +0000 2015,5.94163E+17,0,3,"Governor Hassan Announces Job Training Grants for 
Five New Hampshire Companies in April http://t.co/fpu3cEulQL",SenatorHassan,Maggie Hassan,New Hampshire,Democratic
2014,Thu Apr 30 19:06:37 +0000 2015,5.93854E+17,0,1,Governor Hassan’s Statement on Federal Fishery Disaster Funds http://t.co/7xXB3JQqzN,SenatorHassan,Maggie Hassan,New Hampshire,Democratic
2015,Thu Apr 30 15:09:28 +0000 2015,5.93794E+17,1,5,Gov. Hassan visits the @NewHampshireDOT shed in Rye to discuss the need to responsibly fund DOT http://t.co/jiS170d9nk,SenatorHassan,Maggie Hassan,New Hampshire,Democratic
2016,Wed Apr 29 21:21:02 +0000 2015,5.93525E+17,1,5,"Congrats to Rochester @SafranUSA, a semifinalist in @ACT's 2015 College &amp; Career Readiness Campaign! #ACTReadiness http://t.co/nW9nBFjiNu",SenatorHassan,Maggie Hassan,New Hampshire,Democratic
2017,Wed Apr 29 20:34:38 +0000 2015,5.93514E+17,0,1,Brookings Ranks @NHTI First in the Nation in “Value-Added” http://t.co/uYlHhPpJpb,SenatorHassan,Maggie Hassan,New Hampshire,Democratic
2018,Wed Apr 29 13:58:34 +0000 2015,5.93414E+17,3,3,Governor Hassan’s Statement on Senate Bill 116 https://t.co/YIf4NXrLjm,SenatorHassan,Maggie Hassan,New Hampshire,Democratic
2019,Wed Apr 29 02:03:56 +0000 2015,5.93234E+17,0,2,"""Congrats to Rep-elect Dennis Green - I look forward to working with you to build a stronger, more innovative New Hampshire."" - Gov. Hassan",SenatorHassan,Maggie Hassan,New Hampshire,Democratic
2020,Tue Apr 28 19:05:33 +0000 2015,5.93129E+17,0,2,"To support disaster relief in Nepal, visit this link to learn about how various organizations use your donation http://t.co/psbXdNLiNe",SenatorHassan,Maggie Hassan,New Hampshire,Democratic
2021,Tue Apr 28 15:03:01 +0000 2015,5.93068E+17,0,4,Gov. Hassan at Genesis Behavioral Health in Plymouth to discuss importance of bipartisan health care expansion plan http://t.co/9yeM6ULnaM,SenatorHassan,Maggie Hassan,New Hampshire,Democratic
2022,Tue Apr 28 12:28:16 +0000 2015,5.93029E+17,2,9,Standing with those fighting for love and equality for all at the Supreme Court today,SenatorHassan,Maggie Hassan,New Hampshire,Democratic
2023,Tue Apr 28 12:08:01 +0000 2015,5.93024E+17,0,3,Gov. Hassan delivers State of the State address to the Portsmouth Chamber of Commerce http://t.co/2j4eoC6FO2,SenatorHassan,Maggie Hassan,New Hampshire,Democratic
2024,Sat Apr 25 19:45:21 +0000 2015,5.92052E+17,0,5,Sending thoughts and prayers to Nepal after the tragic earthquake,SenatorHassan,Maggie Hassan,New Hampshire,Democratic
2025,Fri Apr 24 20:17:15 +0000 2015,5.91697E+17,0,5,Governor Hassan’s Statement on Senate Bill 113 https://t.co/tR0PpXXPnw,SenatorHassan,Maggie Hassan,New Hampshire,Democratic
2026,Thu Apr 23 17:49:33 +0000 2015,5.91298E+17,1,1,New England Governors Commit to Continuing Common Approach to Regional Energy Challenges http://t.co/4IEd7BUzxD,SenatorHassan,Maggie Hassan,New Hampshire,Democratic
