,created_at,id_str,reply_count,retweet_count,text,user,name,state,party
0,Sat May 20 21:07:42 +0000 2017,8.66038E+17,0,6,Congratulations @UNHLaw and River Valley Community College Classes of 2017 - I can't wait to see what you accomplis… https://t.co/G860nRtrXe,SenatorHassan,Maggie Hassan,New Hampshire,Democratic
1,Sat May 20 19:00:16 +0000 2017,8.66006E+17,0,13,"Thank you to all the brave Granite Staters and Americans who serve to keep us safe, secure &amp; free #ArmedForcesDay",SenatorHassan,Maggie Hassan,New Hampshire,Democratic
2,Fri May 19 20:59:15 +0000 2017,8.65673E+17,3,11,I was honored to attend the NH Law Enforcement Officers Memorial Ceremony - a reminder of how much we owe those who… https://t.co/YD8IYoO2km,SenatorHassan,Maggie Hassan,New Hampshire,Democratic
3,Fri May 19 19:48:30 +0000 2017,8.65655E+17,0,5,"Thank you, American Legion Department of NH Convention, for having me today to discuss how we must do more for vete… https://t.co/v7jZCvcsnD",SenatorHassan,Maggie Hassan,New Hampshire,Democratic
4,Fri May 19 18:06:06 +0000 2017,8.6563E+17,9,14,.@SenatorShaheen &amp; I cosponsored legislation to prevent credit discrimination against LGBTQ Americans. Read more: https://t.co/MI12Wuh8Fo,SenatorHassan,Maggie Hassan,New Hampshire,Democratic
5,Fri May 19 16:42:35 +0000 2017,8.65609E+17,0,5,"Great to be at the NH Forum on the Future, talking with business leaders &amp; educators about what we need to do to su… https://t.co/75yzplEXO5",SenatorHassan,Maggie Hassan,New Hampshire,Democratic
6,Fri May 19 15:57:13 +0000 2017,8.65597E+17,3,17,"Trump's budget proposal would be devastating to Friendship House, the only residential drug treatment center in NH'… https://t.co/GoxK5l79fm",SenatorHassan,Maggie Hassan,New Hampshire,Democratic
7,Fri May 19 15:39:39 +0000 2017,8.65593E+17,1,4,Important story on NH substance misuse advocates who are troubled by the Trump Administration’s actions so far… https://t.co/VOzYXaydVA,SenatorHassan,Maggie Hassan,New Hampshire,Democratic
8,Thu May 18 19:17:24 +0000 2017,8.65285E+17,1,25,Check out my latest @Medium post about why it’s so critical that we protect Net Neutrality rules: https://t.co/ssWqVaInuM,SenatorHassan,Maggie Hassan,New Hampshire,Democratic
9,Thu May 18 18:38:14 +0000 2017,8.65275E+17,3,23,"#Trumpcare cuts NH’s Medicaid funding for children by nearly 20 percent, according to this new study. I’ll fight to… https://t.co/IXHEF5O5qy",SenatorHassan,Maggie Hassan,New Hampshire,Democratic
10,Thu May 18 17:52:16 +0000 2017,8.65264E+17,4,8,"This #InfrastructureWeek, let’s recommit to investing in our roads, bridges &amp; so much more for the good of our economy &amp; safety #TimetoBuild",SenatorHassan,Maggie Hassan,New Hampshire,Democratic
11,Thu May 18 14:46:49 +0000 2017,8.65217E+17,4,8,I will fight this dangerous proposal &amp; continue working to improve our public education system so that all students have equal opportunity.,SenatorHassan,Maggie Hassan,New Hampshire,Democratic
12,Thu May 18 14:46:23 +0000 2017,8.65217E+17,5,19,"This is the misguided Trump-DeVos agenda of diverting taxpayer dollars to private, religious, &amp; for-profit schools without accountability.",SenatorHassan,Maggie Hassan,New Hampshire,Democratic
13,Thu May 18 14:45:59 +0000 2017,8.65217E+17,8,70,This proposal from President Trump &amp; Secretary DeVos would be nothing short of a disaster for our public education… https://t.co/tEa0OjwaWq,SenatorHassan,Maggie Hassan,New Hampshire,Democratic
14,Thu May 18 00:32:37 +0000 2017,8.65002E+17,0,2,The Eastern Conference Finals begin tonight! Let's go @Celtics! #ItsNotLuck #BeatCleveland,SenatorHassan,Maggie Hassan,New Hampshire,Democratic
15,Wed May 17 22:53:30 +0000 2017,8.64977E+17,7,23,My statement on former FBI Director Robert Mueller's appointment as special counsel: https://t.co/nY4mCdMJrP https://t.co/1cL79EOYD7,SenatorHassan,Maggie Hassan,New Hampshire,Democratic
16,Wed May 17 21:35:44 +0000 2017,8.64958E+17,1,7,"Today, I discussed a bill I’m cosponsoring w/ @SenatorShaheen to help prevent opioid misuse among student athletes: https://t.co/sCyU5EMB4V",SenatorHassan,Maggie Hassan,New Hampshire,Democratic
17,Wed May 17 21:18:48 +0000 2017,8.64953E+17,5,16,.@SenatorShaheen &amp; I are cosponsoring @SenWarren bill to make it easier to refinance student loan debt. Learn more: https://t.co/dDYUqHCcKT,SenatorHassan,Maggie Hassan,New Hampshire,Democratic
18,Wed May 17 21:01:15 +0000 2017,8.64949E+17,1,9,I was proud to cosponsor the resolution designating this week National Senior Corps Week #SeniorCorpsWorks https://t.co/Qk2Pm51gjS,SenatorHassan,Maggie Hassan,New Hampshire,Democratic
19,Wed May 17 19:53:51 +0000 2017,8.64932E+17,5,22,I strongly oppose changes that would undermine #NetNeutrality. Here’s what I said on the Senate floor today: https://t.co/mOxLGcrOB4,SenatorHassan,Maggie Hassan,New Hampshire,Democratic
20,Wed May 17 19:40:49 +0000 2017,8.64929E+17,4,14,I’m talking on the Senate floor shortly about why #NetNeutrality rules are so important. Tune in: https://t.co/mOxLGcrOB4,SenatorHassan,Maggie Hassan,New Hampshire,Democratic
21,Wed May 17 18:31:44 +0000 2017,8.64911E+17,10,47,"I will stand strong with the people of New Hampshire, my colleagues, &amp; educators in fighting against this dangerous #Trumpcare bill",SenatorHassan,Maggie Hassan,New Hampshire,Democratic
22,Wed May 17 18:31:25 +0000 2017,8.64911E+17,3,12,We cannot afford to go back to the days when we marginalize or don’t assist some of our most vulnerable students,SenatorHassan,Maggie Hassan,New Hampshire,Democratic
23,Wed May 17 18:31:11 +0000 2017,8.64911E+17,4,14,"Without the support from Medicaid, school districts would be faced with cutting services like school nurses &amp; behavioral health services",SenatorHassan,Maggie Hassan,New Hampshire,Democratic
24,Wed May 17 18:30:49 +0000 2017,8.64911E+17,1,10,"#Trumpcare actually makes things even worse than they were before the ACA, with drastic changes and cuts to traditional Medicaid",SenatorHassan,Maggie Hassan,New Hampshire,Democratic
25,Wed May 17 18:30:31 +0000 2017,8.64911E+17,11,103,"Children like my son are able to go to school &amp; participate in their communities because of Medicaid, now under threat by #TrumpCare",SenatorHassan,Maggie Hassan,New Hampshire,Democratic
26,Wed May 17 18:30:07 +0000 2017,8.64911E+17,3,12,"@SenBobCasey I approach issues of education and health care as a Senator, a former Governor, and the mom of a son w… https://t.co/tO40k1T4Gj",SenatorHassan,Maggie Hassan,New Hampshire,Democratic
27,Wed May 17 18:29:50 +0000 2017,8.64911E+17,16,110,I joined @SenBobCasey &amp; advocates to discuss how devastating #Trumpcare would be for students with disabilities: https://t.co/x5npEokG2t,SenatorHassan,Maggie Hassan,New Hampshire,Democratic
28,Wed May 17 17:35:05 +0000 2017,8.64897E+17,0,3,Encouraging everyone to check out these great student projects highlighting the danger of substance misuse… https://t.co/Lj2iqBQPvx,SenatorHassan,Maggie Hassan,New Hampshire,Democratic
29,Wed May 17 17:18:52 +0000 2017,8.64893E+17,2,17,"63 years after Brown v. Board of Education, we must continue to push for full equality of opportunity in our nation… https://t.co/uoCE8UAzDm",SenatorHassan,Maggie Hassan,New Hampshire,Democratic
30,Wed May 17 13:56:23 +0000 2017,8.64842E+17,0,3,"Glad to see you’re ok, @SenThomTillis! https://t.co/k36qmDqV9p",SenatorHassan,Maggie Hassan,New Hampshire,Democratic
31,Tue May 16 21:39:21 +0000 2017,8.64596E+17,2,4,@SenatorShaheen .@SenatorShaheen &amp; I are fighting reckless proposals to eliminate the WH office that coordinates th… https://t.co/H1uoss95sC,SenatorHassan,Maggie Hassan,New Hampshire,Democratic
32,Tue May 16 21:17:15 +0000 2017,8.64591E+17,2,6,"You’re a fighter and an inspiration to us all, Mazie. Sending thoughts and love your way. https://t.co/6cQGFwCDza",SenatorHassan,Maggie Hassan,New Hampshire,Democratic
33,Tue May 16 18:48:14 +0000 2017,8.64553E+17,2,7,Advocates &amp; those on the front lines agree: #Trumpcare would undermine our efforts to combat the opioid epidemic https://t.co/60rTBdBSu4,SenatorHassan,Maggie Hassan,New Hampshire,Democratic
34,Tue May 16 17:26:47 +0000 2017,8.64533E+17,0,2,"Always fun to welcome New Hampshire students to Washington – thanks for stopping by, Shaker Road School! https://t.co/zpDTU4mX2a",SenatorHassan,Maggie Hassan,New Hampshire,Democratic
35,Tue May 16 16:12:00 +0000 2017,8.64514E+17,0,3,"I'll continue working to defeat #Trumpcare, &amp; I stand ready to work with both parties to support those on the front lines &amp; help save lives.",SenatorHassan,Maggie Hassan,New Hampshire,Democratic
36,Tue May 16 16:11:38 +0000 2017,8.64514E+17,1,5,So @SenatorShaheen and I are introducing a bill to reauthorize and expand the Office of National Drug Control Policy,SenatorHassan,Maggie Hassan,New Hampshire,Democratic
37,Tue May 16 16:11:19 +0000 2017,8.64514E+17,1,4,.@POTUS has proposed effectively eliminating the office responsible for coordinating the federal response to this crisis,SenatorHassan,Maggie Hassan,New Hampshire,Democratic
38,Tue May 16 16:10:53 +0000 2017,8.64513E+17,1,6,"We need to be strengthening prevention, treatment, &amp; recovery efforts, not pulling the rug out from under those in the throes of addiction",SenatorHassan,Maggie Hassan,New Hampshire,Democratic
39,Tue May 16 16:10:31 +0000 2017,8.64513E+17,1,3,#Trumpcare also undermines the requirement that insurance companies must cover mental health and substance use disorder services,SenatorHassan,Maggie Hassan,New Hampshire,Democratic
40,Tue May 16 16:09:58 +0000 2017,8.64513E+17,2,5,"#Trumpcare ends Medicaid expansion, which experts have said is the number one tool we have to fight the substance misuse crisis",SenatorHassan,Maggie Hassan,New Hampshire,Democratic
41,Tue May 16 16:09:36 +0000 2017,8.64513E+17,1,4,#Trumpcare would hurt hard-working people across NH &amp; America – particularly harming efforts to combat the substance misuse crisis,SenatorHassan,Maggie Hassan,New Hampshire,Democratic
42,Tue May 16 16:09:16 +0000 2017,8.64513E+17,3,4,"I am grateful that the Trump Administration has discussed the severity of this crisis, but their actions so far don’t match their words",SenatorHassan,Maggie Hassan,New Hampshire,Democratic
43,Tue May 16 16:08:48 +0000 2017,8.64513E+17,2,3,"The heroin, fentanyl, &amp; opioid crisis is devastating communities all over America, &amp; it's the most pressing public health challenge NH faces",SenatorHassan,Maggie Hassan,New Hampshire,Democratic
44,Tue May 16 15:17:38 +0000 2017,8.645E+17,9,37,Joining @SenatorShaheen &amp; others to discuss how #Trumpcare undermines the fight against substance misuse. Tune in: https://t.co/BLkj5QcQrX,SenatorHassan,Maggie Hassan,New Hampshire,Democratic
45,Tue May 16 02:44:51 +0000 2017,8.64311E+17,3,8,.@Celtics win! Bring it on @KingJames! #ItsNotLuck,SenatorHassan,Maggie Hassan,New Hampshire,Democratic
46,Tue May 16 01:23:54 +0000 2017,8.6429E+17,3,8,There's nothing like Game 7! Ready for a big second half from the @celtics! #ItsNotLuck,SenatorHassan,Maggie Hassan,New Hampshire,Democratic
47,Sun May 14 15:00:44 +0000 2017,8.63771E+17,7,37,We are losing too many of our people – including mothers – to the opioid epidemic. Read my Op-Ed for @Refinery29: https://t.co/KwHnvCESp8,SenatorHassan,Maggie Hassan,New Hampshire,Democratic
48,Sat May 13 18:23:53 +0000 2017,8.6346E+17,5,6,Great to join women – and men – picking up tools to improve the community for @NashuaHabitat #WomenBuild Week https://t.co/n1hhtjOrnl,SenatorHassan,Maggie Hassan,New Hampshire,Democratic
49,Sat May 13 15:56:24 +0000 2017,8.63423E+17,1,9,We will always remember Officer Arkell and his commitment to service. Today’s 5k in Brentwood was another great tri… https://t.co/r4UbeY2tWI,SenatorHassan,Maggie Hassan,New Hampshire,Democratic
50,Fri May 12 23:43:49 +0000 2017,8.63178E+17,1,3,Game time! Let's finish this series @Celtics! #ItsNotLuck,SenatorHassan,Maggie Hassan,New Hampshire,Democratic
51,Fri May 12 20:03:54 +0000 2017,8.63123E+17,3,5,We must protect critical programs that older Americans rely on. Great celebrating #OAM17 at the NH Assoc. of Senior Centers Conference today,SenatorHassan,Maggie Hassan,New Hampshire,Democratic
52,Fri May 12 19:22:51 +0000 2017,8.63112E+17,2,33,"Too many grandmothers become moms again because of the opioid crisis. This Mother’s Day, I’m honoring their stories: https://t.co/KwHnvCESp8",SenatorHassan,Maggie Hassan,New Hampshire,Democratic
53,Fri May 12 14:46:16 +0000 2017,8.63043E+17,3,7,Great time with @SenatorShaheen updating folks on the federal issues we’re working on to fight for Granite Staters… https://t.co/fTUq2Tk0eB,SenatorHassan,Maggie Hassan,New Hampshire,Democratic
54,Fri May 12 14:45:14 +0000 2017,8.63042E+17,2,2,Thanks for having us! https://t.co/8xQENgoFVV,SenatorHassan,Maggie Hassan,New Hampshire,Democratic
55,Thu May 11 20:36:34 +0000 2017,8.62768E+17,3,10,Excited to join @SenSanders in introducing legislation to help encourage and expand employee-owned companies: https://t.co/CsbYugjH91,SenatorHassan,Maggie Hassan,New Hampshire,Democratic
56,Thu May 11 19:50:09 +0000 2017,8.62757E+17,3,16,"Women in NH &amp; around the country deserve better than #Trumpcare, and I’ll do everything I can to make sure it doesn't become reality.",SenatorHassan,Maggie Hassan,New Hampshire,Democratic
57,Thu May 11 19:49:05 +0000 2017,8.62756E+17,5,10,"And #Trumpcare attacks women’s health care by defunding Planned Parenthood, jeopardizing critical services for thousands of NH women.",SenatorHassan,Maggie Hassan,New Hampshire,Democratic
58,Thu May 11 19:48:35 +0000 2017,8.62756E+17,1,6,It would end the requirement that insurance companies must cover essential health benefits – including maternity care.,SenatorHassan,Maggie Hassan,New Hampshire,Democratic
59,Thu May 11 19:48:10 +0000 2017,8.62756E+17,2,9,"If you are a mother, giving birth could now be considered a pre-existing condition.",SenatorHassan,Maggie Hassan,New Hampshire,Democratic
60,Thu May 11 19:47:36 +0000 2017,8.62756E+17,1,6,It’s clear that #Trumpcare would hurt hard-working Granite Staters &amp; Americans – particularly women,SenatorHassan,Maggie Hassan,New Hampshire,Democratic
61,Thu May 11 19:09:14 +0000 2017,8.62746E+17,8,26,Joining my colleagues &amp; women’s health advocates to highlight what a disaster #Trumpcare is for women. Tune in: https://t.co/Fhkt3dmHS0,SenatorHassan,Maggie Hassan,New Hampshire,Democratic
62,Thu May 11 17:22:26 +0000 2017,8.6272E+17,3,2,The HELP Committee approved two bipartisan bills that I authored/cosponsored today. Learn more: https://t.co/DMRsSyR6eJ,SenatorHassan,Maggie Hassan,New Hampshire,Democratic
63,Wed May 10 21:55:30 +0000 2017,8.62426E+17,1,3,Great to see young Granite Staters engaging in the fight against substance misuse. Tune in to @WMUR9 at 7pm to hear… https://t.co/Gx1fAmWcs8,SenatorHassan,Maggie Hassan,New Hampshire,Democratic
64,Wed May 10 19:44:05 +0000 2017,8.62393E+17,4,16,I hope that @SecPriceMD listened closely and learned from the people of New Hampshire today. https://t.co/qCeomZ5S4P,SenatorHassan,Maggie Hassan,New Hampshire,Democratic
65,Wed May 10 19:43:22 +0000 2017,8.62393E+17,3,32,I'm also deeply concerned by reports that @POTUS is considering eliminating the office that coordinates the federal response to this crisis,SenatorHassan,Maggie Hassan,New Hampshire,Democratic
66,Wed May 10 19:42:52 +0000 2017,8.62393E+17,4,8,Ending NH's bipartisan Medicaid expansion &amp; undermining requirement that insurance companies cover substance misuse treatment is WRONG,SenatorHassan,Maggie Hassan,New Hampshire,Democratic
67,Wed May 10 19:42:17 +0000 2017,8.62392E+17,2,8,.@SecPriceMD: The #Trumpcare bill you’re pushing would be devastating to those on the front lines of this crisis.,SenatorHassan,Maggie Hassan,New Hampshire,Democratic
68,Wed May 10 19:41:56 +0000 2017,8.62392E+17,8,12,"I appreciate @SecPriceMD's visit to NH to highlight the substance misuse crisis, but the Trump admin continues to pursue backward policies",SenatorHassan,Maggie Hassan,New Hampshire,Democratic
69,Wed May 10 18:20:24 +0000 2017,8.62372E+17,4,13,I’m participating in a hearing on the harmful impact #Trumpcare would have on NH &amp; America. Watch: https://t.co/MhDff5Aaca #AmericaSpeaksOut,SenatorHassan,Maggie Hassan,New Hampshire,Democratic
70,Tue May 09 22:57:41 +0000 2017,8.62079E+17,51,100,My statement on President Trump’s firing of FBI Director James Comey: https://t.co/kThlghd1YI https://t.co/D04fdGsnwn,SenatorHassan,Maggie Hassan,New Hampshire,Democratic
71,Tue May 09 20:22:42 +0000 2017,8.6204E+17,2,2,Congrats to @GYKAntler &amp; @BadgerBalmUSA indeed! https://t.co/VgRcecgLYO,SenatorHassan,Maggie Hassan,New Hampshire,Democratic
72,Tue May 09 19:45:48 +0000 2017,8.62031E+17,6,10,.@SenatorShaheen &amp; I are speaking out about how #Trumpcare is wrong for New Hampshire &amp; America. cc: @SecPriceMD https://t.co/5jPXbeSWlX,SenatorHassan,Maggie Hassan,New Hampshire,Democratic
73,Tue May 09 19:09:41 +0000 2017,8.62022E+17,0,5,And Alexandra held toy donation drives to give to patients at @chadkids. These two Granite Staters are truly impres… https://t.co/LOCGv61ytK,SenatorHassan,Maggie Hassan,New Hampshire,Democratic
74,Tue May 09 19:08:46 +0000 2017,8.62022E+17,1,3,Jacob founded a nonprofit to support those in recovery and promote educational awareness about substance misuse https://t.co/AoqGrdw0E5,SenatorHassan,Maggie Hassan,New Hampshire,Democratic
75,Tue May 09 19:08:09 +0000 2017,8.62021E+17,1,2,"It was great to meet Jacob &amp; Alexandra, two New Hampshire winners of the @PruSpirit award for exceptional volunteer work",SenatorHassan,Maggie Hassan,New Hampshire,Democratic
76,Tue May 09 15:49:42 +0000 2017,8.61971E+17,2,6,"Additionally, he has a record of putting politics before women's health &amp; disregarding science-based decisions when it comes to Plan B",SenatorHassan,Maggie Hassan,New Hampshire,Democratic
77,Tue May 09 15:49:20 +0000 2017,8.61971E+17,4,3,Dr. Gottlieb opposed risk evaluation and mitigation strategies (REMS) used to try to stem the risks associated with certain medications,SenatorHassan,Maggie Hassan,New Hampshire,Democratic
78,Tue May 09 15:48:54 +0000 2017,8.61971E+17,3,3,"The substance misuse crisis is one of the most pressing challenges facing NH, and Dr. Gottlieb opposed a key tool the FDA has to help",SenatorHassan,Maggie Hassan,New Hampshire,Democratic
79,Tue May 09 15:48:34 +0000 2017,8.61971E+17,1,2,Just spoke on the Senate floor in opposition to Dr. Gottlieb’s nomination for FDA Commissioner,SenatorHassan,Maggie Hassan,New Hampshire,Democratic
80,Tue May 09 15:39:59 +0000 2017,8.61969E+17,5,7,I'm heading to the Senator floor to explain why I can't support Dr. Scott Gottlieb for FDA Commissioner. Tune in: https://t.co/dkXk9XYEca,SenatorHassan,Maggie Hassan,New Hampshire,Democratic
81,Tue May 09 13:58:37 +0000 2017,8.61943E+17,5,12,Happy #TeacherAppreciationDay! Thank you to all of the educators who are so critical to preparing our young people for the future.,SenatorHassan,Maggie Hassan,New Hampshire,Democratic
82,Mon May 08 23:21:58 +0000 2017,8.61723E+17,7,15,"With women's health under threat by #Trumpcare, it’s important to recognize #NationalWomensCheckupDay &amp; the vital r… https://t.co/mw76aJKo9H",SenatorHassan,Maggie Hassan,New Hampshire,Democratic
83,Mon May 08 21:47:16 +0000 2017,8.61699E+17,1,10,"We can't overstate the importance of free &amp; open Internet to our nation’s economy, innovators, entrepreneurs, &amp; consumers – including women",SenatorHassan,Maggie Hassan,New Hampshire,Democratic
84,Mon May 08 21:46:53 +0000 2017,8.61699E+17,1,5,These online consumer protections are particularly important to women-owned businesses competing with more established brands &amp; content,SenatorHassan,Maggie Hassan,New Hampshire,Democratic
85,Mon May 08 21:46:22 +0000 2017,8.61699E+17,4,24,Led a letter with @SenatorCantwell urging @AjitPaiFCC to reconsider his plans to dismantle net neutrality rules: https://t.co/kx18gCdLhp,SenatorHassan,Maggie Hassan,New Hampshire,Democratic
86,Mon May 08 21:17:07 +0000 2017,8.61691E+17,1,6,"Love to see innovative teaching methods like ""Christa’s Coders,"" a club for girl coders – keep up the good work! https://t.co/wL0354ctS3",SenatorHassan,Maggie Hassan,New Hampshire,Democratic
87,Mon May 08 18:47:37 +0000 2017,8.61654E+17,14,29,This is outrageous. @EPAScottPruitt continues to put partisan politics before science &amp; smart policy-making. https://t.co/K9cGTy9VfU,SenatorHassan,Maggie Hassan,New Hampshire,Democratic
88,Mon May 08 18:14:46 +0000 2017,8.61646E+17,1,6,.@SenatorShaheen &amp; I discussed how harmful #Trumpcare would be on efforts to combat the opioid crisis. Watch here: https://t.co/UxheqP8W7k,SenatorHassan,Maggie Hassan,New Hampshire,Democratic
89,Mon May 08 18:00:03 +0000 2017,8.61642E+17,0,1,"I will keep fighting to ensure that the law enforcement community, including the dedicated agents at the @DEAHQ, have the support they need.",SenatorHassan,Maggie Hassan,New Hampshire,Democratic
90,Mon May 08 17:59:44 +0000 2017,8.61642E+17,2,1,Met with the NH DEA this morning to receive an update on the latest that they're seeing on the ground https://t.co/sfzT6pfRde,SenatorHassan,Maggie Hassan,New Hampshire,Democratic
91,Mon May 08 17:27:57 +0000 2017,8.61634E+17,1,1,Report from @NewFuturesNH shows the staggering impact of the substance misuse crisis on NH’s economy. My statement:… https://t.co/Z32Wq10kSa,SenatorHassan,Maggie Hassan,New Hampshire,Democratic
92,Mon May 08 15:52:24 +0000 2017,8.6161E+17,7,4,Check out my @EagleTrib op-ed on bipartisan bill I helped introduce to make hearing aids available over the counter… https://t.co/V5Ux8XF54Y,SenatorHassan,Maggie Hassan,New Hampshire,Democratic
93,Fri May 05 21:23:22 +0000 2017,8.60606E+17,1,10,Excited and proud of all the students reaching higher on this #CollegeSigningDay &amp; thanks to @MichelleObama for her work to support them!,SenatorHassan,Maggie Hassan,New Hampshire,Democratic
94,Fri May 05 20:01:05 +0000 2017,8.60585E+17,2,6,.@SenToddYoung Read about our bipartisan bill to help combat substance misuse here: https://t.co/CkGzerpjiU,SenatorHassan,Maggie Hassan,New Hampshire,Democratic
95,Fri May 05 20:00:08 +0000 2017,8.60585E+17,5,4,.@SenToddYoung &amp; I introduced a bipartisan bill to help ensure health care providers are aware of addiction risks of abuse-deterrent opioids,SenatorHassan,Maggie Hassan,New Hampshire,Democratic
96,Fri May 05 19:59:53 +0000 2017,8.60585E+17,2,3,Ensuring that health care providers understand the risks of abuse-deterrent opioids is critical to preventing addiction,SenatorHassan,Maggie Hassan,New Hampshire,Democratic
97,Fri May 05 19:59:42 +0000 2017,8.60585E+17,2,6,Studies show many health care providers don’t know abuse-deterrent opioids are no less addictive than other opioids https://t.co/4qJIiBO8Du,SenatorHassan,Maggie Hassan,New Hampshire,Democratic
98,Fri May 05 19:31:12 +0000 2017,8.60578E+17,2,16,Today I spoke at @UNH disability rights conference about how #Trumpcare would harm Granite Staters with disabilities https://t.co/ku6bzRTGCY,SenatorHassan,Maggie Hassan,New Hampshire,Democratic
99,Fri May 05 18:45:01 +0000 2017,8.60566E+17,9,16,.@POTUS &amp; @GOP keep trying to undermine basic preventative care for women. I’m fighting to stop that: https://t.co/pHHJRN0hW1,SenatorHassan,Maggie Hassan,New Hampshire,Democratic
100,Fri May 05 17:51:43 +0000 2017,8.60553E+17,1,14,Happy #SpaceDay! Did you know that the first American in space was a Granite Stater? Here's to Alan Shepard of Derr… https://t.co/UIeT5clhyG,SenatorHassan,Maggie Hassan,New Hampshire,Democratic
101,Fri May 05 17:30:28 +0000 2017,8.60547E+17,5,17,I joined @craigmelvin yesterday to discuss how #Trumpcare would hurt hard-working Granite Staters and Americans: https://t.co/C1g2g11ldy,SenatorHassan,Maggie Hassan,New Hampshire,Democratic
102,Fri May 05 16:38:47 +0000 2017,8.60534E+17,9,25,Don’t believe the spin. #Trumpcare would be devastating for millions of people with preexisting conditions (like as… https://t.co/4bOE6npeiD,SenatorHassan,Maggie Hassan,New Hampshire,Democratic
103,Fri May 05 16:24:56 +0000 2017,8.60531E+17,0,4,Thank you to @ManchesterFD &amp; EMS for providing a critical pathway to treatment for those struggling with substance… https://t.co/BOKsGmbSSA,SenatorHassan,Maggie Hassan,New Hampshire,Democratic
104,Fri May 05 15:48:46 +0000 2017,8.60522E+17,8,38,"In face of opioid crisis, eliminating @WhiteHouse office responsible for coordinating substance misuse policy would… https://t.co/Mhzln67aMV",SenatorHassan,Maggie Hassan,New Hampshire,Democratic
105,Thu May 04 22:13:55 +0000 2017,8.60256E+17,8,6,My statement on the Senate's approval of a government funding agreement with additional resources to combat substan… https://t.co/TX8grcO89D,SenatorHassan,Maggie Hassan,New Hampshire,Democratic
106,Thu May 04 21:41:42 +0000 2017,8.60248E+17,5,5,Thank you @ncl_tweets for endorsing my bill to protect travelers &amp; help prevent incidents like we saw with @united… https://t.co/5e9GGXr9py,SenatorHassan,Maggie Hassan,New Hampshire,Democratic
107,Thu May 04 21:40:42 +0000 2017,8.60248E+17,2,6,"While voluntary measures from @united and others send a nice message, they are not guarantees and consumers deserve to fly safely",SenatorHassan,Maggie Hassan,New Hampshire,Democratic
108,Thu May 04 21:39:54 +0000 2017,8.60248E+17,2,4,"In the Aviation subcommittee today, I pressed reps from the airline industry on the importance of the TICKETS Act: https://t.co/SN61DB02aT",SenatorHassan,Maggie Hassan,New Hampshire,Democratic
