,created_at,id_str,reply_count,retweet_count,text,user,name,state,party
456,Wed Apr 27 15:24:08 +0000 2016,7.25345E+17,0,2,I will continue to fight against @NOAA’s mismanagement and stand up for much-needed investments to boost the #RedSnapper fishery.,SenShelby,Richard Shelby ,Alabama,Republican
457,Wed Apr 27 15:23:56 +0000 2016,7.25345E+17,1,3,A 9 day season for private recreational anglers is simply unacceptable: https://t.co/Q9PoV8ksRs,SenShelby,Richard Shelby ,Alabama,Republican
458,Wed Apr 27 15:23:39 +0000 2016,7.25345E+17,0,4,Today’s recreational #RedSnapper season announcement is disappointing &amp; underscores the failures of @NOAA’s current system to count fish.,SenShelby,Richard Shelby ,Alabama,Republican
459,Wed Apr 27 14:49:48 +0000 2016,7.25336E+17,0,7,"Let us remember the lives that were tragically lost that day as well as the generosity, strength, &amp; resilience of the people of #AL.",SenShelby,Richard Shelby ,Alabama,Republican
460,Wed Apr 27 14:49:33 +0000 2016,7.25336E+17,3,1,"Five years ago today, the most powerful long-track tornado in #AL history struck Tuscaloosa &amp; surrounding communities.",SenShelby,Richard Shelby ,Alabama,Republican
461,Fri Apr 22 22:43:27 +0000 2016,7.23643E+17,2,1,Great to spend time w/ Mayor Patterson &amp; constituents at Cheeky's Restaurant in Pickens County this afternoon. https://t.co/AWysHwnno1,SenShelby,Richard Shelby ,Alabama,Republican
462,Fri Apr 22 19:12:46 +0000 2016,7.2359E+17,0,1,It was great to visit @univwestalabama in Sumter County to learn about the great work they are doing. https://t.co/yBcrCG72gi,SenShelby,Richard Shelby ,Alabama,Republican
463,Fri Apr 22 18:52:21 +0000 2016,7.23585E+17,2,2,I enjoyed spending time at Butler City Hall in Choctaw County. Thanks to Butler Mayor Mike Williams for organizing. https://t.co/sAAUoDVDic,SenShelby,Richard Shelby ,Alabama,Republican
464,Fri Apr 22 17:56:20 +0000 2016,7.23571E+17,3,1,I started the day off in Washington County at Jake's Family Restaurant visiting with constituents &amp; local leaders. https://t.co/yErmZI6zPE,SenShelby,Richard Shelby ,Alabama,Republican
465,Fri Apr 22 13:20:20 +0000 2016,7.23502E+17,3,1,I'll be on @TheDaleJackson Show at 8:20am CT.  Tune in on @WVNN: https://t.co/aptTvNUFUB,SenShelby,Richard Shelby ,Alabama,Republican
466,Thu Apr 21 19:02:45 +0000 2016,7.23225E+17,1,1,Provisions in this CJS bill will help respond to problems caused by @NOAA's mismanagement of #RedSnapper stocks: https://t.co/iAIHw6l5nr,SenShelby,Richard Shelby ,Alabama,Republican
467,Thu Apr 21 17:18:36 +0000 2016,7.23199E+17,9,5,.@POTUS has accelerated the use of executive fiat to an alarming level. I will continue to stand up for constitutional rights of Americans.,SenShelby,Richard Shelby ,Alabama,Republican
468,Thu Apr 21 17:17:52 +0000 2016,7.23199E+17,1,1,The CJS appropriations bill does not adopt any of the new firearm-related provisions requested by @POTUS: https://t.co/QjRdSDKyRf,SenShelby,Richard Shelby ,Alabama,Republican
469,Thu Apr 21 17:17:21 +0000 2016,7.23199E+17,1,1,"The Appropriations Cmte approved the FY17 CJS bill. As the Chair of CJS, I’m proud to report that it maintains existing #2A protections.",SenShelby,Richard Shelby ,Alabama,Republican
470,Tue Apr 19 14:20:00 +0000 2016,7.2243E+17,3,2,It was great to visit with members of the Huntsville Chamber of Commerce in Washington this morning. https://t.co/7SnS4hMKa2,SenShelby,Richard Shelby ,Alabama,Republican
471,Mon Apr 18 15:29:45 +0000 2016,7.22085E+17,3,3,I introduced legislation this Congress to establish a flat tax of 17% on all income: https://t.co/o6VONo7ksb,SenShelby,Richard Shelby ,Alabama,Republican
472,Mon Apr 18 15:29:26 +0000 2016,7.22085E+17,4,10,Did you know that the IRS estimates that the average individual tax return takes 8 hrs to complete? RT if you agree that we need #taxreform.,SenShelby,Richard Shelby ,Alabama,Republican
473,Mon Apr 18 15:28:43 +0000 2016,7.22084E+17,6,10,"#TaxDay is a disappointing reminder that our tax code is unnecessarily complex, confusing, &amp; inefficient. https://t.co/OLofK3Alae",SenShelby,Richard Shelby ,Alabama,Republican
474,Fri Apr 15 16:09:48 +0000 2016,7.21008E+17,1,6,Proud to congratulate my granddaughter Anna for representing #AL in the Cherry Blossom Princess Program this week. https://t.co/siIStfR4yV,SenShelby,Richard Shelby ,Alabama,Republican
475,Thu Apr 14 16:33:57 +0000 2016,7.20651E+17,11,128,I'm a cosponsor of @SenatorSessions' #FAA amendment to reveal whether visitors left the US once their visas expired: https://t.co/EfUWWAyLFd,SenShelby,Richard Shelby ,Alabama,Republican
476,Wed Apr 13 16:27:30 +0000 2016,7.20287E+17,4,4,Just in time for Tax Day: Every penny Alabamians have earned since 1/1/16 has gone to the government for taxes: https://t.co/U5Y4YKmBAe,SenShelby,Richard Shelby ,Alabama,Republican
477,Tue Apr 12 20:27:29 +0000 2016,7.19985E+17,0,3,"Plasmine Technology, Inc., Revere Control Systems, &amp; @Austal_USA were named #AL's top manufacturers by @BCAToday. Congratulations!",SenShelby,Richard Shelby ,Alabama,Republican
478,Mon Apr 11 16:39:35 +0000 2016,7.19566E+17,0,2,Great news for #AL --&gt; 11 of the 30 @UofAlabama students who applied to the @FulbrightPrgrm this year received the award.,SenShelby,Richard Shelby ,Alabama,Republican
479,Fri Apr 08 15:01:47 +0000 2016,7.18454E+17,2,3,This morning I spoke at the inaugural Water Policy Summit at the National Water Center on @UofAlabama's campus. https://t.co/KVkJzuggSZ,SenShelby,Richard Shelby ,Alabama,Republican
480,Thu Apr 07 13:25:41 +0000 2016,7.18067E+17,6,1,"At 9:00am CST, I will chair the @BankingGOP hearing with CFPB Director Cordray. Watch live on @CSPAN: https://t.co/6fnyqSJNYU",SenShelby,Richard Shelby ,Alabama,Republican
481,Wed Apr 06 16:10:15 +0000 2016,7.17746E+17,2,6,"The official #RedSnapper season will be announced later this spring, &amp; I will continue to fight for changes to @NOAA's misguided policies.",SenShelby,Richard Shelby ,Alabama,Republican
482,Wed Apr 06 16:09:41 +0000 2016,7.17746E+17,4,4,"Anglers deserve more days on the water. That’s why I extended state boundaries in the Gulf to 9 miles for reef fish, including #RedSnapper.",SenShelby,Richard Shelby ,Alabama,Republican
483,Wed Apr 06 16:07:27 +0000 2016,7.17746E+17,1,3,"The #RedSnapper fishery is vital to fishermen &amp; businesses across #AL, &amp; today’s news further demonstrates @NOAA’s mismanagement.",SenShelby,Richard Shelby ,Alabama,Republican
484,Wed Apr 06 16:06:23 +0000 2016,7.17745E+17,0,2,"While the estimates for a lengthened charter season are positive news, limiting the season for recreational anglers is unacceptable.",SenShelby,Richard Shelby ,Alabama,Republican
485,Wed Apr 06 16:05:16 +0000 2016,7.17745E+17,4,5,Today my office learned that this year’s recreational #RedSnapper season is expected to be between 6-9 days.,SenShelby,Richard Shelby ,Alabama,Republican
486,Wed Apr 06 11:00:11 +0000 2016,7.17668E+17,0,2,I'll be on Huntsville's @wbhpam Morning Show with @ToniAndGary at 6:30am CST. Listen in here: https://t.co/WboC56QFZV,SenShelby,Richard Shelby ,Alabama,Republican
487,Tue Apr 05 18:47:22 +0000 2016,7.17423E+17,1,1,Congrats to Auburn High &amp; Spanish Fort Middle School students who were selected to compete in the National Science Bowl later this month.,SenShelby,Richard Shelby ,Alabama,Republican
488,Mon Apr 04 19:45:46 +0000 2016,7.17076E+17,16,13,"Time and time again, the Obama Administration has circumvented Congress and pushed its agenda on the American people through executive fiat.",SenShelby,Richard Shelby ,Alabama,Republican
489,Mon Apr 04 19:44:46 +0000 2016,7.17075E+17,3,2,.@POTUS' plan to offer temporary legal status to illegal immigrants is yet another example of his refusal to enforce our immigration laws.,SenShelby,Richard Shelby ,Alabama,Republican
490,Mon Apr 04 19:42:39 +0000 2016,7.17075E+17,2,6,I joined 42 senators in filing an amicus brief that supports challenging @POTUS' executive actions on immigration: https://t.co/RMiIXuhxSH,SenShelby,Richard Shelby ,Alabama,Republican
491,Mon Apr 04 16:38:13 +0000 2016,7.17029E+17,2,6,The tax filing deadline is on 4/18. #TaxDay is America's annual reminder that our tax code is complex &amp; confusing. https://t.co/AgEkZOHcz6,SenShelby,Richard Shelby ,Alabama,Republican
492,Thu Mar 31 20:31:05 +0000 2016,7.15638E+17,3,12,"I sent a letter to AG Lynch re: POTUS granting 61 sentence commutations, 12 to people w/ firearm-related charges: https://t.co/EZgQFzABes",SenShelby,Richard Shelby ,Alabama,Republican
493,Mon Mar 28 19:33:02 +0000 2016,7.14536E+17,1,7,My Washington staff is safe and accounted for. Thank you to the @CapitolPolice for all you do to keep us safe.,SenShelby,Richard Shelby ,Alabama,Republican
494,Mon Mar 28 19:16:56 +0000 2016,7.14532E+17,1,2,Congratulations to #AL native Kasdin Miller Mitchell: https://t.co/ji0j0GetVU,SenShelby,Richard Shelby ,Alabama,Republican
495,Sun Mar 27 13:37:07 +0000 2016,7.14084E+17,3,2,https://t.co/MLDVHnEdNq,SenShelby,Richard Shelby ,Alabama,Republican
496,Thu Mar 24 17:38:03 +0000 2016,7.13057E+17,12,10,Remember when .@JoeBiden said the Senate should consider not scheduling SCOTUS hearings during campaign season? #TBT https://t.co/4K5bSNFQVe,SenShelby,Richard Shelby ,Alabama,Republican
497,Wed Mar 23 16:38:43 +0000 2016,7.1268E+17,6,3,This unfortunate anniversary highlights the critical need for a President who is committed to repealing &amp; replacing #Obamacare.,SenShelby,Richard Shelby ,Alabama,Republican
498,Wed Mar 23 16:38:07 +0000 2016,7.1268E+17,3,7,"On the 6th #ObamacareAnniversary, we’re reminded of its many broken promises. https://t.co/QXefyxFaYN",SenShelby,Richard Shelby ,Alabama,Republican
499,Tue Mar 22 12:57:49 +0000 2016,7.12262E+17,2,11,US citizens in #Brussels: take shelter wherever you are &amp; avoid public transportation. @usembbrussels has more information. Stay safe.,SenShelby,Richard Shelby ,Alabama,Republican
500,Tue Mar 22 12:38:23 +0000 2016,7.12257E+17,1,12,My thoughts are w/ those impacted by the horrific acts of terrorism in Belgium this morning. Join me in praying for the families &amp; victims.,SenShelby,Richard Shelby ,Alabama,Republican
501,Mon Mar 21 18:52:28 +0000 2016,7.11989E+17,0,5,I was excited to learn that the first Alabama-made @Airbus #A321 had a successful first launch in Mobile today. #AirbusInAlabama,SenShelby,Richard Shelby ,Alabama,Republican
502,Fri Mar 18 19:17:44 +0000 2016,7.10908E+17,0,6,Great news for #AL --&gt; Three students from Fort Payne won C-SPAN @StudentCam awards: https://t.co/QeywAhvcRk,SenShelby,Richard Shelby ,Alabama,Republican
503,Thu Mar 17 20:23:56 +0000 2016,7.10562E+17,14,8,It has been almost 130 years since a #SCOTUSnominee both arose &amp; was confirmed under a divided government in a presidential election year.,SenShelby,Richard Shelby ,Alabama,Republican
504,Thu Mar 17 20:23:22 +0000 2016,7.10562E+17,14,10,"Contrary to what's being said, the long-standing practice of the Senate is to NOT consider a #SCOTUSnominee in a presidential election year.",SenShelby,Richard Shelby ,Alabama,Republican
505,Wed Mar 16 16:10:42 +0000 2016,7.10136E+17,47,11,I am adamantly opposed to any Senate action on @POTUS' nomination of Judge Garland to the Supreme Court: https://t.co/pRmiGOM3Fr,SenShelby,Richard Shelby ,Alabama,Republican
506,Wed Mar 16 16:09:34 +0000 2016,7.10136E+17,42,10,The American people deserve a voice in the #SCOTUS nomination.,SenShelby,Richard Shelby ,Alabama,Republican
507,Tue Mar 15 20:46:32 +0000 2016,7.09843E+17,2,2,"It's #NationalAgDay, a time to recognize the 500,000+ jobs &amp; over $70 billion the agriculture industry brings to AL: https://t.co/w0qwGwkEyp",SenShelby,Richard Shelby ,Alabama,Republican
508,Mon Mar 14 22:00:25 +0000 2016,7.09499E+17,15,20,Today I voted against the nomination of John King for Sec. of Education b/c he supports #CommonCore &amp; other top-down education policies.,SenShelby,Richard Shelby ,Alabama,Republican
509,Fri Mar 11 21:02:35 +0000 2016,7.08398E+17,0,2,It was great to be in Mobile today for the groundbreaking of the U.S. Courthouse for the Southern District of #AL. https://t.co/MQbWhrmMjp,SenShelby,Richard Shelby ,Alabama,Republican
510,Fri Mar 11 18:09:32 +0000 2016,7.08354E+17,0,5,"To learn more #Alabama facts, click here: https://t.co/bPLIdaFbDS. https://t.co/ttvd2PJYxL",SenShelby,Richard Shelby ,Alabama,Republican
511,Thu Mar 10 14:42:50 +0000 2016,7.0794E+17,1,6,I enjoyed meeting Deja Chappell &amp; Steven Higgins yesterday. They are representing #AL in the @SenateYouth Program. https://t.co/r4SZluRWJ4,SenShelby,Richard Shelby ,Alabama,Republican
512,Wed Mar 09 16:03:39 +0000 2016,7.07598E+17,3,4,"Unfortunately &amp; unsurprisingly, Alabamians’ Obamacare deductibles are projected to rise by $158 on average in 2016: https://t.co/VDeTplqe64",SenShelby,Richard Shelby ,Alabama,Republican
513,Tue Mar 08 21:59:20 +0000 2016,7.07325E+17,0,8,"Huntsville companies @Dynetics, @ArcataAssoc, &amp; Teledyne Brown Engineering received @NASA Small Business Industry Awards today. Congrats!",SenShelby,Richard Shelby ,Alabama,Republican
514,Tue Mar 08 18:59:10 +0000 2016,7.0728E+17,0,2,Congrats to the Spanish Fort Junior High students who won their regional competition for the National Science Bowl: https://t.co/Gw2TcY3L64.,SenShelby,Richard Shelby ,Alabama,Republican
515,Tue Mar 08 15:45:45 +0000 2016,7.07231E+17,0,2,It was a pleasure to speak with members of the Alabama League of Municipalities this morning. https://t.co/OrvKkVonCz,SenShelby,Richard Shelby ,Alabama,Republican
516,Sun Mar 06 17:21:44 +0000 2016,7.0653E+17,1,12,I'm saddened to learn of the loss of former First Lady Nancy Reagan. My thoughts and prayers are with the Reagan family during this time.,SenShelby,Richard Shelby ,Alabama,Republican
517,Thu Feb 25 19:44:50 +0000 2016,7.02942E+17,7,8,It's completely unacceptable that DOJ has failed in its duty to defend the U.S. Election Assistance Commission: https://t.co/ajwTQQixDk @NRO,SenShelby,Richard Shelby ,Alabama,Republican
518,Thu Feb 25 19:42:35 +0000 2016,7.02942E+17,6,8,I questioned @LorettaLynch on non-citizens voting in this morning's CJS subcommittee hearing: https://t.co/ONJm5YbHQE,SenShelby,Richard Shelby ,Alabama,Republican
519,Thu Feb 25 15:21:47 +0000 2016,7.02876E+17,1,3,"This morning at 9:30am CT, @LorettaLynch will testify before the CJS subcommittee.  WATCH: https://t.co/QRzdN5jWHb",SenShelby,Richard Shelby ,Alabama,Republican
520,Wed Feb 24 22:38:45 +0000 2016,7.02624E+17,2,1,I enjoyed seeing students from Maddox Middle School in Jasper during their visit to our nation's capital. #AL https://t.co/0pg0aB9h8I,SenShelby,Richard Shelby ,Alabama,Republican
521,Tue Feb 23 17:41:05 +0000 2016,7.02186E+17,20,10,.@POTUS' plan to close Guantanamo &amp; move radical terrorists onto U.S. soil is imprudent &amp; reckless: https://t.co/oHE2w1r5xP,SenShelby,Richard Shelby ,Alabama,Republican
522,Fri Feb 19 18:15:47 +0000 2016,7.00746E+17,4,10,Today I join Alabamians and all Americans in mourning the passing of literary legend Harper Lee: https://t.co/AuzS4OjuDv,SenShelby,Richard Shelby ,Alabama,Republican
523,Thu Feb 18 21:09:07 +0000 2016,7.00427E+17,2,6,Today I visited @Austal_USA in Mobile #AL and reaffirmed my commitment to the LCS program. I'm proud of their work. https://t.co/gqIGiSg9Av,SenShelby,Richard Shelby ,Alabama,Republican
524,Thu Feb 18 19:06:43 +0000 2016,7.00396E+17,4,6,I enjoyed being in studio with Sean Sullivan @fmtalk1065 today in Mobile. https://t.co/yUoZ3uqFd7,SenShelby,Richard Shelby ,Alabama,Republican
525,Thu Feb 18 17:51:01 +0000 2016,7.00377E+17,1,5,I enjoyed visiting @AirbusUSA today and learning more about the great work they’re doing in South #AL. https://t.co/NxlaYAHLav,SenShelby,Richard Shelby ,Alabama,Republican
526,Thu Feb 18 17:00:28 +0000 2016,7.00364E+17,2,6,Congratulations to the 6 #AL companies selected as @USChamber Blue Ribbon recipients: https://t.co/imsKOPqdCu.,SenShelby,Richard Shelby ,Alabama,Republican
527,Wed Feb 17 19:06:13 +0000 2016,7.00034E+17,2,4,Today I cosponsored @SenatorSessions &amp; @SenTedCruz's ICE Agent Support Act of 2016.  Learn more: https://t.co/NWZ1gVvY97,SenShelby,Richard Shelby ,Alabama,Republican
528,Tue Feb 16 16:23:55 +0000 2016,6.9963E+17,3,5,It was an honor to be in Huntsville for the Terrorist Explosive Device Analytical Center ribbon cutting today. https://t.co/TvZkAZDlWs,SenShelby,Richard Shelby ,Alabama,Republican
529,Sun Feb 14 00:35:51 +0000 2016,6.98667E+17,139,53,I will adamantly oppose any attempt by President Obama to fill this vacancy during the remainder of his term. https://t.co/rSvfdgl2BW,SenShelby,Richard Shelby ,Alabama,Republican
530,Sun Feb 14 00:35:26 +0000 2016,6.98667E+17,12,12,Scalia’s replacement should be considered thoughtfully.  It is vital to our future that we confirm a justice who will continue his legacy.,SenShelby,Richard Shelby ,Alabama,Republican
531,Sun Feb 14 00:34:46 +0000 2016,6.98667E+17,4,6,This great loss brings on a great responsibility for the United States Senate.,SenShelby,Richard Shelby ,Alabama,Republican
532,Sun Feb 14 00:34:19 +0000 2016,6.98667E+17,1,12,Justice Scalia will be sorely missed.  There has never been such a strong voice for the Constitution on the Supreme Court.,SenShelby,Richard Shelby ,Alabama,Republican
533,Sat Feb 13 22:38:13 +0000 2016,6.98637E+17,2,20,My thoughts &amp; prayers are w/ Justice Scalia's family. He will be remembered as a great defender of the Constitution. https://t.co/O0TVNjClxD,SenShelby,Richard Shelby ,Alabama,Republican
534,Wed Feb 10 14:38:08 +0000 2016,6.97429E+17,1,8,This morning @ulalaunch had its 105th consecutive successful mission.  Read my full statement here: https://t.co/uW121Ma9n6,SenShelby,Richard Shelby ,Alabama,Republican
535,Tue Feb 09 17:15:22 +0000 2016,6.97107E+17,5,9,The only positive news coming from this budget blueprint is that it is President Obama’s last. Read my statement: https://t.co/e5VUliFsKG,SenShelby,Richard Shelby ,Alabama,Republican
536,Tue Feb 09 17:14:46 +0000 2016,6.97106E+17,10,10,Americans deserve better than a President who offers proposals to expand our bloated government while ignoring our $19 trillion debt.,SenShelby,Richard Shelby ,Alabama,Republican
537,Tue Feb 09 17:14:04 +0000 2016,6.97106E+17,7,12,".@POTUS released a wildly irresponsible budget plan today that further cements his legacy of liberal priorities: tax, borrow, &amp; spend.",SenShelby,Richard Shelby ,Alabama,Republican
538,Mon Feb 08 15:02:48 +0000 2016,6.96711E+17,2,5,I strongly condemn North Korea's illicit rocket launch this weekend. Read my statement here: https://t.co/FmPOYROlL2,SenShelby,Richard Shelby ,Alabama,Republican
539,Fri Feb 05 16:23:15 +0000 2016,6.95644E+17,1,1,It was exciting to see the Lee County students I've nominated to the U.S. service academies featured in @oanow: https://t.co/sQOtypQ0JB.,SenShelby,Richard Shelby ,Alabama,Republican
540,Thu Feb 04 21:32:19 +0000 2016,6.95359E+17,1,8,Congratulations to Coleman Martinson from Huntsville #AL on his recent completion of the U.S. Senate Page Program. https://t.co/Mn7ca2hluz,SenShelby,Richard Shelby ,Alabama,Republican
541,Thu Feb 04 16:44:10 +0000 2016,6.95287E+17,0,3,I'm proud to nominate 35 outstanding students from #AL to the United States service academies this year: https://t.co/TPAEIrMAMv.,SenShelby,Richard Shelby ,Alabama,Republican
542,Tue Feb 02 19:03:30 +0000 2016,6.94597E+17,8,9,"Read my release w/ @RepChrisSmith, @SenatorKirk &amp; @SenatorBarb on International Megan's Law: https://t.co/YdxTS2bMuz https://t.co/7yiEZfvUyB",SenShelby,Richard Shelby ,Alabama,Republican
543,Thu Jan 28 17:25:22 +0000 2016,6.9276E+17,1,51,"30 years ago today, the world witnessed a tragic nightmare when the #Challenger exploded &amp; 7 brave lives were lost. https://t.co/dwX1sfykUt",SenShelby,Richard Shelby ,Alabama,Republican
544,Wed Jan 27 19:55:28 +0000 2016,6.92436E+17,4,7,ICYMI: Read @BuzzFeedNews' article on the RD-180 debate &amp; my efforts to protect national security https://t.co/IX4Rh6yleP,SenShelby,Richard Shelby ,Alabama,Republican
545,Fri Jan 22 22:00:56 +0000 2016,6.90655E+17,3,4,"Honored to receive the ""Heavy Hitter"" award from #AL District Attorney's Association today. https://t.co/V34urJI85g",SenShelby,Richard Shelby ,Alabama,Republican
546,Thu Jan 21 18:51:58 +0000 2016,6.90245E+17,2,5,ICYMI - Former Virginia AG @KenCuccinelli testified in yesterday’s hearing on POTUS' executive action on #2A: https://t.co/uWGpA2ABip,SenShelby,Richard Shelby ,Alabama,Republican
547,Thu Jan 21 17:37:25 +0000 2016,6.90227E+17,1,6,ICYMI - Watch my Q&amp;A w/ @AGLutherStrange from yesterday’s hearing on POTUS' executive action on #guncontrol: https://t.co/b9DJ1qZ87C #2a,SenShelby,Richard Shelby ,Alabama,Republican
548,Thu Jan 21 15:19:23 +0000 2016,6.90192E+17,5,13,I'll be on @FoxNews with @BillHemmer at 9:30 CT to discuss yesterday's hearing with @LorettaLynch. #2A,SenShelby,Richard Shelby ,Alabama,Republican
549,Wed Jan 20 23:22:56 +0000 2016,6.89951E+17,8,4,"Unsurprisingly, POTUS vetoed the bipartisan repeal of the #WOTUS rule. I will continue to fight against this and all other EPA power grabs.",SenShelby,Richard Shelby ,Alabama,Republican
550,Wed Jan 20 21:12:04 +0000 2016,6.89918E+17,5,5,"Spoke to @LOCAL15NEWS on many issues, including the #2A: @POTUS' ""executive orders are usurping the Constitution."" https://t.co/aKGcXqJ89F",SenShelby,Richard Shelby ,Alabama,Republican
551,Wed Jan 20 20:29:11 +0000 2016,6.89908E+17,0,4,ICYMI: Watch my remarks in today's hearing w/ @LorettaLynch https://t.co/yq6qe4XRMG #2A,SenShelby,Richard Shelby ,Alabama,Republican
552,Wed Jan 20 18:16:30 +0000 2016,6.89874E+17,19,46,".@aldotcom: ""Shelby challenges Loretta Lynch at Senate hearing on Obama's executive actions on gun control"" https://t.co/dRTexqNaLM … #2A",SenShelby,Richard Shelby ,Alabama,Republican
553,Wed Jan 20 15:29:58 +0000 2016,6.89832E+17,7,3,Our hearing with @LorettaLynch is about to begin. WATCH: https://t.co/nRBCLcaFiy https://t.co/ydOr6XwxPT,SenShelby,Richard Shelby ,Alabama,Republican
554,Wed Jan 20 14:36:04 +0000 2016,6.89819E+17,6,6,Watch @LorettaLynch testify before the CJS Approps Subcommittee @ 9:30am CST regarding POTUS' executive action: https://t.co/nRBCLcaFiy #2A,SenShelby,Richard Shelby ,Alabama,Republican
555,Wed Jan 13 03:46:48 +0000 2016,6.87119E+17,18,26,https://t.co/DjDuxcACuR,SenShelby,Richard Shelby ,Alabama,Republican
556,Wed Jan 13 03:45:54 +0000 2016,6.87118E+17,11,5,"The American ppl deserved to hear from @POTUS tonight about his real, comprehensive plan to defeat ISIS &amp; radical Islamic terrorism. #SOTU",SenShelby,Richard Shelby ,Alabama,Republican
557,Wed Jan 13 03:44:17 +0000 2016,6.87118E+17,13,13,The #SOTU was another political speech full of empty rhetoric that offered no real solutions to the issues facing families &amp; businesses.,SenShelby,Richard Shelby ,Alabama,Republican
558,Tue Jan 12 23:51:36 +0000 2016,6.87059E+17,6,3,ICYMI: Watch my interview w/ @LOCAL15NEWS on @POTUS' failure to have a winning strategy to defeat ISIS &amp; more. #AL https://t.co/4LTxI9gbI6,SenShelby,Richard Shelby ,Alabama,Republican
559,Tue Jan 12 22:58:03 +0000 2016,6.87046E+17,1,4,It was great to see @mattmurphyshow today in DC.  #AL https://t.co/cLAhoWRl8M,SenShelby,Richard Shelby ,Alabama,Republican
560,Tue Jan 12 19:19:43 +0000 2016,6.86991E+17,2,2,Behind-the-scenes view of my interview with @LOCAL15NEWS where I gave a preview of tonight's #SOTU address. https://t.co/IOUdz1qIN8,SenShelby,Richard Shelby ,Alabama,Republican
561,Tue Jan 12 15:09:12 +0000 2016,6.86928E+17,1,3,"Congratulations to the @UofAlabama on its 45-40 win against @ClemsonFB last night, marking its 16th national title. https://t.co/gypWvR4LrJ",SenShelby,Richard Shelby ,Alabama,Republican
562,Mon Jan 11 23:21:15 +0000 2016,6.86689E+17,5,9,Today @SenatorSessions and I expressed our opposition to POTUS' plan to house illegal aliens at Maxwell AFB in #AL: https://t.co/H8K2oAsBP3.,SenShelby,Richard Shelby ,Alabama,Republican
563,Thu Jan 07 18:55:09 +0000 2016,6.85173E+17,5,6,"ICYMI: Roby, Shelby vow to fight plan to possibly house illegal immigrant children at Maxwell Air Force Base #AL https://t.co/x2UGXnN5OS",SenShelby,Richard Shelby ,Alabama,Republican
564,Wed Jan 06 23:12:08 +0000 2016,6.84875E+17,10,13,I will not sit by idly while AG @LorettaLynch allows @POTUS' executive overreach to be put into practice: https://t.co/Dx5aD4NmZr #2A,SenShelby,Richard Shelby ,Alabama,Republican
565,Wed Jan 06 23:11:03 +0000 2016,6.84875E+17,4,35,"I just requested that @LorettaLynch testify before the Appropriations Subcommittee on Commerce, Justice, &amp; Science that I chair on the #2A.",SenShelby,Richard Shelby ,Alabama,Republican
566,Wed Jan 06 17:36:56 +0000 2016,6.84791E+17,4,12,Taxpayer dollars intended for military facilities should be used for those working to keep us safe – not to house illegal immigrants.,SenShelby,Richard Shelby ,Alabama,Republican
567,Wed Jan 06 17:35:04 +0000 2016,6.8479E+17,1,3,I will fight against allowing those who break our laws to be housed at Maxwell-Gunter Air Force Base: https://t.co/VbUSLLrOT9,SenShelby,Richard Shelby ,Alabama,Republican
568,Wed Jan 06 17:06:35 +0000 2016,6.84783E+17,3,17,"Wishing @UofAlabama &amp; @JSUNews the best of luck in their upcoming national championship football games. #AL 
https://t.co/uHLYizeTn7.",SenShelby,Richard Shelby ,Alabama,Republican
569,Tue Jan 05 17:31:00 +0000 2016,6.84427E+17,37,34,"From amnesty to gun control, I will continue to say ""no"" to the President’s out-of-control executive fiats. #SecondAmendment",SenShelby,Richard Shelby ,Alabama,Republican
