,created_at,id_str,reply_count,retweet_count,text,user,name,state,party
0,Tue May 16 21:31:43 +0000 2017,8.64594E+17,9,9,"This week, we thank our local law enforcement for keeping our communities safe &amp; pay tribute to our fallen officers. #NationalPoliceWeek",SenShelby,Richard Shelby ,Alabama,Republican
1,Mon May 15 22:10:59 +0000 2017,8.64242E+17,8,14,It was great to have @AlabamaFTBL Coach Scott Cochran and his family in Washington today. Roll Tide! https://t.co/MoyKEwcJwX,SenShelby,Richard Shelby ,Alabama,Republican
2,Thu May 11 17:37:11 +0000 2017,8.62723E+17,19,1,Discussed @FBI Director Comey's termination with @ChuckTodd on @MSNBC's Meet The Press Daily. Watch here: https://t.co/F0wgJHca5T,SenShelby,Richard Shelby ,Alabama,Republican
3,Thu May 11 16:52:11 +0000 2017,8.62712E+17,7,2,Thanks to Hatton Smith of B’ham’s @RoyalCup Coffee for the special Senatorial blend. Sharing with my GOP Senate col… https://t.co/M4RGQwJPjR,SenShelby,Richard Shelby ,Alabama,Republican
4,Thu May 11 14:09:00 +0000 2017,8.62671E+17,13,5,It was an honor to visit with the #Tuscaloosa Rotary Honor Flight yesterday at the WWII Memorial. Thankful for thei… https://t.co/rKZsT3WpMV,SenShelby,Richard Shelby ,Alabama,Republican
5,Tue May 09 23:11:05 +0000 2017,8.62083E+17,39,6,"Today I introduced Jimmy Lyons, Director of AL State Port Authority, during a @EPWGOP hearing on water resources: https://t.co/FpLg9qtE56",SenShelby,Richard Shelby ,Alabama,Republican
6,Mon May 08 19:46:55 +0000 2017,8.61669E+17,37,18,Today I celebrated my 83rd birthday with the staff in my Washington office. Thanks for all of the decorations. https://t.co/BEWI3wK9SR,SenShelby,Richard Shelby ,Alabama,Republican
7,Thu May 04 22:34:41 +0000 2017,8.60261E+17,32,6,Today I spoke with Dr. Charles Roberts &amp; Robert Clark from @StJude to discuss their #Huntsville clinic &amp; @NIH fundi… https://t.co/8Pv3QCs3iG,SenShelby,Richard Shelby ,Alabama,Republican
8,Thu May 04 21:40:57 +0000 2017,8.60248E+17,7,4,This funding bill also included necessary funding or the National Water Center in #Tuscaloosa. https://t.co/5vMKuaHBiK,SenShelby,Richard Shelby ,Alabama,Republican
9,Thu May 04 21:38:59 +0000 2017,8.60247E+17,9,5,Pleased to have voted to secure critical funds for @NASA @NASA_Marshall in the government funding bill. https://t.co/BWBai8i3hD,SenShelby,Richard Shelby ,Alabama,Republican
10,Thu May 04 21:34:48 +0000 2017,8.60246E+17,4,5,Today I voted for a bill that secures important funding for Alabama’s Redstone Arsenal in #Huntsville. https://t.co/gHgRZXBADK,SenShelby,Richard Shelby ,Alabama,Republican
11,Tue May 02 22:04:57 +0000 2017,8.59529E+17,16,5,Voted to confirm Jay Clayton as chairman of the SEC. I look forward to working with him on efforts to promote &amp; sustain economic growth.,SenShelby,Richard Shelby ,Alabama,Republican
12,Tue May 02 16:44:06 +0000 2017,8.59448E+17,7,5,.@NOAA’s misguided management of #redsnapper in the Gulf is unacceptable for our recreational fishermen: https://t.co/XkyPvE135c,SenShelby,Richard Shelby ,Alabama,Republican
13,Tue May 02 13:39:34 +0000 2017,8.59402E+17,3,1,"Enjoyed breakfast this morning with @HuntsvilleALCOC, a hard-working, ambitious group. It’s a great honor to serve… https://t.co/N0uLHvM8yg",SenShelby,Richard Shelby ,Alabama,Republican
14,Mon May 01 17:36:23 +0000 2017,8.59099E+17,3,2,Click here to read more about my provisions in the FY17 funding bill that affect Alabama's Gulf Coast &amp; red snapper: https://t.co/VX8HKldUQN,SenShelby,Richard Shelby ,Alabama,Republican
15,Mon May 01 17:35:07 +0000 2017,8.59099E+17,7,4,"The funding bill also includes my provision for a red snapper state-led fisheries pilot program, which is good for Alabama fishermen.",SenShelby,Richard Shelby ,Alabama,Republican
16,Mon May 01 17:32:57 +0000 2017,8.59098E+17,4,4,"The FY17 government funding bill includes my 9-Mile Red Snapper provision to permanently extend the state seaward-boundaries of AL, MS &amp; LA.",SenShelby,Richard Shelby ,Alabama,Republican
17,Thu Apr 27 19:21:45 +0000 2017,8.57676E+17,4,2,Today I was awarded the @ABAesq Justice Award. Proud of the American Bar Association for continuing to improve our… https://t.co/bqt7TmuibF,SenShelby,Richard Shelby ,Alabama,Republican
18,Thu Apr 27 15:58:07 +0000 2017,8.57625E+17,5,18,My thoughts and prayers are with those impacted by the 2011 tornadoes. Today is a reminder of Alabama's strength during difficult times.,SenShelby,Richard Shelby ,Alabama,Republican
19,Wed Apr 26 21:03:35 +0000 2017,8.57339E+17,1,4,"Congratulations to Chef Fuller Goldsmith of #Tuscaloosa, the newest champion of @FoodNetwork’s #ChoppedJunior. https://t.co/kGMZATR87v",SenShelby,Richard Shelby ,Alabama,Republican
20,Wed Apr 26 19:27:46 +0000 2017,8.57315E+17,3,4,"Today I visited with @ALRuralElectric about providing secure, reliable #energy sources. Grateful for the good work… https://t.co/JILIOrlUUn",SenShelby,Richard Shelby ,Alabama,Republican
21,Tue Apr 25 23:05:50 +0000 2017,8.57008E+17,4,6,.@POTUS has made an excellent pick in nominating Stephen Boyd to be an Assistant Attorney General @TheJusticeDept: https://t.co/Fi6sRwK3nD,SenShelby,Richard Shelby ,Alabama,Republican
22,Tue Apr 25 20:38:51 +0000 2017,8.56971E+17,1,1,ICYMI: My statement on @SecretarySonny Perdue’s confirmation as Secretary of @USDA: https://t.co/fweTXhmVyd,SenShelby,Richard Shelby ,Alabama,Republican
23,Tue Apr 25 16:46:22 +0000 2017,8.56912E+17,3,8,"Enjoyed visiting today with recently-appointed #Alabama @AGSteveMarshall, former AL Supreme Court Chief Justice… https://t.co/bGyYkzUlNr",SenShelby,Richard Shelby ,Alabama,Republican
24,Tue Apr 18 19:36:35 +0000 2017,8.54418E+17,3,2,Finished up a great trip with a visit to Integrity Cabinets in Ashland. They employ 185 Alabamians. #AL #jobs https://t.co/gchfGgfugk,SenShelby,Richard Shelby ,Alabama,Republican
25,Tue Apr 18 18:29:31 +0000 2017,8.54402E+17,3,4,I enjoyed visiting Roanoke Electronic Controls today. It was great touring their facility and learning about their… https://t.co/BAOgH1G1uN,SenShelby,Richard Shelby ,Alabama,Republican
26,Tue Apr 18 15:30:31 +0000 2017,8.54356E+17,3,2,Just wrapped up a visit to Rusken Packaging in Heflin. They plan to open in June and will employ 45 Alabamians. #AL… https://t.co/PNWweM8hCA,SenShelby,Richard Shelby ,Alabama,Republican
27,Tue Apr 18 15:20:38 +0000 2017,8.54354E+17,14,11,Please read my statement on the legislation I introduced to establish a flat tax: https://t.co/DriHNeHXhw,SenShelby,Richard Shelby ,Alabama,Republican
28,Tue Apr 18 14:09:16 +0000 2017,8.54336E+17,10,1,It was great spending time touring Carlson Engineered Composites in Anniston and meeting with hardworking Alabamian… https://t.co/poutxfzIBS,SenShelby,Richard Shelby ,Alabama,Republican
29,Tue Apr 18 00:40:57 +0000 2017,8.54133E+17,7,4,Third stop of the day was at Choice Fabricators in Rainbow City. I enjoyed learning about their business. #AL #jobs https://t.co/KKnkKsFMjq,SenShelby,Richard Shelby ,Alabama,Republican
30,Mon Apr 17 20:29:26 +0000 2017,8.54069E+17,3,3,Thanks to KTH Products in Leesburg for having me. It was great to learn about their business. #AL #jobs https://t.co/ulRK8HYo3G,SenShelby,Richard Shelby ,Alabama,Republican
31,Mon Apr 17 18:41:00 +0000 2017,8.54042E+17,5,8,Started off the day in Fort Payne at Little River Sock Mill. I enjoyed touring their facility and learning about th… https://t.co/NoZqmRiBQI,SenShelby,Richard Shelby ,Alabama,Republican
32,Tue Apr 11 22:28:48 +0000 2017,8.51925E+17,14,17,I'm glad to see AG Sessions cracking down on illegal immigration &amp; prioritizing border security: https://t.co/Uv3S3wzRwu,SenShelby,Richard Shelby ,Alabama,Republican
33,Mon Apr 10 22:21:21 +0000 2017,8.51561E+17,10,23,"Please read my statement on Governor Robert Bentley's resignation: 
https://t.co/7RhJISGIjb",SenShelby,Richard Shelby ,Alabama,Republican
34,Mon Apr 10 20:24:34 +0000 2017,8.51531E+17,1,3,Please see my statement on @AerojetRdyne job announcement in Huntsville: https://t.co/YoN0l8jf4R,SenShelby,Richard Shelby ,Alabama,Republican
35,Mon Apr 10 15:25:59 +0000 2017,8.51456E+17,23,15,Today is a great day for America. Judge Gorsuch will faithfully uphold the U.S. Constitution and help restore confidence in the rule of law.,SenShelby,Richard Shelby ,Alabama,Republican
36,Fri Apr 07 18:41:40 +0000 2017,8.50418E+17,15,5,Read my statement on confirming Judge Neil Gorsuch to the Supreme Court of the United States: https://t.co/CPnfQVT6K9,SenShelby,Richard Shelby ,Alabama,Republican
37,Fri Apr 07 15:57:52 +0000 2017,8.50377E+17,28,11,"Following the events in Syria, I believe that the President must now articulate a comprehensive plan to best protec… https://t.co/VH7JHR3GNs",SenShelby,Richard Shelby ,Alabama,Republican
38,Thu Apr 06 18:51:41 +0000 2017,8.50058E+17,18,10,Read my statement on the Senate Rule Change to Confirm Supreme Court Nominee Judge Gorsuch: https://t.co/yPPiGNqesA,SenShelby,Richard Shelby ,Alabama,Republican
39,Thu Apr 06 14:10:46 +0000 2017,8.49988E+17,43,14,"I am hopeful that my colleagues will decide to give exceptionally qualified candidate, Judge Gorsuch, the up-or-down vote he deserves today.",SenShelby,Richard Shelby ,Alabama,Republican
40,Wed Apr 05 13:37:31 +0000 2017,8.49617E+17,2,12,Everyone stay safe and please take proper precautions with the impending weather in Alabama today. https://t.co/usGLC6rBWQ,SenShelby,Richard Shelby ,Alabama,Republican
41,Mon Apr 03 15:51:41 +0000 2017,8.48926E+17,6,1,Today I had the honor and privilege of speaking at the Port of Huntsville’s International Intermodal Center’s 30th… https://t.co/1E4Y3kFWTJ,SenShelby,Richard Shelby ,Alabama,Republican
42,Sat Apr 01 23:04:05 +0000 2017,8.4831E+17,5,6,Third visit of the day was to Daikin America in Decatur. I enjoyed discussing the business and hearing about their… https://t.co/135tbJOAFl,SenShelby,Richard Shelby ,Alabama,Republican
43,Sat Apr 01 22:56:12 +0000 2017,8.48308E+17,4,2,Thanks to Resco Products in Moulton for having me today. They employ 14 hardworking Alabamians. #AL #jobs https://t.co/AvupbcixyK,SenShelby,Richard Shelby ,Alabama,Republican
44,Sat Apr 01 22:26:30 +0000 2017,8.48301E+17,7,6,I enjoyed touring the Polaris Industries plant in Huntsville today. They employ 450 Alabamians and have room to gro… https://t.co/z2dIuW0Nud,SenShelby,Richard Shelby ,Alabama,Republican
45,Thu Mar 30 18:07:31 +0000 2017,8.47511E+17,5,6,Today's announcement by DRS is great news for Alabama and potential economic growth in the Tuskegee region. https://t.co/l8iSa7qzzu,SenShelby,Richard Shelby ,Alabama,Republican
46,Wed Mar 29 21:49:43 +0000 2017,8.47204E+17,6,4,I enjoyed meeting with members of the @ALCattlemen Association and hearing about the current issues that impact the… https://t.co/3FPX3cMR2p,SenShelby,Richard Shelby ,Alabama,Republican
47,Tue Mar 28 23:35:20 +0000 2017,8.46868E+17,3,18,"Please join me in thanking World War II Purple Heart recipient, John Wesley Garmon, for his dedicated service to ou… https://t.co/s4b1MbZKqC",SenShelby,Richard Shelby ,Alabama,Republican
48,Sat Mar 25 19:54:10 +0000 2017,8.45726E+17,9,5,I enjoyed spending this afternoon touring Gulf States International in Union Springs and meeting with hardworking A… https://t.co/n9hOFn03KB,SenShelby,Richard Shelby ,Alabama,Republican
49,Sat Mar 25 18:00:03 +0000 2017,8.45697E+17,8,2,I just wrapped up a visit to Beck's Turf Farm. It was great to learn about their business in Tuskegee. #AL https://t.co/sWpBM5QHoh,SenShelby,Richard Shelby ,Alabama,Republican
50,Sat Mar 25 17:14:16 +0000 2017,8.45685E+17,3,2,Thanks to @archangelsysinc in Auburn for having me today. #AL #jobs https://t.co/dojfnZ7m4n,SenShelby,Richard Shelby ,Alabama,Republican
51,Sat Mar 25 16:29:31 +0000 2017,8.45674E+17,6,6,Third stop today was at @Vectorply in Phenix City. I enjoyed learning about their business &amp; their 130 employees.… https://t.co/8cTGXYx3jK,SenShelby,Richard Shelby ,Alabama,Republican
52,Sat Mar 25 15:09:07 +0000 2017,8.45654E+17,9,6,I just wrapped up a great tour of WestRock in Chambers County. They currently employ 300 people. #AL #jobs https://t.co/lVP7neGJou,SenShelby,Richard Shelby ,Alabama,Republican
53,Sat Mar 25 14:56:05 +0000 2017,8.4565E+17,10,3,I started the morning off at Wickles Pickles in Tallapoosa County. Thanks to the Sims family for having me. #AL https://t.co/5ttQ7BeBdA,SenShelby,Richard Shelby ,Alabama,Republican
54,Tue Mar 21 23:26:29 +0000 2017,8.44329E+17,7,5,I am pleased to see @UAHuntsville collaborating with @NOAA to promote VORTEX-Southeast in efforts to study tornadoe… https://t.co/pvqLe7JGql,SenShelby,Richard Shelby ,Alabama,Republican
55,Fri Mar 17 15:57:04 +0000 2017,8.42767E+17,2,4,"Congratulations to St. Ignatius Catholic School in Mobile, AL for advancing to the National Finals in the… https://t.co/HOXxsOu92p",SenShelby,Richard Shelby ,Alabama,Republican
56,Thu Mar 16 20:41:57 +0000 2017,8.42476E+17,8,3,Thank you to @ASCETweets for the meeting yesterday. These Alabamians updated me on several important infrastructure… https://t.co/0fe1h37ej8,SenShelby,Richard Shelby ,Alabama,Republican
57,Wed Mar 15 20:48:32 +0000 2017,8.42115E+17,11,9,"Congratulations to our new Director of National Intelligence, former @SenDanCoats. https://t.co/5x0HzL5Ito",SenShelby,Richard Shelby ,Alabama,Republican
58,Tue Mar 14 13:55:23 +0000 2017,8.41649E+17,4,4,Read my statement on today's NOAA Red Snapper announcement: https://t.co/0R6pR8OYuH,SenShelby,Richard Shelby ,Alabama,Republican
59,Mon Mar 13 19:12:01 +0000 2017,8.41366E+17,2,5,"March 12, 1946: Army Air Forces School was renamed Air University. I'm proud @HQAirUniversity calls Montgomery home. https://t.co/1xTN761iEM",SenShelby,Richard Shelby ,Alabama,Republican
60,Sat Mar 11 20:21:09 +0000 2017,8.40659E+17,6,5,Thanks to King Kutter in Winfield for having me today. I always enjoy receiving an update on the industry. #AL https://t.co/1CcZFj4I5b,SenShelby,Richard Shelby ,Alabama,Republican
61,Sat Mar 11 18:33:11 +0000 2017,8.40632E+17,8,2,I just wrapped up a tour of Masonite Corporation in Winston County. 288 Alabamians are employed here. #AL #jobs https://t.co/ukiZ7gdiX7,SenShelby,Richard Shelby ,Alabama,Republican
62,Sat Mar 11 16:52:55 +0000 2017,8.40606E+17,8,3,Third stop today was at Clark Pulley Industries in Russellville. I enjoyed learning about their business &amp; 52 emplo… https://t.co/A6KKC1i0HB,SenShelby,Richard Shelby ,Alabama,Republican
63,Sat Mar 11 16:12:02 +0000 2017,8.40596E+17,3,4,I had a great visit with Mr. Nakamura at CBC INGS America in Colbert County. 170 employees and growing. #AL #jobs https://t.co/xmVzFjP0mz,SenShelby,Richard Shelby ,Alabama,Republican
64,Sat Mar 11 15:31:23 +0000 2017,8.40586E+17,8,6,I started off the morning in Florence at Applied Chemical Technology. They employ 72 Alabamians and have never laid… https://t.co/WegXUMCMwl,SenShelby,Richard Shelby ,Alabama,Republican
65,Fri Mar 10 14:38:31 +0000 2017,8.4021E+17,7,3,I had a great meeting with @ABCofAlabama yesterday. I always enjoy receiving an update on the needs of their indust… https://t.co/BLqPD9KiAJ,SenShelby,Richard Shelby ,Alabama,Republican
66,Wed Mar 08 23:51:09 +0000 2017,8.39625E+17,6,7,Enjoyed meeting w/ #AL students Emma Turner &amp; Sydney Ross who are in our nation's capital for the @SenateYouth prog… https://t.co/DVCheLzBVR,SenShelby,Richard Shelby ,Alabama,Republican
67,Tue Mar 07 22:40:31 +0000 2017,8.39244E+17,11,21,Did you know that the majority of all the peanuts grown in the United States are grown within a 100-mile radius of… https://t.co/4zLZFQdMDm,SenShelby,Richard Shelby ,Alabama,Republican
68,Tue Mar 07 18:20:39 +0000 2017,8.39179E+17,7,15,Students from @BriarwoodChrSch had the chance to meet Pres. Trump this morning during their tour of the White House. https://t.co/A0wpdFRP2e,SenShelby,Richard Shelby ,Alabama,Republican
69,Tue Mar 07 16:55:07 +0000 2017,8.39157E+17,2,7,The growing threat posed by N. Korea to our deployed men &amp; women and our allies underscores the importance of our m… https://t.co/eRGSbKLYma,SenShelby,Richard Shelby ,Alabama,Republican
70,Mon Mar 06 22:23:04 +0000 2017,8.38878E+17,19,5,Read my statement on President Trump's executive order on our nation’s travel and visa process: https://t.co/jCuI0WBZUP,SenShelby,Richard Shelby ,Alabama,Republican
71,Sat Mar 04 22:04:27 +0000 2017,8.38148E+17,12,4,Spent the afternoon at Steel Dust Recycling in Millport. They currently employ 100 people &amp; are expanding next mont… https://t.co/383LIBPSAC,SenShelby,Richard Shelby ,Alabama,Republican
72,Sat Mar 04 21:50:19 +0000 2017,8.38145E+17,5,3,Thanks to McGee Lumber Company in Aliceville for giving me a tour of your business today.  #AL #jobs https://t.co/o8vgE3Ro6m,SenShelby,Richard Shelby ,Alabama,Republican
73,Sat Mar 04 20:02:22 +0000 2017,8.38117E+17,2,9,"My third stop of the day was to Southwest Paper Sales, Inc. in Livingston.  Enjoyed learning about their work. #AL… https://t.co/JvqlVQUcT4",SenShelby,Richard Shelby ,Alabama,Republican
74,Sat Mar 04 17:17:25 +0000 2017,8.38076E+17,1,3,I had a great visit to Lassiter Lumber in Silas this morning. #AL #jobs https://t.co/49BO4TnlBh,SenShelby,Richard Shelby ,Alabama,Republican
75,Sat Mar 04 14:32:18 +0000 2017,8.38034E+17,10,7,Kicked off the morning at Bertiles in Chatom. Enjoyed visiting with Alabamians to talk about the direction of our n… https://t.co/zPCcGLfwuX,SenShelby,Richard Shelby ,Alabama,Republican
76,Fri Mar 03 14:31:35 +0000 2017,8.37672E+17,22,26,EPA's rule redefining WOTUS was a prime example of Obama-era overreach. This is great news for the American people. https://t.co/khruHqBvlE,SenShelby,Richard Shelby ,Alabama,Republican
77,Thu Mar 02 23:32:02 +0000 2017,8.37445E+17,22,12,Read my response to Attorney General Jeff Sessions' press conference held this afternoon: https://t.co/VHs3ysUkbY,SenShelby,Richard Shelby ,Alabama,Republican
78,Thu Mar 02 18:34:44 +0000 2017,8.37371E+17,16,13,I was proud to support @RealBenCarson today to be our next @HUDgov Secretary. https://t.co/SGMQUQmghA,SenShelby,Richard Shelby ,Alabama,Republican
79,Thu Mar 02 16:48:48 +0000 2017,8.37344E+17,11,9,"I had a great meeting with Dr. Heather Wilson, Pres. Trump's nominee for Sec. of the Air Force. I look forward to s… https://t.co/kqfyQktFdG",SenShelby,Richard Shelby ,Alabama,Republican
80,Wed Mar 01 21:39:35 +0000 2017,8.37055E+17,5,7,I enjoyed visiting with @ChairmanLathan in Washington this afternoon. I congratulate her on her unanimous reelectio… https://t.co/P855YOQ9qa,SenShelby,Richard Shelby ,Alabama,Republican
81,Wed Mar 01 15:58:55 +0000 2017,8.36969E+17,0,3,Enjoyed speaking with the Alabama Association of County Commissioners in DC yesterday. https://t.co/abOK3JoQ2T,SenShelby,Richard Shelby ,Alabama,Republican
82,Wed Mar 01 03:36:26 +0000 2017,8.36782E+17,17,8,"In tonight’s address to Congress, President Trump laid out his vision for the nation.  Read my reaction here:
https://t.co/jtSKKS0e1H",SenShelby,Richard Shelby ,Alabama,Republican
83,Tue Feb 28 23:01:57 +0000 2017,8.36713E+17,3,4,It was great to see former staff member and current Montgomery County Commissioner Ronda McCaul Walker and her husb… https://t.co/nLsy7tkHoG,SenShelby,Richard Shelby ,Alabama,Republican
84,Tue Feb 28 20:32:59 +0000 2017,8.36676E+17,1,3,I'll be on the @MichaelHartShow today at 3pm CT to talk about @POTUS' address to Congress tonight.  Tune in here: https://t.co/jchfYT7U4W,SenShelby,Richard Shelby ,Alabama,Republican
85,Tue Feb 28 18:32:48 +0000 2017,8.36645E+17,2,14,Deeply saddened by the news coming out of Gulf Shores today. Please join me in praying for all who were injured. https://t.co/2gwChGds8z,SenShelby,Richard Shelby ,Alabama,Republican
86,Sat Feb 25 22:28:44 +0000 2017,8.35618E+17,9,8,I just wrapped up another week of traveling through our great state at SEPCO in Shelby County. SEPCO employs 100 Al… https://t.co/DK4KDcvn3r,SenShelby,Richard Shelby ,Alabama,Republican
87,Sat Feb 25 20:20:56 +0000 2017,8.35585E+17,3,2,Alabama Specialty Products in Munford has been in operation since 1980 and employs 230. I just wrapped up a great t… https://t.co/fOmYar9Psp,SenShelby,Richard Shelby ,Alabama,Republican
88,Sat Feb 25 18:38:27 +0000 2017,8.3556E+17,2,8,Thanks to Don Baxter &amp; @AlabamaGraphite for hosting me this afternoon in Coosa County. #AL https://t.co/Rzb71OgTnd,SenShelby,Richard Shelby ,Alabama,Republican
89,Sat Feb 25 16:05:40 +0000 2017,8.35521E+17,2,2,"There are 310 certified mobility vendors in the US. Gulf States Mobility, Inc. is 1 of the 3 veteran-owned. #AL",SenShelby,Richard Shelby ,Alabama,Republican
90,Sat Feb 25 16:03:45 +0000 2017,8.35521E+17,7,4,"I enjoyed a visit to Gulf States Mobility, Inc. this morning in Wetumpka. They employ 8 Alabamians. #AL #jobs https://t.co/gtmgdNsfTd",SenShelby,Richard Shelby ,Alabama,Republican
91,Sat Feb 25 15:50:31 +0000 2017,8.35517E+17,3,2,I started the morning off with a productive conversation with Lt. Gen. Kwast at @MaxwellAFB. #AL https://t.co/E6lbAtpJQG,SenShelby,Richard Shelby ,Alabama,Republican
92,Fri Feb 24 21:26:35 +0000 2017,8.3524E+17,3,2,Autauga Co.'s Kasai North America employs 116 Alabamians. I had the privilege to tour their facility this afternoon… https://t.co/yM4AajoRqy,SenShelby,Richard Shelby ,Alabama,Republican
93,Fri Feb 24 19:51:06 +0000 2017,8.35215E+17,5,6,I just wrapped up this afternoon's meeting at EBSCO Sign Group. I enjoyed learning about their operation in Clanton… https://t.co/gPvcvsBNoE,SenShelby,Richard Shelby ,Alabama,Republican
94,Fri Feb 24 17:24:03 +0000 2017,8.35178E+17,0,5,Thanks to Cahaba Timber &amp; the Stephens brothers for hosting me today. This Bibb Co. family-owned business employs 1… https://t.co/VcL5H2nkFe,SenShelby,Richard Shelby ,Alabama,Republican
95,Fri Feb 24 16:26:37 +0000 2017,8.35164E+17,4,4,It was great to spend time in Marion this morning with Probate Judge Eldora Anderson at the historic Perry County C… https://t.co/GeCtADjhBt,SenShelby,Richard Shelby ,Alabama,Republican
96,Fri Feb 24 16:13:14 +0000 2017,8.35161E+17,1,6,"This morning I visited Eovations in Selma. Eovations employs 95 people, an increase from 40 at this time last year.… https://t.co/AxkMVNP4Bj",SenShelby,Richard Shelby ,Alabama,Republican
97,Fri Feb 24 02:16:20 +0000 2017,8.3495E+17,10,7,Tonight I enjoyed the opportunity to talk with &amp; hear from the Farmers Federation of Wilcox County. https://t.co/XdCxNlRpTG,SenShelby,Richard Shelby ,Alabama,Republican
98,Fri Feb 24 00:33:42 +0000 2017,8.34924E+17,6,9,It's always great to stop by @PriestersPecans &amp; talk with constituents about their concerns.#AL https://t.co/T3GN3sP3AF,SenShelby,Richard Shelby ,Alabama,Republican
99,Fri Feb 24 00:00:05 +0000 2017,8.34916E+17,3,3,"This afternoon I enjoyed visiting Hyundai Steel America, which has more than 130 employees, in Greenville. #AL #jobs https://t.co/cOVGSLM2s8",SenShelby,Richard Shelby ,Alabama,Republican
100,Thu Feb 23 23:55:52 +0000 2017,8.34915E+17,3,5,Thanks to Hicks Inc. in Luverne for having me today.  Hicks employs 53 people &amp; has been in business for 115 years.… https://t.co/JscRxThlOq,SenShelby,Richard Shelby ,Alabama,Republican
101,Thu Feb 23 19:58:07 +0000 2017,8.34855E+17,3,4,It was great to spend time with constituents at Michael's Southern Foods Restaurant in Brantley today. #AL https://t.co/GLsKBFlgrU,SenShelby,Richard Shelby ,Alabama,Republican
102,Thu Feb 23 18:57:51 +0000 2017,8.3484E+17,0,3,Started the morning visiting @FortRucker_AL to receive an update. Proud of their work to defend our freedoms both a… https://t.co/pinPZgCgy3,SenShelby,Richard Shelby ,Alabama,Republican
103,Wed Feb 22 22:32:22 +0000 2017,8.34531E+17,2,4,Just wrapped up a meeting at E&amp;H Steel in Midland City.  I enjoyed learning about the impressive projects they've b… https://t.co/kh5vCMHq9W,SenShelby,Richard Shelby ,Alabama,Republican
104,Wed Feb 22 18:22:02 +0000 2017,8.34468E+17,10,4,Enjoyed touring Southern Plastics in Eufaula today to learn about their business. They employee nearly 130 Alabamia… https://t.co/s4WByV4gIc,SenShelby,Richard Shelby ,Alabama,Republican
105,Wed Feb 22 16:14:05 +0000 2017,8.34436E+17,2,8,Great to visit w/ constituents in Headland at Todd Farms. Proud of this family-owned company &amp; will keep fighting f… https://t.co/KZeECwxT2k,SenShelby,Richard Shelby ,Alabama,Republican
106,Wed Feb 22 14:57:07 +0000 2017,8.34417E+17,7,7,"Kicked off the day in Dothan at Key Fire Hose, which employees 170 people in the area.  #AL #jobs https://t.co/sv6AZnmW4C",SenShelby,Richard Shelby ,Alabama,Republican
107,Tue Feb 21 22:59:46 +0000 2017,8.34176E+17,6,1,Enjoyed spending time at Air Performance in Hartford this afternoon. #AL #jobs https://t.co/hM891CHE73,SenShelby,Richard Shelby ,Alabama,Republican
108,Tue Feb 21 21:28:00 +0000 2017,8.34153E+17,6,4,Great meeting this afternoon with hardworking Alabamians at Global Aerospace &amp; Defense Manufacturing in Opp. #AL… https://t.co/0rC0TuKBgW,SenShelby,Richard Shelby ,Alabama,Republican
109,Tue Feb 21 18:55:06 +0000 2017,8.34114E+17,10,7,Just visited Weyerhaeuser's forest products plant in Castleberry where we discussed the impact of government regula… https://t.co/GRStG9V5DE,SenShelby,Richard Shelby ,Alabama,Republican
110,Tue Feb 21 16:43:18 +0000 2017,8.34081E+17,1,3,Thanks to @altoproducts in Atmore for the tour today. Alto employees approximately 300 people at this facility. #AL… https://t.co/mQUWIAvCpq,SenShelby,Richard Shelby ,Alabama,Republican
111,Tue Feb 21 14:53:28 +0000 2017,8.34053E+17,4,5,First stop of the day: Furniture City in Robertsdale. This great family-owned store was a 2016 Alabama Small Busine… https://t.co/ox7DI2wCCe,SenShelby,Richard Shelby ,Alabama,Republican
