,created_at,id_str,reply_count,retweet_count,text,user,name,state,party
686,Thu Jul 02 16:26:50 +0000 2015,6.16644E+17,0,3,Read my statement on the #BP oil spill settlement announcement today: http://t.co/0LxvV50cwa #AL #RESTOREAct,SenShelby,Richard Shelby ,Alabama,Republican
687,Mon Jun 29 19:47:44 +0000 2015,6.15608E+17,0,1,Congratulations to #AL high school student Alexander Young on completion of the United States Senate Page Program. http://t.co/HLawsJlZww,SenShelby,Richard Shelby ,Alabama,Republican
688,Mon Jun 29 19:46:25 +0000 2015,6.15607E+17,2,4,I was delighted to have 5 outstanding students from #AL during the 2nd session of my Congressional Internship Program http://t.co/8YvFQiKnMa,SenShelby,Richard Shelby ,Alabama,Republican
689,Fri Jun 26 17:29:39 +0000 2015,6.14486E+17,1,5,It was great to meet #AL @wwp participant Anthony Radetic this week. I'm grateful for his service to our country. http://t.co/jftz7Ksih9,SenShelby,Richard Shelby ,Alabama,Republican
690,Thu Jun 25 17:17:23 +0000 2015,6.1412E+17,4,4,Read my full reaction here: http://t.co/7EupsW8b1e,SenShelby,Richard Shelby ,Alabama,Republican
691,Thu Jun 25 17:17:04 +0000 2015,6.1412E+17,4,26,"Today’s Supreme Court decision does not change the fact that #Obamacare is an unworkable, deeply flawed, and damaging law.",SenShelby,Richard Shelby ,Alabama,Republican
692,Wed Jun 24 20:36:01 +0000 2015,6.13808E+17,5,12,Today I voted against #TPA for the second time. http://t.co/f2QrZw9SES,SenShelby,Richard Shelby ,Alabama,Republican
693,Wed Jun 24 18:51:38 +0000 2015,6.13782E+17,1,7,Google’s announcement is positive news for #AL &amp; proves that our state is a great place for companies to do business: http://t.co/FNONQcdiSV,SenShelby,Richard Shelby ,Alabama,Republican
694,Tue Jun 23 19:56:12 +0000 2015,6.13435E+17,5,8,"""Sessions, Shelby among only 5 GOP 'no' votes on TPA procedural vote"" via @aldotcom: http://t.co/AEhPb14fa8",SenShelby,Richard Shelby ,Alabama,Republican
695,Fri Jun 19 21:02:01 +0000 2015,6.12002E+17,1,4,"Today, 7 students from #AL Russellville City Schools won 1st place in the International Rocketry Challenge at the @parisairshow. Congrats!",SenShelby,Richard Shelby ,Alabama,Republican
696,Thu Jun 18 15:38:49 +0000 2015,6.11559E+17,1,2,"The Senate Appropriations Committee approved the Interior &amp; Environment funding bill today, which reins in the #EPA: http://t.co/YxryCSMMbM",SenShelby,Richard Shelby ,Alabama,Republican
697,Wed Jun 17 22:10:33 +0000 2015,6.11295E+17,1,4,"Taylor Hardy, one of my interns during the month of May, was featured in @TheCrimsonWhite. Read more: http://t.co/J9h9NVRCRp",SenShelby,Richard Shelby ,Alabama,Republican
698,Thu Jun 11 20:13:27 +0000 2015,6.09091E+17,4,2,The bill includes important funding for the Littoral Combat Ship (LCS) program &amp; the Joint High Speed Vessel (JHSV): http://t.co/PDCwy1zkqz,SenShelby,Richard Shelby ,Alabama,Republican
699,Thu Jun 11 20:13:14 +0000 2015,6.09091E+17,3,5,I'm pleased to report that the Senate Appropriations Committee approved the Department of Defense Appropriations bill today.,SenShelby,Richard Shelby ,Alabama,Republican
700,Thu Jun 11 17:54:29 +0000 2015,6.09056E+17,3,3,The red snapper fishery is vital to fishermen and businesses across Alabama.  Learn more here: http://t.co/l4CfpfKb9F,SenShelby,Richard Shelby ,Alabama,Republican
701,Thu Jun 11 17:53:52 +0000 2015,6.09056E+17,2,5,"Today, the Senate Appropriations Committee approved the FY16 CJS Appropriations bill that included several critical #RedSnapper provisions.",SenShelby,Richard Shelby ,Alabama,Republican
702,Wed Jun 10 22:50:27 +0000 2015,6.08768E+17,4,5,"""Led by Shelby, Senate blocks legal fund for immigrant children"" http://t.co/maMoYT24ly via @aldotcom",SenShelby,Richard Shelby ,Alabama,Republican
703,Wed Jun 10 21:44:28 +0000 2015,6.08752E+17,3,3,I just spoke on the Senate floor to oppose reauthorizing the #ExImBank.  Watch my remarks here: https://t.co/6nvxL95yny,SenShelby,Richard Shelby ,Alabama,Republican
704,Tue Jun 09 20:56:28 +0000 2015,6.08377E+17,1,5,"It was an honor to meet James Strong, the 2015 @CMNHospitals Champion for #AL, and his family in DC today. http://t.co/g4AxZj1eCr",SenShelby,Richard Shelby ,Alabama,Republican
705,Mon Jun 08 18:44:21 +0000 2015,6.07982E+17,0,1,I would like to congratulate Tuscaloosa native Madison Elmore on her recent completion of the Senate Page Program. http://t.co/4CZMePtISC,SenShelby,Richard Shelby ,Alabama,Republican
706,Mon Jun 01 17:44:14 +0000 2015,6.0543E+17,2,3,I was pleased to have 3 outstanding students from #AL during the 1st session of my Congressional Internship Program. http://t.co/nygzSKfcaU,SenShelby,Richard Shelby ,Alabama,Republican
707,Tue May 26 20:25:55 +0000 2015,6.03296E+17,3,6,I can think of no better place for the National Water Center to be than in #Alabama.,SenShelby,Richard Shelby ,Alabama,Republican
708,Tue May 26 20:21:48 +0000 2015,6.03295E+17,2,2,Today I was honored to attend the opening of the National Water Center at @UofAlabama. Learn more here: http://t.co/N8blKMohAk,SenShelby,Richard Shelby ,Alabama,Republican
709,Mon May 25 14:17:15 +0000 2015,6.02841E+17,3,5,http://t.co/50xduankXx,SenShelby,Richard Shelby ,Alabama,Republican
710,Sat May 23 01:57:48 +0000 2015,6.0193E+17,9,9,"Tonight I voted against providing President Obama ""fast-track"" authority. Read more here: http://t.co/5v1apnRACL",SenShelby,Richard Shelby ,Alabama,Republican
711,Thu May 21 19:18:28 +0000 2015,6.01467E+17,1,2,The Energy &amp; Water Development Appropriations bill includes several priorities that are important to #AL. Read more: http://t.co/CiSdDmS9Kt,SenShelby,Richard Shelby ,Alabama,Republican
712,Mon May 18 20:27:21 +0000 2015,6.00397E+17,0,6,"I enjoyed meeting students from @SamfordU's honors program, University Fellows, in DC today. http://t.co/AcqLdMSfkz",SenShelby,Richard Shelby ,Alabama,Republican
713,Mon May 18 17:51:14 +0000 2015,6.00358E+17,4,6,"ICYMI - Watch my interview on @FoxNews @SundayFutures yesterday about Amtrak, TPA, &amp; the Senate Banking Committee:https://t.co/6JuM0H3kpq",SenShelby,Richard Shelby ,Alabama,Republican
714,Sun May 17 13:40:21 +0000 2015,5.99932E+17,0,15,I'll be on @SundayFutures at 10:10am ET/9:10am CT.  Tune in on @FoxNews.,SenShelby,Richard Shelby ,Alabama,Republican
715,Fri May 15 18:23:32 +0000 2015,5.99279E+17,1,6,http://t.co/j3nScKGVIW,SenShelby,Richard Shelby ,Alabama,Republican
716,Thu May 14 22:08:07 +0000 2015,5.98973E+17,2,2,"Today, I questioned the NLRB leadership on its politically-motivated actions that stifle economic growth in Alabama: http://t.co/RlLOOxqLEG",SenShelby,Richard Shelby ,Alabama,Republican
717,Wed May 13 18:49:22 +0000 2015,5.98561E+17,1,1,"It was great to meet #AL students from Thorsby HS, The Lakeside School, &amp; Valley Intermediate School in DC this week. http://t.co/fsoP25UWA0",SenShelby,Richard Shelby ,Alabama,Republican
718,Tue May 12 22:38:52 +0000 2015,5.98256E+17,1,7,It is an honor to receive the @ACUConservative Achievement Award for my conservative voting record in the Senate: http://t.co/ZFHiTtBPkt,SenShelby,Richard Shelby ,Alabama,Republican
719,Mon May 11 20:09:29 +0000 2015,5.97856E+17,0,6,"Today marked the 1,943rd county visit of my career as I completed my annual statewide tour of Alabama’s 67 counties. http://t.co/a467JwRmXt",SenShelby,Richard Shelby ,Alabama,Republican
720,Mon May 11 14:23:00 +0000 2015,5.97769E+17,0,3,"This morning, I enjoyed speaking to constituents and local business leaders in Jefferson County. #AL http://t.co/kGOG6BrGYk",SenShelby,Richard Shelby ,Alabama,Republican
721,Fri May 08 15:43:27 +0000 2015,5.96702E+17,0,4,"Donna Coleman of Aetos Systems, Inc. was named Small Business Person of the Year for AL by @SBAgov. Congratulations! https://t.co/DXNKhHRNoi",SenShelby,Richard Shelby ,Alabama,Republican
722,Fri May 08 15:43:04 +0000 2015,5.96702E+17,0,1,"This week is #NationalSmallBusinessWeek, a time to reflect on the important role that small businesses play in our economy. #SBW2015",SenShelby,Richard Shelby ,Alabama,Republican
723,Thu May 07 14:56:10 +0000 2015,5.96328E+17,7,8,Read my opening remarks in today’s CJS Subcommittee hearing w/ Attorney General #LorettaLynch: http://t.co/CLx5Erbef0 http://t.co/oHCPuD3lQb,SenShelby,Richard Shelby ,Alabama,Republican
724,Thu May 07 14:31:41 +0000 2015,5.96322E+17,0,1,"Watch AG #LorettaLynch testify before the Commerce, Justice, &amp; Science Subcommittee at 10:30am ET/9:30am CT: http://t.co/m2JSQbrmSJ",SenShelby,Richard Shelby ,Alabama,Republican
725,Wed May 06 20:01:53 +0000 2015,5.96042E+17,0,7,"Today, I had the honor of meeting w/ WW II &amp; Korean War vets from Tuscaloosa participating in their Honor Flight. #AL http://t.co/YQ2RnfPwnl",SenShelby,Richard Shelby ,Alabama,Republican
726,Wed May 06 14:00:46 +0000 2015,5.95951E+17,1,1,Honored to be presented w/ the Champion of Science Award by @AuburnU's Dr. Jay Gogue &amp; @UofAlabama's Dr. Carl Pinkert http://t.co/vI7XmNerM9,SenShelby,Richard Shelby ,Alabama,Republican
727,Tue May 05 16:50:23 +0000 2015,5.95632E+17,1,4,It was a pleasure to meet with Alabama’s top two youth volunteers of 2015 in DC today @PruSpirit http://t.co/ITLQGRWp0h,SenShelby,Richard Shelby ,Alabama,Republican
728,Thu Apr 30 17:19:51 +0000 2015,5.93827E+17,0,4,Today’s #RedSnapper announcement highlights the need for significant reforms.  Read more: http://t.co/S6TacA8arM,SenShelby,Richard Shelby ,Alabama,Republican
729,Thu Apr 30 17:18:44 +0000 2015,5.93827E+17,2,4,Today's announcement that #NOAA is limiting the #RedSnapper season for private anglers to only 10 days this year is unacceptable.,SenShelby,Richard Shelby ,Alabama,Republican
730,Thu Apr 23 18:54:49 +0000 2015,5.91314E+17,10,6,"Today, I voted against the nomination of #LorettaLynch for U.S. Attorney General: http://t.co/PawLUOPN5C http://t.co/7XjUkCIINN",SenShelby,Richard Shelby ,Alabama,Republican
731,Thu Apr 23 16:57:08 +0000 2015,5.91285E+17,0,2,"Yesterday, I sent a letter to Commerce Secretary Penny Pritzker on NOAA’s misguided practices regarding red snapper: http://t.co/RlkCvplM3x",SenShelby,Richard Shelby ,Alabama,Republican
732,Tue Apr 21 14:23:59 +0000 2015,5.90521E+17,0,4,It was a pleasure to speak to the @huntsvillealcoc this morning in DC http://t.co/6GpoTIoVsK,SenShelby,Richard Shelby ,Alabama,Republican
733,Mon Apr 20 17:32:38 +0000 2015,5.90206E+17,0,1,Read my statement on the five year anniversary of the Deepwater Horizon Oil Spill here: http://t.co/McHUETAYeh #AL #RESTOREAct,SenShelby,Richard Shelby ,Alabama,Republican
734,Thu Apr 16 19:07:44 +0000 2015,5.88781E+17,0,7,"It was great to meet with Andrea Dennis, the #AL Assistant Principal of the Year, from Theodore High in DC today. http://t.co/aul9EvshWB",SenShelby,Richard Shelby ,Alabama,Republican
735,Thu Apr 16 16:54:06 +0000 2015,5.88747E+17,3,1,It was a pleasure to meet with members of the Alabama Association of Fire Chiefs yesterday in my DC office. http://t.co/SxrtbIO5Ia,SenShelby,Richard Shelby ,Alabama,Republican
736,Wed Apr 15 02:07:10 +0000 2015,5.88162E+17,2,6,"I opposed the ""doc fix"" bill tonight because it increases the debt by $141 billion over the next 10 years. http://t.co/5ZW4j0HMSQ",SenShelby,Richard Shelby ,Alabama,Republican
737,Tue Apr 14 21:11:18 +0000 2015,5.88087E+17,3,24,"Today, I introduced the “SMART Act” to establish a 17% flat tax on all income: http://t.co/7UgMCpnmfL #TaxDay2015 http://t.co/mXP2rlh3up",SenShelby,Richard Shelby ,Alabama,Republican
738,Tue Apr 07 23:03:23 +0000 2015,5.85579E+17,1,7,Congratulations to @NASA_Marshall on earning @NASA's Small Business Administrator's Cup award for the 4th time in 7 years. #AL #Huntsville,SenShelby,Richard Shelby ,Alabama,Republican
739,Sun Apr 05 13:49:12 +0000 2015,5.84714E+17,0,8,http://t.co/Ar80v08Opp,SenShelby,Richard Shelby ,Alabama,Republican
740,Wed Apr 01 16:28:44 +0000 2015,5.83305E+17,3,5,"Good news for @Austal_USA today --&gt; The Navy announced funding for 2 Littoral Combat Ships (LCS), which are built in Mobile. #AL",SenShelby,Richard Shelby ,Alabama,Republican
741,Tue Mar 31 13:40:32 +0000 2015,5.829E+17,1,3,Senator Shelby speaking to constituents and local business leaders in Tuscaloosa County this morning. @chambertusc http://t.co/UErtLb7oXt,SenShelby,Richard Shelby ,Alabama,Republican
742,Mon Mar 30 21:13:48 +0000 2015,5.82652E+17,0,4,Senator Shelby visiting Burkes Mechanical Inc. in Bibb County. #AL http://t.co/vNyFXIfaD2,SenShelby,Richard Shelby ,Alabama,Republican
743,Mon Mar 30 18:52:49 +0000 2015,5.82616E+17,2,1,Senator Shelby visiting O-Flex in Chilton County. #AL http://t.co/tbD7J9TYuQ,SenShelby,Richard Shelby ,Alabama,Republican
744,Mon Mar 30 17:12:42 +0000 2015,5.82591E+17,1,3,Senator Shelby speaking to constituents at Alabaster Municipal Complex in Shelby County. #AL http://t.co/kvaxNH7qtC,SenShelby,Richard Shelby ,Alabama,Republican
745,Mon Mar 30 13:23:35 +0000 2015,5.82534E+17,1,5,"Senator Shelby kicked off the day by speaking to more than 1,000 constituents in Madison County. @huntsvillealcoc #AL http://t.co/0rwBhtnOHt",SenShelby,Richard Shelby ,Alabama,Republican
746,Sat Mar 28 20:55:27 +0000 2015,5.81923E+17,2,3,Senator Shelby speaking to constituents at Scottsboro City Hall in Jackson County. #AL http://t.co/NtQwaMrUJe,SenShelby,Richard Shelby ,Alabama,Republican
747,Sat Mar 28 19:07:14 +0000 2015,5.81895E+17,1,1,Senator Shelby visiting Kappler Inc. in Marshall County. http://t.co/NCR7qbPuHR,SenShelby,Richard Shelby ,Alabama,Republican
748,Sat Mar 28 16:49:27 +0000 2015,5.81861E+17,1,2,Senator Shelby visiting 3M in Morgan County. http://t.co/oBBh7rAtjL,SenShelby,Richard Shelby ,Alabama,Republican
749,Sat Mar 28 15:34:34 +0000 2015,5.81842E+17,1,2,Senator Shelby visiting with constituents at Moulton City Hall in Lawrence County. #AL http://t.co/kmhzExlubU,SenShelby,Richard Shelby ,Alabama,Republican
750,Sat Mar 28 14:15:07 +0000 2015,5.81822E+17,3,2,Senator Shelby visiting Carpenter Technology Corporation in Limestone County.  #AL #jobs http://t.co/FzHLhchGNe,SenShelby,Richard Shelby ,Alabama,Republican
751,Fri Mar 27 07:50:10 +0000 2015,5.81363E+17,4,5,I just voted in favor of the Senate-passed budget plan that balances in 10 years w/ no tax increases. Learn more: http://t.co/v2uBq1fY0z,SenShelby,Richard Shelby ,Alabama,Republican
752,Mon Mar 23 15:18:43 +0000 2015,5.80026E+17,6,10,"Over the past 5 years, I have heard from thousands of Alabamians like Chad about the negative impacts of #ObamaCare. http://t.co/HHfURNbnoY",SenShelby,Richard Shelby ,Alabama,Republican
753,Mon Mar 23 15:18:27 +0000 2015,5.80026E+17,4,1,Today marks the five-year anniversary of #ObamaCare being signed into law.,SenShelby,Richard Shelby ,Alabama,Republican
754,Tue Mar 17 23:00:33 +0000 2015,5.77968E+17,3,5,"ICYMI: Listen in to my radio interview with @yhn today - https://t.co/mdEu6UUp4E.  We discussed Loretta Lynch, Iran, taxes, &amp; more.",SenShelby,Richard Shelby ,Alabama,Republican
755,Mon Mar 16 14:55:30 +0000 2015,5.77483E+17,1,2,Senator Shelby speaking to local business leaders at breakfast with the @MobileChamber this morning. #AL #jobs http://t.co/ocy3beqAKc,SenShelby,Richard Shelby ,Alabama,Republican
756,Sat Mar 14 21:56:43 +0000 2015,5.76865E+17,2,6,Senator Shelby touring @powersouth's Lowman Power Plant in Washington County. #AL #jobs cc: @T_AWilliams http://t.co/7xsOWdISNZ,SenShelby,Richard Shelby ,Alabama,Republican
757,Sat Mar 14 19:26:23 +0000 2015,5.76827E+17,1,6,Senator Shelby visiting Rolison Trucking Company in Choctaw County. #AL http://t.co/Lc9d387Iqm,SenShelby,Richard Shelby ,Alabama,Republican
758,Sat Mar 14 17:24:02 +0000 2015,5.76796E+17,3,2,Senator Shelby visiting @univwestalabama in Sumter County. #AL http://t.co/nKm6sAbrIE,SenShelby,Richard Shelby ,Alabama,Republican
759,Sat Mar 14 15:14:39 +0000 2015,5.76763E+17,1,1,Senator Shelby speaking to constituents at Eutaw City Hall in Greene County. #AL http://t.co/nNlACxhv5v,SenShelby,Richard Shelby ,Alabama,Republican
760,Sat Mar 14 14:01:38 +0000 2015,5.76745E+17,2,1,Senator Shelby kicked off the morning by visiting with constituents at Town Square Diner in Pickens County. #AL http://t.co/8BGgGwYjVT,SenShelby,Richard Shelby ,Alabama,Republican
761,Wed Mar 11 21:39:40 +0000 2015,5.75773E+17,3,4,I enjoyed spending time today with Alabama's US Senate Youth Program delegates Jordan Cozby and Matthew Tindal. http://t.co/fyBmBi2dNq,SenShelby,Richard Shelby ,Alabama,Republican
762,Tue Mar 10 20:25:04 +0000 2015,5.75392E+17,2,7,I'm pleased to learn that the ATF withdrew its plan to limit access to sporting ammo. Read the letter I signed here: http://t.co/yzBHvm5IIc,SenShelby,Richard Shelby ,Alabama,Republican
763,Tue Mar 10 15:24:11 +0000 2015,5.75316E+17,3,1,It was a pleasure to speak with members of the Alabama League of Municipalities this morning in Washington. #AL http://t.co/GHPp2XrUld,SenShelby,Richard Shelby ,Alabama,Republican
764,Mon Mar 09 21:22:24 +0000 2015,5.75044E+17,1,5,It was great to see @CityofFairhope Mayor Timothy Kant and members of the Fairhope City Council today in Washington. http://t.co/zaNT2yh4fj,SenShelby,Richard Shelby ,Alabama,Republican
765,Mon Mar 09 13:53:06 +0000 2015,5.74931E+17,2,4,Senator Shelby speaking to constituents from Lauderdale and Colbert counties in Florence this morning. #AL http://t.co/tqAw3JJfhj,SenShelby,Richard Shelby ,Alabama,Republican
766,Sat Mar 07 21:14:05 +0000 2015,5.74317E+17,3,4,Senator Shelby visiting Innovative Hearth Products in Franklin County. #AL #jobs http://t.co/4e3OcB6aIu,SenShelby,Richard Shelby ,Alabama,Republican
767,Sat Mar 07 19:02:16 +0000 2015,5.74284E+17,4,3,Senator Shelby visiting 3M Co. in Marion County. #AL http://t.co/F20heW2RVt,SenShelby,Richard Shelby ,Alabama,Republican
768,Sat Mar 07 17:25:51 +0000 2015,5.7426E+17,0,2,Senator Shelby visiting Marathon Equipment Company in Lamar County. #AL http://t.co/wI5Jrw5nTp,SenShelby,Richard Shelby ,Alabama,Republican
769,Sat Mar 07 15:25:53 +0000 2015,5.74229E+17,3,1,"This morning, Senator Shelby kicked off the day by visiting with constituents in Fayette County. #AL http://t.co/uXnNozME6Y",SenShelby,Richard Shelby ,Alabama,Republican
770,Fri Mar 06 21:15:16 +0000 2015,5.73955E+17,1,7,I'm pleased to cosponsor S. 527 to award a Congressional Gold Medal to Foot Soldiers of the Voting Rights Movement. http://t.co/uZDSmCfk4E,SenShelby,Richard Shelby ,Alabama,Republican
771,Wed Mar 04 17:25:50 +0000 2015,5.73173E+17,4,5,"I just voted to stop the National Labor Relations Board's ""ambush elections"" rule. Learn more from @GOPHELP: http://t.co/NVCTehOv0q",SenShelby,Richard Shelby ,Alabama,Republican
772,Mon Mar 02 14:08:57 +0000 2015,5.72398E+17,2,3,Senator Shelby speaking to constituents &amp; local business leaders in Baldwin County this morning. @City_GulfShores #AL http://t.co/SmnutbLgl2,SenShelby,Richard Shelby ,Alabama,Republican
773,Sun Mar 01 15:01:45 +0000 2015,5.72049E+17,0,8,Behind-the-scenes view from the @FOX10News studio. Tune in to @FoxNews now for my live interview with @MariaBartiromo http://t.co/Ds5rdVE0nS,SenShelby,Richard Shelby ,Alabama,Republican
774,Sun Mar 01 13:56:59 +0000 2015,5.72033E+17,2,5,I'll be on @SundayFutures with @MariaBartiromo at 9am CT. Tune in on @FoxNews.,SenShelby,Richard Shelby ,Alabama,Republican
775,Sun Mar 01 01:33:43 +0000 2015,5.71846E+17,1,9,Senator Shelby speaking to constituents and local leaders in Wilcox County. #AL http://t.co/rzWtplquLO,SenShelby,Richard Shelby ,Alabama,Republican
776,Sun Mar 01 01:32:59 +0000 2015,5.71846E+17,2,8,Senator Shelby visiting with @LtGovIvey in Wilcox County tonight. #AL http://t.co/QsuKHOLeW0,SenShelby,Richard Shelby ,Alabama,Republican
777,Sat Feb 28 23:05:04 +0000 2015,5.71808E+17,0,4,Senator Shelby speaking to constituents at the Marengo County Economic Development Authority. #AL #jobs http://t.co/Sb9oKVXbbw,SenShelby,Richard Shelby ,Alabama,Republican
778,Sat Feb 28 18:14:06 +0000 2015,5.71735E+17,1,3,Senator Shelby visiting Monroe County Hospital in Monroeville. #AL http://t.co/DCn6DpCSa6,SenShelby,Richard Shelby ,Alabama,Republican
779,Sat Feb 28 16:44:51 +0000 2015,5.71713E+17,1,8,Senator Shelby visiting Transportation Products Inc. in Conecuh County. #AL http://t.co/cYP1nF48yn,SenShelby,Richard Shelby ,Alabama,Republican
780,Sat Feb 28 14:18:53 +0000 2015,5.71676E+17,1,4,"This morning, Senator Shelby met with constituents at Atmore City Hall in Escambia County. #AL http://t.co/l5DL4Y9zkL",SenShelby,Richard Shelby ,Alabama,Republican
781,Fri Feb 27 17:09:42 +0000 2015,5.71357E+17,10,11,I just voted against the DHS funding bill because it does not address President Obama's executive amnesty: http://t.co/ywMa9Zh6hU,SenShelby,Richard Shelby ,Alabama,Republican
782,Wed Feb 25 19:42:12 +0000 2015,5.7067E+17,0,11,I enjoyed meeting with students from Jasper's Maddox Middle School today on the steps of the United States Senate. http://t.co/bxVe8VQpyY,SenShelby,Richard Shelby ,Alabama,Republican
783,Tue Feb 24 21:19:57 +0000 2015,5.70332E+17,12,17,President Obama blocked the creation of tens of thousands of new American jobs by vetoing the #KeystoneXL bill today. http://t.co/fpGJ25IpUy,SenShelby,Richard Shelby ,Alabama,Republican
784,Tue Feb 24 20:30:10 +0000 2015,5.7032E+17,0,1,It was a pleasure to meet with the @ALANatlHQ Kelley-Stedham Unit #312 from Anniston today in my DC office. http://t.co/hJnrhmJKKB,SenShelby,Richard Shelby ,Alabama,Republican
785,Mon Feb 23 18:06:14 +0000 2015,5.69921E+17,2,5,"This morning, Senator Shelby spoke with @wsfa12news before breakfast with local business leaders in Montgomery. #AL http://t.co/3jOs7XjRXS",SenShelby,Richard Shelby ,Alabama,Republican
786,Sun Feb 22 22:27:09 +0000 2015,5.69624E+17,0,5,Behind-the-scenes view from the @CapitolJournal studio today. Interview to air this Friday on @APTV. http://t.co/8hv63kIbOZ,SenShelby,Richard Shelby ,Alabama,Republican
787,Sat Feb 21 22:24:44 +0000 2015,5.69261E+17,0,4,Senator Shelby visiting @sproutedflour in Bullock County. #AL #jobs http://t.co/kmhBf2QqHz,SenShelby,Richard Shelby ,Alabama,Republican
788,Sat Feb 21 20:08:30 +0000 2015,5.69227E+17,0,3,Senator Shelby visiting the National Park Service's Tuskegee Airmen National Historic Site in Macon County. #AL http://t.co/RUjzziEfAZ,SenShelby,Richard Shelby ,Alabama,Republican
789,Sat Feb 21 17:28:21 +0000 2015,5.69187E+17,0,2,Senator Shelby visiting Robinson Iron Corporation in Tallapoosa County. #AL http://t.co/RyBrw0HLPm,SenShelby,Richard Shelby ,Alabama,Republican
790,Sat Feb 21 17:04:56 +0000 2015,5.69181E+17,1,5,Congratulations to Terry Lathan on your election as @ALGOP's party chairwoman!,SenShelby,Richard Shelby ,Alabama,Republican
791,Sat Feb 21 15:58:59 +0000 2015,5.69164E+17,1,1,Senator Shelby visiting @ITS_Inc in Elmore County. http://t.co/xjMYdDWSz4,SenShelby,Richard Shelby ,Alabama,Republican
792,Sat Feb 21 14:48:23 +0000 2015,5.69147E+17,0,1,Senator Shelby speaking with constituents and local business leaders at the @PrattvilleC in Autauga County. #AL http://t.co/QCcaywcbLt,SenShelby,Richard Shelby ,Alabama,Republican
793,Sat Feb 21 05:07:48 +0000 2015,5.69001E+17,1,6,It was an honor to attend tonight's @ALGOP dinner in Montgomery. http://t.co/2K6fc5bgWD,SenShelby,Richard Shelby ,Alabama,Republican
794,Fri Feb 20 22:40:40 +0000 2015,5.68903E+17,0,2,"This afternoon, Senator Shelby also visited Tru-Wood Cabinets Inc. in Clay County. #AL #jobs http://t.co/htMohNTORA",SenShelby,Richard Shelby ,Alabama,Republican
795,Fri Feb 20 22:35:51 +0000 2015,5.68902E+17,0,1,Senator Shelby speaking to constituents and local leaders in Coosa County. #AL http://t.co/X9E3rYK5oy,SenShelby,Richard Shelby ,Alabama,Republican
796,Fri Feb 20 17:09:13 +0000 2015,5.6882E+17,0,2,Senator Shelby visiting L.E. Bell Construction Company in Cleburne County. #AL http://t.co/fG0x1OLdO4,SenShelby,Richard Shelby ,Alabama,Republican
797,Fri Feb 20 14:32:18 +0000 2015,5.6878E+17,1,2,Senator Shelby visiting Gadsden Regional Medical Center in Etowah County this morning. #GRMC #AL http://t.co/Q3N6VQoStv,SenShelby,Richard Shelby ,Alabama,Republican
798,Thu Feb 19 23:01:44 +0000 2015,5.68546E+17,1,2,"This afternoon, Senator Shelby visited Heil Environmental Industries in DeKalb County. #AL #jobs http://t.co/A7zICSJnzF",SenShelby,Richard Shelby ,Alabama,Republican
799,Thu Feb 19 21:06:57 +0000 2015,5.68517E+17,1,1,Senator Shelby visiting American Apparel Inc. in Cherokee County. #AL http://t.co/AYHZ4CkIfX,SenShelby,Richard Shelby ,Alabama,Republican
800,Thu Feb 19 19:15:38 +0000 2015,5.68489E+17,0,7,Senator Shelby visited @JSUNews today to meet with university officials and local leaders. http://t.co/AB8FedJ6mR,SenShelby,Richard Shelby ,Alabama,Republican
801,Thu Feb 19 16:12:28 +0000 2015,5.68443E+17,0,4,Congrats to @NASA_Marshall engineer Bill Emrich for being named America's top rocket engineer for 2015 http://t.co/vP3oCECfPp via @aldotcom,SenShelby,Richard Shelby ,Alabama,Republican
802,Thu Feb 19 15:55:10 +0000 2015,5.68439E+17,0,1,Senator Shelby visiting The Dixie Group in Randolph County. #AL http://t.co/2QtNFeftDB,SenShelby,Richard Shelby ,Alabama,Republican
803,Thu Feb 19 14:46:39 +0000 2015,5.68421E+17,0,1,Senator Shelby visiting @EastAlabamaMed in Chambers County. http://t.co/RbjRTvtm2K,SenShelby,Richard Shelby ,Alabama,Republican
804,Wed Feb 18 23:30:55 +0000 2015,5.68191E+17,0,2,"This afternoon, Senator Shelby also visited Auburn University's Assistive Technology Studio. #AL http://t.co/n9krXqRiU0",SenShelby,Richard Shelby ,Alabama,Republican
805,Wed Feb 18 22:45:09 +0000 2015,5.68179E+17,0,3,Senator Shelby visiting Baxter International in Lee County. #AL http://t.co/8NOjJK8dcL,SenShelby,Richard Shelby ,Alabama,Republican
