,created_at,id_str,reply_count,retweet_count,text,user,name,state,party
0,Sun May 21 16:39:00 +0000 2017,8.66333E+17,4,4,Honored to receive @OppFinance #CDFI Champ Award. Let’s keep working together to help create jobs and economic oppo… https://t.co/krcpcgNecm,SenCapito,Shelly Moore Capito,West Virginia,Republican
1,Sun May 21 14:03:00 +0000 2017,8.66293E+17,2,1,"From #Infrastructure to flood recovery &amp; helping our most vulnerable, lots to report. Read about it in my newslette… https://t.co/2FEpl9pbOa",SenCapito,Shelly Moore Capito,West Virginia,Republican
2,Sat May 20 17:07:41 +0000 2017,8.65977E+17,0,2,Caught up with @wtaptelevision to talk about my effort to help infants recovering from withdrawal. Here's the report https://t.co/of4TgvwsDU,SenCapito,Shelly Moore Capito,West Virginia,Republican
3,Sat May 20 15:09:17 +0000 2017,8.65948E+17,5,3,Always great hearing about WVians making a difference. Natalie Spaid stopped by this wk to discuss how her non-prof… https://t.co/YCBhviOASb,SenCapito,Shelly Moore Capito,West Virginia,Republican
4,Sat May 20 13:01:00 +0000 2017,8.65915E+17,3,3,Good editorial by @Register_Herald this week about my efforts to protect funding for anti-drug programs: https://t.co/W6wHGLBdqQ,SenCapito,Shelly Moore Capito,West Virginia,Republican
5,Fri May 19 19:23:42 +0000 2017,8.65649E+17,1,3,"Met w/ #WV Members of @NATA1950 this wk to discuss a bill I’m supporting to help our student athletes, teams &amp; trai… https://t.co/cryxoX3r0x",SenCapito,Shelly Moore Capito,West Virginia,Republican
6,Fri May 19 18:17:00 +0000 2017,8.65632E+17,1,1,"From #infrastructure to helping the most vulnerable recover from addiction, learn about my latest efforts here: https://t.co/y6wIrCIxHX",SenCapito,Shelly Moore Capito,West Virginia,Republican
7,Fri May 19 17:52:27 +0000 2017,8.65626E+17,1,7,Pausing to remember and honor fallen WV miner Luches Rossner. My thoughts go out to his family and friends during this difficult time.,SenCapito,Shelly Moore Capito,West Virginia,Republican
8,Fri May 19 15:03:18 +0000 2017,8.65584E+17,0,4,Had the opportunity to thank @AppServProject for their volunteer efforts in Greenbrier County following #wvflood. https://t.co/TVLYIweqhj,SenCapito,Shelly Moore Capito,West Virginia,Republican
9,Thu May 18 22:46:00 +0000 2017,8.65338E+17,13,3,Happy to announce Bluestone Health Assoc in Princeton is getting more than $2.3M to continue delivering care --&gt; https://t.co/Kzx5iuXVmz,SenCapito,Shelly Moore Capito,West Virginia,Republican
10,Thu May 18 22:14:43 +0000 2017,8.6533E+17,2,11,Trying to rename the Huntington VA after West Virginia’s very own @WoodyWilliams45. Learn more:… https://t.co/kcJNhjI5Qz,SenCapito,Shelly Moore Capito,West Virginia,Republican
11,Thu May 18 21:50:06 +0000 2017,8.65324E+17,1,1,Met up w/ Ruffner Elementary students today on the Senate steps. Have a great field trip! https://t.co/57v1XLJWQY,SenCapito,Shelly Moore Capito,West Virginia,Republican
12,Thu May 18 18:21:01 +0000 2017,8.65271E+17,4,5,WVians rely on roads &amp; bridges to access hard-to-reach places and transport goods across the nation. #TimetoBuild https://t.co/5RTE9AUUXv,SenCapito,Shelly Moore Capito,West Virginia,Republican
13,Thu May 18 17:46:33 +0000 2017,8.65262E+17,2,3,ICYMI: Learn about my efforts to help provide care like @LilysPlaceWV for babies born addicted to opioids: https://t.co/3acO6gBuLe,SenCapito,Shelly Moore Capito,West Virginia,Republican
14,Thu May 18 14:07:43 +0000 2017,8.65207E+17,0,1,My staff was all smiles at last week’s Mother’s Day celebration at the Hansford Senior Center! https://t.co/dzYejchPfu,SenCapito,Shelly Moore Capito,West Virginia,Republican
15,Wed May 17 23:34:00 +0000 2017,8.64987E+17,5,5,I’m working to expand access to substance abuse treatment for Medicaid beneficiaries in WV &amp; across America. MORE: https://t.co/SUu8o1ZxPs,SenCapito,Shelly Moore Capito,West Virginia,Republican
16,Wed May 17 23:07:54 +0000 2017,8.64981E+17,3,6,Improving our #infrastructure can bring new jobs &amp; opportunities to #WV. #TimeToBuild,SenCapito,Shelly Moore Capito,West Virginia,Republican
17,Wed May 17 23:07:24 +0000 2017,8.64981E+17,0,4,Proud to be a Congressional co-chair for #InfrastructureWeek. This is an important issue to #WV &amp; has the power to transform America.,SenCapito,Shelly Moore Capito,West Virginia,Republican
18,Wed May 17 22:30:17 +0000 2017,8.64971E+17,1,3,Had a blast running in the @ACLINews #CapChallenge w/ my staff. Great showing by Team Capito! https://t.co/lhN2OIrh5I,SenCapito,Shelly Moore Capito,West Virginia,Republican
19,Wed May 17 22:14:00 +0000 2017,8.64967E+17,14,40,Great meeting w @NASCAR’s @KyleBusch to hear how he &amp; @SamanthaBusch are helping couples through IVF &amp; their work w… https://t.co/Uh3dtSuG7T,SenCapito,Shelly Moore Capito,West Virginia,Republican
20,Wed May 17 21:58:00 +0000 2017,8.64963E+17,1,5,Proud to support our law enforcement officers by co-sponsoring the Back the Blue Act today. Learn more: https://t.co/c0WQfDiiFg,SenCapito,Shelly Moore Capito,West Virginia,Republican
21,Wed May 17 21:39:00 +0000 2017,8.64958E+17,1,4,An ethane storage hub in Appalachia would be a vital #infrastructure project &amp; enhance our energy potential. MORE: https://t.co/AZWfXMKlCf,SenCapito,Shelly Moore Capito,West Virginia,Republican
22,Wed May 17 16:40:09 +0000 2017,8.64883E+17,5,2,Just announced new funding to support health care services in northern #WV. MORE: https://t.co/4I8a2YpNst,SenCapito,Shelly Moore Capito,West Virginia,Republican
23,Wed May 17 15:29:17 +0000 2017,8.64865E+17,1,4,"During #PoliceWeek, we remember First Sgt. Joe Portaro who died during a fitness run at the WV Police Academy in 2016 after 17yrs of service",SenCapito,Shelly Moore Capito,West Virginia,Republican
24,Wed May 17 13:44:29 +0000 2017,8.64839E+17,4,7,Good conversation yesterday w/ former U.S. Attorney @IhlenfeldWV &amp; David Grubb regarding substance abuse education… https://t.co/eYkFWqrruI,SenCapito,Shelly Moore Capito,West Virginia,Republican
25,Tue May 16 23:25:00 +0000 2017,8.64623E+17,6,5,Learn about funding headed to @WestVirginiaU to help improve sustainable agriculture &amp; help WV communities thrive https://t.co/IXmW275haZ,SenCapito,Shelly Moore Capito,West Virginia,Republican
26,Tue May 16 23:02:59 +0000 2017,8.64617E+17,4,3,Women should be key stakeholders in security &amp; peacekeeping. More on my efforts w/ @SenatorShaheen to achieve this: https://t.co/RB7axUgYSv,SenCapito,Shelly Moore Capito,West Virginia,Republican
27,Tue May 16 19:52:40 +0000 2017,8.64569E+17,0,1,Wishing my grandson Charlie a very happy birthday today! 🎉🎈 https://t.co/uLfB91Ell5,SenCapito,Shelly Moore Capito,West Virginia,Republican
28,Tue May 16 16:25:21 +0000 2017,8.64517E+17,4,2,ICYMI: Announced additional funding to assist w/ #wvflood recovery efforts. Learn more here: https://t.co/GMMkjkWAEf,SenCapito,Shelly Moore Capito,West Virginia,Republican
29,Mon May 15 19:38:42 +0000 2017,8.64203E+17,10,3,Chatted with Dave Bassage of #WV Professional River Outfitters last week about preserving our national monuments. https://t.co/vnNTuFmRTV,SenCapito,Shelly Moore Capito,West Virginia,Republican
30,Mon May 15 14:33:01 +0000 2017,8.64126E+17,4,3,"ICYMI: Urging @POTUS to reconsider funding cuts to ONDCP, an essential resource to end drug epidemic https://t.co/55MOosdNf6 via @BDTonline",SenCapito,Shelly Moore Capito,West Virginia,Republican
31,Mon May 15 13:01:02 +0000 2017,8.64103E+17,2,2,Chatted about the importance of volunteer work w/ this year’s @PruSpirit top youth volunteers in #WV. Congrats &amp; ke… https://t.co/WOS4HJxTmP,SenCapito,Shelly Moore Capito,West Virginia,Republican
32,Sun May 14 20:08:00 +0000 2017,8.63848E+17,20,5,We need everyone working together to end the drug epidemic. https://t.co/lsqOtPOV6I,SenCapito,Shelly Moore Capito,West Virginia,Republican
33,Sun May 14 16:37:17 +0000 2017,8.63795E+17,2,3,Mom before she was the best Mom ever! Miss her. Happy #MothersDay to all the mothers. https://t.co/BhE3P93TBK,SenCapito,Shelly Moore Capito,West Virginia,Republican
34,Sun May 14 15:09:00 +0000 2017,8.63773E+17,22,1,"Signed, sealed, and delivered – the weekly newsletter is out! Read it here: https://t.co/YRKLlGojuP https://t.co/IivCy9HK2N",SenCapito,Shelly Moore Capito,West Virginia,Republican
35,Sun May 14 12:57:00 +0000 2017,8.6374E+17,6,1,"Wishing all the wonderful, hard-working mothers a Happy Mother’s Day today! #HappyMothersDay",SenCapito,Shelly Moore Capito,West Virginia,Republican
36,Sat May 13 16:03:00 +0000 2017,8.63424E+17,3,1,#HIDTA designations provide resources to fight the drug epidemic. Learn about my new efforts to help Wood County https://t.co/DpPaydcv9Z,SenCapito,Shelly Moore Capito,West Virginia,Republican
37,Sat May 13 13:32:00 +0000 2017,8.63386E+17,2,5,.@wvstatejournal has the details on my new bill to utilize our #energy resources &amp; improve #infrastructure: https://t.co/2Cjel8jPrM,SenCapito,Shelly Moore Capito,West Virginia,Republican
38,Fri May 12 19:06:00 +0000 2017,8.63108E+17,5,3,I stand ready to work w our state universities to spur economic development. Glad my staff joined @marshallu to dis… https://t.co/ktqaFIRieu,SenCapito,Shelly Moore Capito,West Virginia,Republican
39,Fri May 12 18:21:01 +0000 2017,8.63097E+17,40,1,Intro’d a bill w/ @SenatorHeitkamp to protect American mothers. Learn about our efforts here: https://t.co/NKRrSzeIb4,SenCapito,Shelly Moore Capito,West Virginia,Republican
40,Fri May 12 17:56:02 +0000 2017,8.6309E+17,9,9,Registered nurses make up more than 3M of health care professionals. Proud to support nurses by intro'ing the Nat’l Nurse Act. #NursesWeek,SenCapito,Shelly Moore Capito,West Virginia,Republican
41,Fri May 12 17:31:43 +0000 2017,8.63084E+17,9,6,"Met the team at Cenergy in Milton, WV &amp; took a closer look at how this oil &amp; gas service biz is helping grow WV’s e… https://t.co/TpBK3ZHRng",SenCapito,Shelly Moore Capito,West Virginia,Republican
42,Fri May 12 15:49:41 +0000 2017,8.63059E+17,6,1,Catch up on the latest in the Senate w/ my weekly video message. Check it out here: https://t.co/KAv9M9RD8j,SenCapito,Shelly Moore Capito,West Virginia,Republican
43,Fri May 12 13:56:13 +0000 2017,8.6303E+17,6,4,Sat down w/ the leadership team of @FiscalService located in WV’s own @ParkersburgCity. Thanks for visiting this wk! https://t.co/yHd6fok5B5,SenCapito,Shelly Moore Capito,West Virginia,Republican
44,Thu May 11 19:17:08 +0000 2017,8.62748E+17,13,3,"Securing permanent health care for miners was only half the battle, now we must work to secure pensions https://t.co/Kn0o9R30wm",SenCapito,Shelly Moore Capito,West Virginia,Republican
45,Thu May 11 17:41:37 +0000 2017,8.62724E+17,2,3,ICYMI: Learn more about my new proposal to maximize #WV’s domestic #energy &amp; #manufacturing potential: https://t.co/sYqBYcsCsA,SenCapito,Shelly Moore Capito,West Virginia,Republican
46,Thu May 11 16:10:15 +0000 2017,8.62701E+17,7,5,Support from all levels of government is needed to combat drug abuse. Glad to have AG Sessions as a partner in this… https://t.co/BG6FCbm7y2,SenCapito,Shelly Moore Capito,West Virginia,Republican
47,Thu May 11 15:12:01 +0000 2017,8.62687E+17,6,5,I’ll be speaking w/ @HoppyKercheval on @WVMetroNews about my efforts to create a #drugfreeWV &amp; more. Listen at 11:30 https://t.co/jehbgFxtmI,SenCapito,Shelly Moore Capito,West Virginia,Republican
48,Wed May 10 19:04:31 +0000 2017,8.62383E+17,8,4,The #PurpleHeart recognizes &amp; honors sacrifices of America’s war heroes. More on my efforts to protect these medals: https://t.co/54Ojm6O1UQ,SenCapito,Shelly Moore Capito,West Virginia,Republican
49,Wed May 10 18:13:40 +0000 2017,8.6237E+17,7,2,Remember to thank a #nurse this week during #NursesWeek for their hard work to keep WVians healthy.,SenCapito,Shelly Moore Capito,West Virginia,Republican
50,Wed May 10 14:29:58 +0000 2017,8.62314E+17,16,3,My letter to the Trump Administration has more: https://t.co/eaP4q8paQt,SenCapito,Shelly Moore Capito,West Virginia,Republican
51,Wed May 10 14:29:41 +0000 2017,8.62314E+17,7,7,"If funding cuts are proposed, I will lead a bipartisan group of my colleagues in the Senate to reject them.",SenCapito,Shelly Moore Capito,West Virginia,Republican
52,Wed May 10 14:29:27 +0000 2017,8.62314E+17,8,8,We cannot drastically cut important programs that are helping communities fight back.,SenCapito,Shelly Moore Capito,West Virginia,Republican
53,Wed May 10 14:29:19 +0000 2017,8.62314E+17,7,6,We are in the grips of an opioid epidemic that is claiming 91 lives/day.,SenCapito,Shelly Moore Capito,West Virginia,Republican
54,Tue May 09 13:56:42 +0000 2017,8.61943E+17,15,6,Miss my op-ed over the weekend? Read it here and find out why #broadband is the key to economic growth in #WV: https://t.co/3JdfSyCCOz,SenCapito,Shelly Moore Capito,West Virginia,Republican
55,Mon May 08 23:22:01 +0000 2017,8.61723E+17,3,1,Find out what they are saying about my #GOAct: https://t.co/9dQrFvY7cx,SenCapito,Shelly Moore Capito,West Virginia,Republican
56,Mon May 08 22:43:58 +0000 2017,8.61713E+17,1,3,"We're fortunate to have a leader, veteran &amp; woman like @HeatherAnWilson leading the men &amp; women of the @usairforce: https://t.co/QsXFLO7cKk",SenCapito,Shelly Moore Capito,West Virginia,Republican
57,Mon May 08 21:35:09 +0000 2017,8.61696E+17,1,6,Belington-natives Heather &amp; River Johnson were in D.C. last wk to urge members of Congress to #ThinkBabies. Great t… https://t.co/p21lcNS1YX,SenCapito,Shelly Moore Capito,West Virginia,Republican
58,Mon May 08 20:47:04 +0000 2017,8.61684E+17,3,4,Speaking on the @SenateFloor now in support of my good friend &amp; former colleague @HeatherAnWilson. WATCH live: https://t.co/B78ZDHukws,SenCapito,Shelly Moore Capito,West Virginia,Republican
59,Mon May 08 20:25:43 +0000 2017,8.61679E+17,8,6,High fives all around today during my West Virginia Girls Rise Up program at Geary Elementary School! https://t.co/8seQwkYY5S,SenCapito,Shelly Moore Capito,West Virginia,Republican
60,Mon May 08 16:25:00 +0000 2017,8.61618E+17,1,6,Good visit last week w/ The WV Beer &amp; Wine Association talking about federal tax and funding issues for distributor… https://t.co/HL0k3EtozP,SenCapito,Shelly Moore Capito,West Virginia,Republican
61,Mon May 08 13:30:02 +0000 2017,8.61574E+17,4,2,Please join us this week in celebrating the tireless efforts of America’s teachers during National Teacher Appreciation Week. #thankateacher,SenCapito,Shelly Moore Capito,West Virginia,Republican
62,Sun May 07 15:24:02 +0000 2017,8.6124E+17,13,8,Updated the WV members of the Alliance for Childhood Cancer about the #STARAct &amp; heard about their advocacy to help young cancer victims.,SenCapito,Shelly Moore Capito,West Virginia,Republican
63,Sun May 07 14:30:02 +0000 2017,8.61227E+17,2,1,Catch up on the latest in my weekly newsletter: https://t.co/p7XbiE47kw https://t.co/iMRzwOJiv8,SenCapito,Shelly Moore Capito,West Virginia,Republican
64,Sat May 06 15:17:23 +0000 2017,8.60876E+17,5,7,"Honored to celebrate @MCL_HQ. Thanks for making our state a brighter place, especially through your work on suicide… https://t.co/7ZO0XjWUnZ",SenCapito,Shelly Moore Capito,West Virginia,Republican
65,Sat May 06 13:27:01 +0000 2017,8.60848E+17,6,4,Had a great conversation w/ WV librarians about the goals of our libraries &amp; the educational services they provide. https://t.co/aN9fU1JlxS,SenCapito,Shelly Moore Capito,West Virginia,Republican
66,Fri May 05 16:09:08 +0000 2017,8.60527E+17,8,2,Have a minute? Catch up on my work in the Senate by watching this quick recap: https://t.co/NlNmli5arl,SenCapito,Shelly Moore Capito,West Virginia,Republican
67,Fri May 05 14:49:34 +0000 2017,8.60507E+17,2,6,"Many thanks to first responders and local law enforcement, fire fighters and others who have been working diligently throughout the morning.",SenCapito,Shelly Moore Capito,West Virginia,Republican
68,Fri May 05 14:49:15 +0000 2017,8.60507E+17,1,5,I am monitoring news of this morning’s crash at @YeagerAirport and send my condolences to the families who have been affected.,SenCapito,Shelly Moore Capito,West Virginia,Republican
69,Fri May 05 13:00:04 +0000 2017,8.60479E+17,4,6,Took the anti-bullying pledge with Miss Northern West Virginia’s Outstanding Teen last week. Thanks for stopping by… https://t.co/qD2TMmi0Sh,SenCapito,Shelly Moore Capito,West Virginia,Republican
70,Thu May 04 19:31:20 +0000 2017,8.60215E+17,19,1,"Learn how the government funding bill we just passed benefits WVians. Live from the floor now: 
https://t.co/V34KiHCXl5",SenCapito,Shelly Moore Capito,West Virginia,Republican
71,Thu May 04 18:32:46 +0000 2017,8.60201E+17,0,2,Was proud to vote for gov funding bill that provides critical resources to help WV in important ways. My statement: https://t.co/SurTgSFROR,SenCapito,Shelly Moore Capito,West Virginia,Republican
72,Thu May 04 17:34:18 +0000 2017,8.60186E+17,6,2,Led bipartisan group of senators to reintroduce bill that helps seniors who rely on community pharmacies: https://t.co/5KLhkBa6XU,SenCapito,Shelly Moore Capito,West Virginia,Republican
73,Thu May 04 16:12:01 +0000 2017,8.60165E+17,1,1,#tbt to when my grandson Charlie came to work w/ me &amp; we met Olympic gymnast &amp; #DWTS contestant @SimoneBiles. What… https://t.co/qYNMUMpyrg,SenCapito,Shelly Moore Capito,West Virginia,Republican
74,Thu May 04 14:41:01 +0000 2017,8.60142E+17,1,1,Congrats to this year’s WV @SBAgov award winners! Small biz leaders like you are the backbone of our communities &amp;… https://t.co/BN8XOaOAC9,SenCapito,Shelly Moore Capito,West Virginia,Republican
75,Thu May 04 13:50:36 +0000 2017,8.6013E+17,4,2,Great to catch up w/ @EPAScottPruitt yesterday about West Virginia's energy priorities. https://t.co/zWJhKv24o7,SenCapito,Shelly Moore Capito,West Virginia,Republican
76,Wed May 03 19:49:58 +0000 2017,8.59858E+17,6,11,"Today I introduced the #GOAct to help expand #broadband &amp; better connect low-income, rural communities. Learn more: https://t.co/au5hG5edzQ",SenCapito,Shelly Moore Capito,West Virginia,Republican
77,Wed May 03 18:18:05 +0000 2017,8.59834E+17,2,1,Last week my staff joined the Roane County Long Term Recovery Group as they dedicated 3 houses to #wvflood victims… https://t.co/pcULRt4Yik,SenCapito,Shelly Moore Capito,West Virginia,Republican
78,Wed May 03 13:37:00 +0000 2017,8.59764E+17,4,1,Don't miss @SenateCommerce's #broadband #infrastructure hearing at 10 where I’ll discuss my new #GOAct. WATCH: https://t.co/JsOJLe9oU6,SenCapito,Shelly Moore Capito,West Virginia,Republican
79,Tue May 02 22:21:36 +0000 2017,8.59533E+17,1,1,Intro’d a bill today to help prepare students w/ skills for good-paying jobs in their communities. #CTE Learn more: https://t.co/Eb0LuLc2td,SenCapito,Shelly Moore Capito,West Virginia,Republican
80,Tue May 02 17:06:46 +0000 2017,8.59454E+17,3,3,Did anyone catch @Simone_Biles and @SashaFarber last night on #DWTS? They make the Charleston dance look easy! Way… https://t.co/7EQ8edXEsY,SenCapito,Shelly Moore Capito,West Virginia,Republican
81,Mon May 01 22:38:46 +0000 2017,8.59175E+17,4,3,Met a few furry friends who were in the @uscapitol today for National Purebred Dog Day! 🐶 https://t.co/c9tArRwlJW,SenCapito,Shelly Moore Capito,West Virginia,Republican
82,Mon May 01 21:28:05 +0000 2017,8.59158E+17,2,3,ICYMI: The government funding agreement includes a number of significant wins for WVians. My full statement: https://t.co/ZkJj47TxcW,SenCapito,Shelly Moore Capito,West Virginia,Republican
83,Mon May 01 17:04:39 +0000 2017,8.59091E+17,13,6,"With my help, we’ve reached an agreement on a permanent fix for miners’ health care. Details here: https://t.co/ypLtvfFBP0",SenCapito,Shelly Moore Capito,West Virginia,Republican
84,Mon May 01 13:16:01 +0000 2017,8.59034E+17,0,2,So proud of @Webcohigh's Tyler Ray who represented WV in @PoetryOutLoud. Great to chat w/ him during #WVWednesday l… https://t.co/qFs4cqOPyP,SenCapito,Shelly Moore Capito,West Virginia,Republican
85,Sun Apr 30 20:45:46 +0000 2017,8.58784E+17,1,16,"Lucky to have served w/ @RosLehtinen in Congress. She is an inspiration, a good friend &amp; a true leader. You’ll be missed Ileana!",SenCapito,Shelly Moore Capito,West Virginia,Republican
86,Sun Apr 30 20:07:00 +0000 2017,8.58775E+17,1,1,"ICYMI: On Friday, I announced @HHSGov funding for Head Start programs in @huntingtoncity area. Learn more here: https://t.co/IE9Ep9BLbA",SenCapito,Shelly Moore Capito,West Virginia,Republican
87,Sun Apr 30 16:44:01 +0000 2017,8.58724E+17,1,2,Had the chance to congratulate Stacie Rohn for being named WV’s Mother of the Year. Thanks for all you do to inspir… https://t.co/Vwxm9rkwCx,SenCapito,Shelly Moore Capito,West Virginia,Republican
88,Sun Apr 30 14:03:02 +0000 2017,8.58683E+17,2,1,My weekly newsletter is hitting inboxes now – read it here for an update: https://t.co/80CqVozLOO https://t.co/gKS2V4wVYJ,SenCapito,Shelly Moore Capito,West Virginia,Republican
89,Sat Apr 29 18:39:02 +0000 2017,8.5839E+17,1,2,"After a 3 year renovation, Charles Washington Hall is back up &amp; running! Enjoyed my visit there recently. https://t.co/DnLUVBGuwc",SenCapito,Shelly Moore Capito,West Virginia,Republican
90,Sat Apr 29 16:06:00 +0000 2017,8.58352E+17,0,4,It was a true honor to present WV veteran Thomas Taylor with war medals he lost during #wvflood. Thank you for your… https://t.co/8pS78pXcnH,SenCapito,Shelly Moore Capito,West Virginia,Republican
91,Sat Apr 29 13:30:02 +0000 2017,8.58312E+17,2,3,ICYMI: New funding headed to local fire departments in WV to help keep our communities safe: https://t.co/W5lTcXSkNk,SenCapito,Shelly Moore Capito,West Virginia,Republican
92,Fri Apr 28 19:03:29 +0000 2017,8.58034E+17,3,5,Don’t forget that National Drug #TakeBack Day is happening tomorrow from 10AM-2PM. Find a drop off site near you:… https://t.co/imtVi8aY71,SenCapito,Shelly Moore Capito,West Virginia,Republican
93,Fri Apr 28 16:45:25 +0000 2017,8.57999E+17,1,1,My weekly video message is back! Watch for a quick recap of this week in the Senate: https://t.co/ywjOYKoA0p,SenCapito,Shelly Moore Capito,West Virginia,Republican
94,Fri Apr 28 12:39:18 +0000 2017,8.57937E+17,3,3,Thank you to my friend @BethVorhees for your 32 years of hard work &amp; professionalism at @wvpublic. You will be missed!,SenCapito,Shelly Moore Capito,West Virginia,Republican
95,Thu Apr 27 22:48:17 +0000 2017,8.57728E+17,2,11,"Glad the Senate confirmed Alex Acosta as @USDOL sec. Now let’s get to work creating jobs, opportunity &amp; safe workplaces for all Americans.",SenCapito,Shelly Moore Capito,West Virginia,Republican
96,Thu Apr 27 20:00:26 +0000 2017,8.57686E+17,4,2,Had fun showing my grandson Charlie around the Senate today. Wish he could come to work with me every day! https://t.co/yHMTtuEiHV,SenCapito,Shelly Moore Capito,West Virginia,Republican
97,Thu Apr 27 17:43:11 +0000 2017,8.57651E+17,5,5,Just intro’d a bipartisan bill to help improve senior’s access to #hospice care in rural America. More details: https://t.co/0G3cLnKR0F,SenCapito,Shelly Moore Capito,West Virginia,Republican
98,Thu Apr 27 14:10:15 +0000 2017,8.57598E+17,1,2,"Speaking w/ @HoppyKercheval about @POTUS’ tax plan, Miners Protection Act &amp; more. Tune in to @WVMetroNews at 10:20: https://t.co/jehbgFxtmI",SenCapito,Shelly Moore Capito,West Virginia,Republican
99,Thu Apr 27 01:51:51 +0000 2017,8.57412E+17,3,10,Great news for WV that @WVGovernor signed #wvlegis #broadband bill into law. This is a resource we must have to create economic opportunity.,SenCapito,Shelly Moore Capito,West Virginia,Republican
100,Wed Apr 26 20:10:38 +0000 2017,8.57326E+17,4,26,Joined @MineWorkers retirees at the @uscapitol today to urge Congress to keep the healthcare promise made to these… https://t.co/tScupD4V5x,SenCapito,Shelly Moore Capito,West Virginia,Republican
101,Tue Apr 25 21:38:09 +0000 2017,8.56986E+17,5,4,Was happy to join @WhiteHouse mtg on fighting country's opioid epidemic. Looking forward to working w/ @GovChristie on this critical effort.,SenCapito,Shelly Moore Capito,West Virginia,Republican
102,Tue Apr 25 20:15:49 +0000 2017,8.56965E+17,9,37,It’s critical that Congress pass a permanent health care extension for retirees like these @MineWorkers who worked… https://t.co/hl2e2wEa7c,SenCapito,Shelly Moore Capito,West Virginia,Republican
103,Mon Apr 24 22:39:25 +0000 2017,8.56639E+17,4,6,My statement on tonight’s vote to confirm Gov. Sonny Perdue as @USDA secretary: https://t.co/rsoWQsv0tj,SenCapito,Shelly Moore Capito,West Virginia,Republican
104,Mon Apr 24 18:26:26 +0000 2017,8.56575E+17,2,2,Sat down w/ employees at Williamson Health &amp; Wellness Center Monday to discuss healthcare and economic &amp; community… https://t.co/zx5Kxfan8G,SenCapito,Shelly Moore Capito,West Virginia,Republican
105,Mon Apr 24 12:38:58 +0000 2017,8.56488E+17,3,1,I’ll be on @Talkradiowrnr shortly talking about my Eastern Panhandle visits today &amp; more. Listen in at 8:40: https://t.co/3QPH1T4AnI,SenCapito,Shelly Moore Capito,West Virginia,Republican
106,Sat Apr 22 15:37:12 +0000 2017,8.55808E+17,1,3,Had the chance to meet with Mayor Nolletti &amp; Logan city staff members while I was in town this week. https://t.co/1gZdigatc2,SenCapito,Shelly Moore Capito,West Virginia,Republican
107,Fri Apr 21 18:38:58 +0000 2017,8.55491E+17,3,4,Thrilled to be in America’s Best Community @huntingtoncity last night for @ChamberAlerts annual dinner. Thanks for… https://t.co/u9VWzyY7Jg,SenCapito,Shelly Moore Capito,West Virginia,Republican
108,Thu Apr 20 23:14:12 +0000 2017,8.55198E+17,0,4,Applauded @HHSGov funding to combat the opioid epidemic in WV. My full statement: https://t.co/JdYQdmec4W,SenCapito,Shelly Moore Capito,West Virginia,Republican
