,created_at,id_str,reply_count,retweet_count,text,user,name,state,party
932,Mon Sep 30 17:24:41 +0000 2013,3.84731E+17,4,7,"Tillis, Berger Issue Joint Statement on Election Reform Law: http://t.co/QHWqkdlRq8 #ncga #ncpol",ThomTillis,Thom Tillis,North Carolina,Republican
933,Fri Sep 27 23:18:27 +0000 2013,3.83732E+17,1,1,"Congratulations, Tricia. “@triciacotham: @JerryMeekJD and I are excited to announce the arrival of Ryan Francis Meek! #ncpol #ncpolbaby”",ThomTillis,Thom Tillis,North Carolina,Republican
934,Sat Sep 21 15:45:29 +0000 2013,3.81444E+17,11,7,"Tillis: ""We Must Defund Obamacare Now.  Admit it Mr. President.  It is time to press RESET."" http://t.co/lCSifMeomA via @thomtillis",ThomTillis,Thom Tillis,North Carolina,Republican
935,Mon Sep 16 16:50:05 +0000 2013,3.79648E+17,4,3,We just launched our new website at http://t.co/eC12mzqgf6. Let me know what you think.,ThomTillis,Thom Tillis,North Carolina,Republican
936,Mon Sep 16 15:27:03 +0000 2013,3.79627E+17,1,5,"Friends, please pray for the victims of the shooting at the U.S. Navy Yard this morning.",ThomTillis,Thom Tillis,North Carolina,Republican
937,Wed Sep 11 13:16:19 +0000 2013,3.77783E+17,0,3,"12 yrs. ago today, one of the saddest days in our Nation's history came to pass. We continue to pray for the victims &amp; their loved ones.",ThomTillis,Thom Tillis,North Carolina,Republican
938,Sun Sep 08 16:20:51 +0000 2013,3.76742E+17,1,1,I'm hating the fact that I'm not at the Panther's game today but I'll be listening. GO PANTHERS! Luuuuuuke! Luuuuuuuuke! Luuuuuuuuke!,ThomTillis,Thom Tillis,North Carolina,Republican
939,Wed Sep 04 23:08:50 +0000 2013,3.75395E+17,0,2,Susan &amp; I wish those celebrating Rosh Hashanah a very happy &amp; healthy New Year.,ThomTillis,Thom Tillis,North Carolina,Republican
940,Mon Sep 02 22:13:00 +0000 2013,3.74656E+17,2,1,"Excellent article in ""The Weekly Standard"" on the structural problems with Obamacare and an alternative.  http://t.co/rmo5VU7Ff2",ThomTillis,Thom Tillis,North Carolina,Republican
941,Fri Aug 23 01:39:05 +0000 2013,3.70722E+17,1,1,Loving the Panthers-Ravens game. Kuechly is a BEAST. He is counting the seconds to get back into the game &amp; this is preseason. Go Panthers!,ThomTillis,Thom Tillis,North Carolina,Republican
942,Tue Aug 20 03:56:38 +0000 2013,3.69669E+17,3,9,Hagan is with Obama and Reid 96% of the time.  Are you with us?  Join our team. https://t.co/RKZyOKKIlQ,ThomTillis,Thom Tillis,North Carolina,Republican
943,Fri Aug 16 00:40:27 +0000 2013,3.6817E+17,5,10,"My friend Gov. McCrory vetoed 2 bills today. Although we differ on these matters, we share a common vision for  North Carolina. #ncgop #ncga",ThomTillis,Thom Tillis,North Carolina,Republican
944,Mon Aug 12 01:41:40 +0000 2013,3.66736E+17,1,2,"13,000 ""likes"" by Friday &amp; now we are approaching 14,000 ""likes"" in just 2 days! Let's get to 15,000 ""likes"" ASAP.  https://t.co/doGypFJfZo",ThomTillis,Thom Tillis,North Carolina,Republican
945,Sun Aug 11 21:47:22 +0000 2013,3.66677E+17,1,3,NC State professor predicts job growth.  http://t.co/Nbghf9fkC6,ThomTillis,Thom Tillis,North Carolina,Republican
946,Sun Aug 11 21:36:06 +0000 2013,3.66674E+17,3,18,"In NC, we have reduced the size of government, we have no deficit, and people are getting back to work.  We CAN do this for our nation.",ThomTillis,Thom Tillis,North Carolina,Republican
947,Sun Aug 11 21:34:31 +0000 2013,3.66674E+17,2,2,"We change the country by reducing the size of government, reducing the deficit, and getting people back to work.",ThomTillis,Thom Tillis,North Carolina,Republican
948,Sun Aug 11 21:31:32 +0000 2013,3.66673E+17,7,4,"N.C. State economist says NC will add more than 100,000 jobs this year &amp; next. That would  lower NC’s unemployment rate from 8.8% to 6.8%.",ThomTillis,Thom Tillis,North Carolina,Republican
949,Sun Aug 11 15:17:02 +0000 2013,3.66579E+17,3,1,Conservatives differ as to how we do it but all agree we must REPEAL Obamacare.  Sign the petition. #ncgop  https://t.co/LA6kTRgL7Y,ThomTillis,Thom Tillis,North Carolina,Republican
950,Sun Aug 11 14:34:45 +0000 2013,3.66568E+17,2,2,Changing the direction of the Greatest Nation is not a spectator sport. We all must get in the game.  https://t.co/doGypFJfZo #ncga #ncgop,ThomTillis,Thom Tillis,North Carolina,Republican
951,Sun Aug 11 01:58:14 +0000 2013,3.66378E+17,3,4,In 2010/2012 we fought back &amp; we gained ground. 2014 is OUR opportunity. Help us get our Great Nation back on track. https://t.co/doGypFJfZo,ThomTillis,Thom Tillis,North Carolina,Republican
952,Sat Aug 10 21:34:15 +0000 2013,3.66312E+17,0,2,"The momentum continues to build on our US Senate page.  Help us top 14,000 ""likes""! Thank you for your support!  https://t.co/doGypFJfZo",ThomTillis,Thom Tillis,North Carolina,Republican
953,Sat Aug 10 14:34:19 +0000 2013,3.66206E+17,15,7,"Avg teacher base pay is $45,947 + avg of $4,931 health benefits, $5,383 pension, and $3,139 SS. #ncpol #rednc #NCEd http://t.co/ReCdU0Swkj",ThomTillis,Thom Tillis,North Carolina,Republican
954,Sat Aug 10 01:26:38 +0000 2013,3.66008E+17,12,5,In 2012 #ncga gave teachers a small pay raise - 1.2% ... 1st in 4 years in tough economic times.  http://t.co/ReCdU0Swkj #ncpol @longshoals,ThomTillis,Thom Tillis,North Carolina,Republican
955,Sat Aug 10 01:20:45 +0000 2013,3.66006E+17,1,1,"We topped 13K ""likes"" today on our US Senate FB page!  Help us top 14,000 by next Friday.  Thanks for the support!  https://t.co/doGypFJfZo",ThomTillis,Thom Tillis,North Carolina,Republican
956,Sat Aug 10 00:03:25 +0000 2013,3.65987E+17,4,1,"When current info does not work liberals go ""backward"" a year to build a case?  Seriously @backwardNC ?",ThomTillis,Thom Tillis,North Carolina,Republican
957,Sat Aug 10 00:00:54 +0000 2013,3.65986E+17,10,2,The liberal left must accept the inconvenient truth.  Graduation rates up &amp; responsible education spending in NC.  http://t.co/QHWqkdlRq8,ThomTillis,Thom Tillis,North Carolina,Republican
958,Fri Aug 09 23:52:39 +0000 2013,3.65984E+17,3,2,The new NC budget keeps pace with both inflation and the growth in the number of students http://t.co/ReCdU0Swkj #ncpol #rednc #NCEd,ThomTillis,Thom Tillis,North Carolina,Republican
959,Fri Aug 09 23:49:27 +0000 2013,3.65983E+17,2,5,A special shout out to my home county of Mecklenburg.  Graduations rates have jumped and we are now above the national average!,ThomTillis,Thom Tillis,North Carolina,Republican
960,Fri Aug 09 23:47:36 +0000 2013,3.65983E+17,6,5,"NC graduation rates are up and now NC is above the nation average.  Thanks to teachers, principals, and parents!  http://t.co/0cSPg6XeT2",ThomTillis,Thom Tillis,North Carolina,Republican
961,Thu Aug 08 19:48:10 +0000 2013,3.6556E+17,2,9,The amount spent on NC education programs will actually increase by $400 million next year.  http://t.co/ReCdU0Swkj #ncpol #rednc #NCEd,ThomTillis,Thom Tillis,North Carolina,Republican
962,Sun Aug 04 21:33:16 +0000 2013,3.64137E+17,2,6,The US debt is rising almost $200 MILLION an hour.  Obama &amp; Hagan are doubling down on debt.  We must stop this. http://t.co/AnekVkNliX,ThomTillis,Thom Tillis,North Carolina,Republican
963,Sun Aug 04 21:08:41 +0000 2013,3.64131E+17,0,1,"16 away from 12,000 ""likes"" on our US Senate FB page.  Please retweet and ask your friends to visit/like our page. https://t.co/doGypFJfZo",ThomTillis,Thom Tillis,North Carolina,Republican
964,Sat Aug 03 13:09:24 +0000 2013,3.63648E+17,4,2,"Help us top the 12,000 mark this weekend on our TILLIS for US SENATE FB page... https://t.co/2NCwhgyM6a",ThomTillis,Thom Tillis,North Carolina,Republican
965,Fri Aug 02 03:05:15 +0000 2013,3.63133E+17,2,2,@Gkelly20 The whole fair and balanced NYT editorial board?  Seriously?,ThomTillis,Thom Tillis,North Carolina,Republican
966,Fri Aug 02 03:01:06 +0000 2013,3.63132E+17,0,2,@Gkelly20 The NYT piece was an opinion piece too dude.,ThomTillis,Thom Tillis,North Carolina,Republican
967,Fri Aug 02 03:00:21 +0000 2013,3.63132E+17,2,3,Senator Baucus (D) the architect/engineer of Obamacare says it is headed for a train wreck?  https://t.co/811ooIkELB,ThomTillis,Thom Tillis,North Carolina,Republican
968,Fri Aug 02 02:45:52 +0000 2013,3.63128E+17,13,15,Forget the NY Times.  Look what Forbes is saying about NC!  I'm proud of the NC House!  http://t.co/y4bMIrDme3,ThomTillis,Thom Tillis,North Carolina,Republican
969,Fri Aug 02 02:43:07 +0000 2013,3.63128E+17,5,4,I believe the not-so-gradual encroachments of Pres. Obama &amp; Senators Reid/Hagan are the greatest threat to our security &amp; our freedom.,ThomTillis,Thom Tillis,North Carolina,Republican
970,Fri Aug 02 02:33:44 +0000 2013,3.63125E+17,4,8,"""There are more instances of the abridgement of freedom by gradual encroachments by those in power than by violent usurpations."" J. Madison",ThomTillis,Thom Tillis,North Carolina,Republican
971,Thu Aug 01 00:53:07 +0000 2013,3.62738E+17,5,5,Stand with us against Obamacare.  Sign our petition calling for repeal.   https://t.co/SnQeiLWmwo,ThomTillis,Thom Tillis,North Carolina,Republican
972,Sat Jul 27 21:18:41 +0000 2013,3.61234E+17,1,1,Happy belated Birthday Zan Bunn! @zanbunn #NCGA,ThomTillis,Thom Tillis,North Carolina,Republican
973,Sat Jul 27 21:14:36 +0000 2013,3.61233E+17,0,5,RT @JamieBollWBTV: RT @CatCoEM: Mudslide in NE area of Catawba County. #ncwx http://t.co/BoWNDsj59h ... Raining hard in Cornelius.  too.,ThomTillis,Thom Tillis,North Carolina,Republican
974,Sat Jul 27 21:13:26 +0000 2013,3.61233E+17,2,2,I hate to see the summer slip away but I love the start of the NFL and college football season.  GO PANTHERS!  @Panthers,ThomTillis,Thom Tillis,North Carolina,Republican
975,Sat Jul 27 16:00:53 +0000 2013,3.61154E+17,0,2,Join our efforts to reverse the dangerous policies of Obama/Hagan.  Let's get the Greatest Nation back on track.   https://t.co/doGypFJfZo,ThomTillis,Thom Tillis,North Carolina,Republican
976,Sat Jul 27 15:58:55 +0000 2013,3.61154E+17,0,3,"Detroit's demise resulted from over-taxing, over-regulating, big-government policies.  A course Obama and Hagan have our country on.",ThomTillis,Thom Tillis,North Carolina,Republican
977,Wed Jul 24 17:28:03 +0000 2013,3.60089E+17,2,3,Pro-Growth Tax Reform Crosses the Finish Line in North Carolina: http://t.co/fkEAsjTsHo,ThomTillis,Thom Tillis,North Carolina,Republican
978,Wed Jul 24 03:08:25 +0000 2013,3.59873E+17,2,5,"8 ""likes"" away from topping 10k.  Help us put the Greatest Nation on earth back on the right path.  https://t.co/doGypFJfZo",ThomTillis,Thom Tillis,North Carolina,Republican
979,Tue Jul 23 11:48:56 +0000 2013,3.59641E+17,2,4,"Join the TILLIS for US SENATE team.  ""Like"" our campaign FB page.  https://t.co/doGypFJfZo",ThomTillis,Thom Tillis,North Carolina,Republican
980,Tue Jul 23 11:46:15 +0000 2013,3.59641E+17,2,2,Budget debate begins today on the NC House floor.  For a summary of the budget CLICK this http://t.co/jcRZuZhqvT,ThomTillis,Thom Tillis,North Carolina,Republican
981,Sun Jul 21 19:25:42 +0000 2013,3.59031E+17,5,2,Want an update on what we are doing in the NC House?  http://t.co/QHWqkdlRq8 #NCGA,ThomTillis,Thom Tillis,North Carolina,Republican
982,Sun Jul 21 19:23:05 +0000 2013,3.59031E+17,8,7,Those like me who want HB 937 passed: Check out this link from the NRA and help us get it done.  http://t.co/Lx3F5Ox5cg,ThomTillis,Thom Tillis,North Carolina,Republican
983,Sun Jul 21 19:13:44 +0000 2013,3.59028E+17,0,3,"Help us top 10,000 likes on Tillis for US Senate.  https://t.co/doGypFJfZo",ThomTillis,Thom Tillis,North Carolina,Republican
984,Thu Jul 18 00:14:04 +0000 2013,3.57654E+17,9,24,"Proud to ratify historic Tax Reform Plan in Raleigh today. Promises made, promises kept. #ncga #ncpol http://t.co/E2tJnnXe0F",ThomTillis,Thom Tillis,North Carolina,Republican
985,Mon Jul 15 21:09:12 +0000 2013,3.56883E+17,4,8,Historic day in Raleigh-our plan will provide tax relief for working families throughout NC &amp; will enable businesses to create more jobs.,ThomTillis,Thom Tillis,North Carolina,Republican
986,Fri Jul 12 15:39:29 +0000 2013,3.55713E+17,1,6,Excellent read from @grovernorquist &amp; @patrickmgleason on similarities between Wisconsin and North Carolina: http://t.co/nqvMxAWNiO,ThomTillis,Thom Tillis,North Carolina,Republican
987,Thu Jul 04 13:36:03 +0000 2013,3.52783E+17,3,6,On July 4th remember the brave men &amp; women who fought for our freedom. They are the foundation of the USA--the greatest nation on earth.,ThomTillis,Thom Tillis,North Carolina,Republican
988,Mon Jul 01 20:21:15 +0000 2013,3.51798E+17,1,6,Praying for the families of the firefighters who lost their lives in AZ yesterday. We thank these heroes for their selfless service.,ThomTillis,Thom Tillis,North Carolina,Republican
989,Sun Jun 23 01:29:37 +0000 2013,3.48614E+17,0,1,Good times my high school year. This song remains one of my favorites. http://t.co/mC4ovmrvbK,ThomTillis,Thom Tillis,North Carolina,Republican
990,Fri Jun 21 00:53:14 +0000 2013,3.4788E+17,1,2,"Proud to see 2 great NC teams playing in the CWS. Friends pulling 4 the Heels &amp; others 4 the Pack, but we are all 4 NC to win it all!",ThomTillis,Thom Tillis,North Carolina,Republican
991,Thu Jun 20 03:08:49 +0000 2013,3.47552E+17,3,6,"LA Senator Elbert Guillory. Welcome to the Republican Party.
http://t.co/QOEzOxggyv",ThomTillis,Thom Tillis,North Carolina,Republican
992,Thu Jun 20 02:40:00 +0000 2013,3.47544E+17,2,1,Feeling very special these folks are interested in me. http://t.co/HmUiPMB9Rh I enjoyed the mud run too.   Join US at http://t.co/lEdBQozMuS,ThomTillis,Thom Tillis,North Carolina,Republican
993,Thu Jun 20 02:27:12 +0000 2013,3.47541E+17,6,7,"RT @AndyBallNC: Andy, my friend.  Consider remedial math and economics at your earliest convenience.",ThomTillis,Thom Tillis,North Carolina,Republican
994,Wed Jun 19 20:42:20 +0000 2013,3.47454E+17,0,2,Rep. Saine and son Jackson in the NC House chamber during session. #ncga http://t.co/0PSaFNXNsG,ThomTillis,Thom Tillis,North Carolina,Republican
995,Mon Jun 17 17:00:01 +0000 2013,3.46674E+17,1,12,"Our state has lost one of its greatest sons, but Gov. Holshouser will be remembered &amp; respected for generations to come. Godspeed, Governor.",ThomTillis,Thom Tillis,North Carolina,Republican
996,Sun Jun 16 13:07:32 +0000 2013,3.46253E+17,0,4,FB friends.  We have created a Facebook page for my US Senate race and we will be removing this site in the near... http://t.co/g6pkKEDRyb,ThomTillis,Thom Tillis,North Carolina,Republican
997,Fri Jun 14 17:01:59 +0000 2013,3.45587E+17,1,2,"@RepDavidRLewis @NCHouseBeards @thomtillis Hold firm my friend and tell your baby girl it is for a good cause...Saving $50,000 a day.",ThomTillis,Thom Tillis,North Carolina,Republican
998,Fri Jun 14 13:40:17 +0000 2013,3.45536E+17,0,6,"Visit the TILLIS for US Senate Facebook page and ""like"" @ https://t.co/MrPU8MUQtl #NCGA #NCGOP",ThomTillis,Thom Tillis,North Carolina,Republican
999,Thu Jun 13 16:40:44 +0000 2013,3.45219E+17,0,4,"Rep. Dollar ""Never has logic been so tortured"" on the democrat's objections to our fiscally responsible budget.  Great work House leaders.",ThomTillis,Thom Tillis,North Carolina,Republican
1000,Thu Jun 13 15:20:19 +0000 2013,3.45199E+17,0,4,"Check out the latest edition of ""Raleigh Digest"" for an update on the good work in the North Carolina House.  http://t.co/gauw2JJ0t0 #NCGA",ThomTillis,Thom Tillis,North Carolina,Republican
1001,Wed Jun 12 17:52:32 +0000 2013,3.44875E+17,1,1,I am glad to see my friend and colleagues @triciacotham back in the House chamber.  Welcome back Tricia!,ThomTillis,Thom Tillis,North Carolina,Republican
1002,Sat Jun 08 16:25:58 +0000 2013,3.43404E+17,1,7,Always great to visit with the next generation of Republicans. #NCGOPConvention http://t.co/Wm4O0hhVNh,ThomTillis,Thom Tillis,North Carolina,Republican
1003,Fri Jun 07 17:05:00 +0000 2013,3.43051E+17,4,13,"House votes to give all North Carolinians much-needed tax relief. Thanks to Reps. Lewis, Setzer, Moffitt, &amp; Szoka for their hard work. #ncga",ThomTillis,Thom Tillis,North Carolina,Republican
1004,Wed Jun 05 17:38:49 +0000 2013,3.42335E+17,1,20,"On this anniversary of President Reagan's passing, I am reminded daily of his steadfast leadership. http://t.co/jq5FUjGXFN",ThomTillis,Thom Tillis,North Carolina,Republican
1005,Sun Jun 02 02:01:15 +0000 2013,3.41012E+17,1,8,Hoping all is good with my friend Tricia Cotham.  Be well Tricia. @triciacotham #ncga,ThomTillis,Thom Tillis,North Carolina,Republican
1006,Fri May 31 12:17:30 +0000 2013,3.40442E+17,14,53,"Friends, I have decided to run for the US Senate against Kay Hagan in 2014. I hope to earn your support.  http://t.co/8d2pk2xUvr",ThomTillis,Thom Tillis,North Carolina,Republican
1007,Wed May 29 03:37:48 +0000 2013,3.39586E+17,3,2,"RT @Matt_Mittan: @thomtillis - ""So the NCLEG is deferring to AFP officially then?""  When they are right, they are right.",ThomTillis,Thom Tillis,North Carolina,Republican
1008,Tue May 28 21:48:51 +0000 2013,3.39499E+17,2,4,So what has the NC House and Senate been doing?  Ask Americans for Prosperity. #ncga http://t.co/LsbJgT5kHI,ThomTillis,Thom Tillis,North Carolina,Republican
1009,Sun May 26 13:55:39 +0000 2013,3.38655E+17,3,17,"Greater love has no one than this, that one lay down his life for his friends. John 15:13  Honor fallen soldiers this Memorial Day weekend.",ThomTillis,Thom Tillis,North Carolina,Republican
1010,Sat May 25 15:22:49 +0000 2013,3.38314E+17,0,2,RT @thomtillis: RT @ltccarver: How #Memorial Day came to be. Via @amhistorymuseum: http://t.co/faBsQiMOGj,ThomTillis,Thom Tillis,North Carolina,Republican
1011,Sat May 25 15:22:33 +0000 2013,3.38314E+17,0,2,RT @ltccarver: How #Memorial Day came to be. Via @amhistorymuseum: http://t.co/faBsQiMOGj,ThomTillis,Thom Tillis,North Carolina,Republican
1012,Sat May 25 15:21:28 +0000 2013,3.38314E+17,0,2,RT @nickwvaughn: Humbled and honored to have been chosen as the next Chairman of the North Carolina Federation of Teenage Republicans. #ncta,ThomTillis,Thom Tillis,North Carolina,Republican
1013,Thu May 23 01:00:46 +0000 2013,3.37372E+17,1,13,I am proud of my NC House and Senate members for winning the NC/SC legislative basketball challenge.  South Carolina legislators were great.,ThomTillis,Thom Tillis,North Carolina,Republican
1014,Tue May 21 01:36:21 +0000 2013,3.36657E+17,1,7,Praying for the victims &amp; first responders in Oklahoma. Visit http://t.co/KeXtmL5XIh to find out how to help.,ThomTillis,Thom Tillis,North Carolina,Republican
1015,Sun Apr 28 13:49:47 +0000 2013,3.28506E+17,6,9,Voter photo ID is a common-sense step for North Carolina | http://t.co/qZvWFPHToF http://t.co/7yJwTWMGsh,ThomTillis,Thom Tillis,North Carolina,Republican
1016,Fri Apr 26 03:15:36 +0000 2013,3.27622E+17,0,1,"RT @RobLamme: ""TT needs to try a hard tail, perhaps single speed..."" #bikegeektalk My bike: EPIC hard/soft tail...single speed sounds fun.",ThomTillis,Thom Tillis,North Carolina,Republican
1017,Wed Apr 24 12:05:55 +0000 2013,3.27031E+17,1,2,RT @RavenRavinoff:  Demi  FUNNY that a twitter bully like you is calling someone else a bully.  Good stuff.  @buncombeyrs @ncfyprs,ThomTillis,Thom Tillis,North Carolina,Republican
1018,Wed Apr 24 11:39:30 +0000 2013,3.27024E+17,0,7,Listen to VOTERID debate and vote in the NC House today at 2:10PM at http://t.co/7AC8cx9Zsw,ThomTillis,Thom Tillis,North Carolina,Republican
1019,Wed Apr 24 03:10:24 +0000 2013,3.26896E+17,3,6,"RT @BenRay: @newsobserver wants to know-- does GOP resent lobbying rules?  Benny, does the fact that the bill is dead give you any idea?",ThomTillis,Thom Tillis,North Carolina,Republican
1020,Wed Apr 24 02:47:57 +0000 2013,3.2689E+17,1,2,RT @pulseoxnc: NC’s infant mortality rate among highest in US; we test hearing &amp; not hearts??? PASSED big in the NC House.  #Pulseox,ThomTillis,Thom Tillis,North Carolina,Republican
1021,Tue Apr 23 23:40:34 +0000 2013,3.26843E+17,3,10,"Thrilled to join nearly 3,000 people in Greensboro this evening, supporting educational choice in NC. http://t.co/JO0Gd2Ufpr",ThomTillis,Thom Tillis,North Carolina,Republican
1022,Sun Apr 21 14:40:18 +0000 2013,3.25982E+17,2,3,"@RME3: 3 out of 4 NC citizens disagree that VOTER ID passing is a ""historically bad moment.""  Most believe it has been a long time coming.",ThomTillis,Thom Tillis,North Carolina,Republican
1023,Sun Apr 21 14:23:30 +0000 2013,3.25978E+17,2,3,Twitter is chatter.  FB is a conversation.  Both are good.  Join me on FB at https://t.co/7w9ButQE4b,ThomTillis,Thom Tillis,North Carolina,Republican
1024,Sun Apr 21 14:13:46 +0000 2013,3.25976E+17,3,10,We will bring the VOTER ID bill to the House floor for debate/vote on Weds/Thurs.  Join us in Raleigh to share this historic moment. #NCGA,ThomTillis,Thom Tillis,North Carolina,Republican
1025,Mon Apr 15 21:37:07 +0000 2013,3.23913E+17,2,8,Heartfelt thoughts &amp; prayers to those affected by the events in Boston today. #prayforboston,ThomTillis,Thom Tillis,North Carolina,Republican
1026,Fri Apr 12 17:35:40 +0000 2013,3.22765E+17,0,1,Check your facts @ForwardAmerican and check with @triciacotham.  Little homework next time?,ThomTillis,Thom Tillis,North Carolina,Republican
1027,Thu Apr 11 12:37:22 +0000 2013,3.22328E+17,1,11,Lies and exaggerations have speed but the truth has endurance.,ThomTillis,Thom Tillis,North Carolina,Republican
1028,Thu Apr 11 00:16:05 +0000 2013,3.22141E+17,0,3,"Thanks for your diligence, Chairman Lewis.“@RepDavidRLewis: 6 speakers remaining @ncga public hearing, dedicated citizens and Members” #ncga",ThomTillis,Thom Tillis,North Carolina,Republican
1029,Wed Apr 10 15:43:51 +0000 2013,3.22012E+17,0,9,"Hosting a great group of students, parents, and educators on the House floor to discuss school choice. #ncga",ThomTillis,Thom Tillis,North Carolina,Republican
1030,Tue Apr 09 14:21:00 +0000 2013,3.21629E+17,0,2,"Finally, media coverage of GOP tax cuts from last year's budget that are providing relief to small businesses #ncpol http://t.co/2IJAQzQbKh",ThomTillis,Thom Tillis,North Carolina,Republican
1031,Mon Apr 08 16:30:41 +0000 2013,3.21299E+17,0,5,"Godspeed to The Iron Lady, an exceptional leader during extraordinary times.",ThomTillis,Thom Tillis,North Carolina,Republican
1032,Tue Apr 02 12:38:04 +0000 2013,3.19066E+17,0,9,Veterans Day at the NCGA - great to have these heroes around the complex today. #ncga,ThomTillis,Thom Tillis,North Carolina,Republican
1033,Wed Mar 27 18:26:14 +0000 2013,3.16979E+17,0,3,"Enjoyed spending time with @SenatorBurr in my office today, a great leader for North Carolina in Washington, D.C.  #ncga #ncpol",ThomTillis,Thom Tillis,North Carolina,Republican
1034,Wed Mar 20 02:24:19 +0000 2013,3.14201E+17,0,4,My prayers are w/ the families of the 2nd Div. Marines of Camp Lejeune. Godspeed to those who lost their lives in this tragic incident.,ThomTillis,Thom Tillis,North Carolina,Republican
1035,Sun Mar 17 18:00:37 +0000 2013,3.13349E+17,0,9,"Voter ID foes say we've shifted our msg to ""Restore Confidence."" Read the title of last year's bill: ""Restore Confidence in Government""",ThomTillis,Thom Tillis,North Carolina,Republican
1036,Sat Mar 16 22:03:59 +0000 2013,3.13048E+17,2,2,Folks refusing to recognize the fiscal mess left us in 2011 reminds me of a great movie scene. http://t.co/jGkDq5TpWh @bcgop  Bye...,ThomTillis,Thom Tillis,North Carolina,Republican
1037,Sat Mar 16 21:41:06 +0000 2013,3.13042E+17,1,7,We honored the letter AND the spirit of the NC Constitution. What bonehead balances their budget with a credit card? @bcgop @ravenravinoff,ThomTillis,Thom Tillis,North Carolina,Republican
1038,Sat Mar 16 21:35:03 +0000 2013,3.13041E+17,1,1,Carles Carter.  You are right.  Republicans did fix the deficit. @bcgop @ncga @cncarterNC,ThomTillis,Thom Tillis,North Carolina,Republican
1039,Sat Mar 16 21:32:39 +0000 2013,3.1304E+17,1,1,@cncarterNC Spending money on recurring programs with nonrecurring revenue creates deficits. A hard concept for some to understand. @bcgop,ThomTillis,Thom Tillis,North Carolina,Republican
1040,Sat Mar 16 16:28:55 +0000 2013,3.12964E+17,3,9,I'll be joining @craigmelvin on @msnbc today at 3:30p to discuss Voter ID. Tune in to hear the importance of election integrity in NC.,ThomTillis,Thom Tillis,North Carolina,Republican
1041,Thu Mar 14 02:03:04 +0000 2013,3.12021E+17,2,4,Heading out to western NC next week with Susan (getaway).  And again in April to visit Haywood and Buncombe County GOP @bcgop @wncgop,ThomTillis,Thom Tillis,North Carolina,Republican
1042,Thu Mar 07 17:12:05 +0000 2013,3.09713E+17,1,8,"Joining @PatMcCrory this afternoon to announce @MetLife creating 2,600 jobs in North Carolina. #ncga #NCJOBS",ThomTillis,Thom Tillis,North Carolina,Republican
1043,Fri Mar 01 14:01:45 +0000 2013,3.07491E+17,0,4,Looking forward to joining @NCCivitas Conservative Leadership Conference today. #CLC13,ThomTillis,Thom Tillis,North Carolina,Republican
1044,Tue Feb 26 21:33:56 +0000 2013,3.06517E+17,0,3,"Thank you to Superintendents, Members, Lt. Gov., &amp; staff who attended today's discussion in the Chamber. Look forward to future talks. #ncga",ThomTillis,Thom Tillis,North Carolina,Republican
1045,Sat Feb 23 19:55:52 +0000 2013,3.05406E+17,0,1,In Chapel Hill with Citizens for Higher Education. Great dialogue on how to further improve our world-class university system.,ThomTillis,Thom Tillis,North Carolina,Republican
1046,Fri Feb 22 15:20:43 +0000 2013,3.04974E+17,1,5,"Liberals and democratic leaders reveal plan to ""cripple"" me and other state leaders.  Help me fight this. http://t.co/G9hld9CTLk",ThomTillis,Thom Tillis,North Carolina,Republican
1047,Fri Feb 22 02:58:55 +0000 2013,3.04787E+17,0,8,Congrats to Mark Edwards of Mooresville Graded School District on being named Nat'l. Superintendent of the year. http://t.co/zXN7OVLeFv,ThomTillis,Thom Tillis,North Carolina,Republican
