,created_at,id_str,reply_count,retweet_count,text,user,name,state,party
0,Sun Apr 16 14:02:24 +0000 2017,8.5361E+17,6,2,Susan and I wish you and your family a #HappyEaster! https://t.co/CsOYKvDZPb,ThomTillis,Thom Tillis,North Carolina,Republican
1,Sun Mar 19 14:04:26 +0000 2017,8.43463E+17,11,1,Tune in at 10:30am. I'll discuss the Neil Gorsuch confirmation with @MariaBartiromo. #SCOTUS #ConfirmGorsuch https://t.co/TktUFPNobs,ThomTillis,Thom Tillis,North Carolina,Republican
2,Wed Mar 08 02:57:38 +0000 2017,8.39309E+17,8,10,Must read: An incredibly moving  piece by @jmpalmieri about her late sister who had early onset Alzheimer’s. https://t.co/9RdmaItK5c,ThomTillis,Thom Tillis,North Carolina,Republican
3,Sun Feb 05 15:00:36 +0000 2017,8.28257E+17,197,15,I’ll be on shortly with @MariaBartiromo on @SundayFutures. Tune in!,ThomTillis,Thom Tillis,North Carolina,Republican
4,Wed Feb 01 01:58:19 +0000 2017,8.26611E+17,96,78,Neil Gorsuch is a mainstream judge who follows the rule of law. He will be an outstanding justice on the Supreme Court.,ThomTillis,Thom Tillis,North Carolina,Republican
5,Fri Jan 20 19:22:37 +0000 2017,8.22525E+17,123,98,On Inauguration Day our country watches as masked cowards take to the streets of our nation's capital. This behavior is completely shameful.,ThomTillis,Thom Tillis,North Carolina,Republican
6,Fri Jan 20 17:02:39 +0000 2017,8.2249E+17,73,24,Congratulations President Donald J. Trump! Now we begin the work of making America great again.,ThomTillis,Thom Tillis,North Carolina,Republican
7,Sun Jan 08 15:48:59 +0000 2017,8.18122E+17,4,49,Please help @gregolsen88 win $25k for @R4Rfoundation by tweeting #OlsenWPMOYChallenge. #PantherNation,ThomTillis,Thom Tillis,North Carolina,Republican
8,Fri Jan 06 21:32:59 +0000 2017,8.17484E+17,2,21,Please continue to keep Senator @kayhagan and her family in your thoughts and prayers. https://t.co/wtS2G8izMF,ThomTillis,Thom Tillis,North Carolina,Republican
9,Fri Dec 30 00:19:00 +0000 2016,8.14627E+17,5,12,It turns out that Obama will get to be President for an additional second: https://t.co/8UEWeHDoUQ #ThanksAtomicClocks,ThomTillis,Thom Tillis,North Carolina,Republican
10,Sun Dec 25 14:04:24 +0000 2016,8.13023E+17,4,3,"Merry Christmas and Happy Holidays from our family to yours! 

https://t.co/2BxqftLYa5",ThomTillis,Thom Tillis,North Carolina,Republican
11,Fri Dec 23 20:53:34 +0000 2016,8.12401E+17,8,49,"The U.S. should stand w/ our ally Israel on the world stage, not turn our backs.",ThomTillis,Thom Tillis,North Carolina,Republican
12,Fri Dec 23 20:52:39 +0000 2016,8.12401E+17,3,19,The Obama admin’s decision to abstain on the UN's anti-Israel resolution is shameful.,ThomTillis,Thom Tillis,North Carolina,Republican
13,Sat Dec 10 19:02:34 +0000 2016,8.07662E+17,4,23,"Susan and I are praying for @KayHagan and her family, and wish her a speedy recovery. https://t.co/z8c9N9kEnw",ThomTillis,Thom Tillis,North Carolina,Republican
14,Wed Dec 07 01:11:48 +0000 2016,8.06305E+17,2,20,"Our military families are a national treasure. They make amazing sacrifices, whether they wear the uniform or support loved ones who do.",ThomTillis,Thom Tillis,North Carolina,Republican
15,Wed Dec 07 01:09:10 +0000 2016,8.06305E+17,1,6,.@realDonaldTrump: 45% of Marine Corps based at Camp Lejeune.,ThomTillis,Thom Tillis,North Carolina,Republican
16,Wed Dec 07 01:07:07 +0000 2016,8.06304E+17,1,25,"In Fayetteville, @realDonaldTrump stresses an important fact: NC produces the very best servicemembers, who defend and protect America.",ThomTillis,Thom Tillis,North Carolina,Republican
17,Sat Nov 26 14:54:00 +0000 2016,8.02526E+17,10,46,"Fidel Castro was a brutal, oppressive dictator. I hope the years ahead will bring freedom to the people of Cuba.",ThomTillis,Thom Tillis,North Carolina,Republican
18,Thu Nov 24 15:26:43 +0000 2016,8.01809E+17,1,7,"Susan and I wish you and your family a #HappyThanksgiving. Today, please keep the victims of Hurricane Matthew in your thoughts and prayers.",ThomTillis,Thom Tillis,North Carolina,Republican
19,Fri Nov 11 14:33:30 +0000 2016,7.97085E+17,3,14,"Thank a veteran today, tomorrow and every day. Happy #VeteransDay! https://t.co/NNVbRfEIY9",ThomTillis,Thom Tillis,North Carolina,Republican
20,Fri Nov 11 13:39:09 +0000 2016,7.97071E+17,2,26,"Thank you, veterans. Because of your service and sacrifice, we live in the greatest nation on Earth. #VeteransDay",ThomTillis,Thom Tillis,North Carolina,Republican
21,Wed Nov 09 15:22:05 +0000 2016,7.96372E+17,3,26,Congrats @realDonaldTrump &amp; my Senate &amp; House colleagues. Americans put trust in us to get the nation on the right track. Let's get to work!,ThomTillis,Thom Tillis,North Carolina,Republican
22,Wed Nov 09 06:30:16 +0000 2016,7.96238E+17,1,32,Congrats @PatToomey! https://t.co/ojnaViwLno,ThomTillis,Thom Tillis,North Carolina,Republican
23,Wed Nov 09 04:04:07 +0000 2016,7.96202E+17,2,8,Congrats @RonJohnsonWI! #WISEN https://t.co/SYM1ymGnEo,ThomTillis,Thom Tillis,North Carolina,Republican
24,Wed Nov 09 03:15:24 +0000 2016,7.96189E+17,2,53,Congrats to my good friend @BurrForSenate! Look forward to continue serving with him in the Senate. #ncpol #ncsen,ThomTillis,Thom Tillis,North Carolina,Republican
25,Wed Nov 09 01:36:29 +0000 2016,7.96165E+17,1,48,"Welcome to the Senate, @ToddYoungIN! https://t.co/Dizz0yNYai",ThomTillis,Thom Tillis,North Carolina,Republican
26,Wed Nov 09 01:31:10 +0000 2016,7.96163E+17,0,6,Congrats @marcorubio! #FLSEN https://t.co/uyDS5OOqT9,ThomTillis,Thom Tillis,North Carolina,Republican
27,Tue Nov 08 01:29:52 +0000 2016,7.958E+17,18,77,We need @PatMcCroryNC’s leadership in Raleigh. Get out and vote for him tomorrow to keep the #CarolinaComeback alive. #ncpol #ncgov,ThomTillis,Thom Tillis,North Carolina,Republican
28,Tue Nov 08 01:28:58 +0000 2016,7.958E+17,10,88,"In four years, @PatMcCroryNC has taken NC from the fiscal and economic brink to the fastest growing economy in America.",ThomTillis,Thom Tillis,North Carolina,Republican
29,Tue Nov 08 01:28:20 +0000 2016,7.958E+17,12,42,I'm lucky to call @PatMcCroryNC both my good friend and Governor.,ThomTillis,Thom Tillis,North Carolina,Republican
30,Sun Nov 06 20:27:07 +0000 2016,7.95362E+17,2,12,.@BurrForSenate has been a champion for our veterans and a leader for reforming the VA. #ncpol #ncsen https://t.co/UbfbKsiA0P,ThomTillis,Thom Tillis,North Carolina,Republican
31,Sun Nov 06 17:03:33 +0000 2016,7.95311E+17,6,8,I’ll be joining @mike_pence this afternoon in Hickory to campaign for @BurrForSenate @PatMcCroryNC @JusticeEdmunds #ncpol #ncsen,ThomTillis,Thom Tillis,North Carolina,Republican
32,Sat Nov 05 15:52:06 +0000 2016,7.9493E+17,22,22,Get out and vote early today for @PatMcCroryNC! #ncgov #ncpol https://t.co/wqcZpAJcVq,ThomTillis,Thom Tillis,North Carolina,Republican
33,Sat Nov 05 15:48:14 +0000 2016,7.94929E+17,2,5,Get out and vote early for @BurrForSenate today if you haven’t already! #ncsen #ncpol https://t.co/FAokmLdoaU,ThomTillis,Thom Tillis,North Carolina,Republican
34,Fri Nov 04 20:56:06 +0000 2016,7.94644E+17,9,41,"Today, I joined @BurrForSenate, @votetimscott and volunteers in #Charlotte at the RNC victory office. Get out and v… https://t.co/YNpIjKH2N5",ThomTillis,Thom Tillis,North Carolina,Republican
35,Thu Nov 03 15:52:57 +0000 2016,7.94206E+17,0,6,It's great to be in Indiana to support @ToddYoungIN. #INSen https://t.co/YnxRNUpSmc,ThomTillis,Thom Tillis,North Carolina,Republican
36,Wed Nov 02 18:41:39 +0000 2016,7.93886E+17,12,53,"#POTUS, while you're in NC today, explain to North Carolinians why 95 of 100 counties now have only one insurer. #Obamacare #ObamacareFail",ThomTillis,Thom Tillis,North Carolina,Republican
37,Wed Nov 02 16:44:15 +0000 2016,7.93856E+17,6,27,"While campaigning for Hillary in NC, I hope @POTUS explains massive premium hikes hitting NC families thanks to #Obamacare. #ObamacareFail",ThomTillis,Thom Tillis,North Carolina,Republican
38,Wed Nov 02 15:30:08 +0000 2016,7.93838E+17,0,2,Susan and I are praying for the families of the police officers killed in Iowa.,ThomTillis,Thom Tillis,North Carolina,Republican
39,Wed Nov 02 15:05:43 +0000 2016,7.93831E+17,2,29,"With @POTUS in NC, it's the perfect day for @DeborahRossNC to explain her support for #Obamacare. https://t.co/pstUlBDODh #ObamacareFail",ThomTillis,Thom Tillis,North Carolina,Republican
40,Fri Oct 28 15:18:08 +0000 2016,7.92023E+17,4,34,The pressure of #Election2016 finally got the better of Ike last night at dinner. He's not the first one I've had t… https://t.co/Rfl8rlj6PE,ThomTillis,Thom Tillis,North Carolina,Republican
41,Fri Oct 28 13:37:36 +0000 2016,7.91997E+17,3,8,"Follow @BurrForSenate for updates leading up to Election Day! Get out and #vote early: https://t.co/53rouqrJLz 

#ncpol #ncsen #ncgov #FF",ThomTillis,Thom Tillis,North Carolina,Republican
42,Wed Oct 26 13:10:01 +0000 2016,7.91266E+17,11,34,"While @BurrForSenate offers solutions to fix ObamaCare mess &amp; lower costs, Deborah Ross’ “solution” = more govt, less choice. #ncpol #ncsen",ThomTillis,Thom Tillis,North Carolina,Republican
43,Wed Oct 26 13:06:01 +0000 2016,7.91265E+17,6,11,"ObamaCare plans to increase 24% in NC next year, yet Deborah Ross still says she supports ObamaCare. #ncsen #ncpol https://t.co/3qDQGFPOGJ",ThomTillis,Thom Tillis,North Carolina,Republican
44,Mon Oct 24 23:46:25 +0000 2016,7.90701E+17,0,4,I’m proud to be a co-sponsor of @PatToomey’s Thin Blue Line Act. https://t.co/bEnggxZShX,ThomTillis,Thom Tillis,North Carolina,Republican
45,Mon Oct 24 23:23:19 +0000 2016,7.90695E+17,0,2,Astonishing hypocrisy. #PASEN https://t.co/JXyyy6azvh,ThomTillis,Thom Tillis,North Carolina,Republican
46,Mon Oct 24 23:02:28 +0000 2016,7.9069E+17,3,5,Happy to be in Philly to watch my good friend @PatToomey discuss his bipartisan record of results in the Senate.… https://t.co/UWIm5htAlZ,ThomTillis,Thom Tillis,North Carolina,Republican
47,Sun Oct 23 18:32:58 +0000 2016,7.9026E+17,7,24,Get out and vote early for @BurrForSenate &amp; @PatMcCroryNC. Find your early voting site here: https://t.co/0UfnvIUNRb #ncpol #ncsen #ncgov,ThomTillis,Thom Tillis,North Carolina,Republican
48,Sun Oct 16 23:26:17 +0000 2016,7.87797E+17,6,65,The firebombing of the Orange County @NCGOP HQ was a disgusting attack against our democratic political system. #ncpol,ThomTillis,Thom Tillis,North Carolina,Republican
49,Sat Oct 08 14:34:09 +0000 2016,7.84764E+17,39,28,Donald Trump needs to take responsibility for his actions and apologize to women everywhere.,ThomTillis,Thom Tillis,North Carolina,Republican
50,Sat Oct 08 14:33:50 +0000 2016,7.84764E+17,54,46,"As a proud husband and father of a daughter, I find Donald Trump’s comments indefensible.",ThomTillis,Thom Tillis,North Carolina,Republican
51,Sat Oct 08 13:41:42 +0000 2016,7.84751E+17,0,5,Please follow @NCEmergency for important updates and safety alerts for #HurricaneMatthew.,ThomTillis,Thom Tillis,North Carolina,Republican
52,Fri Sep 23 23:06:27 +0000 2016,7.79457E+17,2,8,Grateful to have met SPC Budwine &amp; his family through the Baby Bundles project. Congrats on your triplets and thank… https://t.co/bWxnJr41Kt,ThomTillis,Thom Tillis,North Carolina,Republican
53,Sun Sep 18 12:36:56 +0000 2016,7.77487E+17,1,3,"Happy Birthday, @usairforce! #AFBDAY https://t.co/rxgFM6APNy",ThomTillis,Thom Tillis,North Carolina,Republican
54,Mon Sep 12 18:37:13 +0000 2016,7.75403E+17,1,10,Susan &amp; I extend our deepest condolences to Officer Brackeen's family and the @ShelbyPolice.  https://t.co/3BpS3YfE9W,ThomTillis,Thom Tillis,North Carolina,Republican
55,Sun Sep 11 12:25:15 +0000 2016,7.74947E+17,3,37,Never forget. #NeverForget #Remember911 https://t.co/o39Wehry8c,ThomTillis,Thom Tillis,North Carolina,Republican
56,Fri Sep 09 17:18:16 +0000 2016,7.74296E+17,1,7,Follow @Burrforsenate for updates from Senator Burr's campaign. #FF #ncpol #ncsen https://t.co/XHWe1loixj,ThomTillis,Thom Tillis,North Carolina,Republican
57,Thu Sep 08 21:54:09 +0000 2016,7.74003E+17,4,8,Looking forward to the @Panthers game tonight! #KeepPounding #WinFromWithin #CARvsDEN,ThomTillis,Thom Tillis,North Carolina,Republican
58,Mon Sep 05 16:09:46 +0000 2016,7.72829E+17,3,7,"On #LaborDay, join me in celebrating all of the hard-working North Carolinians. #NorthCarolina",ThomTillis,Thom Tillis,North Carolina,Republican
59,Fri Sep 02 02:35:12 +0000 2016,7.71537E+17,2,1,@chadmattk Thank you!,ThomTillis,Thom Tillis,North Carolina,Republican
60,Sun Aug 07 13:32:20 +0000 2016,7.6228E+17,11,19,Never forget the sacrifices made by the men and women protecting our freedom. #PurpleHeartDay  https://t.co/zCt1H2iu15,ThomTillis,Thom Tillis,North Carolina,Republican
61,Sat Aug 06 18:25:26 +0000 2016,7.61992E+17,5,12,My op-ed in @theobserver: ‘Us vs. them’ rhetoric toward police divides the nation. https://t.co/yOyDn4x7aJ,ThomTillis,Thom Tillis,North Carolina,Republican
62,Thu Aug 04 14:01:19 +0000 2016,7.612E+17,2,4,"Happy 226th Birthday, @USCG! #USCG  https://t.co/JfWBqJRJOG",ThomTillis,Thom Tillis,North Carolina,Republican
63,Wed Aug 03 16:08:31 +0000 2016,7.6087E+17,1,8,"Thank you, Maj. Gen. Clarke for your service to the @82ndABNDiv. https://t.co/rLqHyJA7mc",ThomTillis,Thom Tillis,North Carolina,Republican
64,Fri Jul 22 19:57:59 +0000 2016,7.56579E+17,1,11,Praying for #Munich,ThomTillis,Thom Tillis,North Carolina,Republican
65,Thu Jul 21 14:30:19 +0000 2016,7.56134E+17,7,7,"Please join me to wish my beautiful and caring wife, Susan, a Happy Birthday! https://t.co/kdyUUzOESn",ThomTillis,Thom Tillis,North Carolina,Republican
66,Wed Jul 20 15:43:11 +0000 2016,7.5579E+17,1,4,Great to see Dora from #Wilmington @GOPconvention. She volunteered on my 2014 campaign. #RNCinCLE https://t.co/dLEO0vDfwy,ThomTillis,Thom Tillis,North Carolina,Republican
67,Tue Jul 19 18:54:12 +0000 2016,7.55476E+17,1,2,Chatting with @BonitiTWCNews at #RNCinCLE. #ncgop #ncpol https://t.co/mUpR9CxmX4,ThomTillis,Thom Tillis,North Carolina,Republican
68,Sun Jul 17 16:44:20 +0000 2016,7.54718E+17,7,53,Please keep the #BatonRouge law enforcement officers in your thoughts and prayers.,ThomTillis,Thom Tillis,North Carolina,Republican
69,Sat Jul 16 14:55:55 +0000 2016,7.54329E+17,11,21,"Very pleased to see @mike_pence join @realDonaldTrump on the ticket. Strong record growing the economy, cutting taxes, supporting vets.",ThomTillis,Thom Tillis,North Carolina,Republican
70,Thu Jul 14 23:43:16 +0000 2016,7.53737E+17,12,14,Praying for the people of France. #BastilleDay #PrayForNice,ThomTillis,Thom Tillis,North Carolina,Republican
71,Fri Jul 08 03:36:18 +0000 2016,7.51259E+17,7,31,Please keep the officers in Dallas and their families in your thoughts and prayers.,ThomTillis,Thom Tillis,North Carolina,Republican
72,Tue Jul 05 17:07:39 +0000 2016,7.50376E+17,18,57,"Indictment or not, @HillaryClinton's private email servers endangered America's national security and reveals a stunning lack of judgment.",ThomTillis,Thom Tillis,North Carolina,Republican
73,Mon Jul 04 12:47:42 +0000 2016,7.49948E+17,2,27,"Happy 240th Birthday, America! #IndependenceDay https://t.co/kKm5dUK353",ThomTillis,Thom Tillis,North Carolina,Republican
74,Sun Jul 03 20:30:12 +0000 2016,7.49702E+17,1,12,Thank you to the @MLB for bringing baseball to Fort Bragg this July 4th weekend! https://t.co/4nJjDBv0GQ,ThomTillis,Thom Tillis,North Carolina,Republican
75,Tue Jun 28 13:30:07 +0000 2016,7.47784E+17,5,4,"Happy 29th Anniversary to the love of my life, Susan. Thank you for being my best friend and greatest supporter. https://t.co/m6uMcn1JFu",ThomTillis,Thom Tillis,North Carolina,Republican
76,Sun Jun 19 13:28:49 +0000 2016,7.44522E+17,5,2,#HappyFathersDay to all of the great dads! https://t.co/EfLJaVpUk6,ThomTillis,Thom Tillis,North Carolina,Republican
77,Tue Jun 14 12:13:51 +0000 2016,7.42692E+17,2,12,"Happy 241st Birthday, @USArmy! #ArmyBDay",ThomTillis,Thom Tillis,North Carolina,Republican
78,Sun Jun 12 14:42:05 +0000 2016,7.42004E+17,98,20,My heart goes out to everyone affected by the horrific act of terror in Orlando. Susan &amp; I are praying for the victims &amp; their families.,ThomTillis,Thom Tillis,North Carolina,Republican
79,Mon May 30 12:41:17 +0000 2016,7.37263E+17,2,43,We will never forget the men and women who paid the ultimate sacrifice defending our freedom. #MemorialDay https://t.co/kGpFQcDv3C,ThomTillis,Thom Tillis,North Carolina,Republican
80,Thu May 26 17:27:18 +0000 2016,7.35885E+17,1,5,Donations quadruple for Baby Bundles shower event via @HeraldWeekly https://t.co/6aZZCu7DbW (@susantillis @FortBraggASYMCA),ThomTillis,Thom Tillis,North Carolina,Republican
81,Wed May 25 14:17:07 +0000 2016,7.35475E+17,1,5,"We couldn't have done this without all of the volunteers. Susan &amp; I are very grateful, @FortBraggASYMCA. https://t.co/al9LY770yP",ThomTillis,Thom Tillis,North Carolina,Republican
82,Fri May 20 13:23:54 +0000 2016,7.33649E+17,1,7,"Proud of @susantillis, @asymca Fort Bragg &amp; all who supported military families through the Baby Bundles Shower! https://t.co/mvVFDlJjJY",ThomTillis,Thom Tillis,North Carolina,Republican
83,Sun May 15 13:39:51 +0000 2016,7.31842E+17,4,46,Today is National Police Officers Memorial Day. Join me in honoring the men and women who have paid the ultimate sacrifice to keep us safe.,ThomTillis,Thom Tillis,North Carolina,Republican
84,Sat May 14 14:53:59 +0000 2016,7.31498E+17,1,12,Susan &amp; I invite you to join us on May 19 to #giveback to soldiers and their families stationed @FtBraggNC. https://t.co/20IkAowAqH,ThomTillis,Thom Tillis,North Carolina,Republican
85,Tue May 10 20:27:06 +0000 2016,7.30132E+17,1,2,Welcome home and thank you for your service! https://t.co/teXb3ZsFDd,ThomTillis,Thom Tillis,North Carolina,Republican
86,Sun May 08 13:33:50 +0000 2016,7.29303E+17,0,8,"Happy Mother's Day to my mother Margie, wife Susan &amp; mother-in-law Jeanette! Thanks for all you do for your family. https://t.co/1WAcfqrZPc",ThomTillis,Thom Tillis,North Carolina,Republican
87,Fri Apr 22 14:20:01 +0000 2016,7.23517E+17,4,23,Susan &amp; I invite you to join us on May 19 to #giveback to soldiers and their families stationed @FtBraggNC. https://t.co/npDcoRqTCZ,ThomTillis,Thom Tillis,North Carolina,Republican
88,Tue Apr 05 11:32:09 +0000 2016,7.17314E+17,4,2,"Congrats on a great season, @UNC_Basketball! #UNCBBall #HeelsLockIn  https://t.co/qWc84xixUw",ThomTillis,Thom Tillis,North Carolina,Republican
89,Sun Apr 03 03:08:06 +0000 2016,7.16462E+17,2,7,Heading to the #NationalChampionship! #GoHeels #HeelsLockIn  https://t.co/1FE468lZDf,ThomTillis,Thom Tillis,North Carolina,Republican
90,Sat Apr 02 14:05:16 +0000 2016,7.16265E+17,1,14,RT to show your support to @autismspeaks for World Autism Awareness Day #LIUB https://t.co/EV1M5DIvaJ,ThomTillis,Thom Tillis,North Carolina,Republican
91,Mon Mar 28 02:56:30 +0000 2016,7.14285E+17,3,7,Congrats @UNC_Basketball on making it to the #FinalFour! #HeelsLockIn  https://t.co/EmtoXNXMU1,ThomTillis,Thom Tillis,North Carolina,Republican
92,Sun Mar 27 13:05:19 +0000 2016,7.14076E+17,0,4,Susan and I wish you and your family a #HappyEaster! https://t.co/CJBO1vMFMi,ThomTillis,Thom Tillis,North Carolina,Republican
93,Sat Mar 26 01:38:02 +0000 2016,7.1354E+17,1,5,Let's go @UNC_Basketball! #HeelsLockIn #UNCBBall #Sweet16 https://t.co/Qzz61aZf6t,ThomTillis,Thom Tillis,North Carolina,Republican
94,Fri Mar 25 17:35:33 +0000 2016,7.13419E+17,0,5,Susan and I send our condolences to the Pinczowski family. Innocent lives taken too soon. https://t.co/QCqRWDHc4l,ThomTillis,Thom Tillis,North Carolina,Republican
95,Thu Mar 24 17:17:56 +0000 2016,7.13052E+17,2,7,Join us in giving back to #soldiers and their families @FtBraggNC. RT to spread the word! #family https://t.co/7kVeGBdUld,ThomTillis,Thom Tillis,North Carolina,Republican
96,Tue Mar 22 12:08:32 +0000 2016,7.1225E+17,3,24,Praying for #Brussels and the innocent lives that were taken. We must defeat radical Islamic terrorism.,ThomTillis,Thom Tillis,North Carolina,Republican
97,Mon Mar 21 21:07:11 +0000 2016,7.12023E+17,0,2,Live with Tom &amp; Sadie on @1037WTIB at 5:10pm! Tune in: https://t.co/j1AmIoVOfo,ThomTillis,Thom Tillis,North Carolina,Republican
98,Fri Mar 18 01:33:17 +0000 2016,7.1064E+17,4,3,Congrats to Coach Williams on his historic win &amp; @UNC_Basketball for winning in round 1. #HeelsLockIn #MarchMadness https://t.co/kNged715h9,ThomTillis,Thom Tillis,North Carolina,Republican
99,Wed Mar 16 03:18:57 +0000 2016,7.09942E+17,15,51,We’re a stronger nation w/ leaders like @marcorubio who truly believe in and fight for the American Dream. https://t.co/7BXJKOfAbU,ThomTillis,Thom Tillis,North Carolina,Republican
100,Wed Mar 16 02:50:00 +0000 2016,7.09935E+17,8,8,Proud to support my friend @PatMcCroryNC! #ncgov #ncpol  https://t.co/a07xw8ALhx,ThomTillis,Thom Tillis,North Carolina,Republican
101,Wed Mar 16 02:43:20 +0000 2016,7.09933E+17,10,9,.@Burrforsenate fights tirelessly for NC. We are lucky to have him in the Senate. #ncsen #ncpol   https://t.co/Hyl3R9BXIL,ThomTillis,Thom Tillis,North Carolina,Republican
102,Tue Mar 15 01:45:21 +0000 2016,7.09556E+17,8,6,https://t.co/9ofoWfsr1m,ThomTillis,Thom Tillis,North Carolina,Republican
103,Sun Mar 13 03:57:50 +0000 2016,7.08865E+17,4,12,"Congrats, @UNC_Basketball, on being the #ACCTourney Champs! #UVAvsUNC #UNCBBall #HeelsLockIn",ThomTillis,Thom Tillis,North Carolina,Republican
104,Wed Mar 09 02:11:10 +0000 2016,7.07388E+17,23,7,"Vote early for @Burrforsenate! A champion for supporting vets, repealing Obamacare, keeping America safe. https://t.co/ZIZo2FNRX2",ThomTillis,Thom Tillis,North Carolina,Republican
105,Tue Mar 08 02:38:55 +0000 2016,7.07033E+17,0,3,Congrats @uncwmenshoops on being the #CAAChamps!  https://t.co/NlMIVGSlGr,ThomTillis,Thom Tillis,North Carolina,Republican
106,Mon Mar 07 16:17:21 +0000 2016,7.06876E+17,5,4,Caught up with @Bentnews @wcnc to discuss how @marcorubio represents a bright future for our country &amp; the GOP. https://t.co/rwbT1xzRCV,ThomTillis,Thom Tillis,North Carolina,Republican
107,Sun Mar 06 22:47:29 +0000 2016,7.06612E+17,0,1,Congrats #BigSouthChamps @ashevilledogs @UNCAbasketball! #MarchMadness #LetsDance https://t.co/TIYRuIZSh1,ThomTillis,Thom Tillis,North Carolina,Republican
108,Sun Mar 06 17:30:38 +0000 2016,7.06532E+17,1,21,Susan and I are terribly saddened to hear of the passing of Nancy Reagan. Sending our prayers and condolences to the Reagan family.,ThomTillis,Thom Tillis,North Carolina,Republican
109,Thu Mar 03 22:40:59 +0000 2016,7.05523E+17,2,14,Dabbing @CPAC with @UNCGOP! #CPAC #KeepPounding https://t.co/7e5xKiUAAd,ThomTillis,Thom Tillis,North Carolina,Republican
110,Thu Mar 03 22:36:32 +0000 2016,7.05522E+17,0,5,The youngest and cutest Republican @CPAC! #CPAC #CPAC2016 https://t.co/90nJttE9yT,ThomTillis,Thom Tillis,North Carolina,Republican
111,Thu Mar 03 22:26:02 +0000 2016,7.0552E+17,9,13,Any (Republican) candidate on their worst day is eons better than @HillaryClinton on her best day. #CPAC #CPAC2016 https://t.co/et9kGgssBo,ThomTillis,Thom Tillis,North Carolina,Republican
112,Thu Mar 03 22:12:26 +0000 2016,7.05516E+17,2,5,Help me influence the narrative we see in the media. The Republican Party is alive and well. We're independent and principled. #CPAC,ThomTillis,Thom Tillis,North Carolina,Republican
113,Thu Mar 03 22:11:10 +0000 2016,7.05516E+17,16,9,"""We're not going to nominate a Supreme Court Justice until the American people have spoken."" #CPAC https://t.co/wrWy6wnvi0",ThomTillis,Thom Tillis,North Carolina,Republican
114,Thu Mar 03 22:09:00 +0000 2016,7.05515E+17,0,4,LIVE from @CPAC. Tune in: https://t.co/dENVc9VrX4 #CPAC https://t.co/SSUoGjXk2T,ThomTillis,Thom Tillis,North Carolina,Republican
115,Thu Mar 03 21:50:25 +0000 2016,7.05511E+17,1,3,See you soon on @CPAC's Main Stage. #CPAC #CPAC2016 https://t.co/kK6do1e46l,ThomTillis,Thom Tillis,North Carolina,Republican
116,Fri Feb 26 03:22:11 +0000 2016,7.03057E+17,22,179,Couldn’t agree more. @marcorubio is killing it tonight. https://t.co/PVZZzJERrR,ThomTillis,Thom Tillis,North Carolina,Republican
117,Wed Feb 24 16:38:36 +0000 2016,7.02533E+17,0,7,Watch the forecast closely as severe weather hits NC. Visit https://t.co/vghqvHWFO9 for info. Stay safe! #ncwx https://t.co/JqvDmBdSUa,ThomTillis,Thom Tillis,North Carolina,Republican
118,Mon Feb 22 14:16:06 +0000 2016,7.01772E+17,34,156,".@marcorubio represents a bright future for the GOP &amp; America. He’ll draw new people into the party, crucial in a swing state like NC.",ThomTillis,Thom Tillis,North Carolina,Republican
119,Mon Feb 22 14:01:05 +0000 2016,7.01769E+17,163,441,I'm supporting @marcorubio for president because he has an unmatched ability to inspire and uplift the American people.,ThomTillis,Thom Tillis,North Carolina,Republican
120,Mon Feb 15 16:09:26 +0000 2016,6.99264E+17,7,2,Happy #PresidentsDay!,ThomTillis,Thom Tillis,North Carolina,Republican
121,Sun Feb 14 16:27:11 +0000 2016,6.98906E+17,2,2,"#HappyValentinesDay to my beautiful wife, Susan! Thank you for your love and support. https://t.co/vk6SPBVmQk",ThomTillis,Thom Tillis,North Carolina,Republican
122,Sat Feb 13 22:56:22 +0000 2016,6.98642E+17,14,24,Antonin Scalia will be remembered as one of the most thoughtful and influential Supreme Court justices in American history.,ThomTillis,Thom Tillis,North Carolina,Republican
123,Mon Feb 08 03:45:46 +0000 2016,6.9654E+17,0,8,Congrats to the @Broncos and Peyton Manning on winning #SB50. I'm proud of the @Panthers and know the best is yet to come. #KeepPounding,ThomTillis,Thom Tillis,North Carolina,Republican
124,Sun Feb 07 23:11:45 +0000 2016,6.96471E+17,3,5,RT if you're ready for #SB50! Here we go...#KeepPounding #Panthers #PanthersNation https://t.co/1gfbL3E6S4,ThomTillis,Thom Tillis,North Carolina,Republican
