,created_at,id_str,reply_count,retweet_count,text,user,name,state,party
586,Tue Sep 30 16:37:53 +0000 2014,5.1699E+17,1,6,"Keep up the great work! ""RT @dlb5503: Karen and her son working on @ThomTillis signs for Cabarrus County"" http://t.co/pkq7elA3Yz",ThomTillis,Thom Tillis,North Carolina,Republican
587,Tue Sep 30 16:21:02 +0000 2014,5.16986E+17,0,4,"""RT @susantillis: @ThomTillis We got this!  Let's go #teamtillis.""",ThomTillis,Thom Tillis,North Carolina,Republican
588,Tue Sep 30 16:05:10 +0000 2014,5.16982E+17,6,20,Today marks 5 weeks until election day. I will need all your help and support: http://t.co/DWAqwYV4wx -Thom http://t.co/c0z258IVwQ,ThomTillis,Thom Tillis,North Carolina,Republican
589,Tue Sep 30 15:41:05 +0000 2014,5.16976E+17,3,18,"[VIDEO]: While #ISIS grew, Sen Hagan kept quiet. Leadership is about taking a stand. And it starts with showing up. http://t.co/7A24IQCGAA",ThomTillis,Thom Tillis,North Carolina,Republican
590,Mon Sep 29 18:07:44 +0000 2014,5.16651E+17,1,30,"If the King thinks I can get across the stripe, there's no question to it RT @RobEngstrom @USChamber debut #ncsen ad https://t.co/bvq6VczGdK",ThomTillis,Thom Tillis,North Carolina,Republican
591,Mon Sep 29 14:14:08 +0000 2014,5.16592E+17,9,46,"""@JordanP_Shaw Watch new ad:  While ISIS grew Pres Obama &amp; Sen Hagan kept quiet #NCSEN #NCPOL http://t.co/Vj3G50bSS8 http://t.co/26aXNPukd6""",ThomTillis,Thom Tillis,North Carolina,Republican
592,Mon Sep 29 13:02:04 +0000 2014,5.16574E+17,7,22,Pledge now: Tell Sen Hagan we need real leadership and new direction for North Carolina http://t.co/Vj3G50bSS8 #ncsen http://t.co/0RmnLQukp2,ThomTillis,Thom Tillis,North Carolina,Republican
593,Mon Sep 29 01:44:46 +0000 2014,5.16403E+17,1,14,"Thank you! Great to be there ""RT @Tmcbrayer20: Thanks @ThomTillis for coming by Hickory tonight. #ncsen http://t.co/DRoFKmBYCg""",ThomTillis,Thom Tillis,North Carolina,Republican
594,Sun Sep 28 23:15:04 +0000 2014,5.16366E+17,3,26,Winning is about people &amp; hard work will make all the difference this year. Get involved today http://t.co/WCBBUNVDlU http://t.co/f6TEGgoL9d,ThomTillis,Thom Tillis,North Carolina,Republican
595,Sun Sep 28 01:19:48 +0000 2014,5.16035E+17,8,33,"In case you missed it, here's the video of my Weekly @GOP Address this morning: https://t.co/C80SPeYWic #NCSen http://t.co/BrzyoyFEiy",ThomTillis,Thom Tillis,North Carolina,Republican
596,Sat Sep 27 19:38:05 +0000 2014,5.15949E+17,1,9,"Support @CoachToCureMD today. Txt CURE to 90999 to give $5. @CoachFedora, @CoachClawson, @DavidCutcliffe are big backers.",ThomTillis,Thom Tillis,North Carolina,Republican
597,Sat Sep 27 18:03:12 +0000 2014,5.15925E+17,1,2,@NJMIPO thank you for your support!,ThomTillis,Thom Tillis,North Carolina,Republican
598,Sat Sep 27 17:57:02 +0000 2014,5.15923E+17,3,11,Great time meeting voters in Mt. Airy for Mayberry Days. #ncsen #ncpol http://t.co/tjJVch2TjT,ThomTillis,Thom Tillis,North Carolina,Republican
599,Sat Sep 27 17:38:44 +0000 2014,5.15918E+17,3,4,"Great to see you guys! RT @dgregm: My son, @wm_0818, supporting @ThomTillis in Surry County this morning. http://t.co/mwxiPl3t8s",ThomTillis,Thom Tillis,North Carolina,Republican
600,Sat Sep 27 17:22:25 +0000 2014,5.15914E+17,1,3,@LinBennett Thank you!,ThomTillis,Thom Tillis,North Carolina,Republican
601,Sat Sep 27 15:03:40 +0000 2014,5.15879E+17,8,11,In Surry County this morning w/ @repsarahstevens discussing how we can make America great again. #ncsen #ncpol http://t.co/eXssm4d98z,ThomTillis,Thom Tillis,North Carolina,Republican
602,Sat Sep 27 14:14:59 +0000 2014,5.15867E+17,2,25,"This morning, I delivered the Weekly @GOP Address and shared my vision for the great state of North Carolina: https://t.co/e4c7mz2oOo #NCSen",ThomTillis,Thom Tillis,North Carolina,Republican
603,Fri Sep 26 23:14:21 +0000 2014,5.15641E+17,4,12,Thanks for your hard work! RT @GvilleVictory14: Door knocking from sun up to sun down. #FireHagan @ThomTillis http://t.co/AmGF3S7tH4,ThomTillis,Thom Tillis,North Carolina,Republican
604,Fri Sep 26 21:32:55 +0000 2014,5.15615E+17,8,44,Kay Hagan promised 24 times: people could keep their plans. Now North Carolinians are hurting. http://t.co/MhHKcsTmvL http://t.co/aoLMx4gFkC,ThomTillis,Thom Tillis,North Carolina,Republican
605,Fri Sep 26 19:57:11 +0000 2014,5.15591E+17,10,20,Obama &amp; Kay Hagan's foreign policy has failed Americans. @LindseyGrahamSC and I agree: we must eliminate ISIS. #NCSen http://t.co/UszQotTQu0,ThomTillis,Thom Tillis,North Carolina,Republican
606,Fri Sep 26 18:36:13 +0000 2014,5.15571E+17,9,48,North Carolina deserves answers: Is Kay Hagan lying about the stimulus? Tell us the truth. #NCsen #NCpol http://t.co/GY2TOrhPlI,ThomTillis,Thom Tillis,North Carolina,Republican
607,Thu Sep 25 17:05:11 +0000 2014,5.15185E+17,15,69,Is this 60% hike part of Kay Hagan's promise to N.C.? ObamaCare is hurting middle-class families. #NCpol #NCSen http://t.co/kwFWB5q6gx,ThomTillis,Thom Tillis,North Carolina,Republican
608,Wed Sep 24 20:05:05 +0000 2014,5.14868E+17,6,35,Proud to accept the endorsement of @NFIB today next to @JebBush in Greensboro #ncsen #ncpol http://t.co/JUQtS6KmSC,ThomTillis,Thom Tillis,North Carolina,Republican
609,Tue Sep 23 18:35:36 +0000 2014,5.14483E+17,9,37,Our new ad sets the record straight on Kay Hagan and Harry Reid’s false attacks. https://t.co/jhb03fLyy3 #ncsen #ncpol,ThomTillis,Thom Tillis,North Carolina,Republican
610,Mon Sep 22 18:58:54 +0000 2014,5.14127E+17,15,132,Kay Hagan has skipped over half of her Armed Services Comm. hearings over the last 2 yrs. #ncsen #ncpol http://t.co/yjUTXM7GAX,ThomTillis,Thom Tillis,North Carolina,Republican
611,Sat Sep 20 17:52:09 +0000 2014,5.13385E+17,10,34,"""NC needs a Senator, not a pen pal."" Great turnout in Guilford County today with @Walker4NC &amp; @HowardCoble #ncsen http://t.co/dps3jO5sbF",ThomTillis,Thom Tillis,North Carolina,Republican
612,Sat Sep 20 16:15:16 +0000 2014,5.13361E+17,5,13,A big thank you to @SenatorBerger for a warm welcome in Rockingham County today.  #ncsen #ncpol http://t.co/mzr56szOeo,ThomTillis,Thom Tillis,North Carolina,Republican
613,Fri Sep 19 17:56:00 +0000 2014,5.13024E+17,10,32,Today we launched a new television ad. Watch here: https://t.co/ar6IC51Raq #ncsen #ncpol,ThomTillis,Thom Tillis,North Carolina,Republican
614,Fri Sep 19 00:38:05 +0000 2014,5.12763E+17,5,22,Honored to be joined by @NikkiHaley and @PatMcCroryNC tonight in Fayetteville. #ncsen #ncpol http://t.co/obNBfL8C2X,ThomTillis,Thom Tillis,North Carolina,Republican
615,Thu Sep 18 19:19:15 +0000 2014,5.12682E+17,9,56,Election year politics at its worst: Hagan/Reid delaying ISIS authorization vote until after November. #ncsen #ncpol,ThomTillis,Thom Tillis,North Carolina,Republican
616,Thu Sep 18 15:46:10 +0000 2014,5.12629E+17,9,39,Honored to be endorsed by the NRA. We need a senator who will stand up for 2nd Amendment rights. #ncsen #ncpol,ThomTillis,Thom Tillis,North Carolina,Republican
617,Thu Sep 18 14:21:19 +0000 2014,5.12607E+17,10,38,"Leading from behind: Sen Hagan, chair of a subcommittee focused on terrorism, has held 0 hearings on ISIS. #ncsen #ncpol",ThomTillis,Thom Tillis,North Carolina,Republican
618,Wed Sep 17 15:52:36 +0000 2014,5.12268E+17,12,47,"Many in DC have lost their way, but the Constitution will always be my guide to governing. #ncsen #ncpol http://t.co/XkOlnJY3Zq",ThomTillis,Thom Tillis,North Carolina,Republican
619,Tue Sep 16 18:50:28 +0000 2014,5.1195E+17,7,36,"We need leadership in DC that believes in the American people, not big government: http://t.co/niyNZOVzyM #ncsen #ncpol",ThomTillis,Thom Tillis,North Carolina,Republican
620,Mon Sep 15 18:09:40 +0000 2014,5.11578E+17,8,64,"Sen. Hagan chairs subcommittee on nat’l security threats, but has had 0 hearings on ISIS: http://t.co/kPeKn5gMOh #ncsen #ncpol",ThomTillis,Thom Tillis,North Carolina,Republican
621,Mon Sep 15 14:13:52 +0000 2014,5.11518E+17,2,9,Had a great time campaigning w/ @RepMarkMeadows in Lenoir and Hickory this weekend: http://t.co/efQhf4HgPx #ncsen #ncpol,ThomTillis,Thom Tillis,North Carolina,Republican
622,Sun Sep 14 19:54:26 +0000 2014,5.11242E+17,4,8,Two downs two sacks.  Panthers D dominates.  #carolinapanthers,ThomTillis,Thom Tillis,North Carolina,Republican
623,Sun Sep 14 19:52:44 +0000 2014,5.11241E+17,2,12,Luke is a beast.  Go Panthers! #carolinapanthers,ThomTillis,Thom Tillis,North Carolina,Republican
624,Sun Sep 14 19:50:27 +0000 2014,5.11241E+17,1,5,Unbelievable=kicker recovering the kickoff fumble. #carolinapanthers,ThomTillis,Thom Tillis,North Carolina,Republican
625,Sun Sep 14 00:30:39 +0000 2014,5.10949E+17,1,15,Had a great time tonight at @RepMarkMeadows' BBQ in Lenoir. #ncsen #ncpol http://t.co/U6b0DqgoJs,ThomTillis,Thom Tillis,North Carolina,Republican
626,Sat Sep 13 22:27:10 +0000 2014,5.10918E+17,5,23,A packed house today at the Hickory Victory Office with @RepMarkMeadows. #ncsen #ncpol http://t.co/1F0VvZ3PkK,ThomTillis,Thom Tillis,North Carolina,Republican
627,Thu Sep 11 13:18:17 +0000 2014,5.10055E+17,7,104,We will never forget the indescribable sacrifice and courage we witnessed on 9/11. http://t.co/2auBr2Eohi,ThomTillis,Thom Tillis,North Carolina,Republican
628,Wed Sep 10 17:48:19 +0000 2014,5.0976E+17,9,37,Sign our petition and tell Kay Hagan that North Carolinians deserve more debates: http://t.co/yarca85qUq #ncsen #ncpol,ThomTillis,Thom Tillis,North Carolina,Republican
629,Tue Sep 09 18:44:55 +0000 2014,5.09412E+17,14,36,Sign our petition and let @KayHagan know that North Carolina deserves more debates: http://t.co/yarca85qUq #ncsen #ncpol,ThomTillis,Thom Tillis,North Carolina,Republican
630,Tue Sep 09 13:56:49 +0000 2014,5.0934E+17,7,35,Today I sent @KayHagan a letter asking her to reconsider participating in the TWC News/N&amp;O/Observer debate. #ncsen #ncpol,ThomTillis,Thom Tillis,North Carolina,Republican
631,Tue Sep 09 01:16:48 +0000 2014,5.09148E+17,11,72,Disappointing that @KayHagan is declining to participate in the TWC News/N&amp;O/Observer debate. #ncsen #ncpol,ThomTillis,Thom Tillis,North Carolina,Republican
632,Mon Sep 08 13:46:13 +0000 2014,5.08975E+17,12,62,Flashback: @KayHagan voted for amnesty she now says she wants delayed. http://t.co/Zck5e5xK4M #ncsen #ncpol,ThomTillis,Thom Tillis,North Carolina,Republican
633,Sat Sep 06 17:12:51 +0000 2014,5.08302E+17,4,37,My statement on Obama’s delay of executive amnesty until after the election: http://t.co/S1D5Zv1BlP #ncsen #ncpol,ThomTillis,Thom Tillis,North Carolina,Republican
634,Sat Sep 06 15:57:10 +0000 2014,5.08283E+17,2,20,Great tour of tobacco and sweet potato farms in eastern NC this morning. #ncsen http://t.co/P65KTZV2Qb,ThomTillis,Thom Tillis,North Carolina,Republican
635,Sat Sep 06 13:00:31 +0000 2014,5.08238E+17,2,12,Great breakfast at Amy Jo's in Wilson today! Thanks for your support. #ncsen http://t.co/wdgh94HchZ,ThomTillis,Thom Tillis,North Carolina,Republican
636,Thu Sep 04 20:35:21 +0000 2014,5.07628E+17,7,23,Great feedback from yesterday's debate: http://t.co/l1Tnj3OT5r Be sure to watch if you haven’t yet: https://t.co/C3jyPUew9c #ncsen,ThomTillis,Thom Tillis,North Carolina,Republican
637,Thu Sep 04 20:01:23 +0000 2014,5.07619E+17,2,10,Correction: Thom's @TeamCavuto interview will air tonight at 8 and 11 p.m. on Fox Business. #NCSen,ThomTillis,Thom Tillis,North Carolina,Republican
638,Thu Sep 04 15:09:46 +0000 2014,5.07546E+17,6,12,Be sure to tune into Fox Business today at 2:50 pm to watch Thom discuss last night's debate live with @TeamCavuto #NCSen,ThomTillis,Thom Tillis,North Carolina,Republican
639,Thu Sep 04 00:04:08 +0000 2014,5.07318E+17,20,44,"While Hagan will continue to rubberstamp Obama &amp; Reid, it's clear Thom will work to fix Washington #ncsen",ThomTillis,Thom Tillis,North Carolina,Republican
640,Wed Sep 03 23:49:30 +0000 2014,5.07314E+17,13,45,FACT CHECK: @KayHagan Is No “Moderate” http://t.co/Y0U0ThXjTn  #NCSen,ThomTillis,Thom Tillis,North Carolina,Republican
641,Wed Sep 03 23:47:55 +0000 2014,5.07314E+17,7,22,FACT CHECK: @KayHagan Is Not “Bipartisan” http://t.co/ppdolHOed1 #NCSen,ThomTillis,Thom Tillis,North Carolina,Republican
642,Wed Sep 03 23:40:56 +0000 2014,5.07312E+17,7,34,FACT CHECK: Hagan Misleads On N.C.’s Historic Tax Reform http://t.co/xuNa09Cxjz #NCSen,ThomTillis,Thom Tillis,North Carolina,Republican
643,Wed Sep 03 23:28:15 +0000 2014,5.07309E+17,7,32,FACT CHECK: @KayHagan’s Broken Promise to North Carolina #Veterans http://t.co/YjZPGcDagF #NCSen,ThomTillis,Thom Tillis,North Carolina,Republican
644,Wed Sep 03 23:21:36 +0000 2014,5.07307E+17,7,34,FACT CHECK: @KayHagan Deceiving North Carolinians On Obama’s Executive Amnesty http://t.co/FuuuORzwxW #NCSen,ThomTillis,Thom Tillis,North Carolina,Republican
645,Wed Sep 03 23:20:16 +0000 2014,5.07307E+17,9,72,FACT CHECK: Hagan Repeatedly Voted Against Securing The Border http://t.co/dqaV9V2qul #NCSen,ThomTillis,Thom Tillis,North Carolina,Republican
646,Wed Sep 03 23:13:27 +0000 2014,5.07305E+17,14,77,FACT CHECK: @KayHagan Lied About ObamaCare At Least 24 Times http://t.co/f3tQHdkfPd #NCSen,ThomTillis,Thom Tillis,North Carolina,Republican
647,Wed Sep 03 22:56:48 +0000 2014,5.07301E+17,10,23,You’ll see a clear contrast tonight: Thom will work to fix Washington. Hagan will continue to rubberstamp Obama &amp; Reid. #ncsen,ThomTillis,Thom Tillis,North Carolina,Republican
648,Wed Sep 03 19:19:14 +0000 2014,5.07246E+17,11,25,The first #ncsen debate is tonight at 7pm. Be sure to tune in: http://t.co/Z7NjjkLLMb #ncpol,ThomTillis,Thom Tillis,North Carolina,Republican
649,Tue Sep 02 19:14:29 +0000 2014,5.06883E+17,3,19,Want to know where you can tune in to tomorrow night’s #ncsen debate? Check here:  http://t.co/Z7NjjkLLMb #ncpol,ThomTillis,Thom Tillis,North Carolina,Republican
650,Tue Sep 02 14:23:51 +0000 2014,5.0681E+17,5,28,Be sure to tune into tomorrow night’s #ncsen debate at 7pm. You can watch it live on C-SPAN or UNC-TV. http://t.co/03dtgd9oZN,ThomTillis,Thom Tillis,North Carolina,Republican
651,Sun Aug 31 15:26:15 +0000 2014,5.06101E+17,18,17,I get to ask Kay Hagan 2 questions at Wed night’s #ncsen debate. Submit your ideas here: http://t.co/YzNo8CvcHG #ncpol,ThomTillis,Thom Tillis,North Carolina,Republican
652,Sat Aug 30 15:14:33 +0000 2014,5.05735E+17,7,23,Please RT to join us in wishing Thom a very happy birthday! ~ staff https://t.co/hQVCB6fZQL #ncpol #ncsen,ThomTillis,Thom Tillis,North Carolina,Republican
653,Fri Aug 29 19:21:18 +0000 2014,5.05435E+17,6,12,Thanks for a great event! RT @BCGOP: 100+ people out on Friday afternoon to see @ThomTillis #ncsen #ncpol http://t.co/8WLx8RyPn0,ThomTillis,Thom Tillis,North Carolina,Republican
654,Fri Aug 29 13:17:42 +0000 2014,5.05344E+17,5,15,It was an honor to join @CIBOnc today and talk about getting America back to work. #ncsen #ncpol http://t.co/DJmiGKBvvH,ThomTillis,Thom Tillis,North Carolina,Republican
655,Thu Aug 28 18:26:22 +0000 2014,5.05059E+17,11,36,NC’s choice is between a proven problem solver &amp; a rubber-stamp for Obama’s failed agenda. https://t.co/M5Z1Ill2pI #ncsen #ncpol,ThomTillis,Thom Tillis,North Carolina,Republican
656,Thu Aug 28 14:30:52 +0000 2014,5.05E+17,15,30,WATCH: This yr we gave teachers 7% pay raises while Hagan voted w/ Obama 96% of the time. https://t.co/fm3DBWqvfR #ncsen #ncpol,ThomTillis,Thom Tillis,North Carolina,Republican
657,Wed Aug 27 15:10:16 +0000 2014,5.04647E+17,4,33,More false attack ads from Harry Reid already debunked by fact checkers. Help us fight back: https://t.co/H9zGBbvJEg #ncsen #ncpol,ThomTillis,Thom Tillis,North Carolina,Republican
658,Tue Aug 26 16:47:27 +0000 2014,5.04309E+17,6,58,The failed policies of Obama &amp; Hagan have weakened America at home &amp; abroad. We need new leadership in DC. #ncsen #ncpol,ThomTillis,Thom Tillis,North Carolina,Republican
659,Tue Aug 26 13:44:08 +0000 2014,5.04263E+17,5,41,More election-year rhetoric from Kay Hagan today won’t erase her failures over the last six years. #ncsen #ncpol,ThomTillis,Thom Tillis,North Carolina,Republican
660,Sat Aug 23 20:27:58 +0000 2014,5.03277E+17,9,58,Election-year rhetoric won't change six years of supporting Obama’s failed priorities. http://t.co/gxLja8yUEe #ncsen #ncpol,ThomTillis,Thom Tillis,North Carolina,Republican
661,Fri Aug 22 14:16:21 +0000 2014,5.02822E+17,10,51,ObamaCare is causing premiums to skyrocket. Kay Hagan would vote for it again. http://t.co/FFXe5mlDHe? #ncsen #ncpol,ThomTillis,Thom Tillis,North Carolina,Republican
662,Thu Aug 21 17:03:01 +0000 2014,5.02501E+17,7,36,"#TBT: In ’08 Hagan promised to secure the border, but went to DC and rubber-stamped Obama’s open border policies. #ncsen #ncpol",ThomTillis,Thom Tillis,North Carolina,Republican
663,Wed Aug 20 23:22:49 +0000 2014,5.02234E+17,7,32,Our new ad highlights how out of touch DC is with working-class America. http://t.co/pNdVBAhN5O #ncpol #ncsen,ThomTillis,Thom Tillis,North Carolina,Republican
664,Tue Aug 19 21:47:17 +0000 2014,5.01848E+17,0,16,.@SusanTillis has been traveling across NC for the @GOP's 14 in '14 Initiative! http://t.co/nK8U2gEf6z #ncsen #ncpol,ThomTillis,Thom Tillis,North Carolina,Republican
665,Tue Aug 19 13:45:38 +0000 2014,5.01727E+17,4,18,Our new TV ad highlights how out of touch DC is with working-class Americans. https://t.co/YJDsf6S0yV #ncsen #ncpol,ThomTillis,Thom Tillis,North Carolina,Republican
666,Mon Aug 18 22:00:11 +0000 2014,5.01489E+17,5,13,Women rally for Tillis in Winston-Salem during today's #14in14 tour. #NCSen http://t.co/k4JUWA9Fgs,ThomTillis,Thom Tillis,North Carolina,Republican
667,Mon Aug 18 18:39:57 +0000 2014,5.01438E+17,1,15,Today's #14in14 women's tour continues in Cornelius with @SharonDay and @susantillis. Thanks for your support! #ncsen http://t.co/XAYnRSVjwC,ThomTillis,Thom Tillis,North Carolina,Republican
668,Mon Aug 18 15:16:54 +0000 2014,5.01387E+17,4,16,Thanks to @SharonDay for joining my wife @susantillis and a great group of women in Charlotte #14in14 #ncsen http://t.co/6LOFV2fz52,ThomTillis,Thom Tillis,North Carolina,Republican
669,Mon Aug 18 12:31:14 +0000 2014,5.01346E+17,8,32,We need more people in DC who had to sweat to earn a living. Watch my new TV ad: https://t.co/QVnIqY0HrE #ncsen #ncpol,ThomTillis,Thom Tillis,North Carolina,Republican
670,Thu Aug 14 23:01:26 +0000 2014,5.00055E+17,3,19,Honored to accept @jefftartenc and @josephmnolan's #ALSIceBucketChallenge https://t.co/QRK7kap0Fm,ThomTillis,Thom Tillis,North Carolina,Republican
671,Thu Aug 14 15:09:45 +0000 2014,4.99936E+17,10,56,Kay Hagan votes with President Obama 95% of the time. It’s not working for NC. http://t.co/tlCu7E91Qw #ncsen #ncpol,ThomTillis,Thom Tillis,North Carolina,Republican
672,Thu Aug 14 12:58:08 +0000 2014,4.99903E+17,5,18,"ICYMI: Obama &amp; Reid hit the panic button, will spend $9 million on more false attacks. http://t.co/1LQMKC9XDY #ncsen #ncpol",ThomTillis,Thom Tillis,North Carolina,Republican
673,Wed Aug 13 18:52:56 +0000 2014,4.9963E+17,3,28,"Obama &amp; Reid are hitting the panic button, launching more false attacks. Help us fight back: https://t.co/zZ1IxmDPYd #ncsen",ThomTillis,Thom Tillis,North Carolina,Republican
674,Mon Aug 11 15:49:04 +0000 2014,4.98859E+17,11,50,We deserve a senator who delivers results for NC — not President Obama. http://t.co/EsIQwen1BV #ncsen #ncpol,ThomTillis,Thom Tillis,North Carolina,Republican
675,Thu Aug 07 19:29:15 +0000 2014,4.97465E+17,9,33,"Ineffective: In six years, Hagan hasn’t sponsored a single bill that became law. http://t.co/ZiT7zvEOTO #ncsen #ncpol",ThomTillis,Thom Tillis,North Carolina,Republican
676,Thu Aug 07 14:27:18 +0000 2014,4.97389E+17,5,25,Kay Hagan’s ’08 campaign rhetoric vs. her failed liberal voting record:  http://t.co/30TkMCGq1q #ncsen #ncpol,ThomTillis,Thom Tillis,North Carolina,Republican
677,Wed Aug 06 14:46:12 +0000 2014,4.97031E+17,6,28,Obama &amp; Hagan have given us $7 trillion in debt over the last six years. http://t.co/0DFbu9ahju #ncsen #ncpol,ThomTillis,Thom Tillis,North Carolina,Republican
678,Mon Aug 04 12:58:53 +0000 2014,4.96279E+17,9,45,Kay Hagan rubber-stamps Obama’s liberal agenda 95% of the time. http://t.co/lAoaA429cM #ncsen #ncpol,ThomTillis,Thom Tillis,North Carolina,Republican
679,Thu Jul 31 21:06:17 +0000 2014,4.94952E+17,7,18,#TBT: Hagan in ’08: “Voting with the President 92% of the time doesn’t work here in NC.” http://t.co/5Aw0Xj6BR9 #ncsen #ncpol,ThomTillis,Thom Tillis,North Carolina,Republican
680,Wed Jul 30 16:30:09 +0000 2014,4.9452E+17,4,30,.@KayHagan is still providing President Obama cover on the IRS scandal. http://t.co/NkAcUAHngD #ncsen #ncpol,ThomTillis,Thom Tillis,North Carolina,Republican
681,Wed Jul 30 01:25:54 +0000 2014,4.94293E+17,3,12,@kayhagan ad on bipartisanship ≠ 95% voting with Obama. What's the word? Fake/Esse quam videri #ncsen http://t.co/kLU1tY9QKw,ThomTillis,Thom Tillis,North Carolina,Republican
682,Tue Jul 29 18:48:25 +0000 2014,4.94193E+17,34,69,Proud to stand with my colleagues &amp; announce the largest teacher pay increase in NC history. #ncga #ncpol http://t.co/KWnxN3aeQz,ThomTillis,Thom Tillis,North Carolina,Republican
683,Tue Jul 29 15:04:24 +0000 2014,4.94136E+17,8,28,Kay Hagan is trying to run away from her failed liberal record. http://t.co/wzBjEPizjs #ncsen #ncpol,ThomTillis,Thom Tillis,North Carolina,Republican
684,Sat Jul 26 22:11:00 +0000 2014,4.93157E+17,25,94,Budget framework agreed upon between House &amp; Senate conferees. Final details expected next week.  #NCGA #NCPOL,ThomTillis,Thom Tillis,North Carolina,Republican
685,Fri Jul 25 12:57:38 +0000 2014,4.92655E+17,23,36,Kay Hagan added $7 trillion to the debt by supporting Obama’s wasteful spending. http://t.co/6zwAX4VvnK #ncsen #ncpol,ThomTillis,Thom Tillis,North Carolina,Republican
686,Thu Jul 24 12:49:37 +0000 2014,4.92291E+17,17,42,I support repealing &amp; replacing ObamaCare. Kay Hagan would vote for it again as is. http://t.co/DMst3ZQkdv #ncsen #ncpol,ThomTillis,Thom Tillis,North Carolina,Republican
687,Tue Jul 22 20:06:34 +0000 2014,4.91676E+17,19,45,Today's court decisions another reminder we need to repeal ObamaCare and replace it w/ market-based solutions. #ncsen #ncpol,ThomTillis,Thom Tillis,North Carolina,Republican
688,Sun Jul 20 17:42:05 +0000 2014,4.90915E+17,2,14,Incredibly saddened to learn of the passing of Rep. Fulghum. He was a friend who will be missed by our entire chamber. #ncga #ncpol,ThomTillis,Thom Tillis,North Carolina,Republican
689,Sun Jul 20 12:14:23 +0000 2014,4.90832E+17,12,27,Cleaning up the coal ash mess left by @kayhagan. Kay's vote allowed MILLIONS of tons dumped on NC. #ncsen http://t.co/MDHOJFozvO,ThomTillis,Thom Tillis,North Carolina,Republican
690,Sat Jul 19 20:08:55 +0000 2014,4.90589E+17,12,16,Had a great time with the @NCGOP today. Big thanks to our hardworking volunteers! #defeathagan #ncpol #ncsen http://t.co/ohZd9ZaM1C,ThomTillis,Thom Tillis,North Carolina,Republican
691,Fri Jul 18 17:53:50 +0000 2014,4.90193E+17,17,23,Another day of silence from @KayHagan on the nation's border crisis. http://t.co/tLqr9m2t3p #ncsen #ncpol,ThomTillis,Thom Tillis,North Carolina,Republican
692,Wed Jul 16 19:52:48 +0000 2014,4.89498E+17,7,19,Fact Check: @KayHagan's record on coal ash. http://t.co/TAITMbzCJm #ncsen #ncpol #ncga,ThomTillis,Thom Tillis,North Carolina,Republican
693,Wed Jul 16 13:40:37 +0000 2014,4.89404E+17,8,39,"After supporting Obama's open border policies, Hagan is now silent on the border crisis. http://t.co/tLqr9m2t3p #ncsen #ncpol",ThomTillis,Thom Tillis,North Carolina,Republican
694,Thu Jul 10 17:19:39 +0000 2014,4.87285E+17,5,26,"Kay Hagan's carbon tax could destroy up to 67,000 N.C. jobs: http://t.co/YKXNOaiDtZ #CarbonTaxKay #ncsen #ncpol",ThomTillis,Thom Tillis,North Carolina,Republican
695,Tue Jul 08 21:22:41 +0000 2014,4.86621E+17,9,15,"Great chat w/ NC Teacher of Year, @JEFordNCTOY today. Truly appreciate this thoughtful educator's commitment to working together. #ncpol",ThomTillis,Thom Tillis,North Carolina,Republican
696,Tue Jul 08 13:58:09 +0000 2014,4.8651E+17,13,29,The 25 reasons why @KayHagan refuses to campaign on #ObamaCare: http://t.co/wqciOKDqQJ #ncsen #ncpol,ThomTillis,Thom Tillis,North Carolina,Republican
697,Sat Jul 05 14:44:44 +0000 2014,4.85434E+17,5,4,"@kayhagan keeps mixin up NC's motto. It is ""To BE rather than to SEEM."" Her friends too...  #ncsen  http://t.co/hk23OZIZmV",ThomTillis,Thom Tillis,North Carolina,Republican
698,Fri Jul 04 23:45:42 +0000 2014,4.85208E+17,6,15,July 4th:  The day that marks the birth of the greatest nation on earth. Proud to be an American. #ncsen,ThomTillis,Thom Tillis,North Carolina,Republican
699,Fri Jul 04 15:40:51 +0000 2014,4.85086E+17,3,24,Happy 4th of July! We are truly blessed to call America home.,ThomTillis,Thom Tillis,North Carolina,Republican
700,Thu Jul 03 19:47:10 +0000 2014,4.84785E+17,2,8,"Just received briefing from @NCEmergency - Arthur remains remains a dangerous storm, First Responders/Nat'l Guard are mission-ready.",ThomTillis,Thom Tillis,North Carolina,Republican
701,Thu Jul 03 04:03:50 +0000 2014,4.84548E+17,2,9,"Coastal residents &amp; visitors, please exercise an abundance of caution as TS Arthur approaches. Follow @NCEmergency for the latest updates.",ThomTillis,Thom Tillis,North Carolina,Republican
702,Tue Jul 01 19:55:40 +0000 2014,4.84063E+17,3,6,"#1N1T RT @NCGOP: Let's go, @ussoccer! #IBelieveThatWeWillWin http://t.co/TmTJRDdmfc",ThomTillis,Thom Tillis,North Carolina,Republican
703,Tue Jul 01 17:04:58 +0000 2014,4.8402E+17,6,19,It's time for a special prosecutor to investigate the IRS scandal. http://t.co/zgR1dTd4mk #ncsen #ncpol,ThomTillis,Thom Tillis,North Carolina,Republican
704,Mon Jun 30 16:12:51 +0000 2014,4.83644E+17,27,38,"Today’s SCOTUS rulings were a win for our 1st Amendment freedoms, a loss for Hagan, Obama, &amp; DC bureaucrats. #ncpol #ncsen",ThomTillis,Thom Tillis,North Carolina,Republican
